Sentence,Tagged_Sentence
Bukan ngam2 buku lali,_
So kene tgk size chart betul2,_
Untuk 3thn agak longgar lg,_
Ni guna untuk aku sorang ja lah sambil masak,_
"But I think they liked it because of its originality and because it was really evocative of Carrie's personality, she said",_
Sudah terima barang dgn CPT tapi parcel ada kesan koyakan,_
AW saya kini terlindung,_
"Kali kedua beli dengan seller btw jemput follow shop saya, ada giftbox murah2 and comel2🥰",_
"ingatkan berkualiti tinggi, tpi boleh2 lah dengan harga tu",_
Cheap🥰🥰🥰,_
Kasutnya ya ampun cantik sngatt,_
terbaik barang smpai dlm keadaan baik good,_
mencukupi boss,_
"The bulbs, while they stuck in brightness, the color is excellent and very prototypical",_
"Its amazing how time flies, I remember watching your skits and then tech videos as a 10 years old kid, and now still as a 23 year old adult",_
xlame tggu,_
"Well, they say it's not the software problem but it's lagging like this every time I use didn't get refund or anything exchange tbh disappointed",_
Memang tak pernah mengecewakan,_
now that buyer can't select the courier company at least listen to buyers when we say we dont want j&t courier company,_
walaupon korang tk minat wrna kuning but dun worry okay this dress memg sgt cntik,_
Cantik gilerrer,_
Barang memang terbaikk,_
not packing in box hope no got pecah🤭but thanks for free gift anda best,_
Senang je nak pasang walaupun awal² tu jenuh jgk nk paham,_
Saya sangat-sangat suka kan nya,_
"The clusters are the Kuching engineering cluster, which involved eight cases",_
Esoknya pulak dia hantar dekat rumah lain,_
Xtaw la ori ke x,_
"Orang pompuan beli banyak papan,1,2 bulan beli lagi tak tau lh pegi mana",_
"Trusted seller, penghantaran cepat dlm masa 3 hari dh sampai",_
dan shipping laju jaa,_
chemical terbaik,_
Justice Suraya further said it was trite that the power of the Public Prosecutor to charge any person can be exercised by him at any time,_
Penghantaran pn cpat sgt,_
beli ingatkn untuk pakai umur stahun nanti tapi boleh pakai sekarang,_
"Workers, hawkers and shop owners in Teluk Cempedak will be required to show their employee cards or confirmation letters from their employers at the entrance, he said in a statement yesterday",_
Kain sedap tk nipis,_
Tutu dia lembut!,_
Aku udah bang,_
"tp kenapa naikkan arga,",_
selesa sangat seluar ni,_
will review back if anything problem,_
"This shirt is soo nicekain lembut, tidak panas, got spare butang lg from seller",_
baju daa laa koyak,_
terima kasih ggmu Cr7,_
good and comfortable shoes,_
Here's my Twitter ID:- $MENTION$,_
9 received on 13,_
5 per loaf,_
I love the way it was packed and the delivery was fast,_
I super duper lovee ittt worth the moneyyy,_
Functionality:Good product good quality good service thankyou seller,_
"Cantikkkkk🥵🥵 dia cam tak kecik sangat, tak besar sangat, mmg ngam lah, banyak compartment untuk card, nak letak duit pun okay je klau ad cash, no worries RECOMMENDED SANGAT2 !",_
still 2gether,_
"Howeever, when received, there is a big hole on plastic, luckily no harm inside",_
Beli 3 free 2,_
kaca pn slamat j smpai,_
Yg penting selesa pakai lama,_
gambar cun n clear,_
cme lmbt jlah kli nie,_
Saya chat dengan seller,_
Beg cantik sngt buat ootd nmpk exclusive gitu,_
Another loss I guess but am not giving up easy $MENTION$,_
There are no two ways about it as a divided political front will lead to a divided Malaysia,_
Ape pon bergantung pada cara kita disipinan diri ngn pemakanan dan gaya hidup yang sihat,_
Kain selesa dan tak jarang,_
Patot beli lg besar wattage dia kalau nk terang cam kt rumah,_
Packaging baik Sizing baik Material baik overall baik baik,_
It is easy and usefull,_
Patut nya kena buat lg labuh Kalo smpi utk 12taun,_
Taste:havent try it out yet,_
Ridiculous delivery fees now,_
Fast shipping and thanks for the gift,_
"kain tebal, lawa, nampak estetik, andddd sesuai utk ootd 🤭🤭",_
"soo niceee tebal pon tebal, kain dalam dia pon xpendek sangat",_
Yg size L tapi lemak banyak akan ketat bila pakai,_
And untuk colour agak disappointed jugak,_
Barang Padu Semua Cun Laju Shipping,_
"(COP15), which was supposed to be held in April and May in the southwestern city of Kunming, was likely to be delayed",_
Seller no reply,_
Give this a shot been meaning to give OnePlus a shot,_
"material is nice tak panas, ‍‍‍‍ fast delivery",_
bleh pakai buat tido mlm,_
harga pun berbaloi puas hati sangat beli,_
O Allah,_
laju jer buat krj,_
- the heels is very thin,_
THANKS SELLER nk repeat lagi next time!,_
Neat and nice workmanship,_
Bagi penggiat seni mereka tahu bagaimana karya Osman,_
Sangat cantik & berpuas hati,_
semua barang sampai dgn elok,_
"Chile will begin offering a fourth shot of the coronavirus vaccine next week to immunocompromised citizens, the government said on Thursday, the first country in Latin America and one of the first in the world to offer the extra dose",_
Baik cantik ok,_
All very cute n nice,_
Kain mcm keras sikit ala2 cotton,_
"Skin Suitability:rasa pedih bila mula letak tu, Xthu kenapa🤷‍",_
Recived love sangat dengan tudung kedai ni,_
"Abang kata ok , so semua ok lah",_
nama je poslaju tp xlaju pun,_
Harga murah drpd market,_
tanpa ada yg bocor,_
dd dd e ccdeceecev e ex e v eeeccd,_
Federal prosecutors presented evidence to depict Holmes as a charlatan obsessed with fame and fortune,_
Not bad laa okayla tapi singkat untuk tinggi 160 keatas n pakai dengan skirt cantikla,_
"Late on Sunday, the Tesla Inc",_
Terbaik lah shoppe,_
"No leak, well packed thank you, will update taste later",_
"Seluar hitam tu, lagi kecil utk 4tahun",_
Fast delivery good iteam,_
hrp brfungsi dgn baik & ank2 suka,_
Anyway product looks fresh from inside the packing,_
great card sleeve protector for my collection nice and fit,_
Order received within 24h,_
bagus elok sekian bubye,_
Absorption:tiada masalah,_
"Kecik sgttt lg 1, topi nye kotor siket tp xralat sgt la sbb harga nye singget lebih je 🤭",_
Bajdhfhnfnfkkfktkfnnfj cabtik jajajadjjdjdjdkkdkdkdkkdkdkdkkdkdkdkdkkdkdmdmfmmddjxjdjdjkdkdkdkf,_
"CHAT SELLER LA LANGSUNG TAK BALAS,",_
Ok selamat sampai terbaik barang cantik,_
"Johnson's government has declined to say how much it contributed or what guarantees it made to secure the investment, but local sources put it at around 100 million pounds, helped by the approval of a new motorway linking the port of Sunderland to Nissan",_
jnuh nak pulangkan,_
Jurulatih,_
700310,_
Masakan jadi sedap bila guna Perencah ni Takpayah nak tambah 2 perasa lain lagi,_
bole repeat order lg tqq,_
Harap bertahan lama la raket ni,_
Berbaloi tq seler,_
Alhamdulillah saya beli ya🤗,_
Beli 1 dulu utk try dengan anak sesuai ka x,_
mmg sye akn reaped oder lagi lps ni !,_
RECOMMENDED PRODUCTS ALSO!,_
"barang dah sampai , barang dibalut dengan baik , semua sedap fast delivery saya suka anak suka bapak anak suka suami suka good job",_
Remember not to store important files in cloud,_
"Fourth parcel is for me, delivery less than one month for this time packaging and wrapping is superb price is cheap during annual sales some sphere/tower have minor defect but overall is acceptable waiting for fifth parcel now",_
Baju cantik sangat & kain sangat berkualiti,_
"Nice, sangat membantu",_
Alhamdulillah oat sampai dengan selamat,_
"Ambik saiz dh ngam dekat badan tinggi pun ngam2 cumanya ketat bahagian dada, sya ambik saiz m smua ngam ngn tinggi sya 150 berat 65 cuma tu la ketat bahagian dada",_
Completed 11th June,_
CQ Roll Call/Tribune News Service,_
nasib barang x hilang,_
Bungkusan yang dikirim telah saya terima dalam keadaan baik dan terima kasih,_
received on the October 29,_
terang mmg terang,_
But received without FOC,_
Memang laju la delivery,_
Sya masih di kampung,_
"This time difference packing, very fast service and delivery",_
I ambil warna blue yellow (ala ala ikea) & white brown (aesthetic gituu),_
Firma Singapura beli 51 peratus kepentingan Sportsland,_
tak bersih,_
"NFT refers to non-fungible token, a sort of digital asset that can be anything from images to music and text",_
Material:sangat nipis tapi selesa,_
Menegangkan payudara,_
tak dapat harga macam ni kalau di luar,_
It's pretty but dia macam tak masuk elok,_
Overall layout and interface in so messy and confusing,_
ikut la ukuran dia bg tu,_
parcel ni lak wrapping terbaik,_
so far mask ni okay je kualiti pun okay,_
"Work as described, recommended seller",_
Fake medicine sold in the app,_
Dia bagi manual tapi mudah je nak pasang takyah tengok pun tau dah,_
"With this in mind, when in doubt, a little fact checking goes a long way",_
"Wow lama yang tunggu ini, it's ok items so nice good quality, thank you sellers for selling",_
tp seluar besar sngt plk,_
"Gambar takde kaitan, tapi mmg dah biasa beli",_
Respect to the rider who r willing to delivery food to the people during military coup under the difficult situation,_
"Fast delivery, good product, just wish can be longer the extension",_
Software easy to install and there is a guideline too,_
tp dpt warna lain,_
"Everything okay, baru nak try, sebabtu beli yang size kecil dulu",_
",🥰🥳,",_
Yy best super cepat hantar,_
Fast delivery and product packed in proper way,_
result belum thu,_
jln2 mlm pon ok,_
"They include around 200 minors, most of them unaccompanied, a Sea Watch spokesperson said",_
"Good quality+fast delivery , loveee it so muchhh!",_
for me okey lah,_
"But anyway, wore it once and got a compliment for it",_
packaging yg perfect,_
seller pun baik dlm live ramahksut cantik2 tp satu je saya ada minta return kasut untuk tukar sbb kulit kasut dh nak terkupas seller xreplyhrap lepasni reply ya respond kalau xbole tukar bgthu je sbb sy tunggu lama seller nk balas,_
Terbaik la boss dengan harga yang memang kena dengan kasut ni dan semuanya dalam keadaan baik dan terkawal hehehe thank seller,_
kain lembut je mmng sesuai untuk babu yg baru lahir,_
Tp kena peram dgn jnt,_
Kain sejuk barang pun nice,_
"Mmg sedap,cepat memasak",_
Baca review suruh ambik size kecik dari biasa,_
Dapat dlm keadaan baik takde ape maslah mcm pecah ke calar ke,_
Seronok sebab fast delivery,_
giveaway in your phone,_
"Item sampai dengan selamat,",_
">Oleh itu, penting untuk ibu bapa memenuhi keperluan harian dalam masa sama melindungi anak-anak",_
saya suka tq seller n abam dhl,_
labuh pun ok paras buku lali,_
Very very like this brand tea,_
terbaik dah byk kali repeat order tq boss,_
What best affordable laptop that can be for work (still related to photo editing plus all it&$HASHTAG$,_
"Barang sampai dgn baik dan sgt berpuas hati, seller pos brg pun laju, courier pun laju, recommended",_
ni dapat plastik bodo jer,_
Dapat download semua,_
Nati repeat lagiiiii,_
skirt singkat,_
I would rather buy a new one (of course not from this Seller again) instead of using the same item,_
cantik ngam ngn anak,_
Lampu mmg okay sangat,_
Recommended to buy and wear,_
Activate win 10 Pro thou,_
"i have a question that nobody have ever ask in any video, does the iphone 12 pro max cases fit on the 13pro max?",_
boleh makan dengan nasi kerabu,_
"Terima kasih daun keladi, pasni beli lagi",_
packaging pakai bubble,_
Seller pun respon dgn baik,_
Jam sangat baik,_
Dah terima toy's thanks seller,_
btw i felt a little dizzy after wearing this spec,_
complete yg di order walaupun barang kecil2,_
"Jam sampai semuanya ok tiada yg rosak, siap dgn beg kertas casio sekali",_
packaging dan lebelling Al Quran juga ada,_
"I think its okay, no complaints by the father",_
"Beg lawo ,tk besar sangat boleh laa 2 3 Malam jee bolehh lahh",_
harga x kayangan sgt,_
"First time trying this product, hope it works for my face",_
Ngam2 je pakai,_
Mantap jam tangan yang bagus,_
Good product comfortable to wear,_
Thank you seller! Boleh repeat items lain pula lepas ni,_
There's no option to let me subscribe & download the email invoice statement and I don't know how to check bill status (digi business),_
handphone semua dalam keadaan baik,_
barang adalah fake please jgn beli d sini,_
"Rasa berkobar-kobar dan bersemangat untuk beraksi, namun berdebar untuk ke negara sedang bergolak",_
Ordered-9hb,_
"Dh smpai, cepat jugak lah penghantaran wlaupom jauh",_
Size ja masalah tapi kain dia oky,_
"The stronger USD price action this morning has eased with the renminbi strengthening again, said Alvin Tan, Head of Asia FX Strategy at RBC Capital Markets",_
Kenapa belah ujung potongan tidak cantik(berbulu),_
cntik tasbihnya,_
"Fit Ngamm mmg merecikkkkk ,",_
Dapat free belt lagi,_
bnyak kali da repeat tq seller,_
dalam 3 4 hari sampaii,_
Kne ngn hrga,_
thanks for the fast delivery process,_
"Best gilaaaaaaaaaa beli acc chegg ni, dpt answers sangat pantas, tpi kena download discord yeee",_
"Lps 2 hari bru hantar keluar,kesian anak2 menunggu",_
"sy beli ya,",_
Didnt use them yet cause its a gift during gift exchanging during our farewell next week,_
Good value for money well packaging,_
So no need to go to saloon frequently 🤣,_
"Brg sudah sampai, walaupon agak lambat, ambil masa lama",_
I love the colorful thread options,_
klau gi jalan2 x susah dh nk suruh org ambilkan gmbar,_
Parcel safely arrived bought it at cheap price will repeat order soon,_
"sesuai pakai as inner je sebab kain dia kalau kena tiup angin mmg lekat kat badan, walaupun kain dia longgar tak ketat pun",_
"bought many times from this seller, thank you so much for the gifts",_
"Seluar memang cantik, size ngam ngam and jenis loose and baggy",_
gambar Dan video tiada kaitan ye,_
Barang diterima dengan baik Jahitan kemas terbaik seller boleh beli lagi ni,_
Apa² pun dh try so far ok je membuang 2x sehari,_
oder 4-5day safely arrived,_
Belanda masih mendahului Kumpulan G tetapi hanya dua mata di depan Turki yang meledak enam gol mengatasi Gibraltar,_
BRG semua ok,_
"Digi is a liar,",_
but medium,_
Effectiveness:Suitable for children/primary school,_
tapi kukuh !,_
I just look at them and feel they are too exposed!,_
direct competition&$HASHTAG$,_
Thank you for the patient to get me thru step by step,_
boleh lah buat ganti2 di rumah,_
"Yes, it is, but my symptoms were so atypical that even the doctors were gobsmacked at the initial stage",_
"melakukan kesalahan terbabit seperti yang dipaparkan melalui pautan tular dalam media sosial, katanya dalam satu kenyataan, hari ini",_
"baju dah sampaii🥰🥰🥰second time beli, good",_
Repeat lg kali brp xtau,_
"Because of the accessories, it make my bag very stable on the trolley",_
Fits the face,_
Finally just received thank you seller product have been in transit place very long time but its ok i received all items perfectly,_
Terbaikkk aa dhdhddhdhdhdhdhdhdhdhdhdhdhdhdhdhdhdhdhdhdhh,_
The box got dented a bit but no damage to the mouse,_
"Okay, thank you seller",_
"63 Li Shifeng, who shone at the Thomas Cup Finals in Denmark, blew away Timothy Lam of the United States 21-6, 21-10",_
", can keep warm , price okay",_
so kalau nk yg cantik sikit beli yg mahal sikit kut hehe,_
"Overall barang semua ok, cuma delivery je slow",_
"good quality, and length just nice for my height",_
gambar takde kena mengena tapi nak ckp baju tu ngam sangat dgn badan,_
skirt bundle tapi kondisi letop!,_
Mak yg sihat sebelum ni tapi le,_
I have attached my resume for your review and I look forward to hearing from you soon about the position and thats what should be doing for bad so i finally got my action to personally,_
tq dapat gift macam ini memang puas hati ba🥰🥰🥰🥰🥰🥰 sangat rekomen dengan seller ini,_
"This has created a lot of curiosity among those from outside Penang, he said",_
post Iklan Di Grup_ *WhatsApp & Telegram* _Setiap Masa Dgn Mudah_,_
Tapi rasa belum tahu lagi nanti saya edit review,_
Quality:nice and excellent love it so much gonna repeat,_
puas hati nanti sy repeat lagi okayy InshaAllah,_
My baby will look cute wearing this hehe,_
Microsd dh selamat dlm fon br snal gmba hee,_
Biskut telah selamat diterima dalam keadaan baik,_
barang smpai agak lmbat,_
m gonna try my luck here 🥺 hope I can get my hands upon one of those beauties Subi_bp05 is my twitter handle,_
Shoes so comfortable,_
Overall it was even better than expected,_
"From now till Feb 15, share your photos/video with the interactive lion dance AR filters on Instagram, hashtag $HASHTAG$ and tag any of its seven malls ($MENTION$ Plaza, $MENTION$ Mall, $MENTION$ Coast Mall, $MENTION$ Mines Shopping Mall, $MENTION$ Damansara, $MENTION$",_
wow ow wow wow ow wow wow ow wowwow ow wowwow ow wowwow ow wowwow ow wow,_
Packaging so good,_
Caps dah sampai,_
"Globally, Teo expects economic recovery to be patchy and uneven as uncertainties surrounding Covid-19 continues to linger in 2022",_
"Order received and the quality is quite good and fast delivery too,",_
Skru tayar,_
"The other end can't delete at all,",_
Delivery man service is great,_
Penghantaran memang laju sealant order hari ini sudah dapat Tapi baju x seperti dlm gambar,_
9 huhuhu kecewa juga,_
Penghantar an laju sangat2,_
"However, supporting the market was the U",_
dlm tempoh 3 4 hari ja,_
Apapun tq boleh repeat lagi,_
Tapi cantik jgk la color dia,_
"Alhamdulillah barang selamat sampai,memang terbaik",_
"Tapi boleh la beli sini, ada cashback ada free shipping",_
"Few times order from the seller, but getting bad and bad delivery service",_
LG Display said its shipments of advanced organic light-emitting diode (OLED) panels jumped more than 70 in 2021 and the display maker reached break-even in its OLED business,_
tak try lagi kuat ke edak,_
Smoga trus sukses dlm brniaga,_
Tpi x sure la brand H&M beno²,_
Safely arrrived,_
Giler Seller hantr,_
The situation was made worse during the MCO period as people lost their businesses and jobs,_
UAE's Ministry of Health and Prevention said in a statement the new cases of many nationalities are all in a stable condition and receiving medical treatment,_
"Agak nipis laa but overall goodd, cuma penghantaran lambat, almost 2 weeks",_
alhamdulillah dapat lock saiz yg ngam ngam,_
The strip is not good quality,_
Kualiti barang berpatutan dengan harga yang ditawarkan,_
"Quality:bagus,sedap",_
"Just nice, tak bukak lagi",_
A very good product and the stickers are cute!,_
Use my code CMK5JHDKUA to sign up for BigPay and get RM20 when you activate your card,_
Beli guys tak menyesal punya,_
Took very long to deliver but I like the material,_
Good good luck bro,_
cuma bahagian metal dia dah nampak lusuh n ingatkan ada 2 compartment rupanya eksen jer,_
Thank you soooo muchhhhh,_
layanan penjual sangat bagus kualiti produk pon ok,_
"alhamdulillah parcel sampai dalam keadaan yg baik,sngat cepat sampai harga berpatutan,very recomended",_
14/9 oder 15/9 brg dh sampai,_
beli hadiah utk gift exchange utk colleague,_
teruskan khidmat yg trbaik,_
susahlah nak beli kalau camni,_
kalau beli warna putih kena pakai lengan panjang belah dalam,_
"Tp, kat kampung",_
Habis ni blh beli lg,_
Pei Ping Happy Birthday!,_
Got free gift sanitizer n ruler,_
elok la beli jam ni,_
"Taktau nak komen apa lagi tentang produk ni, sebab ini hadiah untuk orang lain",_
Warna pon sampai betul dgn betul,_
delivery time sangat pantas dan packaging sgt padu dan kemas,_
Nice gler,_
Tinggi 170cm berat 73kg,_
Itne time bad ujwal bhai pubg khel rahe hai,_
"im using mi 10 t pro,I charge 40 and it only uses 9 in the powerbank",_
Wish it was a compact phone 5,_
Hahahshajajajajajsjajakakajajajsjsnsnanmsmamamamamakamajwkwkwkwkekw,_
penghantaran cepat semua bagus baju ok lawa muat muat berat saya enam puluh kilogram jadi semua okay cantik okay bai maaf baju n video takde mengena hanya mau collect coin ajer okay bai terima kasih sama sama okay bai okay bai bai bai bai bai,_
"tak cakap banyak baju mmg cantek,",_
"Dalam bag pun okay, tak besar sangat and tak kecik sangat",_
I love this sunstone so much,_
tunggu dekat sejam tiba2 cancel,_
"The packing is neat, safe",_
the machine that I am buying had arive at my door step succesfully,_
cuma bungkusan tidak memuaskann,_
nanti Kita cuba,_
I'm not struggle for my food because food panda is always there,_
But the Boeing jet has been delayed until late that year at least following a lengthier process of regulatory approval amid intensified scrutiny in the wake of the grounding of the firm's 737 Max model following two fatal crashes,_
Nanti boleh repeat order lagikkk🥰,_
"Thankyouuuu, love this",_
ngam2 soyy,_
Baju pun senang di iron,_
Terima kasih giftnya baju,_
boleh laa nanti nak repeat lagi sekali Dan lagi sekali Dan lagi sekali,_
Safety:kukuh,_
delivery was a bit late coz it's from china,_
Material:kulit laici ringan,_
Seller mantap sporting lepastu fast reply dengan trusterd tak sampai setengah jam order dah dpt acc,_
Safety:tebal,_
terbaikkkkkkkkkkkkkkkkkkkkkkkkkkkkkkkk,_
blh repeat lg lps ni tp klau blh nk courier jnt,_
Formulation:ok dah buka bau wangi,_
"Sbb dpt dlm 96 sen je,hehehehehehe",_
already received the item the socks material is kinda ok not that bad,_
Prompt and safe,_
Kain lembut warna cantik,_
guna ni kdg2 kena sabar,_
loud sound when pump,_
kecil dan mudah dibawa dlm handbag,_
2nd time using AF ni tapi temperature tu memang hijau masa first on AF dan lepas berapa saat akan Off?,_
Beg² murah tp cun,_
"Skirt tu agak panjang tapi boleh lipat,senang nak pakai",_
"President Xi Jinping and Russian President Vladimir Putin pledged on Friday to further boost bilateral cooperation in the fields of energy, finance, science and technology, and the mutual connectivity of transportation infrastructure to deliver more benefits to the two peoples",_
Item was well protected,_
Pintu sudah selamat diterima,_
Plastik bungkus comel,_
1st time nak try pampers dr seller nih,_
The toy car is amazing!,_
tak rasa belimbing,_
so ok boleh order untuk anak,_
Bila try pakai td gigi rasa bersih ja,_
Very responsive when it comes to feedbacks,_
sesuai dengan muslimah yang ingin menutup aurat,_
Worth buying: Yes,_
Sesuai untuk adik saya,_
Tq seller barang sampai dgn baik pembungkusan yang kemas tq free gift,_
wangi j bau,_
Cuma kainnya agak nipis sikit,_
"kualiti produk baik , harga baik , penghantaran yang pantas",_
Tp utk pakai xde masaalah sgt,_
"Pampers selesa dipakai, kualiti bagus, penghantaran cepat",_
Fare has increased,_
harga pun berbaloi murahhh,_
Kualiti dan kuantiti cawan sangat baik,_
W🤤🤤,_
Nice tasbih,_
"Alhamdulillah barang dah sampai dng cepat Setokin pun cantik, murah dan cantik",_
Wil repeat again to buy another item,_
AKN REPEAT ORDER LAGI !,_
Cukup 4 keping tq seller,_
05/06/2022,_
ngam2 jer dgn ank,_
"All in good shape, good deal from the seller too, thank you very much",_
Also it clipped the phone well,_
Repeat order murah tpi silap beli satu je adoii,_
pakai braces memang kena guna yee berus gigi ni,_
Penghantaran sangat cepat 🤩,_
understanding of,_
mgkn saiz m ok,_
sorry tkde kena mengenaa,_
Tak cepat bocor and line kuning kat pampers jadi line biru bila dia kencing or berak,_
item arrived as described and fast delivery as well,_
harga murah and berbaloi 🤘saja amik satu saiz besar 🥳,_
Ngam dan padu service yg diberikan seller,_
Good quality fast delivery reasonable price with good products,_
btw tq free gift extension mask n bag cntik sbb wrna putih tue semua style boley pakai,_
Kali ni beli 2 biji terus,_
She said some puppies were sent to them by feeders from various locations around the city,_
Quality is OK and the price is good,_
Good product quality and good product,_
It is the tracking system,_
"Inai ni bkn jenis berselaput,merekah",_
Mnum sikit esok tu terus membuang,_
Sampai sudah puas hati ngam sangat dengan badan saya,_
tinggi 154 berat 50 sesuai sangag cuma seluar labuh je sebab pendek tapi pinggang just nice!,_
"Good product quality, nice design",_
Will buy another size that fit me,_
"Ciotti ultimately lost out to the more moderate head of the greater Paris region, Valerie Pecresse, in a run-off vote on Saturday",_
"Menurut kenyataan itu, kerajaan sudah memperuntukkan RM30 juta melalui geran padanan dalam Bajet 2021 bagi menyokong aktiviti MARCOP manakala pihak industri menyumbang RM30 juta melalui kutipan ses Lembaga Minyak Sawit Malaysia (MPOB) dan ia digunakan bagi tujuan penyelidikan dan pengkomersilan teknologi mekanisasi ladang",_
Quality:🤲🤲🤲,_
"Memang terbaik, packaging cantik, penghantaran pun laju",_
ELF happy,_
Seller shipped the item pretty,_
Received parcel in good condition nice jersi quality ok,_
lepas nie boleh baiki pembungkusan lagi okayyy,_
Kain cotton mahal tp harha murah dah lah lembut,_
Tho packing not original,_
Tidak dinafikan perniagaan mempunyai tanggungjawab besar dalam menghadapi cabaran dan menyesuaikan diri dengan persekitaran baharu,_
Jaga diri patuhi SOP,_
Its such a hassle that i need to relogin everytime I use a different phone,_
Dah berapa kali repeat order kat BZEBI ni love all of their necklaces!,_
"Pada masa sama, kami ingin mempersoalkan peranan Menteri Kesihatan, Khairy Jamaluddin dan pengurusan tertinggi Kementerian Kesihatan (KKM) dalam perkara ini, katanya",_
Boleh beli lgi lain kli,_
"tp barang sampi dlm keadaan baik, pembungkusan jg kemas Kali ke 2 beli dgn seller ni",_
"Cantik sgt jam ni, warna pun cantik Tali pun cantik nanti Kita repeat lagi leaps ni design lain",_
Super long delivery even though it's local 🤦‍🤦‍🤦‍🤦‍🤦‍🤦‍🤦‍🤦‍🤦‍🤦‍,_
🤤🤗,_
seller kena tukar courier lain,_
"Is the defination of Poached Egg different in China compared to the whole world, I don&$HASHTAG$",_
35 and RM395,_
fast delivery cantik sangat takde defect ke apa cantik sangat sangat,_
pakacging pon lawa,_
"Received in good condition, thanks sellers",_
Mereka itu semuanya,_
wak hiasan ala kador jer,_
my suggestion for the seller is to check the expiry date first and whether its in good condition or not,_
government contracts,_
Seneng bngt pake apk grab,_
One piece at the back is nice,_
Very light and also runs small size,_
harap boleh psg kat cctv mi,_
Terry GO,_
Beli tuk anak2 bujang,_
lju untuk ip11,_
"From Penang to Selangor, Klang",_
