Sentence,Tagged_Sentence
Barang smpai ii xbole gune bodo pnye penjual byr elok ii bgi yang rosak,_
Effectiveness:besttt nanti share feedback,_
mmg kain dia cun melecun,_
So far okay sebab kali pertama pkai buai elektrik ni,_
Kualiti!,_
"I have dealt with many customer service of multiple apps whenever I have a problem in the app, but never faced procrastination like in this one, if you get a problem you simply delete the app cause it won't be solved",_
"Soryy baru nak menilai,saya suka sangat2",_
hanya beza pd pnjg tgn je,_
os shapee mall,_
sbb not waterproof,_
Cepat btul smpai nye,_
Tlg ringankan kesedihan mangsa,_
Received in good conditions with well boxes,_
Sho lawa and item cukup thankyou seller semua di permodahkan urusan,_
Harga tu ada murah skit dari kedai lain,_
Alll beautiful,_
5 star pnya seller ni,_
Tapi kene jga elok² once dah pakai kasut ni,_
Safety:cantik & baby tidur pun selesa,_
Kalau ada warna Black lg saya suka,_
"Jahitan beg agak tak kemas, benang berbulu zip jahit senget, ada kotor sikit kat tali beg",_
x reti beza,_
Recommend Recommend Recommend Recommend Recommend Recommend Recommend Recommend Recommend Recommend,_
"I love the shirt, recommended",_
Lain kali mau repit,_
I suggest you buy this product,_
Every cyclist should have it,_
Cepat bertull hehe sbbtu sy suka rpeat dgn kdai ni,_
Mmmmmmmmmm mmmmmmmmmm mmmmmmmmmm mmmmmmmmmm mmmmmmmmmm mmmmmmmmmm,_
Yang paling seronok barang sangat cepat sampai just dlm tempoh 2 hari sudah terima,_
pasti akan repeat lagiii,_
Free one candy,_
Sampai kena cucuk lubang dekat yg isi angin bahagian bawah tu,_
sona-09,_
"Apple had been planning to make this a reality for iPhone users, but was then forced to put this iOS innovation on hold after protests from advertisers",_
Tp saiz cutting kecik,_
strong army grape,_
"Favourite dulu Jjajang, skrg buldak corn nih",_
"Aplikasi nya bagus Sangat membantu,",_
Barang sampai dengan selamat dan tiada kerosakkan apa apa,_
Phantaran cepat!,_
okay sgt zikir plug in ni i used sepanjang mlm then cek pagi ni tak pns pun,_
"Unlike many Americans leaving their jobs, JPMorgan's senior executives had positions lined up at rival powerhouses like Bank of America Corp, Citigroup Inc and Millennium Management",_
Cinnamon roi tea & chamomile tea slightly bitter,_
?Suh a dishonest seller,_
Quality:quality was ok I bought it for my brothers birthday,_
Barang cantik penghantaran pon laju tapi tali dia kurang panjang,_
"Very fast delivery,order on 17th, 18th public holiday, arrive on 19th",_
"MELAKA: Satu langkah berani, proaktif dan tepat pada masanya",_
Plz include it,_
Yg paling Best packing memang terbaik,_
oky fodd,_
recommended seller ni sebab puas hati sangat,_
pantas dn cpat je smpai even dinsrwk,_
minyak ad leaking skit,_
this shop hantar laju,_
order 25hb sampai 26hb,_
Design menarik dan kain keras,_
Seller os dengan cepat,_
"Mayor Datuk Yew Tung Seang said there were 375 unlicensed hawkers, which accounted for 12",_
Main pubg xde lag,_
07 malam,_
Tq seller sangat laju tip top meletop,_
Cantik sangat beg n the condition was really like new,_
Astu beli balik astu harap tk hilang lg,_
barang pon cepat dapat,_
Sampai hari kedua lepas order,_
"Another 24-year-old Lao youth from Xieng Khuang province on central Laos' plateau, Somboun Tualavong, told Xinhua that he wanted to work in the railway for life since it is a great opportunity",_
"Bagi pengendali JDT, Benjamin Mora aksi menentang skuad bimbingan P Maniam itu penting bagi mengekalkan momentum kemenangan selepas melakukannya pada empat aksi lalu untuk kekal di tangga teratas kumpulan",_
"Bestmurah,xdpt kt tmpt lain",_
sbb oder time shocking sale kan,_
Got leaking on eye&lip mask but overall is ok,_
90 satu pek,_
"Thanks also to the seller who gave me a free gift of haruto, yoshi and calendar",_
Bole la nak kurengkan cholestrol jaerrr pon,_
"Alhamdulillah la barang sampai dengan cepat, tapi tengok tak macam 6 layer langsung, skali anak kencing pun dah penuh ni oi",_
"comfortable,soft n quality",_
Keyboard ringan dan nipis,_
3m feels cheap,_
yg lain oke,_
Dh sampai oneset,_
Very good quality materials and the prices is good too,_
"ngamsoi, slipar raya",_
"MANILA (Philippine Daily Inquirer/ANN): President Rodrigo Duterte sees Manila Mayor Isko Moreno as a threat to a Duterte Dynasty by 2022, the Makabayan bloc in the House of Representatives said Wednesday (Aug 11)",_
All I can say is super super comfy 🤙🤙🤙,_
$HASHTAG$ selesa pakai,_
Lagi dan lagi beli dgn diooo,_
dah 2x repeat beli dekat seller ni,_
"Speed delivery,Good product quality,Good seller,will purchase again,thank you",_
"barang sampai dgn baikk,penghantaran pun pantas smlm order harini sampai",_
Fast shipping and good packaging and good quality products,_
Kena tengok ukuran yg diberi tu betul2,_
Cute cute geram sgt tgok🥰🥰🥰,_
"Very honest and responsive seller, informed me regarding of the expiry date in advance and provided extra pack as well",_
janji kad terpelihara,_
Kualiti mmg padu !,_
"Yeahh baju sdh sampai,puas hati sangat,harga murah,kain pun cantik selesa jak,ni kali ke2 beli dekat sini,bestt brg pun cepat sampai beli masa 11",_
"Sampai masa saya akan dedahkan identiti mereka yang terbabit dalam komplot ini, tegas Sheila",_
Cuma tersalah ukur kot,_
"Presidennya, Datuk Dr Najmil Faiz Mohamad Aris berkata tindakan itu berisiko meletakkan skuad kendalian Nafuzi Zain dalam bahaya sekiranya berlaku penularan COVID-19 dan boleh menerima nasib sama seperti pasukan Negeri Sembilan",_
very cheap and arrived safely,_
Awesome phone and your explanation is very good,_
cuma kotak utk reverse camera tu kemek sikit,_
Quality:ada skru yang tak jadi skru,_
The size is right and the material is quite alright as well,_
Received in good condition ang long expired date,_
Tapi sedih la,_
Item arrived already and packing in a good condition with box and bubble wrapping to prevent any damage,_
Jasvin Love Lulu,_
Material:Plastik dan besi,_
Saiz ngam cuma kalau nk selesa sikit kena ambik 1 saiz besar,_
"His team took anonymised data from more than 40,000 mobile phone users, most of which was information from messaging apps and other interaction data",_
And saller also say he want to give me freegift but no freegift at all still ok,_
good qualityyy sangattttt bolehhh repeatt lagihh,_
Macam kat cameron highland,_
x susah langsunghghhhhhh,_
Ok la tapi kecik,_
Bile guna botol ni,_
2nd!,_
nnt boleh repeat LG tq seller,_
Pantas dan cepat waktu penghantaran,_
Good product of course,_
"Barang sudah sampai ke rumah, nanti pasang la, harap selasa ok je laa iyaa",_
Maybe we have to wait,_
It is fast charging,_
"Senang pasang,hendak place mana pun boleh",_
"Product safely arrived, finally!",_
🤔beg dah siap bgi mandi,_
"tp ok lg la, 3,4 hari je",_
Well packed received in,_
Item delivered within 5 working days,_
warna cantik sangat topi pun nice,_
X pasti samada brg ni preorder/ tidak,_
"Received with good packed in cartoon, wrapped with bubble wrap",_
Took 1 day to ship out and got it one day after,_
terbaikkkkkkk terbaikkkkkkkk,_
"Good value for money,fast delivery,good product quality",_
"Pei Hwa High School principal Chen Yeok Ling said the school in Muar had raised some RM60,000 to date to help needy students with their tuition fees",_
Barang dibalut dan diterima dengan baik,_
Takde gmbr sbb beli as a gift to my fren,_
Print punya quality pun elok,_
"pampers sampai cepat dan dln keadaan baik, da kame gune genki so far ok je tqvm seller",_
bullion & her beautiful boys,_
tapi pendek ye labuh dia,_
"Taste:Good product, my dad's favourite",_
ggood -------------------------,_
bagi tawaran hebat dan penghantaran pantas,_
Kotak nya ada defect,_
satu dh letak dalam tupperware,_
sgt sgt sgt lahh,_
I not like it,_
pos pn laju saja,_
sebab belom guna lg sabun tu,_
Delivered: 5/2/2022,_
tiba2 tuduh orang nak menipu,_
Boleh datang beli lagi 🤩,_
It's not a gun it's a disruptor that disables enemy guns,_
Leakingggg!,_
ok lah blh guna untuk simpan baju anak anak trima kasih terima kasih,_
Hsin JieYeoh Jucy,_
"Setakat ini, 24",_
"MANCHESTER, England (Reuters) - Stuart Broad grabbed his 500th test wicket to set England on their way to a resounding 269 run win over West Indies in the third and final test at Old Trafford on Tuesday",_
"Good seller, good product, affordable, fast delivery, overall okay good",_
"Russia would seek to use its superiority in electronic warfare to paralyse its adversary's command and control and cut off communications with units in the field, he said",_
Sedutan habuk sangat efisyen,_
I totally love it,_
Kain dia memang tebal,_
Quality:Ok baik,_
Super super super thanks to the seller items received in very good condition,_
"This is my 3rd time buying, nice",_
"Arrive safely in good condition, very wide n comfortable",_
Cleaning Effect:baru Cuba guna,_
received in good printing condition,_
TerbaikterbaikterbaikterbaikterbaikTerbaikterbaikterbaikterbaikterbaikTerbaikterbaikterbaikterbaikterbaikTerbaikterbaikterbaikterbaikterbaikTerbaikterbaikterbaikterbaikterbaikTerbaikterbaikterbaikterbaikterbaikTerbaikterbaikterbaikterbaikterbaikTerbaikterbaikterbaikterbaikterbaik,_
Sentimen pasaran secara menyeluruh masih terganggu dan kami menjangkakan ketidaktentuan itu akan kekal dalam persekitaran kenaikan kadar Rizab Persekutuan AS yang akan berlaku,_
-received the product in good condition,_
Jangan sebar berita palsu!,_
Thank you seller n abg yg hantar,_
Selipar dah sampai selesa dipakai lembut sangat dan mudah dibawa,_
nasib muat terima kasih saya beli,_
cuma sempit sikit bila suami try td,_
Hope can work fine for long period of time,_
Baju dh smpai serius mmg cantik,_
Hope it helps hair growth,_
Udah gitu ukuran kecil yang ada di pakean branded,_
Tq saller barang di terima dengan baik,_
It loooks small at first like,_
"Tested, the resolution are clear and smooth",_
Harga murah pmpers berkualiti,_
Barang diterima dalam keadaan baik cuma penghataran lambat sikit sebab pre order walaupun barang Malaysia,_
Nk bg org jer nie,_
dgn tampal nyer lgiii,_
Effectiveness:Barang dlm baik,_
beli ntuk pantang nanti,_
Cuma sizing agak besar dari chart,_
"Nice packing, but 1 item have some flaw, can replace but on next purchase",_
"Selain SK Seberang Ramai, turut menjadi wakil negara bagi menyertai T4 World Education Week tahun ini, ialah dua sekolah menengah masing-masing di Kuala Lumpur dan Perak",_
"As good as before, brought so many time repeated order",_
"Barang okay, terbaik",_
22 23 1510,_
Overall mmg,_
Sapa nak beli boleh laa try hehe,_
dah banyak kali pakai muka xberminyak lansung pastu dia cerah kn skali muka kita yg burn,_
stock ready from Malaysia no need to wait a week to receive the item,_
"baju dah sampai , cantikk dan dapat free 1",_
alhamdulillah brg dah smpaistill xpasang lagi,_
Very fast delivery despite the sale period,_
bebaloi jgaa ngam dgn harga,_
I'm searching back,_
Fast and crush ice like nothing,_
Mengurangkan selera makan,_
Tq tq tq tq tq tq tq tq tq tq tq tq tq tq seller,_
Service really pantas and installation dia mudah je but for me terkial2 sikit sbb dh lama tak install software (read: tak pandai hahahah),_
"44 per cent in the past 24 hours, according to a release from the Ministry of Health on Sunday (Jan 23)",_
Repeat order banyak kali dah!,_
Taste:barang sampai dengan baik harga sangat murahh berbaloi beli dengan seller ni,_
"freee jaa i dapat time sale tapi utk yg nak beli mmg i recommend sgttt ,",_
Blikn tok jiran,_
Kaxoe micro usb charging cables arrived safely,_
🤩🤩🤩🤩🤩🤩🤩🤩🤩🤩🤩🤩🤩🤩🤩🤩🤩🤩🤩🤩🤩🤩🤩🤩🤩🤩🤩🤩🤩🤩🤩🤩🤩🤩🤩🤩🤩🤩🤩🤩🤩🤩🤩🤩🤩🤩🤩🤩🤩🤩🤩🤩🤩🤩🤩🤩🤩🤩🤩🤩🤩🤩🤩🤩🤩🤩🤩🤩🤩🤩🤩🤩🤩🤩🤩🤩🤩🤩🤩🤩🤩🤩🤩🤩🤩🤩🤩🤩🤩🤩🤩🤩🤩🤩🤩🤩🤩🤩🤩🤩🤩🤩🤩🤩🤩🤩🤩🤩🤩🤩🤩🤩🤩🤩🤩🤩🤩🤩🤩🤩🤩🤩🤩🤩🤩🤩🤩🤩🤩🤩🤩🤩🤩🤩,_
11 Next time repeat lagi 🥳 Thankyou seller,_
"Anyway, cheap",_
111111111111111111111111111111111,_
"Super secure packaging, with bubble wrap and many many many many many layers of plastic wrappers, nice promo rm5 and coins, will buy again in future, super cheap Vs to others shop, expired date 2024",_
MATERIAL PREMIUM JACQUARD DOT CEY,_
Kaler cantik n material terbaik,_
jam elok video tidak berkenaan jam elok video tidak berkenaan jam elok video tidak berkenaan ok baiiii,_
ok ok ok ok ok ik okhujhehjeejje,_
Mmg selesa lh pkai,_
He said this when asked if he has received any invitation to join PBM,_
Rupanya panjang pula pedang dia ne,_
kali kedua beli cadar dekat sini,_
Baju ni saya suka,_
Amazing collection and top notch quality of all the products,_
"PHNOM PENH, Sept 17 (Phnom Penh Post/ANN): Cambodia's capital, Phnom Penh, could achieve the highest rate of Covid-19 vaccinations compared to other cities around the world because the government has a clear strategy in vaccine management and distribution, Prime Minister Hun Sen said",_
ni dah kli ke2 bli,_
Bju cntik cuma ad sedikit bahagian poket bawah tak terjahit,_
Sangt puas hati suka sangt anak saya tqqqq seller gift nye,_
Material bestt sangatt lembut jee,_
Receive with good condition and fast delivery Asal aku beli wrna putih ekk Apepon thank you,_
Tengok suami pakai hensem sgt,_
my family love the taste and aroma,_
Alhamdulillah dah sampai kualiti seluar tiptop saya mmang suka sluar ni yg ada tape dkat blakang dia tak mengecut,_
"Package just arrived today, and I have tried",_
terrrrrrbaaaaiiiiiikkkk lahhhhhhhhhj,_
very nicebeli banyak kali🤭🤭🤭,_
Thank you barang sudah sampai dengan selamat barang cantik penghantaran memang cepat good good good good good good good good good good thank you thank you so much,_
"00 iPhone 13, OPPO A54, and more are still waiting to be yours!",_
SAMA MACAM DALAM GAMBAT NYAA,_
Lambat loading,_
SCHOOLS in Cambodia reopened after a six-month closure due to the impact of the Covid-19 pandemic,_
"094 tonnes of CO2 per megawatt hour depending on how much electricity they generate, according to the energy ministry's data",_
Barang dah pun sampai seperti yang di order tq seller dan penghantar terbaikkkk selalu berbaloi-baloi,_
setakat ni belum ada apa2 masalah,_
Yang ni sumpah best,_
Oder smlm Hari ni da sampai,_
Barang sudah diterima dgn selamat di bungkus dgn baik dan kemas kualiti mmg memuaskan sangat puas hati,_
repeat byk kali da kat kedai ni,_
thankyiuuuuuuuuuuuuuuuuuuuuuuuuuuuhhuhuuuuuuuuuuuuuuuuu,_
Terima kasih dh sampai,_
"6 , to 4,898",_
Patut ramai cust cancel order bila guna cash,_
boleh tukar2 pakai pergi school,_
Hopefully it will be good products,_
untuk kancil yang belakang tu besar sikit,_
"will rate higher starts, will promote to friends",_
"And in January, two bankers involved in the deals said they had noted smaller hedge fund orders as the ECB prepares to buy less bonds",_
Original Rasa,_
"W 54kg,",_
Rasanya ramai mintak iphone guna type-c sebab airdrop support file transfer berape gb je,_
Suka sangat sbb ada bulu2 kat bawah tu hehe,_
terbaik untuk buat seluar,_
This will lead to wrong order,_
The quality is amazing and I bet it's durable,_
warna dia pun cantik >< value for money,_
"Kata preorder,",_
"Besarnya kotak, walaupun hanya sebotol di dalamnya",_
boleh la bagi mak nak isi barang barang hahaha,_
Seller salah anta ke?,_
PENJUAL BOLEH DIPERCAYAI,_
aku xde duit pun beli jugak,_
"The price is cheap, the quality is very good, standard shipping, the packaging is super fast, the item lands properly",_
Penambahbaikkan dari segi pempakejan amat diperlukan untuk mengelakkan daripada kotak produk kemek semasa dalam penghantaran,_
i try dlu yerrr,_
His account features comedy skits and impersonations of the character Tony Montana from the 1983 film Scarface,_
please let this courier company deliver my other orders,_
kenapa lah dapt gambar blkng duit,_
Effectiveness:sangat berkesan utk ibu saya sakit lutut,_
Senang pakai dan getah x sakitkan kaki,_
TQVM seller & ninjavan🤩,_
Mahu beli lagi,_
Texture:Quite sharp but didn't hurt your skin,_
tiptop bagus goodjob seller boek tenciuuuuuuuuuuuuuuuuuu,_
So this purchase is very worth it!,_
"Animal welfare organisation Four Paws has warned that thousands of strays in Bali were at risk of starving or being snatched by dog meat traders, as a plunge in tourism hammers the holiday island",_
penghantaran delay,_
"trbaik seller, fast delivery",_
Fast delivery and received item in a good condition boleh beli lagi,_
Kena rajin follow up,_
Item received and used well,_
GTAEF has introduced appropriate experiences that are designed to allow the elephant caretakers to raise the funds they need to look after their elephants without forcing them into activities they might not enjoy,_
"Barang okey berpatutan dengan harga ,",_
sesuai untuk kepala besar sebab boleh adjust2,_
saya beli untuk anak saya,_
GOOD VALUE FOR MONEY GOOD VALUE FOR MONEY,_
Penghantran cepat laju tiptop,_
"The whole movie leads towards the end, where finally someone tells him who he is",_
"barang padu, charger cepat naik , packaging kemas, trbaik seler",_
Aamiinn🤲🥰,_
I like this because nice to eat,_
"Thanks seller, nanti saya repeat",_
Gonna repeat order tq,_
Oder 14/3/22 sampai 4/4/22 produk bagus kat luar tak jumpa lagi macam ni,_
mmg puas hati dan hrga pun murah,_
Satu lagi tempat dalam kumpulan masih boleh diraih selepas Young Boys dan Atalanta seri 3-3 di Bern,_
parcel dpt dlm keadaan baik,_
Effectiveness:kulit kepala tak gatal,_
Tinggi 157 berat 46,_
FIFA's rules for all Football Associations state that they must be free of any government or political interference but the report says any conflict with those rules could be avoided by the regulator's board being appointed by a panel of experts rather than directly by government,_
game work perfectly fine,_
Quality not as expected like pictures,_
Received item in a good condition after 4 days place order,_
Planning on buying again since the groot that i bought don't have light in the middle,_
Texture:cantik semua jenis kulit,_
"dah try jalan, klip takde tercabut hiks thank you seller!",_
No hubble wrap but product received is OK condition,_
kalau ok akan repeat order InsyaAllah,_
"Cuma pembungkusan boleh lah ditambah baik, tapi mungkin selipar ni tahan lasak sebab tu bungkus macam tu je kot",_
lawa comel cute hehehe,_
sesuai dgn saiz kaki,_
Fast Delivered & Nice Packed by Seller,_
sy bagi 5star🥰,_
j j jj h h h,_
Tq sealer Minta shakers 4,_
"Happy with the price and service, delivery time also OK, 3 days",_
Barang diterima dalam keaadaan baik penghantaran dalam masa yang ditetapkan,_
"6 bilion sekiranya 250,000 pelajar antarabangsa melanjutkan pengajian menjelang 2025",_
However the quality is really good!,_
Sling bag dah diterima,_
Belum cuba lg utk semua item tu,_
Alhamdulillah telekung dah sampai mmg cantik,_
Tpi klau nk beli yg oky semua condition jngn beli kat sini,_
Installation is easy with manual and youtube for help,_
Macam handkerchief je size nyaa,_
Reasonable price for the product quality,_
selalu walk in,_
phillppine s,_
Sooo u guys boleh beli kat kedai ni,_
"Im a fan of small phone but still like doing stuff that needs bigger screen,",_
Bagus bnget,_
"dah repeat order dgn seller ni, mmg best la",_
Item dh slmt smpi & ada free gift blous lg,_
Shipping pun laju kasut selesa pakai saiz ngam kaki,_
next mmg akan repeat jelah jersi kt kedai ni je,_
wajib la tukar,_
shopee express yg lambat bebenor,_
Seller give the right colour,_
"While iconic, the",_
Brang semua ok memuaskan,_
"First time beli sbb nk Cuba, heheh papa pun tq seller pnghantran sgt cepat 🥰🥰First time beli sbb nk Cuba, heheh papa pun tq seller pnghantran sgt cepat 🥰🥰First time beli sbb nk Cuba, heheh papa pun tq seller pnghantran sgt cepat 🥰🥰First time beli sbb nk Cuba, heheh papa pun tq seller pnghantra",_
ship: 19/11,_
servis laju dan mantap,_
recommend seller :),_
The size received well and correct but it skinny type that really tight on me btw photos and video not related,_
Skin Suitability:okeyy selesa,_
"Guna courier jnt memang terbaik, walaupun musim covid ni",_
Beli : 11/11/2021,_
Banyak kali dah repeat dan tidak pernah mengecewakan,_
I can confirm that,_
"Perfume cantik, bau pun sedap boleh la tahan tapi bau dia lembut light2 macam tu, apapun ok nanti nk beli bau jenis lain pulak",_
"Boleh beli oversized or usual size sebab dua okay, wuduk friendly jgk even xde zip , tpi depan dia agak pnjg sikit dari blkg, elakkan pergi tempat panas sb cpt serap peluh",_
oder sbtu mlm,_
French Vanilla tu sedap sgt,_
"Barang sampai dalam keadaan yg selamat, bungkusan pun memuaskan, boleh berurusan lg dgn seller ni",_
Harga murah kualiti pun elok,_
"Alhamdulillah dh smpi, terus guna",_
That would be up 68 from 9,_
Favourite drink all the time,_
"Bai Ming, deputy director of the international market research department at the Chinese Academy of International Trade and Economic Cooperation, said Washington has repeatedly resorted in recent years to political manoeuvres to hinder normal business and investment decisions by putting a growing number of Chinese companies on blacklists",_
Nice delivery and the steering cover looking good and nice,_
"quality cantik, the chain cantik",_
"The controller's condition is so good and so well, great job and keep it up ^^",_
lain tempat yg tutup 3g,_
But still boleh jahit,_
Delivery em agk lambat la,_
"servis yang bagus , esok post harini dah sampai , saya bagi 5 bintang",_
"We don't have to be afraid to put regulations to direct the economy to a low-carbon economy, Biggeri adds",_
stoken xnipis sgt sesuai dgn harga,_
cantikkkkkk okaylaa untuk tinggi 151 berat 36 muat muatt tapi labuh sikit jee,_
so ni beli terus 3 senang xyah pkir dah nk cri,_
So cool the price was really cheap and great can't wait to try out !,_
Thanks pureenn m chakk so love gituw,_
penghantarannya lajuuu je sampai,_
"Murah beli dlm online ,beli kedai 1 kotak kena 3ringgit,boleh beli LG bleh buat niaga air dah ,esok nak beli lagi kat seller nie lah",_
"00,DRIVER AKAN DI PM/PHK/DI PECAT/NGA BISA NARIK OJEK ONLINE LAGI, CUMA GARA2 BINTANG REJEKI ORANG MATI/KELUARGA NYA NGA DI NAFKAHIN/TELANTAR",_
baju sy pn smpi awl,_
paling suka brand ni sebab material dia boleh tahan best and tak nipis sangat,_
pmbungkusan yg kemasrecommend seller,_
"Penghantaran cepat gile,",_
Overall saya suka saya amik size sama je mcm yg biasa pakai,_
s just a normal phone with 120watt charging which is only being showed instead of it&$HASHTAG$,_
"lawa gila , now my eunwoo safe 🤣 , and ada calar sikit but it's okay , I ordered on 25/12, but 12/1 just arrived, shopee express peram barang",_
code 03,_
Taste:so goodddd,_
Hope next momo can give free shipping to ur customer,_
Just like it's meant to be shipping was fast and reliable,_
utk coin je,_
"beg ni nice bukan jenis kain yang mcm dkat kedai lain, beg ni material dia mcm kulit and kalis air, i mean worth for the price though",_
First time try melecur jugak yela buat sendiri kan hahah pastu tak kemas plk tu adoiii takpe nnti try sampai pandai,_
"Kedua-dua mayat telah dibawa ke Unit Forensik, HSM untuk bedah siasat, katanya",_
but it really hard to connect the call center,_
Nak yg premium kena lah beli yg mahal,_
3T and I m satisfied and happy to use it,_
Rasa air lain sikit dari sebelum ni,_
Parcel arrived safely in good condition with good packaging,_
Barang sangat baik sudah berkali kali saya beli barang dari kedai ni,_
Used to buy together with other bulky stuff & the bar was bent when received,_
Hopely it look nice and good,_
Tertinggal keretapi,_
Service cepat from seller,_
"SUKAAAA GILAA NAK MAMPOSSSSSSS , SAYANGGG AKAK UYA <3",_
"Ni tak, tak secure langsung",_
"The startup wants to start doing short hops between yards but operating on public roads adds complexity, Smith said",_
dah habis guna sy akan repeat,_
"pembungkusan terbaik harga sangat murah berpadanan dengan kualiti terima kasih kepada seller, shoppe dan kurier",_
Good job to seller and courier,_
cun dengan saiz yang di order,_
com/world/americas/nicaraguas-ortega-coasting-victory-after-contentious-election-2021-11-08 a fourth consecutive term after jailing political rivals,_
barang terbaikk smua terbaikkk sangattt,_
Tapi sebaik nye tebal kn ckit plastik pos sbb dapat yg koyak,_
Oriteeeee tenkiuuuuu seller tenkiuuu courier service tenkiuuuuu semuaa,_
"SINGAPORE: Binance Asia Services, the Singapore entity of Changpeng Zhao, says it made an investment in a regional private securities exchange called Hg Exchange (HGX) that gives it a post-money stake of 18",_
saiz sesuai ngn kaki,_
kain pon tebal n jahitan kemas,_
Utk selfie boleh lh,_
"Very soft comfort, nice green like your mother turn to green",_
Got two slim fit and 3 straight cut (including the one with belt),_
"Maaf gambar dan video tiada kene mengene,just nak bgi tau brg di hantar sangat laju dan dibalut elok selamat,belum cuba lagi harap2 sesuai dn bole repeat lagi",_
"If you want to buy urgent, forget it",_
Cantik love sgt siap ade muzik lg cuma nk colour pink tp da abis stock so beli 2 colour biru,_
Skin Suitability:okayy smells like honey,_
"Tu try colour lain plak,terbest and recommend sgat yg mana cari lipmatte yg ringan dan x melekit bila pakai🥰buy 2 free 1 plak tu",_
"Alhamdulillah, wallet ni cantik & nampak smart gituu",_
Kotak besar penuh dengan bubble wrap,_
parcel well received and in good condition,_
Nasib baik item dalam keadaan baik,_
seller terbaikkkkkkkkkkkkkmmmmmm,_
Xsdap sangat nk guna,_
"After install at dashboard, quite easy to drop for Bezza",_
barang semua okay tiada kerosakkan,_
Pelan anda adalah edisi terhad yg memberi anda 2GB PERCUMA utk Internet 4G setiap Sabtu Ahad sepanjang hayat,_
Penghantaran barang dengan cepat dan barang sangat cantik,_
"Nga boleh dpt emas ko Medy,nanti pensi YouTube nga bisa denger nyanyi Buki ,itu slime knapa kyk ingus di temennya Sinchan ya",_
