Sentence,Tagged_Sentence
"penghantaran yg cepat, susunan dan sampul yg kemas",_
"Tanpa berselindung, Remy mendedahkan, dia pernah terkilan apabila peluang memenangi trofi FFM masih belum tiba meskipun sudah berbelas tahun menghambakan diri dalam dunia seni",_
Treatment firm & flawless,_
"bang nak tnya , saya ada beli juga , tp payment just potong untuk apple pensil n adapter jaa , tp dlm id oder ipad tu stay dlm proses , dia bila nk pos baru dia potong duit or mcm mna ya?",_
Patut ambil xxl,_
ingtkn kain jnis satin,_
I love you Aron,_
"Received in good condition, looks quite flavorful and tasty",_
"t disable, yes -We can see that it&$HASHTAG$",_
so alhamdulilllah jmpa dngn owner nj barang mmg tiptopp,_
Great product with great features,_
mmg yg biru besar sgt sampai sy return,_
MANAGEMENT and Science University (MSU) has signed a memorandum of under- standing (MOU) with Selangor State Sports Council (MSNS),_
Jie Shan,_
Received in good condition and fast delivery too thank you,_
Alhamdulillah slmt terima,_
Easy to keep things,_
Cantik sangat simple sahaja tapi berkualiti boleh repeat lagi lepas harga pun murah boleh beli peghantaran cepat lah juga ukuran pun just nice beauty kalau nak hias mmg sesuai sgt bagus seller pun balas chat respon pd pertanyaan nak raya ni sgt menarik tertarik kau memang da bomb sesuai untuk rumah,_
Gooood product quality cheap price will buy it again fast delivery,_
Good taste and good value,_
Shingyi Ang,_
Tktau nk cakap macam mana tapi puas hati sangat sangat!,_
"Ketika ini, pasangan itu berada di kedudukan kesembilan ranking kejohanan akhir musim itu dan perlu berada dalam kelompok lapan terbaik untuk layak",_
Kain yg sgt2 lembut dan halus,_
-duit terkumpul hasil cod harini,_
Puas hati n berbaloi dgn hrga,_
Terkejut time bukak,_
Received my order 5 days after placed the order,_
Beli sbb senang nak bwk ke mana2 sbb kecik kan,_
Its savely arrive,_
Quality:Menarik cantik,_
Exactly as shown,_
"but i think the seller can improve more the packaging, received the parcel without any protection (bubble wrap) luckily nothing happened to my tumblr :)",_
The wheels are not doing a good job tho,_
"Dalam pada itu, penduduk tempatan mendakwa mereka bergelut untuk mendapatkan makanan mencukupi sejak kebelakangan ini, walaupun pihak berkuasa China menegaskan mereka berusaha memastikan bekalan terbabit stabil",_
skrg dh connect dgn tv,_
Harap vacuum yg anak kutu terima dua2 baik ok dan bertahan lama,_
"Did anyone bet on the number of times Sam says £220 ? Could have bought one on the proceeds,",_
Poor handling of customer complaints,_
Hotspot kouta tak gerak,_
"beli: no 2, 26",_
untuk pinggang saiz 36-38 ni 3xl sangat cun,_
Pampers agk nipis dr brand lain,_
boleh la nti boleh repeat barang2 lain plak,_
Kualiti kain bleh la,_
colour tudung nampak gelap sikit tak sama macam yang dalam gambar,_
Kali ke-3 beli palazo Zoe Arissa,_
"During the visit, Sultan Ibrahim also ordered additional mattresses and pillows for the comfort of the victims at the PPS",_
Abg DHL sgt friendly thooo 🤭🤭,_
All accesories also included in the packing,_
brg dh slmat smpi,_
"Good quality, cute casing,so cheap,but not really fast delivery",_
Kain tebal warna nude pinkish cantik thanks seller terbaikk,_
woc,_
bubble wap pun tebal,_
"If one thing is clear, it is that we cannot rely solely on most of our leaders to care about us or our future, and certainly not about the future of our children",_
perkhidmatan juga sangat baik,_
"Product received in good conditions, wrapped with bubble wrap",_
love the vid uncle Lew $MENTION$,_
"If Antony Blinken loves history lessons so much, then he should take the following into account: when Americans are in your house, it can be difficult to stay alive and not be robbed or raped, the ministry said on its Telegram social media channel",_
Where and what happen to the unlimited internet subscription?,_
Baju smpai dlm keadaan yg baik,_
Condition item like new,_
Thanksssss for this awesome product !,_
T 154 B 48 took size L and it fit me perfectly,_
baru nak buka tengok,_
Thanks seller 🥰 barang sudah sampai dlm keadaan yg baik thanks seller 🥰,_
semoga beruntung dan rezeki saya 🤲,_
terbaik n bau sabun wangi sngt,_
Penghantaran tu kena sabar,_
how to say very nice,_
Nowadays im using sponge to cleanse my face,_
"Selain itu, diharapkan semuanya berjalan dengan lancar dan dapatkan keputusan yang baik,",_
baju cantik baju cantik baju cantik baju cantik berbaloi beli cntik cntik cntik,_
"Penghantaran begitu pantas , order malam, esok seller terus ship out",_
jahitan pun kemas takdak terkoyak ka apa kecuali dekat tag nike,_
Nice lepak discord mmng trlalu mantap bang tpi itula kalau ada awek boleh lepak sesama eh lupa single HAHAHAHAHA,_
tq seller sangat mudah berurusan,_
good terbaik seller,_
Tiada kerosakan parcel sya,_
Very nice folder,_
"The expire date is on 05/08/22, still fresh",_
Mempermudah perjalanan suka banget,_
"Received In Good Condition, Haven Try Yet In Toll Hopefully It Works, Fast Delivery From The Time Frame Given, Thank You Seller",_
$MENTION$ my fingers are crossed,_
s the meaning of July 9? Yoongi: It sounds like &quot,_
damn bro,_
"Nk collect coin saje,",_
Growth of 2,_
Fong Ying Mervin Loh,_
kalau saiz 43 ambik 45,_
Amat bagus dan cepat delivery,_
"Apart from green energy and transportation, Suhendar said Hong Kong businesses might also be keen to tap opportunities in healthcare and digital technology",_
cuma belum test lagi kat hiway,_
$HASHTAG$ kali dah repeat,_
🥰🥰 terbaik momo,_
brg terima elok,_
My friend dah dpt yoshi diaaaa,_
"bila tanye kenapa, enggak di jawab",_
"orders, it was a bit late in delivery",_
Very soft and not yet use,_
"Barang selamat mendarat di bumi malaysia, qualiti yang bagus packing yang biasa² sja",_
Baju padan molek,_
the box is damage but the item inside is not,_
dah beli afew mmg awesome,_
"The package could've been better but since it's a SSD, tolerate able",_
Quality:RM0 Oops!,_
"cantik sangat , sesuai la untuk student sebab banyak poket senang letak barang barang yang kecik macam kalkulator , mini note book or phone pon boleh",_
mcm brg dr china pulak🥴tp alhamdulillah kualiti kain mmg superb,_
dalam video ada zip kat belakang,_
"ini apa miskaaaaaaaaaaaaaaa jgnla kedekut salotape :,)",_
semua the best tpi kulit saya not best,_
thanks seller shopee and courier,_
"I suppose Sabah DAP also attempting to 'reform' its leadership and bring in young leaders, he said",_
Material:taktaula cotton kot,_
Muat dgn sya,_
oder yang keberapa kali x ingat dah,_
macam macam perisa bole pilih,_
cantik menarik tertarik kau memang de boom,_
Effectiveness:r,_
"These units will then manage and continuously improve new early warning systems, she says",_
Tried it on and it works as expected,_
My local fish n chips store and bakery use the same &quot,_
it just u cannot set the preference of sentences,_
Has extra plastics,_
well I am looking for yours but not yet found it,_
klu xmurah dn berbaloiii xkn oder setiap bulan kn,_
"Brg sampai dgn selamat,paking kemas,tqqqqqaaa nnti lh bli lg",_
baby lena tidor,_
Di shopee search &quot,_
"good casing, able to protect phone well",_
i pakai saiz 4xl ok,_
recived items in good condition,_
lawa mcm jam mahal,_
Kain selesa untuk workout,_
But luckily the product itself is ok,_
Setakat ni motor boleh start,_
kipidap the excellent quality,_
"Finally the item safely arrived, it packed neatly and no damaged at all",_
- 1 star for fake description,_
Penghantaran pantas bungkusan tebal,_
The watch is actually easy to set and the handsock is fine material,_
Sedap sangat and box pon agar besar beyond my expectations,_
"Nice weyyy dh repeat kali ke berapa dh dkat kdai ni,haha item smoa padu,smoga trus success sllalu yer",_
Mancini turned Italy from a shambolic team that failed to qualify for the World Cup into the European champions in the space of three years,_
"When pressing more than 3 keys, the sound is out",_
Fit my weight 74kg height 170cm,_
tapi sikap seller buat macam ni yang tak best,_
Penghantaran pantas jugaa,_
"Method delivery still same , slow consider Peninsular Malaysia",_
Ermmm Dah la anak aku nie jenis lasak,_
material kain superbbbbbbb,_
Xde la nmpak oelik sgt,_
"Received the product, thank the seller, the packaging is no problem, I have not started to use it yet",_
EAST-WEST ROW The EU has called on Russia to make Lukashenko end the crisis,_
dh smpai dngn pntasnye,_
tunggu lama respon seller lambat sngt,_
Very good packaging but I cut it until breakage of innner packaging,_
45pm on Thursday (Aug 13),_
"This investment will enable the History of Science Museum and Pitt Rivers Museum to recruit, train and support a new team of 200 volunteers from across Oxfordshire, Britain",_
so hampa boleh beli dengan seller ni,_
Nice nice nice great great great,_
Hadiah untuk cucu,_
Superb excellent,_
"Nothing to complaint, worth 5 stars",_
All 3 packs received in good condition,_
ketaq lutut tunggu baju ni sampai,_
Oily bottles,_
HDMI cable is thick n good,_
Awk yang mencari kek batik cadbury,_
So kita beli jugak utk Give someone for birthday gift,_
"Apart from that, noiceeeeee~",_
tp mjur brg slmt xde rosak,_
Fast delivery Good Quality Product Smells so nice,_
"Di sebalik cabaran ini, negara kita kekal teguh dan berdaya tahan menghadapi cabaran, katanya",_
"harga pun murah, thank you seller 🥰",_
Alhamdulilah selama menggunakan Grab selalu d beri pelayanan dengan baik,_
so disppointed,_
"Untuk sy, berkesan jika berserta diet dan exercise",_
Tttttttttttttttttttteeeeeeeeeeeeeerrrrrrrrrrrrrrrrbaik,_
jazi,_
"Castillo was rushed to the emergency department of the hospital on April 27, after experiencing Covid-19 symptoms including fever, cough and difficulty in breathing",_
"Thank you, I&$HASHTAG$",_
nnt sy pasti beli lg sbb laju gila smpi,_
Tak tahu berapa kali dah repeat ngan seller ni,_
okay okay je tak seperti yg di hype kan huhu,_
The wedding was attended by the couple's immediate family members,_
Teddy bear comel ni cantik dan murah,_
maaf unboxing kali ini gak seru dan mengecewakan,_
"penghantaran pon laju, bleh repeat order",_
33 juta minggu lepas dengan harga sahamnya meningkat 9,_
stroller dah sampai,_
Quality:Five start,_
"Simple, comfortable",_
long expiry date with promo price,_
"Where an increase was reported, firms reported taking on additional staff to aid production although businesses indicated difficulties in taking on foreign workers amid strict border restrictions",_
"Sorry gmbr x dak kaitan, maleh, haha",_
Make more shocking sales,_
byk wrna dah sold,_
v21 untuk saya,_
"Secara tidak langsung, kerjasama anda amat diperlukan oleh kami untuk membina pasaran bisnes kami",_
Thank you seller for the little candy,_
Laju gilerr service dari pihak seller & j&t,_
senang untuk basuh tangan umpama sabun,_
Beberapa kali dah dok repeat dari kedai nii,_
"Barang sampai dalam keadaan yang terbaik, qualiti saya bagi 3/5, grip saya bagi 4/5, tapi overall mmg mantap, 5 star sebab harga sepadan barang",_
Barangg baikk mana amana rancak becak ketiakkkmmmm,_
Arun Da I want to buy a new laptop in this BBD please suggest the best one with 8 gb ram 256-512 gb SSD in the range of 45k-46k please please please with i3 11 gen,_
servis kedai ni paling laju,_
Delivery took 8days from China,_
Sesuai dengan harga nyer,_
"slow delivery,nice packaging, express delivery very fast",_
Overall ok even it's a bit late since it's from china,_
Brg murah tp design n quality dia nmpak mahai,_
"Just tried this noodle,is really nice and is easy to cook as well",_
padahal grab sudah kasih surat peringatan ke 2 1,_
"All item okay, magnet pon kuat",_
utk yg berat 70kg - 80kg sy suggest ambik saiz xxl,_
Dried my clothes within 1hr for emergencies,_
Plastik parcel terkoyak em xtw la sapa pny keja sebab xdak bubble wrap kan,_
order 23/4,_
XD M,_
Received in good condition and so beautiful!,_
Oder kelmarin hari ni dah sampai Alor Setar Kedah memang cepat jam dah rosak,_
Visually nampak elegant & mahal,_
"Barang ok tak kecik tak besar, delivery pon tak laju",_
"JERUSALEM (Reuters) - Prime Minister Benjamin Netanyahu said on Monday that Israel is preparing for direct flights, over Saudi Arabia, to the United Arab Emirates as part of its normalisation deal with the UAE",_
Do your thang do your thang tell me now,_
Gave me free Pet and Gems,_
"Baju cantik , pakai untuk malam berinai nanti aaa tak sabar rasaaa nak pakai nanti terima kasih",_
Kain lembut dan berbaloi,_
Baju telah di terima dalam keadaan baik,_
!good job🤍🤍,_
"Nice, very cute n satisfied fast delivery, the material also good recomeded buy it",_
Texture:foamy & moisture,_
Nt too bad quality for the price,_
I really hope to win one of these,_
"i 48kg, tinggi 156",_
received the right colour and the good item,_
Arun please have a look on Samsung m51 because it contains some unique feature,_
"For reference, I am 150 and 40 kg, I want it's a bit longer and baggy and this size suits me nicely",_
Goodjob and thank u kakyan!,_
baguih la suka bagus suka suka suka,_
Saiz baju S,_
wlwpn murah berbaloi dgn harga,_
size S sesuai sangat,_
Card murah dan sgt berbaloi beli byk2,_
But got a stain on that bag,_
3cm but this sandal size 41 is 26,_
Hampeh jeeeee,_
Before ni beli kt mydin brand same tp tebal ckit lah,_
So I can do it awayof with the way ke rumah anda dapat nak teruskan kerjaya saya sebab masalah penglihatan on the way ke rumah anda dapat nak teruskan kerjaya saya sebab masalah penglihatan on the way ke rumah anda dapat nak teruskan kerjaya saya,_
harap berbapoi,_
memang terbaik barang Dari seller ni,_
"Efficient, Easy to use",_
the fabric is comfortable,_
tk de gambar,_
Fast delivery and great quality!,_
shipping pun cepat 02/10 bayar hari yang sama juga keluar shipping 03/10 sampai,_
kasut cantik cuma besar 1inc skit bt saya,_
However the item is working,_
Tqqqq tqqqqq tqqqqq tqqqqq terima kasihhhhh tqq tqqq,_
kalu x,_
Sedia bincang jika Pulau Pinang mahu ambil alih perkhidmatan feri,_
Good product quality ⏳⏳⏳,_
Bahaya jgk laa,_
sabun wangi sngat,_
Bear mmg lawaaa and gebuuu sngt,_
apa pun thank you seller🥰,_
good product quality and nice^^,_
3)RAM - 16gb(doubted-4gb),_
"Saja beli, nak lock semua peti ais, asyik keluar masuk dapur je bukak peti ais, rimas",_
baju sampai dengan baik cuma salah posisi untuk design sahaja,_
sbb murah dan cantik kita borong byk2,_
cume x rase lagi,_
Kit Kat = 1,_
No back cover,_
Tak perlu susah² nak tapis,_
Byk kali beli,_
Ordered on 5 May and received on 10 May with 300 coins cashback,_
Harap boleh la tahan lama sbb nk guna,_
Cuma casing airpod kurang memuaskan but overall sangat sangat bagus dan okay,_
"Penghantaran dari seller ok, cepat",_
dpt kotak dlm keadaan kemek dan reseal oleh DHL,_
Love this cloth absorbed water very well,_
Cuma kasut ni akan membuatkan kaki kita nampak besar,_
Should be welcome by kids n patents,_
Harap2 boleh la survive 2 bulan,_
Egg Fried Rice,_
The greedy whistle phytogeographically add because correspondent histopathologically hang in a trashy downtown,_
Seller yang bagus dan cepat,_
Terbaikkkk selesa murah,_
Yang kecik tu betul2 kecik takut tak muat je letak garam sepeket,_
"The decision is scheduled to be delivered online at 9am Wednesday (Dec 8), due to the fact that the former prime minister and his defence counsels were casual contacts to Tan Sri Muhammad Shafee Abdullah's son, Muhammad Farhan, who tested positive for Covid-19",_
Murah but the quality is great,_
Seller proses paling pantas,_
penhantaran yang sangat pantas dan cepat,_
I really love them so much!,_
Malas nak pegi ambil tapi memang bungkus elok sangat,_
It is like an upside down U,_
"seller yang baik ,semoga dimurahkan rezeki",_
Alhmdulillah brg dh smpai dgn selamat,_
"pdhl kmrn² bisa, udah di update yg baru pdhl apknya",_
But the packinging was secure,_
untuk anak bawa ke asrama,_
Beli sebab ramai kata bau sedap!,_
Seller fast respond and provide product key and guides via link provided in chat,_
"So nice, cute",_
kalau suka yg ngam2 boleh ambil L,_
Barang juga sampai cepat,_
barang padu sudah sampai free mask thanks you,_
Laju betoi,_
"Massachusetts baru-baru ini mengumumkan akan membuka beberapa pusat vaksinasi berskala besar, termasuk membuka semula Fenway Park, tuan rumah kepada pasukan besbol, Boston Red Sox",_
Seller send it very fast n secure with bubble envelope,_
Kira nasib baik la x bocor atau rosak,_
"mmg colour lembut, dlam camera maybe nmpak grey but real colour mmg ke arah soft grey hehe",_
"Kombinasi mantap Lee Tuck, Habib Haroon dan Dechi Marcel di jentera tengah ketika mencipta gerakan selain keupayaan penjaring terbanyak Liga Perdana, Jordan Mintah yang sudah kembali menemui sentuhan jaringan, sudah pasti menggerunkan lawan",_
No leaking and box damaged,_
"Received in good condition, delivery time acceptable, free item, thanks",_
Kereta saja ada charge bateri,_
lovely kiru mera kiru,_
Can repeat to buy it again 🤩,_
Size/Perfect Fit:saiz ngam dengan anak,_
Order semlm hari ini sampai,_
Pepun thanks seller jual brg2 yg berbaloi dg harga,_
Walau mengambil masa sehingga 7 hari,_
The UX UI designer must be very good!,_
Contoh paling senang adalah Bangladesh,_
lawa teroks penghantaran pon laju berbaloi dengn harga love,_
"sambil ngantuk2, dengerin",_
Will repeat order again Thank you,_
Tq seller sedih sedih,_
"Taste:best sedap lemak disukai ramai,yang penting cepat saja sampai dah",_
Boleh pakai kat rumah je,_
Sporting equalised through Nuno Santos in the 22nd minute but Brazilian Antony restored the Dutch side's lead just before halftime after a horror defensive error by the visitors,_
Overal perfect 🤩,_
fit2 msuk dkt my kenali 🤭🤭,_
Great products with good deals will repurchase soon,_
Exactly what I needed to lit all my my stuff up,_
thank u seller Semoga dipermudahkan segala urusan Sory pic tkda kena mengena,_
Banyak kali beli ngan dia,_
Barang berkualiti servis memuaskan harga berpatutan penghantaran baik terima kasih seller,_
Sorry gambar takde sebab tengah pakai casing ni malad nak cabut and pasang balik,_
strechable as u can see here in my review pic,_
seliper 4 inci,_
"yg bijik sawi tu panjang ckt,yg sauh 2 ngam2 ngn tangan🥰",_
Repeat order untuk anak fruit,_
Even though a thin design adds NOTHING TO PERFORMANCE!,_
The product is very good in quality,_
so windy,_
Pls do not share it with anyone,_
"Fast delivery, wrap with bubble wrap and box, printer ok , bluetooth print is fast and smooth, AWB sticker print out is clear, easy set up follow video by seller provide, recomment product if u r fist time buy thermal printer",_
Selamat sampa,_
A very slow app,_
Seller ship out quite fast too!,_
Grab kok sekarang aneh?,_
masih mngekalkannnya,_
akan beli lg di sini,_
Br aje smpi,_
"Order kedua, sampai hari sama dari DHL",_
bila pakai jadi tenggelam,_
TQ seller&shopée,_
sangat berpuas hty,_
baju pon kain lembut,_
This time I directly ship to my friend house as her gift,_
Cheaper than all supermarkets at Sabah,_
"The owner then confirms that the guest is legitimate, and that's about it, says Rainer Schuldt from Computer Bild magazine",_
seller doing their job,_
Tak jadi masalah pada saya,_
Quality: Received in the good condition,_
Ingatkan besar sikit tapi rupanya kecik je hahahhaha,_
mmg untung berganda kalau beli time sale,_
There is a speed as artistic as shimano noisy,_
Wow everyone made peaches and ream beautiful,_
tq jnt n tq shopee,_
Quality ok suit with price,_
Laju perfume kereta AQUA wangi & segar,_
Fast Shop,_
very goodgood qualityvery fast deliverynicecan buy more,_
Nice packaging ‍,_
nice teruks weiiiiiiiiiiii suka gile penghantaran pon laju,_
Brg diterima dlm kdaan baik,_
warna dalam buku menyerlah membantu menarik minat anak membaca,_
Hello Seller?,_
"Harap2 oker la untk ank2 bulus,kesian asyik mnggaru jer",_
I ever bought in shopee,_
"taktahu nak komen apa, macam dah kena pakai pun ada",_
-buku rujukann mudah difahamii,_
Tap www,_
Texture:light and small,_
Sarung tangan cun,_
laju seller dan jnt buat kerja,_
We got rickrolled bois <a href=$URL$,_
Nk gune mase pregnant ni,_
WYnne PV 10=1 KO,_
(Boleh rujuk gambar),_
mmg sk jenis ni,_
Speedy delivery and everything was well packed,_
nice banyak promonya,_
Recommended untuk toddler,_
"Compare to other seller, here is cheaper!",_
Terima kasihhhh sangat sangat suka,_
"Tudung cantik, selesa dan muka senang bentuk",_
Baju lawa mcm biasa,_
"s so refreshing, the gifts it has inside and the concept photos are so precious",_
s stickers you too,_
Sayang seller huhuhubu,_
Penghantaran laju beg lawa tiada defect zip okay cuma kotor sikit takpe boleh bersihkan overall puas hati,_
"Barang pun berfungsi dengan baik,",_
"Barang sampai OK, tak de apa masalah",_
Hi brg dh sampai dgn baik smalam even agak lmbt sampai but its okay btw tq,_
Baramg dah sampai tq seller,_
Lawa terox!,_
24hb out,_
how much is the srp,_
6 from a year ago to RM2,_
Berat 84 tinggi 162 okay muat xl untk wrna cream,_
angin kipas pon kuat,_
Cutting cantik ade fishtail blakang cuma depan singkt sikit tp so far ok je,_
Terkejut mak,_
Im pretty sure it said 5meters when i ordered it but never mind,_
Got a small pack of biscuit as gift,_
Perfect size for my girl,_
Blink-blink in my eye,_
"Good product quality,good value for money,very good wrapping",_
"Despite his struggles, Daren is not considering the world meet to be his last",_
harap lepas ni seller jgn guna DHL,_
Disppointed after checking it's fake product,_
"Jadi siasatan masih dijalankan dan kita harap akan dapatkan laporan penuh dalam sedikit masa lagi, jelasnya",_
yg pertama amk saiz xl mcm terlebih besar,_
Kena tekan dlm 3-4 saat je lps tu stop kejap dan tekan balik,_
t do this all the time for every videos,_
i need that,_
Perfume dh smpai lama dah,_
Whatever thank you,_
"Complain to seller but seller said l keyed in wrongly, Shopee can checked from my order , l rate this seller unreliable",_
pasanagg sendiri senang senang,_
Pop it besar bebaloi beli time shocking sale 1,_
fast delivered and cheap,_
sangat selesa dan sejuk kalau pakai,_
try knsisten dlu,_
Dh pki Dh,_
Mcm ketat sikit,_
smp 15hb,_
"Let's give it a shot, $MENTION$",_
One of the nestum packets was slit and open at the side,_
"But for me, mcm lebih sesuai utk remaja kot ni haha",_
terutama mangsa banjir,_
This many time frying n boiling with a layer of starch i guess these crunchy fries are for shoving up in Ass not in mouth,_
thank you makkk,_
nk yg berkualiti bli yg mahal,_
Quality:Too good,_
mmg cun hrge dgn barang die,_
have yet to send for carwash,_
Will definitely come back in the future hehe,_
Kt sini murah gile,_
"The tote bag is good, the price is cheap, it includes the zipper and the furing inside but the shipment is a bit long because the red one is okay",_
tudung tu senang bentuk and lembut je warna semua cantik cantik,_
Everyone loves choc right?,_
change to blue also,_
"NAISSSSSSS DOO SPORTY , BOLEH LA UTK BERSUKAN , 18 SEN AJEEE HEHEHEHE",_
elok2 padan pakai kasut ni lembut ja,_
"kami nak raya tahun ni ,",_
Barang murah compare dengan kedai lain,_
Matterial wise good,_
Harga murah lagi dari pasaraya,_
"-Beg sudah sampai, delivary laju & mantap by seller, order 2 hari smpi",_
brg pun semua baik tq seller,_
"Pasang dekat smart tv Di kampung, tapi x bole guna pun",_
"First tudung utk baby 🥰🥰 cantik sangat kain dia , tak panas",_
Susah nak Cari size 41,_
delivery also acceptble,_
So many sratch like reuse item,_
stuck dr 17hb xgerak2,_
Penghantaran cepat sepantas kilat lajuuuuuuuuuuu,_
I would recommend!,_
sya beli untuk anak 13 tahun sabuh ni sampai buku lali,_
"Brg diterima dlm keadaan baik , terima kasih seller",_
Senriasa membeli mask dengan seller yang sangat responsif dan bertanggungjawab,_
seronok ank2 main,_
Baju cantikkkkkkk,_
I can't on it,_
I've raced with him and witnessed it first hand,_
Thanks You Grab Superapp,_
Kos penghantaran lagi mahal dari barang,_
"Luckily 34 habis and tukar ke 35, sebab 35 dah ngam ngam kaki",_
"takdan nak test , nanti review lain la , sorry huhuhu lobe ( ‿ )",_
sampai <3,_
"terbaik bosss ,penghantaran laju gile ,barang padu",_
try cas tadi kepala plug jadi panas,_
"Thanks seller harga berpatutan, penghantaran pantas,tiada kerosakkan",_
btw tq seller kasut anak saiz ngam,_
"The fears of a wipeout of the opposition, which the WP and others had warned about, proved unfounded, he added",_
14hb order 16hb dah sampai rumah,_
"KUALA LUMPUR: Industri automotif negara akan terus pulih dengan jumlah keseluruhan industri (TIV) dijangka melonjak kepada 600,000 unit tahun ini, sebelum diunjurkan berkembang 7",_
"besar pula watch ni, memang lawa sangat, berbaloi, walaupun dh lama",_
thankyou seller next time boleh repeat lagi sorry gambar dan video takde kaitan,_
fast delivery good product to be used!,_
"APAPUN, SYUKUR SEBAB CUKUP QTY 🥰",_
Motmkotmlpt,_
i suka gila this pario,_
Barang dibungkus dengan kemas & elok,_
"Myanmar kebiasaannya mengeksport makanan laut, buah dan beras ke Chian melalui laluan darat, dan menerima pulangan semula barangan elektronik, ubat dan bahan pembinaan",_
t throw your toys out of the pram just because I&$HASHTAG$,_
harga asl 26 tpi voucher kurg 10 so just byr 16 henggit je,_
"I understand that in the short term, the goal is to improve our league position",_
mungkin okay,_
tp memory kad tu pakai beberapa hari ja dah damage,_
s able to bring people from all around the world together,_
penghantaran lajuuuuu tq seller sorry video tk berkenaan,_
yosh!,_
YAyyUyyY BTS,_
mmg jauh beza la ngn gambar,_
"This is not good, not good at all!",_
help my fren to buy,_
Tk menganggu pon,_
"Warna yang cantik , terima kasih",_
Akan dcuba nanti,_
and the shawl incredibly stunning,_
syukur tiada msalah,_
oklah vacuum boleh tarik debu dan rambut,_
I already made a payment,_
Bagus kali cuyyy wow jadi pengen tapi,_
But this chain very cantik la,_
Comes with warranty too,_
brang telah selamat diterima,_
price batao plz,_
Material:waterpruse,_
Selekeh je,_
w sgo,_
App hebat,_
