Sentence,Tagged_Sentence
"A point of concern for investors is that BHP may have sold the assets too cheaply, and that getting only Woodside shares as payment is less than desirable",_
Torn box and damaged,_
Goo000000oooooooooooooooooooooooooooooooooooooooooooooooooooooooooooodddd,_
belooo cheese cake,_
cute sgt comel dia t q seller,_
t=2m31s> jimin give me a high five,_
Material:prodak ok bolehlah,_
So far barang okey smua solid,_
tu pon belah 2,_
Ordered 8 cans of tuna,_
"Stokin terbaik, material tebal n sesuai utk main bola",_
"Cuma tali mask baby pink tu dapat warna hitam, dekat dalam variation tunjuk tali putih",_
Cuma kat bhgian dpn kasut ada mcm gam tumpah,_
Saja try yg design kecik dulu sbb nk pakai semua wktu nikah nnti,_
Memang selesa gila,_
Good quality Nice packaging Fast delivery,_
barang sampai dengan selamat tanpa ade ape2 kerosakan,_
"Selain itu, Jabatan Perkhidmatan Perubatan turut menyediakan kira-kira 25,000 katil untuk pesakit di hospital dan hospital lapangan",_
Saiz tk besar mana tk kecik jugak,_
cuma tali pinggang tu aje yg agak berbaloi,_
Effectiveness:barang nya dh smpai,_
Takyah gi kedai bancuh sendiri je kat rumah huhu,_
"Order 12/12, ship out 14/12 and guess what received on 22/12, shopee express is not so reliable as its name",_
Good product original pillow polister hilton,_
$MENTION$ Hafez Sold out already!,_
Overall servis okay,_
Tp bestttt,_
"Kain ok selesa, kedut ii dia tu comel ii jahitan pn alhamdulillah kemas",_
I dh ambik saiz s punya,_
Penghantaran yang sangat pantas dari China!,_
Yang paling penting telo tu yang baru dan segar,_
Warna accurate dgn gambar,_
"Barang sampai dengan baik, harga murah, barang berkualiti, memang smooth je pakai",_
Minta maaf sbb video tak berkaitan,_
harap harap berfungsi dengan baik seperti dalam iklannya,_
Tak ada video ade gambar je dr kawan sebab bagi gift dekat die n die suka,_
bwk g kjbjew,_
was put in the box with lots of bubble wrap,_
Size/Perfect Fit:nice for a 4 year old,_
"Last Thursday, HSL was notified of changes of direct and indirect interests by HSLE, Yu and Tang Sing Ngiik (mother of HSL executive director Tony Yu Yuong Wee) that their collective shareholdings in the company now stand at 84",_
Hari ni barang saya dah sampai bungkus degan bait tapi bile bukak barang dalam dah kemet terima kasih,_
"Tapi prob nya knp getah dia mencair ,ke proses penghantaran dlm keadaan panas",_
"xde rosak or pecah,packaging ok",_
"Tak pakai lgi tapi nampak macam okay and selesa, berpatutan la dgn harganya tu",_
"skirt ni cantikk sangat ,",_
Taste:my fav flavour so mmg sedap,_
harap xda apa2 la,_
i jual knitwear,_
"KUALA LUMPUR: Pemain naturalisasi, Guilherme De Paula menafikan tindakannya membaling botol minuman ketika aksi berdepan Kemboja, semalam kerana tidak berpuas hati selepas jurulatih Harimau Malaya, Tan Cheng Hoe mengeluarkannya pada minit ke-65",_
Material:not so sure,_
Harga lebih murah plus dpt free pes asam pedas,_
Comes in box that look very premium,_
"for me, the installation for the adapter is easy as i only plug in the adapter and let my laptop configure it",_
"baju cntikkkk puas hatiii, cuma bju bsar skit ,sluar ngan2 xpe blh kecik kan ,tp lawaaaaa puas hati murahhhhhhhhhhh",_
The items all at mom's house,_
I am happy to get set A pc!,_
Walaupon lambat tp tetap sampai,_
Cutting dan warna jeans cantik,_
Produk memang bagus,_
Barang sampai dgn baik dan cepat tq seller,_
Cannot install or get support,_
"cute and nice, i will make it as mid autumn gift to my friends",_
tali boleh adjust sampai pendek srs tak tipu hehe,_
But due I still in KL so have check on the items yet!,_
Cantik sangat beli untuk sepupu heheh gambar xdk kena mengena ya brg smpai lama dh,_
brg hantar secure sgtseller terbaik,_
"terbaik, brg ori n padu",_
Quality:vey nice smell,_
"Good condition, tq seller",_
visit shop saya,_
Kali ni ambik size 46 curve,_
Time waste app,_
Expiry still quite some time to go,_
Box already damage,_
Muhammad Soid Ayuh!,_
Rayuan anda telah diterima,_
Seller sangat2 fast response,_
ⁿa,_
"Boleh repeat lg yes sure,",_
bgsbgsbgs,_
Tak capuk walau pakai mask,_
"Material:perfect, kain berkualiti",_
Absorption:hwwhhw,_
My digi app very very easy to use all digi promo,_
Quality:66,_
I am 157cm 46kg,_
Sory late respond,_
There is taken too long to received the good,_
Aloe vera gel ni baik utk sun burn an?,_
"Shout out to Manhattan fish market setia alam, pre ordered early and get the food late after 2 hours for buka puasa",_
buku aktiviti yg menarik dengan warna warni dan mudah difahami,_
"Harga pon murah, penghantaran sangat pantas",_
"Weight 56kg,high 158cm,I buy XL,better take size L",_
Value for money as got super discount by seller and,_
saja test letak kasut mmg lebih drpd muat la,_
"Received in good condition and value for money, recommended and trusted seller, tq",_
Overall vacum ok bunyi boleh tahan angin sedut kuat terangkat kapit kat rumah,_
Just fit to me,_
As long as xlebih expected masa yg ditetapkan shopee,_
Bhgn loop Tebal,_
"Too bad, i cannot get my dino saur 🦖",_
Ncd 45 (1st Party) Tune,_
"Pengantaran cepat,thank you",_
MY TAE BABYYY hes so cute,_
"RM 17,778 Cash Reward, you can easily get",_
mana² ranchak berdhosa🤳,_
Yang ni agak nipis sikit berbanding yang 5,_
Bought so many times already from this shop,_
Awesomeness to the max!,_
"kain best , awning memang senang jadi",_
"Next Time saya beli lagi,",_
"Motion dia ok, suara ok, ringan, easy access",_
sangat sangat rekomen sapa sapa nak,_
Please buy from them,_
Bungkusan kemas bungkusan kemas bungkusan kemas bungkusan kemas,_
tgok kain cantik lembut,_
You may discover that a solitude of your own choosing is very different from the one a virus forces on you,_
xblh pakai dlm jangsa masa yg panjang n hanya letak barang2 yg ringan2 shj,_
Don't know abt the quality!,_
I used the money from my winnings to fund my study,_
"It keeps showing nothing like the options for booking any rides, food, etc",_
kalau sanggul tak boleh masuk,_
Bolelah sbb murah kan,_
"overall barang berfungsi dgn baik, tak ada rosak or pecah",_
Go buy here bestie!,_
Gave FOCs too!,_
Saiz 4 thn ngam2 anak 4thn,_
I need to improve my work from home situation hence gotta but few products but this stupid non responsive app just annoying to use,_
"Order saiz lain, dpt saiz lain",_
100 natural,_
Quality:Good with great pricing,_
Big capacity though!,_
1 hal lak nk g cari soket,_
xtau apa masalah dgn j&t,_
Service next time boleh order lagi,_
slow shipping companyshopee expressbut towel is nicethank saller,_
Quality:barang dah sampai pembungkusan kemas puas hati thanks yoouuu sellerr thanks yoouuu sellerr thanks,_
Sdap la kot,_
"kain cantik, selesa pakai",_
Thank you seller for good service and fast shipping,_
yg pnting jngn joy tau 🤗🤗🤗🤗🤗🤗🤗🤗🤗🤗🤗🤗🤗,_
"Usually I spend just about RM400, and now increasing to RM600-RM700",_
anak dah tak boleh tarik² laci lagi,_
Kevin Kong,_
I like will repeat another color soon,_
"Barang dah sampai,masih panas2",_
Assalamualaikum nak kasi feedback ni,_
kali kedua beli kt kedai ni,_
cept aje smapi,_
"love the texture, love everything",_
Cantik boleh tahan bagnya,_
"Tak susah pun nak buat hardwire, banyak video dalam YouTube",_
"corak cantik2,",_
Chitrawathy has been travelling to University Malaya Medical Centre (UMMC) frequently for treatment after being diagnosed with lymphedema,_
"Fortunately, proper cooking and food handling can prevent most cases of food poisoning",_
The flexibilities accorded under the relief measures will enable brokers to better manage their clients' margin financing facilities and maintain stability in the marketplace amid continued market uncertainties arising from the COVID-19 pandemic,_
"United were eventually drawn with PSG, Real drew Benfica, while Atletico drew Bayern Munich before the draw was scrapped after the Spanish side complained and UEFA admitted the error caused by a technical problem with the software",_
TaKeshi MI 🤣,_
"But how come 1 pack of rice with vaccum packaging, but another 1 is not?",_
"Tuyệt vời, tôi rất muốn được ăn ngay 🥳🥳🥳",_
Material:ringan dan lembut,_
bagi anak anak belajar main dart dr main telefon jer,_
"However, kain dia macam mudah koyak, and banyak 'bulu bulu' benang kat area butang",_
dpt freegift sampul raya lagi,_
TRY THE DENIM BLUE !,_
Thank you to seller that give the excellent service to me,_
keadaan baik ja,_
Sesuai jadikn outerwear,_
"Baju sendat sikit kat perut,mungkin umur anak dh10thn tp baju utk saiz 9tnn",_
"WHAT SUGA WANTS SUGA GETS LETS GO ARMY ,",_
He said there was no need for Hongkongers to specifically wear the highly protective N95 masks recommended by medical experts in the United States and Canada,_
"Kulit sy oily, gel type sunscreen paling sesuai setakat ini",_
Taste:Normally,_
Material not that kind of soft cotton,_
Expiry date: Nov 2021,_
Tapi baca review ramai kata ambil saiz kecik sikit,_
Tebal dan lembut jugok,_
Okay lah delivery cepat sebab dekat,_
"Best beli kedai ni cpt jek sampai material pun ok, terbaik seller, sarangaheooooooo",_
Siap dpt beg dan ziplock bag,_
lom sempat godek,_
selalu guna yg cotton je,_
Ke dah kena hack parcel sy ni,_
order dan hantar pada hari yang sama,_
Material:Safety toys,_
Material:tak sure la,_
Murah dan berkualiti sangat berbaloi,_
Bought this for 18sen really worth it thankyouuu 🧡,_
Fast delivery from China within one week only,_
semua ok elok kena dengan harga,_
White is shiny,_
saiz sama seperti ukuran yang diberikan,_
"It collects detailed records of what its customers watch and do on their TVs, then sells that information to marketers so they can target their pitches more precisely potentially showing your tía different come-ons from the ones they show you",_
Received: 14/12/21,_
Semua cute thankyou seller,_
42 per barrel in electronic trading on the New York Mercantile Exchange,_
the material is very nicenormally seamless panties is not cottonbut this one is,_
this thing eed to chnge frequently,_
OK TQ,_
Well you deserve it with millions of subs !,_
Easy and simple for blind to manage and use it,_
"That said, a closer look at M-REITs reveals the potential to poise for a rebound from the current depths and reach for greater heights post-Covid-19",_
HEHEHEHEH CANTIKKKK FLOWY II GITUU DELIVERY PUN LESS THAN A WEEK SO SANGAT BERBALOI TUNGGU DENGAN QUALITY PUN EMPHH !,_
"This app is very simple to use,",_
so overall ok nice je thanks seller,_
X rugi beli harga pon murah Sgt berpuas hati tq saller penghantaran pon X de la lama Sgt rasa mcm nk order jenis yg lain pulak,_
Bqju dh smpai,_
the delivery is as fast as light!,_
Effectiveness:To keep liquid in small quantities,_
Idk laa but tk cantikkkk cennotlaaaa haduih lambat tuu tkkesah but tk cantik em rasanya simpan jala kot,_
Yang ni ok sebab apolo,_
brang dalam keadaan baik,_
"Received in good condition, fast delivery though its pre order",_
A : ),_
"Bank Islam Malaysia Bhd chief economist Mohd Afzanizam Abdul Rashid said in light of the recent appreciation, there could be a possibility that the ringgit might experience some correction on profit-taking activities",_
"We don't want dictator Hun Sen, photographs on social media showed",_
"Susunan sangAt kemasss snagat berpuas hati, penghantran cepat and bakal repeat soonnnnnnnnnnnnnnn sorry video tkde kna mengena🥳🥳",_
I want one!,_
Tudung cantik pleated shawl dia rapat,_
"Singaporean state-owned investor Temasek has acquired Element Materials Technology Group from Bridgepoint, the London-listed private equity firm said on Tuesday",_
Pit 20,_
But like other sellers mentioned the customer service is damn bad,_
Safely arrived yesterday,_
kain pun best sejuk tak panas,_
Versatile and in-demand Internists are trained to provide complete patient care,_
Thank Ya,_
Hari ni tekan butang refund dan2 malam tu dah gerak ke sini dari warehouse tu,_
Goods received with no defects,_
Lots of variety,_
Im so excited to try this Lavender Scent,_
Taste:sedaplah mcm biasa,_
t=9m53s> Taeyong missed Ten I miss them together :(,_
Kawan kata Power beli x ke 3 dah kita minum pun powers penghantaran dari terpantas,_
"beli 2, satu utk mama",_
Shawl smpai dgn cepat dan selamat serta cantik ii yee sye bli warna pink ngn putih btw sorry gambr xde kne mengena and tq seller,_
Tiada bhgian jahitan yg koyak,_
Doakan supaya ubat ni juga akan kurangkan rasa sakit lutut ibu sy,_
kain pun elok boleh beli lagi,_
Cleaning Effect:My scalp feels fresh and clean,_
"Loveeeee it, received in good condition!",_
Dah banyak kali order dari seller ini,_
cantik casing cantik casing okay je semua bagus je semua cantik casing okay je semua cantik casing okay je semua cantik casing okay je semua cantik casing okay je semua cantik casing okay je semua cantik casing okay je semua bagus,_
Due to parcel already in use,_
Barang diterima dalam keadaan baik cuma lambat sikit je sampai,_
Water Absorption:x luntur,_
"Kain ok, mmg sedap dipakai",_
"tq seller sbb cepat buat kerja , brng pun cepat je smpai 🥰🥰🥰🥰",_
sekali ny ad promo sll g bs d pakepadahal msh masa berlaku,_
Me: yea I better not,_
Makan dengan nasi putih x payah tambah lauk lain dah,_
tanya no telefon lorry pon tak ada,_
Alhamdulillah syukur ke hadrat Allah swt,_
m in Massachusetts so my theory is that she made here from England via Canada!,_
Barang bagus dan baik terima kasih saller maaf gmbr tiada kaitan tapi barang saller sangat baik dan bagus terima kasih,_
Спасибо все очень понятно,_
Good product and quality with fast,_
"Fast delivery, seller shipped hari yg sama",_
"Kualiti, tahan lasak",_
takde yang pecah or rosak,_
Huntunggg wei,_
Cleaning Effect:Berfungsi Dengan Baik,_
1day to prepare and received after a week,_
Product came super fast!,_
good quality of goods!,_
Beli utk mak 1psg utk tok 1psg,_
"Mask okay je, quality okay tapi tak try lagi",_
cepat betul sampaii,_
Kasut ni agak kecik,_
Item: Anya Keychain,_
I was charged twice and was told it was a pre authorization charge,_
But overall is good product with the price,_
Aplilasinya bagus sekali Hayok,_
utk yg xpenah pakai mesin jahit sblm2 ni mmg sgt sgt membantu,_
Quality video cukup untuk nampak apa berlaku,_
The product is good and the price is great,_
Love the shoes and clothes,_
bought black ver here also!,_
This is something that I need to address,_
The olive oil bestolio is my repeat order,_
Seller siap bg freegift yang cute,_
Tapi still puas hati sebab bowl ramen tak kemik dan dapat free gift & chopstick,_
Effectiveness:cantikkkkkkk suka gila hahaha beli untuk adik sebenarnya,_
Delivery 2days arrived to JB,_
kadang2 i pakai 39,_
Hello aap es phone ka giveaway kar dijiye,_
Bau memang kuat & sedap,_
Alhamdulillah da sampai baju saya,_
beli dkt adik,_
and nak try yang ni since ramai kata best,_
Penghantaran pantas sorry gambar dan video tiada kena mengena,_
"Woods, who made the cut with a shot to spare, could not find much of a spark on the fast greens at TPC Harding Park where he mixed four bogeys with a pair of late birdies for a two-over-par 72 that left him at two over on the week",_
Kasut cantik berbalai beli,_
Design:nemo,_
sebab mcm agak nipis,_
Woiii,_
Item very fadt delivered the next day,_
memudahkan ibu2 yee,_
tsalah beli colour sama plk,_
TQSM seller n shopeeeeeeeeeeeeeeeeeeeee,_
klu bhajat nk trun berat bdn InsyaAllah,_
", Tencent Music Entertainment Group and Pinduoduo Inc",_
Tak sabar nak guna jogging,_
Wonderful review as always Sam!,_
Tq barang sudah sampai,_
Warna Green Mint yang sangat cantik dan keadaannya sangat memuaskan hati,_
Buying in 11,_
Done beli baru yg lama dah jahanam barang okay good quality,_
"However, Diego Simeone's team returned from the break much more determined and halved the deficit shortly after the hour mark when substitute Matheus Cunha scored from a rebound following a corner kick",_
My weight 68kg and height 168 size Xxl dah okayy sbb beli satu 3xl satu 2xl,_
Ambk msa juga nk psang,_
tp ade missing item,_
"Been using pureen Product for quite sometime, value for money",_
Payment was made online and payment was deducted from the account but kfc unable to proceed my order,_
2 hari sudah sampaii huhaiiiiiiiiiiii,_
It is still acceptable,_
"dress dia okay je, saya 150cm 42kg pakai ngam ii",_
Root has been publicly outspoken about the deficiencies of both his bowlers and batsmen over the series and said the squad had to accept they were clearly second best on this tour,_
Murah & so lawaaaa!,_
Quality:bulb dah sampai,_
klau berkesan insyAllah reprt order nt tq saler 🤩,_
Kena bnyk bersabar kalau beli barang pre-order ni,_
Terima kasih nnt repeat order lagi,_
Ngam dengan dia,_
"gmba n vdeo tkde kena mengena , haha tak tahu nk ckp mcm mna , tapi takpe lah sbb murah kan",_
Received the correct item in good bubble packaging,_
loojing forward to buy more from this seller,_
99 sen,_
Please i want this One Plus Nord 2 5g for my online class,_
"Mistake dekat Fuse tap pula xngam dengan fuse kereta,kereta pakai yg Mini micro jadi xdapat pakai",_
This is the packaging for my gf at jb and it was delivered on the same day,_
buku pun cun,_
Iain jersi nipis sgt²,_
Taste:rasa manis tu ada sedappp,_
"Cantik wei kasut ni, belilahhh🥰 yang paling aku respect seller ni tengah hari aku payment, petang dia dah post‍",_
Recommended seller🫰boleh repeat order lagi,_
Material:Elastic,_
alang² tgh offer,_
Handles are heavy enough which balances with the weight of the rope,_
sy beli ye saller,_
I may buy the same product again if there is promotion in the future,_
"sgt cepat dan pantas,",_
8 order,_
"got this as freegift, tq",_
But no free gift as promised by the seller,_
"cantikkk sangattt , hargaa murahhh sangatt , penghantarann sngatt lajuuu ,",_
Baru ada masa nak bg feeeback cantik2 next time boleh lock lagi,_
Tq free gift hair band,_
Very useful when the car battery not functioning,_
Saiz perlu tambah 1 rasanya utk lebih selesa,_
Great products I use them all the time but the tracksuit I just purchased cost me 5 pounds extra because I used the mobile app as it was out of stock online (pc ) and I don't get to choose the option of adding my grandsons name,_
Eu amo vocês,_
Nanti nk beli motor plak,_
Budget killer&quot,_
Dlm live ckp sikit je kotor dia,_
Xphm betul,_
"Young teens shouldn't be on social media, but parents allow, Stamos tweeted",_
Hi received in a good condiiton,_
3 times I make online payment and I didn't get my orders,_
courier service hantar salah bukti,_
Maaf pic dan video tak da kena mengena,_
dh lh sekejap je internet abis !,_
Dekat saya Still besar jugak sikit,_
berbaloi beli utk anak,_
pray for pahang,_
Csn also be used with smartphones if you opened up the base as it has a phone clip,_
baca review orang kata dapat beg untuk simpan kalo beli 6,_
"But before they could reach him, Abu Ibrahim al-Hashemi al-Quraishi detonated a suicide bomb, triggering a large explosion that blew mangled bodies -- including his own -- out of the building into the streets outside",_
Magnet dia ok semua ok,_
Hehehe nak beli brownies bite $MENTION$ / kucate $MENTION$ boleh cari saya kat ig,_
Pastu delivery pun laju,_
"Anyway, terbaik seller",_
tiptop packaging seller ni,_
Ive saved many items on the wishlist and all of them disappeared,_
Smooth je guna dekat 1c,_
Not the first time purchasing household items from them but this recent purchase was definitely disappointing,_
Nice packaging and value of money,_
Sorry the photo,_
Overall I'm very satisfied with this purchase,_
yg ni takde masalah,_
Tq Seller for your service,_
n budak2 pun selesa bile pakai,_
jelas tiptop,_
"the material also nice,like it",_
Love L'Oreal,_
Touge !,_
"Fast delivery, receive it in good condition",_
mang servis terbaik,_
Thank you for the free Huawei gift,_
tak marah pun kalau awak jujur,_
Anak2 dan org tua,_
Jarang jumpa kain begini ssejuk jdi kalau jumpa dak boleh dilepaskan tqtq,_
Will surely buy another unit from here,_
Oldest stock exp dec 2022,_
Cantikk wehhhhhin love terukss,_
"So far ok , penghantaran cepat",_
Didn't expect it will be like this XD,_
"Manusia dapat memanfaatkan sumber air bersih ini untuk membuat kerja-kerja harian seperti membasuh baju,mandi,membekal minuman dan sebagainya",_
Very Satisfied With My First Time Experience,_
Adik beradik pun pakai kasut yang sama,_
Whats happening to pinned loc?,_
"Pembalutan baik, barang datang dengan selamat, akan beli lagi!",_
Taste:God,_
Kindly fix your system,_
Alhamdulillah selamat sampai Alhamdulillah selamat sampai Alhamdulillah selamat sampai Alhamdulillah selamat sampai Alhamdulillah selamat sampai Alhamdulillah selamat sampai Alhamdulillah selamat sampai,_
Tq for the voucher dqn free gift,_
"Nice nice servis laju, seller ada ajar cara macam mna nak backup account kalau tetiba acc take down, rajin2 la baca instruction ya anak2 Demi mahasiswa yang berkualiti🤝",_
Very good for the value,_
Functionality:boh baju la apa lgi,_
"ni ngam2,terbaikkkk,terbaikkkkkkkkkkkkkkkkkkkkkkkkkkkkkkkkkkkkkkkkkkkkkkkkkkkkkkkkkkkkkkkkkkkkkkkkkkkkkkkkkkkkkkkkkkkkkkkkk",_
"oke je cantik, sye dapat warna pink lawaaaaaa",_
"Product quality is good, price of course is good",_
NAMJOON LOOKS SO FINE MXBSJSKNDBJSNBCJAMDBCJNSBF,_
Bug ga jls,_
kalu nama dpt dua belah lg cun,_
Pigment:kenapa Ada 3 Saye Pesan 4,_
seller paling pantas pos barang,_
Please advise ASAP,_
"But good product, delivery packing is good with cartoon box",_
Brg smpai dgn slamat by shopee express wlaupn agak lmbat smua part ckop n hrga pn berbaloi,_
"The price is affordable,",_
"saya sukaaa ,",_
boleh order lagi saiz mmg muat dlm air fryer,_
Best cards ever,_
"Good phone casing, value for money, so buy few more for exchange",_
bolehlah nak bawak laptop,_
"boleh lah guys berpatutan lah dengan harga nya guys, dok tahan lama pung",_
Skin Suitability:Sesuai dengan kulit,_
Wowowoeoeoeoeowowowowowowowowowkwkwkekekeowowowoekekeke,_
"Barang dah smpai dgn selamat ah mcm tu, cute jer First time order harap okylah pakai klw oky repeat balik",_
"Alhamdulillah sampai dah , 2pcs seperti kita lock , nanti cuci balik memang cantik , material pon okay , mekasih seller dan abg delivery :) semoga murah rezeki selalu ya",_
"Rodgers said he enjoyed a close relationship with Tielemans, who has six goals and three assists across all competitions this season",_
The sponge is soft and blending well,_
Sebab tudung ni pendek ja,_
"Packing cpt, jnt pun pantas",_
Effectiveness:sabun dy wangi sangat,_
Hamdok has demanded the release of top civilians and a return to the transition that began after the ousting of autocrat Omar al-Bashir in 2019,_
Beli bnyak senang nak simpan brg,_
memang sebiji dalam gambar,_
Suggested to buy,_
Ada patah sikit dekat tempat letak cawan tu tapi yang lain ok,_
Kenapa sih setiap di perbaharui selalu ada aja erornya ngga ngerti dech,_
Dan di mudah kan rejekinya,_
Double A battery given,_
serap peluhh,_
Soften the clithes,_
Pape pn tiptop,_
Arrived in good!,_
PANTAS BUAT KEJE,_
H 164,_
Minimum 3 pax order tuk luar kawasan Manjoi,_
"56, manakala Indeks FBM Emas Syariah meningkat 23",_
So far oke je,_
finally mediatek is taking charge $MENTION$,_
SAYA SUKA!,_
"Order 9/9, harini 14hb sampai",_
Teh Halia is superb,_
Nice wehh comel tak berat beliiiiii jangab tak beliiiiiiii,_
mural &quot,_
"But despite this, the Malaysian bowling team still gave an outstanding performance by taking in two golds and two silvers",_
Tqqtqtq maaf gambar takda,_
The time taken for the package to arrive was really fast,_
"Semua okay, Semua okay, Semua okay, Semua okay, Semua okay, Semua okay,",_
apple is stingy,_
Murah je tak sampai rm10,_
definitely will purchase from seller again,_
Semua ok seluar panjang jenis bawah lutut,_
Berbaloi lah dengan harga 🫶 Very fast delivery hehe suka suka,_
"order semalam, petang harini dah sampai",_
",penghantaran sgt pantas, kain agak nipis tapi berpatutan dengan harga",_
received in packing goodfast deliverythank you seller,_
"Barang dah sampai, baguslah boleh dipakai dengan baik,",_
Thank you seller for the superb service,_
Ok mmg serius terbaik giler selipar ni,_
Saya nggak pernah order apapun di grab,_
Nice & good quality products !,_
Items are well packed & expiry pn lmbt lg,_
Bagus baik,_
Pesanan saya sudah diterima,_
The fabrics are smooth & skin-friendly,_
takpe saya harap dpt guna pada kejadian yg dperlukan nnt,_
TQ SELLERRRRRR BAJU CANTIKKKK BANYAK KALI DAH REPEAT,_
BRG dh sapi tebal 50pcs ok,_
Taste:not yet open,_
"Fast delivery, nice packaging and good quality product",_
Seller lewat hantar keluar barang,_
Item : 5 stars (but I just realised I accidentally bought the sealed one but hm okay la nvm my fault,_
alhamdulillah barang order 11,_
received semuanya seperti yang telah diorder,_
tidak sempat gambar sebab sudah hadiahkan dengan ibu sempena hari jadinya,_
I am able to log in the app now,_
brg smpi seperti dalam gambar,_
