Sentence,Tagged_Sentence
Expire in 06/31,_
Functionality:Tulis 100kg tapi yang smapi x sampai baru 50kg,_
Nhiều cái lỗi vớ vẩn trên app định góp ý mà thôi không thích nên mặc kệ bạn!,_
So better avoid seller mcm ni,_
Good materials and gonna buy again from this store,_
Sbb tu sepah sikit huhu,_
the material of the boots was not too thick or thin,_
"ahhh,",_
Took 1 day arrive real fast,_
Makmal Academia Sinica mempunyai tahap keselamatan bio-keselamatan kedua tertinggi manakala kes tempatan terakhir yang disahkan di Taiwan adalah pada 5 November lalu,_
Absolutely in love with their Pan Mee!,_
"Bought it during 10/10 promotion, never use before, just to have a try",_
Iniesta did not immediately respond to a request for comment from Reuters sent via Twitter,_
The Main Market volume slipped to 3,_
The packing is acceptable but have one or two packs of noodles are a little broken,_
Try beli sikit dulu and wangiii nanti boleh repeat lagi bau lain nanti cuma bau dia tu tak tahan lama sangat padanlah dengan harga thank you seller,_
Serious kasut bundle dari hawzbundle memang berkualiti dan selesa dipakai,_
addition: cooking eggs directly using spices can reduce the protein of the egg,_
Tq mudahkan journey saya menutup aurat,_
"Over the decade, the security situation in the Mekong River basin has improved significantly and remains largely stable, according to the department",_
"It will timely eliminate black spots in traffic accidents to cut traffic accidents by between 5 and 10 percent per year in terms of cases, number of deaths and injuries, local media Vietnam News cited the program by Hanoi People's Council as reporting on Friday",_
-Harga yg sgt berpatutan & mampu beli,_
Baby dah selamat dilahirkan alhamdulillah syukur pada mu ya allah,_
blom pasang lagi moga bleh bertahan lama,_
Pleasant transaction and highly recommended seller,_
This one can't comment much as i haven't cook for it,_
Hope this simple explanation helps,_
"The virus is ravaging several sectors of public life, including theatres",_
Edited: I am so impressed with the service,_
"puas hati dapat sebab takde crease, takde terlipat",_
so sy normally saiz 37 ambik saiz 38 ngam terletak tak sempit,_
Coverage:Jgn beharap lebih,_
murah+cantik,_
low price nga low quality naman madaling mag hang sa gaming,_
Expiry is longer until Feb 2022 however seller forgotten to include extra pack for me the the previous order error,_
Thank you so much seller yang cute yang baik hati sangat2 suka goda dengan barangan yang cute buat i jatuh hati,_
waaa tq cantik sgt bju ni kain pun x panas,_
It would be interesting to see the watch,_
Senang nak buat video,_
buku tak de kemek apa² pun,_
"Received in good condition,third time buy from this seller",_
Bola ini sgt membantu ibu mengandung,_
"Super fast delivery, items received in good condition",_
cantik jew kain sejuk,_
Admin nk inform good news,_
Baju tu tak baggy pon actually eventho dag beli saiz yg plg besar,_
s sooo beautiful I love the unboxing $MENTION$,_
brg dlm keadaan baik dan cantik sgt2,_
Originally sandisk mmc,_
short expiry,_
Tak boleh guna pon bazir je beli,_
Tudung utk cust smua ok,_
"Okie selesa , kain dia macam tudung sekolah agama saya time darjah 1",_
ok la sesuai utk 1-2 tahun,_
The note and bookmark were cute too!,_
Burger benjo* + *Air kotak/ Air mineral*,_
Sempoi ahhhhh,_
Barang sudah sampai dengan selamat tq seller jam tangan nya sangat cantik puas hati beli nya 🥰🥰🥰🥰,_
Barang dah sampai trimksih,_
Quality:material gurl,_
beli byk sbb nak bagi kat org,_
sabar je la labu labi laba labo,_
tulis dpt free coke bottle dpt cup apa benda,_
cotton tebal,_
Semoga berkesan la dkt diri ni,_
"received quite fast, less than 48 hrs i think",_
"Nice product, fast delivery, good quality, product arrive as shown",_
sekli bli 5 botoi,_
Mudah je lepas tangan,_
They can be dressy or casual,_
boleh buat sukan kat sekolah,_
Good tapi sala colour,_
"Kain dia sedap pakai, tak tebal dan tak nipis",_
dah beli sbelum ni memang ok,_
Brg diterima dlm keadaan baik dan kemas,_
Size/Perfect Fit:ngam ngn apa y di order,_
so repeat order again~so mean its good enough for me🤭,_
layanan penjual sangat sangat baik,_
Material was good and size shirt fit well with my hubby,_
OKOKOKOKOKOKOKOKOO WORTH BELI BI NYAH APA LAGI TGK COMMENT BELI LAAAA WOI LAGI MURAH DARI JALAN TAR NYAH AJSJWUDHWIXKWNIXKWKZNCJDKD,_
Thanks to seller,_
Nak ape lagi?,_
so that delivery times doesn't take so long periods to arrived,_
Nice quality thank you for your prideeeee the same time as well as the math and science,_
Semua cantik2 belaka,_
"Cute, comfortable to hold, and strong wind",_
Ngam ii je pakai,_
t=11m39s> moment bizzare (aneh),_
kain jenis lembut dan serap peluh,_
jalah kat dalam seluar pon tk elok,_
And what about the Pixel 4a or 5?,_
Expiring april 2023,_
penghantaran yg super cepatsangat berpuas hati,_
Best before 30 Sep 2022,_
Need to wear for a few times to know the quality,_
"good seller, good product for quality",_
nanti nak repeat untuk myvi pulak,_
Functionality:Functionnya untuk mendapatkan tidur yang berkualiti,_
"BUT BUT BUT it seems quite alot small pieces one, but ok la, just accept",_
Terbaik anak anak suka main barang dari jauh tapi cepat juga sampai dan murah,_
good for packing clothes,_
Penghantaran dan pembungkusan tip top,_
Items received in great conditions,_
Amek masa 4 hari je weyh,_
Boleh lah Boleh lah,_
"Woi grab katanya bangkrut ya, aduuuuh gimana si bisa bangkrut, banyakin promo dong sama manjain customer nya, biar ga bangkrut pokonya promo banyakin",_
Baju cantik dan warna jgk menarik,_
beli tuk office ni,_
My new fave bag!,_
seller pantas gilaa,_
Senang & mudah nak bawa ke mana2 x susah kan orang lain suruh ambilkan,_
cume spoil kt delivery,_
Will biy again next times,_
Kibo Wa Odoru Oyamashima,_
Effectiveness:semua brg order cukup,_
"Selain itu, Seksyen 29A SICDA menetapkan semua urus niaga sekuriti hanya boleh dilakukan oleh pemilik manfaat sekuriti atau penama dibenarkan",_
lain kali Sy repeat Oder LG,_
Products received are all in good condition,_
Puas hati seluar,_
The shou wu taste is stronger,_
semua barang cukup dan tak rosak,_
alhamdulilah dah sampai tudung nya selesa dan dalam keadaan baik,_
Cuma seluar blue saiz 36 labuh sikit,_
colour also same as being advertised,_
harap boleh hilang calar kat kereta,_
Dgn spec yg bagus,_
This is my daily wake up drink since uni days (and to keep me staying up at late nights),_
"anak suka,mudah nak membaca",_
Memang bli kt awk je lps ni,_
Barang dah sampai cepat dan pantas Peking pon kemas tq tq tq,_
YOU KEEP ON INCREASING YIUR DELIVERY FEE RATES,_
"Item received in good conditions, sesuai dengan harga",_
I believe I can touch the sky,_
watch me win - $MENTION$,_
even ada calar sikit dekat tali (calar yg boleh dimaafkan) but padan la dengan harga 🥰 packaging pun secure,_
corak x seperti yg digambarkan,_
Comfortability:satisfy,_
habis nanti bole beli lgi murah sangat2,_
tq cikk seller,_
haqap2 coklat sedap la,_
During sales,_
This was a good buy!,_
"hi already received my order in good condition thankyou,",_
btw produk tmpt letak phone in bagus,_
"beli color hitam sebb sekolh x boleh pkai color2, Hitam biru Putih je",_
"Don't open the buttons when wearing it, the button's hole will be spoilt",_
Quality:original maggi,_
Pos mai tggai brg mcm tu ja dpn rumah,_
tapi nipis je kertas nie,_
Bought during sale !,_
Baby menghitung hari nak keluar dari perut mummy die ni,_
I found a bit 'burned' taste in the coffee,_
Senang nak connect pada laptop,_
The camera is 720p,_
Item barangan yang dipesan telah selamat sampai dalam keadaan baik,_
Tebal giler seller balut bubble wrap+kotak,_
Item good quality definitely worth the price,_
"The allegations put Peru's Cabinet at fresh risk of failing to earn a confidence vote from Congress, with some parties saying they would vote against him",_
"walaupun guna cod,brg sampai cept",_
smpai ja order pertama trus cuba dan trus order plak,_
P/s bawah tin jer kembung,_
Anakku detergent really friendly with my baby,_
Belum guna lagi harap harap anak suka,_
mntk maaf bebyk gambar xda kena mgena Kerna pos kpd org tua ibu d kg,_
seller mudah base senang kira bak hang,_
i want try,_
Ni dah kali 2,_
Love it even not use it yet,_
Ordered on Sunday and received it on the following Sunday,_
tqtqtqtqtqtqtqtqtqtqtqtqtqtqtqtqtqtqtqtqtqtqtqtqtqtqtqtqtqtq saller,_
merah makngah uoolss,_
barang dah smpaii thnkyouuuu,_
mmg easy harga pun berpatutan,_
Material:comfort,_
Yang ni okay ah kot,_
"at least seller bungkus la dgn kertas,takda nampak barang",_
sory bos,_
"the quality is good,i expect it to be thin plastic",_
bkn x mampu tp x brpa mint bab kasut so xnk la spend,_
seller handled it well,_
"At least five major hospitals in Metro Manila that are already running at full capacity have to quarantine infected frontliners and couldn't accept more patients, Duterte said",_
"Tq saller barang selamat sampai, esok kita pasang",_
Smpai jugk Kurier yg lmbat,_
My twitter: $MENTION$ kumar Edit: I can&$HASHTAG$,_
11 dh smpai dulu kita beli lagi awal tak smpai lagi kan hahaha,_
Fast reply on messages,_
Taste:rasa sedap sangat la,_
Will defo buy again,_
Well until there is a power outage,_
Sure Will Buy More Once Finished,_
Local bag with excellent quality,_
Btw 164cm 65kg suit me well with XXL,_
"Before he called off his protest on Friday, Fichot was visited by a group of 10 ambassadors from EU countries, who expressed support for his cause",_
beg nya sama dalam gamba,_
nanti bole repeat beli lagi barang kat kedai ni🤗,_
Lets Go butter 500M&quot,_
Went for a 90min walk and lost 1,_
this toploader can bend if you put a bit force,_
sesuai untuk uniform pdrm,_
sepatutnya iklan menjual dashcam dgn kad SD memory hendaklah di asingkan,_
2nd time purchase red dates from seller,_
Absorption:Senang menyerap,_
I've made the right choice to purchase from this seller,_
Duduk di rumah kalau x da keperluan,_
App keeps crashing when I haven't even browse for 5 mins,_
"Good product, can always refer to the YouTube or the shopee page to see how the installation is done",_
"Initially available only in Australia, the in-app coins can be acquired as users remain active on the platform or keep their profiles up to date",_
Box dented luckily toothpaste unaffected,_
Mmg cantik2 brg nyee,_
"Hiii seller,",_
"Kim has used previous speeches around the New Year to make major policy announcements, including launching significant diplomatic engagements with South Korea and the United States",_
Ada cable utk powerbank,_
Dilip sarkar beli lalah kasi orang lain apa ni sarkar?,_
dia susah masuk bhgian punggung masa nk pakai tu je,_
There is so much happening,_
Gambr tkde kaitan,_
Dah repeat order 2 times,_
Exoired date on 2022,_
walhal status still kat dhl,_
2 out of 10),_
Texture:bahan2 simple,_
super value price for the quality!,_
"Although last time is 15inch shoulder, this one blouse, shoulder 16",_
diri aq,_
okay la kain nipis tak tebal mana anak kecik boleh amik size ni,_
Tapi masih puas hati guna storage ni untuk letak pakaian,_
"harga tak padan dengan kain sebab apa tau, harga berbaloi kain tebal gila warna nude pun tak nmpak jarang",_
Annabelle Chek,_
Ringan material kainnya,_
Would buy other items from this store again,_
Snuggled well between each other so no damage had been seen,_
"Haven't test it on pools tho, so idk how good it deals with fog/vapour build up",_
Harga pun berpatutan kain tkde la tebal sgt tpi ngam2 okey and selesa sgt2 penghantaran pun laju ‼,_
Penghantaran kemas serta laju mcm pakai turbo memang bijak betol,_
"Barang sampai dengn selamat, penghantaran ok",_
Quality:Very good quality at chepest price,_
So bila pakai macam lembik sikit,_
saya lihat suami pandai melayan anak-anak dan menerima mereka seadanya,_
"Design ok overall, kulit shiny2 ala2 kasut kulit",_
ni br ade ms nak bag feedback,_
tapi kawan saya okay jee,_
its very good,_
need to work neat abit,_
Seller courier out the items very fast and hoping that the taste is as good as pilah's one,_
"Fast delivery, good packaging, good value for product",_
RM35 (READY STOK),_
"barang terima hari ni,5",_
8)Daim,_
"So, faham",_
Marry ann,_
"Sy ada beli 5 lg brg lain dari shopee, tp yg lain guna Shopee Express mmg berjanggut lah nak tgu sampai",_
"COMEL TERUKS CANTIK PULA TU MATERIAL DIA YA ALLAH MCM BEG MAHAL , MASA 7",_
Tapi quality kurang baik tp OK la,_
It follows accordingly to the policy next day shipping,_
Dah sampai kali ke brapa order mmg padu laju kew pos,_
Btw size 36 agak besar tapi tu je size paling kecil yang ada,_
"but i still dont get a hanteo qr code, sad :( the pcs are all cute and i got namjoon 🥺 !",_
"Jika penilaian risiko KKM menunjukkan risiko sesebuah negara itu sudah meningkat, kita akan meletakkan negara berkenaan sebagai senarai merah dan mungkin sekatan dibuat",_
Terbaik seller harga berpatutan dan murah pembungkusan pun kemas quality barang pun ok tq very much,_
condition semua 10/10 beli la everyone tak rugi pun hehehehehehehehehheebhehehe beli tau,_
saya tetap nak minum sebab KHASIAT,_
dah repeat kali ketiga baby wipes ni,_
berbaloi Dan recommended,_
"Walaupun tiada bubble wrap, dalam kotak je semua",_
Ada bubble wrap lagi,_
CES organisers encouraged but did not require attendees to get tested for Covid-19 before arriving,_
Barang dah sampai dalam keadaan baik waknat mantap pak abu,_
nnti sye shoping lagi yer,_
tapi delivery speed is ok je,_
Tak sangka beli dengan harga murah pon dapat warna yg sangat cantik,_
Tapi boleh la dengan harga tu,_
But anyway the product works well,_
Penghantaran yg sgt2 laju wlpn dr ke malaysia dlm masa 5 hari dh sampai wlpn murah tp function tiptop sgt2 berbaloi beli,_
Sory la weiii gmbar lain vdeo pon lain,_
"It is good enough with the price listed, hopefully you will get a blessing fortune",_
apa pun be careful next time,_
cheap price but really worth my money!,_
Alhamdulillah received elok and dia suka sgt,_
tekan2 je barang sampai,_
Sangat recommended utk ada for those yang nak design in eurocode,_
",guna zip lock beg setiap 1",_
"As on 8am (local time) Saturday, 26,273 deaths related to novel coronavirus have been recorded in the country, reads information released by the ministry",_
"I ordered the white one, but instead they sending me the black one",_
"seller cept jnt pn cepat ,ssngt puas ati recoment seller n brg ni,dah cuba ok sngt harap tahan lama",_
semua ok dan terbaik,_
kli kedua rpeat ngan seller ni puas hati sangat,_
tq 🤭,_
nampak la mata kasar,_
"Saiz 17,19,24",_
Size dia tak besar sangat tak kecil sangat and tali dia okay la tak pendek sangat overalll cun delivery cepat hari ni order semalam sampai,_
tgk kesa,_
kuning mmg cntik colour dia mcm bumble bee,_
"Sadly,not the colour that i ordered",_
Tak melekat bila pakai mask!,_
"Mula2 ingat rosak, rupa2nya lepas chat seller kena tanggal sticker",_
"This is my second time order to this shop, the seller is very friendly fast response and mostly the fabric is thick and comfortable to wear my son and my husband",_
Sampai dah barang sampai dengan selamat xde pecah,_
"Penghantaran super fast,very convenient rack just buka lipatan & lock",_
"Ini antara keluhan yang kerap diterima terutama daripada nelayan setempat sehingga menjejaskan pendapatan sara hidup mereka, katanya",_
The belt wrapped with plastic,_
"I clicked for the title comments, but stayed for the food",_
Nak try bbw atau vs mist yang baru tapi x nak beli full bottle?,_
nmpak mcm design org2 tua,_
my/epostNovel88Jun22,_
"Good packaging, fast deliver, just took 2 days to arrive",_
This video and photos not related but it is fast deliveryyy and i received the item in a good condition,_
Terbaik terbaik tq seller🤗,_
Aries,_
Terima kasih seller dan j&t ekspress,_
Sy buat mandi utk kesihatan bknnya utk brpantang,_
maaf gambar xde kaitan🤭,_
Quality:nipis tapi tak bocor,_
kain dia lawaaaa,_
uv x tau knp dia lekat kan kat plastik filter,_
My stomach can not resist,_
Items arrived safely in bubble wrap and wrapper,_
Seller postout pada hari yg sama payment dibuat,_
"order hrini, chat seller mintak hntr hrini jgk sbb nk guna brg urgent",_
Received within 2 -3 days,_
"It provides an opportunity to learn from the past to create a better future, the company said",_
kasut selamat sampai ke destinasi,_
Beli utk letak dlm kereta,_
Please contact me immediately and have that money refunded at once!,_
Penghantaran agak lambat to overall semua okay,_
Hope can get more protection for noodle,_
"Buku masih cantik, takde kuning atau kotor",_
klw g' di update g' bisa di pakai,_
terrrrbbbbbbaaaaikkkkk,_
dah sampai tapi kain nipis ye kena pakai bra atau inner kat dalam kalau tak sedikit free show especially yang warna muda macam soft pink tu ke apa,_
"Comell, sy beli utk guna kat matriks XD hopefully xmudah luntur, sy try basahkan dgn air hritu, wrna biru xluntur pun, baca review Ada yg repeat 2x means okla kain dia, mantap thanks seller",_
Mungkin ada kesilapan,_
"78, a first since 1990, the year of the stock market crash which had ushered in a lost decade, a banking crisis and years of deflation and weak domestic demand from which Japan has yet to recover",_
This heel suits me so well,_
"Order smlm,hri ni trus sampai",_
Functionality:rimas pulak tali byk rasa berbelit,_
"Bought on 25/3/22, get the on 3/4/22",_
Harap okay la nak gunakan,_
Kain sedap 100 cotton,_
"penghantaran yg cpt, mmbuat pesanan 17/9 18/9 dah sampai brg",_
Tq2 seller yg baik,_
Bau dia biasa ja,_
"i pull my bias la sia HQKSKAJAJAJJAJSJJAJAJ NEOMU HAPPY, thank you seller <333",_
Come with two layer of bubble wrap,_
"Penghantaran cepat, kasut cantik dan sampai dalam keadaan baik sebab ada kotak, kalau takde kotak tak tahula sebab dia takde bubble wrap, detailings dia kena la dengan harga,saiz I recommend ambik saiz asal kaki, cuma macam i punya saiz dah ngam tapi tali dia agak besar so dengan i agak longgar,",_
Nadie yo cuando me toca hacer la comida JAKSJSKSK,_
Penghtran pn mmg laju,_
Though takes a little bit longer due to courier services,_
"tq penghantaran cepat , kain elok sangt , selesa tatau nk cakp , harga sangat murah , bole beli lagi katkedai nie",_
Thumbs up ( sebijik macam dalam gambar ),_
Penghantaran dr Seller & ninja van pn laju,_
But took quite a while to get connected,_
"lembut pijak zuppp masuk dlm kakinya,HILANGGG KAKI NYAAA",_
Miss this so much and the roasted duct too,_
"Bloomberg While bitcoin showed strength in 2021, we've seen a constant stream of capital trickling down into altcoins, the research firm wrote in a note",_
Would love to see a review of the poco f3 gt or a comparison video between OnePlus Nord 2 and poco f3 gt $MENTION$,_
Saya dah terima produk dari tuan,_
terimakasiih,_
Cleaning Effect:Rambu kurang gugur,_
100 Authentic Guarantee,_
Children sizes,_
tak yah gosok,_
price more cheaper than other,_
s see if im the lucky one $MENTION$,_
Alhamdulillah telekung dah selamat sampai 🤗🤗 awal dari tarikh yg di jangka kan,_
saja simpan buat koleksi kasut,_
Sorry i give 3 stars only,_
5++ macam tu and 37 fits me well,_
Material superb!,_
utk height 14+ pakai dia paras bawah lutut cmtu,_
last year rose by a quarter to $96,_
"Pos cpt, friendly and i like it",_
BARANG SANGAT BERKUALITI DAN SEPADAN DENGAN HARGA,_
He said only Putrajaya (Rt 1,_
"Skirt cantik, material skirt okay, harga murah dan memang berbaloi beli",_
Kain tebal n cantikkk,_
Btw thank you very much,_
Memang terbaik benda boleh repeat selalu bankin dulu waknarttt,_
Belum cuba lg tp harap oklah,_
penghantaran cpt banget,_
t wait for the v live Jin,_
"Clear ink, the binding is excellent only took 3 days to arrive from payment",_
Ni kali ke dua repeat beli,_
"Kadang tk baik , air tak dpt",_
Barang dah sampai cepat bungkusan elok,_
thank you for good protection and delivery,_
bnyk ruang untuk org yg bnyk card tu🤣🤣ahahahhaah sya beli tpi mak pulak yg minatnya so bgi kt mak lahmak pon cakap cantik,_
tak sabar nk buat patch test,_
lepah pada tu,_
Seller hear me by free 2 small pack of different taste Chek Hup,_
Ok for fake sandisk,_
Sebelum ni beli dgn seller lain but sme brang pupici,_
Barang sampai dengan ok thank seller,_
kucingnya dah menunggu je,_
semua item yg saya order cukup,_
"All you need in your life, is a woman who talk to you like she talk to the Pro Stand <a href=$URL$",_
x sabar nk pakai raya,_
"hmmm malas nak return, ambil jelah",_
Tak pernah lagi pecah ker apa,_
Thanks for the gift anyway,_
I found multi difficulties in ordering food,_
"Tak panas, kain lembut",_
Not everyone is doing fine,_
cantik jam nie,_
"Harga berpatutan, penghantaran yang sangat pantas",_
sesuai utk paperbag customer beli brg🤪,_
"Zynga has also found success through hyper-casual games with simple tasks and puzzles such as those made by Rollic, which Zynga acquired in 2020",_
Item diterima semua baik,_
Saya bagi 5 dan 5,_
cuma penghantaran terukk,_
🥰🥰🥰penghantaran cepat sgt,_
Cpt2 restok hat size L yo,_
"Taste:good, second time buying, thanks for the free gift , very fast delivery",_
Item received in good condition and timely,_
"Sementara itu, Guterres menegaskan bahawa tumpuan perlu diberi terhadap sains, fakta, dan hujah bagi menangani isu ketidakpercayaan dan perpecahan",_
dye coklat² cmtu warna dye ok laa,_
Overall good ya!,_
Brg Dibungkus dengan kemas,_
"Maaaaaaaaaannnnnnnttttaaappppp,",_
Lgipn ade saiz besar,_
"Seller is fast and responsive, got my guides fast and doesnt burden buyers at all , easy verification and hassle free!",_
Cantik seluar sangat cantik,_
Parcel received in good condition and good product quality!,_
Received the Sarawak Mee Kolo in good condition,_
"Good seller very fast respon, good service, thank you very much sellers",_
Meter LCD 5,_
and baju ni kene hujan cepat gila dia kering i love it so much boleh repeat lagi lepas nii,_
Barang dah sampaiTq seller1st time beli,_
Ingt beli time sale dpat cepat lambat,_
"Penghantaran baik, barang yg dapat dlm keadaan baik, tak ada beza seperti dlm gambar",_
Durability:Boleh guna lama sbb I jarang pakai eyelashes,_
Penghantaran sedikit perlahan kali ni,_
nothing can be seen on the screen,_
"Barang sampai keadaan baik, Pembukusan baik dah pasang kat motor",_
"All the talk beforehand was whether Tottenham's goalscoring talisman Kane, strongly linked with a big-money move to City, would be involved",_
As always super fast delivey by shopee supermarket n shopee delivery,_
harap2 sesuai laaaa,_
"kenangan malam minggu waktu jalan jalan , berdua jalan kaki saat turun hujan",_
"order grey color,label also grey colo,but seem is black color,what ever lah,can anti rain water proof ok edi",_
Saya suka sangat sangat mantaapplpppppppppppppppppppppol penghantaran pun lajuuuuuuuuuuu,_
Penghantaran cepat dan item diterima dalam keadaan baik,_
Barang diterima dlm keadaan baik & dibalut dengan kemas,_
Kualiti so far nampak ok sesuai dgn harga,_
Even though no response from the seller,_
Thankyou so much seller🤗will repeat again!,_
thanks anyway!,_
Okay la selesa je,_
baju cantik gila dan wangi lagi,_
Good service Thank you bagi free gift,_
Cantik gila hehehehehee kecik pun kecik,_
"walaupun lembut, rambut jadi terjuntai",_
terbaik2 getah rambut budak,_
Plus the seller give a small free gift too,_
Did not register?,_
Thats all that matters,_
Took me an hour & 150cal lost to assemble it,_
brg dh smpai cantikkk kaler dia pn cantik🥰 nnti boleh repeat lgi tq seller,_
Sbeloom raya smpai,_
supaya xketat,_
Awesome unboxing and review :),_
Xtahu kali keberapa beli kat kedai ni tp terbaik la,_
Cantik herlok,_
my/60195914590/,_
Penghantaran pom laju hehehe,_
Tp brg mmg terbaik senang nk bawa,_
"Delivery pantas nak mampuihhh, esoknya terus dapat",_
Kasam he aapko,_
- The use of straight cable instead of L shape,_
In love with colour & function so much!,_
Good product quality good vaule for money fast deivery good good,_
Good packaging good buyer good place to buy,_
GOLD DIA TU MEMANG LAWA,_
Banyak kali dah beli dengan zanzea ni kain bestmurah dan laju ja seller hanto,_
"Sampai cepat nye semua ok packaging ok dh try pun ok harap tahan lama ni beli untuk mak mesti mak Happy sebab dia memang nak chopee ni harga mampu milik warna merah suka nanti boleh beli untuk sendiri, terima kasih seller Shopee dan penghantaran",_
"We would buy a copy of the paper daily from a shop near our home, said Lim who is from Cheras, Kuala Lumpur",_
Kalau ada lebih bintang,_
The handbag is smaller than i imagined,_
Selesa pakai nya,_
We decided to use all our energy to walk in the flood water and rain to go to a petrol station located along the main road to ask for help,_
berat pun dah kurang 580g jer dr 600g,_
Kukuh utk menghalang anak kecil ke ruang dapur/toilet,_
Vivian Wong see,_
And taken,_
"Quality:mmg betbaloi dgn harga pasal color dia cantik, material mmg hampir mcm Ori",_
kasut sdp,_
alhamdulillah pantas,_
But for me tinggi 156 and berat 60 ambik M pon dah okey,_
buku cantik org cantikk semua cantik,_
Seller balut pun dah tebal,_
Thanks for nice packing Thank you seller for fast delivery and good service,_
"Themed, Rising Together As We Reimagine The Future: Evolution And Change Amidst The Covid-19 Era, Taylor's E-Summit focused on Malaysia's youth and future nation-builders to strengthen, resolve and renew optimism helping them realise their dreams",_
"Diogo Jota is already a fantastic player, the numbers speak for themselves, Liverpool defender Virgil van Dijk said",_
"Barang sampai dalam keadaan baik, packing padu terbaik seller, barang sampai cepat",_
"why digi is so slow like a turtle,",_
Received in good condition received in good condition thanks,_
Sticker utk projek ushwn dh smpiii Terima kasih memudahkan projek kami!,_
Plus the delivery was so fast,_
sumpah cantikkk sangat ngam2 kat badan tq zanzea,_
Size quite fit,_
Hilang diet bila dapat makan dgn nasi panas2,_
Quality:sampai dengan apa yang harapkan,_
TQ SO much,_
Quality:item mencukupi,_
penghantaran punnn sgt pantas thankiuuu seller,_
barng ok x d masalah,_
Quality:10/5,_
