Sentence,Tagged_Sentence
-tapak kasut ni tinggi so bagi effect tinggi,_
In-app purchase revenue is one of the most lucrative components of Apple's nearly US$70 billion-a-year services business,_
lgi nk ckp ape ek,_
kalau rasa best kta komen lg,_
12 seller terus pos brg,_
Tapi yang x canti tepi kain tiada jahitan nnti die akan keluar benang kain tu,_
"kualiti produk pun mcm ok, blm try guna lagi",_
Bought it during shocking sales and is worth of money,_
The condition of product is good after received,_
"siap ada kelajuan volume 1-5, Berbaloi sgt2 bli dgn seller, siap ada music n blh slow dan high kan volume",_
Seller post out laju delivery also considered fast,_
This time I bought 3 kgs again,_
"Lembut sangat, tak nipis, sejuk 100",_
Baju keja pon kena beli sendiri hahaha,_
TQ GRIMOOO,_
Keep asking reset the password but i already reset three times,_
Pum also function well but its must take long time to inflate also sound too loud like a vacuum machine,_
Beli tuk mak,_
Dah Kali kedua repeat sbb kain dia selesa,_
Saiz XXL (hello kitty & ice cream) mcm saiz M,_
"Seluar saiz ngam2 cantik terokkk, kain ok",_
"LIKE THEIR SITE TRY TO CONFUSED YOU & MAKE THEM EASY TO CHEAT THEIR USER MONEY IF PAY USING CREDIT/DEBIT CARD ,",_
Bajunya cantik2 semuanya tapi cuma kecewa x dapat corak daun,_
Lilac the size is perfect you just need to buy 1 size bigger than your original size,_
Ah Meaw,_
Murah Cantik sedap kain,_
Bru teringat sy dah ada tdung wrna lilac hmm,_
"She was furious, he recalled",_
"Wait till today, the seller said, because I hadn't received it yet",_
"The French never took their foot off the pedal after the break and soon increased their advantage with two quickfire goals from Benzema, who poked in the fourth from a Hernandez assist before Mbappe turned provider",_
"Its so cute and helpful to me cause i had to done my homework and my finger is swollen a lot ,thanks seller",_
Zip ketat skit x smooth,_
Nanti sy bagi feedback lepas racun rumput area rumah ni either berkesan or x,_
Palliative care aims to improve cancer patients' quality of life and provide relief from pain and any distressing symptoms,_
"Quite nice la mini skirt ni, kalau pakai baju senteng sikit bole la cover kan",_
com/morning-joe/watch/secretary-of-state-u-s-is-prepared-if-russia-does-not-choose-diplomacy-dialogue-130778181839 that Finland wanted to join NATO after Kremlin spokesperson Dmitry Peskov had told reporters on Wednesday that Russia would view Finland joining NATO as an instrument of confrontation,_
cantik jahitan pun kemas harga berpatutan,_
"It's been a difficult tour, but we stood up and found a way to get a result out of this game, said Root",_
ohhh i was so confused on why i kept hearing namjoon's voice and i realize he was by them,_
"Cuma time nk pakai tu dkt paha ketat sikit sbb paha besar,tapi boleh je masuk",_
Produk ok dan sangat puas hati,_
Cheap + cute + efficient,_
It's really thick and cute!,_
3âƒ£Products terbaik,_
seller lipat n packing brg kemas,_
thank you for the good service and good packaging!,_
Grab masa jualan hebat harga beli pun kdg nasib baik sen2 jee,_
"tanpa dawai, ada 4 cangkuk",_
mlem mlem,_
Items are in good packing and worth for price,_
$MENTION$ It's difficult to get some items shipped here,_
Nicely wrapped and well received,_
Customer unboxing parcel,_
All the items are good and had received it perfectly fine thank you so much seller,_
Parcel sampai hari isnin,_
Material:plastik tp tahan lama rasanya,_
Sh4heeen,_
Stay Safe ðŸ¦ ,_
lain kali akn shopping lg,_
Esok lusa saya beli lagi,_
Berat 62 kg tinggi 175 cm,_
"I can fit a MacBook 13inch laptop in the bag, but it is not big enough to fit the whole laptop",_
"Barang dah sampai, packaging pun kmas",_
"fast arrangement, good packing, received in good condition, fast delivery by Shopee Expree excellence service by seller",_
Material sejuk!,_
Its use also gives rise to fiscal contingent liabilities,_
", fast charging works really well,",_
"Topix returns have not come close to matching the exceptional Japanese earnings recovery, he added",_
Xtau la msk dlm air nnti tbuka ke x,_
kualiti barang tebaik,_
Bunyi ok sdp,_
Effectiveness:Dulu dapat dekat klinik je,_
The Covid-19 outbreak followed by the various phases of the movement control order have caused a significant drop in the number of blood donors in recent months,_
bungkusan pun okay boleh repeat lg lps nih,_
Buy for my office,_
my lower body part is bigger so L fits well,_
Happy shopping at your store,_
tahan lama mmg betul blh sampai 30mint okie boss,_
"Every month at least buy one pack from this seller , really worth to buy and good taste",_
Item sampai dengan selamat!,_
tpi klu nk pi riadah pun ok je bju tu,_
Packaging also good with a foam,_
sbb hntar sbagai hadiah utk kwn,_
"In England's second tier Championship, Saturday's matches between Reading and Luton Town and Millwall and Preston North End have been postponed because of cases of the coronavirus",_
Sampa anjing buang la tidak berguna juga digi macm anjing,_
Okay boleh la tp tilam nipis sgt,_
x dpt nak tampung berat handset,_
"We are not constrained in terms of ability to invest, in terms of capital, Rafalovsky said in an interview",_
Always repeating order from this seller,_
"10 Stars,",_
Will buy again if suitable,_
my/60164337083,_
OnePlus is a PLUS $MENTION$,_
sumpah recommended gile,_
Dah repeat dengan seller ni,_
"the shoe sole was peeling off a lil , but then i press it down a bit and it sticks back on",_
Gooodddddddddddddddddddddddddddddddd,_
Nothing to complain so far,_
fast deliverypromotion price is cheaperthanks seller,_
delivery cepat dalam 3-4 je then barang deliver dapat kotak kecik ingat kan dapat adapter je tak dapat wayar tapi nasib ade tapi tak try lagi and barang sampai dengan selamat &lepas dah try cable okey tapi tiba ii charger tak boleh berfungsi,_
"Really next day delivery so item was delivered super fast,",_
Quality:sesuai Untuk anak saya,_
Hope last very long hahaha,_
$MENTION$ Cheng,_
Bring me back from ios $MENTION$,_
Packaging sangat cun,_
Adehh,_
material pun selesa pakai berpatutan dengan harga,_
Will continue to support her,_
bungkusan pun sngat elok,_
mmg muat elok dgn botol Avent classic anak sy,_
No item damaged all well protected,_
rapuh,_
Super cheap so grab 10pcs on time,_
"Please review the snyder/soule swamp thing omnibus,",_
received:14/4,_
Terbaik lah seller and jnt purse pun cantik thankyou thankyou,_
"As for the fertiliser and methanol segment, revenue increased by RM1bil or 83 y-o-y to RM2",_
Material look ok & worth with price,_
"Tq seller, lepas sebulan tak tengok tv sebab arial rosak dulu",_
Effectiveness:Slow effectiveness,_
hari ni da smpai,_
It is a Damn good phone !,_
cheapest alsoo!,_
Gas safely arrived at my house,_
"minta seller install microsoft office, kena tambah RM50 tapi still murah dari kedai lain",_
"Nak lebih stabil, pasu berat bawah, ringan atas",_
I can only order via mobile payment or gcash,_
"Najib, 67, was found guilty of all seven charges involving criminal breach of trust (CBT), money laundering and abuse of power involving RM42 million in SRC International Sdn Bhd funds",_
Best juga terbaik,_
Cantik besar dan berbaloi dgn harga,_
ok tenkiu shopee,_
Sy lpaz ootd terus prelove ada yg minat ke wasap la sy 0136438510,_
Yeay free gift,_
beli untuk anak di hostel,_
berbaloi and puas hati,_
bajuu sangat cantikkk ngam ii !,_
Penghantaran yang sangat cepat barang dalam keadaan elok semua brg lacarrrr,_
Great video great recipe,_
Same product with what purchased at shop and save money,_
"In a decision two days later, board members said they had considered Smith's age at the time of the attack, the childhood abuse he described and his clean prison disciplinary record in granting release after more than 28 years and 10 previous denials",_
beli kat market mahal,_
Wuhuuuuu,_
skin tengah glowing pakai Yang murah fake ponya mau Naik tentara jerawatðŸ¤£,_
kotak kemek ckit kat bucu,_
Its ok and cool,_
"pastu tak mudah jatuh, metal type ni berat so sangat2 best la i really recommended sangat!",_
apaÂ² pun thkyou seller,_
"TOBACCO products kill over eight million people globally per year, most of them living in low- and middle-income countries",_
"Most importantly, think of your children",_
Selesa n cantikkkkk,_
No damge,_
Received the item with good pacakging,_
"Terbaik boss ku,puas hati baju sama seperti yang d inginkan cantik mantap,nanti pasti order lagi",_
C U M i L,_
paling penting takde kemek,_
isi dalam takde rosak juga,_
akan repeat lg dari shopper ni,_
Design:barang dh sampai,_
buat bersikan xde masalah,_
Durability:effective,_
Who else is watching yet cant afford it,_
Only one have a bit dented,_
At first kne fahamkan betul2 skru mana utk step mana,_
Tq seller barang dah sampai dalam kedaan baik dah selamat,_
"Ordered 9/25, received 9/28",_
barang sampai kotak pecah dlm perjalan proses kurier,_
"baju sumpah lawa,kain pon cantik",_
But it doesn't work well,_
Pasni boleh repeat lagi penghantaran laju 2 hari dah sampai,_
"Packaging ok je tapi ye la material pun cardboard beli pulak 1 je, mmg ada la kemik2 tu",_
Recommended by online blog,_
Seller post out laju tapi shopee express macam biasa lerr lambertt,_
material kainnya lembut dan nampak selesa,_
Klau ad 1 saiz ats ni mybe selesa,_
!penghantaran cepat dan cantik,_
Dah sampai seminggu skrg baru nak rate,_
Well packaged with bubble wrap although its a bit crushed but it's okay it can be eaten anyways,_
"Hello , i really need you to help me post this urgently",_
Overall kemek tapi takpe takde yg tumpah,_
padahal udah isi saldo ovo,_
Harap sesuai dan selesa bila digunakan,_
Design byk,_
tgh pujuk baby dia xnak jugak yang ni pun,_
"Brings stable positioning, can well work for game playing, personal study, office needs",_
Dah sampai bosskuuuu terima kasih ye,_
Fast delivery and good quality with 5 layers,_
Good prod quality,_
"Cuma ralat sbb shoppee boleh tersalah rumah, dan nasib baik orang yang terima tu jujur pulangkan balik",_
Cpt brg kluar n penghantaran laju,_
"The man got out of his car and went in front of the vehicle to check its condition, he said",_
packingnya lain,_
Baru bleh drive dgn penuh keyakinan,_
Puting sampai cukup kuantiti,_
"Beli 2 helai kedah dan selangor, sekali dapat selangor lengan pendek",_
I really like this wipes,_
Bang coba beli Demon slayer lagi tapi versi iblis bulan nya bang bisa gak,_
Cepat dan pengiriman nya juga tepat waktu,_
Material is soft though,_
"Quality is great, can order",_
thank u shope n shope express,_
risau banjir ni kan,_
That things ganna perform,_
"ingat ank patung barbe ke kaki boleh buat pasang kiri kanan,",_
Apa2 pun puas hti,_
This sum is the estimated savings required for basic subsidised healthcare needs in one's old age,_
"dm seller , seller diam",_
MG kualiti terbaik,_
Murah mudah berkesan,_
Brang smpai laju,_
Nonetheless total exports rose by 14,_
Old age love their oats,_
12/12 da sampai,_
5 sudu besar t,_
That screen corner is,_
Desmune How Wei Lym,_
Seller shipped out the parcel fast but shopee express took some time to deliver,_
Barang dah sampai barang elok,_
"barang sampai dalam keadaan baik ,setiap kali sy cht seller,fast je balas",_
"Overall are good, Seller is responsive on queries, considered a responsible Seller",_
mcm2 brg ada dkt momohouse,_
sorry gmbr tkd kaitan :),_
"Quality brg agak memuaskan,",_
I placed an order at pm and waited 2 hours in hunger for my order before they cancelled it at the last min,_
Thank you seller will order more thank you again for your service seller,_
"I order 50 pcs,but there's only 48pcs inside the package,seller need to be more careful with people's order, product quality is ok",_
sgt cepat 1hari je sampai,_
kena gam sendiri la nmpknyaa,_
Kemaih cendoi!,_
Dapt da thanks seller,_
"Kalau lima tahun lalu, tiada pertandingan enam penjuru, kali ini menyaksikan tujuh kerusi menyaksikan pertembungan sedemikian",_
Selamat sampai walau lama menunggu dari JNT,_
sesuai utk ibu menyusu,_
"fast delivery, good packaging, good value of product, get it at 25cents only",_
Penghantarn pon cepat perak to sabah,_
Cuma shopee express x express,_
Barang sampai dah ni ok sangat dah ni terima kasih boss,_
Thanks for having refill pack,_
"Overall is good, But M size is too big",_
elok ðŸ¥º,_
PASTU BOLEH MENTION PULAK WRONG LABEL,_
"Taste:Sedap gilaaaaa ,",_
gmbr dan video xda kaitan,_
Belajar matematik & mat,_
Yeay barang dah sampai n sampai lagi,_
Dapatkan akses PERCUMA ke iQiyi Standard VIP apabila anda melanggan ke Video Walla Plus iQiyi di *118*3*5*2$HASHTAG$ Tertakluk T&S,_
"Everything arrives safely,",_
"Nice packaging fast delivery 2day only SA TO KLT , sh!t i loved",_
Be A Winner and drive a brand-new Proton Persona home!,_
25/515/6,_
"memang mura, kain pun ok",_
"The instructions inside the apps always unclear, make customer confuse, especially for the subscription and promotions",_
Penghamtaran laju cepat terbaik,_
Item is in a good condition,_
Kain terlalu lekat pada badan,_
"*Before using, remove the battery plastic cover",_
"Delivery pantasss, cantik pulak tu senuanyaaaaaa",_
"It arrives in polystyrene box and the quality is outstanding, totally recommend",_
Dapat harga sales RM30 shj untuk bengkung,_
tak nampak ketat,_
But it transferred when I drink,_
Dah siap basuh untuk digunakan,_
all seriously good value,_
"Nampak sedapppppppp , cant wait to open it",_
Bhai aap itna jhaldi mobile kha se late ho,_
seller wrapped mmg excellent sgt,_
Really disgusting this digi Don't buy DIGI Internet package!,_
Apa pun tq dah sampai walaupun dah berakaq tunggu,_
There is someone special who will spend the rest of my life with me,_
Ng Yeow Meng Meng,_
Good product quality Good value for money Fast delivery and excellent service by seller,_
me hungry,_
My fourth time buying from shoppee mart,_
"Thankyou good product quality, yang pasti ori baru beli, thankyou",_
seronok dapat free gift,_
sya tak dapat ambil gambar,_
*******TERBAIK*********,_
Asal siap je huhu,_
But comellah,_
Design ni sgt selesa utk bernafas,_
Packaging xda rosak pa pe pda kotak 5,_
Gmbr dgn vid tkde kena mengena,_
Sir I am big fan $MENTION$,_
It came with a box and some plastic kat atas but not berbalut kat barang tu,_
Supt Aidi Sham said a post-mortem on the deceased showed that the cause of death was blunt trauma to the head,_
and i jumped in youtube to find a review,_
Kotak x yg kemek,_
Dh bnyk kali repeat kt sini,_
amik 1 size besar,_
"ST berharap pihak yang telah dibawa ke mahkamah serta didenda, tidak lagi mengulangi perbuatan mencuri elektrik dan kes dapat menjadi pengajaran kepada semua pihak supaya tidak mengusik meter elektrik pihak utiliti dengan niat untuk mengganggu bacaan bil elektrik daripada mencatat bacaan meter dengan betul, katanya",_
"Dr Wee said some of the basic necessities had been packed into boxes while 2,500 food packs were given to those in need",_
Tak lupa juga thank you pada courier service tolong hantar barang dengan selamat,_
This is my second purchase for this garnet,_
Tudung sngt best,_
Btw fast delivery sgt2 n seller baik sgt2,_
"Fast delivery, quality good, tq",_
Kalau xsesuai seller cakap xsesuai,_
Barang padu uuuuuu uuuuuuu uuuuuuu uuuuuu uuuuu uuuu uuuu uuuuu uuuuu uuuu uuuuu uuuuu uuuu uuuuu uuuu,_
Parcel came with simple packaging,_
HAHAHA FOOD PANDA NUMBER 1 AHHAHAHAHAH,_
"Good packaging,nice product, item received with good condition",_
brbaloi sgt beli,_
saya beli 12 packet = 1 kotak,_
Produk diterima dlm keadaan baik,_
"Rubbish, Rubbish, RUBBISH",_
Soft comfy flat heels,_
"Kami tertarik untuk mencari langkah yang berinovasi untuk menghasilkan karya selaras dengan arus dunia hiburan yang sentiasa berubah dengan pantas, kata Willimon dan Tappis dalam kenyataan diterbitkan THR",_
tuan dia suka sangat boleh beg baru,_
Its a bit pricey for bby bottle but!,_
Jam blum dpt di on lagi,_
:1,_
"However, police officials nonetheless charged the officers with multiple counts of misconduct, according to court records including for failing to respond to a robbery in progress, making misleading statements to supervisors and investigators, and playing",_
Twitter Inc said on Monday it will expand free access to the social networking site's data to help software developers create tools and products that could promote safer online conversations or curate content,_
"Nice packing and fast delivery, my daily must drink kopi!",_
This case also in love,_
kain dia memang best,_
Samyang di deliver dalam kotak,_
Brg smp dgn elok & berfungsi dgn baik,_
"â€¢ Beg Silang harga murah tapi nampak mcm mahal, berjenama dan best quality",_
Material bagus sebab pernah beli yang serupa sebelum ni,_
Who wants wear baggy style should take xxl size overall is okay nice nice nice nice nice nice nice nice,_
belanja anak fruit hehehehehe,_
Waterproof:i dont think so,_
they still get your order wrong,_
Nongshim ramyun from Korea are very suitable to eat when watching movie shows and chilling because it's just too perfect taste,_
Haaaaaaayyyyy ka ganda dito,_
Its price = its quality,_
"Tak tahu bau , semua first time beli tibai sampai 4 sebab selalu beli rm10",_
Thanks seller & Courier,_
Yg lama mcm dah lekat bila tukar pada lain,_
Durability:belum pasti lagi,_
brg sume cukup sifat,_
ni jimat blh wat byk kli,_
Good product quality good value for money fast delivery good product quality,_
Ubat semula jadi untuk tekanan darah rendah juga termasuk menambah kismis Campuran garam dan madu adalah salah satu cara untuk meningkatkan tekanan darah secara semulajadi,_
Cara seller packing the item sangat excellent,_
"Aku suka mee segera cawan jenama maggi ni, sebab mee dia sedap",_
I ordered size of XXL but the Lo Han Guo I received is L size compare to the one I bought from Eu Yan Sang,_
"Kain okay , cantik",_
"Tahun ini sahaja, dua kali mereka berdepan ujian banjir, katanya",_
Packing kemas dan menarik,_
Tapi okay la kain cantik,_
Quality:bagus 5 Bintang,_
bubble wrap cntikk,_
sangat comel thankyou saller will repeat oder againnnnnnn,_
"tiada kerosakkan apa ii , terbaik",_
Not sure why they don't keep doing that,_
sorry video lari tajuk,_
Tapi x pe selesa buat pakai dirumah,_
cepat dilekatkan sekira nya seller tak potong satu satu,_
Good service and helpful seller,_
"sesuai utk baby, sesuai utk cuaca di malaysia",_
Hopefully taste sama lah ye,_
Total bulanan-rm5000,_
Suitable for todler,_
"Ceylon tea, biscuits, wine and other",_
kali ke-3 repeat kedai ni,_
kali ke 3 beli,_
Naiseee harga berpatutan delivery laju semua okayyy ngamsoiiiiiiiii,_
Repurchased more!,_
galing niya kahit bike lang,_
Gmbr dgn video tiada kna mengena,_
Design:blue&purple,_
"Kain pon ok, sedap xpanas",_
4-5 hari sampai ke destinasi,_
Thanks seller for the good and cheap products,_
But the item is value for money,_
Always wanted to buy one but only a few stores offer this brand in the,_
Respond seller pon cepat & mesra,_
sapu bnyk2 urut lepas tu habis muntah kahak semua,_
Design:Balloon,_
The smart watch is easy to be linked to his android smartphone as well,_
Baju cantikkðŸ¥°,_
sampai2 terus pasang mmg mantop terus naik 100 battery health,_
pembungkusan baik nasib baik x pecah,_
harga sangat berbaloi-baloi,_
"Barang sampai dgn cepat, didalam kotak barang tidak rosak, Terima Kasih seller dan juga Shopee",_
Myb blh kot pakai saiz 38 hehe,_
Energy Information Administration (EIA) reported that domestic crude inventories fell by 4,_
Sehari ja saya oder sah sampai,_
lawa haih wrna dia,_
Tq bos barng dlm keadaan baik,_
11 and get it on 27,_
cuma besar pd sy,_
to sabah its normal the delivery took 4-7 days,_
dan kesihatan yg baik,_
Fast delivery and the fabric is soft and comfortable,_
Botol boleh beli search nozzle bottle baru harga sen,_
26hb lg place order,_
"Quality:kain agak nipis,warna pudar tak terang macam dalam gambar",_
Seluar cantik dan barang diterima dalam keadaan baik dan sangat berpuas hati,_
Quick easy to navigate and pay,_
tapi seller guna pos laju yg ajak lambat nak sampai,_
"So, kalau kau orang nak kualiti tahap lanjiau tak payah beli niii",_
"For reservations, call 03-7622 8888 or WhatsApp 017-228 6098",_
Pelampung sesuai utk anak 1 tahun 6 bulan,_
Portal <a href=$URL$,_
fast delivery jugak even beli time 11,_
X tebal tapi x nipis,_
Apa yang tak seronok dekat sini,_
Packed only two weeks ago,_
Packaging sgt2 la tebal,_
-)saya suka,_
Bayar sekali free Selamanya,_
Penghantaran laju dan diterima dalam keadaan yang baik,_
Harap boleh guna lama barang ni,_
Handsock n stoking dah sampai,_
Yg kelabu pom ngam2 la,_
servis drpd seller pun sgt boekkk,_
Verstappen is 14 points clear of Hamilton with three races remaining,_
"Securely wrapped, slow delivery might due to raya haji",_
light grey ingat light sangat tapi okaaaay lah!,_
"He did not give reasons for the players' absence but there have been COVID-19 infections among all African teams preparing in the Middle East ahead of the tournament in Cameroon, while other Gambian players have weekend club commitments in Europe",_
"Separately, Anwar said PKR would never abandon its ally DAP just to form ties with other political parties",_
Suka sangat beli disini,_
size S agak besar,_
"Recent publicly posted job advertisements for roles at TRG have sought people with expertise in telecommunications signaling protocols such as SS7, as well as knowledge of lawful interception, an industry term understood to mean surveillance of communications",_
12/12 - 24/12,_
then interface biasa je,_
Me respondo yo misma,_
Request to cancel order due to intend to modify the purchase but the seller refused to act so,_
Yehhh dh sampaii Best seller ni jual harga promo,_
"Good for value, but late delivery",_
Seller fast response in chatbox,_
Thanks seller cantik sgt colourr!,_
barang pun cantik cukup memuaskan,_
"kain helokk , nanti blh order lg",_
m loving it!,_
"Very cool, the material is thick and the shipping is super fast, the zipper accessory was right when i got the initials of my name",_
ÑÐ¾ÑƒÑÐ°,_
Terima kasih sellerðŸ¥°ðŸ¥°ðŸ¥°ðŸ¥°ðŸ¥°ðŸ¥°ðŸ¥°ðŸ¥°ðŸ¥°ðŸ¥°ðŸ¥°ðŸ¥°ðŸ¥°ðŸ¥°ðŸ¥°ðŸ¥°ðŸ¥°ðŸ¥°ðŸ¥°ðŸ¥°ðŸ¥°ðŸ¥°,_
Nice writing & compatible,_
tapi takpelah yang penting barang okayy,_
Sy dah repeat byk kali house bland,_
semua item cantik,_
Cuma barang keluar lambat sedikit dari seller,_
Quality:good for the value paid,_
J&T bawak barang roundÂ² dulu sebelum hantar,_
5 hari baru smpi,_
"Great, hopefully it's durable",_
N seller pom de ngtau warne yg kite nk tu xde,_
"Keseluruhan semua okay, material best sangat",_
Kali ke brp dah beli,_
"As per usual, very fast and legit seller",_
"Ambil masa5 hari untuk sampai, tp kialiti beg memang ok,seller punrespon cepatðŸ¥°ðŸ¥°ðŸ¥°ðŸ¥°ðŸ¥°ðŸ¤©",_
Agak besar sesuai utk org2 dewasa,_
Memang beli kotak kat sini je utk pack shipment cookies saya,_
Thank you powder dh sampai,_
Did I miss any,_
Mmg quality yg bagus tapi bile pakai kena adjust elok2,_
barang dh kemas xad rosak,_
Material:tak panas bila pakai selesa,_
Cuteeeeeeeee bagggggggg!,_
dan tiada bau,_
Tq item sda sampai,_
Good service and fast reply!,_
mak saya dah soh saya order kan,_
"MUAR: FELDA melancarkan inisiatif Ladang Lestari 2523 bagi objektif dapat meningkatkan pendapatan peneroka sebanyak kira-kira RM5,000 sebulan pada 2023",_
Kena ambil 1 extra size kalau jenis pointed-toe heels mcm ni,_
Kualiti lain sangat bagus,_
Three in 10 suspected Covid-19 patients in Cebu are turning up positive,_
Sangat berbaloi beli ini,_
microwave berfungsi,_
Overall still pretty,_
"tk de la nk perfeck sgt, camera dia mmg tk laa tu secantik camera hp",_
y'all won't regret it!,_
Quality:nearly expiration,_
many years have passed,_
Wow barengan,_
Quality:satisfied purchase and convenient for quick meal,_
SANGAT RAMAH 5 BINTANG TQ SELLER WILL REPEAT SOON,_
Quality:semakin nipis plastik,_
Thankyouu seller nanti repeat lagi,_
btw sy try guna cable fon untk cas fon saya tpi tk boleh ponnn,_
"Design:Good, cute, nice",_
Actually Shopee have to update to courier service,_
tapi wallet panjang tak muat sangat,_
sorry image uploaded does not represent the actual product,_
semua oke je,_
Muat2 ukuran-nya,_
Keropok ikan sedap dan rangup,_
O hope its okay,_
Cuma 1 romper tu jenis yg berbulu,_
good product and fast delivery!,_
$MENTION$ blondi ooooo my God thanks so much,_
segala baikÂ² lah,_
yg brown orange tu tak keras,_
Kucing i memang suka sngt,_
juz love the shoes,_
"Sedapnya,bagusnya,wah,murahnyaðŸ¤˜ðŸ¤˜ðŸ¤˜ðŸ¤˜ðŸ¤˜ðŸ¤˜ðŸ¤˜ðŸ¤˜ðŸ¤˜ðŸ¤˜ðŸ¤˜ðŸ¤˜ðŸ¤˜ðŸ¤˜ðŸ¤˜ðŸ¤˜ðŸ¤˜ðŸ¤˜ðŸ¤˜ðŸ¤˜ðŸ¤˜ðŸ¤˜ðŸ¤˜ðŸ¤˜ðŸ¤˜ðŸ¤˜ðŸ¤˜",_
8GB is activated,_
Arrived safely without any defect,_
terbaik dan mesra,_
tq jnt tq seller muah,_
Tq seller for shop voucher,_
Sape ajar?,_
tak sabar nk pakai ðŸ¤©ðŸ¤©ðŸ¤©,_
Absorption:Ambil masa sikit,_
They love love so much,_
Labra nice item uiiii,_
Produk diterima elok,_
"Kalau jenis kaki lebar x sesuai bahagian depan,ketat sikit",_
dah bli yg lain tpi xmau,_
Functionality:Have not installed yet,_
"Ini akan menyukarkan 'scammer' untuk menghantar mesej palsu bagi menyamar sebagai agensi kerajaan serta memudahkan usaha mengesan oleh Kementerian Dalam Negeri untuk menyekat mereka, katanya",_
Kurang baik,_
Thanks seller for the good packaging and the product received in good condition,_
Received in good condition and everything is good,_
Price dropped a lot since the 1st time I bought it,_
can it run ps2 / xbox emulators flawlessly ?,_
"Opec+, which consists of the Organisation of the Petroleum Exporting Countries and allies including Russia, agreed to stick to the plan of boosting output by 400,000 barrels per day (bpd) per month",_
thank you verymuchh,_
Wide selection of color,_
Hopefully taste dia ok,_
la/Wakaf_Ramadan,_
Good price n good quality also,_
Driver batalkan pesanan tanpa pemberitahuan,_
