Sentence,Tagged_Sentence
tq boss barang smpai dgn selamat,_
bqnyak cepat oo,_
Value for money for sure,_
So happy these weren't made from dogs,_
"As per pic, length ok stil got allowance, depth of the insert cant be opened fully",_
THIS IS A GIFT SO I DONT ACTUALLY KNOW WHAT IS HAPPENING BUT IT ARRIVE SUPER FAST AND THE PRODUCTS ARE SUPER IN A GOOD CONDITION SO IT IS A 5 FROM,_
Anyway condition by sui ja 50/50 sebab bundle,_
Improved App with PandaPay,_
Tapi tang kolar dgn baju lain kaler,_
shipment slow sgt,_
jersey ni cantik ni da kali ketiga repeat 🥰,_
Bungkusan sangat secured and selamat,_
"Comfortability:selesa, lembut, senang cuci",_
Handsock nipis,_
Safely arrived Actual size 2XL beli this one at size L,_
Cantikk hehehe nanti repeat lagii okey siapa nk beli bawal boleh follow ig dyhhijab_ okey tatatata,_
barang dah selamat sampai dan dah selamat diterima,_
Kenapa tidak ada tombol login?,_
belikan untuk akak ipar dia ckp boleh lah kena dgn hrga cuma kain mcm cepat koyakk,_
Cntik utk yg x suka kasut bertali,_
Normally buy the packet one,_
Seller respond di chat dgn cepat dan bagus,_
They're adjustable so don't worry!,_
Takde rasa pedas yg buat tekak rasa perit,_
cuma pelapik kasut yg dlm tu senang trtanggal,_
Great items but would be better if the items were sorted according to the order,_
please be careful from this scam done by adidas,_
Seller actually shipped out quite quick but stuck in Poslaju for so damn long!,_
Although I wish I had chosen a size bigger,_
Functionality:high class,_
"Not satisfied because no bubble wrap but sokay , the item in good condition and it so cute",_
Kali ke 2 repeat beli wallet kt seller,_
"Cantik sungguh baju,seluar dan topi adidas tu",_
Recommended seller 8,_
Kain cotton elok tuk anak 5 tahun yg cubby saya ambk saiz xl,_
Free gift for trial,_
mgkin bukan ori kot,_
"Alhamdulillah barang dah sampai, ambik masa 2 hari je untuk sampai",_
nnt la pasang tak sempat,_
"terbaik, terbaik terbaik terbaik terbaik",_
1mm,_
Ape pn ok la dh sampai,_
Maaf gmba takde kene mengena,_
"Sabah STAR president Datuk Seri Dr Jeffrey Kitingan (pic) said he walked out of a seat-sharing meeting among Perikatan leaders on Tuesday (Sept 8), adding that his party was being forced to reduce its 15 to 18 seat allocation to just eight",_
kena msg tye baru brg keluar,_
Jumpa di next order bosssskuuu,_
Jenis Nipis punya sejadah,_
"only provide one layer of bubblewrap to post a canned,",_
"Seller did a good job, fast delivery!",_
18 sen expact ape kan,_
"Very fast delivery, appreciate, repeated purchase",_
"The Kota Sentosa seat will be a five-cornered fight between Yap, DAP's Michael Kong, Parti Sarawak Bersatu (PSB) candidate Datuk John Lau Pang Heng, Sarawak People's Aspiration Party (Aspirasi) Tan Kok Chiang, and Parti Bumi Kenyalang's (PBK) Lue Cheng Hing",_
Sangat memuaskan cantik,_
apa sya nk ucap tkasih,_
Forget it!,_
Barang sampai dengan keadaan yang baik terima kasih bungkusan sangat kemas,_
\(^ω^\ ),_
"Always use logi tech for my mouse, it's pink and it's silent touch, when you click, there is no sound",_
"Monthly stock banyak kali dah beli from this seller, recommended thank u,",_
"The villagers said the acrid smell in the air, with thick black smoke billowing out from the factory located about 100m away from the village was affecting their health as well as the environment",_
Ivy Ku !,_
"Kualiti kain seluar ok cuma agak singkat atas buku lali bagi orang yang tinggi, gambar dan video tak berkaitan tolong order untuk kakak je",_
local seller,_
"This year was a story of global recovery for petroleum products, said John Kilduff, a partner at Again Capital Management in New York",_
kain memang sedap sangat pakai,_
SBB order untuk cust je,_
Thanks shopee to have shopee mart with a wonderful cheap price with free delivery,_
Gooooddd cantikkkkkk boleh ripit lagi beli gan seller ni hanta pon laju,_
ke Salah Pasang ke kain memang mcm tu?,_
Buy la,_
Placed order on the night of 13/08/2021 and received on 18/08/2021,_
"Jadi sesiapa nak beli tu tolong tengok ukuran dada jangan tengok bahu sahaja, overall puas hati dan kain selesa, akan repeat lagi",_
Depan clear blkg kurg sket,_
Thank you seller for the best price,_
jgn nk kualiti A la dgn hrga murah,_
Nasib our citizen baik2 and call me to pick up at his guard house,_
Barang dah spai tp barang rosak,_
Sir do we get whatspp notifications,_
158cm 57kg XL size ok size🤣🤣🤣,_
thank you sellers thank you posmen🥰,_
Lepas tu ada maltodekstrin,_
"GilA keren banget gua baru pertama kali liat beginian,",_
Tq so muchhh,_
The biscotti bit thick,_
Okay but your voice is so relaxing idek the language,_
kain mmng lmbut,_
"Barang telah smpai dgn selamat, walaupun kotak kemek2 tapi barang di dalam tetap utuh",_
meme recommended,_
Perfect for everything,_
Tapi seluarnya agak kecik sikit,_
A little longer than i expected,_
Dari segi servis mantap,_
Cantikk sngt ii dah laa murahhhh mmg bestseller baik hati,_
kipas tu walau kecil tp angin agak kuat,_
"Waaa cepat sgt sampai , barang cantikkan , terbaikkk ada free gift la , tq seller recommended",_
thank u seller penghantaran cpt wlupon pakai poslaju,_
"Service laju, seller responsive, packaging elok dan barang terima dengan selamat!",_
Tanak cakap banyak,_
After 15 mins they suddenly cancelled my order,_
"Quality okay, harapnya kalau hujan air tak masuk, saiz agak kecik dr expectation, mungkin sbb tak tgk saiz",_
Tauke friendly🤭,_
Kuch khane wale,_
Item arrived super fast delivery,_
"Barang dh sampai, bru je order smlm ari ni dh sampai,",_
Okay utk baby,_
"Well pack for the parcel, received with good condition, seller free a probiotic too",_
Didnt try the camera yet,_
terimakasih sellar dan berjumpa lagi,_
Recommended for home barista,_
dua hari sudah sampai ok buleh harga pun murah,_
expired jun2023,_
cuma barang yang berat2 sangat tak boleh lah nak letak,_
just need to give more features of tracking the rider better,_
zul,_
muchlove <3,_
- Anyways Nice Deal,_
"80, milo 2kg RM27",_
Nasib baik amik xl,_
"Most adult helplines are already too busy handling adult cases, and they need to see to urgent basic needs such as food and support for families during the pandemic, so they may not have time, nor be trained, to deal with children's emotional needs, Wong explains",_
"Good product quality, good value for money, good packaging, Thank you seller",_
Material:love love love,_
"Order kelmarin, semalam post, harini dah sampai!",_
The items looks good & I m happy with the quality,_
Boleh ke buat dodol ni,_
Durability:Quality ok value to buy it second time purchase,_
n done repeat 4 my mom 🥰,_
Oder 15/9 dpt 19/9,_
dahla post dari negara seberang,_
Taste:rasa ank2 ya rasa,_
"Good value of money, but the material not i expected",_
Tp seller cpt respond cepat utk hantar seluar tapi kena byr shipping,_
Okay ajee,_
"There are between 35 to 43 types of bitter-sensing GPCRs, although they can sense rather more than 43 bitter compounds when working in combinations",_
Gambar video x berkaitan,_
Ordered the 20 and 24,_
The designs are nice and different from others Cloth materials are soft and good too,_
51 bilion bagi Kementerian Dalam Negeri secara undian suara majoriti,_
cntik berbaloi dgn harga,_
knp?krn bhgian lengan sy DH makin kecillll,_
Ketiga2 lampu berfungsi dengan baik,_
I can now put my card inside the pocket haha,_
"Lambet jugak nyampei nye , tapi disebabkan banjir di selangor kemungkinan jugak terstuck kat sana",_
Image Quality:not tested yet,_
Kualiti baik sesuai la dengan harga,_
"Much was left undecided, he told reporters after the end of the Fed's latest two-day policy meeting, including the pace of subsequent rate hikes or how quickly officials will let its massive balance sheet decline",_
dari kedai dekat muar,_
"Harga murah , penghantaran cepat , terbaik",_
All items are cute and soft,_
kualiti terbaek saiz pon ngam cntik,_
xtau le pas basuh kainnye bleh mengembang ke idak kan,_
"Penghantaran ok, packing ok, nk try pada anak kucing yg tk cukup susu, harap2 sihat lah dia",_
Senang bernafas even double mask pon,_
sudah Dua Kali beli dengan seller ini,_
Just poslaju slow only,_
Fast delivery and good product quality satisfied,_
Received item in good condition whether it took a quite long time to receive,_
boleh repeat next time 🥰,_
Mmg beza cuma 1 jer dan nilai ruginya rm10,_
Barng smpai dengan keadaan baik,_
"Cheap price, very fast delivery, parcel is very neatly packed",_
Penghantar pantas 14 Oktober 21 order,_
But we made them diagonal?,_
"Hello fatirkshop, my friend has received the item safely and she pulled I",_
Your songs are very beautiful,_
gambar/video tiada kena mengena dengan barang dibeli,_
Semoga Allah merahmati,_
harga murah🥰,_
A bit tricky to open and store it but it is compact,_
Cun melecun wei mcm baru nmpk sikit jer kesan pemakaian berbaloi beli yg premium ni klu yg jenis fussy better jgn berkira la,_
"Beli la from this shop, pos pun laju",_
berbaloi beli rm 25 ja,_
Harga pn berbaloi dan murah,_
-Saved Value,_
Can we change the SSD memory to higher size ?,_
"The Federal Trade Commission is moving toward writing new rules that would make it easier for Americans to fix their broken cellphones, computers, videogame consoles and tractors themselves or at independent repair shops",_
"cantik sangat , memang puas hati beli",_
Penghantaran mengambil masa 3 tiga hari,_
Cantek kualiti kardigan,_
"NATURAL resources and environment deputy ministry Vo Tuan Nhan talks to Tai nguyen via Moi truong, an online ministry newspaper about this year's campaign to make the world cleaner",_
Mask litup dagu,_
"Performance:npak cm bsr dr af pak mertua,xpe la",_
Saya terima seluar dengan selamat,_
mudah mudahan murah rezeki anda dan bisnes bertambah maju,_
size 41 okay sesuai untuk 25,_
my fav place utk iptv,_
theres a little leaking but still acceptable,_
Now da check one by one,_
Penghantaran dari seller elok dan cepat,_
"Memng bagus botol ni beli bukan untuk anak , bukan untuk adik , bukan untuk anak buah tapi untuk diri sendiri haha",_
It is just tge kepala,_
maaf gmbr xda tp sy recomanded sgt beli,_
fast delivery from seller but the pos laju not inform me regarding the delivery,_
rugii takk grab lbh 🤣,_
Pack nicely with multi layers bubble wrap,_
1pcs berwarna putih,_
Will repeat at same seller again,_
"Fast response, good service, good value, fast delivery, excellent",_
Tak tahu nak bagi bintang berapa,_
Saya ambil saiz ngam2 memang sedang elok dekat kaki,_
semua ok cuma botol air tu je susah benau nak menyedutnya,_
Effectiveness:penghantaran sangat-sangat cepat,_
Tapi kenapa ramen ni rasa sama macam ramen stew hmmmmmm tapi sedap,_
"Cantik, wangi ringan je nak guna",_
I give them as a treat esp when he loses appetite for a wholesome meal,_
"good value for money, packaging okay",_
Wrapped well received in good condition,_
Texture:Smooth Like Butter,_
"no doubt, 5 stars",_
"Beg cantik mcm dlm gmbr, seller sgt la mdh respond sy minta seller cptkn ckit phtran sbb nk pkai sblm date blik kpg almdulilah seller sgt la mmahami hari tu jgk seller post tq seller i bg",_
Convenient giler,_
Very fast response and easy to install,_
Unt makluman semua minggu ni adalah minggu akhir persekolahan,_
Sambal ni sedp betulllll,_
imagine use iMovie to make the birthday video of your aunt,_
"Kalau ada rezki lebih nak beli semua buku,",_
Colour baby blue dye cantik,_
beli pada 25/6 dapat 29/6 tapi free gift cuma protector shj strap extra xde dpt sebab strap dah abis,_
⊂(‿)⊂(•‿•⊂ )*,_
Kotak kemik tp brg okay,_
ank2 pun mudah nk guna,_
It worth a penny buying here,_
terima semua item seperti yang diminta,_
Warna terang macam dalam gambar,_
Bungkusan tebal dah minum sedap & mudah,_
Dalam gambar nampak besar tp kecik je rupanye rantai rantai tu,_
"A bit slippery after installation, so keep an eye on your kid the first time they use it",_
weyyy cepat giler delivery,_
t=10m40s> my heart just stopped for a sec,_
Barang siapa yang dikeluarkan di sini dah tak tahan dengan baik insyaallah akan dtg nk beli ni tak smpt kot nak cari brand Hisense ye tak ye jugak aku nk guna married ada stok lagi ni kami dtg jam 10 pg kami akan mengenakan harga aircond yg nk servis ke dalam perairan dan sini atau ruang tamu dan bi,_
Effectiveness:Very effective perfect for travel,_
Thankyou barang dah sampaiiii hahahahahahahhahahahhahahaha,_
Ubat sudah sampai rumah,_
"Beginning next year, iPhone users in the US who are in a car accident could have their phone dial 911 automatically",_
"Quality:Black Soy Sauce not fresh already, very sticky",_
"yg warna gold tu bukan gold ya, ianya warna rose gold",_
picture is not related to the product,_
hanya atas bawah shja,_
"original product, affordable",_
Adeehh,_
thank you so much to j&t you are awesome,_
Packing OK OK,_
confirm nak beli lg,_
idk la but eyeliner dia okay kot tapi hsjwhdjdss tahler tak reti nak explain sebab sebelum ni pakai liquid eyeliner so,_
My aunt finally got me one,_
Memang kali ke-2 repeat,_
"Hence,it explains 1",_
Works as indicated!,_
Kalau jenis stokin tebal tu kena amik saiz besar sikit sebab ni pun cukup cukup je,_
(Reporting by Valentina Za and Elvira Pollina,_
mgkin badan sy yg beso gamaknyer,_
selesa dan sesuai gn anak kecik,_
"The photography fair, running online now, is an opportunity to discover shots of the Sex Pistols on stage that have never been previously shown to the public",_
kualiti sangat baik layanan sellwr bagus🥰🥰🥰,_
Sesuai untuk heavy duty,_
tahamk you,_
and I'm sorry seller just 2 stars i can give really bad experience,_
kalau still contemplating beli je user friendly beli on 11/11 rm200 je,_
Just tekan je button semua dah siap,_
New to choose thick rope,_
Cleanliness:yeah good enough to clean stuff,_
Buy those from this shop is really good for the price an the delivery and also good explanation from the dealer thank you will buy more in the future,_
plug it in your car's charger,_
"Bagaimanapun, ada sektor PKS lain seperti pertanian merekodkan penurunan",_
pos cpt jea smpai,_
95 juta yang dicatatkan semasa suku yang sama tahun sebelumnya,_
Jam rosak macam hanat spe ii nk beli sure tak payah beli,_
Taste:Spicy and mala,_
Kecik je size,_
"Item packed nicely , well received in good condition , thanks",_
"Beliau berkata, pihaknya sedang menjalankan siasatan berhubung perhimpunan berkenaan mengikut Seksyen 9(5) Akta Perhimpunan Aman 2012 dan Akta 342 Pencegahan dan Pengawalan Penyakit Berjangkit 1988",_
sesuai utk pelajar sekolah rendah,_
Maaf xde gambo tapi good good good good good good good good good good good good,_
"! fast response bila tanya, mmg mantap",_
Lekat kejap pastu tercabut sendiri,_
Good product quality fast delivery good value of money thank you,_
insyaallah tahan lasak kot,_
Delivery on time by seller very recommended,_
"akan datang lain untuk membeli lagi ye, untuk projek akan datang",_
Taste:Dah terima kopi nya,_
hrp Wangi r huhu,_
Sye dh order 3 kali setiap order 30biji,_
Arrived Kuching: 30/11,_
"Pghntran cepat sedap pakai , cntikkk , murahhhh ok laaaaaaaaaaaaaa",_
"Delivery not take too long even though fatir hv announced on their official Twitter abt the chuseok holidays may effect the delivery but all good,",_
Servis laju dan barang sampai dengan selamat,_
Kasut yang cantikkk dan sangatt selesa untuk dipakai,_
"loveee sangat beg dia macam beli branded punyasumpah cantik,",_
Labuh dgn ank ambik size m,_
Hips 36,_
cuma jahitan butang kurang kemas,_
Akan oder balik,_
lain kali blh odar lgi,_
tapi salah saya jugak tak ukur dulu,_
SedapKacang rangup,_
Kepala mcm tk brpe nk support kalau dia jatuh keblkng,_
"Anywhere the hat is very beautiful, I love it very much",_
Love my pulls btw hehe <3,_
maaf tau,_
"Well packing, slow from courier service",_
The cable is working perfectly,_
Yeah same,_
Pasni nk order red plak,_
Taste:this better good,_
I am disgusted by the lack of any planning by Afghan leadership,_
Senang nak bgi anak mkn sndiri,_
"Perfect score and perfect experience, no issues at all",_
Fast delivery items,_
"Hope this app would fail,",_
J&T cepat,_
Kalau tak bagus tak mungkinlah repeat kan,_
"Lps pakai yg ni memng best gila, selalu bwk moto jgk terdedah",_
Other than that it's perfect!,_
"Everyone having tough,",_
Boleh pakai buat basahan harian kat rumah,_
Very moisturized good value for money,_
I would buy again this product,_
GOOOOOOOOOOOOOOOOOOOOOOOD QUALITYYYYYYYYYYYYYYYTYYYTT,_
saja bagi rating lambat sikit sebab nak tunjuk kemenjadian baju raya haji untuk anak2,_
"Easy menu setting, reasonable price",_
Okkkkkkkkkkkkkkkk(kkkkkkkmmmmmmmmmmmmmmmmmmmmmmmmmmm,_
Layanan chatting seller baik,_
"All item well received , great service by seller !",_
Ok sgt product nya,_
Kenapa ye bagi beg yang sudah berkarat,_
Purchase a lot this type of underwear when offer given,_
selesa sgt pakai kain lembut,_
need to advertise for them,_
Hanya buble wrap nipis,_
beli time sale dpt rm 1 lebih jee,_
Texture:baik sangat,_
Excellent !,_
"tapi penghantaran yg terlalu lmbat bukan di sebabkan oleh syarikat penghantaran, tetapi oleh kedai sendiri yg mengambil masa sehingga 4 - 5 hari untuk ship out",_
Thin towel,_
Quality ok mau try,_
Barang sudah diterima dalam keadaan baik packing sangat rapi puas hati thank you seller Thank you kurir,_
Cheaper than at convenience store,_
received all my orders completely and secure,_
"$MENTION$ lessgooo, good luck everyone!",_
Goods received however there broken parts at the solar panel,_
nnt i order lg,_
Terbaik pakaging secured barang smpai dgn keadaan tapi penghantaran sangat lmbt,_
Penghantaran laju betul!,_
colour pun cantik hehe thankyouu,_
I think Most of the flagship smartphones were risen from Redmi and Realme,_
"Thank you seller, got items in good condition",_
plastik pun elok jeeee,_
"Not genuine Electrolux brand but for the price we are paying thats expected, product wise its good build and function well, good rolling and weight when used, worth every amount of money paid",_
My hair length is until my underarms and one set was more than enough,_
quilt lembut sgt,_
"The infection apparently occurred on Wednesday evening due to contact with a member of his security team, who tested positive on Thursday, the chancellery said in a statement",_
Love it so much 🤗🤗🤗🤗,_
belum cuba pakai lagi harap semua ok,_
I was in the restaurant,_
Xc Celcom,_
Terbaikkkkkk awesome 🤗 tido Lena x sadau,_
"Kalau suka pkai longgar2, better amik 2 saiz lebih besar",_
"item shipped out awal , baru order tak lama tu dah shipped out nicee !",_
s phone can&$HASHTAG$,_
This is such a good sleeve ever!,_
my height: 150cm,_
sangat mahal,_
Idk laa jam tu oke ke tak sebab bukan i punya but maybe okayyyyyyyyy so ya hehehe,_
bought this for the 3rd time alrdy really trustable seller,_
jenuh tunggu x smpai blh bli lg lepas ne,_
"Penghantaran sangat laju, bungkusan biasa, nk kasi org, harap dia suke, terima kasih seller",_
semuanya okay dan terbaikk terima kasihh no more overcharge hehehe thankyou sellerrr,_
Product is working great reasonable price,_
Serius tak best,_
Fast and nice product,_
Nice yarn,_
Item cukup sama dgn yg dplih,_
Kalau ade demage i edit,_
Gambar sangat berkualiti,_
Brang spai cepat,_
Ribet promonya,_
nanti boleh order lg cpt penghantarannya,_
Functionality:Part ni agak power,_
"berbaloi,harga murah nanti boleh repeat beli",_
This is the best aroma Kopi O I have tasted so far!,_
Pantas cergas,_
cukup sesuai!,_
bole repeat oder,_
Sis sangat puas hati,_
Hanya Sarawak dan Terengganu mencatatkan bacaan Rt terendah iaitu masing-masing 0,_
Will repeat again terima kasih seller,_
Safety:Packing ok,_
"Parcel that are already received, that is still good in the package , that shipping and delivery very fast in this few days , thanks for the seller",_
39 bg saya longgar skit sbb saiz saya 37,_
"Taste like normal pork lunch meat, but not so salty, delivery is fast with good packing",_
Kompem,_
sebab best kain dia sesuai untuk baby juga sebab tak kasar,_
kasut agak berat n so far ok la,_
Mask belom cuba lagi,_
prAktis,_
Brg dh smpai bbrapa hari lps,_
"suggest siapa yg nak beli, beli size 2 kali besar dari size asal",_
At the same time dpt protect jam secara keseluruhan,_
Taste:sedap terrasa coffe nya,_
Seller guna jnt mmg laju,_
Taste:belum makan lagi sebab puasa,_
"The colour is pretty, I like it No bubble wrap but safetly arrived, no damaged",_
"Items are cute, quality is good",_
Beli brg htr alamat kg sb balik kg hr tu,_
Diterima dalam keadaan baik dan elok,_
Effectiveness:good n cute,_
Mask cute,_
Dan sagt berguna,_
Cant wait to wear it with my exercise outfit,_
"very disappointed, too bad, no more deal, very poor service",_
sgt2 puas hti dgn seller ni,_
"Compared ngan cordless vacuum lain, yes mmg function tu sedut habuk tp",_
not as promise 24 hours,_
good condition and well wrapped,_
besar hmmm tapi cantik,_
sesuai untuk home machine,_
The sai hong colour is good,_
Terima kasih klu ok blh beli lg,_
"Good packaging, fast shipping, good value for money",_
Item received in timely manner and in good condition,_
sorry gambar tkde kena mengenaaa,_
Terbaikkkkkkkkkkkkkkkkkkkkkkkkkkkkkkkkkkkkkkkkkkk 🥰,_
For 2 years,_
btw im 56kg and 160 cm,_
happy customer here 🤗🥳,_
Ni klu tadi ambil Xl memang kecil nasib baik ambil 2xL,_
barangan lengkap,_
color & corak & kain soft,_
"Overall, still usable",_
Sangat menarik dengan warna yg cantik,_
barang sampai seperti diharapkan walau lambat sikit,_
the skirt fit me well,_
Can't even edit contact,_
"Fast delivery and arrived in good conditions,",_
I want repeat soon gooooooooooooooooooood dooh,_
Go with Redmi K50,_
Delivery in one day,_
"Good value for money, all the product expired in 8/6/2021, 14/7/2021 & 4/7/2021",_
saya tak mahu atlet terpinga-pinga!,_
Salah saya juga tak baca betul2,_
Saya nak aqil main game mobile legend,_
"02(1)(c) of the Main Market Listing Requirements, in the interest of maintaining an orderly and fair marketin the trading of its securities",_
Very beautiful and very nice and very good looking1,_
"More than 100 business counsellors from various ministries and agencies are offering free advisory services to MSMEs such as Bank Negara Malaysia, Malaysian Industrial Development Finance Berhad, Credit Counseling and Management Agency, Bank Kerjasama Rakyat Malaysia Berhad, and Credit Guarantee Corporation Malaysia Berhad",_
Terpantas Seller ni buat kerja,_
"As education systems begin to make decisions about investment for the new school year and beyond, it is important to take a step back to consider the longer term imperative to create a better system for every learner, Noser said",_
cepat tiasa kerosakan,_
bila tngok comel mcm ni,_
Kain jenis baju hujan punya nipis ja,_
Warna semua ngam,_
Seluar semua elok saiz ngam jahitan kemas,_
untuk 160 keatas,_
Sedikit nipis tpi bolehlah kalau2 nk pkai utk beraya,_
cuncun 🤩🤩🤩🤩🤩🤩🤩🤩🤩🤩🤩🤩🤩🤩🤩🤩🤩🤩🤩🤩🤩🤩🤩🤩🤩🤩🤩🤩🤩🤩🤩🤩🤩🤩🤩🤩🤩🤩🤩🤩🤩🤩🤩🤩,_
Waiting for stock brown box 12x12x2,_
Ingat kecik betul,_
"For the pink one, the material is more stiff and rougher compare to the white one",_
penghataran sngat pantas dan kualiti bag sangat ii puas hati boss‍‍‍,_
so so good,_
Exp5/2/23 lama lagi,_
"Elok, puas hati",_
t=9m04s> in my pocket because yoongi&$HASHTAG$,_
very good packaging plus free sample,_
"Padan bila pakai, tak sabar tunggu weekend nak try pakai di swimming pool 🥰🥰🥰",_
"!thank you so much seller,",_
Nampak besau,_
Texture:matte n shiny,_
khamis baru order Hari sabtu dah sampai,_
cuma satu uncang herba mandian yg pecah,_
Already use it and its works really well,_
"Good product quality, good value for money , faster delivery , excellent service by seller",_
All boxes received in a very good condition,_
Thanks Shopee Providing Free Shipping,_
com/watch?v=-Zmxl-Btpgk>$URL$,_
Takelok,_
"Sumpah tak nyesal grab tudung ni,nasib beli 3 sekali gus",_
Banned from COD without sending me the complete details about cancelling orders on purpose?,_
Laju amat penghatarannya,_
t-shirt 2-3,_
Update : harini 13/12/2021 lepas sy rate 1star haritu terus seller msg dia dah repost,_
Always support this seller with good value for money and good products quality,_
Wangyy kali kedua repeat,_
Bang mending tuh uang dipake naik haji,_
Luckily inside ok,_
yg lg 2 x muat,_
Comel jugak Banya kemampuan dia and sedikit kekurangan tapi Saya Rasa ok la utk kolej student Harga yg blh dimiliki,_
Warna tak sama langsung seperti iklan,_
Alhamdulillah barang suda sampai dlm kaadan yang baik,_
Received it quick,_
"So satisfied with the quality, thanks seller ><",_
pembungkusan xmemuaskn,_
Okay Thanks seller will repeat it again,_
was good,_
"Functionality:function bagus , lampu berkualiti",_
semuanya dalam keadaan baik dan saiz semua ngam cun melecun 🤭 Syukur Alhamdulillah 🤲🤲🤲🤲🤲,_
Why i dont see comments about this?,_
dulu nyari hp ini susah jadi beli nexcom poseidon,_
1016 : 20 have 5 are no functions,_
"17, Firdo said in an interview with Reuters",_
I never bleach my hair !,_
Items quality looks good but not yet consum,_
"The delivery was quite slow, ordered on 19th 3pm but only got my parcel today despite shipping from Balakong to Cheras",_
My son love to use this product,_
50 per share in February,_
Getah memang memeri,_
"maaf,video xad kena mengena",_
Sangat tegap dan kukuh saya dah pakai almost a week and so far okay sangat saya sepit kat frame katil sebab senang nak tengok K-Drama,_
and set to my feet,_
