Sentence,Tagged_Sentence
"tried with 200 Celsius bacon, good - no leak no broken no burnt less messy",_
"Overall good, only the delivery guy sent the wrong parcel, exchange with another percson parcel in same row address with me, luckly is near, if not i will complaint to the deliver guy",_
Boleh repeat beli dekat sini je,_
"Seluar best, selesa",_
This is very osm,_
"Its my first time to use the app, and i cant even check out",_
mybe mcm canvas,_
Barang ok x Ada masalah tapi penghantaran jnt mmg kurang menmuaskan letak barang merata2 smpi org pun x tahu,_
"we anticipated rain because of the weather forecast, said Queenie",_
Tiada kerosakkan n selamat digunakan n boleh dipercayai,_
Aplikasi luar biasa untuk saat ini tingkat kan kembali Promosnya hehheheh,_
Expired in 05/23,_
t=7m50s>,_
"biasa ambil saiz 39,tp bila bc komen kena ambil 1 saiz lbih besar,so sy ambil 40",_
"Mengenai veteran ATM yang tidak berpencen, beliau juga berharap kerajaan dapat memberikan satu kadar elaun bulanan yang munasabah kepada mereka sebagai pengiktirafan terhadap perkhidmatan dan pengorbanan untuk negara yang telah mereka berikan",_
the price is very cheap compared to the real one,_
Sangat mudah nak setup babycot ni 🤩🤩🤩🤩🤩,_
dan setelah sy mengamalkan selama dua hari pembuangan sangat lancar,_
First App-Clusive purchases will also get RM15 off their purchase and free delivery,_
"THANKS SELLER BRG DH SMPAI ALL ITEM IS SO CUTE TOOK 6 DAYS TO RECEIVED BELI 4x, TERUS 1x DAH PAKAI NAK ABIS DH HARAP CERAH LA",_
hopefully can use for long,_
Thankyou seller🥰 will repeat it soon 🥰,_
got it only at 18 sen,_
Test dh peritt telinga dengornye,_
Cute for diy pendants,_
yg penting sgt sepadan utk plus size cam biasa,_
Delivery pon bagus,_
Tk besar sgt,_
10 79,_
Contacted 3 times with customer care,_
The best sarung bantal,_
"Kini, pendekatan yang sama diambil kerajaan bagi membantu rakyat menghadapi bencana banjir",_
Lepas ni boleh repeat lain pulak,_
Maaf gambar takde kaitan sebab belikan untuk orang lain,_
Laju dan murah sangattttt,_
"material is see through, but nice laa sesuai dengan harga dia",_
"Received in good condition, correct size but only one tshirt (ESPRIT BRAND) the cutting was too small 🥴 so, will try hard to squeeze body in it🥴 anyway, the material is soft & comfortable to wear",_
Give me coins too,_
dah repeat beli kaler lain,_
"tinggi 163cm, 70kg",_
Harap terang macam bulan,_
lepastu ada waktu suruh paksa korang rajin minum air,_
Barang sampai dalam 3 hari,_
"Some disenchanted Conservatives said O'Toole had pulled the party too far into the middle during the campaign, announcing major policies without consultation",_
"Functionality:berfungsi dengan baik, ade 3 mode",_
Settle masalah thomas train dh blh bergerak 🤣🤣 tq seller,_
tp x mnjejas kan rasa,_
WARNING SAMYANG BULDAK IS SOOO SPICY,_
mntk2 xde mslh dgn alat ni,_
"Penghantaran pantas,selalu dgr org ambil 1 size besar,tpi kalini kite slh ambil 1 saiz kecil",_
10 hihi,_
I been using this as part of my makeup routine and it's not bad for covering red spots / hyperpigmentation,_
"The EC should quickly clean up the electoral roll they recently announced to empower new voters to participate in the next general election, said Dr Sim",_
Good nice best awesome perfect magnificent recommonded,_
cuma X puas hati sebab patah,_
Texture:Good product fast service,_
Sampai dng selamat,_
Receive the parcel in good condition tq shoppe seller and courier,_
Alhamdulillah kawan suka dan cakap semua ok kecuali besi tu ada kemek sikit mcm dlm gambar,_
Baran baikkk bohhhh rugi hampaaa x beli,_
Please make real battery life review video,_
12 TOTAL,_
Ingtkan bsar pearl dia,_
Sluar selamat smpai seblum raya,_
Too yellowish,_
Kamera internal pun HD,_
Some riders are marking the order as delivered even though they just picked up the order,_
t send you galaxy s21,_
seller pun baik hati,_
saya sedekah la dgn family yg 1 lg,_
GoodfastdeliverypuntingpuncntikjeGoodfastdeliverypuntingpuncntikjeGoodfastdeliverypuntingpuncntikje gmbr xde kne mngene,_
quantity also correct!,_
Sehingga sekarang tiada masalah,_
Dah pakai hampir sebulan,_
Cuma bagi aku utk pintu penumpang belakang & bonet korg kena ukur dan potong kalau nk cantik sbb saiz x ngam,_
Kemah keming sek kite mandi lanjeyyyyyy,_
Bought it for my friend and she like it🤩thanks seller,_
Kualiti baju okay untuk pakaian harian,_
buku nya saya dh hilangkan,_
tp kcik,_
"Very slow app, and not friendly",_
"Item bundle, lepas dibasuh terus gebu gebas",_
Perfect for picnic!,_
"🥰 Balut dengan plastik je, tak de kotak tapi barang semua okay",_
"Fast delivery & good packaging, due to I bought it n send director my dad therefore unable to provide proper photos & video",_
Bby 1m+,_
Topi smp dlm keadaan baik,_
Thank you seller for the fair & low price for each can,_
Penghantaran dan perkhimatan pelanggan sangat cepat dan pantas lagi laju,_
Okay la kot bungkus dia,_
Quality nice,_
"Terima kasih yaaa,barang dh smpai kemarin",_
dah 2 kali repeat dkt seller ni but this time cuci gambar passport sekali,_
"Barang udah diterima dalam keadaan baik, bisa di pake untuk perang",_
Ada bunyi dr kat dalam macam skru xketat ke ape tah,_
The seller keep saying will send voucher,_
n 1 hp,_
"Bukannya pemain yang sudah berusia 30 tahun, kata Hodak",_
akn repeat oder,_
Anak dan suami pon menyukai seluar ini kerana kualiti kain serta desingn dan material,_
As usual fit to my size,_
yg penting baju cantik²,_
Items received in good condition🤩,_
so far so good so far so good so far so good so far so good so far so good,_
"Always buying stuff at Shopeemart, because of fast delivery and good condition",_
"4 - Government U-turn on Paterson After unhappiness in his own party and newspaper headlines accusing Johnson's administration of sleaze, or self-serving dishonesty, the government makes a U-turn on the plans it had pushed through a day earlier and Paterson quits parliament",_
Kain kinda nipis,_
Lewwwww I need a new phone Twitter kairav691,_
"Terima kasih seller,tudung sarung telah selamat diterima",_
"Received in good condition, fast and good packaging, thank youu",_
"Produk bagus kucing suka makan, delivery ambil masa 3 hari after payment and hope seller boleh improve packaging maybe letak bubble wrap ke sbb takut parcel akan koyak or rosak if courier jenis campak2 barang",_
barang ngam²,_
Ini dah kali kedua rpt n beli byk sikit dpd sblm ni,_
Bnyk kali dh blii snii mmg lajuuww,_
!very nice!,_
"Pattern agak besar, mungkin x matching dgn org berkaki kecik, org kaki besar boleh match",_
rasa kopi yang enak,_
2ari brg dh smpai dr perak ke kl,_
"9 in July, the highest reading since February, but still below the 50-mark threshold that separates growth from contraction for an eighth straight month",_
"dah sampaiii , comel je beg ni",_
tp xpe la ada baju free gift 1,_
Ubat ni sedap la makan time pening2 dan demam macamtu hahah,_
barang sampai cepat puas hati dgn kain & berbaloi dgn harga,_
^_^^_^^_^^_^^_^^_,_
tp still ngam sbb dia strechable so xnmpk ketat sgt,_
Delivery laju n thank you for the free gift,_
Delivery also fast just took 2 days after order,_
but it's okay asalkan boleh guna,_
Customer service helps to solve the hotspot connection issue,_
Thankyousomuch sebab kasi harga kaw kaw murah punya,_
"Assalamualaikum Alhamdulillah selamat sampai baju nya,colour cantik terima kasih",_
Kudos to seller JnT,_
It is quite heavy but it is stick la,_
BLOSSOM COLLECTION 2,_
ada gift tambahan 2 pcs,_
He would never He likes to act like he important when he&$HASHTAG$,_
Ngedip woy,_
$MENTION$ Best OnePlus ever,_
Size/Perfect Fit:excellent,_
Bila tnye seller jwb dgn berhemah,_
Nanti boleh repeat lagi!,_
"$MENTION$ A Well, I guess if you eat multiple servings every day it&$HASHTAG$",_
Jam elok tak dak kerosakan,_
Baju kecik seluar besar,_
spend of RM80*,_
Kee 10,_
I put wrong address I ask customer service can change address or not he say can but when the driver send to my wrong location,_
mkn ngn apa2 saja,_
comey ja anak pakai,_
I love this luncheon meat because it is less salty compared to china ones,_
ll support you,_
Best before 22 Apr 2022,_
All good and all there,_
Seller juga peramah dan memberikan kerjasama yang baik,_
The shot itself is based on a level strike,_
Quality:bagus dan selesa,_
Super cuteeeee and this one memang pre order tapi cepat jeeee,_
LOVE YOU BTS 🤧,_
penghantaran ambil masa yg lama mungkin disebabkan lambakan order yg masuk,_
"Beli combo byk terus, semua lawa laa jugak, puas hati :) paling suka parka london tu lawa bakhang",_
dan lmbat update,_
"Black,emerald green, maroon & harini baru received dusty pink semua terbaik",_
Hi selller,_
oh no!,_
And getah dia fits seja,_
Thanks for the free gift too !,_
reminding members of the public to be aware of online scams during the Covid-19 pandemic,_
"Baricitinib berada dalam kelas ubat berlainan dikenali sebagai perencat Janus kinase, namun diletakkan bawah garis panduan sama dengan perencat IL-6",_
Cute packaging and color,_
"thankyouu, barang dah sampai",_
"overall ok ok ok,",_
warna more to cream instead of white,_
Functionality:boleh isi macam2,_
"next time , beli lagiiiii",_
All neat and tidy,_
"Received in good condition, good packaging, nice and value for the money",_
"4, receive 22",_
yayy items arrived in good condition ni kali kedua repeat lagi 150pcs,_
Tpi seller hntr awai jaa,_
"Fikirkan mengenai panggilan serentak, video dan aplikasi awan yang kita telah semakin biasa menggunakannya dalam tempoh dua tahun lepas, katanya dalam satu kenyataan",_
Delivery took 7days from indonesia,_
banyak laju kiki,_
Very cheap and cute,_
Pebghantaran cepat dan pantas,_
less than 2 days arrived,_
appm ckup2 puas hati,_
Ordered on Mon & received on Thurs,_
walaupun lambat smpai bukan salah seller,_
Suko weyh,_
cuma pergh,_
All 2 units also inverted label,_
terbaik laa stocking tapi beli yang long napee dapat yanggg sederhanaa ayooo,_
brg selamat sampai ke kaki,_
"Berkongsi harapan sempena ketibaan 2022 yang baru sahaja menguak jendela, tiada apa yang diharapkan selain berdoa semoga pandemik COVID-19 segera berakhir",_
Have to alter a bit for 153 cm height,_
periuk smpai dengan selmat,_
baju sedang elok aje pada badan,_
"CN Lilly need pay to go in ,",_
Sticker fragile ni berkualiti,_
bungkusan dengan bubble wraping,_
"Lets go,",_
"Good buy and delicious coffee but not very economical basically get 6 cups of coffee s sometimes drink 2-3 a day, might as well buy beans or just Nescafé instant",_
"Radio ok,cantik,murah,bleh beli lg,nk terbaik murah, ,brg ringan mudah pasang",_
Brg smpai dgn cepat dan dlm keadaan yg baik,_
🥭🥝🫒🫐🥥🥭🥝🫒🫐🥥🥭🥝🫒🫐🥥🥭🥝🫒🫐🥥,_
They key note what actually quite cool,_
Jenis kain mcm kain lampin,_
xde dah,_
pakej diterima dalam keadaan baik,_
"krim param tu wangi sgt,xsabar nk try hehe",_
"Pengkhianatan adalah label diberikan kepada BERSATU yang nawaitunya mahu menjuarai integriti, sebaliknya pendedahan korupsi menjadi dendam kesumat membarah",_
terbaik lam,_
Good good good good good good good goodddddddddddddddddddd,_
Soft and strap works suitable for my baby,_
"Justeru, skuad kebangsaan sudah menyusun jadual latihan yang lengkap bagi memastikan setiap kelompok pemain mendapat latihan yang terbaik dan bersedia sepenuhnya sekalipun dengan skuad yang 'rongak' ketika ini",_
Hat size is on the bigger side which is great,_
Namun dalam masa sama berharap dapat berlatih dengan penyerang import secepat mungkin,_
"Yehhhh anak Sy suka sgt,nanti nk repeat lagi",_
Cantik sgt hrga pn murah tapi saya salah pilih sz agr besar untk ank sy yang bru 1,_
Bagus banget grab,_
и стряпаю лепешки без масла,_
cutting bolela,_
Anda ada honda?,_
"For those interested w marinated lamb shoulder, marinated beef tenderloin, marinated chicken chop, Korean chicken wings please visit Ig/FB MaluraFoods",_
"alahai cantiknya beg ni dahla murah puas hati sangattt ,",_
but really satisfied with it thanks,_
letak ni mmg kain dlm tu x berbelit,_
🥰🥰🥰🥰🥰 recomended to all buyers,_
thank you but ill try others,_
terlampau pack sangat dalam kotak rasanya,_
Saya bukak video PRINCE MEED ni,_
Kui Ying Zhi Qinjasmine green tea,_
Okei barang dah selamat sampai,_
"When I use back my original cable, no problem on it",_
Harga pun xmahal sgt,_
But what I paid what I get,_
Thank you for free gift to,_
Tp size tu kena ambil lg besor sikit,_
Sy pun akan repeat lagi order,_
RECOMMENDED BY MY FRIEND!,_
pretty and i igtkan besarr tpii okeyy ajaa klu nk ootd kee okeyy laa muat je klu nk letakk brg ii kecikk soo its worth it love it may repeat again,_
Internal documents reportedly detail a plan to open a series of retail outlets,_
Hope the content is fine,_
Dia suruh beli lagi sampai pergi mall pun pakai traksuit ni haih🤦‍ ni semua salah seller jual traksuit best & selesa,_
tinggi 81,_
com/shell provided by the company for a $5,_
"overall , TQ SELLER",_
"Buying this for my class Fast delivery from seller, the price is so affordable & the sanitizer smells so good keep it up seller will repeat with this seller when this 2 bottles finish",_
Receive :17/11,_
However tqvm seller,_
Barang bfungsi dengan baik,_
"Kehidupan dunia sementara bahkan Kehidupan akhirat kekal selamanya, yang kekal hanya Pemilik Abadi",_
dy pun suka,_
Terbaikk boleh beli lagi,_
Received item in a good condition wrapped in bubble,_
harap okla tq seller,_
apa2 pun semua terbaikk,_
Delivery is quite slow but still acceptable and I will buy agn,_
Item look nice and quality,_
"Xbeli jnis kain, sbb risau la ada ank2 kecik kang tumpah air ke apa",_
Where is the fingerprint?,_
Sluar smpai dgn slmat,_
Selalu beli kat kedai ni sbb service dia cepat,_
So ada video insert dia jela,_
Grab waktu shocking sale,_
Sesuai guna untuk menyusu baby,_
Wrapping pun terbaikkk,_
Ngam dgn anak amek saiz besar sikit yg ni,_
Use Senheng App buy appliances many times already,_
**mmg mati selere mkn tu,_
"memang ngamm, tapi ade lebihan sedikit",_
She urged residents to help inform her office or their village community management council (MPKK) of any abandoned vehicles in their area,_
Hope to get more promo in future,_
"Taste:Order 1/1 , ship out 4/1 , received 5/1 , haven't try yet , hope taste good",_
bole beli kaler lain plak,_
Thank you seller guna untuk hadiah hantaran,_
jam2 pon bagus sgt,_
Saya suka dengan item yang saya beli,_
the colour it like dark beige i guess HAHA but i like it too,_
"Maaf saya nak tanya, bouncer chair baby knp tak ada net ya?",_
Basuh xluntur pn,_
Barang duduk kat tepi box,_
Quality:kain tebal dan cantik,_
Semoga dilimpahkan rezeki yg berpanjangan,_
bru nmpk de byk tudung act 🤣🤣🤣,_
"all items received with no defect, safe and sound,",_
Dah kali ke 2 repeat dan mmg terbaik,_
OKAY OKAY OKAY OKAY OKAY OKAY OKAY OKAY Good!,_
saiz dan kain pon ok,_
sbsjshsb sbehehbe r r rhrhrbbr d rhdbr,_
Pin pun tajam,_
packaging ok ade bubble wrap belum mula baca lagi,_
hαrαp αnαk ѕєlєѕα pαkαí ѕєвαв kαín díα tαk tebal,_
Safety:Alhamdulillah dh sampai,_
shampoo ni berkesan sangat,_
Body: 2,_
campur dgn ramen jd la rabokki,_
Peggy Chong Pang Yeeling,_
Kualiti mantappppp,_
"Saya belum sampai tahap Haqiem atau Yonnyboii, mereka sudah stabil dalam kerjaya dan memahat nama dalam industri muzik",_
marilah ramai2 makan ketupat nina,_
terima kasih sis penjual,_
Sampah digi,_
Make sure to inform your customer next time,_
kain sesuai jer,_
"This followed the 15 value added tax introduced by Saudi Arabia, from only 5 previously",_
Not suitable for perodua especially axia,_
Belum pasang lg sebab x reti,_
I hope so because they said so,_
yang bawak banyak barang,_
Item sampai dlm keadaan yg sgt baik,_
Tak pakai apron berniaga,_
takdela gedabak besar,_
I thought dia ngam ngam tak nampak kaki so tak perlu pakai seluar,_
200g Poria,_
Packaging has no problems at all,_
"Yoongi cuando dices ''Army'' en coreano, en español se escucha como ''AMIGA'' todo cuadra perfectísimo JAJAJAJA",_
Hope nxt time delivery will more faster,_
boleh lh nk pakai nak gi class nnti,_
sampai tepat pada waktunya,_
- terima dalam keadaan baik,_
"ni kali kedua beli dengan seller,",_
Amik 3xl ingatkan besar rupenye muat² je,_
Froot loops memang sentiasa sedap,_
berat jugak papan dia,_
Fast delivery with thick bubble wrap,_
penghantaran pun sangat2 laju,_
TAK ADA PECAH KE APA,_
Yg lain² semua ok tiada masalah,_
Ordered 11/11 arrived 19/11 which is fast considering it's a pre-order item,_
Bought during flash sales is cheaper,_
saya sangat berpuas hati dengan pull saya,_
Mungkin semasa courier,_
So food panda if your job is to earn money through unfair means then there are multiple other unfair ways at least you shouldn't earn unfair money through food system,_
barang tkde rosak,_
Love this beverage,_
Tpi tula order colour lain dpt colour lain,_
Excellent brand,_
"The 2019 Roland Garros champion has certainly progressed through the draw rapidly, though Anisimova extended her time on court to 74 minutes",_
Driver banyak yg tidak mau mengambil pesanan,_
Kuantiti cukup seperti yg saya oder,_
Quality:sangat lembut x keras mcm puting botol susu,_
"Good quality, fast delivery,love it,",_
Noodles good taste but delivery very slow,_
Shutter tak try lagi sbb belum beli battery apa2 pun barang terbaik,_
dekat pun lambat,_
Quality:good packing and wrapping with bubble,_
Rasa dan aroma sama macam jenama coffee kurus yg saya beli sebelum ni dipasaran kayangan,_
Bought two with free shipping,_
7-8 ntuk 6 tahun,_
"utk seluar budak2, kain sedap tak panas & lembut",_
"But i prefer jeans yg jenis stretchable sebab nk duduk ke senang, yg ni pun ok je but amik size ikut korg je tau",_
parcel pun balut sangt la tebal!,_
Jubah ni warna hitam tau,_
Nostalgic,_
dapat pepel impian hati,_
"mask sesuai dgn muka yg kecik skit , tebal tpi tulah haha colour hitam an mmg nice",_
- fits me well,_
It is a very good hard drive,_
Jumlah portion dia lebih kurang sepinggan,_
42-43 pun okey rasanya,_
Rupenya kena sgt ng muka hehehe uuuuu kena beli lg color lain ni,_
Delivery time was a week as expected,_
"fast delivery and received in good condition baju lawa2 really recommend ,",_
Tq RealMe,_
"We're always trying to compare the new variant to the initial shock, she said",_
"Fast delivery also, arrive within less than tla week",_
5 But everything cool,_
Sebab kain mmg cotton,_
x bleh pkai,_
agak disappointed buy it's okay,_
Received: 18/10/2021,_
Tq barang dah sampai bag pun cantik nampak tu mcm kecil tapi banyak barang boleh masuk,_
RECOMMENDED SELLER WITH LOW PRICE gais,_
Tangina wala man lang macontact na support walang kakwenta kwetnang customer service,_
"Fast delivery, received with good condition, good packaging and very cheap price",_
$MENTION$ Cat OK,_
I love oxygen os $MENTION$,_
thank you sellershipping take too long mayb is economy shipping yabut i like cover,_
"The Dettol Malaysia public awareness programme, which aims to educate schoolchildren on how to practise and retain hygiene habits from a young age, is targeted at 100,000 pupils aged between seven and nine",_
"MANTUL TERUK BENDA NI,",_
Secured well in a box,_
Delivery consider unreasonable just lack of bubble wrap,_
Bang hampir ajah aku sediiiiiih banget eh ternyata,_
the sauce ingredient?,_
love love loveee!,_
selesa Pakai,_
Teoh Shuhua,_
Functionality:selesa sangat tidur,_
"Beli masa promo rm3 je, anak umur 2 tahun setengah saiz L muat2, kain ok",_
This is a boiled egg,_
boring ku menungguuuuunyaaaaaaaaaa,_
Thank you Thank you thank you thank you thank you thank you thank you thank you thank you thank you thank you thank you thank you thank you,_
HajzjzjsjakzjhzzkjzhsksbzksjsjsjJskaksuzbzjsjsjsjhsjsjsjsjsjsjsjsj,_
selesa di pakai seller pon ok,_
Sonuljit hoped that Malaysians would show some respect to his late father and his family instead of spreading unverified information,_
"All item in good condition, this is the 4th order from you, congratulations",_
tapi macam saiz M,_
things safely received!,_
Good Product and nice to feel it,_
Spe2 nak beli boleh percaye seller ni,_
Frendly seller too,_
It doesnt look totally black it has some dark blue in it i can see,_
"brg dah sampai, kecik sgt la plak, 14cm , bolehla muat2 1 tudung jer, tapi nk sangkut mudah sgt tjatuh sb kecik , kena beli yg 17cm apa pun tq seller ,",_
"Program BP3 ini turut membabitkan Jabatan Perhutanan Semenanjung Malaysia (JPSM), PDRM serta agensi penguatkuasaan bagi membanteras pencerobohan, pembalakan haram serta pemburuan hidupan liar di kawasan tumpuan dalam kawasan perlindungan di Semenanjung Malaysia",_
"Quite surprised since the price is low definitely would recommend to buy these shoes here,",_
"Tokens can land on the list for several reasons, like if they're part of a new project that's about to launch or if Kraken's technical developers flag it",_
Just the screen is dented when received,_
"Tak lama pun, order Jumaat, Isnin sampai",_
Kualiti barang 7/10 kain nipis & sizing mmg lari sikit,_
anak 3 thn sesuai saiz ni,_
tak panas bila pakai,_
Sory sory,_
Beli 1 beg dapat 3 beg cantik2,_
cuma baju yg saya dapat ukuran x sama,_
Ordered yerterday,_
Price is cheaper if you join the membership,_
R02,_
alhamdulillah terimakasih ye,_
"thank you for free gift, ade 3 tapi satu dah bagi org",_
Ya allah seriusly cantik,_
delecious,_
on a worldwide level ?,_
Nice Hoodies & no regret,_
Terbaikkkkk pantasss terbaikkkkk,_
Smlm order harini terus dpt,_
"Packed well in bubbled envelope, arrived safely",_
puas hati bekas murah,_
brg elok berfungsi dgn baik,_
"so cantik , free size tau even delivery lmbt sikit hehe sokay puas hati thanks seller 🥰",_
Minum air yang bersih penting untuk kesihatan tubuh badan,_
terima kasih seller penghantaran yang sangat cepat dan barng smpai dalam keadaan baik,_
thank uuuuuuuuu🤍🤍🤍,_
tak test lagi dengan isi,_
1 broke but it's okay 🤍🤍🤍🤍🤍,_
ingttkna strnnded ngan bnnjir,_
Good goood good goood good food and good good vibes to oder love love good,_
Definitely will repurchase as soon as my current stock approaching deficiency,_
Good hig kuality godhood good gwobdjzhzkwlsjsbsndnjxnxnxndnxjxnxnxncnnfnfnfnfnnfnfnfnfnnfnfnf:hdbfbcjcjfkdbcjcndndjdnwjdkdbdjxnskxkxbdndncjxxnndjd?jdkdnfncjfnfnfnfnnfnfnfj,_
"Item well received ,good product quality",_
harap dapat membantu dan berkesan,_
50kg/159cm spatutnya saiz M tp nk longgar skit ok la ni,_
Umur anak 6tahun,_
hahahaha tapi takpe la,_
sebelum ni beli 2 skang ni pun beli 2 nnti nk grab lg sebb kain dia sedp giler plus murah plk tu,_
"Saya xde mslh dgn pilihan seller, i is ok je",_
ade 2pcs eyeliner untung,_
look elegant for office wear,_
Rase puas hti,_
Brg cun mantap dan terbaik,_
Tahan lasak nampak,_
"Very fast delivery, very good product, worth to buy",_
"sangat memuaskan hati, kain x tebal dan x tipis sangat",_
Chew horr,_
bos saya beli ya,_
Baik ok baik ok baik ok baik ok baik ok baik ok baik ok baik ok baik ok,_
04 sahaja,_
i will come back again and share,_
"Safely arrived 🤗 ordered yesterday, arrived today",_
saying they're proud of me is enough,_
jersi dh smpi,_
thnk youuuuuuuu,_
Delivery aspect quite confusing but seller respond also not comforting customer's worries but glad item received in good condition due to proper packaging,_
best mula mula tengok macam kecik tapi bila dh letak buku nmpk besaq plak dye cm tiber tpi x pe pastu en yg klip biru tu aku beli kat kedai lain bukan dpt skali tau n botol tu pon aku beli kat kedai lain estetik gilerrrr,_
Scarlett Whitening body lotion memang tidak pernah mengecewakan,_
"Kotak okay, ukuran yg dibagi ngam",_
Shopee kot ye nak cepat pun balut lah elok2 saya bayar bukan tak bayar delivery bagai,_
Better feedback (progress status) while search is working so we know the app has not crushed,_
8akan repeat next month,_
dah beli for second time and just wanna say worth my money and sound dia just nice tahan lama and color dia pun cantik hehehe tq seller,_
Tapiii yang dapat jenis kain xsama satu lembut satu mcm keras sikit,_
"Received in good condition, first try on this brand",_
First time beli dari sini and packaging sangat memuaskan,_
"nice cap murah tapi berkualiti, delivery pun cepat, sedap pakai ngam ngam kepala thank you seller",_
really love it and affordable,_
tak raya weiii,_
Barang dah sampai smlm terima kasih saya bli,_
semalam order harini smpai penghantaran mmg lajuu pembungkusan pon baguss dy letak dlm kotak besar uii pdhl beli menda alah seketul tu je,_
Service and options are excellent,_
Warna pink cntikk sangat,_
ngam utk anak sya umur 7bulan,_
Will get more colours,_
but it late because courier,_
aa tu je,_
"The two sides next play a three-match one-day international series, which starts in Canberra on Thursday",_
Sampai dahhh cantik adik suka tq jual beg mampu milik ne hehe,_
taktau la nk ckp apa lagi sbb beli untk bf hahahahahaha,_
"Grandparents should be allowed to make decisions when parents are not present, when a child's action directly affects them, when safety is at stake, or when house rules are broken",_
Seller sent a pic to check with me of the items I purchased before shipping,_
berpatutan semua tqsm !,_
Item: No worry dengan kualiti,_
"shipping laju, saller baik, kasut cantik selesa pakai guys",_
The black one that i received is not microfibre,_
6⃣🤔🧵,_
"ada baju yg tak ada stok, jd kena tukar lain",_
Relevant used,_
Sesuai untuk :,_
"Harga berpatutan, penghantaran cepat",_
N murah!,_
Quality:pretty sturdy,_
keep up the good work guys!,_
"suka ngan warna dia ,sy jenis lengan kuruih tapi jadi longgar sikit ja ,cantik i like like and so cheap ul",_
Barang telah sampai dalam keadaan baik penghantaran yang cepat berpatutan dengan harga,_
"Baru order, seller dah ship",_
beli same saiz tp sepasang tu agak kecik Dr saiznye,_
Very good product and very recommended!,_
smunya okey🤗,_
belum cuba iron lg,_
