Sentence,Tagged_Sentence
Items were packed properly and were received in good condition,_
Ramah dalam pelayanan dijalan,_
"Bagus lah penjual dia snap gambar yg kita pesan baru dia delivery, teruskan maju jaya",_
stokin so far not bad,_
thanx dhl,_
make perfect 1 set buying together with Yoga pants legging grey lake blue with same seller,_
"Good packing, I like it, will buy again, very nice, thanks",_
kli prtma bli semua ckp,_
kali ni ambil 4,_
hjngjnnjghhhhbhhhhhhhbhhhhhbbbhhhhhhbbbbbbbbhhhbbbb,_
"First time buy this drink, and its taste really good, will repurchase if have big promo",_
Risau barang adalah fake,_
line pun slow,_
Mcm biasa item sampai semua okay,_
Tq seller sampai walaupun lambat sbb shopee express botol ok x kemek tq,_
Cantik beg dengan harga yang berpatutan,_
"shoppee /,/,delivery pulak letak je atas tembok batu",_
sape yg dalam pantang beli tisu basah yang ni bnyk2 pun ok,_
sdg2 tapi pias hati,_
Taste:sesuai dgn tekak saya,_
beg original legit puas hati yg penting delivery cepat sangatt satu hari dh sampaiii terbaikkkkkkkkk 🥰🥰🥰🥰,_
nobody talkigabout how he rickrolled us at 3,_
So delicious yummy yummy,_
Taste:nampakkk yummyy,_
Lembut je dan beli waktu promo supya dpt free postage baru rasa worth it utk beli,_
Wear at home ok,_
"The colour is very sweet, just like the pictures shown",_
Saya amat menggemarinya,_
$MENTION$ plz lew,_
Looks like not my favour,_
terbaik sangat baik untuk anda yang ingin kita tampilkan ke atas jalan raya,_
sumpah cantik tq sangat,_
Tp tkpe kita try and error!,_
barang sudah selamat di terima 🥰,_
Murah dan sgt best bila pakai malam kalau mata penat pakai ni bangun pagi terus segar,_
Memang soft pillow,_
Might not last if things too heavy,_
saiz m ni ngam dgn bdn saya,_
", tapi dah beli so enjoy la 🤣 btw murah and berbaloi sebab sale",_
recommendddd,_
"Customer suka ,",_
I hope win this time,_
terbaikkkkkk laahh,_
Bace review rmai ckp sedap,_
Beh laaaaa org penang Syed Ahmad Fatin Adilah Omar,_
memang sesuai nak bawak ke mana-mana,_
I like puma,_
mmg mampu milik,_
cuma warna off white tu hm tahla ku hentam sajo tak reti nak bezakan color but it's okay,_
"Smpai cepat sgt,kad Pon berkualiti",_
Comfortability:selesa Dan mudah dipakai,_
And got a free hair clip too super recommend if you like flowy skirts esp during the hot weather it's so cooling,_
baik baik baik bakk biam naik naik baik kaik kaik maik vaik naiaokqkakak,_
Cheng Hoe is also mindful of the intense rivalry between both teams and reminded his players to keep their cool in the match,_
Taste:sedap ngam ngam 5/5,_
7 billion annually before the Covid-19 pandemic,_
Dpt smua 17 pair n color yg d order,_
Just so so aje,_
A decade of e-commerce adoption took place in a matter of months,_
baby suka sangat makan,_
"Half of the year group achieved A*/A grades in at least five or more subjects, while an incredible 25 achieved the top grades in nine or more subjects",_
mana gift mi band 5,_
"Treasuries have also steadied after beginning the year with a rout, though a new test looms later in the day when U",_
Tkot bocor kene duri,_
Mending grab ini ditutup saja,_
Kenapa gak bisa di daftarin,_
Men's Jeans Stretchable Denim Pants Fashion received in good condition,_
"penghantaran laju & pembungkusan baik, thankyou",_
Pertama banggg,_
"Because all the items packed together, and",_
Order tilam baby,_
tq atas perkongsian anda,_
"Seller pantas, smlm order rini brg sampai",_
Nanti saya repeat!,_
smlm Oder Harini dh sampai,_
Ni sedap sbbtu recommend,_
Hasilnya barang sampai dalam keadaan yang sangat baik,_
btw tu kaki abg bkn kaki sy,_
"THE state government is providing a one-off financial assistance of RM500 to each of the 199 boat operators in Sarawak this year, amounting to a total of RM99,500",_
reputable brand,_
Will buy again and highly recommend,_
Thank you thank you thank you thank you thank you thank you thank you thank you thank you thank you tahnk you thank youThank you thank you thank you thank you thank you thank you thank you thank you thank you thank you tahnk you thank youThank you thank you thank you thank you thank,_
Performance:Quality the boom 🥳,_
Semua ok Semua ok Semua ok Semua ok,_
jangan ragu ngan seller ni,_
"However, a military-like any other state institution and structure has a role and purpose",_
Safety received,_
We worried that putting the neutering off for two months might cause a problem,_
"Berat 53, tggi 158z",_
Thermostat Dan thermal fuse,_
Sgt2 sesuai,_
Buttercup 3 sudu besar,_
"Utk i berat 49kg tinggi 158cm,ok je tak ketat tak longgar just nice",_
"Fast delivery, 24/3 order 25/3 received, this 3rd times order, will order again",_
bertambah nasi bila makan dengan nasi panas,_
Soft feeling,_
Sebab layan dgn baik,_
"Udah nyoba ber kali' lho, g bisa'",_
Worst management in Pakistan,_
thank you so much chief Chau for you sharing hope you sucses always Xie Xie ciayo,_
Expiry Y2024,_
Brg elok murah,_
Cleanliness:Good suited for kids,_
"Overall is okayyyy,sesuai dgn harga🤍",_
"PETALING JAYA: Following a crackdown on an illegal e-hailing operator and its drivers in Penang, authorities are being urged to ban its app and to go after the firm",_
Just the 2 pin plug,_
"He said the high number of positive cases remained within Kota Kinabalu (53 cases) and its neighbouring districts of Tuaran (55), Ranau (34) and Kota Belud (25), which is dubbed as the Empat Serangkai districts (Group of Four)",_
But i guna utk notes je so its fine,_
"pos terlampau cepat,tapi syg saiz kecik",_
budak pon suka,_
sebab selalu jer hilang,_
7hb11 dh sampai hub tp simpan sampai hr Jumaat 12hb11 baru nk hantar,_
InshaAllah nnti boleh repeat order lagi yew,_
cuma design leher dia agak pelik,_
okay2 laaa,_
"LONDON: Britain has cleared its 700 MHz band of airwaves after a four-year programme that involved retuning nearly 20 million TV sets, freeing up new capacity to be auctioned for 5G mobile services in January 2021, the government said yesterday",_
Barang dah sampai saya beli ye 🤗,_
"I never receive my order, but the app show delivered",_
Super nice to give free gift besides the fried soya sheet rolls,_
Take berapa function apapun tq saller harga murah quality pon standing harga,_
Wore it whole day quite selesa coz shoes are soft,_
"The acquisition, valued at between RM9mil and RM11mil, would be fully satisfied by way of cash payment",_
Even wrapped with bubble wrap,_
Barang sampai dalam keadaan baik cuma kalau boleh mintak seller utk wrap sikit supaya lebih secure,_
harini baru sampai,_
Kali ke 10 beli kat seller ni,_
Dia tinggi sket,_
Pnghantran sgt cpt,_
"5 cm feet, perfect size!",_
Delivery seminggu,_
Order items received safely as ordered and advertised,_
Video and photo not related but items safely arrived!,_
boleh repeat lagii lain kalii,_
Bafhsgbatgehethagatjeggjeyjeyjstjjeymrujeyjsthetjeyhsttjyejsbtukuttehejrukrybwrgetthethwrhwtjeyhqrvtbeyeg,_
Overall handbag sgt cantikk dan comel sesuai utk jalan bersantai santai🥰,_
Senang nak pasang tq seller,_
Puas hati siot pulls aku hahahah,_
Akan repeat beli lagi sebab selesa,_
Saya beli hand wash,_
(Reporting by Chandini Monnappa in Bengaluru and Abhirup Roy in Mumbai,_
o Medium,_
"Smpai2 tu memang tak berbentuk la, sbb berlipat2 kan",_
"Brang sdah smpai packing kemas,lajuuu tq terbaik bosss",_
thats my pulls yalls sila dengki sksk,_
saiz agk kecik jgk laa,_
"i need the new screen, the lan, i just need it",_
Good received in good ordered and nicely packed,_
"have always love this coffee, the coffee not so strong and have chocolate topping",_
Such a down to earth personalities,_
beli 300 pcs bola ni,_
Da byk kali repeat order ni,_
Sampai2 terus makannnn🥰🥰🥰🥰,_
KUALA LUMPUR: Sebanyak RM10,_
"pasang pun senang, tpi pintu je leceh sikit nk adjst",_
"Setakat minum kopi ni, gula diabetes sy x naik lg sampai lebih dr 8 x mcm sy minum 3 in 1 yg lain boleh cecah belas2",_
Charging while listening to music or playing games is great,_
"Barang sudah diterima dalam keadaan yang baik,",_
"Great vid, oneplus is killing it this time again with the price and it&$HASHTAG$",_
Thank you seller cuma ada satu ring rosak kena gantung mirror tu guna pin,_
"brg memang ok, dh pernah cuba",_
"bagus kain nyaa tak nipis tak tebal sangatt, pastu cadar ada getah keliling nice nice sama cam dalam gmbr and ship out timing pon laju terbaikkk",_
nanti kalau berpuas hati saya repeat lagi ye,_
YANG PENTING HARGA BERPATUTAN MASA COVID19 NI,_
Sekali ngadap licin,_
Looking like the z flip,_
"By featuring in yesterday's showdown, Axelsen, a runner-up in 2015, has already equalled Chong Wei's feat of playing in five finals",_
Mangsa banjir di Pahang meningkat lagi,_
Didatangkan dengan bateri bagi mouse dan keyboard,_
Aroma:aroma yg Pasti terangkat🦾🦾,_
"Also the box: Big, and charger box also big",_
inner mcm besar,_
"Price is cheap, hopefully good taste,",_
kene tambah span bru empuk,_
thanks seller dah dua kali repeat order kasut murah tapi nampak macam mahal best sangat guna,_
fast delivery l,_
"Beli untuk yang kedua kalinya, memang sangat berkesan",_
The 39-year-old Williams said two weeks ago she decided to sit out the year's final Grand Slam on the advice of her medical team and did not give a timeline for her return,_
Courier jnt pon laju,_
I didn't install it yet,_
And seller sangat baik!,_
SALLER TERBAIK,_
baju dia besar,_
"Ordered early in the morning at 9+am, for a 12",_
"bile wssp tak bls, call tak angkat",_
Hb berat 82 amik size 4xl,_
Tqsm walaupun penghantaran agak lewat,_
Fast delivery and reasonable price from this seller,_
12/7 item sampai,_
hsushevdudbdhhdbdksjabwbjshvvsushsvsuzhsvsvusvsvssh,_
"Packaging, 10/10 more than enough bubble wrap even for such small parcel",_
l saiz m saiz,_
Dapat harga 7 ringgit lebih berbaloi wehhh beli untuk kawan,_
Penghantaran by seller laju,_
x guna ag,_
"Kontinjen Malaysia akan disertai 28 atlet yang berusia antara 13 hingga 23 tahun selain pegawai dalam beberapa acara seperti olahraga, badminton, boccia, renang, ping pong dan powerlifting",_
"Igtkn beshe² je, deii sampaii MashaAllah",_
Baru pakai yang kopi punya,_
nak tulis repeat word dah tak boleh huhu,_
I baru first time beli concealer maybe,_
just follow the measurements on description but consider 2-3 cm more,_
Okkkkkkkkkkkkkkkkkkkkkkkkkkkkkkkkkkkkkkkkkkkkkkkkkkkkkkk,_
tkde pecah patah atau calar,_
Already try this camera,_
The quality better than my expected good package,_
pos out laju laju,_
Only give 2 screw,_
loose ngam dgn badan,_
Harap lepas ni tak beli lagi sbb dah seguni gelang kat rumah,_
barang paduu!,_
"Five victims are still reported missing, he told a press conference at the Taman Sri Muda flood operation centre on Saturday (Dec 25)",_
Durability:Terima kasih saya beli,_
tlg ye bantu saya,_
Sya beli yea,_
Good quality and fast del tq,_
"Baju nice sangattttt,",_
cute jer maceh,_
t afford their albums,_
Boekk ehe,_
"Taste:Always live the fine, smooth coffee taste",_
dapat la beda nk pkai p kerje n harian,_
tapi kalau tetiba saya membesar emang tak muat terus bahagian pinggang and butt ohh dia bagi free belt,_
all these ------> nah,_
a lot of time already repeat order,_
sarung bantal pun ngam²,_
"The researchers found that ethanol, a liquid with low surface tension, flowed towards the leaf tips, while water, with higher surface tension, spread in the opposite direction",_
"Panjang cukup 7 hasta, kain dia nipis sedikit jadi bila lilit tu tak nampak tebal, saya suka sebab nampak lebih kemas",_
pos pun anta cepat,_
T e r b a i k,_
seluar fit ngan kaki,_
tp bnda sama jer,_
Sekali ngan soket so xyah buat apa dah,_
Quality was so good and very cheap!,_
Fits me very nicely,_
Item dah smpai tp belum pasang lagiii,_
Maybe this is economy packing?,_
Wrap nicely & expired date is next yr!,_
"Chan Nget Mei, can check whether Cerdito and Bakebe can claim ?",_
Tq cik barang dah sampi,_
Tapi tak perasan kata sea shipping,_
"Awesome phone, hope the cpu runs well",_
rupanya sebaliknya,_
cuma warna lain sikit dari gambar,_
beg boleh la cntik cme kcik je sesuai utk kanak2 umur stun dua,_
m watching this video 4 months later!,_
Cant wait to start reading the book!,_
terima dlm keadaan baik walau pos sampai ke sabah,_
"Parcel delivered in good condition, cheapest but worth buying",_
so kite masak,_
sy betul2 suka,_
A very good deal!,_
"Kami masih belum pulang kerana air belum surut dan tidak dibenarkan masuk, katanya kepada BH Online",_
Cva Raj next buy n keep,_
"Oder ahad, sampai khamis ke sarawak",_
🥺🥺🥺🥺🧧🧧🧧🧧,_
"Good product quality, china rom but nothing different from global rom, u can just change the language to english",_
quality okay colour cantik murah kun murah,_
Bagi 4 star sebab tak sama macam model pakai je,_
Beli masa shocking sales,_
"Akibat penyakit itu, keadaan mata kanan Ayu Umairah Mohd Zamberi juga tidak seperti kanak-kanak normal yang lain apabila matanya kini semakin membengkak",_
The Kampung Buluh Gading team was in third place while Kampung Seberangi Jeram came in fourth,_
Price is cheaper than other product,_
Bayar terus seller mintak emel,_
"Project Guardian is just the internal name for one of many automated tools we deploy to identify potentially abusive content, Katrina Lane, vice-president for Twitter's service organisation, which runs the programme, said in a statement",_
"Thankyou seller , items received good will repeat soon okay huhu",_
Order hari ahad hari isnin sudah sampai,_
laju pantasssssssss,_
"cutting agak besar sikit dari cutting baju biasa,",_
But sometimes I have problem locating an address,_
"Measurement is exactly as stated, suitable for big size",_
Chong Xinyun,_
next month repeat sini je,_
"You know Din, i don't think i can retire",_
soon my son will chnage to others since he will be one year old another month,_
It's grey with purple undertone,_
So far size is suitable only colour I not dissatisfied,_
Gambar video tak ada kena mengena,_
Seller is also very kind,_
MATERIAL IS GOOD,_
The slope from back to front was really severe,_
kena amik size besar sikit sbb sizing dia a bit small,_
ok ok ok ok ok ok ok ok ok ok ok ok ok ok ok ok ok ok ok ok ok ok ok ok on o kn k k ok on ok on obii ok ok ok ok ok ok ok ok ok ok ok ok ok ok ok ok ok ok ok ok ok ok ok ok ok ok ok ok ok ok ok ok ok,_
Saya order 2 helai 4 suku yang dapat 2 helai 3 suku,_
My son n parents like it cause comfy inside,_
Repeat buyer like every 2 months because buy in bulks,_
malam palit dan besoknya pasti akan terjumpa mayat cicak yg mati berhampiran dgn palitan itu,_
"Good good good good, third times purchased, recommended!",_
"tp okay la, kalau di bungkus dlm kotak pastu bubble wrap okay da",_
Does the job nicely,_
Casing worth the money,_
"OMG very the recommended this router, sye masukan kad sim YES universiti kasi free sbb kn tgh online dari rumah sangat laju giler, juga nk guna dkt rumah sewa bila balik kampus nanti, sye langgan data unlimited, pencawang kawasan sye banyak tu laju pastu kena letak router tempat open sikit",_
"The problem is that the World Cup has to be every four years to be interesting, Ceferin said at the Expo 2020 Dubai fair",_
Lajuu barang paduu,_
Sape nk tanggung kerugian nnt kalau kerosakan lebih teruk,_
Tq barang dah sapa,_
I can use it properly nice for drawing and colouring,_
mantap terbaik penghantaran sangat pantas sugest seller,_
cantikkk‍‍‍‍‍‍‍‍‍‍‍‍‍‍‍‍‍‍‍‍‍‍‍‍‍‍‍‍‍‍‍‍‍‍‍‍‍‍‍‍‍‍‍‍‍‍‍‍‍‍‍‍‍‍‍‍‍‍,_
"Wangi gile lh beb sumpahhh,btw ni levender yee",_
"Semuanya ok,tq seller,",_
Quality:good quality herb,_
Sekejap je dh ada isi dh,_
Expired bulan 12 2022,_
"elok terletak, selesa",_
I like it so much thank you for making this app,_
Kasut tu lawaaaaastoking pun lembut je,_
tp banyak drivernya yg ga pake protect,_
Tetap jugak koyak,_
"However, the oil and gas services group will not be classified as a PN17 company, considering that Bursa Malaysia has suspended the PN17 criteria until Dec 31 as part of its Covid-19 relief measures",_
Six,_
"saya sangat puas hati, penghantaran laju",_
Ingatkan ada kotak,_
Barang dah pack tapi tak pos out,_
Thankss seller laju padu dan pantas barang ok memang terbaik,_
Barang baik sesuai ngam ngam,_
kain sangat cun tambahan pula dengan layanan yang sangat baik oleh seller,_
People are working and waiting for the food to be delivered,_
Terrrrrrbaikkkk*****,_
"t care about them at all, we love you, Jungkook, with you forever",_
3 Mnyala,_
Walaupun murah tapi material dia mcm kain mahal,_
cable sizd,_
Overall everything is OK,_
lain kali nk beli lg,_
tq seller nanti bole repeat order lagi,_
I gave up trying to get it working in the end,_
Lots of 90's game,_
Berguna dan banyak ruang,_
Barang free pun elok je,_
jnt hantar brg cepat,_
Repurchase these caps again bcs its so cheap!,_
Jimat RM4 untuk minuman Black Whale hari ini!,_
Ni yg ke2 dh order,_
Twitter Id -: $MENTION$,_
1 tbsp cooking oil,_
klu dh bleh pkai nti mmg rsa nikmat bhgia la we ooo,_
Fall in love with taeyeon,_
Produk original & terbaik,_
blm try bg bby hisap,_
Already repeat for second purchase,_
Product as per describe by seller,_
Cuma muka berpeluh bila memakainya,_
"Ia selaras dengan cadangan kerajaan baru-baru ini untuk menaikkan had hutang daripada 60 peratus kepada 65 peratus daripada KDNK, katanya",_
"anak saya suka, material bagus sesuai untuk anak-anak",_
Lim Yan Tong Janice Khun,_
"Penghantaran ok,laju",_
Cntik bkas cermin mata nie,_
"Barang dah sampai, seller bagus buat penghantaran pantas",_
PM bakal saksi pemeteraian 2 MoU penting di China,_
Taste:good rasenya anak2 suke sgt,_
Siapa yg nak beli plain cap recommended ti buy from this shop,_
Diterima dalam keadaan baik walaupun tiada kotak,_
cepat gilertq seller,_
Half the normal speed,_
boleh terus main,_
Everything are good,_
So can't treat people to drink during CNY,_
Barang baru sampai tapi barang landing alamat lain🤭,_
"With risk appetite still low, some of the main picks in the past week for TD Ameritrade clients have been big tech stocks such as Apple and Microsoft Inc Corp, as well as blue-chips, including McDonald's Corp, Walt Disney Co and AT&T",_
always looking fresh,_
Ada 6 jenis clip,_
Delivery by JnT is superb,_
When it will be dragon,_
Comei comei comei comei comei sangat2 anak suka sangat Comei comei comei comei comei sangat2 anak suka sangat Comei comei comei comei comei sangat2 anak suka sangat Comei comei comei comei comei sangat2 anak suka,_
"Easy to apply, nice colour especially the nude pink",_
"Alhamdulillah semua item cukup, bagus j&t staff jujur",_
Parcel lambat sikit sampai,_
Seller x tukar variasi pd color tudung & sy dpt color yg slh,_
Pesanan suda di terime dengan kadaan yang menyakit kn rack nye ada pata bgian ujung,_
Sri Nagara Thandayuthapani Hindu Temple incoming president Dr A,_
Walaupun lmbt sbb banjir,_
The parcel of the ink is safely covered and safely arrived in my own hand 🧚‍,_
"He knew the lyrics to entire Broadway musicals and shared them with his granddaughters Zoe and Madeline during their annual summer visits from Brooklyn, New York, to Kansas City, where he was a renowned architect",_
little bit creamy but still nice klu lip gloss really recommend mcm pki liptint silky girl top up dgn clear lipgloss foundation pun ok ambik yg kcik sbp nak tgok tone dia sesuai ke tak,_
I'm also convinced namjoon watches us freak out on Twitter when they cut their boxes open there's no way he hasn't joined Stan twitter,_
memey berkesan dgn saya,_
"barang hantar cepat, sampai pn elok, xde rosak",_
"Taste:barangan pesanan telah selamat di terima, terimakasih penjual & agent penghantaran yg pantas terbaek",_
Racket pun ringan,_
Kualiti setanding supermarket,_
"Very bad experience, sebab yg pesan lain, hantar lain, Kod csc28 dalam iklan corak lain",_
White coffee well packed and received in good condition,_
seller ni mmg mantappp,_
Fast delivery and excellent packing,_
Terima kasih saller sbb da jual dan terima kasih untuk abg posmen tolong hntar kan,_
Fast delivery and good packaging recommended,_
Klu nak cri barang cute utk anak bulus bole la cari kat sini 🥰,_
Sorry ya tak ada gambar sebab bagi kasut ni dekat orang lain,_
"Safely arrived, thank you seller Safely arrived, thank you seller Safely arrived, thank you seller Safely arrived, thank you seller Safely arrived, thank you seller Safely arrived, thank you seller Safely arrived, thank you seller",_
the dress is so pretty and i love it so much,_
Material:ok cuma tilam nipis,_
Tp silap drpd lori,_
product big and nice,_
tp ni sye gune universal punye plug sbb was2,_
very usefull lalu na sa malayuang biyahevery convinient sa akin,_
7 from RM156,_
Barang smpai dngan baik n selamat,_
order kaler lain dapat kaler lain,_
penghantaran lambat masalah jnt,_
semalam pos hari ni da sampai,_
"kualiti terbaik , penghantaran pun pantas",_
"Kain sarung mimang tidak dinafikan cotton 100 ya, jahitan kemas lagi",_
wayar cable tu anda boleh selitkan di bawah carpet terima kasih seller,_
xsakit kat bby,_
Jarang nak dapat smbal pack yg sedap macam ni,_
delivery also fast although from china,_
Bdn ringan,_
terbaik dh repeat kali 2,_
AAAAA my go-to sneakers!,_
Been repeating order with this company,_
Sdh smpai brgnya,_
Never disappointed every time I need it,_
Terima kasih kpd seller dan J&T,_
Baik boek habis packing ok kasut lawa sedap guna sesuai untuk semua orang,_
Didn't expect can receive this fast,_
Aman ramah,_
dh ciap cuci nnt bleh la psg,_
Sungguh enak dimakan begitu sajaa,_
Brendan Goh,_
The herbs are fresh and big portion,_
Will order again next time during sale,_
Tgu alter labuh baru boleh pakai,_
CANTIK SANGAT PUAS HATI BARANG SAMPAI DALAM KEADAAN BAIK TERIMA KASIH $HASHTAG$,_
Yg penting ada emblem cukup hahaha,_
"Nice bag, quality tiptop sesuai dengan harga yang ditawarkan",_
and i'm so much satisfied with your work,_
"Sanitiser all OK, no leakage",_
$MENTION$ yeeeeeeee,_
Camera visor reminds me of Robocop,_
boleh la beli buat saje2,_
parcel arrived in good condition,_
The material is suitable for our weather,_
seller always packed parcel neatly,_
Kotak sampai dengan selamat takde kemek,_
abaikan gmbr x ada mengena,_
penghantaran cpt walaupun dari china,_
Cheapest in shopee,_
pas bsh jd xcntik kaler nya,_
Not sure if seller salah post but sokay la urgent nak pakai,_
Thank you saya beli yah,_
cuma nk masak ja xtau cara lagi nk kena tgk pnduan cara guna dlu,_
Harga murah tp boleh isi mcm2,_
It reached here in 3 days by Poslaju!,_
penghntarn mmg cpt beli pg ptg gerak hntr boba pon ok je tkde ap2 masalh tq so much,_
dh check td brg cantik,_
"Супер рецепт,",_
"Padahal mau pesen GrabFood tapi alamat rumah sendiri aja susah banget buat ngatur,",_
There will never be any second and next order,_
Beli terus dapat lepas 5min,_
be/7hGRc8KCFyk <a href=$URL$,_
Thank you seller and shopee customer service,_
Like both flavour of noodles,_
"msg minx refund lg 3 helai, seller refundkan terus dlm masa 6 jam",_
"Have't test yet, hopefully okay",_
Display: good bag,_
Okay good kualiti kena dengan harga tapi penghantaran sangat lambat ya ke kota Kinabalu,_
Material:kain jenis elok,_
Beg cantik n mmg trbaikk,_
Suka sangat bebudak bila parcel sampai,_
Material:terbaik padan dgn harga,_
berak anak okay,_
best terbaik best terbaik best terbaik best terbaik daripada korang beli yg tah pape tu better beli oppo punya ni tak sampai 100 pun ha 89 hemgget je,_
Functionality:bilik nampak cantik,_
Sapu atas roti sedap,_
tinggi mana,_
Good good good good good good good good good Good good good good good good good good good Good good good good good good good good good Good good good good good good good good goodGood good good good good good good good,_
"Akan repeat lagi, saje beli 2 dulu nk tgk macamana",_
Terima kasih seller nexr bole beli lagi,_
"Good quality of the product, good value for money",_
bungkusan pun dibungkus dgn kemas,_
Thank you thank youuuuuuuu Thank you thank youuuuuuuu Thank you thank youuuuuuuu Thank you thank youuuuuuuu Thank you thank youuuuuuuu Thank you thank youuuuuuuu Thank you thank yo,_
Tu kurang 1 star tu,_
paking pon kemas sngt2,_
Beli utk tutup lubang angin rumah 🤣🤣🤣 tqttqq seller,_
"Can see car plate during day(less than 1 car distance), Blur at night/rain",_
Semua crackers sedap sangat,_
$MENTION$ good content as always,_
"Murah pun murah tq saller, tggu saller update kasut² baru plak lpas ni",_
My daughter loves this very much,_
okay kotak sampai dengan elok,_
Cantik hitamnya,_
🤪 LOVE SO MUCH,_
Barang baik kualiti baik mak saya baik ayah saya,_
Cleanliness:effective,_
Smpai je terus pasang,_
Harga baikkkkkkkkkkkkkkkkkkkkkkkkkkkkkkkkkkkkkkkkkkkkkkkkkkkkkkkkkkkkkkkkkkkkkkkkkkkkkkkkkkkkkkkkkkkkkkkkkkkkkkkkkkkkkkkkkkkkkk,_
