Sentence,Tagged_Sentence
"Penghantaran cepat, dibungkus elok",_
Perisa sedap macam aiskrim paddlepop,_
Item quality just ok as per mentioned,_
"penghantaran sangat cepat,dua hari dah sampai",_
pengasuh dan ayah tercinta,_
I like this bag Verry cute,_
Lampu berfungsi dengan jelas,_
quality face mask,_
COMEBUYTEA QNO1,_
Barang semua smpai dengan selamat dan mencukupi,_
Bagus seller barang ship cepat je quality pun elok,_
0138324056,_
Pnhtran cpt jugak,_
Salam bohh,_
"Barang berkualiti, barang baik",_
"seller peramah dan senang berurusan , nanty boleh repeat lagy",_
Thank you seller for your good service and fast delivery service,_
Good product quality with value for money and fast product delivery,_
Cuncuncuncuncuncuncuncuncuncuncuncuncuncuncuncunxuncuncun,_
Cept pantas pasti repeat order,_
Tapi harga murah je,_
Seller ship out on the same day also,_
Gooooooooood goooooood Gooooooooood goooooood Gooooooooood goooooood Gooooooooood goooooood Gooooooooood goooooood Gooooooooood goooooood Gooooooooood goooooood Gooooooooood goooooood Gooooooooood goooooood Gooooooooood goooooood Gooooooooood goooooood Gooooooooood goooooood,_
"Under low light, it can capture almost nothing",_
Nyam Kee Jong old is gold,_
29/3,_
Packinging terbaik sebab guna bubble wrap dipacking lagi dengan plastik,_
3 ) were category one and two,_
"Memaaf kan, menyantuni serta mendoakan kebaikan kepada mereka yang menyakitimu, itu adalah ihsan",_
Malaysia Tour Guides Association president Jimmy Leong said the country's experience in dealing with other variants of concern (VOCs) were important as this provided guidelines for the government and industry players to tackle Omicron,_
cheap and taste good,_
ok thanks!,_
lawa terokssss,_
"This bnb can fit g shock copy original v1, copy original v2 and original watch",_
"Smpai2 xbesar rpanya ,",_
"the courier bag a bit dusty but it's okay super fast delivery from jnt as well ,",_
Long expired date to go,_
Taste:smooth,_
currier lain boleh je hntr smpi rumah,_
Labuh pun okay bawah punggung,_
Sng nk pakai sbb magnet,_
Dah dlm mesin pula,_
be/UWr0XFgzhpI>$URL$,_
macam surprise utk diri sendiri bila terima stoking random macam tu,_
Very cheap but affordable and recommended!,_
Sbb kedai suh anta botol da pecah smula ke kedai bru refund,_
Okla Murah jer,_
"Cuma warna kain tu i mntk lebih kpd gold mcm dlm gmbr yg model pakai tu, tp dpt coklat gold",_
I buy it is due to the comment said fast delivery,_
first time dapat seller yg memang padu buat bisnes,_
Belum cuba lagi tengah masak air nak buat latte,_
Semalam siap urusan harini dh smpai kt tgn,_
pembelian yg mudah,_
I received the parcel but it came to my neighbor's house instead of mine,_
Leceh nak order,_
Normal la tuu,_
Thank you comel besar tapak sangat je tapi dua minit tak cukup untuk dia jadi crispy jadi kalau nak crispy need to wait until 5 minit macam tu baru crispy anyway its gooddd,_
Langgan bulan² tpi line mcm sial babii,_
tp terpksa la pakai jgk utk kje sb dh beli,_
bulu tangkiss baikk,_
Nak murah jangan expect barang mcm butik,_
Oder 11 hb sampai 12 hb,_
"Even before last month's extra budget, the IMF saw public debt hitting 256",_
Barang sampai dlm keadaan baik seperti diorder,_
Thousands of youngsters in India have burned down empty train coaches and blocked rail traffic this week in protest against,_
"I urgent nak guna toploader before khamis, and i ask seller if its possible to reach me hari rabu",_
Belum buka lagi barang,_
"Seller cepat pos out barang , senang deal dengan seller ni, kualiti setaraf dengan saya beli dekat kedai harga rm400",_
"Timbalan Pesuruhjaya Polis Sarawak, Datuk Mancha Ata, berkata pihaknya menempatkan petugas Polis Diraja Malaysia (PDRM) bagi setiap lokasi mengundi awal",_
"Dalam pada itu, Kementerian Keadilan memaklumkan bahawa pengampunan itu akan berkuat kuasa pada 31 Disember ini",_
Dress putih bunga turqoise tu material cotton agk nipis mcm kain sarung bantal,_
Blh Beli Lagi Lepas Ni,_
"Good packaging, wrapped with bubble wrap, no leaking etc",_
The clothes is comfortable to wear,_
"with pro acc,help me so much with a abundance of ideas for my work",_
Awning keras n tebal,_
"Penghantaran laju , sampai dlm keadaan baik , fast respon",_
"Seller is good, sending free gift with love letter, nice wording",_
Tak ketat sangat dengan kepala baby okay la,_
How can order missing?,_
boleh tahan besar jgk saiz dia,_
Memory card already installed on my cctv,_
Good quality and agile shipping,_
Ben and Danny closed out the second round with respective two-over 73s,_
Silicone cover: Excellent!,_
I think my whole 38k was dumped and I felt very sad by choosing this laptop,_
sbb kesan gunting yg senget²,_
Tisu bsh ok terbaik,_
"Sorry gambar tiada kena mengena tapi barang baik, beli untuk adik saya and dia cakap condition tiptop",_
It was nice!,_
"Walsh died shortly after the trial, but after discussions with his family, details of the trial and a",_
mula bukak terkejut cutting kecik betul² untuk org yg peha betis kurus,_
Harap mydin upgrade lg service,_
"Color semua ok, cantik cantik",_
Saiz 2Xl ni utk anak saya tinggi 166cm berat 54kg,_
satu jela keras sikit,_
Mya Lamiah Norita Bsz,_
Tq seller kingcg,_
"pants,cpt proses nye",_
"Sugar is the generic name for sweet-tasting, soluble carbohydrates, many of which are used in food",_
tp pembungkusan sume koyak rabak,_
A little bit late in shipping but its okay i can wait,_
Kudos for the intro,_
really good offer during promo 🥰,_
Wasting my hp storage to install this useless app,_
Sin Kai wah seh,_
ENTAH PARCEL KEBERALA KALI NYAAA LAHHH NI,_
Material:kualiti padan Dgn harga,_
Quality pun mantap utk harga yg murah,_
nnti dh hbis blh beli lgi kt kedai ni,_
Barang semua packed dlm kotak dan wrapped with bubble wrap,_
"Thank you free gift, Haven't tried it this brand",_
sebab dia memang fit habis,_
seluar ok harga murah nanti blh beli lagi,_
"The size fitting for me, it is slightly baggy but most importantly the shirt is below my butt lol so that is great",_
38 5403537825 5403530198,_
"Mask okay , selesa tak nipis",_
Work perfectly for my laptop and tv,_
"Rancakk,",_
never dissappiont me,_
"2nd purchased, good service,good quality",_
Awning agak lembut utk anak,_
Selfie very nice!,_
Taste:yet to try it out but hopefully is the texture and taste in my memory,_
"packaging is so so so good, i received all the items i have ordered, good value for money, fast delivery, excellent service by seller,",_
Beli ler uollss murah jee pastu wangi,_
Not recomended to buy due to the function setting is quite difficult,_
20/2 smpai dh geng,_
Really impressed me!,_
"Try it on my tablet, good!",_
Zheng Hoe 00,_
DENGAN KAKI SERIBU KURANG SATU,_
Barang dalam keadaan yg baik dan telah selamat sampai ke rumah,_
nanti nak belu warna lain pulakthank you seller,_
penghataran super laju,_
Tq seller n courier good service <),_
Penghantaran pantas 2 hari smpai,_
maaf gambar xsmpt snap,_
"kain agak nipisssssssssss,",_
The colour is more like mustard colour but i dont mind,_
Boleh repeat sejuta kali nih,_
"I order vans, dapat Nike",_
"my 2nd purchase fr0m this st0re alhamdulillah , tudung 0kay & lawa cuma ada beberapa defect macam benang tertarik but it's small matter laa satisfied Insyallah , will repeat again",_
will repeat again for pasta,_
Cantikkk sgt2 tp xsesuai untuk sy yg berbdn besar,_
This is my second time ordered from this shop,_
Brg sampai dgn elok tp yg beg hitam tu terlalu berkedut,_
Siap bubble wrap tq boss,_
Nanti nak pakai masa merentas desa dan hari sukan,_
seperti di gambar,_
sudah berkali2 repeat order,_
PETALING JAYA: Strut your stuff in the Razak Cup to earn a place in Malaysia's hockey team to the Asian Champions Trophy in Dhaka in November,_
"Mau order grab food Tiba2 keluar, dan masuk lagi di tangguhkan Padahal akun ini sudah lama, ko tiba2",_
"Seller pack barang well,kemas dan ada 'bubblewrap'",_
Baju santek no,_
2 kali beli sini harga murah,_
Pay for worst delivery service,_
"diterima dalam keadaan yang baik,",_
tanya seller pasal size seller tetap bagi salah size,_
yg dark blue besar dr colour hitam walaupun sama saiz,_
but so slow delivery by shoppe eksprss,_
bab nk bg kakak,_
5cm=39,_
"Kotak hauk , tapi kasut cunn",_
"Cair tu biasa laa, dah perjalanan jauh dari kelantan ke perak",_
penghantaran pantas beg semua ok spt yg d order,_
in detail with magnet,_
Baju cantik tp penghantaran sgt lambat,_
Good and fast delivery and I really safe three day day only,_
order harini lusa smpai,_
kalau sesuai nti repeat lg,_
Lightweight and easy to install,_
Stuck kt china 🥴 btw thanks seller,_
tpi okey je selese je,_
"When it comes to the system, FoodPanda delivers",_
Sorry gambar x sempat nak amik,_
Material xnmpk murah,_
work flawlessly (low noise),_
Alhamdulillah barang selamat mendarat dengan jayanya terima kasih,_
Chew said the two also didn't talk about laws to prevent party-hopping then,_
Barang kat dalam tak rosak mantap dan berguna,_
Barang sampai dah blum try gi dok cari cam ner nk guna,_
Spraygun cuba sudah,_
Semua ok cantik cantik sgt elok sgt cantik cantik sesuai dgn harga,_
jgn tubik derak,_
Thick bubble wrap and packed in a box with a fragile sticker on it,_
I would also like to see famous Hong Kong wonton noodles too!,_
Barang smpai tq seller dan JNT,_
Maaf gbr xberkaitan good quality of product saiz ngam,_
Apparently the HELP guys don't even change the delivery address at ALL,_
"thanks sellerreceived in next 2 days after purchase, try something new",_
sarung bantal cantikk,_
thnks dude,_
", sbb barang takda dekat saya",_
"terima kasih seller dan abg delivery, walaupun cuti hari pekerja, barang tetap sampai lebih awal daripada jadual, semoga maju jaya, selamat hari raya",_
Balance of RM100,_
"Thankyou awak ,",_
Hrga pon berpatotan,_
"Among them is Tan Lai Kwee, 53, who gets his supply of fresh vegetables from his community patch in Taman Perling, Johor Baru",_
Pakai saiz s sangat ngam,_
KUALA LUMPUR: Semua pihak terutama pengusaha agensi pelancongan dan umrah perlu jujur serta mengikut peraturan ditetapkan dalam usaha kerajaan menangani penularan COVID-19,_
Quality:bagus berbaloi,_
Pagi smlm order petang pos esoknya sampai memang,_
Taste:delicious to much,_
"harga berpatutan puas hati,barang tiada kerosakan semua berfungsi dengan baik",_
"nak dapat keberkatan & semangat dari team sirpuloh, saya mintak sir syahmi t/tangan beliau",_
Look expensive but the fact very cheap!,_
Barang baru sampai packing cantik terbaik cume pos laju x berapa nk laju sangkut dari 13-11 ari ni baru sampai 3 hari terperap kat pos laju petaling jaya,_
So far so good and seller post it as soon as i ordered!good job seller 🥰,_
"sesuai dengan harga lah, kalau nak beli yg okay sikit bulu tak tercabut korang belilah yg mahal",_
Baju dah bawa ke asrama,_
Sangat sesuai untuk pakai,_
delivery little slow,_
been eyeing this viral sunscreen,_
"Shipped the next day, delivered two days later, the packaging is very good, the service is good, thank you for the gift, it is worth buying",_
hihi comel je kecik molek,_
"Design pun lawa2 🥺🥺🥰🥰🥰 Tak menyesal langsung beli, dah la murah",_
Functionality:works for light waste paper or garbage,_
"Arwah ayah memang tidak tahu adik sudah tiada kerana keadaannya juga memang lemah dan kami sendiri juga tidak tergamak memaklumkan kejadian menimpa adik, katanya",_
The quality is okey Excellent job by the seller,_
Okay saya suka saya Okay saya suka saya Okay saya suka saya suka,_
"Macam saya, ok je",_
Tapi agak kecewa warna,_
"Bila pakai nampak glowing , terasa macam skin remaja",_
"I'm sooo happy,",_
lagi rezekinya,_
Masih boleh fungsi dan tiada sebarang masalah atau kerosakan,_
"DUBAI: As the Middle East enters the hottest days of summer, Saudi Arabia is set to burn potentially record amounts of crude oil to run its power plants and keep its citizens comfortably air-conditioned",_
The battery also didn't last long but that was expected so,_
"Mengulas lanjut, katanya, antara enam elemen itu ialah pengurusan dan perancangan kewangan",_
Beli semua saiz 1 2 utk corak car muat elok cuma corak super wings dan baby bus besar sikit ja,_
Anak sedara suka sgt,_
sedap toppoki nie,_
Parcel received in good condition n item got bubble wrapped,_
Help the dental clinic to advertise for free,_
mmg mcm ni kli kasut mcm ni mmg ringan,_
Separuh dari harga yg di jual di pasaraya,_
Delivery pun lajuu!,_
terbaiklah seller pantas buat kerja,_
Da repeat Kali ke dua dekat kedai ni,_
Blue haze colour is good but the matt finish of sierra grey is pretty cool too,_
"Attendance at this school is at nearly 80 and from what we gathered from our (education) officers, all schools are following the set Standard Operating Procedures (SOP), she said on Wednesday (July 1)",_
Anak umur 10tahun,_
"NEW DELHI: India melanjutkan penggantungan penerbangan antarabangsa hingga 31 Januari depan, susulan kebimbangan mengenai penularan varian baharu COVID-19, Omicron",_
"Tq, brg dah smpai",_
Dia bukan light blue tau,_
"Tq bg beg skali, senang nak bawak nanti, layanan seller pun baik,giler laju hantar",_
"Utk kid umur 5y ke bawah agak besar, umur 6-7y ngam saiznya",_
"Quality:kualiti bagus, jenis material tahan lasak",_
"kasut idaman da sampai, harap muatla kat dia",_
this is repeat order and fast delivery,_
s how you make the rice yellow!,_
Saya juga akan mengesyorkan kepada keluarga dan rakan-rakan untuk membuat belian drpd seller ini,_
sangat berpuas hati sebab baru order dh sampai,_
"Thank you seller, kain sedapp saya puashati",_
seller need to change their packing method,_
"seller sangat baik hati,(bagi lebih benih kelapa sawit),cepat sampai",_
Nasib suami dgn anak2 ckp sedap,_
All the Chinese brands are so so similar in software,_
barang memng terbaik,_
"maksudnya sealed terbuka, so bila dapat je lekit2, harapnya double seal supaya air jeruk tak tumpah dan kering",_
"Stokin tebal, tak nampak kaki, tapi stokin wrna biru tk sama panjang semua stokin dia, yg hitam okay, licin sikit je kalau jalan atas tiles, yg pendek sampai atas buku lali sikit, panjg mcm standard stokin sekolah, yg pnjg sampai bawah lutut, terima kasih seller, courier dan shopee",_
how does it work dont thry have an area of territory they cover or is it whole philippines?,_
Winners Contact me Whatapp only,_
Is it in beta test,_
I loved the small and precised pencil head,_
Alhamdulillah dh sampai terima kasih sorry gambar takde kaitan,_
bila kita pakai auto nmpk segakk kaler pun cantikkk kain elok,_
Teammate Akina Teo took over the wheels for Race 2 and managed to claim a win for the team,_
alhamdulillah brng dh smpai,_
Soon: Boleh repeat,_
"try tgk utk mlm ok clear so far, harap bertahan lama",_
"Quick delivery, well packed",_
4 ke 5 hari baru hantar,_
Fast response dari seller everytime,_
brg sampai hritu buka dah mcm tu,_
Highly recommended and will repeat again next time,_
Tiada kesan tumpahan,_
Barang as expected sama macam dalam gambar,_
Condition baju pun okay kain material semua comfortable 🤗 thankyou 🤗,_
Fast delivery and secure packaging!,_
packaging destroyed,_
Quality:10/10 expired pun lambat lagi,_
tapi bahagian muka ketat sikit la,_
"Mak menangis suruh periksa sebelum itu, kau tak nak dengar",_
More power!,_
Dah la besar hanger dia tp boleh jd foldable kecik,_
"Bolehla untuk rm4, boleh simpan fon dan earphone n kunci, tempat air tu kalau letak air berat skit je belt mula londeh, so kena bwk air kecik mcm 250ml tu",_
Pasai lupa nak inform sesuatu kat penjual,_
trusted seller and I will repeat buying from this seller,_
But a bit expensive though it is from oversea,_
"Kain batik sudah sampai semua corak betul , kain cantik sangat dan lembut memang sesuai buat baju budak2",_
Safely received 🥰 material kain so far so good Selesa and cantik,_
Alhamdulilah cap udah Smpai,_
"Visitors can take a closer look at a guqin (seven-string instrument), play a game of chess, test one's calligraphy skills and admire the Chinese paintings on display",_
Nie terbaik,_
received in good condition eventho the seller didnt put any bubble plastic,_
"Therefore, a strong education background is imperative to shape the future generation of Malaysians",_
Ttttttteeeeerrrrrbbbbbaaaaaiiiiiikkkkkkkkkkkkkkkkk,_
"Terbaik seller,panghntran laju",_
Thank you will repurchase again,_
fuhh akhirnyaa dapat pun,_
safe space,_
Mouse dia tu ok jugak,_
Battery ok cuma bekas dia 1 pecah 🥴,_
"Beg memang cantik ,tak rugi shopping dengan seller ni",_
Product wasn't what I needed but it's my mistake,_
KUALA LUMPUR: Satu Jawatankuasa Pemantauan Bajet 2022 (JPB 2022) ditubuhkan bagi memantau pelaksanaan dan prestasi pelbagai inisiatif di bawah Bajet 2022 untuk kesejahteraan Keluarga Malaysia,_
Bhai please phone ko kuch gante band karne wala app batau,_
"Majlis Tertinggi PN mengambil pendirian untuk menyertai PRN demi membentuk sebuah kerajaan negeri yang stabil, inklusif dan progresif serta melaksanakan dasar yang prihatin rakyat, katanya",_
Have yet to try the maxim coffee,_
Laptop 14 inch,_
Kat luar harga 20 dapat satu,_
Dah terima dengan pantas siap ada free gift multipurpose pocket survivor tool bagus sgt,_
Iran over the past few years has pressured Seoul to release about $7 billion in revenues from oil sales that remain frozen in South Korean banks since the Trump administration tightened sanctions on Iran,_
Pastu nk masuk sehari ni tkle beli internet pulak,_
"No more minor accidents at workplace, cos the steel toe cap is damn good",_
Terima kasih seller ank suka sgt dgn kuda ni,_
Received in good order and quality very well pack,_
com/results?search_query= 23khicas>$HASHTAG$,_
seluar mcm ni kalau Kat kedai rm10 je,_
So I'm confident with the product,_
i be repeat again,_
pilihan di tngan ANDA,_
Kira memang sebulan sekali mesti repeat beli makanan kucing kat sini,_
It's not the thick type socks but it's ok for working,_
laju hantar smlm order hrini smpi,_
Bodoh sapa buat app ni,_
penghantaran is ok,_
Ade karat2 beteri pun berkarat,_
Boleh borong,_
I have attached my resume for your reference and hope to hope to hear from you soon as I am currently working on the same and I am afraid that I have not been able to get the money back from you in the past few days as I have been away with a few other girls in a few days and I have been away with a,_
Quality:repack of sumo sushi rice,_
Thanks for the great deals,_
"Video tak berkaitan, maaf",_
Even peram barang ni seminggu,_
I would like to win that phone in giveway and this is my twitter handle $MENTION$,_
barang belum cuba harap semuanya ok,_
Shipping cepat!,_
sehari jaa dahh sampai,_
Penghantaran tak cepat sangat tapi takde la lama sangat,_
The skirts are very very very comfortable and the material so nice!,_
Cant wait to try itt,_
"Alex Carey will resume on 10 on day two with Mitchell Starc, who was yet to open his account",_
"i tried to put my phone but it fell, so i just put my power bank since its much more lighter than my phone",_
The worse food app ever,_
"Maaf gmbr dan video xde kena mengena,baju elok",_
satu hari je smlm oder arini dpt,_
Kad ucapan mmg murah berbaloi beli kedai ni,_
Kasut yg lembut selesa bila dipakai,_
supporting foot tu xda,_
Aplikasi Bego,_
Excellent service by seller as the order was sent out pretty fast,_
"Btw ni dah kali ke berapa ntah repeat, sangat memuaskan",_
Barang nya udah sampey,_
bungkusan sngat kemas dan selamat,_
Berfungsi dengan baik & cpt smpai,_
Material:SuperB,_
Barang dah sampai ok la gak kan blh la nk buh dlm bilik air,_
Pewartaan mengikut Peraturan Kawalan Hasil Tembakau 2004 itu bertujuan melindungi orang awam daripada ancaman asap rokok yang boleh membahayakan kesihatan,_
Barang diterima dalam keadaan calar tapi minor,_
harga kena dengan kuality,_
"beg dh terima, ok lah sesuai utk anak nak masuk asrama nnt",_
I've previously bought this brand from elsewhere before,_
belang² rabbit upenye,_
The digipack album it really nice and pretty,_
The material doesn't feel cheap,_
okayyyy,_
",pghantaran sangat laju tq seller",_
"The move follows Queensland Premier Annastacia Palaszczuk's announcement of stage-two coronavirus restrictions across areas of Queensland on Thursday, including Brisbane and Gold Coast as well as Townsville",_
These oats are tastier and healthier than regular oats because they are pesticide and chemical free,_
GOOD AND FAST,_
The packaging was very good and safe,_
sellau beli 9rm lebih even dkt tesco,_
brg oklah,_
"The announcement received mixed reactions from parents and students, with some requesting for the SPM 2021 schedule, which will take place from March 3 to 20, 2022, to be reviewed, especially the papers held on Fridays and Sundays",_
Penghntran CPT,_
Product good go o o o o o o o o o o o o o o o o o o o o o o o o o o o o o o o o o o o o o o o o o o o o o o o o o o o o o o o o o o oo oo oo oo oo oo oo oo oo ooo ooo ooo ood ok ok ok ok ok ok ok ok ok ok ok ok ok ok ok ok ok ok ok ok on ok ok ok ok ok ok ok ok ok ok ok ok ok ok ok ok ok ok ok ok ok,_
Sedih sbb smpai smpai dh pecah,_
sgt2 berkualiti,_
Susah nak dapat seluar yang labuh,_
Sampai tertidokkk dia punya selesa,_
"Handsock okay, kain best",_
"First time bought from this seller, good packaging,",_
saya pakai seluar ni longgar kat pinggang,_
Functionality:nice led,_
Fast deliverygood servicei will repeat again!tq seller,_
this is the second time I order,_
But samsung gave me a great deal couldn&$HASHTAG$,_
Comeiiiiii sangattt,_
Pigment:iyup,_
Cantikkk gileeeeee,_
"As a business owner, I need to think about our cost and that includes purchasing ingredients and other materials",_
The material is good and suitable for malaysia weather,_
It stick firmly to bra,_
good break first for me and my kid,_
"THANK YOU SISTER FOR SHARING YOUR BLESSINGS THROUGH JESUS CHRIST,",_
Effectiveness:Wangi dan mudah dibawa kemana-mana,_
Beli untuk hadiah birthday mak,_
Penghantaran dengan cepat dan pembungkusan Terbaik,_
Perak Menteri Besar Datuk Seri Ahmad Faizal said they planned to have more strategic investments and developments in order to help those affected by the pandemic,_
mmg bleh repeat order,_
my je hahahaha,_
Long term brain damage,_
kalau butang dia jadi x betul so kurng memuas kn,_
The grey is light grey,_
t=0m47s> carefully opening,_
Kajang OCPD Asst Comm Mohd Zaid Hassan said police were still awaiting further information from the local authority regarding the funfair,_
Dengan harga sebegini,_
Know it only after i wash and wear it,_
"Hasil Perbendaharaan dan dolar susut, manakala minyak mentah melonjak ke arah AS$74 setong",_
I'm sorry this is another item I bought with it,_
"Tapi ok lh , cantik bila pakai",_
Functionality:susah sikit anak nak minum sbb kena sedut air naik lalu kat paus dulu,_
Taste:good taste as always,_
Pertama kali pakek grab express langsung dibuat kecewa pengemudinya,_
Need to format ur ssd,_
Thank you SELLER ^_^,_
Gudddddddddddddddddddddddddddddrrrrrddrrrrrrerrrrrre,_
I recently had to reinstall this app and it hasn't worked since,_
thnakyouuuu barang dah sampai cantik sangatttt murah pun murah,_
Cute sized,_
i receive many extra,_
Maaf lambat terima,_
"Alhamdulillah dh selamat smpai, kalini jnt laju buat kerja",_
kaldjLzmhxlalxidkallzodoasldooakdbdnzkzkzkskjsjdjksishdjsjs,_
Terima kasih tuan yng menjual,_
boleh guna satu badan,_
Harga pun sgt2 brbaloi,_
bila smpai dan sarung kt basikal,_
buku pun oky tkde kemek,_
Maybe only the size was misinterpretated yesterday,_
Sesuai dengan saiz goodies besday anak nak bagi kat kawan2,_
JALAN TUANKU ABDUL RAHMAN / SULTAN ISMAIL,_
🤝🤝🤝🤝🤝🤝🤝🤝🤝,_
Quality:kualiti oke terbaik,_
Been looking for this style everywhere at the store and luckily found it on shopee,_
Perlu perbaiki cara bungkusan masuk kotak dan guna buble rapping,_
Everytime you order there is an issue with online payment which gets deducted and the order doesn't get placed,_
order 02,_
But unfortunately seller no use bubble wrap so the some products are spoil and got rubber powder,_
thank shopee express,_
outside the door without informing,_
Terbaikkkkkķkkkkkkkkkkkkkkkkkkkkkkkkkkkkkkkkkkkkkk,_
I was left with smaller portion of noodles because the outer noodle crumbled due to poor packaging,_
- -,_
seller post cepat oder harini esok smpai,_
Quality:kualiti cantik nampak mahal,_
suggest sgt,_
beli 2 psg dpt harga borong,_
dalam masa satu hari dah dapat item,_
Next time boleh repeat lg🤭,_
Seller bt kerja pantas,_
"Spec dh mula hogeh, baru pakai sehari",_
I did message them to ask if Xl is too big for someone with height 160cm & they did not reply,_
Luk Chrisgo,_
Received item in perfect condition in just 2 days upon order,_
Wow superb,_
The Manager said the hotel segment recorded gross revenue RM9,_
"So far received in good condition, haven't try yet, dunno the taste",_
Comfortability:recommend ambik one size lebih besar,_
PACKING,_
Material:Simple to use and easy to bring averywhere,_
kain mask pon lembut je,_
"1st time beli yang ini, sedap espressonya",_
Jnis kain okey boleh la pkai kt rumah sebab kain nipis cuma awning xoke,_
"Saiz L, ok muat kat peha tak ketat tak longgar",_
tapi kadang promo gak bisa di gunakan,_
Max panas 230,_
hampir sebulan!,_
bilangan semua cukup 20pcs,_
"It took 9 days to received this, longer than expected",_
Allhamdulillah brg smpi dgn selamat terima kasih seller,_
"Ok sangat , ok sangat , lepas ni boleh repeat lagi , tenkiu seller",_
x mcm seblm ni sy beli,_
Cntek tp xleh lasak,_
"However, Faroese substitute Olsen struck in the 89th minute to dent Denmark's defensive record before Joakim Maehle added a third for the home side three minutes into stoppage time",_
pnt jgk seller ni,_
warna lebih terang dri dlm gmbr,_
Because i am at office and the thing is at home,_
"bantal lembut ,besar n kemas",_
Bought for my dad and i hope he likes it thank you so much for the quality and quite fast considering from oversea,_
But somehow can still be used,_
"If your exact measurement same with me, Please choose below than XL size",_
terbaik barang mau rekemen kat member 2,_
