Sentence,Tagged_Sentence
Received well packed and protected items,_
6184/6225 daripada 5,_
Hope dpt buang daki² kt leher dia,_
"The item so good and cheap,",_
dia punya printed tu laser bukan sticker,_
"anak enjoy skipping, azam nk kurus",_
Tpi Barang bagus,_
Maaf video x de kne mengena,_
Its good and comfortable lah to wear anywhere,_
The proses bit slow,_
order petang semalam harini dah smpai,_
"Kain pun sedap,lembut je and tak nipis aaargh suka and recommended sgt, as a plussize ppl, im happy!",_
9 🤩🤩🤩🤩🤩,_
"Lebih 1 la, slow, and block the road, still need customer take by own self",_
"Tapi Tak Cuba lagi, hopefully semua baik2 je",_
"puas hati nnty nk repeat oder , ni nk bagi gift dekat kawan harap dia suke",_
Delivery laju barang sampai dalam keadaan baik,_
Please form a group (max,_
Mengcantikkk tak try lg tp hrp senang dibentuk lah 🥺 heheh tq seller,_
Klau ckp dgn seller pn msti d jwb msalah dari kilang,_
Yuabcdefghijklmnopqrstuvwxyz,_
Thanks for the excellent service seller!,_
Fast delivery via Ninja Van - ordered on 19,_
Nice lawa teruk!,_
"I had some Apex Coins left in my account, hence, the additional amount",_
"Selain itu, program eksklusif ini membolehkan usahawan mencapai pasaran berpotensi menerusi strategi pengiklanan pelbagai jenama media premium dinamik, bertenaga dan unik seterusnya menjadikan perniagaan anda kekal mendahului pesaing menerusi perancangan kempen yang mampan",_
Harga mur2 dr seller lain,_
Parcel lambat sampai bukan masalah pada seller tapi jnt problem,_
Good quality products,_
I wear it 2 days only,_
"good quality, like",_
Design:design pun okey,_
Barang dah sampai dlm keadaan baik dan kemas,_
belum try lg simpan utk pantang,_
Good product and for sharing with thanks for your feedback I appreciate it thank you so much quality of 🧦,_
Very usefull i can print every i want and vers simple,_
Nice bro very good,_
delivery dalam seminggu sbb oversea kan,_
Material:kain elok sedap pakai tapi panas sikit,_
harap ssuai dgn klit kpla,_
"Regardless of the reasons, the fact that the credentials were inaccurately stated and it triggered controversy that runs counter to the fairness and common sense that I have underscored, Yoon said",_
Boleh repeat dekat seller sebab laju buat kerja,_
"Koperasi yang terlibat dalam industri pertanian akan turut dilibatkan untuk menawarkan barangan asas tanpa melibatkan orang tengah untuk mengawal harga, katanya",_
Due to seller mistake they give me a few sample dog kibbles,_
"So, yg jd powder tu sikit je la",_
Will repeat again beli brg ii lain pula 🥰,_
Looks fresh and new,_
Smell so good infact its smell very similar to BBW,_
"96 last year, also lifted by a 1",_
Quality:barang dah,_
Wihi,_
"But believe me, the excitement vanishes 48 hrs after having this in your tech backpack",_
Sangat mmbantu,_
Memang betul betul fast delivery ya,_
Kain best and baju ngam2,_
"alhamdulilah berfungsi dengan baik,good kualiti",_
1 minggu lebih aku tunggu,_
We'll be moving soon next town pero hindi abot foodpanda,_
"Received all in good order, thank you all the best in your business",_
hatap berkesan itu yg penting,_
"Fast dlvery , good pcking , item in good cndtion , overall puas hati !",_
Price is cheaper than pharmacy!,_
Doubt the authenticity of the product,_
kain bestt tapi barang kat adikkk so xdpt snap,_
mcm Galaxy A905G,_
"ARSENAL are playing as good as they have been in a long time and if they manage to stave off serious harm when they clash with Manchester City today, they can look forward to the rest of the season with legitimate optimism",_
Need to purchase more as i think it is better to consume as daily supplement,_
Seller terba,_
Aqil sing a song,_
Mengikut maklumat yang dikumpulkan YWM bagi dana waqaf tunai yang dikutip seluruh negara hanya RM50 juta bagi tahun ini,_
lambat sampai but it's okay,_
Item reach in good condition,_
"Kalo nak urgent, tak sesuai",_
Betul-betul macam apa yang saya bayangkan,_
cuma saiz je muat muat sngat,_
Balut2 la sikit kot ye pon,_
But this brand is best for me,_
Quality:Tekstur pekat,_
"Can't fit my phone, but ok",_
Sng je kopek kertas tu klu sruh wife yg buat sbb kuku dia pnjg sikit,_
Seluar cantikkk size ngammm tqq,_
Thanks seller and thanks j&t courier service for fast,_
Texture:tk try lg,_
Kucing pun taknak makan,_
xsempat nak memasang,_
Brg ckup packinging pon molek,_
Save arrived but the parsel glued was open,_
Seller post cepat so overall okayyyy terbaik recommended sangat sangat,_
kena getah,_
Shall place order again soon,_
Saller pos sgt laju,_
2mini 1box,_
Next blh repeat popcorn sedap ni,_
argh!,_
Blahblahblah,_
"The design is good, cute, the material is thick, it is very worth that it supports local products",_
Parcel in a great condition,_
Puzzle 3d macam ni sangat bagus untuk kanak kanan,_
Clear sgt,_
Masa: 9 pagi hingga 12 tengahari,_
"X nipis sgt, xnampak dalam pon",_
Rangers (SCO),_
"Ok,kasut sgt lembut,harga murah dan cantik",_
receive with good conditiondelivery pun cpt smpi,_
Totally disappointed with digi,_
Extra 5 sachets per packet would be better if packed in a box or bubble wrapped,_
"Bukan setakat voucher, promo pon banyak",_
btw comel en saya punya love kat mask tu hihi :3,_
Donde las compraste yo las quiero me hiciste regresar a mi infancia,_
"Under the , the city's mini-constitution, the appointment and removal of principal officials in Hong Kong must be approved by the central government",_
Effectiveness:Delivered as requested after 9/6,_
meterial yang nipis dan selesa pakai,_
Barang packing tak proper dibalut dengan bubble wrap jer,_
But physically nice,_
Delivery mcm biasa la ambil masa sikit sebab dr china murah utk bg gift kat customer thank you,_
Nice couple eating together,_
item bubble wrap safely & products received in great condition,_
cantik hope tahan lama,_
"harga yang berpatutan, mampu milik, kualiti yang baik,",_
Yang penting semua happy dapat makan snappy tommmm & good value for $$$,_
"Ingat mainan tu semua lembut, rupanya ada yang keras",_
my china friend recommend me this brand!hope it tastes good,_
"Penghantaran laju, standard oversea",_
recommended love sangat!,_
Ada rezeki nak repet beli lagi,_
He said they were investigating the case under Section 304A of the Penal Code for causing death due to negligence,_
"And nice color too, exactly as pictured",_
Cantik gile seluar ni kena sgt dgn tinggi 150 cm NICE NICE NICE NICE,_
Thnaks love the taste so much,_
46_1643589021,_
Sz XL tpi mcm sz L,_
Tq seller love it 0,_
Jam berat mcm ori,_
Good product quality Preorder and waiting around two weeks to receive it,_
bahagian tepi banyak kemik,_
So slim and sleek,_
Material:kain sgt² sedap pakai dan lmbut,_
"Fast delivery service, good product quality, good value for money, well packed will repeat order",_
Products are good and long expiry date,_
Hope blh la bsh hlg,_
Very ggooooooooooooooooooooooooooooooooooo99ooo9o9d,_
"Haven't tried all of these, hope it tastes good",_
"4ply, very thick and tough, great!",_
tapi dpt bentuk sama,_
Will recommend to my friend !,_
I buy this for my husband birthday surprice,_
"12gb ram that is fast , but MediaTek chipset seems to me it&$HASHTAG$",_
Dalam gambar tak sama dengan yg sya dapat,_
"Penghantaran lambat, kotak kemik ckit tp OK la",_
penghantaran sngt pantas puas hatii tenchiuuuuuuu,_
Seller gulung tidak lipat,_
"Aroma:harum,sedap baunya",_
kasut getahh,_
Worst food delivery service app ever,_
check brg sebelum hantar,_
Good nice awesome bravo fast delivery,_
Postage cepat & sangat berbaloi i love it 🥰,_
"LITERALLY COMEL GILAA hika now has a place to live in hehe <3 , thank you seller for the fast shipping <3 take one day je ^^",_
Lembutnya kasutttttttt,_
tp klu pilih 1cm lbh sket ikut saiz asl,_
Beli kat shopipipipipipipipipipi jugak lah,_
Good quality with solid body,_
"Puas hati sangat, murah pun murah",_
Tq buyers 🥰,_
senang bawak barang kerja,_
Beli 2 tapi satu lagi dh guna,_
Sesiapa nak beli boleh cuba beli kat sini,_
The material nice sangat cantik for a cheap price,_
Ok sangat puas,_
Cantikk cantikkk,_
good packaging and everything is gooodddd,_
Hope my dog likes it,_
Bukan menanti masa yang kosong utk menghidupkan agama,_
Aplikasi terkeren,_
bubble wrap tebal nau,_
Already notify the pandamart but they said that they wont give me a refund,_
🤣 jadi gais,_
Barang da sampai harap2 berfungsi dengan baik tq seller tq delivery man,_
Material:look good dan kelihatan cantik,_
so far semua ok will repeat buy,_
Kasut' dah sampai penghantaran cepatttttt terbaikkkkk seler nnt repeat order,_
dah 2 kali beli di kedai ni,_
Ahha taha berfungsi ke idok jgn tnya sbb saya tk pakai ceyh,_
Kena chat seller untuk make sure dapat semua color sama kalau jenis cerewet macam saya lah,_
easy to clean my laptop,_
taste strong,_
Hrp2 dtg dgn cita rasa i,_
units are also lean tannies vs,_
nora kasi 10bintang🤩🤩,_
Golllllllllllllllllllllllllllllllllllllllllllllllll,_
if normal price will be too pricey,_
", nk buat ootd memang sesuai",_
"Overall semua okay , surely will repeat again !",_
Penghantaran guna The Lorry,_
tapak agak tebal n selesa,_
satu dia kasi size besar,_
"Order 29/3, terima brg 7/4",_
"Sori gambo x kait, weh sedak dooh kasut2 sini tp hk ni kne ambik 1x,",_
"Tertuduh boleh dikenakan hukuman penjara minimum tiga tahun dan maksimum 15 tahun dan denda sehingga 600 juta rupiah (RM176,000), kata Putu Yudha dalam satu kenyataan",_
murah n sterilized,_
kaliti baik,_
Memang terbaik first time beli sini memang puas hatii🤗🤗 sampai2 terus pakai,_
🤭 Terima kasih seller dan jnt,_
I have received the stainless steel clothes hangers in good condition and exact order number of the items good value for money in fast delivery service in good packaging and packing,_
don't expect to much but still okay i have big hip M is okay but my waist so small need to wear belt the length of pants also okay,_
Just oopps sorry!,_
Good product with fast shipping~,_
Baju semua dah sampai dengan cepat,_
kain mmg cantik berbal0i dgn harga,_
"Fast order fulfillment, beli tengah malam, lepas subuh seller update dah extend subscription",_
Always a great experience,_
What is white thing,_
While the poll may be delayed amid disputes over the rules $URL$,_
"Taste:good, nutritious,easy to prepare for consumption",_
Harap suami muat lah pkai,_
"ACTOR Ashraf Muslim's father, Muslim Bulat, 67, passed away due to Covid-19 on Tuesday, Berita Harian reported",_
"As a yoga pants, the size is just nice for me",_
Tu je review,_
Ngam2 sme mcm sy order,_
Nice product good value nice no damage everything fine,_
TQ seller Item dh smpai,_
bln depan saya repeat lg 5 ya,_
location pn x blh on,_
Purchase from this shop second time,_
Puzzle quality is good,_
Very nice colours and the colours really stay on,_
material pun premium solid terbaik,_
jnji brg ckop,_
kalo pakai no hp yg lain bisa,_
Hrga berpatutan mampu milik,_
maaf ya lambat sikit,_
"Good quality, color doesnt luntur when washing, the material is soft and comfortable, shipping also fast, tq seller!",_
"rack dh selamat sampai,condition tiptop,",_
I had low expectations on this cardigan as it was cheap n i wanted it just for casual use,_
88390,_
Siapa ckp tak nak nmpk alamat pendek umur,_
Terima kasih sudi kongsi rezeki,_
Tapi rasanya kuat ni 🤭 kalau okay nanti kita repeat next colour,_
Apsal kemas sangat,_
tarikh smpai menipu,_
"Alhamdulillah selamat smpai, sedap, bokeh try , recommend",_
Value for money for the price,_
2 free items received as well,_
xyah nak pendekkan,_
"We hope to continue working side by side with the Ayer Hitam MP and his team to help those in need, Ismail added",_
Taste:chocolate taste nice,_
seller bauk,_
9 dpt rm10,_
Let me try first,_
Oh Cassie needs that asap&quot,_
Keadaan barang pun dalam keadaan yg baik,_
dhlah kempunan gila dh nk minum kopi ni,_
"When the people we love go through tremendous struggles, it is expected that we, as their family, partner or friends, will feel great pressure to help them 'get back to where they were'",_
"packaging pun okay,bubble wrap tebal n secure",_
lampu semua,_
right sizes,_
Kalini beli dapat banyak yg lembik macam dah tak elok,_
"I think from my perspective, the signs have been there for a while that the rest of Asia is improving and we've kind of stalled in our development",_
Taste:X Rasa lagi tapi harap2 la sedap,_
lembut nipple shield ni,_
"Adventure tourism, and especially adventure trekking, is still pretty uncomfortable for the average person and there's not a lot of modern conveniences (readily available such as) bathrooms, hot showers or reliable food",_
Cuma tag shining shop jahit terbalik,_
Effectiveness:sgt2 best for my sensitive skin gurl,_
Tq seller sbb balut dgn bubble wrap,_
Aroma:very very good,_
"Thanks for the haidilao free gift too, will continue support!",_
Berkali-kali repeat dah from seller ni,_
hanger semua cukup cuma mungkin nipis sikit tapi takpe nak guna gantung tudung je tak berat pun tq seller for fast shipping,_
I have received the grip in good condition,_
Dah repeat order kali ke 4 or 5,_
pakai mmg best,_
trusted seller yaww,_
MODE,_
It's stuck on and can be peeled off without leaving any residue,_
berat 53 tinggi 150 saiz m sesuai sangat,_
nanti kita nak cuba teh bidadari pulak,_
Harga pon mur mur je love terukss,_
China's zero-Covid target means no compromising on lockdown,_
Next time please balut plastik tu tebal sikit,_
"tapi xpe, bole alter jahit dat kt belakang",_
"Seller chat dulu utk confirm sblum ship, mmg terbaik, recommended beli kat sni harga murah, kualiti 10/10",_
Give to my sister as she need it,_
"Sebanyak lapan kertas pembentangan daripada pelbagai agensi merangkumi perspektif makro ekonomi, sektor logistik, industri perumahan, penguatkuasaan dan advokasi kepenggunaan serta isu berkaitan buruh dibawa dalam mesyuarat khas berkenaan",_
Sangat sedap pakai dan kain selesa dipakai begitu saja,_
ada yang sampai memecah server pemerintah dunia berkaitan dengan freemason,_
Ignore the other pucture,_
"The bag has arrived, thank you, the shipment is fast and the quality is good",_
sumpah lawa gilaaaaa!,_
Tunggu sales 11,_
Penghantaran yg baik dan material kain yg berkualiti dan selesa,_
"First try this brand, taste more spicy than sour",_
btw thank you seller for the excellent service,_
I really love this brand !,_
"They look exactly like the picture,",_
yg lain saya xrecommand kan,_
"(Surah al-Qiyamah, ayat 36)",_
$MENTION$ one Plus nord Rock,_
Package has bubbled protection,_
lembut kulit dan wangi,_
my 12 y/o daughter loves it,_
"Barang dh sampai walau pun kotak kemek,tp isi dlm ok",_
Quality was excellent,_
*** sorry video is not related,_
kain legging sangat cantik,_
Good quality and good luck good fast delivery free download,_
Selle4 pos laju btw,_
Very clear and ease to use,_
This phone looks great! Twitter: Moontages1,_
Seller process cepat tp courier pending kan penghantaran sampai seminggu lebih,_
selesa tak sakit tumit,_
korang beli la jugakkkkkk (sorry for the bad quality of the picture and video's review 🥺),_
berbaloi lah kalau you guys beli memang dia tahan i baring baring tadi elok je lagi satu i tidur lasak so memang berbaloi beli tak mahal pun,_
"It is best to park the vehicle in a lockable individual garage overnight, Hack recommends",_
Material:Quality rubber,_
Nice Product Packaging,_
"Serious sangat berbaloi beli dkt seller ni, barang pun berkualiti, harga pun murah, servis pun laju",_
igt smpai lambat lagi tgk kejap je dah sampai,_
received the pillows in good condition,_
Semalam order harini dapat dah,_
Kain sangat nipis dan bahagian pingang sangat melebar(xde getah langsung),_
The size was just nice to hold & lightweight,_
Law berat sangat tanggung sendiri,_
smlm bayar hri ni dh smpai,_
Harap tekak boleh terima,_
Material oke tak tebal tak nipis,_
"Tens of thousands of people protested in Brussels on Sunday against COVID-19 restrictions, some clashing with police who fired water cannon and tear gas to disperse them near the European Commission's headquarters",_
"There is no defect, everything is good from material, strap, zipper",_
senang nak bagi baby makan,_
Kasut semua cantik!,_
I love the towels,_
Some kids who stop eating meat may just start eating more bread or pasta,_
Sedap laaaaaa,_
"Saiz L fit, but sleeve too short for me LoL",_
cute and cheap !,_
The first bra is quite longgar,_
Mahu keluar segala asap,_
ve been at this for 6 months For the love of God can I finally win,_
Kasih barang sampai baik,_
"the product works very well, I love it got this at only rm102 during 9",_
81 hektar yang awalnya dikelilingi hutan selepas mendapat izin daripada orang tuanya,_
beli satu free satu,_
It's took time to receive email but it's okay,_
ingt bsr tpi tkpe berbaloi dngn hrga,_
"Sampai dalam keadaan yg baik, tapi penghantaraan sedikit lambat",_
Similar to description,_
Harga sangat murah!,_
Mcm nk pakai terus,_
Hrga murah and best jaa pkai nnti hbs kta rpeat lgi yaa,_
Quite surprised!,_
"Minum panas² sebelum tidur, esok pagi² dah rasa nak membuang",_
Sangat sedap pakai tk tau nk hbaq rasa bila pkai tu sejuk ja,_
seller bungkus barang pon baik,_
Saya akan repeat oder utk luar rumah pulak,_
Well done seller and courier service,_
"sesuai dgn harga , laju pon laju",_
Alhamdulillah cepat smpaiii thank you sellerr,_
Cepat hantar n terbaik,_
"Penasihat kanan Kumpulan Krisis Antarabangsa Myanmar,",_
"Bila lahir dekat kedah, membesar dekat n9, kene la beli dua²",_
"cutting kecil mmng beli utk ank umur 9 thn,mmng padan elok",_
"Lovely & pretty light purple colour sports top,",_
mask tebal sesuai dengan harga,_
seluar pun ngam sgt tak ketat tak longgar,_
Ikut actual size yang korang selalu pakai,_
tapi nk masuk dock xboleh,_
kain cantik sgt suka suka,_
bila nak pakai kata kita dh pakai,_
Penghantaran yang pantadsngt2 recommended sellerbrg berfungsi dgn baik tengkiu seller,_
Warna yg dipilih juga dpt spt yg dioder,_
Мыть обязательно перед приготовлением,_
"Hantaran cepat, bungkusan ok",_
The cotton material is soft,_
barang sangat berkualiti sesuai dengan harga,_
Good delivery time and food still warm tq,_
Walaupun dari HK tapi takdelah lama sangat nak sampai,_
Wanxia,_
Sampai dalam keadaan elok tanpa pecah,_
Orng suruh beli jdi sya mls buka lagi bgus xda pecah xda masalh,_
"Suma ok, cuma wrna y dberi bukn wrna y kita pilih",_
"Goalkeeper Aaron Ramsdale re-joined from Bournemouth, Ethan Ampadu completed a loan switch from Chelsea, before Max Lowe and Jayden Bogle arrived on permanent deals from Derby County, and Scotland winger Oliver Burke joined from West Bromwich Albion",_
Flavor padu,_
ALL ARE RECEIVED IN A GOOD CONDITION AND FAST DELIVERY,_
thanks seller and saya beli ya,_
Kaulaiti produk baik,_
kain cantik giler tak kecik and quality sangat lah worth all you penny hhe love it delivery arround 1 week,_
"Tgk yg ni tebal so berbaloi ngn hrga, mak pon suke",_
already told the seller,_
Terbaik terpantassss,_
1325 trilion pada akhir Julai 2021 merangkumi 34,_
She's requested and she's loved the hbags so much,_
"Good value for , excellent service by seller",_
Wath i Money =,_
poww,_
cantikp boleh repeat oder lg,_
dah repeat order satu lagi,_
"4 per cent year-on-year in the first quarter of 2020, the latest statistical figures released by the country's Department of Economic Planning and Statistics (DEPS) at the Ministry of Finance and Economy has shown",_
Xtau bpe kali repeat dh,_
so far so good thanks you,_
Delivery in expected,_
Jacket jeans rm10 je,_
Good service of seller and shopee express delivery man,_
Material is super comfy (soft fabric),_
nseb saiz ngam ii ngn kaki tok saye,_
quality so far okay je and kain tak kerassss,_
Harap seller check balik,_
harap barang berfungsi dgn baik,_
Penjual bagi bateri sekali,_
Quality:solid products,_
Even a plate quite bigger!,_
All nice and good condition,_
seluar dh sampai🤗,_
One of the best in the Biz,_
But the stream of mist is not too high,_
I bought pink colour one last time but no smellthis one better,_
Taste:Sedap tapi pedas,_
They are betting on the return of glamour,_
Sgt2 praktikal dan bagus,_
mask cantik okay,_
Not gonna upgrade!,_
Seller x payah pakai ABX dah,_
mmg terasa perubahan,_
"098 juta), Datuk Seri Siti Nurhaliza (488,000), Exists (301,000), Yonnyboii (300,000), Iklim (297,000), Hujan (257,000), Search (227,000) dan Ukays (212,000)",_
Each item is individually wrapped with extra protectonfor glass bottle,_
"Bau yg sangat wangi, packaging kemas",_
cantikkkkkkkkk sangatttttt !,_
WiNnie ChiA,_
Kalau nak beli better beli ngan2 size,_
Oder yg kedua kalinya,_
kain lembut sngat,_
Finally received my bag,_
"Yeah man, crazy creative transition!",_
- Foto IG Nad Zainal /> Nad semakin seronok dengan kewujudan saluran TV dan OTT menyebabkan produser berlumba-lumba menghasilkan karya yang bagus,_
maaf video xada kena mengena,_
sbb tv plug dia bukan plug Malaysia,_
kain tak try basuh lagi,_
"cant wait to try it, it comes with freegift if lip mask thankyou",_
Overall cantik dan berbaloi dgn harga,_
Try bercucuk tanam,_
Boleh lah pakai,_
Thanksss untuk freelock jugak,_
Baju ok je quite ngam ngn badan,_
Nord for life,_
"Kain dia keras kejung, saya da basuh pun still keras susah nak bentuk, sedih nya lahai takpelah nasib murah je, warna dlm gambar ni lain",_
"Cuma mau aktifin akun lama aja segala harus naik banding, gagal pula, padahal gak pernah ngelanggar ketentuan aplikasi",_
Barang sampai dalam keadaan yang baik dan penghantaran yang cepat terima kasih,_
niceeee nt boleh repeat,_
"Sebanyak dua cek diberi kepada Datin Seri Zizie iaitu satu cek daripada saya berjumlah lebih RM200,000 dan satu lagi cek daripada Puan Norhaili yang jumlah untuk membuka akaun itu lebih kurang RM600,000 hingga RM700,000, katanya",_
Tay said he expected the number of people seeking help from loan sharks to increase further when the extension for bank loan moratorium came to an end,_
Material PP yg super mantap,_
"sangat cantik, Puas Hatii",_
Out of my expectation dengan harga murah macam ni compared to other brands yang lagi mahal,_
Minyak dah masuk dalam gearbox,_
i like that dia mcm canvas,_
"received parcel in good condition, very fast delivery and thanks seller",_
Saya percaya hakim lain juga begitu,_
Seluar dr jauh nmpk mahal,_
Lama sikit kalau shopee express,_
Cun ngam,_
It did not name them or provide further details,_
"the World Food Programme estimates that five million Yemenis are on the brink of famine and that 50,000 are actually starving",_
Your welcome po,_
TAK PERNAH MENGECEWAKAN,_
order khaski,_
Alhamdulillah terbaikkk highly recomended seller ni,_
easier to use and great performance,_
1 camca kecil esen vanilla,_
"Siapa yang mengeluh kerana ditimpa musibah, maka dia mengeluhkan Tuhannya",_
confirm repeat next time Tq,_
Yang grab food juga ketepatan waktu nya baik,_
Baranggggggg paduuuuuuuuuu tqqqqqqqaqqwwqqqqqqqqqqqq bosssskuuuuu,_
Colours of the paper bag is nice,_
Maaf gambar tak ada kaitan sebab tak sempat ambil gambar semalam,_
Paid for only RM1,_
Excited sampai tak sempat snap pic,_
"So fast delivery and good service, the saiz suitable with my shoes and so comfortable, thank you for the service",_
Packging kemas berkotak & berbubble wrap,_
Love itt will repeat order for premium next ada free gift one candy but I already ate it thanks seller,_
Okey lawo,_
dah berapa kali x ingat repeat kat seller ni,_
"Exactly what I wanted, thanks",_
tq buat sales 4,_
nine apps,_
"boleh pilih color,chat saja seller pasti di layan",_
Chloe Choong,_
pakai pun ok la,_
"Korang yang nak beli tu, baca description dulu tau",_
Ada lebih skit jeee,_
The books came in a good condition too,_
"Barang telah sampai, packaging baik, fast delivery,",_
"Very good quality and nice to my body 152cm,52kg,xl suitable for me fit, comfortable and very nice, very happy to wear and swimming with my lovely doudther next time can buy another colour again",_
Kna improve lg packaging,_
"Fast delivery, quality quite thick and kasar hope comfortable",_
I love the men chest bagwill repeat order soon🥰thank you seller,_
"Product very nice, and cheaper than the others",_
Sound okay la padan dengan harga,_
"kalau letak phone, mcm tak firm",_
Quality:bagus mcm beli kat butik,_
