Sentence,Tagged_Sentence
🥺 bole buat ootd nnti ‍,_
"i beli this powder sebab nk kawal minyak dkt muka , sebab i beli sunscreen yg finishing dia tak matte so dia buat muka jadi berminyak sikit",_
Smooth bila pakai,_
I have been buying from this trusted seller many times,_
Material:Ok for my baby,_
sampai 8/6 penang,_
"Instead, they came up with a way for people to use a smartphone to record themselves as if it were a tape recorder",_
My parents felt very satisfied,_
"There's so many things we need to monitor before a final decision can be made, he said",_
"Barang smpai semua cantik, anak suke sgt",_
got the right size after reading the ratings paid 19 sen only,_
lembap apps ni,_
Tapi kali ni nampak lain pula sebab tiada cop,_
"All the Best,",_
"Fistime beli sgn seller ni,sgt peramah n fast response",_
I can wear it on eid mubarak <3,_
Baju selamat smpai corak cantik ank suka ngam2 tp kain nipis ok la tok buat tdo mlm,_
good cantik gilaaaa sumpah cantikkkkk good good good good good good,_
"Untuk makluman, talian WhatsApp MPS yang lama sudah tidak dapat digunakan",_
"Kualiti elok, sound sedap, pakai kat telinga tak senang tercabut",_
IMO:,_
beli sebab wangi and memang keras tudung bawal saya,_
"l, definitely repurchase after finished",_
Penghantaran lambat cikit tapi xpelah sebab barang terima dlm bungkusan yg kemas dan tidak rosak,_
Terima kasih barang selamat sampai dalam keadaan baik dengan tanpa kerosakan,_
sangat baik dan cantin harga pon murah tak tau nk dapat harga murah ni kat mana penghantaran cept,_
cuma size 34 brand lain,_
Terima kasih Seller dan Jnt,_
Baju cantik2 perfect condition seller bagustq bagi freegift,_
Tapi yang bolster tu xdqpqt seperti yang dibeli dan sudah selesai pos smula ke seller,_
i love my pulls so muchh,_
walaupun random tapi design semua comel2,_
paling ii pon bg la kotak hshs ni buble wrap je tu pon nipis la bebenornnye,_
Choon Yeah Tan,_
It is suitable for beginner like me,_
"Order on 23/03 morning, ship out on 23/03 afternoon, received on 24/03",_
Semuaa dalam keadaan yang baikkkk,_
"Dh try pakai bateri die, okay",_
Material:sturdy & strong,_
Well received within 3days,_
my Samsung Galaxy S10 just died so it would come in very handy to win a brand new OnePlus Nord 2,_
Youli is very thin,_
Dah lebih 5 kali rasanye beli kat sini,_
thnkyou somuch sbb mmg urgent nk posbkat player kutu,_
"SEOUL (Reuters) - South Koreans will forego some of their most cherished traditions when they celebrate their thanksgiving holiday of Chuseok this week, as the coronavirus forces many to hold virtual services instead of visiting their ancestral sites",_
$MENTION$ Yeah that&$HASHTAG$,_
"warna cantik dan yg penting selesa dpakai n murah jgk,",_
jc chao pai - 1,_
"In an exclusive interview with Sky, the first since he left the military, Stringer said unusual activity was first discovered by contractors working for outsourcing company Serco and alarm bells started ringing",_
Tq wanyyy,_
Jadi saya pon teracun ehek,_
Nk try iron tgk mana tau tetiba jadi aaron aziz ke,_
"Barang dalam keadaan Baik ,delivery laju,boelh cuba",_
kalau bocor tak akan basah,_
Tapii lain orang lain hidung,_
"Sumpah selesa gila slippers dia and for those yang nak beli, just ikut je saiz asal korang",_
s cool to see what you can get for a fraction of the price,_
Cara pembungkusan perlu dibaiki sikit,_
macam original one,_
"That year saw countries worldwide commit to the framework laid out in the Plan, as well as to develop and implement their own national action plans to tackle AMR, during the World Health Assembly (including Malaysia)",_
Berpuas hati dgn seller tq for the service,_
Pembungkusan agak tdk selamat sbb hanyan balut buble wrap yg nipis,_
Barang sampai cepat walaupon PKPBungkusan,_
Tak cantik dalam gmbr lain dpt lain jangan harap sngt dpt mcm dlm gmbr,_
Been using all Boonga skincare,_
"Lampu terang, boleh tukar warna (putih, merah, pink, biru, hijau & kuning: kena pandai adjust mod tona untuk dapatkan warna-warna ni)",_
hei,_
"Very good, we can already use it in the laws, highlighted a lot",_
zzzzzzzzzz gbr takde kena mengena,_
yang purple lawa sangat sangat,_
Video xkena mengena gmbr je yg sempat snap,_
When chat no response at all 🤬,_
Very nice size,_
They are a fraud and they don't refund money either,_
ingatkan available within date je tapi kalau nak beli sekarang pun boleh je,_
tq good seller,_
Cantik dan comel sangat-sangat stokin nii,_
Selesa jer kata anak,_
lupa nk hantar agaknya,_
thankyou cuma xda gmbr nak bgi,_
packaging juga kemas cuma delivery agak lambat,_
"A number of countries around conservative Latin America have taken steps to decriminalize abortion, including Argentina last year and Mexico, where the Supreme Court unanimously ruled in September that penalizing abortion is unconstitutional",_
"The order of the closure was taken into account for the safety and health of the hawkers and public to prevent an outbreak of Covid-19 virus, MPKP president Azmin Zainol Abidin said in a statement on Wednesday (Aug 26)",_
Terbaik sangat suka ubtuk bergaya menarik penghnataran cepat,_
Tak cakap pape pn,_
Barang dah samapi dalam masa 3 hari,_
2 brg ni sgt2 membantu msa vacation sy bru2 ni,_
Thank you seller give five star rating,_
Saiz kcik cket,_
-kualiti 5,_
Hope to deal again with this shop,_
Siat Fong Chong,_
"seller packed it really well with lots of bubble wrap and the plastic in photobook has no wrinkles fit the normal pc size well but if use sleeve, put the pc in the fit size !",_
bubble wrap parcel,_
My favorite shopping online destination for clothes in Indonesia,_
Saiz besar dpd expectation,_
"A genuine flying catamaran aimed at the very well-off, the aircraft features a spacious lounge and five suites for guest passengers",_
siap pasang tali dan grip,_
Tq seller barang berfungsi dgn baik,_
57 juta),_
"Neymar sudah meledak 70 gol antarabangsa, tujuh kurang berbanding pemegang rekod sepanjang zaman Brazil, Pele",_
"OK baik, boleh lah, awal x awal kemek dah kotak, buka dlm dah barai, tapi kne betulkan semula, salotape bagai, barulah OK",_
Beli sebab murah lagipun nescafe lover,_
Tq seller penghantaran yang cepat dan pantas terbaikkkkkk,_
Not in hurry,_
"Not bad, genuine, cost-effective super high after the activity discount, very easy to use, send things or, the first time to buy, will also buy!",_
The combination of the tea very nice to drink,_
Sedap puas hati dah banyak kali repeat,_
Ha siap dh baju utk adik dan anak nya,_
"cover lawa, tmper glass pon tebai puas hati",_
"Food service, riders, duration time",_
**bukan gambar sebenar,_
Kebanyakan skru longgar,_
Lepas ni boleh repeat order lagi,_
cengginiii seller,_
Wasted my money to buy these and now they are going to become rubbish,_
Trusted seller and definitely will deal again in the future,_
"Wife suka,",_
I suka gilaaaa,_
im really amazed at the effort oneplus put into the launch video,_
"colour pudar sikit dr gambar,biasala filter kan mmg nmpk cntik",_
Dalam dia bnyak jugak lah,_
"At other companies, however, A lot of non-union performers signed away rights that they had no idea about, says Katie Watson, the union's national director for voice-over contracts",_
"Under judicial management, a court appoints independent managers to run the affairs of a financially distressed company in place of existing management, a move that is often looked upon favourably by creditors",_
TerbaikkkkTerbaikkTerbaikkTerbaik,_
tenkiu so much seller & courier,_
Material:barang sudah sampai penghantaran amat laju hari ni order esk dah sampai,_
"The quality is very good, the color is very beautiful, I like it very much",_
sya duduk sabak bernam ambil masa 2 hari je alhamdulillah sampai harap susu sye bertambah,_
"I think a woman's IPL would be incredible, the 21-year-old added",_
Klu isi kasut yg besar agak sendat,_
Baru ngam geng,_
tpi ok la barang dah smpai dri yg d jangka,_
dh la murah!,_
Shipped out on 1,_
cuma bahagian body basikal buruk sikit sbb mengerutu,_
nk kasi byk bintang,_
Nais gilerrr HAHHAAH amik saiz sendiri je ngam ngam,_
I pernah makan sambal keluaran ULEG ni time my dad bawa balik dari INDO,_
hihihiiiiii,_
beli untuk suami suami suka,_
Tak tau nk sedih ke ktwe,_
My twitter handle : krishanth ($MENTION$),_
Yellow Color wrong size order size 36 but receive 38,_
Seller peramah dan sabar melayan kehendak buyer,_
Order whale tapi yg sampai mermaid,_
Barang dah sampai nie cun jew,_
s purpose,_
Thanks I just want you to have the same thing and I'm sorry I,_
One out of 3 packs had nearly punctured packaging due to sharp objects or rough handling by the seller,_
takda bubble apa pun,_
Woahh tk expect kain diam macam tu,_
"Fast delivery, good and easy to put your goods",_
x tau la rase camne,_
Laju seller n J&T buat keja,_
The official mcd's app gives no information about the rider and his number,_
"dah lah mahal,sebulan",_
Lots of items from other korea shop arrive during 5/6 days but i have to wait from you for 2 weeks,_
"good product quality,value for the money,good service,tq",_
"so effective when night,i buy it as precaution step",_
Sedap dipegang,_
nntii boleh repeat lagiii,_
Klik Target Labur dalam aplikasi myASNB anda,_
elok elok sedap didengar,_
panjang nya size sejengkal jari,_
delivery bagus wsap dlu nak sampai,_
Good item for money,_
Best value for money good product quality and quality quality is excellent for all of the features,_
Mantap pak abu naya pak karim,_
Safety:I think the safety just fine,_
Terbaik seller Siap dapat free gift lagi,_
sorry video and pic are not related,_
Barang dah sampai cuma belum sempat pasang pada kereta je lagi,_
"The SWS survey was commissioned by think-tank Stratbase ADR, but screenshots of it were leaked by a candidate briefed about the results",_
1 boleh pkai,_
"Kualiti sangat bagus, kaftan2 nawal warna semua vibrant",_
"Yg putih nila saiz S, yg putih biasa saiz SS",_
"Doakan saye kaya, murah rezeki, sihat dan dekan this sem, Amin!",_
Actually I salah address nk sent so nak cancel order pun tak sempat,_
she pulled jaehyun & hyuckie <333333,_
Received the carton boxes in good condition,_
"Penghantaran laju , harga pun okeyy cuma kaki sotong tak sama panjang ada kaki yang panjang ada kaki yang pendekkkk",_
ambk y box biase,_
"Of the actives, G3 Global and SMTrack both gained half-a-sen to 8",_
7 million stolen in 2016,_
simpan waktu bersalin dihospital nanti,_
Alhamdulillah3x,_
corak lawa murah,_
tak sampai sejam dah dapat email,_
It's value for money with great ratings from customers,_
Oklah semua ok,_
"Sedapppppoppoopopp,",_
2) set location services to always or while using the app,_
Moscow says it has no plans to invade Ukraine,_
Barang xcukup,_
It's wrapped perfectly and good bargain,_
well pack and worth to buy,_
Love love love nike,_
"Good quality like waterproof material, reasonable price and fast delivery",_
quality so good!,_
Bubble wrap nk pakai yg tebal punya:),_
Rubbish app I need verify my new phone number and email but show me my new phone number got registered,_
Dah try dah terbaik laaa,_
alhamdulillah semua ok n baik,_
Tak sabar nak guna utk next vacation,_
This has resulted in changing employers' expectations and propelled higher education institutions (HEIs) to rethink and redesign their education curricula,_
Pijau dlm mulut,_
"AHHH finally ,",_
Boleh lah menari nati nak buat tiktok content wkwkwkwk tentiuuuu,_
tgk ink hbs,_
Persediaan utk bersalin,_
but still cantik tudungnya,_
"Box cute sgt , dpt free 1 pcs",_
kering jer but worth it laa dgn harga nyaa,_
Cantik sangattt tapi tak try pasang dekat katil lagi,_
Cantik o🤩my mum sukaamuat muat jaauntuk kaki yang besar tu beli satu size tambah daripada size yg sebenar,_
puas hati guys 🥰,_
Haven't open the noodle yet so can't tell the damages,_
"Taste:Sedap, selalu minum untuk cuci perut",_
Very good seat and very comfortable but only negative point the red reflective sticker stick a bit out of alignment and the adhesive not so good but this price consider fair value,_
Items received intact and correct quantity,_
Seluar okay tetapi saya dapat zip berkarat dan hampir rosak,_
Sbb dlam kotak sudah tersedia alightment,_
semoga dpt memberi manfaat,_
"Buka je parcel, barang dah berterabur",_
I told you once in video to make a video on realme slim book laptop,_
The best delivery service,_
seller pon respon bl ditanya,_
"SPACs raise money in public offerings, put it in a trust and then aim to merge with a private company and take it public, typically offering shorter listing timeframes and strong valuations",_
Nnt nak repeat!,_
"bayar petang, malam seller dah pos",_
Service mmg pantas,_
Maff gmbr tak da kaitan but kualiti selipar sangat baik smpai dmgn slamat,_
Klu X Dorg Jemu Haha,_
nice packaging n fast shipping,_
mmg puas hati dgn harga,_
kain sembahyang dh sampai,_
Lagu ini menceritakan perihal saya yang tidak yakin atau 'insecure' dengan diri sendiri,_
"On Nov 1, she admitted that she had not accompanied the victim to the police station",_
"s more a painted on sports bra, which I don&$HASHTAG$",_
makin teruk tahun ke tahunn,_
"The process was held with a strict emphasis on compliance with Standard Operating Procedures (SOPs), in line with the Covid-19 Prevention Guidelines under the National Recovery Plan",_
i like it i like it i like it i like it,_
"3rd time buy,",_
repeat order utk kli ke tigaaaaa,_
sy nk yg labuh2,_
Hope delivery is a bit fast,_
Take 2-3 days to arrived,_
use cod if u really need to use their service,_
Taste:Memang lawas keluarnya,_
Bubblewrap elok je,_
Bungkus dengan sangat baik,_
Bungkusan kemas brg cepat sampai tq,_
insyallah will repeat another color lepas ni,_
Best sangat beli dengan seller ni,_
Omar A Long jom,_
Taste:Penghantaran sangat pantas,_
Boleh wat doorgift juga ni,_
"Sticker mmg random tapi rezeki kebetulan dapat mmg nak warna nude macamtu, thankyouu!",_
Alhamdulillah item diterima dgn baik,_
"Received all items in good condition, good value for money",_
pampers yg mudah nk pakai n selesa tuk anak saya,_
Cantik sgt² saya suka dan senang dipasang kat dinding,_
Well packaging as usual,_
Selesa nak pakai kalau mask tu ketat,_
selesa dipki,_
Agensi Keselamatan Kesihatan UK menerusi Twitternya menyatakan akan membekalkan lebih banyak kit ujian kendiri di pasaran,_
Item sampai dengan selamat dan dijamin original,_
"Nice product from the seller, fits me well",_
Sory pic & video xde kna mengena,_
tip top laa,_
Apps ni semakin rosakkkkkkkk tada gunaaaa baik tutup kedaiii masa org perlu di situ lah buat taiiiii cilakakkk,_
Labuh-29,_
"Selain itu, Hakim Mahkamah Tinggi Shah Alam, Datuk Abd Halim Aman, mengingatkan remaja terbabit yang dia wajib hadir mengikut jadual dan mematuhi setiap aktiviti khidmat masyarakat yang ditetapkan",_
Keadaan ini akan membahayakan nyawa penduduk yang mendiami atau melalui kawasan itu,_
Mak dah pakai tapi dia x ambk gambar,_
Verry Verry Goog🤓🤓,_
Received within 2 days after placed order 🥰,_
"Servis penghantaran laju gila,",_
penghantaran sangat laju good job,_
Penghantaran pantas dan pembungkusan pun baik,_
Further extensions will connect the main airport and eventually other cities and towns in the coming years,_
Lampu dah sampai ye cantik sgt cuma xpsg lagi,_
"6 peratus untuk setahun penuh, sejajar dengan pembukaan semula meluas ekonomi domestik yang disokong oleh kemajuan kempen vaksinasi COVID-19",_
"Tapi,4 kedai sy pegi, pekerja dia pandang atas bawah then layan sy acuh tak acuh je",_
**photo and video are not related**,_
so far baju okay je still boleh pakai since untuk tidur je kan,_
"Lepastu barang pula bagus, kain yang berkualiti dan sangat selesa",_
Lawaaaaaaaaaaaaaaaa,_
Will repeat soon 🥰Walaupun beli 1 je tapi packaging dia terbaik saya suka!,_
Nicee thank you seller looks good package arrived safely,_
Kalau ada manis2 sikit baru balance rasa sambal ni,_
takdak defect pape,_
I tried to press home button but it doesn't works,_
Alhamdulillah🤲 Sampai dah jubah saya,_
brg boleh la,_
"Fast delivery, nice product, very tastes good!",_
Order yesterday arrived today !,_
Alhamdulillah Selamat mendarat dgn quality yg baik memang puas hati Cuma skg ni byk yg pos Guna ninja van lewat skit sampai dan update kureng,_
Impressive $MENTION$,_
Received in good condition and fast delivery all item received correctly and good,_
"Very tastety, can adjust sweetness by adding more or less water",_
Ordering for 3rd time,_
"Walaupun saya menerima satu untuk sekian hari semasa cuti, ia tidak kurang daripada semua lengkap",_
"Delivery was fast af, my items came correctly",_
"If I were the brands in this app, I would pull out my store and sell somewhere else where peole can buy more",_
Item received in a very good packaging,_
Expiry date Sep/Oct 2023,_
Will update once effected,_
500+- gram,_
hello people baju dia dahlah wangii murah cantik 🥵,_
"Nice product, value worth",_
It's not fit in my hand but i can adjust also,_
m chalked?,_
Cantikkkk sangat warna-warna jam ni,_
Barang smpi dgn baik untk nk bgi hadiah hri jdi kt gf korang blh la,_
"Cantikkk n murah, good seller, fast post by sellerm",_
Dah 2x dah oder kt,_
selesa sngt untuk budak2,_
"Normal use this for works and traveling, feel more secure for files store in flash drive",_
sebab mudah lipat,_
semoga murah rezeki selalu 🥰,_
Nice packaging and satisfactory delivery speed,_
Thank you bagi banyak free gift!,_
Tak sempat nak gambar,_
good good good good good good good good good good good good good good good good good good good good good good good good good good good good good good good good good good good good good good good good good good good good good go,_
Produk dalam keadaan baik dan memuaskan,_
"1000000000 follow ig kami tau, semoga yg mna follow tu ika doaakan lagi murah rezeki ig $MENTION$",_
worth sngd beli taksesiaa tapau 3 terus will continue purchase shirt kat sini,_
lew contacted me and he&$HASHTAG$,_
Cari pharmacy sini semua habis stok,_
Tq seller brng da slmt smp,_
"Taste: good product , good service",_
Packaging: In plastic bag,_
"Sebagai galakan, syarikat korporat terbabit pula diberi status pengecualian cukai oleh Kementerian Kewangan",_
Semua item is right,_
- kalau paling rendah pun still tinggi (tak muat letak dalam bag macam mini tripod),_
"It's great, the prices are great and the goods are great",_
Rs nk repeat lg wrna lain plk,_
Dapat free gift weh,_
pghntrn da biasa la klu dri china mmng lmbat,_
APLIKASI PALING SAMPAH,_
Anak kita shuukeee sgt,_
Barang onhold lama,_
"Another laudable initiative under Budget 2022 is the continuation of the MyRail5 initiative, whereby students and the disabled can enjoy unlimited rides on KTM trains for RM5 a month",_
puas dengan tampilan dan fungsinya,_
semattt siakk,_
Performance:Barang sampai dengan selamat kualiti gambar dan material baik warna seperti dalam pilihan,_
Don't hv to worry of it being too tight as it hv tiny white stoppers to protect ur ears,_
I don't know adjust time for analog,_
Never tried marrakesh tea before,_
"Selamat sampai Sabah, n tq free gift",_
seller pom pos cpt je cnie j&t mmg the best lah,_
Tolong kekalkan sama macam dulu,_
alhamdulillah ok selamat,_
seller pos semalam harini sampai,_
"Quality:Äșťøńìșhìńğ,",_
"31 (Xinhua): Vietnam reported 16,515 new Covid-19 cases on Friday, including 16,476 locally transmitted and 39 imported, according to its Ministry of Health",_
Cept dan pantas,_
Pakai kat dada pum selesa sngat 🤩 zip semua okay takde rosak,_
"PUTRAJAYA: Although the prices of essential goods have increased, this is not due to the indiscriminate pricing placed by traders, says Prime Minister Datuk Seri Ismail Sabri Yaakob",_
Baru nak try and hope berkesan memberi tenaga sepanjang hari,_
Serta murah,_
Hal ini berdasarkan SN yang dinobatkan berusia 60 tahun ke atas,_
"Anak baru 10 tahun tapi kaki seluar ngam2 je dengan dia, sebab dia agak tinggi",_
"While Twitter, Facebook and Instagram have unveiled the rankings of the best publications on these Olympic Games, YouTube is still analysing the positive impact on its platform",_
penghantaran pon x laa lambat,_
"Ahhahaha,",_
tissue is a biological organizational level between cells and a complete organ,_
Mantap Lh Akunnya TOP MarkoTOP,_
Cleaning Effect:hope boleh la,_
Beranak czer nx week,_
Thanks seller for your quick response and excellent service,_
masak guna ni je,_
Variety of design and all looks nice,_
Comel2 je sesuai sbb nk bg goodies utk bday anak,_
Kucing saya suka sangat,_
harga berpatutann beli time sale 11,_
Keong,_
Photo dgn video x relate,_
I missed it totally,_
Barang cepat sampai and beli time harga promo,_
"Time duduk pun ok , kain nda terangkat nampak kaki",_
That's why we are so over weight here in America because we don't follow these healthy food remedies,_
Sesuai utk botol Pureen sy,_
s Always Sunny in Philadelphia,_
x th bpa kli beli dah,_
Anak berat 7,_
Issue unlike HP printers!,_
nnti kita beli lg lain kali yer,_
huru hara drone terbang,_
"This product quality is soooo good, so high class i could say",_
bdk² mmg nmpk pelik sikit la klau pakai,_
bukan jenama sebagaimana yg kamu iklan,_
"Overall ok, tak tebal, tak nipis sgt",_
"Tapi in the meantime, your behalf should improve the packaging supaya lebih secure",_
"Lembut,tak keras so tak terletak lama sangat",_
The size is accurate for me,_
"Parcel telah diterima, pembungkusan bagus",_
received in a good condition and thank you for the free gift,_
lampu nyala waktu kitaaa lalu,_
Uwuwuw murahh gilos huhuhhuu mangkuk besau mmg puass nice seller brg no defect,_
Tidak terlalu mencengkam dan tidak cepat mengembang,_
Berat 70 amik L,_
Utk elak calar okay dahh,_
Dpt harga murah jer,_
Semua ok baik baik sahaja,_
mknan dh nk hbs bru terigat nk buat view🤣 apa2 pun service seller mmg tiptop cepat giler smpai terbaikk next nk repeat order lg,_
sampin okey sgt,_
Je terus try jjajang punya,_
bli trus 12 pek sbb de diskaun,_
Overall its a good earphone value for it's price,_
good quality with best price,_
Good product quality Good product quality Good product qua,_
penghantaran ok xla lambat sgt,_
Laju and perfect,_
Design: 5 stars (can be match up with any OOTD including casual or sporty),_
Quality cam tk kena dengan hargaaa,_
I have tested it,_
Quality:ok blh sedap rasa,_
tapi buat kje nyet2,_
Display: big,_
Tastes exactly like the ones from those RM5 coffee cups dulu,_
"Plastik rabak, sib baik barang ok",_
terbaik mantap boleh repeat lagi,_
Paduuu boleh beli recommend kecik saja boleh try beli penghntran ok,_
"kualiti ok, saya suka",_
Ailynn Teoh,_
Corak dan warna agak menarik,_
terbaikkkkkkkkkkkkkk cantikkkkkkkkkkkk,_
"Selesa pakai,cuma sedikit sendat kat perut",_
Material keras juga,_
Items safely received and well packed!,_
2 packs are short expiry,_
Gambar takde kene mngena sebab beli on behalf of my brother,_
Sesuai untuk remaja yang sedang membesar,_
"Great product quality, good value for money and fast delivery sangat cantik",_
Cuma barang ada kotor sikit,_
"Easy to assemble, i bought the biggest one for my giant laptoph",_
screen akan nmpk gelap,_
"Sejajar dengan peningkatan sentimen semalaman Wall Street, kami menjangkakan sokongan belian itu akan turut memberi kesan positif ke atas bursa tempatan, terutama saham teknologi selepas Nasdaq ditutup hampir mencecah paras tertinggi",_
"kualiti baik, cepat je ship out dan sampai pun cepat 3 hari dah sampai plus packaging 100 so takrisau kalau rosak ke apa thankyou seller!",_
so have to improve,_
I just can't understand,_
Safety:kurang memuaskan,_
Cntik n lmbut kain nyaaa,_
This is only,_
Fakehope weh hmm silap sendiri jugak tak baca aku just dapat cover untuk kunci je cover remote tak dapat sebab kena beli asing,_
kain nipis tapi selesa pakai size pn ngam superb good quality mybe i will repeat,_
You can preview your ticket here,_
inside Bak Ku Teh not so fresh,_
m still trying,_
getahhh lembuttttttt!,_
sb zip pun dah rosak,_
Seller shiped out awal,_
pwnghantaran tak lamaa,_
Thank you thank you than youThank you thank you than youThank you thank you than youThank you thank you than youThank you thank you than youThank you thank you than youThank you thank you than youThank you thank you than youThank you thank you,_
Texture:rasa masin sikit,_
"Saya sangat kecewa sama driver grab , saya pesan grab car L , 4 orang Padahal yg 2 anak kecil , di bilang overload dan harus tambah 5000 , karna saya gk mau saya di suruh turun , lebih baik gojek mobil kecil saja 5 orang gk comen , ini pesen grab car L , kaya naik angkot aja suruh bayar sendiri payah",_
super duper satisfied with everything,_
LOVE IT SO MUCH!Untung Betul beli Masa 11,_
Agak lembut dari yg ori tommie tippie,_
Order Hari niesok sampai,_
xingat kali berapa repeat dengan seller ni,_
Cantik sangat the packaging of course product pun terbaik and thank you for the free gifts,_
up status pun makan masa yg agak lama,_
Dapat semua fragrance oil yang dikehendaki,_
harap2 dpat cas hp laju,_
dan seller sangat membantu,_
