Sentence,Tagged_Sentence
Baju pun cantikterima kasih free gift🥰,_
Tom yam flavor,_
"Nasib tak beli yg branded mahal, yg ni pun quality terbaik, jahitan kemas, zip okay, mmg berbaloi",_
Terima kasih akakku dan abng,_
Nice and comfortable short pants,_
barang pun dapat dengan begitu cepat,_
sebab kain dia tak nipis & tak tebal,_
delivery pantass!,_
bungkusan tetbaik,_
Lepas ni rajin laaaaa menggosok,_
Overall satisfactory!,_
seller yg bagus dan responsif,_
Kurma best sedap lembut dan tak terlalu manis,_
macam pakai kain pulak,_
"The new Sarawak Museum Complex opening has been shifted to early next year, but that doesn't mean that visitors don't have another museum to visit in the state",_
"sy nk minta tolong cik aien isikan detail komitment luar dari slip gaji jika ada, untuk memudahkan sy bantu buat semakkan kelayakkan ni",_
that different looks cute in the other way,_
"Also, for XL it would be better if the shirt is slightly longer",_
Dapat sana seperti yang di order,_
tunggu nest kain yg sampai,_
Second time buying from the same seller!,_
Very fast response and delivery by the seller,_
"The crude palm oil (CPO) prices are expected to trend lower in anticipation of rising inventory and unsustainable exports, the research unit said in its latest report",_
Penghantaran 4,_
hoodie dia pon nicee terletak je bahu dengan kepala,_
sila la beli ngn seller nih,_
The scarfs are not tight and just comfortable enough to wear it,_
walaupun murah tpi sgt selesa,_
Cantikkkksknebeyifyhktud7difcitdusxk jlut7sccituudvic75d,_
"Great that it has micro sd, which is sadly lacking in the upper ranges and why I&$HASHTAG$",_
Penghantaran barang ok tak cepat tak lambat,_
penghantaraan yang cepat dan pantas,_
gih bli cpt,_
letak kat dapur takut ank pecahkan ok cantik clear je cermin tbaik 🥰🥰,_
nasib baik seller double kan packaging,_
Thanks you seller ship out laju,_
Cuma X test lg,_
m so happy that I did it,_
tgi 150,_
bola dah sampai kat kampung,_
ҬᏒbᎪᎥᏦ,_
"Bagaimanapun pada 2020, Malaysia kehilangan 122,000 hektar hutan semula jadi",_
"bad packaging, but luckily product no damage",_
oder 2 helai tapi dapat sehelai ja,_
Brg cantik sgt sya suka🥰,_
selamat smpaii‍‍ bole repeat lg sbb xde yg hncur pon,_
Patut ambil size 2XL untuk orang yang berat lebih 65kg,_
"Menyesal beli, saya order size L , tpi bagi size kecik macam size S dan saya hubungi penjual dia cakap semua free size, lepastu apa guna buat pilihan size S M L XL semua tu ?",_
Haritu ambil 2xl,_
have a nice day ahead!,_
And also received cashback which is great value for me,_
It's okay if they reject my refund request since it's just a two dollar thing,_
"Penghantran cepat,sesuai sgt utk kaki sya",_
Puas hatiii fast deliveryyy,_
tq seller fast delivery kaen berkualiti tebal and corak yg cute,_
baby 5kg perlukan 4 spring,_
Material:good very good,_
Elok kualiti with harga puas hati sngt2 recommend,_
memang terbaik padu,_
Shi Min Chew,_
Got the product at insanely low price during 5,_
Satisfied with all the games,_
dengan ini saya nk bg rating 5 star,_
Size fit me as a jacket normal sue loose,_
Tq seller barang dh Selamat sampai,_
3 star je sebab seller jenis buat keje cincai,_
"Colour nya cantik , menarik , dabooom",_
I didn't have many so I don't take any goal for granted,_
beli kat besday dia,_
Mask kualiti elok,_
kalau amik satu saiz dari biasa korang pakai kena pakai stokin,_
"Timbalan Menteri Perdagangan Dalam Negeri dan Hal Ehwal Pengguna, Datuk Rosol Wahid berkata, ini berikutan tempoh itu dilanjutkan dari tarikh asal daripada Khamis lalu ke Rabu depan",_
walaupun xdpt harga penuh,_
Pigmentation:not very pigmented but overall im satisfied sesuai dengan saya yang tak suka colour terang sangat,_
Barang diterima dalam keadaan baik dan dibungkus dengan bubble wrap,_
Memang berpuas hati sangat warna pun cantik grey color,_
tapi untuk peha tu just sekadar ada je,_
"However, the delivery service is horrible",_
baju dia singkat sikitt tapi still cute,_
Fast response !,_
Sape² nak saya nak jual rm24 shj,_
im still satisfied,_
Worth to purchase with such promo price,_
Best phone in this segment i guess !,_
"MBPP will continue to study the residents' needs after the RFP for the Teluk Kumbar market is done, he said",_
Akan repeat order lg pda msa akan dtg,_
"Plastik dia td ada sikit koyak tp tak apalah, aku risau makanan aku ja rosak",_
Mmg cantik gilerr,_
nice design by OnePlus Nord 2,_
"Material:Kualiti terbaik, bagus",_
The lip stains in shade $HASHTAG$ & $HASHTAG$ are quite pigmented,_
0 bagi meringankan beban kewangan mereka akibat pandemik COVID-19,_
Seller tak wrap properly,_
lampu dalam keadaan baik & berfungsi scra normal,_
It's ok for me since I like both,_
ini barang banyak bagus woo!,_
Tp berbaloi sgt2 la,_
Pos lambat sikit so kalau korang nak urgent takleh laa,_
s so easy to toss our phones in the landfill every 2 years that I&$HASHTAG$,_
Ada apa sih dengan aplikasi ini kok mulai meresahkan,_
Charlie's Adventure - RM46,_
Good quality fused adapter very tight fitting and tested working,_
Very cute bag for occasions,_
Good packaging and I got everything just like the order,_
eden_ omg 🥰🥰,_
Brg dh smpai awal drpd tarikh yg dinyatakan🤩🤩dgn selamat,_
Kualiti kain sama mcm inner biasa tu,_
Maggi xpecah elok dlm packaging dgn order2 yg lain,_
Sbb penghantaran laju + secure,_
Sgt2 cantek dn murah,_
Padahal saya cuman mesen makan 1 hari 4 kli?,_
Harith -,_
kemas pantas,_
Just paras betis sahaja,_
Bought many and will continue to support,_
FMCO sama kot,_
Takda calar or apa2,_
"Bang, coba beli treasure x dinosaurus yg merah",_
Ni kali ke dua repeat beli dengan saller ni,_
authentic products at best affordable prices especially during sales,_
sapa nak pakai baju rupa mcm gitu?,_
boleh simpan benda benda atau barang yang kecil,_
bought 5 hehe super fast delivery!,_
"Kejohanan berkenaan akan disertai 2,000 atlet dari 50 negara",_
"nice secured dalam kotak lagi, quality baikkk habissss, sebelum ni beli lembik dy punya kain tu kat kedai lain tapi kedai ni keras lagiii terbaikk!",_
nsb amek besar cket,_
"Quality kain best, tebal and sejuk",_
Give it to meeee!,_
Suami kata baju sedap pakai,_
The packing without charger but you can use charger usb micro to charge,_
"Secure packaging, tiada hanger yang patah mahupun rosak",_
Hahhahahhahhahhahhhahahhhahhahhahaaokkokolalallallalllaallalallallallallallallalallallalallallallallaka hm jom follow meeeee hhehehhehhehhehhes,_
Tggu lama,_
btw thx seller for ur good services,_
Keep asking to complete details,_
baju pun terletak elok pada bagan,_
SIAP AD FREEGIFT LAGI,_
Received goods in order as usual,_
Gambar tiada kena mengena dengan pesanan,_
Free gift,_
mmg boleh repeat order,_
Thank you untuk gift yang diberi,_
You in every department,_
Surprise and love the tea~,_
"The product is correct, the product quality is very good, and the seller is trusted",_
cma kena bli besar sikit,_
Barang semua lengkap cukup,_
"(Reporting by Michael Church, Editing by Cynthia Osterman)",_
Buy five packs first for testing,_
boleh belajar melalui youtube cara tukar,_
"sblum ni order kdai lain, tp kualiti x sama",_
Kembang pun cantik & tak nampak macam pregnant gituw thank you seller,_
Item have been received in good condition,_
Dah beli berkali2,_
Thank you to the seller for good service,_
"Gw pelanggan setia grab jadi terganggu perjalanannya ( ini buat grab mobil ya, sejauh ini grab bike baik2 aja) dan akhirnya gw memutuskan buat un instal !",_
This is the second time I purchased and will continue to support 888,_
thankfully seller bekerjasama menyelesaikan mslh,_
quality supplement,_
"The bear is nearly can not see for the black one, quality is ok, kinda soft",_
Hello Sender!,_
ваша родственница?,_
Tak pernah menghampakan🥰Highly recommended and trusted seller!,_
padu padu padu padu padu padu padupadu padu padu padu padu padu padu padu padupadu padu,_
Semua perisa saya dah cuba dan sedap,_
"the mic is ok, need to put it closer to your mouth",_
I like the 12 a lot,_
keadaan baik Tq Tq Tq,_
Fast fast fast delivery and wrap many many bubble wrap,_
Kalau jenis lengan besar better takyah kot sbb sesuai utk orang lengan kecil to sederhana,_
Ank sy berat dlm 82kg,_
cepat pn cepat smpai,_
nanti order lagi kat sini,_
"Brg smpai, seller laju wt keje, ari ni tempah , ari ni siap, cntik, ni kali kdue repeat, mmg recommend sgt2 sape nk wt diy casing ni,",_
Order navy blue tp sampai kaler lain,_
aduhai nasib la labu,_
My food is a pity the noodles are a bit crispy T~T,_
Dari China ke Malaysia hanya mengambil masa satu minggu sahaja,_
pelekat xkuat sgt tp ok lah ha mmg ok lah tq cpt jgk hntr nye kne tulis pnjg kn xdpt koins plk betul x,_
harap seller dapat check dulu sebelom hantar,_
"Hi seller my parcel had arrived, the phone works perfectly, but sometimes its off suddenly, and i cant downlaod big apps, the back of the phone has scars, the camera beautiful, recommanded seller",_
"Thanks for your reviews,",_
That dessert mirage case though🤩🤤 Twitter : $MENTION$,_
Material:very soft and non stick,_
"tak putih sgt, bagi sy lagi cantekkkk",_
"Mom loves it, 1 pack per month great value",_
saiz bag tu tak mcm dalam gamba,_
Tggi 155 berat 53,_
ada dpt berus skli mudah nk tacap inai lps nii,_
Mantap seller laju kerja harap boleh tahan lama mantul pak abu,_
The vision of UMK Ignite Venture Innovation Lab is also in sync with the recently launched Festival of Ideas a MOHE initiative to stimulate creativity and innovation in the academic community,_
bentuk vertical,_
Its 4GB and 32GB,_
garnet so nice,_
tp jnis kain panas,_
Malas aku nak return and refund,_
Picture xdpt snap sbb hadiah kepada orang,_
"Nipiss sgt , laju je smpai tpi kecewa sbb nipis still nmpk kaki klau pkai",_
Sempat sampai before trip,_
I don't know man but it's hella small,_
All items well pack in a box,_
Tapi ketat dekat area perut skit,_
"Rasa macam waw sangat convenient, plastic - nak cuci senang, ringan - tak bawak banyak load, kecik - bleh simpan kat poket",_
Perhantrn pants dan terbaik,_
good packagingreceive orders in safe and sound,_
Material is smooth type,_
ada je yg nak beli,_
Baru Pakai 2 hari tak Nampak kesan lgi klo oke repeat order Barang cepat sampai sorry gambar tak ada kaitan,_
hrap sedut air la klu x sedut air bdan bby x kering lpas mandi,_
Parcel received in good packaging and condition,_
Good and come with two pieces with such a cheap price,_
tu satu bagusnya,_
lepasni nk repeat yg saiz besar plk,_
Dlm iklan tulis ad free gift klau purchase over than rm59,_
harap2 dia SUKE la,_
"Tali pinggang elok, bag kulit agak nipis sikit",_
tp 2 wyr je dpt pakai,_
This is really Flagship Killer $MENTION$,_
Effectiveness:sesuai umur 2y,_
is suspended,_
portrait&quot,_
Sepanjang beli skali je ttbe game kena lock but ada cara nk open balik,_
kawan2 i pn ckp cantikkk hehe,_
tc/KkcyhR,_
kalau serasi boleh beli lagi,_
siao BAGI free gift gula gula,_
Hope okay huhu,_
terima kasih seller 🥰🥰🥰🥰🥰🥰🥰🥰,_
Ok first,_
Sorry to get this rate,_
seluar nye agak labuh,_
Sehari satu cukup lah,_
always very freshly roasted beans sent,_
Dh smpi tapi x cuba pakai lagi sampai elok xde pecah ke ape,_
xmembazir pun,_
Durable bag with handle and good material to protect laptop,_
Functionality:Really works for post natal mothers,_
Love the plastic,_
"Namun, seawal usia 21 tahun, pasangan suami isteri, IDr Lokman Hakim Ahmad Subki dan IDr Rabiatul Adawiyah Rasol yang berjaya menubuhkan syarikat reka bentuk dalaman yang dikenali dengan IDW Design &amp",_
okey je boleh la tpi penghantaran lambat sedikit tapi okey je,_
topi cantik walaupun murah,_
Athletic dominated a thrilling match and went ahead early thanks to a beautiful cross-shot from Iker Muniain who curled the ball past Marc-Andre ter Stegen into the top corner,_
M size sesuai dgn 70kg 155cm,_
tp selipar awesome sedap dipakai,_
ngam jew kt badan,_
itz so simple and elegant,_
"Barang dah sampai dgn lajunya,terbaik,barang baik 32GB pun dah cukup besar utk dashcam, harap2 la berbaloi",_
Cantikkk lahhh,_
00 TERUS KAU SUBCRIBE KAN AKU RM10 BUAT APA SIAL ?,_
Formulation:jenis cecair,_
skali jenis kain licin,_
"Baju cantik sgt2, w 57 h 158 mmg cantik terletak pakai",_
sukaaaaaa🤗🤗🤗🤗🤗🤗🤗🤗🤗🤗🤗🤗🤗🤗🤗🤗🤗🤗🤗🤗🤗🤗🤗🤗🤗🤗🤗🤗🤗🤗🤗🤗🤗🤗🤗🤗🤗🤗🤗🤗🤗🤗🤗,_
jarang mengecewakan,_
4 Feb Ship out,_
syukur sudah dapat email,_
p survey smua kedai 2 helai dpt hrga 24rggt,_
parcel received in good condition with buble wrap,_
then went kaput,_
Review di gambar dan video,_
Rasa curry yang enak,_
expired 12 months after the production date,_
"delivery ok, material ok, packaging ok, tapi kalau sapa2 rasa dia big size boleh beli 1 more size bigger than usually la, its better",_
Baiknya jika ada di reward saya di klik langsung direct resto mana saja yg bisa pkai,_
packaging is nice and secure nothings broken,_
CANCELING ORDER AFTER 20 MINUTES STUPID APP 🤬,_
kedai termurah setakat ini berbanding seller lain,_
"Sebetulnya tunggu dari siang hari**dah dekat 10 mlm ingat delay dah penghantaran, tau2 depan pintu je!",_
"Yang penting bau dia tak tengik,tak kuat macam brand ubat nyamuk lain",_
"Product receives in good condition, fast delivery, will repurchase again",_
"'As I understand your theory, a false assurance that the bank had nothing to worry about as far as sanctions went (was) because they could assure Skycom was in compliance",_
"Logo a bit small, not the size as shown in the post",_
Je vous aime je,_
"Dia cam lebar, but cantikkk",_
tak pakai pin just lipat je pon dh trbentuk elok,_
nti nk repeat ordr lg,_
Setakat ne pakai sekali pn dh best,_
tk besar tk kecik sgt,_
first time purchase barang makan online and srs lebih murah dari kt shopping,_
"I want this for my mother , she is suffering",_
cepat gilerrr 🥰,_
Haritu pernah beli dah ni beli pulak,_
"Through the Perlindungan Tenang RM75 voucher programme, the lower income group will get a higher value voucher, which enables them to have more options to choose from a range of affordable protection plans that suit their needs, he said",_
Sorry bukan gambar yang berkaitan,_
Luar setinggan,_
Fast delivery and amazing quality of prodcuts,_
Overall satisfied with the order received,_
Its worth to buy it from watson shop,_
"Size okay for adults, fast delivery, value for money",_
Kaga sesuai sama harga ya pas diorder diaplikasi mc donalds ya promo delivery pas mau bayar dikasir harga normal bayarnya Minuman juga ga sesuai kalau ada perubahan dikonfirmasi dulu,_
DRAWSTRING BAG IS VERY STRONG ‼,_
Taste:Taste good and fresh,_
Cuma tak sama jenama yg diberi,_
Effectiveness:so effective to treat bad smell from mouth,_
Produk baik tapi penghantaran agak lambat,_
siap bagi kotak lagi,_
"Quality:choose white, paling lembut utk kulit muka sensitive",_
Stokin telah sampai,_
"Overall, semua okayyy",_
Baaaaaaaaaaggggggggguuuuuussssssssssssssssssssssss,_
Had been repeating purchase many times,_
Surely there's a better way for you to estimate if you have enough drivers without making customers wait for half an hour,_
Tq saller shopee dah sampipenghantaran sangat pantas walaupun made in china cantik sangat harap mnyala la,_
E-rokok pod memberikan kadar nikotin lebih tinggi kepada pengguna berbanding e-rokok konvensional,_
"barang da lama sampai ,baru sempat nk review",_
Very low quality compared to other shop that previously bought,_
Add to my sock's collection,_
Ingat panjang rupanya pendek ja habuan make up boleh,_
has their album only 2 songs this time or do you think there's more coming?,_
"Kain soft, sejuk and sangat besar",_
"This project is a key element of Petronas' aspiration of achieving net zero carbon emissions by 2050, it said",_
"Wlaupn awlnya bru persan slp order, tp lps dpt brg, ok r",_
Mintak black & white tp seller bg cmpur silver,_
maaf vd dgn gambar kebanyakan tk de kaitan HAHHAHA,_
Good product Good product Good product Good product Good product Good product Good product Good product Good product Good product Good product Good product Good product Good product Good product Good product Good product Good product Good product Good product Good product Good product Good product,_
Ordered 20/1,_
Jimin your so cute🤭,_
"Barang sampai dengan cepat dan pantas, cantik berbaloi dengan harga, bungkusan PON kemas ,",_
Item working perfectly even on carpet,_
Taste:Mixed fruits and grains,_
Thank you seller baju ni cantik sangat2!,_
Ok dah sampai agak kemas ckitla nampak tak perlu pening pasal nak buang gam lagi,_
"Ur person in charge, don't check 1st before post this set",_
"All in good condition, just have a lil bit dented edge I guess?",_
Obviously yar,_
1 on tv then soundbar to earc on tv and get atmos /dtsx? Thanks In advance,_
Dapat sebiji macam kat kedai terima kasih seller dah banyak kali repeat kat sini,_
Sambal che nor kegemaran saya enak dimakan dgn apa saja,_
12 cuma bagi beli 2 je but it's okay,_
dia suka dgn baju tu,_
"kalau x jdi pape or error ke,cek winrar korg",_
Cuma yang satu lagi tu dia loose sikit,_
Tetap sukses aplikasi,_
"It feels everything here happened extremely last minute and that's why it became such a mess, said former world No",_
kualiti kain memang elok dan designnya cantik cantik sesuai tuk kanak kanak,_
The gift so cute and pretty,_
well packed and fast shipped,_
Super fast came within a day,_
Shoppe exprs pghntran lambt,_
jahitan pon cantik leas ni nak beli borong pulak,_
Xkupas cpt,_
"penghantaran cepat , dan sangatttttt puassss hatiii , Deabak !",_
"Saya sama kejadiannya dengan sdr darda, sudah melakukan pembayaran siang hari, sampai detik ini tidak ada terkonfirmasi status pesanan saya, berhasil atau tidak, cek di lacak pesanan tidak ada no orderan saya",_
Yang ni kerass sikit tapi okay jeee,_
elok sgt cutting mcm ni utk budak,_
"Highly recommended taw, harga mampu milik Tapi kualiti mcm brand2 mahal punya",_
receive in good conditionfast delivery thank you so muchh for,_
My cat love royal canin wet food pouch 85gram,_
Alhamdulillah item received in a good condition and thanks for your time,_
Paid : 01/09/21,_
Many different products to choose from this store,_
Barang semua ok xde apa yang rosak,_
item all arrived safely,_
wasap 0195906592,_
cute album and can fit many picture thankyou for the cute album,_
Saiz agak besar n makan ruang,_
5 g mobile villege ma calge ya nahi,_
"79 year-on-year, according to the report",_
3 hari smpai sabah sdh,_
Dapat la dalam seringgit satu setiap botol lepas kira2,_
But the quality for this model is so-so,_
huhuhu dan baju mcm saiz L wlupn,_
Delivery is acceptable as well,_
Functionality:tahan lasak,_
Service seller mmg mantap,_
but it's good lah for the price,_
I liked it $MENTION$,_
"Finally received the Portable Power Bank parcel, when I open the parcel the box outside already damaged, but the power bank is ok la no problem",_
Kualiti produk bagus dan dapat meregang dengan baik,_
"Walaupun barang diimport dari luar negara,",_
Moda transportasi umum yang sangat bermanfaat,_
Rekemen seller nie,_
Barang diterima dalam keadaan baik dan selamat,_
"Bagaimana mungkin mereka boleh membuat keputusan awal bahawa bos mereka menjadi mangsa politik padahal siasatan belum dibuat dan cara beliau menafikan sebelum ini juga tidak masuk akal, katanya dalam satu kenyataan kepada media semalam",_
3 helai semua,_
Pegawai yang tidak layak untuk menerima suntikan imunisasi COVID-19 hendaklah mendapatkan pengesahan daripada pegawai perubatan dan memaklumkan ketua jabatan,_
"Terima kasih, siap bagi gift, terbaik, trusted",_
tp mtk line kelabu dpt line putih pulakkk,_
"While vaginal bleeding is common during early pregnancy, anything other than spotting during the first trimester may be considered a threatened miscarriage",_
u gais kena try beli,_
"Senang digunakan, tak payah risau kalau kat tol tak sampai nak touch dah",_
Semuanya OK tkde masalah,_
"Fckng trash app, it doesn't even let me choose the accurate destination point, it keeps moving it on its own, then the promo doesn't even works!",_
mungkin ukuran yang dibeli kolam mandi itu sekencang kencangnya,_
Seller kata disebabkan kecuaian courier service masa loading barang,_
Barang sangat cantik dan berkualiti,_
ni kosong jee,_
kerja senang hati pon gumbira,_
"He also noted Deputy Plantation Industries and Commodities Minister Datuk Seri Dr Wee Jeck Seng's victory in the Tanjung Piai by-election on Nov 16, 2019",_
lawaa lawaa,_
"Kualiti bagus, boleh repeat lagi",_
JUMP,_
"First time to buy from this seller, never expected the goods received very fast",_
I am the customer is happy and I,_
Thanks shopee mart & shopee delivery,_
Mula2 saja beli satu sebab nk tgk kelembutan dia mcm mana,_
Mkn sejuk2 lg sedap,_
Sangat2 sesuai kalau kite xpernah jumpa atau tau saiz baby tu,_
took only 4days to arrive at sabah,_
Gambar xde kaitan Sebab barangnya xdapat,_
Nampak exclusive tq nenahijabs,_
Let's buy it,_
terlupa la,_
Eating data with frequently updating,_
Cuma nyaa syaa biasa size L tpi ni bsr,_
penghantaran sangat cepat dan condition sampai dlm keadaan baik,_
botol,_
Hopefully good for me,_
Always a fan of one plus,_
Nasib baju helok,_
My whole family loves eating these,_
Kain nipis ckt,_
That would be very helpful,_
gmbr xde kena mngenaa,_
Rezeki dapat kain lembut gila,_
tapi tu ketat sikit🤭,_
"so fast received it, nice to eat, good product and good value for money, tq for seller",_
This is much second time of purchase,_
Wish I could win! $MENTION$,_
It's gift with purchase on 12/12,_
"But the city-state's authorities have repeatedly warned that trading in digital payment tokens (DPT), or cryptocurrency, is highly risky and not suitable for the general public, as they are subject to sharp speculative swings",_
"Good quality, fast service and very suitable for online class or meeting",_
kualiti dan design tshirt setara dgn harga,_
Expiry dated September 2022 (16 months away),_
cantik pulak tu thank you so much seller🥺,_
The Council also confirmed that Glasgow will host the 2024 world indoor championships and Lima the 2021 world Under-20s championships,_
MEMANG TERBAIK LA,_
Nice The price is cheap,_
warna pun Cantek sprti dlm gambar,_
Brg baru sampai kerumah,_
Thank you seller item shipped really fast and the shirt looks really nice,_
"material okay tak tebal tak nipis, sedikit jarang, kalau perempuan nak pakai make sure pakai singlet, XL dia macam M/L",_
Jam dah smpaisize agak besar la tapi oke jaa murah ja tapi cantik kena dgn harga 🥰🥰post pun cepat kemas elok siap dgn balut smua tq seller,_
Sesuai untuk travel jauh dan dekat,_
Alhamdulillah selamat sampai tiada rosak atau koyak,_
got bags to put the telekung also,_
mmg xcr coffee lain,_
Thank uou you seller🥰 item have arrived safely and i am so satisfied with it🥰🥰🥰🥰🥰🥰,_
I hope the price is durable,_
Raya-raya raya-raya selamat hari raya,_
Cleaning Effect:haven't used it but it smell nice,_
memang authentic,_
"thankyou, barang dah sampai",_
Parcel well packed and delivered on time,_
Seller inform awal yg purple dh xde n refund duit,_
"murah drpd kt mall, sampai dgn slmt, delivery cpt, bau sedap",_
Harga mmg berpatutan berbanding kualitinya,_
Skin glowing & putih berseri,_
seller baik blas chat dgn cpt,_
Will recommend for friends and buy it again,_
"cantik,zip pon ok overall semua cun tq seller delivery pon cepat harga berpatutan beli utk suami dye pon suka",_
"nice to wear, soft and not thicker, will not feel hot when wearing it",_
"Body measurement 36-27-40, S fits me well :) material is comfortable to be worn inside air-conditioned room",_
Baju jersey dah sampai dalam keadaan yg baik dan saya sangat berpuas hati serta material kain pun sejuk jer pakai sangat berbaloi dengan harga dan lgi satu saiz baju sedikit besar untuk ketinggian 158cm dan berat 40kg,_
WhatsApp +60133211979,_
kitab sudahsampai ke rumah,_
Kena beli lagi nii🤭🤭🤭,_
Tq seller tq seller🤭🤭,_
Price : 4/5,_
5)zip die asal terlebih,_
utk org bdn besar x muat tpi ok laaa,_
gocang dlu sebelum guna,_
Lena ank tido,_
"seller ok,trus ship tp sangkut kt courier",_
Cantik sangat hehehe warna putih pula tu🤩🤩 ngam saiz,_
putih sgt cntik bawak jalan2,_
"The two-time FedExCup champion, who is 49th on the points list and would need couple of strong finishes to make it to Atlanta, said after this year's PGA Championship that he was gearing up for a heavy workload should he need to compete in three consecutive weeks",_
Camera kualiti Sangat²,_
trusted seller and cepat hantar brg,_
Incredible !,_
"repeat order untuk kali kedua, tq seller",_
bukan cermin kaca,_
Wow th: $MENTION$,_
bgus utk sorok brg time kt spital ni,_
alhamdulillah barang selamat mendarat,_
Membuat kemudahan dalam memenuhi kebutuhan kami,_
beg mcm ni Sya mau lasak murah tebal,_
"It has a lot of memory, and it is very fast to use",_
"Since i subscribed to panda pro, the app has been so slow i cant even see the pictures of what ilike to order its so lag even if my internet is so fast",_
t=2m31s> Taehyungggggg,_
"The bloc's decision to not sanction Burkina Faso contrasted with its response to coups in Mali and Guinea, with which ECOWAS member states closed borders and imposed some economic sanctions after military takeovers in May and September",_
closter,_
Kain dah hantar ke tailor,_
"Kita semua tahu apabila dia ke Dortmund, langkah ini akan berlaku",_
Delivery fast n furious,_
I want Iphone for free sirrrrrrrrrrrr,_
Kali ke 2 beli beli di kedai ni,_
Thank you received with tq note,_
Slalu m seluar tue kena beli size L,_
"It was worth it, the goods arrived in good condition and worked perfectly",_
The design was very pretty and it is comfortable too,_
storage bag abit thin,_
a pakai tunai juga,_
btw kasut okay size 39 tapi tulis 39,_
Rugii beli satu jee,_
Terima items dlm 3hari,_
00 diskaun voucher!,_
will continue repeating order in future,_
serius tk menyesal,_
Mmg kena study dulu ar cara guna bru faham hahahha leceh sikit part tong air tu je la,_
