Sentence,Tagged_Sentence
"tak rugi beli, meh2 datang beli",_
"Chat seller nak barang sebelum 24hb , 19hb dah sampai",_
"Earlier, Mahdzir attended a groundbreaking ceremony for the proposed project which was officiated by Sabah Chief Minister Datuk Seri Hajiji Mohd Noor",_
"The storage bag is particularly good, the bag is large, the compression bag is very good, I love it!",_
Im having issues with the GPS & Grabpay often,_
harap bertahan lama walaupun dah tahu harga murah,_
Thank you seller for the well packed,_
Better than using the Web version,_
tq seller pos pon cpt smpai,_
May be i mentioned speedy delivery for the past few shipment but this round took 7 days ftom Johor to KL,_
ok elok je ngam,_
Pearl pun besar jugak,_
"LONDON: Chelsea mengukuhkan cengkaman di persada Liga Perdana Inggeris (EPL) apabila membenam Leicester City 3-0 di Stadium King Power, sebentar tadi",_
Nice stuff tip top condition good service representative best service fast response fast action good item good thank you,_
"Fast delivery, took 4 working days to receive",_
Tripod okay agak stable,_
Chromebook received in good condition,_
"Seluar nice tapi agak singkat , tebal tk tebal mana ngam ngam , tk jarang",_
Yeah the LOL stories,_
But the sizes of panties are quite bigger,_
Thanks for the fast send out,_
My purchase decision depends on this,_
Terima kaseh seller dan tq shopee,_
sian fon tu carik case susah sgt nk dapat,_
Kecil2 boleh muat letak 2 fon 1 powerbank dgn purse,_
seeloknya ambik saiz 38 or 39 bagi yg biasa pakai saiz 37,_
havent try it hope it tasty,_
Thank you and more power!,_
Ahamdulillah sudah sampai terima kasih banyak banyak 🤍 selesa,_
line teruk sangat macam maxis tolong perbaiki,_
Lucky that I chose her size correctly since she so tall haha 🤭,_
"Justice Department investigates Apple: This probe, revealed in June 2019, appears to focus on Apple Inc's app store",_
All goods delivered in good condition,_
tapi badan dia kecil juga,_
"Nice job seller, nice packaging",_
size chart is very very accurate and selesaa sangat pakai,_
THANK YOU SELLER ITEM DAH SAMPAI WALAUPUN LAMBAT POS BUT SOKAY COKLAT CAIR SIKET SEBABKAN CUACA PANAS BUT SOKAY NO HAL BOLEH DITERIMA 🤗 HARGA LEBIH MURAH SEBAB TEBUS COIN THANK YOU SELLER THANK YOU J&T 5,_
Functionality:it's is really compact,_
"Paling wangi strawberry cupcake, 2nd candy sugar, 3rd stress away",_
3 saiz ok 2XL,_
"sampai ptg tadi kurier ninja da wasap,tq ninja van",_
BLM cuba lgi,_
government data,_
Phang Khar Mun,_
"sorry gamba tkde kena mengena , demi secebis coin HAHAHAH",_
Good product quality Good value for money Fast deliveryyyy,_
Ada penutup dlm tu,_
I would like to have a one plus node cause currently I&$HASHTAG$,_
Courier delivery is fast,_
Size chart pun tepat,_
terbaiikkkkk!,_
Kualiti baju memang mantap,_
Effectiveness:the best sunscreen in drugstore,_
"Turqouise green not turqoise blue, but my camera cant snap the real color",_
khas utk ibu sempena hari lahir,_
Semoga mira dimurahkan rezeki dan dipermudahkan segala urusan 🤲,_
"Harga sama, beza 5sen je",_
Nmpk sngt cam budak od od hahaha,_
TAPI ADA TULISAN AQUA X,_
The ROC deals with what is generally said to be illegal,_
Why is it so ugly,_
"Pada 2013, Taufan Haiyan adalah ribut paling kuat pernah mendarat, menyebabkan lebih 7,300 orang maut atau hilang",_
Handsock tak melorot dan panjang nak dekat siku,_
Refund takes too long,_
The T shirt looks really good,_
parcel pun smpai dgn baik,_
Barang okay kena dengan harga tak tebal sangat tak nipis sangat selesa pakai,_
tapi apa apa pun mantap bergaya gitu,_
Lain yg saya order lain yg pihak tuan hantar,_
Size is quite small,_
Quality:tak nipiss sgt pun,_
It's worth to buy thanks seller,_
Kualiti bagus kalis air dan cantik,_
Taste:Kurang serbuk kopi,_
So far function well,_
surat khabar reject yg belum digunakan,_
"delivery quite slow from seller, but it's ok",_
"At first it was confusing, but once you get the hang of it, its actually rlly cool,",_
kalau nak kualiti terbaikk dan mantap kenala beli yang mahal kan,_
Just buy for Rm 12 eqch,_
Well fits with the bra,_
Aroma:not much from outside,_
Delivery took very very long,_
"Kain sangat lembut, thank you seller",_
Portability:Very good,_
mask yg murah n tali getah kuat,_
pls seller improve packaging item sblom delivery 🥺,_
I'm in love🥰,_
Sesetengah pelabur institusi akan melihat nilai dalam saham terutamanya dengan penjualan baru-baru ini,_
Ok cume harap focus kat bucu buku maybe letak cover bucu sbb dia kemik tp tu lumrah barang post so overall ok study online so susah paham nota slide,_
"Like the soft scent, soothing and calming as claimed Highly recommended for baby with eczema or skin sensitivity, it leaves skin a layer of moisture after shower",_
2 hari dah dpt barang,_
Order lain saiz 9x9(m3) dpt saiz 8x8(m2),_
"Sangat selesa dan ringan, tggi 170 brt 56, saiz M okay, labuh paras punggung,tapi kalo nak labuh bwh punggung boleh amik saiz L",_
Buka parcel je dah wangi!,_
"Sebelum ni pakai awadah, mmg best gilaa",_
The F3 delivers well above its price,_
Terbaik lah saya amak menyukainya hehe betul sangat kot lah,_
boleh beli siapa yg teringin nak bergaya,_
barang sampai dlm keadaan baik sekali,_
AHAHAHAHAH lawa betul kaler dye,_
"Berikutan terdapatnya peningkatan aduan pengguna mengenai isu berkaitan pelaksanaan RFID di seluruh Lebuhraya PLUS, MyCC turut berkongsi penilaian dan kebimbangannya dalam mesyuarat yang sama termasuk memberikan akses kepada platform pembayaran lain bagi pembayaran tol, bukan saja melalui kad debit atau kad kredit tetapi juga sistem e-wallet yang lain",_
"Good value for money , tq for free gift,",_
Siap bubble wrap 🥰,_
"aaaaaaa antara semua earphone yang aku beli kat kedai ni,ini yang TERDAEBAK",_
Quality:6ctn,_
convenient as it was claimed,_
je lalai,_
"bungkusan elok, 5,",_
Item received well with no damages,_
They are all exporting at or near capacity,_
"Baru sampai stuck di Stwn bnyk hari, tak sure sempat ke tak pakai kenduri",_
serbia yg pants sis bg,_
Then order was closed,_
seriously worth the moneyyy,_
Am a mi user for long enough,_
Also seller wrap it properly,_
Soft and easy to install,_
GOOOOOOOOOOOOOOOOOOOOOOOOOOOOOOOOOOOOOOOOOOOOOOD:),_
pape pun semua kain elok selesa terbaikm,_
"Parcel kotak kasut dah sampai, parcel tu ada koyak sikit",_
"i bagi 10/10 sebab tali skipping nya cantik dan berkualiti,",_
My items arrive safely,_
ko behn ke tge,_
Courier took long time to delivery,_
"Founded in Miami in 2017, the company has raised at least US$40mil (RM167mil) from investors including SoftBank, Tiger Global and Reddit founder and South Florida resident Ohanian",_
"Tak besar sgt, senang dibawa ke mana2",_
Alhamdulillah brang sampai dlm keadaan okey,_
"Nyesal pulak beli 1, tak bleh stop nk mengunyah insyaAllah akan repeat lg nanti 🥰",_
"Brent briefly surged above $77 a barrel, while U",_
but the packaging must improve some,_
- Meet Safety Purposes (Sturdy),_
ship using almost 3-4days arrival,_
Dh psg kt,_
"It is cheap, suitable for old car that refill frequently",_
Easy to fold back and bring to anyway,_
"In accordance with the order, fast delivery",_
sory gambar xda kena mngena,_
KOTA BHARU: Peniaga runcit di sekitar bandar ini mendakwa bekalan minyak masak paket sekilogram dan minyak masak dalam botol kehabisan sejak lebih sebulan lalu,_
Cume seller post lambat,_
"brang Smpai dgn selamat, Kepok semua ok , sedap sgt",_
Casing colour macam cream cream,_
Tilam cun,_
webm animated stickers or bring your custom sets from other apps,_
Kualiti produk baik harga baik penghantaran sangat2 pantas layanan penjual sangat2 baik,_
Nk bagi dkt org pun mcm serbesalah,_
Korg kena blk shipping amik masa sminggu gak tpi mmg berbaloi tq seller,_
good quality of the cotton tissue and nice to usetq,_
xpernah xckup,_
This is booster type with usb,_
Sy suka sgt pati sarang burung ni,_
"Good product quality, delivery is fast also",_
"Very fast, convinient, thank you seller",_
"I have used this before, under sun can see burgundy",_
Kurang rasa dan pedas sikit jer,_
"There are many variations of passages of Lorem Ipsum available, but the majority have suffered alteration in some form, by injected humour, or randomised words which don't look even slightly believable",_
This app and the Canon printer work flawlessly,_
recommended for sure,_
Wokey tire dh smpai tq seller,_
penghantaran sangat pantas dan saiz juga sangat tepat dengan ukuran dalam carta,_
7) Mencerahkan mata,_
"Hopefully it taste even better, thank you Nestle 🤗",_
beli dgn hrga rm4,_
It's always my favorite pan mee,_
Memandangkan sekolah nak buka so beli kelengkapan buka sekolah time2 covid,_
"Trash internet service and customer service, did not even think of improving themselves or fixing their internet",_
Sedey molek hok lamo abih,_
walaupun dr luar tp pnghantaran cpt,_
"heard my mum complaining about the gloves that she bought at the clinic was sooo expensive then I tried to find in shopee and I found this shop, really recommended!",_
( sorry for the unrelated video ),_
Mari cuba misi-misi ini untuk persediaan masa depan anda!,_
kene leher die,_
Lepas kilat meme cantik gilerr,_
Baju ni sesuai utk pakaian harian anak2,_
barang sampai awal tp hari ni baru teringat nk nilai,_
Kualiti video even malam pun memang cantik dan clear,_
Biggest congrats she is beautiful,_
"Dan tak sabar nk mamam peminat koko crunch hadir🥰Dah sampai,",_
Jom pakat2 beli,_
mudah nak memasaknya,_
I need to like it bcs i have to wear it every day,_
maceh sgt2,_
exactly the same,_
selesa juga pakainya,_
Kain dia best cuma tk berapa ketat sngt,_
"Teruskan menjadi baik, kerana menjadi baik itu tuntutan dan kewajipan, walaupun anda tidak dihargai tetapi setiap kebaikan ysng anda lakukan Allah akan lihatn",_
Light² skit,_
boleh isi 4 helai baju dewasa 4 helai seluar dewasa 4 helai baju kanak2,_
siap dpt free gift kid mask,_
Barang sampai cepat dan seller sangat2 efisen,_
Terima kasih seller n semua yang terlibat,_
tapi seller bagi lebih 4 pack,_
Mantap ngam cantik kasut tunggu 3 Hari je penghantaran laju 5 Star,_
h: 153 w: 45,_
"Cantik, panjang boleh buat hijab mask chain kalau beli mahal sgt",_
Seluar sngt selesa dipakai,_
penghantaran cepat pakai shoppee express,_
"Barang selamat sampai dengan cepat dan pantas, recommended TQ Seller, maaf gambar tiada kaitan",_
"Received in good condition, during this Covid time we need more Vitamin",_
Gambar tak de kena mengena dengan barang,_
Purchase the many times from this seller,_
It fit nicely & strong enough to hold the handphone,_
hihihi 🥰🥰🥰🥰🥰🥰🥰🥰🥰🥰🥰🥰🥰🥰🥰🥰🥰🥰🥰🥰🥰🥰🥰🥰🥰🥰🥰🥰🥰,_
"Pembungkusan kemas, tiada yg pecah dan calar",_
"sampai dgn selamat ,paking kemas",_
Sakit hati pulak aku,_
gudluck bro,_
bidang kecik tp sokay boleh adjust 🤩🤩🤩,_
The quality is the same like typical wallet you buy out there for rm10-rm40 but this one is the cheapest and worth it,_
Order before 2pm and they will ship on the same day 🥰 semua barang berfungsi dengan baik cuma bubblewrap agak nipis mungkin lepasni seller boleh letak dalam kotak and wrap,_
Functionality:everything ok,_
Akan repeat balik kalau nk beli lagi,_
petang besok sampai,_
Size XL dekat tagging tapi fit macam Size S$MENTION$,_
Bagus kualiti bagus penghantaran pun cepat,_
Sangat2 membantu bila rsa nk mkn sedap2,_
rugi satu shipping free pass sebab seller tertinggal sehelai Baju,_
"Barang cantek, timakasih bagi freegift",_
Color putih mmg betul2 putih,_
lusa sampai🥰,_
dia ade bnyk kocek,_
Sabun sangat sesuai untuk anak2,_
padu padu padu padu padu padu,_
"Dalam masa sama, mereka yang berminat berkecimpung dalam bidang muzik memerlukan sokongan padu ibu bapa, katanya",_
"Maggie kari, Maggie laksa milo",_
Br je oder,_
Super fast delivery by JNT!,_
"McConville, chief of staff of the U",_
Fans will this week get their hands on the latest,_
Okaylaaaaa barang sampai agak lambat sbb dari china tp cantik anak saya suka,_
Order cancel everytime i dont know why?,_
kali ke dua repeat order sbb ayah kata sedap,_
servis superb dr pekerja,_
Pigmentation:gelap,_
Seller post barang cepat tak try lagi tapi apa apa pun seller wrap item sgt bagus and berbaloi dengan harga murah sgt2 thankyou thankyou thankyou thankyou thankyou thankyou thankyou,_
The mee very nice but J&T put the parcel outside of my house,_
Buy this for my siblings,_
baunya macam bau pemadam pon ada,_
"Alpha Tauri - Yuki Tsunoda (Jepun), Pierre Gasly (Perancis)",_
brang pn ckup,_
"Thanks seller, trusted and I will purchase more",_
"Item received in good conditions, thankfully",_
"kekasih muda bukan takat berpegang tangan, harta dan jamuan nafsu tidak berkekalan, bila menjela",_
byk pilihan ukiran,_
Sampai dgn selamat dan dah cuba buat,_
"No komen kasut tu cantik cuma tak sesuai utk aku yang kulit kering , mudah mengelecek huhu sokay",_
Seller shipped out 27/9 and received 29/9,_
Barang dh sampai tapi tk test lgi,_
baju selamat smpai tp tu la nipis je padan la dgn harga tq saller tqtqtqtq,_
Quality product mcm harga yg dijual,_
Tudung ni lembut kakinya,_
Sorry takde gambar sebab tengah basuh haha,_
"Bungkusan mantap, sangat selamat",_
My Digi app go,_
Grey and black colour,_
Servis by J&T dari KL - Pulau Pinang bagus -1 hari,_
9 bilion ringgit yang dikhususkan kepada kontraktor kelas G1 ke G4 di seluruh negara,_
"Dh try test, berfungsi dengan cemerlang",_
comel mcm lisa,_
Kaaainnn molllekkk teeeerrr,_
Your the greatest ever,_
Just okay quality and not really confortable,_
Received received received received received Received received received received received,_
Very very responsible seller,_
"Dalam banyak banyak EO pernah pakai, estremo la paling best",_
Hopefully seller take this into consideration for the future,_
"baju cantik, kain selesa, ngam dgn saya, tq seller",_
"Trusted , kejap je respond",_
"But it can't achieve the speed increase effect of 5A, and it is faster than the charging speed of most charging",_
Hanya letak dalam plastic then terus hantar dekat cust,_
Terus hadiahkan dekat husband sebelum dia pergi kerja,_
ok la ngan harga,_
tq saller cepat ship out !,_
kecik je berus giginya,_
Terbaik lah🤩lepasni boleh bwk gi keje🤩🤩quality baguss gila weyyygonna repeat again🥰DUA HARI LEPAS BAYAR HARINI SAMPAI ALHAMDULILAH 🤲,_
Taste:Super,_
"Yg penting berbaloi beli dgn seller ni, murah",_
Delivery was okay since seller needs to print first,_
Mama im early,_
After apply,_
Wanny,_
So cheap the wipes!,_
Correct quantity sent,_
Tak try kat baby lagi,_
co/cl589x0,_
"Barang semua ok, tak ada kerosakan",_
Berpatutannn beliiii walaupun kain mcm tracksuit sikittt,_
Shoppe express bahagian 70mai ni tersangatlah lembab,_
Seller banyak bantu,_
kumpul semua wrna,_
barang memang berkualiti dan berbaloi i recommended to buy this for yor phone protection,_
"Murah dan sangat berpatutan , penghantaran pon sangat laju 🥰🥰🥰",_
Tak rugi Beli dari seller ni,_
Suit for daily wear,_
baru try xtahu berkesan ke tidak,_
"Ketua Pengarah Perkhidmatan Veterinar, Dr Norlizan Mohd Noor, berkata bagi mengawal dan mencegah rebakan penyakit ASF, JPV telah menguatkuasakan 'stamping out policy' menerusi pemusnahan babi ladang yang telah disahkan positif ASF",_
"The job is demanding, and after a long day at work, Khor unwinds by spending an hour quilling",_
beli utk mok kt kg,_
The contract is known by its agency code name Wild and Stormy,_
sedappp xmengecewa kan,_
Xtaw laa getah ok ke tak,_
Very fun to make waffle and u can put all sorts of flour into this to turn into a waffle,_
I dah bnyak kali repeat beli pampers kt kedai ni,_
Ada dua bateri lagi,_
"Best flavor among all,",_
"The bag is good with a cheap price, and it arrived quickly",_
"Jadi saya dpt 2 id pesanan dgn 1 transaksi, id kedua mengcancel pesanan saya dari good doctor katanya karena saya belum melakukan pembayaran",_
Me first,_
Easy to apply as well,_
A few days already received,_
Baju cantik kain selesa,_
Good value for money good product quality recommended good,_
"Hello Sir, What will be it&$HASHTAG$",_
but saiz saya ambil trbesar pula,_
The cloth texture is abit different from my first purchase,_
น่าทานจังน่าอร่อยขอบคุณค่ะ🤩,_
Buku sekali dengan jawapan,_
kan ad certain slipar getah tu berat je kan,_
KUALA LUMPUR: Kementerian Kesihatan (KKM) melaporkan 12 kes kematian akibat COVID-19 sehingga tengah malam tadi dengan dua daripadanya membabitkan kematian di luar kemudahan kesihatan (BID),_
Memang murah dari harga kedai,_
lipstik warna semua lawa,_
"If nice, will order more",_
"Pan Gon dijangka tiba di Malaysia pada awal bulan depan bersama-sama empat pembantunya iaitu seorang penolong jurulatih, seorang jurulatih penjaga gol, seorang jurulatih kecergasan dan seorang juruanalisis",_
Everything is done through remote,_
Tak tahu nak ckp apa lagi selalu beli kat seller ni mmg terbaik,_
First time dapat meow kitchen stick ni,_
Seller product ini boleh diyakini kualitinya,_
Tak cuba lagi nak masak dalam air harap dapat lah bawa masuk air,_
Pigment:good,_
THANKYOUUU THANKKYOUUU THANYOUUUUUU THANKYOUUUUUUUUUUUU,_
akirnya smpi,_
Does it switch between Apple devices like AirPods Pro?,_
Material agak berlainan dgn yang mula ii saya beli,_
memakbulkan segala doa setiap hambanya,_
The delivery does not delay and in the expectations,_
My album absolutely fine from korea to malaysia,_
Haritu tengok kat sport direct dekat sekali ganda lg mahal drpd seller ni,_
Has this option been taken off the app?,_
West Ham United manager David Moyes believes his side are not yet at the level where they can hit the highest standards consistently after Saturday's 1-0 Premier League defeat by Wolverhampton Wanderers ended their seven-game unbeaten run,_
Memang besar dan berat seperti dijangka,_
Not 1st time order,_
Idk is the factory terlipat or what,_
"penghantaran cepat , semalam order hrini terus sampai",_
Heels feels rubbery,_
Kain tebal elok warna cantik,_
kenapa ya kok akun saya dibekukan dan ditangguhkan semua?,_
Barang berkualiti mantap,_
alamat rmh hilang di map,_
penghantaran laju kualiti produk baik nice,_
Terbaik beli dgn seller ni🥰🥰🥰🥰🥰sorry xde gambar,_
"Received the item in good condition, well packed, super fast delivery & good value for money",_
"Order 15/9 , 16/9 dah sampai sebab duduk satu daerah je",_
"Companies like ByteDance Ltd and TAL Education Group shut down their online products and training centers for kids, laying off thousands",_
"Can't wait to try it out, my friend recommended tis brand",_
"Since the institution has a one-month loan policy, the last reader on the list will have to wait a year to discover the exciting tale of",_
Kalau baju tebal sikit je take time,_
"Ok,bleh repeat lg saiz ni",_
Dah guna pun alhamdulillah berfungsi dengan baik,_
"Yeay dah sampai,",_
Tapi takpe la xpecah,_
Cuma dr pihak courier je lambat smpai,_
CUMA LAMBAT LA,_
Cannot bit the halogen lamp,_
Kualiti kain nampak elok,_
"So cute , terus beli tiga",_
Tqtqttqtqtqtqt,_
"mimpi mcm bosch, sangat nipis, tapi padan la dengan harga, ada yg setara harga tp bagi kotak kertas saja",_
Bshejejsndn,_
"This one looks good like the picture, i don 't know if it' s easy to fall out when sticking",_
Maintain ja awning hihi,_
Kombinsi deruman enjin dan note teknologi tinggi ekzosnya amat menarik,_
That's why so cheap,_
Sesuai utk buat blouse or kurung ke ap jika suka,_
Complete 21,_
Sangat selesa di Pakai,_
Nt tgk ok ke tak,_
"Malah, jersi nombor 7 itu dianggap 'keramat' kerana reputasi Baddrol selaku kapten Kedah yang banyak mencurahkan kejayaan buat skuad Hijau Kuning sejak memakainya bermula musim 2006 lagi",_
It's my new favorite noodles,_
Raut wajahnya akan menyejukkan mata yang memandangnya,_
Good looking bags,_
I would have bought it had I seen that blue,_
Idk much sbb bagi kawan birthday gift untuk dia and she like it!,_
Received with good condition 3days ago,_
"bagi gambar masa barang sampai dekat seller, seller refund balik 3hari masuk dalam shopeepay",_
Thank you so much thank you thank you :) Super fast delivery,_
"Received in good condition, no defect",_
5 to farahshop,_
Tq seller kasut da sampai,_
Overall is good and fast delivery !,_
mandai office external perimeter no finding parking played,_
will repeat another design🤩🤩🤩 in love,_
Carl wants to hog whatever jud unboxes,_
harap nanti bungkus dgn wrap yerr,_
"It's been a tough season for me in Europe, so it's good to be back in Asia after being away for long (since his last trip in Malaysia in 2020), said Gavin, who won the 2017 Taiwan Masters for his sole Asian Tour victory",_
"Tested on Amazon Fire HD 10 tablet, working as advertised",_
Barang sampai dalam keadaan yg selamat tkde kerosakkan,_
Barang smpai 5,_
"for second time i repeat , baju okaa padan dengan harga 2 hari je dah sampe",_
overall okay la utk harga yg murah cmtu,_
"I asked seller to write some notes & wrap the box if can, if not it's okay",_
Tv best,_
kain nipis so tak panas,_
sangat lembut nanti boleh repeat beli lagi dari seller ni harga pon murah sangat rm 3 lebih utk 3 pairs stocking tq🥰🥺penghantaran pon cepat sangat,_
Came with mileage sticker,_
Voucher code obtained by Shopee message within minutes,_
And it was such a nice gesture and I love it All of the products were received in a good condition I didn't cook yet but overall the services is very good,_
The pump was spoilt,_
Material:kualiti sangat bagus,_
Material is thin and cutting is fit,_
"You need to filter your riders carefully, had several encounters with unpleasant behavior and paid orders not delivered while im waiting for hours",_
"Setiap minggu nak suruh pergi servis centre keterangkan masalah bnyk kali,",_
Tapi yg bestnya mlm tadi makan bnyk gila sbb risau nnti berdebar debar bila first time makan hkt tapi Takda apa pastu berat tk naik pun malah berkurang 0,_
"Beli 2 saiz, saiz yg freesize tu besar dan luas lubang tangan, saiz s-l tu ngam2 dgn tangan cantik labuh, dlm pic ni saiz freesize, lengan singkat nk jd mcm 3 suku, btw berat sy 80+ tinggi 154, ngam2 xkena kerat bawah",_
Quality:affardoble for everyone,_
sampai 8 hb ptg,_
dh Cuba buat kt ank mmg mnjd,_
mmg ngam dan selesa,_
Tak ingt kali berapa repeat beli sini murah pastu baru of course material cun tak panaih,_
terima kasih banyak2 saller,_
Lembut je so recommend you guys beli sini and berbaloi sangat la,_
bila order saiz S besar pulak,_
Effectiveness:losyen tu wangi,_
pth blik ke perak,_
Wangi tak bole bawa bincang,_
Bang mantap keren bang itu musuh megatronkan bang,_
Bghhhjmmikkkk,_
Tq seller barang semua cantik,_
gam dia xcukup kuat,_
Fast shipping+delivery,_
Terima ksh bju dh smpai semua dlm keadaan elok,_
Sorry pic x dk kena mngena,_
harga market price,_
Not reccomended this seller,_
insyaallah bole repeat oder nnt,_
Received it with good condition and good value for the money,_
puashati sgt2 cantik warna Rosewood ni,_
super jimat flash sale!,_
Hehhehee srry gambar xdak kaitan,_
"Lava flows have damaged or destroyed at least 2,910 buildings, according to the EU satellite monitoring system Copernicus, forcing the evacuation of thousands of people from their homes on the island, part of the subtropical Canaries archipelago",_
"Level 3 bans face-to-face classes, contact sports, funfairs, and casinos",_
"Sempena bulan kelahiran anda, dapatkan Scaling & Polishing dengan harga RM99 shj!",_
Cheng added that the higher wages offered by the oil palm plantation sector had also made it difficult for fruit and vegetable farmers to retain their workers,_
Aku beli yg 1314 tapi yg sampai 11-12 hm takpe la sbb jarang pakai kot,_
"SIAPA 18TAHUN KEATAS JOM CLAIM RM40 FREEDownload BīGPAY kt appstore/playstore, register,ENTER code VOQB1MWF06 (jgn skip tau nanti tak dpt), SIAP!",_
"Masih belum guna lagi, jadi tak tahu berfungsi dengan baik atau tidak",_
"Ngammm,",_
"I learnt about the incident on Friday and was shocked, said Fong",_
Kuotaa,_
Lain sangat,_
"I had bought 5w, 10w,10w,15w hopefully all works and can last",_
Tak tahu macam mana lagi kejadian,_
"by seller,",_
"boleh pakai baju longgar dan labuh untuk cover shape, kain pon tebal",_
It says the Os you are using does not pass our security tests,_
Safely arrived dlm keadaan yg sangat baik,_
Murahhhhhhhhhhhhhhhhhhhhhhhhhhhhhhhhhhhhhhhhhhhhhhh,_
saya beli baju yaaa,_
"Barang dah smpai dengan selamat walapun lmbt sikit smpai,kain cantik tak de kerosakn",_
Quality:Elastic is satisfying,_
Thank you shopee pii pii,_
Terima kasihhhh to the vendor for the gift sangattttttt bagussss,_
siap 2 lapis lg,_
"penghantaran laju sangat2, barang pun cukup & okay",_
Aaaa cantikkk wehh colour nii aaa aaa aa,_
YOOOOO Hopefully i win one love you&$HASHTAG$,_
harap berfungsi mcm mn yg diiklankan,_
Material:puting elok dan tidak rosak,_
thanks seller n shoppe telah memudahkan urusan sy,_
Aslam,_
kain amat selesa,_
Horner said he had spoken out in frustration more at a situation than any individual after his championship leader Max Verstappen was handed a five-place grid penalty ahead of Sunday's race,_
"Mmantteeppppss bream directly shipped to the recipient address thanks for the recommended store, thank you",_
"I oder 11/11,barang sampai 13/11 sekejap je u alls !",_
packing good and deliver ontime,_
Just nk inform ship out agak lmbt,_
"Klu anak 1,2 taun bleh masuk 2 org",_
"Next time, please check your customers orders before shipping them over",_
and also ada stain harap seller boleh recheck,_
saiz okayyy,_
Mf video xberkaitan,_
tak ketat pon klu ngm2,_
Takde bubble wrap langsung nasib takde yg pecah,_
Banyak kali dah beli sini sbb murah berbaloi Terbaik,_
The material soooo nice and comfy!,_
Barang dh sampai but ketat skit,_
berbaloi jg la dgn harga,_
Tapi saya suka dengan baju n seluar,_
Nice sama model ngn remote aircond di rumah seller pack sgt bagus thank u soo much,_
tukar ke android,_
Padan dengan harga ikut bajet yg ada,_
kalau hp besar,_
Harga berbaloi dgn barang yg dibeli,_
Good quality value for money,_
