Sentence,Tagged_Sentence
"So, can you give commands to the iPhone, like picking of phone calls by voice commands?",_
Camera are niiiiice,_
sarang,_
suitable for my huawei laptop,_
imma head out,_
barang dah smpai harap harap elok la pendrive nh,_
This whole month my digi app is just keep loading and i couldn't even check my balance,_
kecil senang nk bawa,_
Maaf gambar takde kena mengena barang semua hokay warna putih menawan,_
"will repeat order soon,tq seller",_
Baju xbrape tebal,_
"Nicee, laju betul sampai",_
"Even with blockbuster numbers, Big Oil is more defensive these days",_
menyesal beli 1ðŸ¤£,_
sorry gambar and video takda kaitan,_
Seriously u guys should grab this tudung,_
Not to forget free bookmarks and a 'love letter'!,_
Penghantaran cepat barang dlm keadaan baik,_
Barang sedap boleh order pula lain kali comel,_
"Each individual circuit-breaker should be flipped off one at a time, and then the main switch",_
sampai dengan Selamat n berpatutan harga nya,_
"It's laughable, said Wolff",_
$MENTION$: it&$HASHTAG$,_
Fast delivery ! !,_
"super duper fast delivery, faster than superman",_
Material:kain mmg ok yg tak ok,_
sbb berlipat,_
"TERBAIK,TERBAIK,TERBAIK,",_
Brang puas hati,_
selesa UTK dipakai,_
"also send emails on support as well but unfortunately no response what are you doing guys ,",_
penghantran sngt cpt,_
Alhamdulillah dah smpai barut,_
"boleh bawak kemana mana, memang puas hatiiii worth ittt bsndbshnenwnwbsbsbdbdbbdhdhsjjsjwnwnwnwnnejdkkkk",_
baru betul muslimah,_
Tq saller barang smpai dgn selamat,_
"Tqsm condition pun tiptop lg, dh kali keberapa ntah beli sni, mmg puas hati!",_
vchhhgjhk,_
belum test gantung lg,_
Cuma nk dirikan dia kena letak elok2 sbb x berapa lekat,_
Seller i told you please take extra care for this,_
kain yang cantik,_
biasalah kasut dipos tanpa kotak memang ada part yang kemik2 sket,_
Good harap2 tahan lama,_
ank x tra ag,_
Sorry gmbr not related sbb item dh ltk dlm kereta,_
tak sempat nak ambil gambarni kawan saya yang order jadi gambar tiada,_
Penghantaran dalam masa yg cepat,_
My favourite brand for granola,_
Ouh baru tau so so je aduh melayang,_
Kualiti boleh la,_
Fit perfectly on my 15 year old childs hand,_
"I must say the quality is so good,",_
We would name the kitty Bella,_
"Kualiti sangat memuaskan, da try cas mmg laju",_
Effectiveness:FUMINO DIETARY SUPPLEMENT PRODUCT THAILAND,_
"Product quality is OK for the price, packing too simple caused dented to the products",_
Her trial begins on Nov,_
The result: games that more closely merge the interactive medium with television,_
terima kasih seller dan ninja dgn penghantaran yg sgt pantas,_
best delivery service as usual,_
"Tq seller, 2nd time buying",_
ssuai la nk pkai harian,_
Cup je kecik sikit dari biasa,_
Super fast delivery but the taste is no good so in overall i give three mark,_
niceee sangat sangattt now my desk more organize than bfr tq !,_
Penghantaran ok cepat baju cantik n saiz sesuai dgn badan,_
dah dapat all my junk foods eheheehee,_
"This is 3rd time buy from this seller, good service and fast, just 3 days can receive",_
thank you so much hawzbundle btw nk ootd kasut nie nnt saya bg kat chat ye,_
"Barang terima dlam keadaan baik tkde pecah, penghantaran pun laju terbaik dah try okay sangat, nak ckap full coverage tu tak lah sangat tpi mmg best la pakai",_
Thanks seller barang dah lama sampai cume lmbt nilai,_
cukup semua & murah dr seller lain,_
9 not yet ship out,_
"Btw semalm dah try, berterabur nyamuk dgn anak lipas mati hahahahaha PUAS HATI!",_
Berst 70kg ok je,_
Kalau grab just tekan je order and guna maybank and dia trus auto tolak duit,_
Anak suke terutamanya Bola,_
Utk qualiti produk so so je,_
She keeps saying jabajeen like shes casting a spell on her dish!,_
"I like it, the material is good and nothing is broken",_
Mantap Mantul Cakep yihaaa,_
"Anyway, the earphone is good",_
"good quality, sesuai dgn harga",_
"loveeeee it,",_
"The material is very good, worth buying with this price!",_
I received the parcel but has defect on it,_
"I want a phone very badly right now, so that I can attend my online classes",_
"With elements of the wind and sun, the shadows come to life with vibrant colours that are synonymous with the presence of beauty in everything",_
Beg dh smpai tq seller n j$MENTION$ terbaik laju ja,_
Thank you seller and courier!i already eat 1 cup of tge mushroom porridge and its totally worth it because it was soo good !,_
"Barang ok,cun,penghantaran pantas",_
Bahagian table ada chip sikit jadi hati2 bila bukak dan guna selotep utk tutup bahagian tu supaya tak calar tgn,_
dan sesuai untuk isi baju 3 hingga 4 hari perjalanan,_
The seller was nice and helpful,_
Tak pasal aku kena marah dgn laki aku,_
"Kite try sebulan dlu, nnti okay, kite smbung lgi",_
"Berpatutan dgn harga dpt full set anak pn blh blajar pdpr guna fon ini,penghantaran pn sgt pantasðŸ¥°terbaikk seller",_
eyeliner cepat kering and color die teranggg,_
Mmg cun gile dia functioning,_
No Big discounts,_
Texture:nice and good smell,_
Visit my ig shop to get sexy curve $MENTION$,_
I dont think the protection is good enough,_
pernah beli ada,_
Nice smell come out from box as I brought body shower!,_
Cantik yang merah tuu,_
Terbaiklaa shop n seller ni,_
Secured Parcel,_
Good material and nice product,_
-ba,_
"The next morning, Chen sent Xiao a box of oranges and then added five more boxes when he realised that she had said they needed oranges of different sizes for the experiment",_
apa-apa pun semuanya ok sahaja,_
nak masukk buku text mmg tak lepas,_
"Memang ngam, thankyou ðŸ¥°ðŸ¥°",_
Kain cantik sejuk tak panas terima kasih cepat sampai,_
penghantaran cepat juga tq selalu bagi gift x ingat Kali keberapa beli kt sini ðŸ¤—,_
"baikkkkkkkk, charge msuk lajuuuu, delivery tk smpai sminggu, brg dh smpaii",_
"This intrigued us, says Ghafir in a recent interview",_
So far good condition,_
"Mesin jahit cantik boleh pakai sama macam dalam gambar, banyak bentuk jahitan boleh jahit love ittt",_
So don't expect a lot from this 53,_
Anak beli buku untuk dibaca,_
Ok je murah dan berbaloi,_
"Fast delivery, good packaging, worth for the price",_
Siap dpt free gift kain kecik,_
"Penulis adalah Ketua Laboratori Generasi Siber, Institut Pengajian Sains Sosial (IPSAS), Universiti Putra Malaysia (UPM)",_
Boleh beli ye kawan2,_
Tebal betul dia,_
Kualiti pon helokk,_
"Terima kasih banyak banyak seller, barang dah sampai , terus guna , sekejap je berkilat",_
Received in good condition excellent service by seller good wrapping recommended,_
Was pleased with the quality of their tubular round neck tshirts purchased earlier and decided to try the polo tshirts,_
duduk kt cdc lama,_
Item semua okay & protected with bubble wrap,_
penghantaran laju barang dalam keadaan elok selalu beli local skincare dekat seller ni je trusted,_
sedang2 jeðŸ¤©ðŸ¤©ðŸ¤©ðŸ¤©ðŸ¥°,_
Area muka pun ngam,_
"Item received with good condition and goo quality product, really appreciate it, really affordable price, want to buy another piece next time,",_
pengantaran pon pantas ye even dari penang,_
Murah murah murah murah murahurah berbaloi berbaloi,_
"Expiry date is Oct 2022, good for me",_
Functionality:not try yet because i dont know how to assemble it,_
The cable provided is in good condition and poses no problem,_
Kualiti so so je tp okayla nk pakai,_
Baru pakai yang earloop,_
pakai nipis pun dah nampak,_
even quran telawat suntasi oikhaner vedio teo balmart er ads,_
"Is this an iPadOS ripoff,",_
This keychain is bigger than the normal 1 i usually bought before from other sellers,_
"Pastikan minum subuh, jadi ptg tu baru rasa nk membuang",_
pkai ni smpai k pgelangan tgn dia,_
The goods received but the quality is very thin from what I order from others supplier the picture show is the upper one is I order from others below one is I just ordered,_
Not badfddfffffffffffffffffddddddddddddddddddddddddddd,_
Giftbox RM25ðŸ¤©ðŸ¤©ðŸ¤©ðŸ¤©,_
rugi sbb rm1 satu mask,_
Sedangkan saya membeli 2 unit dan membayar 2 unit,_
"BarangPADUUU,",_
Bought when promotion,_
Dapat beli masa promosi 9,_
Delivery consider slow,_
dah trima tq,_
sorry that the video n picture r not related but the shorts r super comfortable n i might buy them again,_
i already did everything they asked me to do,_
Bayar 2Julai,_
shashiiranjan24,_
"Semalam lock,hari ni dah dapat",_
Mmg powerrr,_
Received in good condition during 11,_
shouldn't call express if delayed delivery in same state (selangor),_
x sabar nak mulakan projek,_
Adik dan abang psg sendiri shja untuk kereta viva,_
"Seller cepat pos, brg cepat sampai, packing ok",_
"soft, not using it yet but i guess considering the price the product is just nice & fast delivery",_
Aesthetic banget,_
"Barang dah sampai , thank you seller , dah pakai kat phone full screen",_
"Following the strong share price outperformances across technology names (84 higher in 2020 and 43 higher in 2021), UOBKH sees less compelling risk-reward valuation profiles, with forward PE valuations for outsourced semiconductor assembly and test (OSAT) and semiconductor production equipment names trading at two standard deviation (SD)/3SD above their five-year mean levels and price/earnings-to-growth of over one times",_
xde gangguan,_
But the shopee customer service not that prompt,_
I had bought for many many times,_
Lumayan enak,_
"I like it, it's super convenient to clean the floor and other places, but hairs will stuck at the vacuum head",_
"Penghantaran cepat dan pantas,kain nipis sedikit tp ok la denga harga,Terima kasih saller",_
Pls disregard SMS if pymt has been made,_
"Stokin cantik tak nipis,",_
recommendet,_
The customer service very kind and helpful,_
M size bag okey but the spoiler things i dalam yg L size tu koyak macam ni,_
i I DON'T LIKE IT,_
Makin kedekut pulak syopi dengan free shiping,_
Ah Ning B40,_
fast delivery and received with good conditionthank you seller,_
jnt pickle it first in their store,_
Fast service by seller & parcel received in good condition,_
"Sangat jarang bocor, kecuali hari yg dia minum air banyak",_
3 and arrived safely on 4,_
Seller baik sangat sangat,_
Hope they last for sometime,_
"The item has arrived, thank you, it is nice, good luck always for the seller",_
"Received in good condition, delivery time quite fast, good packing",_
ok tata,_
Thank you seller kain dia macam bukan cotton dan agak nipis,_
Saya suka harga juga berpatutan,_
I like it so muchhhh giteww,_
"Sentiasa beli kat kedai ni, murah, penghantaran cepat",_
Nmpk mcm kotak lma,_
"Kena pakai lame-lame like pakai malam tu sekali bawak tidur esok tu baru basuh, baru warne naik cantik ðŸ¥°",_
Well packed amd fast delivery,_
Baju nmpak mcm tebal tp xtebal,_
Yyummeh!,_
"Folate acid ,",_
Thanks for your kind blessing,_
"Quality is good, light pink and light purple, look beatiful",_
ðŸ¥°ðŸ¥°ðŸ¤¤,_
long expiry date 22 July 2024,_
Order sampai salam sehari ja ni,_
"Terbaik,penghantaran faster,barang berkualiti dan berfungi dengan baik",_
Besar la jugak cantikk saya suka tapi ntah kenapa beli,_
Alhamdulillah dh smp inner yg ditunggu2,_
* Maaf gambar dan vid takde kaitan,_
Fast delivery TQ,_
kain lembut elok untuk baby kalo nk bedung ke x panas sbb ad lubang halus mmg trbaik,_
cam gini haaaa,_
Saje beli awal sebab awal tak kalut,_
Tq supplier 4 the free gift,_
Semoga murah rezeki kak ye,_
harap seller cek sblm pos,_
"dah lama sampai, cuma baru ada masa nak bagi rating, btw belum di cuba lagi fd saka ne",_
Just bought ps4 controller and get these 2 mask,_
"Sudah chat seller, seller balas da resend dan da terima 2 helai baju tu",_
Assalammualaikum/selamat petang,_
Packaging design for masks,_
"Alhamdulillah , barang dah sampai lama , dah pakai banyak kali pon",_
size smaller because the cutting is really big and the color looks darker than the pictures,_
Cuma tiba2 tengok tadi harga offer rm15 pulak harini,_
the watch really small,_
Tidak bisa dibuka,_
*does not come with usb*,_
Ok terima kasih barang sdah dapat,_
Kne sabo mnunggu jeler,_
Tak sempat pon nak snap,_
Asked me to settle with shopee instead,_
"Sori, video xde",_
murah buat stock,_
"Seller bagus, brg dipacking dngn wrap yg tebal walaupon cuma beg",_
the quality is superbly incredible and I will be in the morning thinking about it but it was meant for you and I am a little more about your company,_
harap dapat membantu baik pulih kereta sy,_
Rasa mcm x best plak barang trang tang tang nampak,_
sesuai sangat untuk anak,_
Stokin tak tebal sangat and pendek,_
have not tried to giv you a review on taste,_
Thank you seller moga bisness trs maju jaya,_
Let c if I can win this time I never win win anything online my Twitter is Raziqkakar,_
"Insya-Allah jika ada rezeki, saya mahu menyambung merakamkan drama bersiri berkenaan",_
and good condition can't wait to try it,_
Kita try tgk,_
Sebelum ni ada beli dengan seller lain kain,_
Good for low budget recommended,_
Tapi barang diterima semua dlm keadaan baik,_
Kini selesai sudah masalah,_
"Penghataran sangt cepat,oder smalam hri ni sampai",_
Brg smpai berfungsi dgn elok dan ringan,_
Mantul j,_
sudah test berfungsi dengan cemerlang,_
Effectiveness:nice,_
"Alhamdulillah barang sampai dengan elok, berpuas hati sangat saiz helokkÂ² jahh",_
"Yg pake batu, lumayan gede",_
xjarang dan kain tebal elok,_
bolehlah dah try guna ok sgt sesuai lah cuma penghantaran je lambat dekat 2 minggu baru dpt tu pun 3 kali out for delivery baru dpt huhu,_
Sampai dalam keadaan baik dan takde rosak atau bocor,_
senang pasang dan selamat,_
Satu kajian yang diterbitkan dalam jurnal Food Science and Human Wellness pada tahun 2018 menunjukkan bahawa pengambilan jagung bijirin penuh mempunyai kaitan dengan penurunan risiko perkembangan diabetes jenis 2 (T2DM),_
sampai tak muat baby aku nak pakai dah,_
"According to the bank's weekly survey of analysts at leading Brazilian financial institutions, the GDP growth forecast for 2021 has remained unchanged for 16 weeks",_
"bagus seller siap tulis note utk abg posmen, pembungkusan pun bagus ada bubble wrap, adaptor berfungsi dgn baik, recommend sgt2,tq seller",_
Love the phone excited to try out the new features,_
Curious whats the wattage of the charging brick,_
ðŸ¤¦ðŸ¤­ðŸ¤­ðŸ¤­ðŸ§‘â€ðŸ¦½ðŸ§‘â€ðŸ¦½,_
Thankkkkkkkkkkyouuuuuu mmg berguna utk adik pergi sekolah,_
"None of the countries in the region have any intention to become involved in direct conflict, he said",_
"Alhamdulillah, dh smpai buku ni",_
Boekkj tepat pada masanya ngam tengah nak buat kreta barang sampai macam food panda pula,_
Maybe I should try 2XL,_
"Barang terima dalam keadaan baik , penghntran sgt cepat",_
Waiting test it :),_
Order come in good condition as well packed,_
"However, keen on a 120hz screen + better battery life",_
skg motor sy suda berada d langit jmpa ayah pin disebabkan kehenseman yg melampau lpas pasang barang aksesori tuan,_
1cawan gula halus,_
ingatkan tebal sikit mcm buku ori,_
Haritu dah beli dua,_
Yet to try the taste but looks good,_
what is that about?,_
Bila pegang kain mcm lembut,_
got any grapes?,_
Fast delivery n recommended seller,_
"Im falling for this brand~ so sedap,",_
The oversea one reached safely but not the local one (out of stock),_
Best buat lap pinggan dekat dapur atau cucu kereta pun boleh,_
The most beautiful stories BTS,_
berat 55,_
Tp lebih berbaloi coz x yah susah2 q kat kaunter n packaging pun not bad,_
hrp mnepati slera,_
But waist is not snug but thighs are perfect,_
I love it I love it I love it very very very muchhhhhhhhhhhhh,_
Biasa la sbb kita kena pasang sendiri kotak tu,_
Kecewa Tapi overall semua boleh lahh,_
MURAH DR KEDAI LAIN,_
baru free nak rate,_
Africa,_
Tak try lagi nanti dah try sy edit balik ok ke tak,_
"kat bahagian camera tu sangat tebal ye, dan menjaga camera belakang kita",_
I see the moon is shining so bright tonight,_
Delivery quite laju and bau wangi,_
Packaging was also secure,_
Baru nak test,_
Terima kasih seller barang sampai dgn cepat dan pantas tq,_
Barang Sampai dalam keadaan baik Bungkusan yang kemas,_
Baju lengkap dengan plastik,_
"xpela, sbb xurgent",_
jirn suka,_
letak buku n rehal mengaji,_
Suka beli kat kedai nie,_
"For grab food, they don't give refunds/compensation for spoiled food",_
Tidak terlalu mahal seperti wipe berjenama di pasaran tetapi kualiti agak baik,_
Petugas SPRC sebelum ini meletakkan penghadang minyak yang panjang berhampiran garis air pasang bagi mengekalkan tumpahan dari mencemari pantai tropika itu,_
Tak sangka dapat warna hijau,_
and freshly roasted!,_
A simple loafer,_
"Sorry gambar x da kaitan, lupa nak snap hari tu",_
Hope to winðŸ¤ž Greetings from PortugalðŸ¤—,_
Good joob !,_
ramai cakap sedap,_
brg bebaloi dan ngam dgn harga,_
Barang sampai tepat waktu,_
"After transfer few files, then all files corrupted",_
"Kalau okay, boleh repeat order",_
"1) Pre-order kata 30days, tapi sampai after 45 days!",_
bought many many times from this good seller,_
Byk kali repeat order dh,_
UN-Habitat received 120 nominations for the Scroll of Honour Award this year,_
à¦¬à¦¡à¦¼ à¦¬à¦¡à¦¼ à¦¬à¦¡à¦¼ à¦¹à¦¯à¦¼à§‡à¥¤ à¦¸à¦®à¦¯à¦¼ à¦¸à¦¿ x xx à¦¯à¦¾ see à¦¯à¦¾ à¦¹à¦¯à¦¼ à¦¯à¦¾ cc me à¦¯à¦¾ X cc z see xc can zz XX à¦¬à¦¡à¦¼ z see can be xv thes,_
bhg lain dia cam half transparent,_
kain tshirt biasa je sesuai la dgn hrga,_
But cantik warna putih compare black,_
"Affordable price,friendly seller",_
Tq for extra 1 pcs,_
"Fast delivery, the quality of the product is good, i'm sure to be a regular buyer, hopefully your blessing and blessing will be blessing, thank you",_
Missing 1 product it ok,_
Good wrapping as well,_
Taste:sedap ja,_
ok la bag pun kualitit memuaskan kene dgn harga,_
"DELIVERY ARE QUITE SO FASTTTT , OMG I LOVE ITTT , very recommanded",_
barang elokkkkkkkkkkkkkkkkkkkk,_
Fast delivery will repeat Tq tq tq tq tq tq tq tq,_
Perumpamaan bosku,_
Super small,_
The sound very responsive and clear the bass mantap,_
Cantik jamnya berbaloi dengan harga terimakasih reseller,_
"VIENTIANE, Oct 18 (Vientiane Times/ANN): The National Taskforce for Covid-19 Prevention and Control on Friday night (Dec 17) announced 1,702 new cases of Covid, along with four more deaths from the virus",_
Sekarang lemot banget ni aplikasi,_
"Since it's silicone, it can stretch but not well fitted",_
Qualitynya bagus dan sama dengan,_
"Dengan adanya kemudahan SMK Bandar Saujana Putra ini, ia tentu memberi banyak kemudahan dan manfaat kepada ibu bapa di kawasan ini bagi membolehkan mereka menghantar anak ke sekolah yang lebih dekat",_
"PENGHANTARAN YANG SANGAT BAGUS ,",_
I choose for M size but I received like S Size,_
"Secondly, an all of society response is needed whether it involves NGOs, and whether it's locals or foreigners living in Malaysia - to overcome a pandemic or other devastating disaster of this magnitude",_
Dress quite see through so u need to wear inner,_
Excellent communication by the seller,_
"barang boek ni , wayar tak senang rosak kalau pasang benda ni",_
remote box tv boleh diguna,_
packaging tetap bocor,_
ve had a Vizio since 2017 and it&$HASHTAG$,_
I'm so glad they finally stopped including a power brick in the box!,_
"5mm headphone jack, all the best to all My Twitter handle : $MENTION$",_
lama jugak saya tunggu,_
It takes up to six weeks just to make a pair,_
bpenghantaran pantas,_
LOVE ðŸ§¡ LOVE ðŸ§¡ LOVE ðŸ§¡ LOVE ðŸ§¡ LOVE ðŸ§¡,_
alhamdulillah sempat sampai sbelum melawat cucu,_
"The world's largest book fair, the 40th Sharjah International Book Fair (SIBF) which ended Saturday, attracted 1,692,463 visitors from 109 countries, despite the Covid-19 pandemic",_
"Alhamdulillah cept smpai wlaupn sellr baru pos semalam, order since jumaat",_
"If you want a better option, look into a Logitech pebble and UAG scout",_
Easy to assemble too!,_
Kne lecha je harga brg,_
"Disebabkan kewujudannya di mana-mana, kami mempunyai akibat tidak diingini daripada pendaftaran seluruh penduduk pada platfrom digital",_
Tunggu sudah 1 bulan,_
i pay for the item,_
"Tapi since seller kata dia nak hantar panel solar baru, so bagi 3 star",_
Terbaik seller lain kali boleh order lagi,_
Muka Besar&selesa sesuai plussize,_
"Fast delivery excellent service by seller yet to try, if good and lasting will repeat order again !",_
"Maaf bang video tiada kaitan , barang okey",_
"If there's a good year of tourism, it can help me to train and travel for races for three to four months",_
Just like thick,_
The product could be broken with no bubble wrap,_
Order 45 helai,_
Saya puas hati dengan produk ini,_
"Hong Kong authorities reported a wave of some 25 new preliminary-positive coronavirus cases on Friday, while announcing that those who had received two doses of the BioNTech vaccine would be able to sign up for a third from January 1",_
Really fast delivery and really good packaging,_
gambar tak de kaitan tapi beli benang utk jiran,_
Got the free gift alongside with purchase of Megumi Hair Essence,_
"paling sedap antara semua flavour, takyah cuba yang lain dah",_
"yg alas dalam tu tak lekat betul, kalau jalan, rasa bergerak2 tak selesa kadang2",_
btw y pakai size m better amik size L or xl laa jgn kau bantai size M pon dh macam size s tau,_
walaupun 10gram ja bila dikembangkan dapat banyak,_
Pjg smpi buku lali,_
"Seller take note perincian buku yg nak dibindkan dgn confirm dgn buyer terlebih dahulu, aturan kerja yg professional",_
Looveeee,_
Seronok bile buat gift box utk customer,_
"Tgk shopee xupdate, barang xbergerak pon dri perak",_
"Marcos is also facing a disqualification case grounded on a two-decade old tax evasion conviction, which Eurasia said Duterte could weaponise if he turns against his ally",_
Apa apa pun memang murah dari kedai2,_
This product good and is my 4th times with this seller,_
"Suddenly, he heard footsteps pounding along the passageway outside",_
"Second time purchase, recommended store",_
Sesuai untuk masukkan buku pelajar,_
umph muantap ommm nanti boleh beli lagi ni,_
Anak request pasir macam pasir pantai,_
niceeee so fast deliver,_
"cherryshop always be my fav shop,",_
Order 7hb smpai 9hb,_
ApaÂ² pun kain best jenis getah kan,_
This is my first time buy bird nest from here,_
Just takda respond kat chat je,_
Kalau pakai kain skirt singkat ke okay je pakai legging ni,_
"Cantik sgt, cincin adjustable, tapi mmg betul2 ngam2 ngn jari manis sy saiz 15, xperlu ejas",_
"Good seller,good service,good product",_
Clinical operations were not affected too,_
Kemarin bayar hari nie dh smpai,_
okla selipar tu,_
Mask chain adult & kids face mask strap tali gantung variasi black,_
"tengz seller~dah la murah pastu kualiti okay pulak tucantik sangat hehe ni beli then pakai untuk kerja next time nak repeat beli warna lain pulak,",_
Ok boleh bei lagi lpasniiiiiiiiiiiiiiiiiiiiiiiiiii,_
"Seller terbaik, penghantaran lajuuuu",_
Complete received items wallet cantik & sesuai utk gift bg ayahðŸ¥°,_
"tengok,kucing saya pun suka sgt dgn design ni",_
"Its okay for me, nak pakai sehari je",_
Sesuai for those yg ada bibir kering tu,_
Seller is the trustworthy person,_
Dah sampai pn makanan kucing,_
Senang dan puas hati sgt,_
"Since dah banyak kali beli dengan decathlon ni, so tahu service mereka ok",_
Knee guard dah,_
"Beli ni sblum tukar phone, phone pla tidak tmpt msuk aduiii",_
Susah didonlod,_
"Thank you seller, already received the package",_
Just bhgian pgang kecik sgt nextime mau ambl size bsar dri biasa,_
Barang diterima dgn pantas Dan baik,_
Tapak mmg sesuai maen futsal indoor kesat xlicin,_
Children Colour Mask,_
Performance:quality time it's good,_
sempat ni kita,_
pos out laju Dr seller n j&t,_
J&T super fast delivery great job,_
kali kedua repeat sbb qualityðŸ¥°ðŸ¥°,_
My 3rd time ordered,_
dpt kuantiti sme mcm yg dimnta,_
caption,_
Mix of pvc and Eva not totally Eva,_
my scnd baju beli kat sini will repeat againn,_
Seller packed shipped out fast,_
cuma x sempat bukak lg,_
Kain cunnn gilerr lawa cotton lembut sejukkk,_
"Hari tu beli untuk mak, mK buat baju cantikkkk",_
Received safely but i havent unboxing it >,_
f o r,_
"Letopsss matt , boleh laa sbb murah ennn sksksks dia punye kualiti sikit nipis tpi",_
"Katanya, Johor juga sudah membangunkan sistem khas 'Johor Travel Save' bagi melicinkan pelaksanaan VTL darat",_
"When the ride was smoothly, please reduce the charges",_
"We saw some players who are feeling a bit, I don't know what was going on, but Victor was feeling his breathing",_
Jimin be like : why did my album decoration look different Also jimin : who put this donut here Jin :,_
Responsive seller n harga murah,_
We actually used this long time since he was born (now he's 1yo),_
Fit my table well,_
baju serap peluh Dan sejuk,_
anyways yeji cantik,_
"ilove it, thankyou",_
The delivery is not too fast considering its from johor to johor,_
wrapped with bubble wrap but the box of bulb still cracked,_
okaylah dgn harga nak pakai workout dalam rumah je huhu tapi i amik satu saiz besar rasa cam ollonggar sikit maybe amik saiz asal okay kot atau pakai stokin tebal,_
Cuma kotak je ade koyak sikit,_
Effectiveness:Badan segar dan xletih,_
Harap2 ok utk guna masa pantang nnt,_
"Barang dah sampai,xcuba lae",_
Baik terbaikkkmmmmmkkkkkkkkkkkkkkkkkkkkkkkkkkkkkkk,_
"Mcm sedap, tapi minyak goreng nya sdh hitam",_
"untuk yang berat 85kg , dan tinggi 160cm macam saya , mungkin boleh amik 4XL sebenarnya",_
sori pic x dak kena mengena,_
"Semalam order, tgh hari ni terus smpai",_
Penghntaran juga pntas,_
kualiti plastik okay,_
Xuan Yap,_
com/watch?v=ypX9ij8rUHI&amp,_
"As another said i also have the PowerBeat Pros that are dying, but now debating between goin with the Sony XM4&$HASHTAG$",_
"0 rate, Peninsula Higher Education (PHE) is collaborating with Bosch Rexroth to create Bosch-certified skill training centres across Malaysia",_
