Sentence,Tagged_Sentence
Harap barang tahan sajalah,_
Tq seller shope express simpan barang org Lama2 buat apa xtaw,_
The apple is sour but tasty and prefer more than blueberry,_
KM Sarawak akan terus perjuangkan 20 peratus royalti minyak,_
Pic and video unrelated,_
🤗🤗🤗I don't give up shopping here,_
KEREN DONG,_
"Necktie, seluar track",_
Ye to bilkul Vivo T1 jese h,_
Tiada Ujian,_
Savely arrived a week ago,_
"Really like the switch, sounds really nice",_
game semua ok,_
"Coba instal lagi dan KECEWA, sulit menentukan titik lokasi penjemputan ,",_
seller bagi cantik sgt thnkyou seller 🥰🥰🥰,_
Shape: rectangle like a square (boat),_
"Comfortability:,🤦",_
very good itrm,_
Penghantaran packngcepat sampai,_
seller terbaik penghantarn laju barang bagus vacumm sedutan kuat,_
Pakai ni kejap je and colour dia very nice!,_
Value to buy value to buy,_
Skin Suitability:5 of 5,_
Parcel dah sampai di asrama anak,_
Boleh laa nak pakai buat jalan2,_
",its help more thank u",_
"Kasut ni best sgt bila pakai,daam dia lembut je",_
Album was packed very securely and item arrived in good condition,_
Sampai pun dalam keadaan elok,_
It's thin yet very comfy even if you're sweating,_
(Vmin),_
Tq dh smpai ok not bad kasut lawa tq seller tq qourier good job,_
mmg sesuai dgn anak,_
07-04-2022,_
"tapak kasut nih mcm getah getah gitu so lembut and selesa arr, nk buat jogging pon best nih, harap boleh tahan lasak lama🤣 warna cantikk cam dlm gmbr",_
Texture:tak berbuih sangat,_
Tp macam tak kick bila makan,_
Just restock my bath things,_
Yadiiii,_
"Dah byk kali beli ,mmg selesa pakai",_
"Surprised by quality, soft and comfortable",_
Though i needed some time to figure out how to set it up,_
Excellent service by this seller,_
"ADA MACAM2 JENIS BUNYI, TAPI SAYA PILIH BUNYI DINGDONG BIASA SUPAYA TAK PENING DAN KELIRU",_
Kalini banyak jackpot thank u seller murah hati belanja customer,_
sgt puas hati quality kain best,_
"Laju,pantas,halilintar penghantaran",_
"Kesemua barang dan kes diserahkan kepada pihak Kementerian Perdagangan Dalam Negeri dan Hal Ehwal Pengguna (KPDNHEP) Kelantan untuk tindakan lanjut mengikut Seksyen 21 Akta Kawalan Bekalan 1961, katanya",_
"He added that Singapore hopes to collaborate with like-minded parties to support key initiatives such as the Access to Covid-19 Tools Accelerator - a global collaboration to accelerate the development, production, and equitable access to Covid-19 tests, treatments, and vaccines - and the Covid-19 Vaccine Global Access Facility, as Friends of the Facility",_
90 selai🥰 Buat pakai harian,_
barang pon smpai dalam keadaan baik,_
Skin Suitability:High Quality very better and Money value very better,_
"Seller pun bagus, very responsive",_
Saya telah terima dalam keadaan baik,_
Taste:pedas nakmampus gentle but iloveit!,_
"ITEM FIT WELL FOR MY 17 LAPTOP , RECEIVED IN GOOD CONDITION , THE PRICE ALSO AFFORDABLE , VERY RECOMMENDED",_
"KUALA LUMPUR: Ganjaran lebih tinggi bagi menggalakkan pemberi maklumat (whistleblower) untuk tampil melaporkan salah laku boleh berperanan kritikal menghentikan amalan rasuah dan membanteras ketirisan ekonomi berbilion Ringgit disebabkan perdagangan haram, kata Datuk Seri Akhbar Satar",_
Kalau ada tahap kesabaran yg tinggi boleh kot order,_
siap bagi yassin lebih lagi,_
So better amik size L,_
I didnt got mingyu for the pob,_
Belum cuba lagi nanti dah cuba update balik,_
great promotion during this sale,_
Good thing I dident have to untie the child this time,_
Kena beli satu size lg besar kot,_
so far tq seller and abg jnt!,_
seller ship out hari itu juga,_
"Seller post out laju, packaging tiptop",_
saiz pon ngam2 cntik,_
"nice fast deliveryyyy,",_
First beli rugi beli 2 pasang salah size,_
"You get what you pay for, matches the price",_
cantik&good🦋🦋🦋🦋🦋🦋🦋🦋🦋🦋🦋🦋🦋🦋🦋🦋🦋🦋🦋🦋,_
"Nak kualiti bagus, kena beli yg ribu2 haha",_
Thank you jugak untuk freegift,_
ordered on 10 February and received on 12 February,_
The next edition will have two new teams -- Lucknow and Ahmedabad -- with the competition featuring 74 matches where each side plays seven home and seven away games,_
ℝ ℝ ℍ,_
Good product quality with fast deliveryy,_
The only down side is the currier service they are too slow and keep sending my parcel to other place not once but twice,_
Baju nipis yakmat,_
Minecraft plz,_
Size/Perfect Fit:xl fit 3y 13kg,_
"order 15/Nov, received 23/Nov",_
Sampaiiii,_
Seminggu sekali pun takpe,_
Selesa pakai dgn sandle saya sbb sandle tu licin,_
Klu serasi boleh oder lg,_
"Taste:strong coffee, just like the way I like it",_
Penipu digi gak jelas dh beli tetap line slow penipu buang je lah dari play store my digi di cipta kan untuk tipu orangg supaya dapat duit aku lapor dekat polis,_
berbaloi harga yg sgt2 murah,_
"SAN FRANCISCO: Gergasi media sosial yang sedang dibelenggu skandal, Facebook, akan menghentikan sistem pengenal pasti wajah yang sekian lama dikritik dan akan memadam data imbasan ke atas satu bilion orang, dedah syarikat itu Selasa lalu dalam satu respons mengejutkan terhadap kebimbangan privasi",_
lepas ni memang akan repeat lagi🤗,_
harab tidak tembus air bila hujan lebat,_
"Keadaan baik, bungkusan kemas dan susah untuk rosak barang",_
Added 2 more colors into my strap collection,_
These is amazing phone they amazing features Twitter: SinghJi76586094,_
Beli utk hantar kat rumah pengasuh,_
Semua gambr tu ada kesan kotor,_
"Stoltenberg, an economist by training and former leader of the Labour Party, was Norwegian prime minister from 2000-01 and 2005-13 before becoming NATO chief the following year",_
thankzzzzxxzzzxx,_
last last worth it weyhhh !,_
Functionality:Ok nice !,_
tiada kekurangan!,_
Super bad app I ever used!,_
"Agak kcewa skit sbb pos laju tdak chat or call bila smpai d tmpt saya, mngkin seller tdak letak no hp",_
Everyone agrees that ARMY is the luckiest FANDOM!,_
Flip octopus comel,_
less iron,_
Sya pakai saiz 32 tpi sya ambik 34 memang ngam,_
Cuma harap kurier pls alert dgn no,_
suka masam2 asam laksa,_
🥳🥳🥳🥳🥳🥳🥳🥳🥳🥳🥳🥳🥳🥳🥳🥳🥳🥳🥳🥳🥳🥳🥳🥳🥳🥳🥳🥳🥳🥳🥳🥳🥳🥳🥳,_
"From touching the touch feel point of view, hammer series is the best",_
Harap membantu dengan kancil yang usia 20 tahun,_
Ada wrap yang sangat dibalut rapi,_
parcel tdg dh selamat smpi,_
After few times I tried the 7,_
Pape pon ngam thnks u seller,_
"seller sent out the product very fast, just that been delayed bcoz of raya holiday",_
probably due to courier problem,_
This i nit illegal?,_
"Pemain muda, Noor Ainaa Amani Ampandi memastikan kemenangan mutlak buat skuad negara apabila meraih mata ketiga selepas menewaskan Sogol Samoudi 11-5, 11-4, 6-11, 11-6",_
Wrapping boek,_
"Delivery ok,item packaging also ok",_
Tapi boleh la buat pakai,_
Skirt okay cantik sangat,_
Parah !,_
"Barang sudah sampai bosss, terima kasih sekali lagi, next time saya beli lagiii yah selesa pula brrlari",_
X sabar nak ride with new glove,_
Okay sedap je,_
"This is highly recommended,",_
Barang dah sampai cukup semua tiada cacat cela penghantaran laju sehari je terbaik,_
Everything in a good condition Thank you so much for the great service,_
Repeated order banyak kali suda,_
Global set bukan sama ke dengan MySET?,_
"Cable able to support 4k 60hz even though passed thru a 2 In, 1 Out HDMI hub switch",_
"First aq beli pintu die, pastu ni aq beli sambungannye",_
ordered yesterday today it came in🥵,_
Good parcel delivery,_
Good quality and it's quite big for weekend holiday,_
"Memang saya gugup ketika disapa mesra Raja Zarith Sofiah yang datang ke rumah saya di Kampung Pogoh 3, di sini",_
Cuma nk kne ptong sket kain sbb sy pendek huhu,_
"Thankyou sallerfast deliverybaju cantikkain cantikselesa sangat,",_
dah cuba rase sedap &xpahit,_
Nivea brand tapi murahh!,_
"There is a 'decentralisation illusion' in DeFi since the need for governance makes some level of centralisation inevitable and structural aspects of the system lead to a concentration of power, the BIS said",_
Warna yang saya nak sampai dengan tepat,_
the quality is very soft and good,_
"83, or 2",_
Okayy takde rosak apa apa penghantaran laju good,_
delivery is so fast get on the next day after place order,_
"Quite acceptable quality, but surprisingly not so big but should be good",_
"The fire was largely extinguished within 30 minutes, according to NHK, after engulfing a narrow, 20-square metre (215 square foot) room",_
Keadaan keropok leko pun elok je,_
Definitely worth for money,_
order harini esk dah dpt brg,_
Semua ok takde rosak atau pecah,_
Just as i want it,_
Just purchased one month to test and see,_
sampai juga akhirnya barang yang ditunggu2,_
thumbs up for some Kunai action,_
"recommended, bole repeat order ni",_
"Best benda ni, pasang dalam bilik aircond, jadi lah ala2 bilik hotel gituu saya beli 2 satu letak kat ofis",_
suka betol budak² dapat beg yg cantik nie,_
Gambar& video tiada kaitan,_
Trima kasi sngt sillet,_
40 je wow sangat sangat la,_
"Your standard, modern hearing aid comes equipped with at least three hearing programmes, four channels, digital technology and noise and feedback suppression",_
pakai stokin ni kaki auto hensem,_
cantik n angin kuat,_
Alhamdulillah barang dh smpai 🥰🥰🥰 sluar cntik kain tebal mmg xrugi bli recommended sgt tq seller 🥳🥳🥳🥳 nanti boleh repeat lagi maaf gambar tiada kaitan apapun mmg xrugi bli cepat penghantaran,_
"thanks to seller, really recommended to buy",_
Material:sgtlah cntik,_
Best material for the tiny gadget bag,_
"Lovely color, comfortable cotton",_
Good condition and good pakejing,_
Seem long lasting,_
ank suka mlompat2 ja huhuhu,_
kain dia syok span pun elok,_
Yg putih alhamdulillah,_
Chia Ying Ooi Kah Yen if I balik la harrrr,_
Taste:rasa sedapp mmg xmuak lansung,_
"The option of sending a nonpolitical representative, tabled by Asean, was also blocked by the junta",_
Nice quality worth it for the price and fast delivery recommend seller,_
If u want something small to keep a decent amount of pcs u should def get it :),_
"For the period of January to October, the country's CPI grew 2",_
Hundreds of Trusted Brands Fr,_
ambo beli boh,_
dia datang rumah jatuh cinta dgn yg kita,_
"Barang sampai dengan selamat, penghantaran pantas, terbaik seller",_
Cunnnnnñnnnnnnnnnnnnnnnñnnnnnnnnnnnñnnnnnn cunnnnñnnnnnnnnnn cunnnnnñnnnnnnnnnnnnnnnñnnnnnnnnnnnñnnnnnn cunnnnñnnnnnnnnnn cunnnnnñnnnnnnnnnnnnnnnñnnnnnnnnnnnñnnnnnn,_
Taste:good Nice,_
Brek and spark plug sampai dengan selamat,_
Apa gk bau amisss nasi nya,_
BOLE REPEAT LEPAS NI,_
I have will buy from you again in time to com,_
"Smallest size available is M, suits my daughter who usually wears an S",_
"Kami di AllGadget Solution mementingkan keperluan serta kehendak anda dalam dunia gaming, editing, streaming serta office work -kosong satu 2",_
Terbaik terrrrrrrrrrrrrrbaaaaaaaaaiiiikkkkkkkkkkkkkm,_
everything okay!,_
Selamat sampai terima kasih terima kasih terima kasih terima kasih terima kasih terima kasih terima kasih terima kasih terima kasih terima kasih terima kasih terima kasih terima kasih terima kasih terima kasih terima kasih terima kasih terima kasih terima kasih terima kasih terima kasih,_
Barang dah sampai brapa hari lepas baru kesempatan rate,_
The Rio de Janeiro Open begins on Feb,_
nanti beli saiz L plk,_
"Penghantaran yang sangat cepat, bungkusan kemas, barang sampai dalam keadaan baik, corak seperti yang dipesan",_
"While place order, the stock number showed 40+ stock left",_
Barang diterima dengan selamat dan sangat cepat,_
penghantaran pun xde la lambat,_
Alhamdulillah Bubble wrapped & safely arrived !,_
Sampai hari ke6 baru dia inform I brg no stock,_
yg badan size s bole laa pakai,_
postage pn murah compare seller lain,_
muat 70 keping gambar,_
EURO: Shaw tutup mulut Mourinho,_
Boleh turun naik lampu ye,_
Tpi sorry,_
Barang dalam keadaan baik yang xbaik adalah penghantaran shopee,_
sorry video was not related,_
Murahh love sangat beli time shocking sale sebaik dapat biaseyer tak dapat takpela bnde murah kan tai selesa tk pnas satu lagi seamless so bile pkai dgn seluar ke kain k jubah ke tak nmpak kesan dia boleh repeat lagi,_
Beli online berbaloi2,_
Excellent&perfect‼,_
bungkusan nampak kemas,_
for me body scrub susu ni bau dia mcm bau sabun basuh baju pun adaa tp ok lah wangi jgk,_
Hi Assalamualaikum,_
"Cantik sangat warna pink , tiada kerosakan",_
stoking dia cantik,_
Sblm ni ter-rate 2-star sebab sakit hati koyak pulak,_
Kemas & elok cara pembungkusannya,_
"Fast delivery , very sastified with the product",_
Kasut nampak comel dan kemas,_
"We may never be able to control this pandemic outbreak, which saw new virulent variants spreading fast in the community, and be forced to live with the virus for good",_
Should buy M/L next time,_
Fast delivery lead time,_
"Received without bubble wrap, but it's okay only the kotak dented",_
Like the app a lot it keep me on point with sneaker and clothes,_
He has vowed to fight tooth and nail to earn a spot and believes that he is primed and prepared when the season resumes on Aug 26,_
buat pakai2 kat rumah jerr,_
Pdhl tak fit mana pun Syukur seller ni jual panties gini murah2,_
Terima dgn cukup dan pantas,_
He says developers will have to adapt and find what appeals most to buyers,_
ada tali purse,_
While he's touching your skin,_
"Cadar dah sampai,cantik",_
Keyboard is function well,_
dari anak baby sampai dah nak 2 tahun setia pakai anakku detergent,_
"So secure, and no need to worry if your parcel will bocor tgh jalan",_
soft and comfort,_
kalau pkai style balut biasa jadi xjarang,_
Harap wrist tak sakit dah pakai nate ni,_
Beli putih macam tak berapa sesuai,_
"Sy puas hati, lain kali bole shoping lagi tq saller",_
🤝🤝🤝🤝 sakit sikit,_
"Baik baik baik baik , tq nanti repeat lagi baik baik baik baik baik baik baik",_
"Cukup dengan rangkaian kata yang tersusun jadi sebuah kalimat, niscaya api di jiwamu akan berkobar lagi",_
Baju berbulu sikit,_
"No matter how much I press review and check, nothing changes",_
"the quality not bad, it seems quite solid",_
Baju dah sampai next week boleh pakai,_
i'm 154 and berat 60 plus minus,_
Edited: I think this sandal is for women,_
"It credits the momentum to the reopening of local flight routes by Malaysia Airlines, AirAsia and Malindo Air",_
Cantikkkk sangat handbag ni sesuai untuk santai2,_
"KUANTAN: Jabatan Perikanan Pahang merekodkan lima kematian penyu agar akibat tersangkut pada pukat nelayan dan terkena kipas bot dalam tempoh 10 bulan, tahun ini",_
Functionality:Floor,_
"To cheer everyone up, all Liverpool Football Shirts are 50 off for the next 24 hours!",_
Go buy this dashcam now lah,_
"I've seen not in Japan with one ,",_
The material is very nice and comfy!,_
Barang cepat sampai tapi packing x berapa cantik,_
Adik kakak semua beli yg sama,_
Tq for the free give my daughter love it so much all the items received with good conditions i love the material it's very soft and good for hot country,_
"1) when i tap the food category, it relocates me to a different menu",_
$MENTION$ OMG OnePlus Nord 2 is pretty much Wow,_
Comfortable to wear while you're in the first trimester,_
Alhamdulillah boleh diguna pakai,_
Kualiti okay even nipis sikit padan la dengan harga size L labuh mantap,_
Zoey Voon Jolene Tan,_
benang jahitan elok,_
Tersangat sangat baik tak sia² menunggu 🤩,_
🥰 Terpulang,_
"Good condition while receiving it, packed well, satisfied with it",_
Jimat duit kalau pergi butik semua harga atas 100,_
- very satisfied,_
Pulas nk bkk tibe pch,_
Really worth for the price as it is good in quality,_
bandingkan,_
cantikk dan muat muat je,_
t have IG how can I still win?,_
🤞 _You are never too old to set another goal or to dream a new dream,_
Sorry gambar blur,_
Dilivry charges bohat high ho gaiy is liye kam hi karte hain dilivry ab,_
"The product is original, fast packaging and neat",_
3stars just the product itself,_
Performance:bateri 8800mah tapi cepat sangat drain,_
Bunyi pn jelas,_
nanti cuba untuk anak,_
Jarang sikit tapi soooo cantik n selesa pakai,_
Lepas tu kena repeat beli laaaa tidak kaa dok teringat sampai bila bila,_
product quality fair,_
"Hakikatnya, tahap peduli pemaju, pihak berkuasa tempatan (PBT), pihak berkuasa negeri dan pembeli itu sendiri akan menentukan pola pembangunan serta pemilikan perumahan di kawasan berkenaan",_
"The bag is quite big compared to my old bag that i bought almost 6 years ago, but still good",_
Boleh pakai badahan biasa atau bersukan,_
"Dalam perkembangan sama, Timbalan Yang Dipertua Majlis Agama Islam Kelantan (MAIK) Zulkifle Ab Rahman berkata, setakat ini Masjid Pakistan akan menyediakan penempatan sementara kepada mangsa kebakaran",_
omggg !,_
smpaii dlm keadan cntikkkk,_
and thank for the freegift,_
Seller pantas bertindak,_
"im 153 and weight 35 but S is still tight on my thigh eventho i dont have big thighs cause im skinny af, sadly doesnt fit me, overall ok la ~",_
Bbarang sampai dam Kasaan baik,_
", the world's largest battery maker",_
Good price good value good quality affordable price thank you will buy again thank you,_
Sambal kacang kriuk agak kering & keras skit,_
KUALA LUMPUR: Pelakon Adam Shahz tidak berniat memburukkan mana-mana syarikat produksi termasuk JS Pictures berhubung pendedahannya mengenai syarikat produksi yang didakwa meneruskan penggambaran biarpun sebahagian kru positif COVID-19,_
"Bag cantik dan elegan, cantik sangat dan sangat bagus",_
"The White House, the U",_
"Mask best, soft and light",_
"The 24-year-old told reporters at the circuit in Austin, Texas, that he had made an unscheduled detour via New York after missing his original flight from Nice in the south of France due to the mix-up",_
Tqvm seller for fast response,_
Ori Pak Joko Yamaha Jakarta,_
87756,_
That's why i changed the rating from four star to one star,_
"Tak faham dgn kaki sendiri , kadang beli kasut saiz 38 padan elok , kadang besar",_
thnkyou again,_
Portable and easy to carry,_
tq for all free gift,_
3 hari jgk la amik masa nak sampai,_
Barang sampai keaadan baik,_
"Beliau turut menyatakan penghargaan Malaysia terhadap sumbangan pekerja migran warganegara Indonesia kepada pembangunan ekonomi Malaysia dan kehidupan rakyat negara ini, dalam pertemuannya dengan Presiden Indonesia, Joko Widodo, pada lawatan sulungnya ke negara itu sebagai Perdana Menteri Malaysia, hari ini",_
I will do my best to try to balance out these more controversial viewpoints with other people's perspectives,_
Valuable product with low price!,_
Quality:tanpa rap bubble,_
first order dpt slh,_
Barang sampai dgn selamat dan pembungkusan sngt kemas,_
cantik tp silap bg colour,_
4 million vehicles on Friday,_
tpi ambil saiz besar sikit ya,_
Bagus murah dari biasa beli masa shocking sale,_
Kini saya lebih bergaya berbanding dulu,_
staff J&T buka Parcel,_
Maaf vd xda kena mengena,_
semua okay tak ada yang rosak,_
Konten yg ini keren banget,_
boleh la nak letak makup or macam cable ka bila balik kampung,_
"cantik, takda defect apa apa, boleh repeatt, service pun cepat",_
Thanks seller!fast delivery n servis terbaikkk!harap okey jelh ni,_
Naseb ngam2,_
siap bgi besi penambah lubang,_
"Good packing and good quality , delivery very fast , I will buy again with seller , thanks",_
"Very nice careful packing , great",_
"Tq seller,utk packaging yg sgt bagoss,siap dgn air bubble wrap",_
naise!,_
Lepas anak berak buang pampers dlm plastik baru buang tong sampah,_
thankyouuuuuu seller fast delivery & love it so muchhhhhhhhh,_
Texture:ok sangat bagus,_
i don't get jaehyun but thanks to seller i inform first that i hope to get jaehyun and they give me jaehyun merch not only 2 but 4 thank you seller,_
"The model had become one in which it was hard to achieve breakthrough innovations, the paper said",_
"antara banyak2 ramen aku rasa carbonara paling sedap , lepastu kat seller ni cepat gila sampai",_
tq penghantaran pantas,_
gooodddddddd job,_
we both pulled yuta pc!,_
Baju lawo² x leh posa🤣🤣Harga mmg berpatutan bnding dgn seller lain ada lebih mahal weii,_
Skin feels tingly after using,_
Beli utk adik ipar dn anak2,_
Performance:fast and cheap,_
Material tiptop dan selesa,_
Terlalu besar,_
"seriously lawa,tapi syg",_
Alhamdulillah telekung cantik dah sampai,_
dan tiada info langsung,_
"Hingga kini pembinaan hospital itu sudah mencapai hampir 90 peratus, namun terdapat isu yang perlu diselesaikan",_
Taksenang kemek,_
fully received,_
"Baju cantik sangat,",_
The motor was broken and exchanged with a new one luckily it works,_
) dia mcm takde laa hilangkan semua but still ada improvement🥰,_
"the eyeliner is easy to use and quick drying , waterproof",_
Liked the amoled 120hz display and that charging Twitter- ItsRishiPrathap,_
Barang smpi dgn selamat dan pantas,_
baragan cantikkkkk xdan ambik gmbar laa pulak apa pon beg cantiiikkk puas hatiii pengataran cepat ii terbaikkkk laaa 🤗🤗🤗🤗🤗🤗,_
"Sorry takde gambar green tea , tapi dh sampai dkt rumah hehe",_
"item received safely, trusted !",_
"sorry gmbar xde kena mengena adik saya dh pakai dulu xsabar2 ,",_
Item received in order and my mum satisfied,_
okay to use for outdoor put in the bag,_
Over packed,_
Dapat sekali hand sanitizer,_
sblum ni elok ja guna Digi,_
$MENTION$ Okolo well assuming that it&$HASHTAG$,_
Sejadah sgt2 gedu,_
Maaf ganbar tiasa brkemaan,_
Hp nie ok tak tuk maen fb,_
Love it smell so nice Love it smell so nice Love it thank you for the freebies,_
thank dah siap pasang menjadi,_
tngu bsalin dlu,_
"Item receive in the good condition,This is my first time to orderBut the delively almost one month,Anyway thank you very much seller",_
Seronok masuk dapur tngok barang kemas,_
"Barang sudah sampai ke rumah, nanti akan guna laa iyaa",_
just that got some dented part,_
boleh la pakai harga,_
"MOSCOW (Reuters) - Allies of jailed Kremlin critic Alexei Navalny introduced on Thursday a new way to accept online donations from Russia, using U",_
video juga x berkaitan,_
ttttthhhhhheeeeeeeeeeeeeeee bbbbeeeeeeeeessssstttttttt,_
My height 152cm,_
Super duper good service,_
Beg dh smpai trma kasih,_
2022 thank you for for parcel,_
Lain kali akan repeat Oder lagi dari seller ni,_
Tak seperti yg diiklankan,_
Beg kemek sebelah :( kat dlm cuma ada seketul kertas je so maybe kena hempap time tgh delivery,_
nak pakai musim tengkujuh je,_
But it doesn't have iMessage,_
"lawa, berbaloi lah dngn harga thank you seller, heheheh okay",_
The bilateral discussions on the Johor Baru-RTS link project had been extended by three months to July 31 from the previous April 30 deadline,_
Maaf jika gambar tidak berkaitan produk,_
Semoga murah rezeki and recommended,_
They do profiteering to their employees,_
lots of nuts inside too,_
Should have purchase the normal at a slightly lower price,_
the clothes is kinda short for me bcz I like long,_
Barang Sampai dalam Keadaan baik,_
cma lmbat biasa la jauh kan,_
pnghntrn yg sngt cptbrng yg d trima sngt brpuas hti x dh sbrng kroskn pda brng,_
"But overall, the service is very fast and good",_
will repeat again soon hehe,_
Coffee not taste yet hopefully can get the sweet,_
"Seller hantaq barang lamabat, courier hantaq cepat ja, barang cun",_
(Reporting by Bhargav Acharya in Bengaluru,_
oklahhhhh,_
Senang anak2 guna,_
Kain pon lembut je kecuali Minnie mouse tu kain kasar cket,_
"11, item received on 16",_
20/2 trus barang sampai,_
Sesuai utk muslimah la gitu,_
Very recommended seller and trust seller and thank you seller,_
Pernah rasa style sambal macam ni dulu,_
anak happy saya pon happy laa,_
Parcel sudah terima tetapi terlalu lewat tarikh yg ditetapkan terima kpd buyer & malam tadi baru terima ke tangan disebabkan minta hantar ke lokasi lain disebabkan atas sebab2 tertentu,_
Servis dr seller terbaik,_
"thank you seller always layan my questions, my requests & all,",_
:42,_
Fast deliver and has a lot of options aside from ordering food you can also pay bills and order a cab,_
bubble wrap semua ade,_
"BURNOUT SYNDROME Last year, Father Giovanni Cucci wrote a landmark article about abuse in convents in the Jesuit journal Civilta Cattolica, whose texts are approved by the Vatican",_
ngam boss ku,_
Cantik sangat baju sampai sya oder size XL labuh dan baggy,_
Send Biggggg love to this seller,_
So pls improve the grab chat,_
The filters are not working right these days,_
Pghntrn sangt cpt,_
"One bottle even flattened when received,",_
Yet to review the products,_
"LOVE TERUKKK warna semua cantik cantik, tak tebal tak nipis, jahitan elok bulu skit boleh ptong sndri recommend lagi dpt voucher kdai jdik murah 3helai rm10",_
The sewing also very neat as well,_
Jnt services memang problem if di labuan,_
"second time purchase for pan mee, would like to try on dry chili and sambal",_
Horrible no saben ni hacer arroz Esos parece vómito de pero den le esos a los que saben A los dioses colombianos,_
YRY JOIN LH BARU KOMEN,_
Cannot share my internet anymore among family lines anymore,_
"Cheap and super fast delivery,",_
ll really deliver more than anyone could have expected,_
sorry didn't have any pictures or video,_
Heheheheheheheheh love it heheheheheheheheheh,_
Tq seller barang daa smpai dalam keadaan baikk tqq heheehhe bungkusan cantik dan kemas,_
terus dia pakai,_
The condition is god damn good 10/10,_
Item well received today,_
da byk klinrepeat beli kt sni,_
"Kalau dah pernah pasang kat mana-mana phone, memang konfirm senang",_
Hehehehehehehehehehehe tq seller,_
"The simpel bag is quite small but it fits for the wallet, cellphone, and power bank",_
height - 158cm,_
"walaupun ada kemek pada bekas, barangkali merdeka,banyak yang beli",_
OVERALL GEMPAK WILL REPEAT LATER,_
puas hati sgt2 kain best,_
i really loves it,_
Jana pendapatan kecil kecilan,_
Kali ni dapat extra sticks dgn masks,_
Still ada ilmu2 dalam dalam telegram tu,_
"Terbaik barang sampai sama seperti yang diiklankan, service laju",_
Quality:cheap quality,_
