Sentence,Tagged_Sentence
apepon brg yg dihantar dlm keadaan baik,_
Haven't test yet,_
"First, delivery superb",_
yg lain rase ok la kot,_
Aroma:yummyyy,_
Kurier jnt,_
Thnak u seller,_
Love you BTS And how cute was that part Tae slapped his hand,_
Material ok soft,_
cantik jee sampai,_
very good dupe of apple pencil!,_
masih boleh guna juga,_
fast shipping and fast delivery by the courier services,_
Very good produk,_
Material selesa,_
"Rodzi berkata, berikutan itu, pihaknya membuka siasatan mengikut Seksyen 336 Kanun Keseksaan (Akta 574) iaitu perbuatan yang membahayakan nyawa atau keselamatan orang lain",_
Ni pn repeat lg ni,_
Grabe ka unfair my hard earned 800 points used to redeem upto 280 discount but only got 80 ?,_
Cuma yg ni berlengan,_
Taste:yummylicious very chocolatey & not too sweet,_
Colour/Pigmentation:ok,_
blm sempat bw burung pegi berenang lagi,_
SANGAT MEMBANTU UNTUK MENINGKATKAN METABOLISM,_
Barang dah sampai semua dalam keadaan baik pembungkusan pon bagus tetapi penghantaran agak lambat sampai tak pasti sebab apa,_
Bildiğin çılbır bu sadece daha şekilli,_
"jam terbaik, cume nk adjust time tu x reti",_
"Delivery laju , barang pun okay",_
If not in hurry to consume then it's worth the price,_
"SERVICE LAJU,",_
Money & good product,_
Comelll tha ks selller,_
feels smaller and slimmer,_
Cukup barang semua!,_
thank you and will definitely buy again,_
Catatan awal Barat mengenai negara ini bermula sejak orang-orang Yunani seperti Cladius Ptolemy menamakan semenanjung yang terdapat di negara ini sebagai Semenanjung Emas (kini digelar Semenanjung Malaysia) atau Golden Khorsenese di dalam buku Geographia yang ditulisnya pada sekitar 150 M,_
Kain Cotton yg tak tebal tp tak jarang,_
It's sooooo cuteeeee,_
Barang smp dlm keadaan baik berbaloi,_
-got nose wire,_
Haaa padan,_
"5 meter, sebelum dihanyutkan oleh arus deras",_
"The shoes are good quality, fits snugly & is comfortable",_
"ni dak bisa di pake lagi,memang saya jarang pake karena corona,ini mau di pake dak biso2",_
Fast delivery excellent service by seller & friendly seller,_
"CAPE TOWN (Reuters) -Irish rugby team Munster and Welsh side Cardiff were unable to leave South Africa as planned on Sunday after both returned positive COVID-19 cases, the clubs confirmed on Sunday",_
Cepat pon cepat walaupon hantar ke sabah,_
bungkusan baik dan sampai cepat pada masanya harga pon menarik harap original produk la nak tukar kejap lagi,_
"Barang sampai cukup 100 pcs,cuma ada 3 pcs yang pecah,but it's okay,bukan salah seller",_
"masa order tu, tk ada pon utk click utk add on free gift",_
Harga sangat murah compare dengan seller lain,_
Sesuai untuk kek tinggi,_
Convenient to bring around this soft pack,_
Beli masa 10/10 terima 13/10,_
"saved money,save time",_
SINGAPORE (The Straits Times/ANN): The Health Sciences Authority (HSA) has approved 11 applications for private hospitals and clinics to import China's Sinopharm vaccine under the special access route (SAR),_
Barang dah selamat sampai ke destinasi dengan jaya,_
Senang nak pantau diorg bila keluar rumah,_
27 confirmed dead,_
Love the sponge,_
Siapa yang nak gantirugi?,_
"!sungguh mengecewakan,",_
will definitely purchase again from this seller,_
Sorry no pictures or videos,_
Oooooooooooooooooooookkkkkkkkkkkkkkkkkkggggggggoooooooooooooddddddddddddddddddd,_
"Overall, we love it",_
"Ordered on 6/6, received on 9/6",_
dalam beg sangat besar,_
Hopefully sesuai dgn muka,_
Seluar pendek semua sudah sampai,_
semuanye cantik2 & cute suke sgt dpt beli blouse cantik & harge mampu milik,_
Memang tak rugi beli walaupun brand lama,_
"The best quality for casing iphone , i can repeat oder again fast delivery and good for safety",_
"Taste:pedasss tapiii sedappp, mantappp gengg",_
"Sebelum ni beli hitam,x smpat review",_
Trbaik2,_
nk ajak kawan2 beli sekali,_
even though beli dgn voucher and dapat rm 9 je,_
Berfungsi seperti sepatutnya seller pun bagus,_
saya x boleh pki,_
Functionality:bole la dari takde,_
Terima 4/12,_
Better ambik size M ke atas,_
Good Good good good good good good good good good good maaf gambar x de kaitan,_
Thanks so much seller nnti boleh repeat lgi,_
Buat it sokay,_
Harap selesa laa,_
"thankyou seller , parcel arrived safely 🤍",_
puas anak2 mkn,_
selamat di terima,_
Tq very much sgt cepat n kemas pembungkusan,_
Labuh okay dah untuk tinggi 162cm,_
cuma dia lapar tu je,_
"Beliau berkata, pada ME pertama 2022, hanya terdapat tiga kluster pendidikan direkodkan, namun kenaikan kluster",_
Texture:saya suka,_
"Ramakrishnan said Johor, along with other states, would benefit from such a special select committee",_
kain sedap pakai sesuai untuk tido,_
Mantap seller & abg posmen,_
"good value for money and excellent,",_
mudah serap peluh,_
"It was a marketing tool, and if certain investors were willing to go out of their way to buy a municipal bond labelled green, well, terrific!",_
Plastic quality looks good,_
"PETALING JAYA: Rio Olympics silver medallists Goh V Shem and Tan Wee Kiong will have no qualms about playing for Malaysia at the postponed Thomas Cup in Aarhus, Denmark, from Oct 9-17",_
Nampak mahal cuma berharap zip tahan lama,_
brbaloi la harga murah,_
Package rate 5/5 Great,_
"Said will get around 6 month expired date before i purchase , after i purchase received is around 3 months want expired !",_
Value for money buy on sale,_
overseas kan🤣,_
Sebab beli pon murah je so okay le,_
Cantik ngat ngat,_
tp laju mcm biasa shipping,_
Lepas tu chat tak reply,_
More then 2 hours in waiting for order and still no update from them,_
Kain elok berkualiti mcm kain getah ckit,_
Takda issue so far,_
Nak repeat pon boleh,_
sya akan repeat lagi,_
"Alhamdulillah,barangnya sudah selamat sampai",_
V very cute and RM,_
Ini hadiah buat peminat,_
xnipis sangat dan xtebal sangat,_
Terbaikk r,_
tp tak jadi,_
EhehehehehehehehehehehehehheheheehheehehehehehehEhehehehehehehehehehehehehheheheehheehehehehehehEhehehehehehehehehehehehehheheheehheehehehehehehEhehehehehehehehehehehehehheheheehheehehehehehehEhehehehehehehehehehehehehheheheehheehehehehehehEhehehehehehehehehehehehehheheheehheehehe,_
cuma tali jela tak tebal,_
cheaper &good quality,_
"For now, 15",_
Aaa srs cantikk,_
"and also very secured thankyou,",_
Bungkusan xtebal,_
Protection lasts up to 18 hours,_
terimaa kasihhhh,_
"Best value, best quality, best app",_
"Belikan untuk suami , diaa sukaaa",_
tapii boleh lahhhhhhhhhhhh,_
Jangan risau lah,_
Sngt cantik saya suka nanti bleh oder lagi video tidak berkaitan,_
Our personnel will monitor the routes frequently and ensure they are safe for passage,_
this is my second time buying from here!,_
Beli utk ayah di kmpg,_
writing by Gabriela Baczynska and Philippa Fletcher,_
anak berat35 camtu ambik m,_
"Better buy at shopee hehe,",_
Hopefully received in good condition,_
Received received tq seller,_
jpa utk cxf roj fyu qmw etr pbl hw qds,_
"Sampai in good condition, and seller balut dengan tebal and put the fragile sticker",_
barang smua cun macam screw baru cantik laaa seller memng terbaik la,_
Texture:super,_
"KUALA LUMPUR: Nilai ringgit meningkat sedikit berbanding dolar Amerika Syarikat (AS) ketika dibuka untuk urus niaga pagi ini, dengan dolar AS menyusut ekoran kebimbangan kemunculan varian baharu coronavirus selain kemungkinan kawalan pergerakan dilaksanakan di beberapa negara",_
Murah dari kedai time sale harga rm9,_
Dr segi waranty kata 5 tahun xp dalam kotak xada pun kad waranty,_
Product received in good condition but bubble wapper was too thin,_
sampaibdgn selamat,_
Service: good n fast,_
They don't respond to complaints,_
"KOTA KINABALU: Rural small and medium enterprise (SME) entrepreneurs did not receive Covid-19 aid as they are not registered, says Sabah Industrial Development Assistant Minister Mohd Tamin Zainal",_
Love from far far away $MENTION$,_
dh mintk refund bru dia terhegeh2 bwk kluar dri centre,_
"Fast delivery, will comment more after receive phone set",_
Llllllllllliiiiiiiiiikkkkkkkkkeeeeeee iiiiiiiitttttttttt,_
🥰Hopefully i can be a loyal customer,_
tq tq tq tq courier,_
Poor service found several times but no place to complain,_
"Saiz L panjang& labuh semua okay, lengan labuh sikit but i like that, cuma seluar agak ketat and ada koyak sikit kt lengan but issokay boleh jahit balik sendiri",_
Tried and it works perfectly,_
Seller inform when ready to ship out,_
"Saiz aku 38 tapi aku order 40 sebab tengok review ada yang suggest dan yang sampai kat aku saiz 39 kasut cantik, jahitan kemas, berbaloi la beli dengan harga murah jugak wehh!",_
🥰🥰🥰🥰🥰🥰🥰🥰🥰🥰 tudung x payah iron,_
klu nk beli ok sngt tp ambil yang besar,_
"Penghantaran laju, harga berbaloi dengan kualiti pakaian",_
Benang dia tk brp cun la,_
Takpe dah puas hati,_
"Tripod easy to use, able to hold the phone firmly",_
Utk jdkn cenderahati utk murid kelas,_
Yang penting cepat sampai,_
"p/s: no need to take 1 bigger size guys, maybe you can consider to take 1 smaller size",_
"Barang sudah diterima dan sudah sampai ke tangan yang membeli, saya tolong oder kan sahaja, anyway semua dalam keadaan ok",_
saiz bag ni sesuai untuk pergi sekolah,_
mantap dowh dahlah battery dapat sek,_
n kain pun cantik2,_
"Ikan bilis kurang, saya kurang minat sebab kepala ikan bilik berlambak dalam sambal tu",_
Insyaa Allah akn repeat lg jika ada prubhan yg +ve,_
"Taste:taste really good, suit for irish cream coffee",_
"Kita juga menemukan tali dan percaya sebelum itu mangsa diikat berdasarkan kesan ikatan pada kaki dan lengannya, katanya di sini, hari ini",_
You should make rider id like grab so u can trace which rider took my food,_
Very cute shoes for kids,_
Good protection bubble wrap,_
Good product with fast delivery and excellent response by the seller,_
Cleanliness:thing recieve in gd condition and wrap well,_
Cde qeb gkt egg dudk htfc,_
The items well packed and received with accurate amount and correct colour,_
please buy me that album i really want it but i don&$HASHTAG$,_
ok sy kasi 5 ha,_
bila try ngam,_
Takda pecah semua dalam keadaan cun,_
Kain nya mcm tak berapa selesa sgt,_
Good service Good service Good service Good service Good service Good service Good service Good service Good service Good service Good service Good service Good service Good service Good service,_
"Low acidity, hint of chocolate aftertaste",_
Alhamdulilah pengendara nya baik dan ramah,_
I recommended for you guys to buy it from this seller because its so good,_
"Sedap rasa dia macam bihun, tpi kenyal2",_
"Best white coffee, my favourite",_
Maaf menggangu,_
"Well pack, use",_
"Very good, convenient and functional",_
"got baby fish, fat fish",_
nasib muat2 je pakaiii,_
Seller juga sangat responsive,_
order 16/9 received 22/9 fast delivery,_
Ada gift comel pulak tu,_
Item received in very excellent superb condition,_
And it hv very high sensitive sensor touch,_
Thank u seller :),_
"On the re-development of Kinta Riverwalk, Nolee Ashilin said it was a continuation of the Ipoh Heritage Trail previously developed to attract more tourists to the Ipoh City Tourism Triangle",_
beyblade tu mmg dpt single je dh smp tapi x tboleh main selalu kalau beli mmg dpt set,_
Memng boleh order,_
Kain ringan sesuai untuk travel,_
the federal excise on gasoline is 18,_
Insya-Allah nak order lagi di hari yg mendatang,_
Rekemennn sangat beli kt sini,_
MANTAPPPPPPPPPPP LA ABUUUUUUUUUUUUUUUUUUU MANTAP MANTAP,_
Gòooooooooood packing,_
kain pun ok cuma kecik sikit,_
bila lock bertambah lah koleksi kaftan yg cantik² n menarik,_
MON I spend 600$ and I fly to China to buy this thing and I have only 5W adapter,_
salah sent video & gambar,_
"Ternyata semua album nyanyian yg ada di kedai ini,adalah best2 belaka",_
I was so excited I accidentally slashed the label into half while I was slashing open the bubble wrap,_
sampai cukuo dia pon suka thank you ibeli,_
Musim sekarang kena makan vit,_
Tak perlu beli from china dah,_
"Fast delivery,baru order berapa hari sudah sampai,lagi dapat satu pilot free gift",_
so sorry tak amik gambar the quality but still dont worry LUSTER type anti fingerprint glossy punya taktau lah hihi,_
Dpt jgak akhirnya,_
Standard time delivery,_
"tp giant da tutup, ada pn grocery yg jual x halal",_
There are also night walks to see fireflies and the occasional nocturnal animal,_
fit to my head,_
Sangat murah berbanding seller lain,_
Tdung agak nipis tapi tak jarang,_
fast delivery and good quality packaging,_
Nice shoes i loved it so much,_
Doesn't work with Huawei phones,_
But the clothes arrived the next day,_
Sejak itu ia memberi kesan bencana terhadap pembangunan negara,_
Cuma tak sesuai utk anak saya yg umur 7tahun,_
Thank you seller kalau kne tekak,_
Mghantaran laju gile,_
okay la sbb brand pinkflash ni sesuai untuk org yang makeup natural2 look shj,_
45pm sampai perak mantulllll 10,_
TYSMMM FOR GOOD SERVICE,_
Sajadah nya ringan bgt,_
Hoping for seller to replace the new one but too late since I already clicked already received,_
"Repeatedly, we have made clear to the Administration that we are willing to come down $1 trillion if they will come up $1 trillion, House Speaker Nancy Pelosi and Senate Minority Leader Chuck Schumer said in a joint statement",_
"Fast shipping, very beautiful bag and good quality too i like it so muchh thanksss",_
Trimakasi barang sda sampai dngan baik tqtqtqtqtqqtqtq,_
Tapi boleh la kalau untuk nak guna dalam kereta,_
Rindu nak pergi cameronnnnnn,_
kain elok cantik tak nipis,_
Alhamdulillah barang sehari je dah sampai ke batu pahat,_
Quality/Material:terbaik,_
Mask sudah sampai pengantar cepat dan pantas terima kasih kepada seller,_
The product is original and received in good conditions,_
"Product quality ok & comfort, recommended",_
Nnt i recommend,_
Jahitan dlm ada rosak,_
Satu-satunya kedai yang bagi FREEGIFT mahal,_
"beg ok, wlpn belum guna lg",_
Paid for only 17 cents for this sunglasses,_
puashati terima kasihh,_
seller response pun sangat pantas,_
Hritu dapat belii 2 jer lagi 2 tuu sold out,_
Hati ni mudah betul rapuh bila Tengok Promo Hazel T-shirtDakwah ni,_
Safety:kurang sikit,_
Barang selamat dah smpi,_
kasutt dahh smpaiiiii,_
Delivery is abit late believe is because of the high demand,_
Very soft fabric material,_
"Material:thick , not see through",_
Wanted to see how AI makes life easy (how this chip will help in regular day life),_
The stomach part fit me well,_
Each mask dalam satu pek,_
A big thank you,_
dah selamat mendarat 🤩🥰,_
Baju pon cantik sgt2,_
"I was into you, but I'm over it now",_
Every things in perfect conditions,_
Stokin tak la tebal sgt,_
barang2 ddah sampai,_
Quality:Best seller use bubble wrap wrapped the product,_
"Seller is very good, after arrange delivery they will inform you right away",_
Courier mantap x humban2 brg cuma lambat sikit,_
"Baby selesa pakai tp mcm senang berbulu,color cream tu ada warna lain melekat xboleh hilang walau dah try basuh nie pendapat saya untuk color putih n cream tu seller boleh pack asingkan plastik untuk elakkan mcm gambar",_
Sebab tak guna beteri,_
castemer pn suka rasa perisa ice bland nie,_
Terima kasih seller ship pnts,_
tapi bila pakai mcm saiz L,_
material sedap pakai berbaloi sgt dengan harga,_
Sesuai untk anak bwak pg taska,_
barangan Smpai dirumah dengan selamat,_
Good quality and worth for price,_
gmba xde kene mgene,_
beli aritu twakal la must ker tak sbb tgok ade feedback budak umur 4 tahun pkai ok,_
SUMPAH SELESA GILA,_
Baju pun cantik kain yang selesa dan sedap dipakai,_
"Selain itu, struktur duti import semasa menguntungkan minyak kacang soya (SBO) mentah kerana duti yang dikenakan ke atas SBO ialah 5",_
so mga bata po pla mag adjust s chicken,_
Aku bayar ye law pun tudung ni murah,_
Terbaik seller ni recoment kawan kawan 3 hari sampai,_
🤩🤩🤩🤩🤩🤩🤩🤩🤩🤩🤩🤩🤩🤩🤩🤩🤩🤩🤩🤩🤨🤨🤩🤩🤨🤩🤩🤨🤨🤨,_
I also love it,_
cheap and convenient,_
"lawaaaaa, worth the money kualiti nice delivery pun laju gila",_
boleh masuk lipas taw,_
spoil sikit sbb kotak dah bergaris garis maybe terlipat masa kat kurier,_
sorry for not related but parcel safely arrived in good condition,_
This is like,_
MOHON RETURN BALIK BAYARAN SAYA,_
"Still berbaloi, alter2 sikit nanti cantik la",_
First time bought this almond,_
Im happy to use the product up sweet and I love it 🥰🥰🥰,_
Btw bag memg cantik giler,_
Hmm tak selesa sebab kecik untuk phone boleh lah,_
Sangat cantik dan berpatutan!,_
"1 per cent, similar to influenza",_
Item delivered in 1 weeks which is okay bcs from china,_
50* *11,_
"Texture : xbest,pekat and susah nak apply",_
semua elok brang,_
why is it getting more and more expensive and in less than a minute the price has gone up please dont be like that,_
shopee shopee shopeeshopee shopee shopee shopee shopeeshopee shopee shopeeshopee shopee shopeeshopee shopee shopee shopee shopeeshopee shopee shopeeshopee shopee shopeeshopee shopee shopee shopee shopeeshopee shopee shopeeshopee shopee shopeeshopee shopee shopee shopee shopeeshopee shopee shopeeshop,_
Cantikk sngtt benang kat zip tu tak kemas sngt tpi tkpenlaa,_
Mmg berbaloi la 1,_
Nasib baik kualiti baju ok Takpelah nanti repeat lagi,_
bila bau dekat2 smpai sakit dada sbb wangi sgt,_
Order 10 dulu,_
Bro buat macam mana ya?,_
"produk original,puas hati,saiz Ngan,cepat sampai",_
Kain jenis seakan akan jersey,_
"Nice shoes, penghantaran cepat and barang Sama macam dalam gambar",_
"Alhamdulillah, good job seller & delivery",_
"Received everything in good condition, correct design and amount",_
thanks nanti repeat beli dkt sini,_
Order kelmarin and semalam dh sampai,_
"Still have an Redmi Note 7, this phone seems to be much better than this one",_
n air kurang,_
"Taubira, 69, who was justice minister under former Socialist President Francois Hollande, only threw her hat into the ring earlier this month and had said she would withdraw her candidacy if she did not win the primary",_
With Box,_
pantas oenghantaran,_
Sebab kalau saya pakai magnet senang tercabut,_
vlog,_
hehehehe sorry lambat respond,_
"Excellent speed, excellent service, great original product",_
Goodluckkkkk,_
All products working as states,_
"Begitu juga ketika skuad Harimau Malaya muncul naib juara Piala Suzuki AFF 2018 dan pada prestasi terbaik meraih kemenangan ke atas Thailand dan Indonesia pada November 2019 dalam kempen Kelayakan Piala Dunia 2022/Piala Asia 2023, siapa Presiden FAM ketika itu?",_
Dah try pasang kat peti ais,_
Rugi tak jumpa awal awal will repeat it again,_
I will purchase it again tq so much seller pun mantapp balas chat sy,_
nti leh repet lder lg,_
Absorption:9/10 cus gotta wait a few sec before continue with other sc routines,_
satisfied with their products and services,_
And for this security check i only give 1 star because the app is not working,_
Still rocking with OnePlus 3 :D twitter: $MENTION$,_
But i received 1 extra wood painting maybe seller know that they sending the reject items,_
bantal tebal lembut,_
Worth to buy when got promotion,_
kotak diterima dengan baik,_
barang memang mantap pak abu,_
"Instead of sitting across the table from each other, sit side-by-side and figure out a way to make it work",_
Dah 2 kali beli selipar kedai ni nak cakap lembut maca,_
Ok kain pasang sudah sampai,_
Cleaning Effect:Baru nak try,_
Quality:very bad packaging and products,_
rly effective,_
korang klau rsa diri to tnggi ambk laa yg 38/39 yee,_
0 billion Islamic facility granted to Malayan Cement Bhd (MCB),_
Terbaik bossku brg mnjadi alhamdulillah nmpk mcm baru jugak la dlm gmbr tu belum kasi rata lg bru test je tu,_
Okay i miscalculated the size and they came smaller than expected But it's fine i'll just order the right size next timeThe box itself is durable for a cardboard box,_
"THANKYOU seller, baru beli semlm, harini dah sampai",_
terima kasih kepada pihak penjual dan juga shoppee,_
The awards come with the title Datuk,_
apk ini sangat bagus,_
tq seller & deliver,_
fast transaction & trusted,_
Dos pe,_
Size/Perfect Fit:sesuai ntk ank umur 4,_
Tqu soo much dear seller,_
Mcm bertompok2 warna putih,_
Tak tugi beli banyak,_
"[J&T Selangor] Ordered & shipped by 27/8, delivered by 30/8",_
jenis kain licin tapi takde la berkilat sgt,_
Nak tampal kat kereta dia,_
"Item delivered fast,",_
!ttkgim9go £v j v !,_
Some have had fist fights over the pumps while others hoarded fuel in old water bottles,_
Kain lembut selesa meregang,_
"*DEAR CUSTOMER*,",_
nice nice nice nice nice nice 18 sen on 18,_
sauce taste is yummy,_
"There are limits to the changes that Apple is making but it's still a big milestone, said Nathan Proctor, senior director for the Right to Repair campaign at US PIRG, a consumer advocacy group",_
"Bajunya cantik dan menarikwalaupun jenis kain agak nipis,namun selesa dipakai",_
terima 2/9 j&t,_
Chin Wan Sin,_
beg dh slmt smpai kpd mak,_
"for someone berhijab dan bersanggul like me, this is worth every penny",_
Good job and thanks,_
Recommended Seller!,_
"Ya allah love gilerrr baju nie, nk repeat order lgy, penghantaran cepat, kualiti baik sama dengan harga",_
"Tp sbb stok hbis,seller wssp suruh pilih design lain",_
In and out pockets,_
before this pakai brand aljoofre & both superb quality,_
Laju betul seller pos barang,_
Maaf gambar Tidak berkenaan sebab x sempat nak ambil gmbrnya,_
"Fast delivery and good packaging,i will by again next time",_
Oklah belom try lagi,_
quality non bad but its smaller than expected,_
Bungkusan dibungkus dgn sangat baik dan cermat,_
So fast delivery purchase so many times already worth for the price,_
takyah pakai extender dah,_
Baju ni memang terbaik kain dia,_
Fast delivery and quality sgt bagus,_
"brg lom tgok lg,papun tq seller pghntaran laju",_
"94) in China, but companies have been exploring the use of drones or box-like robots on wheels from as early as 2013 amid a labour crunch that has worsened due to the pandemic",_
Items packed nicely and super fast delivery,_
Barang blom test lagi,_
"nak kaler biru,dia bagi hitam pulak",_
1 day delivery hyper fast,_
One of the bag has some scratches/dented (2nd pic),_
aku sih yes,_
"Ну, вот так, мы китайцы, готовим, не нравится- не готовь!",_
yang penting wangi,_
Atas dia around 6cm cover dr ankle,_
Two are super akka,_
Tali sedap dipakai,_
Ok jg cuma nipis n saiz yg diberitahu tdk jls,_
"And, 1 lagi",_
"Semua selamat sampai, item dalam keadaan baik",_
xboleh nak komen sebab belum cuba,_
x rugi beli ni,_
love ittand the seller spotrimm🥰,_
I like this mineral water,_
nk nk repeat kaler lain lg la,_
Dh try kat kaki,_
"Modem setakat ni bfungsi, td try letak sim tuntok, ok la, boleh tgk youtube hd",_
Thank you baby men,_
Item received same as advertised,_
Berpolitik itu boleh tetapi gunakanlah untuk memperbaiki keadaan,_
Not sure Wats wrong with it,_
(Waiting new car coming),_
Veronica FayeVictoria Teo,_
Tttttttttttttttttttttthhhhhhhhhhhheeeeeeee bbbbbbbeeeeeesssßssssttttttttt eeeeeeeevvvvvvvvvveerrrrrrrrrr product,_
Courier really have a bad service at Merlimau,_
Barang sudah selamat sampai terima kasih seller penghantaran cepat dan pantas sangat sangat berpuas hati,_
The noodle was carefully packed in box,_
Aroma:thick,_
sometimes even normal day fares can be expensive,_
Terima kasih free satu pasang baju sama saiz,_
Price: value for money,_
Seller pun kasi respon,_
roda senyap,_
Performance:terbaik!,_
yeszaa cantik macm originalWalaupon cop,_
So far ok semuaaa cantik dan paling penting murah tengss seller,_
"Alhamdulilah tdung ank dh sampai, Penghantaran cpt,di terima dgn baik, thanks seller",_
ppaoqishalalmxbxbxnzmzlzkzjshdjdjdjwpqojsshsjsjsjsjsndndbdbdjdjaoaowuejdjdjdjdiepqowjsjdndndksodkdndndjfjfjfjfofpdlsbsnxbxmdjfnf,_
order and received within 1 week,_
"But sincerely, the material of the curtain is the thinnest among all other curtains I've bought lately, while the price is the highest",_
baca detail betul2,_
"Barang yang saya order sudah sampai, terima kasih, shopee,",_
Bgmi gameplay video uploaded,_
twitter: nandakishore_99,_
"Tq seller, brng slmt dan laju smpai, 3 hri ke sabah, trbaik pos laju",_
Seller response and ship out the order very fast,_
Sya byr utk dpt produk tu dlm keadaan baik,_
Order colour lain sampai lain,_
Alhamdulillah parcel arrived safely!,_
Pembungkusan kotak sahaja,_
Quality:bungkusan masih rapi,_
"Dah sampai dah rak ni, boleh bubuh perkakas elektrik semua atas ni, besi nya pun berat, senang pasang, tq seller,",_
kaki meja saja ada kemik sikit,_
12 ok la xlama tunggu,_
Only 3 days needed,_
cepat je dh rasa effect dia,_
Use future time not available,_
All the way from Sibu,_
2nd purchase from shop,_
Tapi mask terlalu NIPIS dekat plastik tulis 4 lapis tapi bila bukak nipis,_
Cuma rasa masam tu terasa sangat,_
"Sejak2 c19, jadi habit plk skrol shopee nak survey mask",_
sedang elok nk bawa g transit anak dr baby ke 7thn,_
Terrbaik laa,_
Bagus seller ni pos dlm kotak,_
"I've never been this lucky with jimin, i guess my summoning worked",_
baju nie,_
Good expiry time,_
Camno nak buat,_
expiry date on 2/10/2021,_
But the other 2 are fine,_
terima kasih seller bagi gift,_
Quality:packaging okay,_
tpi seller mcm hare geram aku HAHAHAHA,_
Pahit2 manis,_
Nes pun murah dari tempat lain,_
"They were known for their social status and wealth attributed to spice, fruits, textile, charcoal, rice, onions and gold trades",_
"Buntu apatah lagi telefon pintar kehabisan bateri, saya sempat membuat rakaman video memaklumkan ada orang terperangkap untuk dihantar kepada kumpulan WhatsApp keluarga Rafar",_
It is the tight type,_
$MENTION$ wants to win a nord 2,_
Effectiveness:RM0 Bajet 2022: Tebus baucar baharu RM75 Perlindungan Tenang untuk insurans/takaful,_
maaf gambar n video tak membantu tapi kain tak nipis elok and quality agak kualiti,_
Definitely gonna order it again!,_
Absorption:halus dan cepat serap,_
This is included warranty will registred by seller,_
Taste:A++,_
Which language this,_
The album arrived safely and everything is sealed without any damage!,_
Arrival: 18/12,_
