Sentence,Tagged_Sentence
Received products in good condition Thank you seller,_
"Penghantaran pun laju, harga pun murah bagi kualiti yg mcm ni",_
Very upset kerana tapak tidak terlekat,_
Pas hujan gak ada driver yang mau ambil padahal jarak dekat dan saya bersedia bayar tarif tambahannya,_
"sorry muka tak mandi, btw cantikkkk nasib baik beli dua colour terus i loike <333",_
Daging Salai padu tapi isi dia mcm carik2 hancur gitu,_
beg ringan dan berbaloi dgn harga,_
Boleh order lagi dekat kedai ni sbb murah,_
"Only the wording too small, mybe next order can request them extra font size",_
very good purchased,_
Really got fast charging function,_
Selesa la pkai harian,_
Parcel selamat di terima dalam keadaan baik,_
Received exactly 5days,_
Five witnesses were called to the stand throughout the trial,_
Pape pun cantekkkk,_
"Kenapa baru jumpa seller ni eh,",_
Terbaik boss kuu,_
"Products are okay, order 2 pasang tapi satu tu benang dia agak teruk terkeluar",_
"( Full Name , Email ,",_
Sumpah fall in love gile dgn sluar dia,_
How can I buy from UAE?,_
Apa pun ok jer la,_
Baru terima semua ok ja nasib sempat dpt tq no damage well pack,_
Sbb fit kaki terus seluarnya,_
all 7 item received with good cindition but 150ml clear got different size,_
Taw laa brg xmahal tp kte byr kan,_
ada 10 bungkus dlm ni,_
"Buy one size bigger okay, will b tight if buy exact size",_
penghantarannya pantasssss,_
Logout terus,_
Saiz beg 46 X 20 X 36,_
"22 oleh ShopeeXpress,",_
overall pasal seller 5 star sy bg,_
"Sebenarnya pada awalnya, perancangan adalah mengadakan perlawanan persahabatan dengan Korea, namun mereka mempunyai perancangan lain",_
Will order again when l finish,_
Handsock ni best,_
Taste:the tea is good,_
Berpatutan dengan harga dia jual,_
Boleh beli 1 kotak terus jimat sebulan utk rakyat marhean mcm kami ni,_
Spring lembut je,_
Kualiti gambar okey dgn harga,_
"tgk owner review mcm besar, rupanya dagung kecik kecik je",_
Game can't play,_
"Penghantaran cepat, dah beberapa kali beli harga pun berbaloi",_
Seluar cantik ok sgt,_
SORRY VIDEO TAKDE KENA MENGENA TAPI LAJU AH DELIVERY MEMANG NGAMSOI SEDAP PULAKTU I MINUM HARI HARI KAT KOLEJ 🤩🤩🤩,_
Pregnant 5 month bhgian perut ada byk lg ruang blh adjust,_
blum mkn lg hrp bole la kurus apa pun tq seller,_
Item well function and fast delivery,_
Tidak bisa kebuka aplikasinya,_
"The order is according to the fast shipment, very recommended",_
L fit well dgn badan,_
Why August don't have,_
Mintak maaf gambar takda kaitan dgn produk sooooo comfort berat 70 kg tinggi 171 cm,_
"Ordered on 11/1/2022, received on 12/1/2022 via J&T, fast shipping and delivery",_
"Satu kajian dijalankan Institut Alergi dan Penyakit Berjangkit Kebangsaan di Amerika Syarikat (AS) yang mengkaji campuran vaksin COVID-19 terhadap beratus pesakit mendapati semua dos penggalak meningkatkan titer antibodi peneutral terhadap varian Delta, tidak kira apa jenis penggalak atau vaksin utama digunakan dan setakat ini, belum ada kebimbangan terhadap keselamatan dibangkitkan, katanya",_
Material casing sangat kuat dan tidak nipis,_
You have to figure it out on your own,_
TQ courier sbb jga brg sy dgn elokk,_
"Safely arrived, bought because it is much cheaper than in store price",_
"Easy to bring,",_
"Elok sangat,",_
semua sepi yang dioder,_
"HAN PON HENSEM THANK YOUUU,",_
Kurier ja lambat sikit,_
thanks boskuu,_
Nnti saya boleh oter sndiri,_
But favorites are green teas i like green tea's smell so bad 🤩🤩🤩 will repeat in the future and thankyou for the fast delivery and fast shipping in love 🫶🫶🫶🫶🫶🫶,_
tp nenek suke sgt,_
Baby dah 6 bulan,_
my little sister loves it,_
"Cuma kain nipis sikit, sesuai dengan harga",_
Saya sangat sukaaa🥰,_
Tq seller bg free gift yasin,_
2nd time buying sleeve and i love it!,_
2tb rm22 je,_
Memang cepat seller&jnt buat kerja,_
Unfortunately I open the parcel after order auto completed and seller will not acknowledge any refund,_
"Item received, same as advertised",_
Perkhidmatan penghantaran POS LAJU memang terbaik,_
I like that White Switch,_
61mil) in total in the top 10 scam categories,_
"barang dah sampai, tak try lagi tapi order sekejap je sampai kat rumah",_
SANGAT BAGUSS,_
"letak dalam air humidifier, lepastu sedut",_
cuma nak ikat tu macam susah pulak nak bagi dia nampak kemas,_
Memang repeat sini ja bila habis 🫶,_
Cushion lembut,_
"tiap² bulan bli cni, next time bg la free give",_
"Thank you, have a nice day",_
Tq couirer,_
Tapi setakar ni,_
And need say a lot thank to J&T,_
I had to buy more,_
siap free gift filter,_
Looks nice with the pants,_
ingat pesan saya,_
"bass pun okay,",_
Sir ye laptop buy karlu,_
bile Lupe nak cabut ape yg patut,_
got it cheaper because using my coins,_
The seller is very helpful on providing the instructions,_
Boleh repeat lock lgi,_
I said whoever throw that paper your mom a hoe‍ 🥵🥵🥵🥵🥵🥵🥵🥵,_
Thankyouu seller 🥰 dapat brand h&m nice teruk 🥺🥺 seluar nice material okay cuma besar sikit je kena alter but nvm i like it good quality n fast delivery too hehe will repeat soon 🥰w:55 H:157,_
semua berfungsi dengan sempurna,_
Jam beli utk anak lelaki 6 tahun,_
kasut just nice and this time alhamdulillah dapat kotak tak hancur hahahaha,_
"Nice customer service, sry for not related video",_
Thank u seller n delivery man,_
ty is handsome for whatthes my biassss ofc wanted to buy winwin after,_
Bole beli dengan kedai sgt recommended,_
"Aaa dh dapattt,",_
Blazer nice saya amik saiz L igtkan labuh jadi bawah punggung rupanya saiz apa pun labuh sama je,_
tapi rasa die memang terbaikkkk,_
"May 12, only I received",_
Kualiti kain bagus nmpak mcm cotton lembut,_
Received with good condition and packing Well,_
BELI BARANG AMBIK VIDEO MSE BUKAK,_
Padan dgn saiz badan saya,_
11 for 0,_
So Bed,_
Functionality:okies,_
keadaan coklat tiada yang patah,_
Terima barang dalam keadaan teramat baik,_
nmpk cerah sangat berpuas ati 🥰🥰,_
Terima Kasih seller sbb barang dah sampai,_
Agak besar dri saiz kaki saya,_
first time beli di zanzea,_
Jajaja amo ver a esos tres juntos,_
Fren: Why you so indecisive one?,_
Lawa sgt! will repeat soon!,_
I got the parcel in good condition and I will recommend this product to my friends,_
"MHC said based on the Standard Operating Procedure (SOP) issued by the Health Ministry, the team will have to undergo quarantine from Dec 8-14 if they want to leave for the Dhaka tournament scheduled for Dec 14 to 22",_
Sory video gambor dok kaitan,_
Repeat order wey,_
"Fast delivery, packaging very good, item arrived safely",_
freah milk plk habeh,_
AND KALAU TAKTAHU SIZE PM JER SELLER NANTI DIA AKAN BAGI SIZE KAT KORANG,_
Less work to reapply sunscreen when it's scorching hot outside,_
"tgk komen rmai ckp blh ambik size slalu pakai,hmm better ambik 1 size lbh",_
But we facing issue on this phone where experienced the photos selected to open is not shown,_
Cabul,_
Lps ni confirm akn repeat lg,_
material okay utk harga yg mcm ni,_
Material:Thick and non slippy material,_
Agak kecewa tapi akhirnya air sampai dengan selamat,_
Looking forward for cameras 50mp and increased battery size Twitter: $MENTION$,_
Aaaaahh love the new packaging🥰,_
Always need to reset pwsd after not login around 2-3 months,_
embassy in Kyiv said on Twitter,_
untuk h -160 cm w - 39 kg better ambil 2XL untuk baggy,_
Baru perasan 1 tudung bukan segiempat dan bukan warna yg di order,_
Brg dh smpai tq tq tq tq tq sorry lmbt respon,_
Parcel Received in good condition totally worth it,_
Not frendly user,_
"Ученик,",_
$MENTION$ Hope this will be the one,_
Order untuk free gift untuk player,_
Recommended sgt2 uollss,_
"Beli sikit2 dlu sbb nak rasa 🤣 packaging okayyy, tea pun okayyy cuma maybe seller boleh tulis expired date lepas ni dkt sachet tea tu overall niceee kalau sbb boleh repeat dkt sini sbb antara yg termurah",_
The cooler came in perfect condition & as advertised,_
berat 40 saiz s,_
height : 166 cm,_
"Very fast delivery, order on Sunday nite dapat barang Tuesday morning",_
"In the past few days, I realised that my heart and my mind are contradicting my actions",_
Cepat hantarnya walaupun chinese new year,_
Ini dah 4 hari pemakaian,_
penghantaran bolehhh lahhh,_
mula2 tak tahan lerr,_
Verrrrrrryyyyyyyyyyyy delishhhhhhhhh nyummm nyummmmmmyyyyy sorry the vid is not related,_
The point is recommended,_
"Omg the quality is so good,",_
"Wrap nicely, but ade jgk 2 yg hancur tp yg 1 lg tu lagi hancur lebur seperti hati ni yg hancur btw, Thank u seller",_
2 hari je dah dapat barang,_
"Thank youu memng recommended,",_
Thanks seller I waiting for this so long and finally got to use it to put my pc,_
Ggggggggggggggggggooooooooooddddddddd,_
my mother 3xl pn boleh pkaai la weii,_
deets:,_
ni kali ke 5 beli dari seller ni,_
kecil je cuteeeeeeeee,_
green tea latte memang sedap,_
"Received 07/02/2022 (KK, Sabah)",_
walaupun lama juga dr cina kn,_
Nanti dah habis I repeat,_
"Item semua okay, cantik",_
"Barang sampai dengan baik, beg cantik",_
Yg ni sy syorkan beli size besar,_
sbb kain bagus,_
Selipar gedabak,_
Semua kaler dapat betul,_
আমার কাছে ভালো লাগে,_
"Berterabur milo dlm tu sbb bocor,then masuk angin dan keras separuh",_
Persediaan utk BOB (Bug Out Bag),_
Ni dah order baru,_
The sensors and algorithms will be adapted to detect lung diseases such as asthma at a young age by listening to and evaluating breathing patterns,_
muat dan selesa,_
Suke beli time flash sale ni sbb murah,_
"TOP,",_
Good to see oneplus embracing mediatek's dimensity chip $MENTION$,_
Semua jenis getah,_
kasut ni paling murah highcut setakat ni ‍,_
is that a joke or something?,_
"The cooperation contents match guidelines of the Vietnamese Government and meet domestic demand for vaccine access, he said",_
kasut dia best,_
Suzuki swift tak boleh guna yg ni,_
Dosa ngan org hati² bro,_
"Yo, look at the left tv closely, nice one bro :))",_
Keduanya ode size sama tapi bila ukur tak sama,_
pictures and here's with all attached photos n video,_
hrp rajin berus gigi selalu,_
Worth to buy products Strongly recommend to buy the fried fish cakes too,_
"penghantaran lajuuu 🤪 berbaloi la beli dgn harga ni hehe , papepun thnkyou yer seller ‍",_
"With a weakening demand outlook, expectations are growing that the Organization of the Petroleum Exporting countries, Russia and their allies, together called OPEC+, will put on hold plans to add 400,000 barrels per day (bpd) to supply in January",_
"Terima kasih seller jam berfungsi dengan baik,ada muzik&lampu design &warna kartun yang menarik,buat kanak-kanak tertarik",_
longgar and baggy that's why i luv it eheh,_
Beg cantik mcm dlm gambr,_
Quite good even though the price is cheap,_
"Boleh la buat vlog naik moto, rekod p mancing dan buat kerja2 di kebun",_
i love it guysss,_
"Sumpahhh lawa gilaaa,",_
My bf bought one,_
45 mlm order 11,_
"Penghantaran cepat, seller pun sng berurusan di chat, tq seller",_
buat kek Pisang tnpa tepung,_
klik rambut diterima dalam keadaan baik,_
bags are ok,_
"We can confirm that our UEFA Europa Conference League Group G home fixture against Stade Rennais will not take place tomorrow after a number of positive COVID-19 cases at the club, the statement read, Tottenham said",_
Kami ucapkan semoga terus berjaya bersama pasukan baharu,_
Untuk kerja-kerja pejabat,_
"Brg smpai cpt, hrga pun puas hati",_
tido lebih lena dan bangun segar jea,_
Hanya 4 barang je yg saya terima termasuk free gif,_
"Really packing properly,i like it",_
Brg complete and cantek,_
& dah rasa!,_
Semua hidup elok,_
Ggggggggggggggooooooooooodddddddddddd,_
Sorry gmbr xsama dgn product,_
dk cek apa2 lma2 brg org bodo btoi,_
Size xl memang ngam panjang pun okay,_
fit sikit plk mungkin kena tambah 1 saiz lagi,_
ringan tak ada la berat sgt,_
"barang sampai dengan cepat, cukup kuantiti seperti yang diorder, seller wrap barang denan bai,tiada masalah leaking dan sebagainya",_
"Tq seller, kasut overall ok",_
I am repeating order,_
She said they were also looking for Christmas gifts for their families and friends,_
sy bli brg🥰🥰🥰,_
Soft and cold materials,_
"The logistics is very fast, the quality is very good, I like it very much, thank you seller",_
thank you so much seller and delivery man,_
Quality:canvas type,_
penghantaran laju kemahennn 2 hari dh sampai tp tersilap order,_
"Good seller, price was cheap, will buy again",_
"toppoki ni sedap dr yg lain, kena dgn tekak",_
X sangka lawa macamni,_
Goods received in order and properly packed,_
puas hati berbaloi beli,_
"Bare A bare kepala kain, demo kenal bare, skoda skoda terpaling A, bare jadi boh keno anginn sek kito, comey blako, timo kaseh seller terpaling comey",_
"The exhibits at the museum also include a collection of ancient weapons, modern firearms, and defence weaponry",_
"penghantaran laju, kelmari order kelmarin jugak pos, hari ni dah sampai,seller pun fast respon untuk jawab pertanyaan, next time boleh repeat lagi, terima kasih daun keladi semoga kita berurusan lagi",_
Trima kasih seller sbb jual produk yg bkualiti,_
"My nearby restaurants Don't show up, the app is basically useless",_
"Unbelievable fast delivery, good response on seller, not try yet, hope everything in fine",_
Tuala mandi baby sudah selamat sampai ye,_
"price, and the editing of pics are great too!",_
terus success,_
"Good , penghantran pun pantas, sedap dan krup krap",_
Material:Very good and comfortable,_
Penghantaran 2 hari ja memang laju,_
"$MENTION$, that would be a perfect phone to have honestly",_
awwwwww saya suka,_
Its baggy indeed but for someone with 170cm height mungkin akan pendek sikit but still fine if you wear it with skirt,_
"Albertsons Companies is testing grocery carts outfitted with cameras, sensors and a scale to scan groceries, including canned goods, boxes, meat and produce, as customers shop and place items in their carts",_
selipar semua dah sampai,_
"7, received on 13",_
yah gak dapet emas karena gak baca basmallah,_
So fast delivered and good quality,_
hrga sama je dgn seller lain tp boleh dpt saiz lg besar huhu,_
But some have a bit loose,_
Cuaca buruk hambat misi pelancaran angkawasan SpaceX,_
"Even goods received in good condition, but still diff size",_
"saya hanya lock bag balik kampung tu je tp free lg banyak dr lock,bag laptop tu pun ikutkan saya nak bayar tp xsangka lak sis bg free je🥰🥰🥰",_
"Unreliable, buggy, lagging, slow Yet EXPENSIVE,",_
"very fast delivery, received within two days time only will buy again soon!",_
Elok2 pilih warna deh,_
The law firm will examine concerns raised by employees in a lengthy 2019 email thread and actions Microsoft took to address them,_
I would say its worth buying,_
"Belum pasang lagi, harap pagar tak sidai kita",_
sorry not related photos and videos but the item received safely and all good!,_
Agak mengecewakan barang yg diterima tidak mencukupi,_
nicely packed & wrapped,_
~~bianmi~~,_
berapa kali repeat pun xtau laterbaik termurah,_
maaf gmbr takde mngena dgn video,_
Definitely will repeat buy the service boost !,_
"The students will be given a Covid-19 rapid test kit (RTK) and upon completing the test, they will drive to the designated parking area while waiting for the RTK result, he said",_
The taste no tomyam at all just spicy and sour somemore still have a very smelly belacan,_
"Pengerusi Jawatankuasa Infrastruktur dan Pengangkutan negeri, Zairil Khir Johari, berkata beliau mengambil maklum isu kemalangan disebabkan pemandu mabuk, namun sudah ada undang-undang bagi kes berkenaan iaitu mengikut Seksyen 44(1) dan 45A (1) Akta Pengangkutan Jalan 1987",_
t=9m12s> First story seen by 24742 people,_
siap bagi gems berjuta juta lagi,_
Bantal utk harga macam ni it's quite berbaloi lar,_
overall mantap kbai,_
kali yg ke 3 beli dh macam koleksi hahaha,_
Penghantrn laju,_
"cantikkkk , recommended beli kat sini",_
He is the chief editor of a blog called Official Korolyov hosted on Russia's popular social network VKontakte,_
"jnt peram lama betul,macam terima item dari luar negara",_
nk tgok kucing senang kalau xda dkt umh,_
quote of the day have a nice day everyone don't stress2 just live your life and have fun sorry heh,_
jenis jelly yg lembut soft je,_
"Received in good condition,good product quality, all item is working",_
hargai pun berbaloi,_
SellerTerbaik Terbaik seller Terbaik seller Terbaik seller Terbaik seller Terbaik seller Terbaik seller Terbaik seller Terbaik seller Terbaik seller Terbaik seller Terbaik seller Terbaik seller Terbaik seller Terbaik seller Terbaik seller Terbaik seller Terbaik seller Terbaik seller Terbaik seller T,_
seller pun friendly bila kita request x nak loose sheet tapi nk terus sambung,_
Bad quality and i have to give it to my 9 year old sister because it is too small for me,_
Tapi seller post 2 colour skin and 1 pink,_
average taste i tambah kiub ikan bilis and more gochujang to add more umami and salty taste,_
"In 1994, three Berlin construction workers were killed in a similar accident",_
Many devotees observe a vegetarian diet a day earlier to cleanse themselves,_
Safety:Gud knee pad,_
Korang boleh try beli okayy,_
sebelum ini order dlm rm36 dah boleh dpt free shipping ini dah naik,_
bodoh buat kerja merepek kerja bodoh x da kerja kau meed,_
"Paling penting nak habaq mai, rega murah pada pi beli di kedai",_
Saja amek size XXL nampak loose dan selesa dipakai,_
inner pun best,_
Best sgt kualitinya🥰,_
Terbaikk dan murah,_
Niceeeeee lajuuuuu shippinggg saya sukaa,_
"Penghantaran yang pantas, saiz kaki 36cm dan ambil kasut 36cm juga, memang ngam2 tk ada rasa longgar, tpi better ambil saiz 1cm lebih utk lebih selesa",_
Ppppppppuuuuuuaaaaaasssssss,_
"Last time refill pack was 800g but now seems like new refill pack is 750g,",_
Gambar tak tahan lama,_
Bukan nak promote tapi barang dengan harga tak masuk akal,_
"Cantik sgttt, saya pompuan gune sbb cantik n besar",_
Laju plak die naik time bkak tu,_
material pun x tebal sangat dan x nipis sgt,_
Kali ini kami kembali dengan *PRODUK BAHARU*🤛,_
the baby crunch is so crunchy and my chocojar taste just as good as people out there sell,_
It has moles approval! $MENTION$,_
berus ni senang untuk berus gigi anak saya,_
very good packaging good value for money bcs got battery plus film tooo very good deal sorry i donthave the sample picture bcs i dont develope the film yet,_
I was so far from you,_
I only bought the Detox Tea,_
nk lg ok i letak kat freezer,_
"Pembungkusan yang sangat kemas,terima kasih 🧸",_
Boleh lipat untuk travel,_
penghantaran pantas amek masa sehari je untuk sampai,_
Love the fabric and the length of the shawl is just right too,_
sgt berpuashati🥰🥰🥰🥰🥰🥰🥰🥰🥰,_
Wait for longg hours,_
husband berat 75 ambik size XL 3/4 pant ni memang muat dan ngam2 cover lutut,_
"Order harini, harini dah ship",_
aapko,_
hrga punn sgt murah,_
Texture:eyeshadow tu pigmented sangat sangat,_
pakai ni besar kalau jalan risau terbang je,_
Tag 18 utk kakak 13y,_
Well connected with my xr and well functioning for both sides as it stated in the manual (also for the multifunction touch button),_
"items received in good condition, good product quality, well packed by seller",_
"Qatar Airways Chief Executive Akbar Al Baker appeared to confirm a major upcoming 777X order on Tuesday, days after Airbus took the increasingly bitter dispute to lawyers",_
High spec hbis,_
"Dah sampai tadi, kualiti ok, harga berbaloi, cuma tali tu kurang 10 pcs",_
Parcel safetly arrived,_
"The home side had much the better chances, with United goalkeeper David de Gea bailing his team out with several fine saves, the best of which denied Manu Trigueros a goal",_
"Most restaurants are unavailable now, and when you make an order, the app doesn't update the progress of the order",_
Sumpah tak cantik,_
"On when slope works would begin, Nor Azlina said she has presented the case to the state assembly council and had received the mandate for work to be carried out immediately by MPS",_
Price &amp,_
PLEASE CHECK BUYER REQUESTED ORDER!,_
Anak umur 6 tahun beli saiz besar sikit tapi dpt besar jgk,_
Sorry gamba dan vid takde kena mengena,_
bisa bercinta dengan kamu,_
iron dia da rosak,_
5 star sbab bnyk dpt coin,_
"Lawa terbentuk helok, delivery laju lak tu dua hari je smpai pakai apa nyah kita bukan satu negeri colour white more to pure white bukan off white",_
tak mnysal,_
This is good easy to use and and safe space received without damage,_
I like the mobile very much my Twitter id $MENTION$,_
Adik cakap sambal sedap,_
Tp dpt yg xok plk,_
Walaupun tak chat Dengan seller tapi service baik hehe TerimaKasih seller Melaka-JB,_
Terbaik dgn harga tersebut,_
Made an order (from a convenience store amd not a restaurant) and they keep changing the estimated delivery time,_
It now truns into a worse app,_
"Packaging dia bagus, tebal",_
"Affordable price with good quality, fast delivery from seller too",_
"Buat pertama kalinya, pemenang Filem Terbaik akan membawa pulang trofi dan Dana Kandungan Digital (DKD) bernilai RM500,000",_
t coat the rice with eggs like that,_
suka je dia makan,_
"Taste wise, kopi ni memang sedap",_
19 per share and $1,_
Sesuai la nk buat aktiviti bg keluar peluhh,_
Kain memang ons!,_
Lipstick dh diterima dalam keadaan baik,_
"Pretty late shipping, case is good and premium",_
"xda apa-apa kerosakan, terbaik",_
Brg smpai dgn slmt & cpt,_
Program ini secara tidak langsung akan dapat memberi peluang kepada lebih banyak usahawan kecil dan sederhana negara untuk mengkomersialkan produk makanan masing-masing terutama melalui jenama My Kitchen,_
Had time to think about sharing your feedback? ?,_
the item arrived in good condition and properly sealed!,_
User-friendly?,_
Monyet ada pelik,_
nk remove backround pic pon dah mudah,_
Good good good good good good good good good good good good good good good good yyy,_
"Sedap sangat , tenkiu nanti saya repeat lagi",_
Mask ank dh smpai,_
"soooo cheap,",_
"You can have the strongest motors, the heaviest locomotives, it mean next to non if you cant get that power on the tracks",_
kain cntik dh 2x beli,_
NORD twitter:$MENTION$ lmao just trying any colour,_
"Harga pun ok, berbaloi",_
Design:terbaik wow amazing,_
"Banyak kajian di luar negara untuk melihat keselamatan dan keberkesanan vaksinasi heterologous, termasuk ketahanan terhadap varian Delta",_
Good product but the boards were broken at the corners or sides,_
Fresh product and looks good,_
brg dh smpaii,_
torrrbaik,_
Durability:Ringan dan tak terlalu nipis,_
t=0m25s> that looks like a futuristic concept phone that I saw over 6 yrs ago,_
૮₍•᎔•₎ა,_
"(171cm,64kg)",_
tak sabar nak bagi anak sedare main atas ni,_
barang yg dihantar pun betul,_
I am 158cm and 68kg so this size fits me nicely,_
jerawat badan pun hilang 🤩🤩,_
Bidang 47,_
Asa free gift lagi,_
nanti i edit balik,_
"For reference, 161 & 75kg i ambik 2XL, super selesa",_
"Kalau biasa pakai L, better amik XXL utk yg loose",_
Organizers insist the demonstration will be peaceful,_
"Are there any phones that can be connected to a screen and keyboard and be used as a computer/laptop/tablet/, and now a phone?",_
You speak about two ingredients in the heading and then you start to put in ingredient after ingredient and we say please not any more,_
"SubhanAllahi 'l-`adheem wa biHamdihi (Glory be to Allah, The Supreme, and Praise Him)",_
"Harga berbaloi, siap dpt free gift lagi",_
pin tajam2 oklah,_
ayah kata okey jee,_
He described 'wedding tourism' as an important branch in the tourism sector,_
recommendedpenghantaran laju seller shipout awalll,_
"SINGAPORE (The Straits Times/ANN): Singapore and Indonesia will start discussions on green lane arrangements to resume essential travel between the two neighbours, Foreign Minister Vivian Balakrishnan and his visiting counterpart Retno Marsudi said on Tuesday (Aug 25)",_
beli gna coin harga makin murah,_
Bought at rm3,_
Always great to use no issues,_
Only delivery via poslaju for place not so convenient,_
"Belum pun reda serangan virus pembunuh COVID-19 yang melanda, negara dikejutkan pula dengan bencana banjir yang disifatkan antara terburuk abad ini",_
"TERMURAH, TERLAJU DAN TERCEPAT",_
"kaler lbih kurang jaa tumcm nipis n jarang , ta tahu lh pkai cm mne t , arap sng bntuk , tq , nnti repeat lg",_
"Material:selesa dipakai,cantik",_
singgah shopee saya sekarang $MENTION$,_
Parcel dibungkus dengan baik dan penghantaran cepat,_
Takes time a bit either you blow or use electric air pump but still can inflate,_
Cantik gila quality dia walaupun lambat sikit,_
Quantity was wrong and sending the wrong product,_
Berfungsi dgn jayanya!,_
plug xboleh pakai,_
penghantaran pn sgt2 laju,_
FRANKFURT (Reuters) - Nine leading U,_
"If it's suits me & more interesting than Neutrogena HA cream, than I'll switch to loreal",_
Semua baik bungkusan kemas,_
idk wtf she&$HASHTAG$,_
Only you can feel the rubber is harder,_
"happy adik saya recommended and very trusted seller and subscribe to blueblackx ,",_
sticker sangat berkualiti dan servis yang sangat cepat,_
PRODUCT ALREADY RECEIVED TODAY BUT THE BLUE COLOR I ORDER 5 PIECES BUT YOU ONLY SENT TO ME 1 PIECE ONLY,_
Effectiveness:Thank You,_
Fast delivery i like this service so much,_
Barang cun cun punya,_
"happy with this purchase,",_
lambat dan terukk,_
blh tukar tp malas dh nk ke pos,_
This system no longer exists,_
The characters are growing up!,_
Very meaty thanks ya 🥰🥰🥰,_
Cleanliness:supportive,_
But its okyla dh sampai dh pun boleh je guna,_
Adult also can consume,_
One had to do with Verstappen pulling up alongside and edging ahead of Hamilton,_
"It has improved a lot over time, both in terms of features and customer support",_
Tp tak pasti lah beza dengan yg mahal macam mana,_
A source familiar with Pfizer's strategy told Reuters earlier this week that GSK and Pfizer would open negotiations with Unilever's boss Alan Jope if the consumer goods giant was ready to improve its bid to more than 60 billion pounds,_
coffee pun sedap,_
