Sentence,Tagged_Sentence
The measurements provided is accurate,_
but it is less sweet so can put extra in my latte,_
Tak boleh harap ini saja tp okey la sebab kids kan payah sikit nak bukak mulut,_
which has seen the European Union accuse Minsk of flying in people from the Middle East and pushing them to enter neighbouring Poland,_
"but its ok,i dont mind as long as its working",_
Kepala zip bag pecah,_
murahhh dan terbaikkk cantekkkk,_
nak beli lg la,_
Google dialer he,_
I NEED TO SELL MY LUNG TO BUY AN APPLE MASK !,_
if cannot find people to do washing,_
tekstur x melekit n berpeluh bila pakai,_
"Katanya, wanita yang bekerja juga mesti diiringi penjaga lelaki",_
"x tahula knp malas sgt seller nak lipat2 lampin tu, main sumbat je, geram rasa",_
nsib baikk,_
"Received all in well condition, will buy again from this seller",_
