Sentence,Tagged_Sentence
Without my expectation,_
"First, Fave shouldn't ask about buying voucher while customer is doing another purchase, which can easily lead to a mistake ( which unfortunately I did)",_
Terima kasih Allah kerana panjangkan umurku dan diberi kesihatan yang baik untuk meneruskan hidup dan beribadat kepada-MU,_
I am having a problem with this,_
Tested the unit all works well,_
"The bag is good, it's better to buy, thank you",_
Kalau ngam repeat utk kereta saya lak,_
"Rambut lembut, tak kering lepas guna",_
dah tak kacau emaknya minta dukung 🥰,_
"Pembelian ke sekian kalinya, rasa hebat citarasa unggul, macam tertulis di bekas, WAJIB ADA DI SETIAP MEJA MAKAN, jadi hukumnya wajib la",_
"HI THANKYOU MY JEWEL CASE IS SAFELY ARRIVED 🥰🥰🥰🥰🥰 No luck in suc but it's okayyyy btw if anyone want to trade ten jc to mark jc pls chat me thanksssss,",_
Glad to find this best price here,_
tp kain ok tp tak tahu lg keserapan tuala ni,_
", terima kasih seller",_
s nice words to start the day,_
Good responsive Seller,_
maaf video dia kaitan,_
"sy ambil saiz 90 utk anak berat 8kg, tinggi 75cm",_
setiap item siap dapat free gift sikat kecik tu,_
"well packaged, thank you",_
parcel is safely received,_
map is not available,_
I love this eye pencil so much I returned to buy 2 more colours,_
Functional very well,_
"No exchange policy wow, they made the mistake and we have to suffer, i really didn't expect this from such a famous brand, now I have to wait for refund, I ordered this stuff for my bday and my money is stuck seriously very unhappy and unsatisfied",_
pilihan colour,_
"Tolong dong, saya ngalamin kayak gini bukan sekali dua kali pake grab",_
Open champion Daniil Medvedev claimed the deciding second point by defeating Marin Cilic 7-6(7) 6-2 after compatriot Andrey Rublev beat Borna Gojo 6-4 7-6(5),_
nanti nk reapet bnyk2 🤭 trusted seller and recommended,_
Ship: 25/10/21,_
Very good rechargeable fan to use any time any where,_
"So far dah try Elsalvador, Brazil Santos dan Sunshine",_
Doraemonnnnnn!,_
jd klw time pkai bju lengan pendek tu boleh ler sarung ni baru sarung tdung,_
"Ordered 8/8, received on 9/8",_
"this is N times order, having",_
Sangat puashati anak saya pun sangat suka dah lh murah tq,_
Brgn dh kondisi yg baik,_
"30 AM, el algoritmo de YouTube &quot",_
seller okay je reply dengan elok apa yang ditanya,_
Open Menu,_
"Free tpu case, screen protector",_
Not upgrading from my 11 pro max- its still a tank on battery and performance,_
TQ SELLER :),_
Takleh layan Netflix coz kena tukar package tuk langgan TV sekali,_
The product safely arrived at my home while I was not there,_
i hope my boyfriend will love it!,_
The in skirt material is comfortable and stretchable but a little short,_
ok la nk buat basahan je,_
got free coin,_
"stretchable, durable",_
Love the video by the way!,_
Quality:sangat memuaskn,_
nnti klau sedap,_
night time vision also clear,_
Beli untuk hadiah anak buah,_
Sangat sesuai untuk baby,_
SE3,_
"Pengarah KPDNHEP Johor, Mohd Hairul Anuar Bohro, berkata notis dikeluarkan kepada 21 peruncit, 11 pemborong dan tiga pekebun atau peladang susulan pemeriksaan dijalankan sejak 20 November lalu hingga semalam",_
Pretty nice shoes on the app and also pretty good prices compared to amazon shoes,_
Received item in dented condition,_
"Ordered on 9/9, received on 12/9",_
Blank screen after made payment with the header you're now being directed tonther merchant's site,_
"Thank you, penghantaran pantas, gambar xde kena mengena ngan barang",_
Item exactly as described by salesman,_
but the delivery too slow eventho its located in selangor,_
seller cuba yg terbaik,_
"'It's unbelievable,' Nadella said of the experience during an on-stage interview",_
really love it!,_
Takpe laa hitam pon cantik,_
LAWA SANGAT SANGAT HIGH QUALITY TERUK DELIVERY PUN LAJU JE DUA HARI DAH SAMPAI OMO OMO THANKYOUU SELLER,_
"Her passing is a big loss to the community and state, he said",_
tp cuma bsr sikit myb sbb ank sy kck kot,_
"For the past two years, people with diabetes have experienced not only the fear of being vulnerable to hospitalisation and severe outcomes of Covid-19, but also the fear of not getting the appropriate investigations, care and treatment",_
Jersey type,_
"I m still waiting ,",_
Comel la sller ni siap belanja coffie lg tq syg,_
But seller why gave me spicy flavoured?,_
Nanti gaji beli lain lah,_
"Gmbar ,vdeo takde kaitan",_
"tapi okay je, sedap pakai",_
Enjoy great deals and,_
- handle luar pintu chrome RM100shj,_
Order rasanyaa 2 hari lepas hari nih dah sampi,_
but still,_
90 utk dua,_
Harga pun quite affordable,_
Quality still ok,_
KUALITI STOKIN SESUAI DGN HARGA,_
Item come in good condition~,_
Panas lg,_
Brg dah sampai cantik sangat berbelui dengan harga dia,_
A4 photo print with canon ts3451 doesn't work,_
baju ok ngam xketat xlonggar,_
"The Deputy Chief Minister said that the SOPs should facilitate safe campaigning for all parties and candidates, especially in rural and remote areas",_
Harap berkesan utk kulit yg gatal²,_
lain kali nak beli flavour lain pulak lah entah kenapa selalu beli cheese je,_
"Sarung bantal yang cantik, Kain pun elok, harga pun murah",_
sambal serius overrated xla sdp mana,_
"Ada defect pada size L, boleh refer dekat gambar dia atas",_
And second would love to win that phone because not gonna lie I need that phone for my personal use and more so yeah would love to win that phone and if i dont win its okay i will also try to win in other giveaways as my grandmother said its all about luck,_
Penghantaran yang bagusss,_
"- Foto BERNAMA Ismail Sabri berkata, kerja pembaikan rumah rosak yang membabitkan baik pulih kontraktor dilantik, sudah mula dilaksanakan oleh Jabatan Kerja Raya (JKR) bagi Pahang, Negeri Sembilan dan Melaka",_
Terima kasih penjual dan pihak penjual,_
Please add more restaurants,_
It's comfy and the size fit me well!,_
"Item received in good condition, fast delivery, expired on 30/9/2022",_
"Blh ltk toto, bantal, comforter",_
Safety:penghantaran,_
barang diterima dalam keadaan baik tapi yg paling penting delivery super fast trusted seller,_
"From their black coffee to white coffee to durian coffee, products are of high quality for consumers as they are a trusted brand that has history way back many years ago",_
i sukaaaaaaaaaaaa sgt2,_
Dan seller hantar ukuran sesuai dengan ukuran yg saya pesan,_
Takde pecah or leaking,_
tp next prefer yang lebih tebal,_
Ia juga dilengkapi 13 pembesar suara Mark Levinson Reference Surround Sound System untuk kesan akustik terbaik sama ada bumbung terbuka atau tidak,_
thank you so much my parcel arrived in good condition and seller very friendly and helpful i'll buy with this seller again also thank you so much for the free gift,_
dengan cara ni boleh bersih,_
Seller pun ramah balas chat,_
"Senate on Thursday where the Senate Judiciary Committee will mark up a bipartisan bill from Senators Amy Klobuchar, a Democrat, and Republican Chuck Grassley that would bar companies such as Amazon and Alphabet's Google from favoring their products and services",_
"I've been a part of the creation of every model of the Tour360, so I can confidently say that this is our best-performing model we have ever introduced, added Denison",_
baju comeyyyyy,_
Semua ok dan harga pun baik,_
Cuutiiee V :),_
"Not really comfortable with the silk,and my forehead not really comfortable with the renda,just suitable with the price",_
Barang malaysia always terbaik,_
Material very nice,_
Barang sampai dengan cepat Bungkusan memuaskan,_
xpayah nk sterika,_
packing meragukan simple jee tp safety wooo xde kemik langsung,_
Boleh buat pembelian di kedai ini,_
04 just received,_
Door gift for birthday party,_
bagusss,_
I want to repeat order next time in this store,_
"cuma bila xde stock seller akn refund personal kita x boleh klik refund kat sistem,mungkin untuk jaga rating kedai dan refund setiap isnin sahaja",_
Chup,_
ank Saya suka,_
"Kain lembut, tali panjang, harga pun murah",_
"all good, well wrapped and very fast delivery!",_
50 peratus pengurangan ansuran bulanan untuk tempoh enam bulan,_
The laptops we have picked can also handle system-intensive programming like graphical web development and gaming too making them the best laptop for web development and gaming too,_
"My first time buying so, hope it's good so I can repeat order and give good reviews,thank you seller",_
Manfaat masker organik,_
Ank yg x ok,_
Harap kecuaian tidak diulang lgi yaaa,_
"tp kalau baby kencing, still menitik",_
order color purple dpt color yellow,_
CUMA BARU CEK KALAU PAKE KODE PROMO JADI BERAPA ONGKIR NYA,_
LONDON: Ratu Elizabeth II semalam menggesa pemimpin dunia supaya berganding bahu dalam 'perjuangan sama' membendung perubahan iklim bagi 'menyelesaikan masalah paling sukar diatasi itu,_
I ada uniqlo dan baju ni but as well worth the price,_
Terbaikkkk semuanya okey tiada kerosakkan,_
The boys only had one month to train because of the Covid-19 pandemic,_
terbaikksy beli,_
Thank you for free gift battery,_
kwn,_
Seller pun balut spec pakai bubblewrap tebal 🫶🫶🫶🫶,_
Good packaging from seller and it is not broken when delivery,_
"first time beli dgn seller ingat ok mcm yg lain but i received 2 kemek teruk, next time pls pakai kotak and letak fragile yg besar, tak boleh nak salahkan courier cs they have tons of parcel so what you can do is make sure you do your part as a seller, cust beli pakai duit jugak, thank you,",_
belum pasang lagi sbb rumah blm siap,_
"why is he just rickrolling us in the background,",_
cepqt respon🤩🤩tq,_
It's cheaper and bigger,_
"Good product quality, good value for money and fast delivery by excellent seller",_
boleh repeat lagi beli kat sini,_
Thank god it is satisfying,_
Bought it for my mom and nenek,_
Sama jugak macam beli kat kedai,_
Effect: glowy and dewy,_
Oneplus doesn&$HASHTAG$,_
Kasut muat2 and quality padan la dengan harga,_
"And seller senang utk bincang even dah lewat malam,",_
"11,dapat pd 12",_
"penghantaran cepat, pembungkusan A+",_
Bantal ok sedap guna,_
Capacitance exceeded the tolerance,_
Apa pun delivery memang pantas,_
Going from a 12 Pro Max to 13 Pro Max and I wasn&$HASHTAG$,_
"$MENTION$ Викторовна, Всю систему я незнаю",_
"seluar cantik thnkyou sellerr,",_
"Next order i regret that i only bought one is really good, i must order",_
Usable but do not know how long it will last,_
muat utk sy,_
Nmpak review user d tiktok,_
Mlm kalau lapar mnum 1 lg FM ni,_
Purple color so dim,_
"In a Bursa Malaysia filing, BCM said the Dec 23 agreement entered into by the three companies enables BCM to penetrate into virus attenuation devices business that might yield attractive returns to the group",_
Rakesh showing vivo adapter for iqoo phone,_
brg baik🥰next kita repeat lg tq,_
I'll repeat after this,_
cuma ada 2-3stick je ubat nyamuk tu yang pecah² sikit mungkin sebelum packing lagi,_
Torsion Lee,_
trm kasih bnyk2 ya,_
It has Huawei Dekstop?,_
Sorry tk de kene mengena dgn gambar,_
stiker sudah sampai,_
8400 baht),_
beli untuk guna bawak pi kelas,_
"Bagaimanapun, dalam Pelan Pemulihan Negara (PPN), kita tidak boleh kenakan 'windfall tax' (cukai keuntungan luar biasa) yang akan memberi impak lebih besar jika kita lakukan langkah cukai tanpa melihat ekosistem secara lebih meluas, katanya",_
tpi fedback smua ckp bagus,_
pstu kt krts tu tulis kene download app fit here,_
Hopefully no leaks,_
"com/article/us-philippines-media-idUSKBN23M03B, Ressa is facing five tax evasion charges and a corporate case with the regulator",_
banyak kali saya repeat,_
Why have an online platform when you can't accept exchange ?,_
not something to be missed,_
It doesn't leave stains when we wear mask,_
Material kain elok,_
"7 received on 10th july bagus baguss, material 100 cotton maybe okay kot sbb 1st newborn 🥰🥰🥰",_
Tpi dkt mall harga sama jr jual yg blh gulung atau x,_
Belinni sebab baby nak mula merangkak,_
And nice price,_
hai awk🤭,_
cantik2 & murah untuk midi,_
"Order 10/12 noon, received the next morning 11/12, very fast service",_
Already a few time buy from this seller,_
Ведь уже пандемия была в разгаре?,_
s vibe and Sindy is very Brit&$HASHTAG$,_
thank you very nica,_
penghantaran yg sngat cepat dan berkualiti,_
"Xrugi beli, murah dan berbaloi",_
lepas 2hari order baru seller post nasib baik barang ok,_
Thank you seller alhamdulillah dah terima semua set baju yg dah locked,_
Size puting pula ngam2 dengan silicone ni,_
seller okay supportive,_
Boleh repeat Lagi kat seller ni,_
"China's cabinet pledged on Wednesday to roll out policies to boost consumption, and use more market-based measures to stabilise commodity prices",_
$MENTION$$HASHTAG$$$ ^^&*€£,_
Even i bought the same size,_
cover aurat smpi betis,_
"Item well received, not try yet, seller promptly respond, fast delivery, many thanks",_
"Barang di terima dalam keadaan baik dan selamat, barang yang sampai sangat berkualiti dan berbaloi",_
74 million shares valued at RM236,_
aku suka baet,_
insyaAllah akan repeat lagi product Soundstream mmg sound padu dah pakai kat dua kereta,_
penghantaran superfast,_
Ada free batteri,_
"Good packaging, fast delivery thank you seller!",_
"'I think if I can continue doing what I am doing, continue to develop, I don't see why I can't push (Bayern defenders Benjamin) Pavard, (Niklas) Suele or (Lucas) Hernandez out",_
Cantik sangat & boleh dikatakn very satisfied jgk lr delivery estimated memang laju Dari seller ni,_
Monin Syrup Caramel Flavour,_
Free keychain saja,_
Xtau kualiti camne sbb ni hadiah org jauh boleh lah kot klau tgk dr packagingnye,_
"Quality:terbaik, gam kuat",_
"masukkan susu, serbuk carbonara & samyang sauce",_
hihihi my shoes safely arrived!,_
Penghantaranboleh tahan laju,_
SAYA SANGAT BERPUAS HATII,_
Nah Michael Jackson's Angry lmao,_
"Beli 3helai, Alhamdulillah semua lawa2",_
Delivery standard time,_
Tapi hajshahsh tak muat siott kaki gemuk,_
"tnk you for the give,tnk you so much",_
nice gila casing dia soft touch,_
Maaf gambar tak de sbb pos kat adik,_
"30 je bli,berbaloi sgt3 🥰🥰🥰,seller sgt btgjwb,refer bgkusan",_
Aku kecik pun 50kg 160kg pun pakai 4xl,_
tayar dpn belok la,_
Hopefully all of them are fine and working,_
Thank you seller jual dengan harga yg murah,_
"Saya beli kat peniaga ni sebab dia baik sangat, layan elok, x jadi nak beli kat kedai lainseluar OK laju ja",_
Tak sabar nak pakai masa practical kayak nnti,_
sesuai utk milk booster,_
"this is 4th time buying from this seller,",_
untuk pakai memang berbaloi,_
Menyembur dengan berkesan,_
Sze Ming i want this,_
Order at midnight 3rd Jan and received parcel on 5th Jan afternoon,_
Ho Yuet Ying Carlos Ho Winnie Csw,_
dan wrapping dia sangat baguss,_
Material:sy suka corduroy,_
Comel nya wrna pink,_
Kindly state the ingredients clearly,_
Ngumpulin orang&quot,_
"Beliau berkata, sebagai persediaan, seminggu sebelum acara, kumpulan itu berkayuh dari Putrajaya ke Desaru di Johor membabitkan jarak kira-kira 500 kilometer dalam tempoh 15 jam",_
"Cuma area muka licin sket, so kene pakai inner kt dlm",_
sje nk rse bende baru,_
"Anak suka,mak pak gembira🥰🥰🥰",_
Fast delivery hehe 🥰,_
Super convenient for my most urgent printing needs,_
Rambang mata tengok corak² nye🤪,_
"By midday Tuesday, Evergrande stock - which hit a record low on Monday - had trimmed gains to 0",_
masa live pon have fun,_
bungkusan yang kemas keming,_
penghantaran pantas tqvm seller terbaik,_
Sendiri Salah Address so barang Tak Sampai dkt Tangan lg,_
"Very bad delivery service from Poslaju, item purchased on 11",_
sngt membntu untuk ank2,_
Thank you barang dah sampai balutan cantik kemas sorry lambat review sebab busy mantapppp,_
Good quality product and fast delivery Good job seller,_
🥰 Super fast delivey,_
Tapi semalam try on suis keluar asap,_
"[12/5, AM] +60 12-945 5178: RBS g",_
"Good product quality, nice packing, haven't try the taste, overall ok!",_
Qjdhdlajfjdkdhfhrksjxjsjrjcj lajdjtjfj ksjrkfj jdkgjdkd fke,_
I hope Shopee can let customer to pick the courier company in future,_
Terbaik Pantas Cepat Laju2 Mantap respond Pon Cepat lengkap,_
Saya suka beli kat shoppee ni sbb harga dia lbh murah dari pasaran,_
repeat oder nnti,_
"Program Job Fair yang menawarkan kira-kira 10,000 peluang pekerjaan secara terus kepada yang terpilih menjadi antara faktor penarik ketika",_
GOOD LUCK ORDERING ANYTHING WORTH A DAMN FROM THESE PEOPLE,_
"The shipping is fast and standard with a cheap price and has a good quality, hopefully it can be useful",_
Item cantik dan okay,_
pastu best gila dapat order kat sini,_
Seller pulak shipping cepat,_
bungkusan kemas & semua botol elok,_
sekali ketat plk,_
*Akan datang pada suatu,_
Arrived safely Thank you,_
"Well wrapping, but they are going to expire on August, this is the shortest expiry date that I ever had",_
My repeated order as the luncheon meat tastes good,_
Delivery pantas as usual,_
"Selalu pakai inner asyik kebelakang je, then ni beli yg ada getah, mmg ok sangat",_
"But beli ni pun saje2 je, this is just my opinion hehek",_
Receive good condition + Fast delivery,_
"Foreign nationals who are technical experts, manual laborers, entrepreneurs, students, overseas Lao (of Lao descent), and spouses/dependents of Lao nationals arriving in or returning to Laos from abroad must take an RT-PCR Covid-19 test and await the result within 48 hours at an approved quarantine location",_
bagi saya puas hati tq 🥰,_
hopefully suitable for my baby,_
"Alhmdulillah , pnghntran cepat sngt , terima kasih seller",_
Seller yang paling murah,_
wrap well in box thankyou seller !,_
there's no glue on the surface,_
seller ni org chat pn buat xtw je,_
Some of them I bought as present for my friends,_
"Barang dah sampai , baju cantik semua ok penghantaran pon laju",_
Hyperthyroidism (overactive thyroid) occurs when your thyroid gland produces too much of the hormone thyroxine,_
Sampai dalam keadaan baik cuma saiz besar sikit kena Oder kecik sikit ok la tapi ok la boleh pakai,_
"Stokin okay and just nice, kene dengan harga and dont expect too much",_
"Xlah tebal sgt bila lipat,sgt sesuai dbawa utk travel,jimat tempat",_
Tq barang sampai dalam keadaan baik love sangattt i will repeat again tqqq,_
$MENTION$ awesome phone,_
Boleh repeat lagi bila perlu nanti,_
"As the photo shown, expiry still long time",_
Pake aplikasi lain aja,_
Ok la berbaloi dgn harga cuma ada koyak sikit dkt blkang,_
Both earphones are working so well,_
mmg super dart ONN,_
"It makes me smile, thinking of those people who spoke without thinking about what they were saying, who must now look to their own home instead, Jacobs told Rai",_
Difficult use for 2 mask,_
"Received in good condition, fast ship out by seller but delivery delayed by PL",_
Maaf gmbar & video tidak berkenaan,_
"Kain elok murah memang kena repeat, penghantaran pon cepat 2 hari ja dah sampai very recommended",_
huahuahuahuahuahua,_
Nanti habis pakai kita repeat shopping lagi,_
Hope it can be use,_
saje beli baju besar,_
Anak kata jam ok,_
postage pn cpt,_
Pakai mask ni nampak elegant dan karismatik gituwww,_
Kira saya pakai kira ok laa kalau kata xx bsah dlm to tipu laa,_
"Ingat gift box, ingat Ayu",_
"Speedy delivery, good packing, working well, thanks seller,",_
"At the end of the contract, the client had the option to sell the gold bars back to TGL or keep the gold bars",_
Good Products quality Good value for money Good Products quality Good services,_
bru beberapa hari,_
Thanks courier personnel for fast delivery and hardworking,_
the seller shipped the very day i ordered thanks so much,_
not so fun fact : i ask my dad&$HASHTAG$,_
Thank sebab bagi wish n sign penulis,_
Ini Dia Links Live Streaming Utk Menonton Game2 Tersebut,_
ade 3 speed mode,_
pakai kotak semata pos,_
tak reti nak pasang,_
nak letak handsfree pump pon senang,_
kain ni mmg best,_
Texture:smooth and nice color,_
Fast delivery good packing and received in good condition good value for money,_
nice style packing cun,_
The pro will have even better battery thanks to the LTPO P-OLED display!,_
Memang menjadi licin giler,_
harini oder harini jgk seller pos,_
Just nice je kalau buang diapers guna plastik ni,_
"My order arrived safely,",_
"3 juta iaitu masing-masing RM1 juta daripada Kerajaan Persekutuan dan RM300,000 kerajaan negeri",_
bju semua lawa2 ank2 pn suka,_
"The Philippines has just started to reopen schools after 20 months of pandemic-induced closures, while Thailand opened up its top tourist destinations to visitors from more than 45 countries from Nov",_
Comfortability:Sangat selesa jika sesuai dengan saiz kaki,_
"Consequently, please do not hesitate to buy the items that you wish",_
Astaga stress lah aku,_
Sekejap tekan tidak hidup,_
"Great pillow, sedapp kualiti",_
"Fast dilevery, recommend",_
Another confusing plastic junk!,_
It was amazing to imagine that i&$HASHTAG$,_
Stock received safe,_
items well received in good condition,_
better lock profile,_
Tq seller pampers dh smpai dgn selamat,_
Gincu tu mmg pigmented betul warna dia,_
mask terbaik!selesa utk dipakai!warna cantik!thank you thank you,_
"Baju Nice lawa, amek size L memang nice sbb lengan dia baggy and jacket ni tak fit pon",_
Tapi tak pe janji barang sampai cukup dan betul dengan apa yang d beli,_
"64/162: ngam L, but nextime I'll take xl for more comfort",_
Simply so good to use,_
Terbaik Mizu quality memuaskan,_
Well packed with lots of bubble wrap in hard cardboard carton,_
"separuh gelas, baru teringat nk review",_
Works well printing pdf from android,_
I do not recommend this nonsense,_
"bagus sangat berkualiti, akan repeat order sebab seller pun bekerjasama",_
tinggi 162 berat 56,_
tenkiuww yew,_
Laju walaun pun dari China,_
Thankyou so much seller!,_
"Rasa sedap, garing elok",_
maaf gambar x de kena mengena dgn produk,_
Item diterima dengan lengkap,_
Quality:Sgt cantik kualiti helok sangat,_
sbb harga murah dr kedai luar,_
Received and everything are fresh and nice,_
Have been waiting over 1+ hours for a delayed order that wasn't even during peak hours,_
86 400g8,_
Penghantaran pun laju packaging semua okay,_
"Bought for my friend,",_
Dang It&$HASHTAG$,_
shouldve provide a paper on how to assemble them,_
Win Lim,_
Bagus ubat ni,_
skin felt softer after using it,_
Super fast response from seller even though I purchased it at late night,_
Free shipping to EM,_
Herba yang bagus,_
"The response from the seller is very fast and friendly, the item has arrived quickly, the quality is good",_
Xiexie!,_
dh jd regular cstmr dh,_
Has repeatedly ordered with the seller,_
Scarf received,_
🥳🥳🥳🤍🤍🤍🤍,_
mula mula smapai macam besar sangat bila dah lipat just nice,_
Dah 3 kali beli puas ati dengan baju baju nya selesa sangat sangat,_
"Hi , brg dah selamat sampai",_
Hari yg sama buat payment,_
yg ni material macam tisu je,_
kain tebal elok belum try lagi tapi rasa rasa tak panas kot,_
Design:Firstime beli,_
Terbaik terbaik terbaikkkkkkkkkkkkkkk terbaik terbaik terbaikkkkkkkkkkkkkkk terbaik terbaik terbaikkkkkkkkkkkkkkk terbaik terbaik terbaikkkkkkkkkkkkkkk terbaik terbaik terbaikkkkkkkkkkkkkkk terbaik terbaik terbaikkkkkkkkkkkkkkk terbaik terbaik terbaikkkkkkkkkkkkkkk terbaik terbaik terbaikkkkkkkkkkkk,_
"Asked whether he was disappointed, Ahmad Faizal who is also Perak Bersatu chairman said: My feelings are irrelevant here",_
Taste:Delicious creamy but light,_
"Very fast received, the watch look nicely but not yet try it",_
dapat bg hadiah tepat 27/5,_
Kain okey cuma bahagian bawah terlalu fit,_
"Coverage:nice coverage, fine powder",_
Thank you seller give free gift for Hand Sanitizer,_
But service out,_
Kain agak nipis sesuai dengan harga,_
saya suka saya suka🥰🥰,_
Gnknkj,_
tak kemek,_
Lighweight,_
Kain bedung yang sangat lembut,_
Item receive and in good condition,_
THANKYOU FOR THE FREEGIFT,_
Twitter handle s04kr,_
Tp ada 2 lampu yg kemek belah tepi tu,_
I'm love it's,_
Saya Bagi Lima Bintang,_
MURAH PLUS BERKUALITI SANGAT KAIN DIA BEST SEDAP BILA PAKAI SEBIJIK MACAM JENIS YG MAHAL !,_
"80 je, tapi sebab guna cod runner suruh bayar RM52 pula",_
Sesuai lah utk kegunaan harian,_
kain lembut gila cantikk,_
Kenapa kok nggak bisa login?,_
Dah cek,_
"Penghantaran laju,basikal pun sapa elok",_
TQ shopeeeeeeeee,_
second order 12,_
pakai pergi dekat2 okay la,_
"Cantik lampu LGBT ni, boleh buat ala ala disko low budget",_
"Quality:quality terbaik, jahitan kemas and tak mcm seluar murah",_
Mmg sedap pakai lepasni nak beli colour lain pula,_
kualiti A +++,_
He noted Hasni's administration was too shaky with a one seat majority,_
padan la dgn hrga ye,_
Quite comfortable~~,_
kene beli L lh,_
Aroma:🤤🤤🤤,_
Wkkkkkkkkkkjjkkkkkkkkkjjjjjkkjjjjjjjkkkkkkkkkjjjjjjjj,_
tp brg masih ok,_
"Meanwhile, ASB's allocation in international investments increased from 5",_
"senang sangat untuk connect dengan phone, sangat laju",_
Ame su decoración!,_
dpt plak sekali dgn psil box tu lg ank suka,_
wangi gak weh,_
20 million wala surprise reveal karo nahi to minecraft ka video dalo,_
Ingat termasuk sekali,_
- dua brg utk bonetboard dan armrest box,_
barang semua dah sampai,_
sblum ni beli kt luar longgar ma kena ikat dgn getah,_
Effectiveness:murah dan best kualiti,_
malam hantr nye,_
Clear acoustic,_
"Pernah guna ip punya yg ori, nak kata exactly the same tidak, tapi meyakinkan",_
barang sampai dengan selamat dan bai,_
"Order in 04/07, received on 06/07",_
please fix it !,_
Barang cepat sampai bungkusan yang mantop,_
"Seller shipped pon cepat, laju je sampai!",_
"Semoga,",_
kena amik saiz besar sikit dari yg biasa,_
boleh check kat YouTube,_
I can't ignore a cute stuff,_
Sudah sampai hehe walaupun stuck banjir parcel saya tapi takpe delivery nyee lajuuuu hehe masehhh 🥺,_
"A highlight is the beautiful range of footwear, which includes square-toed brogues embellished with white stitch braided embroidery and sneakers in patina leathers",_
ibu2 pregnant n menyusu pleaseee beli nursing bra ni,_
