Sentence,Tagged_Sentence
"For Hussein, who said he left Iraqi Kurdistan because of corruption and the challenges of finding a job, the hawala system was an obvious choice because it's commonly used at home as a way to transfer money",_
senang berurusan dgn seller dan harga berpatutan,_
tangkai tu sgt okay i luve it hihihi,_
t kena beli extra plastik roll,_
45 am - vs,_
kualiti jugak,_
Just dissapointed sikit sbb jenama lain2 rupanya,_
Dah semuanya warna hitam,_
Peghantaran agak cepat,_
He says the discontinuation of the Home Ownership Campaign (HOC) and moratorium by the central bank are contributing factors to the subdued luxury condominium market this year,_
Barang sudah diterima tapi belum dicuba lagi,_
kain cantik sama mcm yg diiklankn,_
Nombor Kad Pengenalan,_
all ramen packages received in good condition,_
Pictures are very clear and high quality!,_
hantar rapat tangga,_
"Warna cantik gilaaaaaaaaaaaaaaaaaaaaaa, nah ni swatches,",_
niii kali keberapa saya order x pasti,_
Apapun kualiti bola sgt baik,_
Beli casing je,_
kos operasi pn da naik,_
Tebal n tahan lasak,_
"Terbaik, tapi tulah sape kaki besar tolong pilih yang saiz besar , jangan malu kaki besar , sebb kalau badan tinggi kaki besar x balance 🤣, kalau yang cakap besarnya kaki kau ,kau cakap balik selalu rembat orang",_
"Gmbr tiada kena mngena, brg ndk smpat gmbr,sdh sampai ke tuan badan,dan tuan bdn suka,tq seller, insyaAllah akan repeat lagi",_
Bought two products of same brand,_
Pendants and rings received in good condition,_
"same as description, original , cheap , worth buy and repeat again",_
Jgn banyak update ram kita kecik admin,_
So better amik XL,_
barang dah selamat sampai cantek ngam,_
InshaAllah semoga brmanfaat pd saya,_
Akhirnya photocard ini mendapatkan binder yang sesuai hahaha,_
Biasa la mula2 nk start main tu loading kejap,_
Kopok sedap berbaloi beli kat sini,_
memang worti it gile la !,_
but I ordered In box packaging but arrived not inbox,_
"And your customer service sucks,",_
"kekeke, ada tgk posting dkt fb dpt ribena fre",_
"But overall okay, since not urgent use",_
"Rather, men go through a decline in androgen levels and some decrease in spermatogenic function due to ageing",_
nti oder lg ye,_
Definitely gonna buy again and want to recommend this shop to my friend!,_
tp sayangnya mapnya gk bisa sampai depan rumah,_
Look OK size s like m size,_
"Parcel smpai dgn baik,cuma jnt punya servis agk lmbt skrg ni",_
Terbaikkkkkkkkkkk cantik tp xtry lg,_
boleh buat match ball,_
"kecik sikit,sesuai baju anak2 untuk balik kampung",_
Jin:,_
x 2 unit,_
Need to wait for a restock then have it shipped,_
Tak pasang lagi barang harap ok,_
Ingat exact size dia 22mm,_
nanti nk beli kaler lain plok,_
"Sangat berpuas hati packaging ok, dpt free gift lg",_
WAJIB BACAA semua ok jerr cuma bungkusan parcel x de bubble wrap or pape mcm x secure,_
Both batteries working well,_
"08tril) on NEOM, a brand new, next-generation Red Sea tech centre that will offer ultra-connectivity to its planned population of one million-plus, and is trialling airborne taxis",_
Barang terbaikkk boleh repeat order,_
Sbb 2nd time jugak hilang 🥴 kali ni beli lebih,_
just harap xmengecut lepas basuh,_
Kain lembut dan cantikk untuk girl,_
"cuma shipping ler kena tunggu sikit,oversea kan",_
"Can't login to the apps by using MAXIS DATA after upgrade,",_
This is Shopee's official WhatsApp account where we will share our latest promotions with you!,_
berbaloi la dgn harga barang,_
Cheap and quality is okay,_
Kalau untuk pakai biasa mungkin cepat tercabut ikatannya,_
n murah beli masa sale 12,_
"Cuma penghantaran je makan masa sikit tapi kalau tak urgent, okay je",_
However some individual masks packaging were opened and I'm a bit worried that it might not be hygienic,_
ukur ok je,_
but size a bit smaller only,_
Sy tinggi 155 berat 79kg,_
Dia suka sesangat,_
Baju ada yg ukuran tak sama mngikut saiz,_
This time bought 2 pillows,_
7620/7646 daripada 4,_
Beehoon all good n not broken up,_
Penghantaran lajuu Yee berdesup haa murah amatt 18 sen only I guess thanks beg cantik smeua okayh,_
seller dah anta awal dahh,_
delivery standard 2 3 wd,_
lembut and nice,_
*Sekolah*:Kafa Dewan Pusat Islam USM,_
"Taste:sedap, kena dengan tekak peminat tegar sambal pedas",_
Dh smpai dgn selamat X sabar nak tunggu novel leena syiha yg akan datang,_
"terletak elokkk,kain labuh elokkk",_
"Perfectly received and working excellent,",_
harga jadi murah sangat²,_
Its so much more natural,_
Texture:thankyouuuuuu,_
dah try macam besar sikit lah,_
Btw nice je beg ni kan,_
Happy purchase and will repurchase in future,_
1 malam sapu dekat 1 sodok sampah mati,_
Mindy Lmy kl gateway mall eh,_
123456890dkawic gjtcjaw,_
thank you seller ^^ my parcel safely arrived <33 cantik je baju kelawar ni and service pon okayy dari seller bcs balas je chat I when I chat them kain nipis but tak jarang for me laa and corak die pon semua lawa lawa 🤍,_
"Apa pun okaylah,boleh repeat sbb ni first try beli",_
Dlm iklan cakap ada Free gift,_
Ni 1st time beli dr sis seller,_
Kalau OK boleh beli LG,_
Children will come running to it,_
"Beliau berkata, jalinan kerjasama pintar dan strategik awam-swasta pada Februari lalu menyasarkan pembangunan kawasan penanaman padi seluas 300,000 hektar menerusi pelbagai kaedah pelaksanaan seperti pertanian kontrak, sewaan atau pendekatan lain yang bersesuaian",_
Harga yg resonable dan penghantaran segera,_
Effectiveness:packing nice,_
pengahantaran cepat dan siap dapat free gift lagi,_
"tpi cube ambik saiz 42, pakai stokin ngam2 pulak",_
"Hi sy ada jual produk dri korea, semua ready stock dan original!",_
"Baju okay, sy suka alhamdulillah, terima kasih seller, ada rezeki will repeat again",_
Gooooooooodddddddddd sannnngggggatttttttttttttt,_
Dah 7 kali beli dengan selller ni rasanye kali ni beli la quality kertas yang paling terbaik antara semua,_
Cute n easy to carry,_
But item is working ok,_
Please advice your delivery partners to be more careful in the future,_
Package was wrapped with 7 layers of bubble wrap!,_
Style: Fashion & Sweet & Elegant,_
akan oder lg nanti,_
Good good good good good good good good good good good Good good good good good good good Good good good good good good good Good good good good good good good,_
Haven't try yet how the spray bottles working,_
Long Expire date,_
Nak pakai jalan pun okay kot,_
"Terima kasih , cepat pantas , baik dan terbaik , bukn teralik",_
Product good quality terbaik penghantaran delivery terbaik,_
I tak tahu la ni warna apa,_
harap brfungsi dgn baik tq again,_
Effectiveness:Sad,_
buat raye haji lh,_
beli utk dia tau,_
Cute and smells delicious,_
"Good value during sale, however delivery took 7 days despite within Klang Valley",_
"The seller's service is very good, have to answer every question, but the packaging of goods needs to be improved",_
Suggestion for beginner,_
So fast and easy!,_
Giler la sgt laju hnya ambik masa 4 hari sj smpi ke sbh,_
Baju cotton sejukk boleh pakai dekat rumah!,_
bukan la ak main smpai larooo,_
baju diterima dgn baik,_
"Super duper fast delivery, 3 days after payment",_
Ambik 1 saiz lebih besar dan ngam² selesa di kaki dengan stoking tebal,_
Should have just bought size 36,_
Dapat pulak masa sales!,_
but overall all of them looks so good,_
"Kain jenis panas sikit,Tp sesuai laa dgn harga",_
Satisfied with the meterials and the price,_
If x okay kita edit smula,_
Effectiveness:A bit slow to get heat,_
Quality:gud quality,_
Kalau utk simpan skincare sesuai la,_
Thank you seller my parcel arrive safely,_
mmng terbaik lh,_
Adoi habis plan aku nak mekap org x de lampu,_
Fast delivery n good service by seller,_
The biggest scam of the food industry,_
"Alhamdulilah barang anak saya dh sampai bungkusan kemas penghantaran cepat, cuma saya yg lambat nilai sbab kurang sihat lepas cucuk Booster ,minta maaf barang semua ok saya sangat puas hati, terima kasih seller",_
Quality:kurang bagus,_
"thank u , seller",_
"Packing ok, seller pack with bubble wrap and box",_
Ada free baju lg,_
empunya baju dah basuh siap2,_
"Next time will buy again, thank you :)",_
Barang sampai dengan selamat dan okay,_
the color soo nice >< thankyou and stay safe!‍,_
Very satisfied and happy with it,_
Item not properly wrapped causing damaged on product,_
Tq dah barang dah terima kain pun mmg ok lembut suka sngt2🥰🥰🥰🥰🥰🥰🥰🥰🥰🥰🥰🥰🥰,_
Kena letak barang dulu baru nampak helokk btw thankyou seller,_
kasih banyak2,_
Several trees which are no longer strong enough will be removed in the process and DBKL will instruct the slope contractor to use the same shotcrete approach there as well,_
"tq (pic n vid are not related srry) btw, STAN TRAINEE A",_
Tahan lebih 12jam,_
It's going okay for now,_
Kalau amik saiz XL maunya xmuat jadi kazanah dalam almari,_
terbaik la dari segi pembungkusan dan rasa,_
nnti boleh beli pulak lain kali,_
"Kemas dan cepat,2 kali dah beli dgn seller ni,terbaik",_
Good packing sealed wrapped in box,_
"After this, will repeat again here",_
"Laman web ini mencatatkan jumlah halaman dilihat (page views) sebanyak 16,440,800",_
Terbaik BoskurrTerbaik BoskurrTerbaik BoskurrTerbaik BoskurrTerbaik BoskurrTerbaik BoskurrTerbaik Boskurr,_
The colour is pretty and the design is sleek!,_
janji cntik hee,_
semua blehh mai bli sini semua completed brg dah nk ship dia sent gambarr padu laa,_
Plg cantik warna sky,_
"Tq dah banyak kali order dengan seller ni, penghantaran laju berdesup, cepat, saya puas hati, memang akan order lagi dengan seller ni",_
"Also, I have to wear singlet inside because the dress is deep V",_
"Namun, bapa banyak membantu hingga saya mula rasa selesa dan tidak canggung",_
"2 in 2020, amid a sharp slowdown in the global economy as a result of the Covid-19 pandemic",_
Beg tu isi dalam dia besar plus kaler dia pun cantik,_
ok la untuk prsiapan msok spital t,_
This seller i first time buy,_
Pelan Tindakan Perpaduan Negara 2021-2030 adalah usaha untuk mengembalikan impian asal mengenai perpaduan yang tersurat dalam lima prinsip Rukun Negara,_
Good one murah dri yg lain tp kualiti okay terbaikk penghantaran cepat t,_
Siapa siapa nak beli inai sahara boleh contact saya,_
semoga peniaga ini dimurahkan rezeki,_
"penghantaran laju superb,kualiti kain standard harga",_
LOVE SANGAT 🥰 PASTU SAYA CHECK KASUTNYA MEMANG ORI 🤭 JACKPOT YE HARGA MURAH GILAK 🤭 SANGAT SANGAT RECOMMENDED,_
yg dpt 5 kotak je,_
"Delivery sgt pantas harga murah berbaloi sgt2 dri beli kt kedai kain mahal ,kain best lembut",_
Thanks seller barang sampai dengan selamat ke tangan saya walau pun lambat sikit sebab banjir,_
Thank you seller barang cantik dan kemas,_
Expiry date on 21/02/2023,_
Terbaik seller semalam order hari nie sampai,_
Ringan dan bunyi tak bising,_
mula mul,_
"laju gk kain okey, kualiti elok",_
"Kasut murah berbaloi beli lawa sgt smua suka belikan untuk anak, adik dan kakak",_
Order hari ni dapat esok,_
no ngelag kyk yg dulu,_
"Well received, i love it and the price is affordable too!",_
Malas nk komen lebih²,_
Functionality:Not very bright,_
That wallpaper is fire,_
"servis lajuuu , bolh repeat lg lepasni",_
Thankyouuuuuuuuuuu 🥰,_
Minus 1 more star until this sluggishness is fixed,_
"Sebabbb beli dekattt org lain,post sebabbb nak kutip coin hehe",_
"Apple is garbage I remember when I got the 12 pro max I was told it has the shareable charging at the back of my phone, so the iPhone 12 pro max comes out OCTOBER 2020 new iphone 13 pro max comes out September 2021 that's just stupid",_
"(siap boleh bukak pasang 3 ke 4 kali, tak risau pecah)",_
better ambil 98cm,_
sepatutnya seller confirmkan dgan sy bru post,_
jarum kecik xboleh,_
Bau sabun wangi sngat,_
"Functionality:kain jenis serap air,boleh basuh",_
Selalu oder dengan seller ni,_
super satisfied and will repeat soon🤝,_
cuma berborak,_
Seluar selamat sampai saiz besar dari pada biasa tapi okey tak ada hal,_
Fast response and workable and nice,_
Well well well well well well well well well well well well well well well well well well well well well well well well well well,_
Real colour darker than advertise,_
"We are seeing extreme polarisation in the stock market if some stocks surged 10-fold, it means others lost in a big way, said An Hyungjin, chief executive officer at Billionfold Asset Management Inc",_
The delivery is very fast and I like the material,_
Digi very slowly,_
murah gila vanilla mcm biasa lah kan bau dia,_
Nnti blh laa pindah ank ank kat rumah bru ni 🤪🤪,_
Quality:3 unit,_
ship out cepat !,_
sgt membantu dan berguna utk mereka yg memerlukan tape yg brkualiti dan harga marhaen,_
Baju labuh je sampai peha,_
dan guna pon,_
Keselesaan,_
sbb cutting kcik,_
"Fast delivery, within 3 days already received the parcel",_
beg murah n puas hati,_
Impressed by the nice packaging,_
Lipstick patah but sokay,_
thanxxx seller n shopee,_
Macam2 perisa ada,_
"Hantar laju, saya ja yg lambat rate",_
And dpt mcm order,_
Bro I think that now finally we can see BGMI videos,_
proper plastic wrap,_
Mydin post out pun sabar gak pui,_
00?>Welcome to XOX 3G!,_
terbaik laa boleh repeat warna lain pulakk lepas ni,_
"to baseus staff, sorry that i get impatient in the chat, too emotional hihi",_
"t afford it ,i have a vivo mobile from last 4years ,sir can u give me a phone,i don&$HASHTAG$",_
com/DREAMB77,_
barangggg mantapppppp then fastttt deliveryyyyy gempakkkk genggg,_
Tayar mmg tahun yg baru,_
"Fast delivery, simple but great packaging",_
GENUINELY HAPPY WITH MY PULLS,_
mmg rushing carikan hadiah Anniversary utk husband,_
Material kasar sikit tp senang bentuk,_
Terima Kasih kerana memberi peluang kepada saya untuk membantu anda,_
Comel je camera dia,_
"A different setback came last month, in the US Senate",_
Penghantaran sgt cpt beli wktu 10/10 sampai 13/10,_
warna pon lawa lawa,_
lawaaa sangatt kalerrr nii,_
Murah and jimat,_
Works perfectly on DP 1,_
1 hour wait just to maybe find a driver,_
POOR COSTUMER SERVICE,_
"Tp syg, 1 kaler bendera yg biru tu mcm keluar warna sket",_
berbaloi dgr dgn harga,_
Hanya perlu teruskan untuk terus berjuang kedepan,_
Kualiti video tiptop,_
Tidak rugi jum beli puas hati betull korangg kene beli,_
Material and finishing premium quality,_
"Taste:semua ckup, air elok je x tumpah",_
Fast shipping by seller but shopee xpress courier hold my parcel 4 days,_
Beli hari ni esk dh smpai,_
"Murah pun murah, penghantaran pun lajuu",_
Functionality:Good good good,_
Price are so much cheaper than other store,_
"Servicenya sangat bagus shipping pon cepat, barang pon berkualiti",_
sampe jm,_
"Trusted n responsibility seller, reply all my queries before n after sales",_
Ball-bearing & phone grip is good too,_
"Fast delivery and bubble wrapped in good condition, superb!",_
It's not my fault my order is not complete & yet I'm the one who have to suffer!,_
Pat Cummins made a dream start to his Australia captaincy with a five-wicket haul as England were skittled by tea before rain brought the opening day of the test to an early close,_
Good job seller 5 stars for you!,_
"Terbaik,Terbaik,Terbaik,Terbaik,Terbaik,Terbaik,Terbaik,Terbaik,Terbaik,Terbaik,Terbaik,Terbaik,Terbaik,Terbaik,Terbaik,Terbaik,Terbaik,Terbaik,Terbaik,Terbaik,Terbaik,Terbaik,Terbaik,Terbaik,Terbaik,Terbaik,Terbaik,Terbaik,Terbaik,Terbaik,",_
"Excellent packaging, faster delivery, delicious",_
Kasut sesuai pakai dengan jeans atau kain tak sabar nak pakai,_
"Received yesterday with good condition, not try yet with chocolate taste will repeat order if good taste",_
"Penghantaran cepat, harga pun sangat murah",_
Excellent service by seller fast delivery and good value for money trusted seller,_
Jadi terpaksa tak jadi bagi,_
Asalkan dapat jalankan tugas jadi la,_
penghantaran yg cept kemarin buat payment hari sampai,_
Dapat freeeeeeee 1 item,_
Harap lepas ni shopee boleh perbaiki perkhidmatan sebelum customer beralih kepada E shop yg lain,_
my cat cakap trima kasih kat seller,_
bright color,_
s fan since P20pro and keep upgrading to the latest one but watching at 4k60fps video recording looks shaky which is bad and you just said it all good,_
Texture:blm cuba lagi,_
Serendah rm8,_
Really good productvery sturdy packaging fast deliveryand get free gift also,_
Pigment:So so but best to wear,_
Robot Vacuum dh smpai,_
Good good good good goood good good good good good good good good goood,_
xtau la klo deliveryman yg koyakkan,_
"Nice packaging, good value for money, good product quality",_
it's been done every which way you can,_
Anak buah aku cakap macam glove orang main bola,_
"Recommended seller, very good service, nice packaging and fast delivery, thanks seller",_
The item has arrived and arrived according to the color and my order,_
tkdelah zassssss pun tapi ok,_
Tqtqtqtqtqtqtqtqtqtqtqtqtqtqtqtqtqtqtqtqtqtqtqtqtqtqtqttqtqtqtqtqtq,_
"hari ni oder, smlm brg smpi",_
Dahla murah kualiti takyah cakap ah siap kotak dia bagi mana nak dapat hampa,_
You make me feel like eleven,_
"Effectiveness:Klu budk pndi guna, mmg boleh berus semua gigi pada masa yg sama",_
tpi blm psg kt kereta lg,_
"Barang selamat smpai,cuma blm sempat pasang,harap² ok la",_
"Received item in good condition, material good quality bila pakai sejuk tak panas thanks seller",_
"27, will be the third blank-check company to list in Singapore",_
Barang dah smpai dengan pantas dan selamat 🥰🥰,_
I like the controller,_
dan Penempatan Tangki-Tangki Statik,_
Maksudnya just nice jekk klu korg saiz M amk lah L,_
"Very fast delivery, packed well too",_
"Lembut, quality bagus, boleh guna bila dah keluar hospital, murah pulak tu",_
"suit me well ,",_
Hv to get use to turning it ON,_
"Servis cepat, barang sampai selamat",_
🤝 Okay,_
Taste is good and not too spicy,_
Kualiti jugak baik,_
parcel take forever to came to my house i know it already lost and seller dont care about this :),_
"Design cantik and kain pon lembut, boleh buat blankets untuk baby, murah sbb dpt 4 pieces terus",_
"Luckily mine no ripped holes, no defect",_
Murah tapi sangat comfort!,_
Saya anak kedua dari tiga beradik sudah lama terputus hubungan dengan keluarga yang tinggal di Kluang namun saya tidak pernah melupakan mereka dan sentiasa berdoa supaya berpeluang bertemu dengan mereka,_
"Cendana's funding programmes included the Create Now, Performing Arts Presentation, and Arts Venue Recovery platforms",_
"Ruang besar muat laptop, tablet, buku2",_
thnks penghtran yg sgt pantas,_
Happy with the baju kurung moden,_
Free basic,_
Model video dan gambar sekadar hiasan,_
Fast delivery and decent for it's price,_
Suka gila 🥰🥰🥰🥰🥰🥳🥳🥳🥳🥳,_
Barang sudah di terima tqtqtqtqtqtq seller,_
tdak mudah rosak dalam perjalanan,_
kena try dulu baru tau berkesan or x,_
Syukur barang dh smpai cantik comel tqtqtqtq 🥰🥰 kain cantik lembut sedap di pakai xpnas sejuk je terbaik 🥰🥰🥰,_
hahahahaha Tp skrg I lebih confident,_
boleh la wat g keje padan dgn harga ape2 pn thnk seller & shopee x press 5 star untuk anda semua,_
- Item arrived in good condition,_
You need to add secret ingredient MSG haiyaa plz no chile jam,_
Friendly + helpful seller,_
Trim kasih daun keladi,_
Fast Delivered and good product,_
Harga pon murah tmbh² kalo ada coin lg murah Penghantaran kali ni lewat sikit tp ok la seller bgthu Tq seller,_
Quality is not bad for a price like this,_
Okkk very good,_
"Kain sudah sampai,kain dpt sma mcm dlm gambar",_
chat pn reply cepat,_
"Saya try 3 jenis saiz, setiap saiz saya beli 5 keping so maybe secure sikit",_
Sangt rekomandekkkk,_
Both banks could not be reached for comments,_
Ada soft sensation gitu kt kulit,_
"Dengan seller ni,quality baju mmg super harga murah,dah siap dobi wangi je",_
Very very helpful app amazing 🤩🤩🤩 all Foodpand owners and workers best decision for people help 🥰🥰🥰🥰🥰,_
Good service and fast delivery thanks,_
Where is your brother?,_
Fast delivery n cheap during 12,_
Len kli bleh repet lg,_
beli utk hamper,_
"Long expiry date, very fast delivery, packing is good too",_
be/5luXCSIfjUg,_
kaca dia mcm ada tampong² and plastik penutup tu ada 2botol yg terkopek,_
dan brg dibungkus dgn kemas,_
"(Reuters) -Recruiter SThree posted record annual profits on Monday and forecast double-digit growth this financial year, driven by a global hiring boom as firms rush to fill vacancies and invest in the recovery from the pandemic",_
"Allhdllah smpai jgak bju mndi yg diorder,wlaupn seller lmbat bgthu xckup 2 hlai utk corak yg sme,trpksa tkar corak yg ln je",_
I always remember that match with a smile but I know it's going to be a different match this time,_
Siapa yg tgk rating aku ni,_
Easiest way to get the newest shoes period,_
cantik belilah,_
Packaging bubble wrap n looked okey but when open the item is broken,_
Great customer servicewill definitely buy from you again,_
30x40cm good as normal size,_
ukuran baju pun mmg sesuai dgn sy tggi 154 berat 65,_
"I'd never played (Thanos) before, or seen him play",_
Huhuhu jadi belum boleh pakai lg,_
"Berbalo baloi la beli,nanti repeat lagi",_
cuma perlu tukar currier lain,_
double plastic,_
And they are the cheapest,_
Bole repeat sbb kain dia sdp en baju dia style,_
Bulb ok terang giler,_
baju cantik dan saiz pon ngam2,_
"Beli sbb bantal kat hostel tak gebu, nak buat double lah bantalnya",_
"(Video tidak berkaitan) Brg selamat smpai, thank you seller!",_
Had to wait again,_
buying again!,_
Taste:quite spicy but still can tolerate,_
"Goods rceived but not yet try due to machine is pre-order, hope is good",_
Quality:Not really BOSCH' that why chip,_
seluar cantek tq free gift baju comel gila ‍‍‍‍‍‍‍‍utk bdak bdak,_
ukuran pn sller basi lbh,_
"sbb bujet klu lmbt sminggu,Ok lg blh diterima",_
Ok lah jugak,_
Tp ok la kot,_
Y lain okey cuma y hitam jahitan senget,_
pdn la gn harga,_
Barang smpai cunnn,_
murah lagiiii,_
Btw dah cuba,_
"5 to 4,500",_
berjimat² skg smua naik harga,_
brg mcm dlm iklan,_
palazo pun cukup utk size xxl,_
SO CUTEEEEEE BUT MY FEET PANJANG HAHAHA TAPI OKAY JEE CAN STILL PAKAII,_
"Thanks seller , Shopee and the courier service company",_
Texture:Oily and fragrance,_
Like the lipsticks as they are easy to use and very well pigmented,_
Kain jenis stretchy material sejuk,_
Anak tanya kenapa beli seluar besar,_
$MENTION$ Scream betol,_
thanks salers,_
Comfortability:okay,_
masa penghantaran pon ok la sbb dr overseas kan,_
For me its a bit besar so kena pkai brooch kat belah bawah kasi ketat sikit,_
I complain one package is broken seller immediately refund to me,_
ank umo 6 thn seeloknya ambk saiz 8 ke atas tp dh bli blhla pkai utk raya haji nanti,_
Pada bonda tercinta,_
sy borong buat stock,_
barang sampai dengan baij dan selamat,_
Postage n packaging pon nice,_
III yang masih belum diteroka sepenuhnya di daerah Balingian,_
Bila pegang boleh rasa kain jenis panas dan nipis dan kasar/kesat juga,_
"untuk solar charge sangat slow, ambil masa 3 jam untuk capai hanya 1/5 bar",_
Nanti sy repeat lagi!,_
Pertama kali beli syrup,_
Warna merah dia lawa🤩,_
Well received well wrapped with thick bubble wrap,_
really fast!,_
3w sunscreen - kali ke-2 sy pkai,_
Strap produces noise with hand movement as shown in the video,_
(•ᴗ•)(•ᴗ•)(•ᴗ•)(•ᴗ•)(•ᴗ•)(•ᴗ•)(•ᴗ•)(•ᴗ•)(•ᴗ•)(•ᴗ•)(•ᴗ•)(•ᴗ•)(•ᴗ•)(•ᴗ•)(•ᴗ•)(•ᴗ•)(•ᴗ•),_
"Quality:kualiti memg tiptop, tak nipis material macam 100 cotton",_
Button cannot unfastened,_
Absorption:entah apa entah,_
sampai cepat dari kilat,_
I ordered 90 and the rest is packed in that little ziplock I'm vv satisfied!,_
sangat2 nyaman,_
Beli untuk mak kirim,_
penghantaran cepat kualiti terbaik packaging,_
and done installed,_
The Material is good but the xxl size is like m size,_
Ada notifikasih dari bang medy langsung kaget karna bang medy rievew donat,_
Seller very friendly and responsive chat dulu sebelum post out,_
kain x terlalu tebal x terlalu nipis selesa la tok paki d rumah,_
Sy pakai double tape sndri,_
Kejap jer boleh koyak dah,_
"respon chat laju, send jawapan pon laju",_
26/3 - item ship,_
tapi so far berpuas hati,_
sarung je dah siap huhu,_
Police received an emergency call from the public and rushed to the scene with a team of firefighters to conduct a rescue operation,_
"Definitely value for money, wayyy cheaper than market",_
makan dengan bubur rasa nak tambah je,_
WhatsApp+601111832312,_
My first and probably last,_
Comel waffle maker ni,_
The product also looks really good,_
"Kasuttt okayyy saizzz punnnn ngamm takyah amek besaq sikit ka apa , colourrr pun samaa jaa macam gambaqqq",_
Taste:sangat sedap dengan aroma yang harum,_
"then dia punya kepala dia tu , tak kena dgn ukuran leher so tak boleh nak sarung dkat kepala",_
No defect on unit n remote control / manual button all function well,_
"Alhamdulillah barang selamat sampai , ada yang dah rasa memang sedap",_
"Fast delivery, good quality, no damage, very cheap",_
terbaik seller response,_
Beg cantikk kualiti bagus semua ok,_
Baby prem pun belum tentu lagi muat nk pakai,_
papepun tq seller untuk produk yang bagus,_
"Nice , faster , good , will repeat my order",_
Drama Kisah Cinta Kita mengisahkan watak Alisa (Amelia Henderson) yang terpaksa menyamar menjadi Natasya demi membiayai kos pembedahan Ibunya,_
blh shopping lagi,_
kain die pun best,_
Cuma igtkn size besar,_
Mantap pak abuuuuuuuu,_
Softens even with just room temperature liquid,_
"It's my 1st time buying from this seller, but very fast delivery!",_
Thank you barang dah smpai elok jer tak ada yang rosak,_
Terus banyakin promo biar driver sejahtera,_
pakai dlm rumah je,_
mantoolllllllllllllllllllllll,_
Requirements:,_
Small easy to carry anywhere you go suitable for basic used,_
Dia punya leather pun macam beli yg mahal,_
Cuma sellers lambat nak ship out barang tapi sampai laju,_
Tp status dah di shipped,_
"Parcel received in good condition with well packaging, good value for money, will buy again",_
20 sen from 11,_
asal order kaler silver,_
"App McD sumpah sampah,",_
