Sentence,Tagged_Sentence
Please beli korang berbaloi dengan harga terlampau murah kalau nak di bandingkan dengan harga seller malaysia ni,_
Not sure how im feeling bout it,_
s sleeve,_
"j&t pon laju vacum functioning well,",_
Selipar tak de cacat,_
kemek sikit but thats fine,_
TERIMA 16hb,_
Product quality yet to put to test,_
Bg dekat anak,_
casing tebal pon tebal,_
Sekian Banyak Promo GrabCar Yang Dipajang Ngga Ada Satupun Yang Bisa Dipake Di Apps Saya,_
Harap dapat menyusu sampai 2 tahun,_
Tak rimas sangat,_
Servis 5 star boss,_
Selamat sampai dalam keadaan baik memang suka guna pes jenama ni,_
"tapi courier lambat,peram barang saya seminggu sampai saya terpaksa pergi ambil",_
Love the 2x heavy duty multipurpose spray,_
"Boleh pakai jalan2, santai2",_
"Recommended sgt, murah tapi berkualiti",_
Material kain merah licin biru cotton,_
I am satisfied with all the products i purchased,_
Yee Tze Jing,_
dah 2-3 kali basuh kain dah xcantik,_
"5 , showing Chinese cities' home prices are fundamentally stable, said Xu Xiaole, chief analyst with the Beike Research Institute",_
"Majoriti kematian yang direkodkan adalah di wilayah tengah Visayas, destinasi utama penyelam di wilayah Bohol, antara beberapa destinasi pelancongan paling popular, dan wilayah Caraga di timur laut Mindanao",_
Nicely fit my ssd and easy to install,_
"PETALING JAYA: More listed entities are raising funds via private placements in the fourth quarter as companies rush to take advantage of a relaxed ruling, which allows them to place out a higher percentage of shares, before the window closes on Dec 31",_
*4 star sbb kain ada kotor dan utus benang🥴,_
Slow postage but overall superb,_
Seller terbaik penghantaran yang cepat dan bungkusan yang kemas,_
penghantaran cepat semua ok,_
its always been my dream to own 1 🥺🥺🥺 $MENTION$,_
"Tried basil chic n green curry, panang yet to try",_
xberbaloi ngn harga,_
"Maaf gambar takde sbb belikan untuk orang,stakat ni brg smpi cpat xda masalah",_
Kamus Dewan Edisi Keempat mentakrifkan stigma sebagai sifat atau apa jua yang dilihat boleh menjatuhkan maruah dan mendatangkan keaiban atau kecelaan kepada sesiapa sahaja,_
awaning sng bentuk,_
Let it be the best phone ever yet I won&$HASHTAG$,_
(jangan lupa dilute kalau nak sapu kat kulit yeeee),_
"I am able to see the store receipt but not the online purchases,",_
Tak jemu layan pertanyaan customer yang agak memilih ni,_
The case is being tried by Judge James Boasberg of the U,_
i dah amalkan almost one year,_
tq bang saya beli dgn harga nya semoga sentiasa dimurahkan rezeki dipermudahkan segala urusan serta sihat² selalu sekeluarga Aamiin² Ya Rabbal Alamin 🤲,_
getah yg cepat putus baru nak pakai dah putus,_
nak cancel baru nak post ‼,_
this feels like being ripped off,_
"So guna ni kk, murah pun murah",_
"The implementation requires the involvement of all parties at all planning and development levels, be it federal, state or local government stage, he said in a state- ment released after the meeting",_
"All item received, but the colour",_
"jointly shape global norms for emerging technologies like social media and cryptocurrencies so that they are used to empower democracy, not to undermine it, Modi told a virtual summit hosted by U",_
Ada kosong tarikh 28 dan 29 jan ni,_
Beli Kali Kedua,_
"Harap Seller dapat bertambah baikkan lagi cara pembungkusan supaya barang² tidak berlaku kerosakkan, terima kasih🤘",_
"Although the shipment is a bit long, but i don't regret the quality of the product",_
27/7/21 - 31/7/21 RM3⃣0⃣,_
Penghantaran yang pantas dan wallet sngat2 lah cntik,_
"terbaik,dapat superhero hoodies",_
My expectation on this skirt is biasa2 tapi bila dah basuh n gosok sangat2 cantik ya flowy gila dan selesa,_
!i loikeee!,_
Sangat berpuas hati dengan kualiti baju,_
Jenis kualiti kain memang elok,_
Best tapi tak pernah best,_
This phone looks absolutely amazing,_
"Kain sedap pakai, anak saya umur 5tahun, saya ambik saiz 110cm je",_
delivery very fast then expected eta,_
This was my 2nd purchase from this seller,_
satin tapi tak berkilau sangat !,_
Fast delivery and item not bad,_
Puas hati bag cantik besau anak suka,_
I dont know salah courier or seller,_
"tqsm seller,post cepattt",_
"25 petang, semua pelajar terbabit aktiviti luar dan menyedari asap tebal di bahagian atas sebelah kiri asrama pelajar berkenaan",_
Cheng Suyin,_
tak mcm benda murah,_
Cantikkknya,_
No damages on the snacks packaging too,_
Nice as a gift as well,_
Bungkusan kemas Penghantaran pn cepat,_
"Tengok kualiti & saiz okey,so beli utk semua bilik",_
harap suatu hari nanti safety shoes ada saiz khas untuk kaki perempuan,_
my daughter likes it,_
gambar dan video beg takde sbb beg beli utk org lain,_
wangian yg menenangkan,_
Some more?,_
Seller well packed the parcel genuine cartridge,_
terima kasih sorry gambaq tiada kaitan,_
0 pen Drive,_
Long time no c,_
nanti oder lagi dri kdai ni,_
barang sampai dengan selamat bungkusan terbaik kemas cantik barang tidak berat sangat,_
Tak pakai lagi tapi sesuai dengan harga,_
Perfectt,_
Cupnya okay sesuai untuk saiz breast yang bengkak susu,_
worldpostonline,_
"Thanks seller for the good deal,",_
Colour are beautiful soft pink,_
"Excluding the steering wheel emblem, the rest comes in two parts, you'll have to line it up yourself but that's fine",_
"I understand Sue Gray has found the email from a senior official to PM's principle private secretary Martin Reynolds warning him the 20 May party should not go ahead, Robert Peston said on Twitter",_
"Parcel dah sampai prcel dh smpai , tq tq tq tq",_
Good services from personal shopper,_
"Kami juga memanfaatkan platform digital kami untuk memasarkan produk dan tawaran kami secara strategik kemudahan pelanggan dalam menyelesaikan urus niaga dalam talian, katanya dalam satu kenyataan baru-baru ini",_
Bgkusan mcm neh jew ptut saller perbaiki lagi cara bgkusan,_
Ok penghantaran yang pantas,_
free gif cookies,_
17 peratus,_
I've read somewhere that the rotating bezel is much more precise on the classic while the one on regular one can skip around a bit,_
like alwys puas hti sgt,_
okla seller layan,_
tetiba nampak kt shopee 2,_
yg haritu baru cek separuh jumpa 1 kemek tp blh betulkan sbb sikit je,_
barang okeyy kain okeyyy saya sukaa boleh repeat lagii,_
Taste:Not so sweet and nice!,_
"Amihizam berkata, semua 216 warga asing ditahan untuk siasatan lanjut mengikut Seksyen 4 Akta Hiburan, Seksyen 22(b) Akta 342 dan Seksyen 6(1) Akta Imigresen 1959",_
"Sticker tebal, gam pun okay",_
tqsm seller barang sampai dalam keadaan baik sangat berpuashati penghantaran yg laju terbaik,_
sori gambar xda kaitan tp brg dah digunakan dah buat camping,_
tapi seller pos lambat sikit,_
Packing pun kemas siap bubble wrap,_
"takpalah, nanti sy alter",_
"Alhamdulillah barang sampai dalam keadaan yang baik 🤲🤲 Seluar palazo yang cantik Kain yang bagus berquality Design yang menarik ,ade dua poket",_
dah pernah beli sbelum ni,_
Thank you selera🤗,_
"Material:Black, Xs",_
Mcm mahal kan,_
beli yg ni sbb tgk kt tele yaya HAHAHAHA,_
"Agak terkilan kerana kalau di sini, ini adalah ilegal (cetak rompak)",_
kopi menjadi,_
tp ok je sbb xde yg patah,_
Seluar yg sgt selesaaaa,_
Lepas ni nk try matcha/green tea pulok,_
Tpksa tunggu je la,_
"First thing first, tq utk free gift",_
harga jimat poket cermat,_
Quality:sgt2 nice,_
Fast response good service amazing customer service repeat many times alr,_
"(152cm, 54kg)",_
Thankyousellerterbaikkkk semua barang sampai dengan selamat,_
pa pa pun kasutnya saya suka,_
"Good thanks, but It's only for adults not for kids,",_
"So far penghantaran cepat dan dalam keadaan selamat, barang tidak rosak dan bila dipasang, semuanya okay",_
overall very recommended to buy this product,_
But my one month old will outgrow this soon,_
Dah repeat banyak kali masih nak membeli lagi,_
"Memang cantikkk sgt,smpai cpt,brng ok",_
"Sambutan Ulang Tahun Hari Keputeraan Rasmi Seri Paduka Baginda Yang di-Pertuan Agong Tahun 2021 di Istana Negara di sini, hari ini",_
m sure it will be a fun phone $MENTION$,_
cuma penghantaran Shopee express jer yg lmbat,_
warna dia pun cantik sgt,_
paling murah kot kucing i suka thanks,_
yg pantasssss🥰🥰🥰🥰🥰🥰🥰🥰🥰🥰🥰🥰,_
"Senang sikit, kalau x, penuh handbag ibu dgn hp anak2",_
penghantaran lama la sikit smpai,_
Penghantaran cepattt,_
harap tahan lah kainnya sbb jenis memeri kan,_
Besar yaa sy ingat kecik jaa,_
One of the best I've ever received,_
Packaging kurg sikit,_
Banyak pilihan perisa makanan yang sedap - sedap,_
Harap seller ambil hati,_
Sekali tu ja balas,_
Semoga melingkup selagi Tak ubah polisi,_
"Sorry no picture, but my sisters love it so much!",_
Boleh buat as bacpack,_
Lawa baju,_
I am very happy to get it,_
Taste:GOOD QUALITY,_
Finally jumpa pun seller yang jual murah maybe sebab 18sen sale huhu tq so much seller it works well,_
",KF94",_
"Fast delivery, berat 85kg tinggi 160cm xl besar skit bila pakai and labuh skit tapi semua okay kain best",_
The battery was DEAD,_
The double sided tape not strong enough but good value for money,_
feel better,_
Always repeat order here tq seller,_
seller pun responsif dan membantu,_
Pihak industri sudah lama memperjuangkan satu undang-undang kawal selia serta sistem pencukaian yang konklusif bagi produk vape bernikotin,_
Bang Medy: sangat barbar Mama Medy: sangat sopan Papa Medy:serius tapi detail,_
I cant login my apps with password expired and then not receiving any email for resetting,_
So lovely so syantik,_
Kasut juga cantik dan harga berpatutan masa sale,_
x leh minum selalu perot jadi pedih,_
The iron works perfectly and i love it!,_
REKOMEND,_
Разве это яйца пашот,_
"Parcel selamat sampai, cantik² semua",_
PETALING JAYA: National para archer S,_
"And i chose XXL, it's the loose size for my body",_
They introduced it as coffee candies for kids and now the Japanese are one of the biggest coffee drinkers in the world,_
Tambah ada tray bole kukus pau jagungg,_
xputih pun,_
"Огромное спасибо за перевод на русский,",_
Battery health tak dpt detect,_
Abuse those I love,_
Quality:good tebal,_
Product by Sembonia memang sempoi,_
Barang sampai sengan selamat,_
Quality:sangat bagus dan tebal,_
"I ordered 2 sets same size L,but the other one is smaller",_
"Received in good condition , fast delivery, worth value for money",_
"Good material, size quite big than usual, will buy more, excellent service",_
Antena selamat sampai,_
Kualiti ok belt ni,_
Jac Tan I want this,_
Nanti insyaAllah boleh repeat order lagi kat kedai ni since harga murah dan kualiti pun baik,_
enough 30 pcs,_
tu bagi berseri seri sket lagi,_
"Barang baikkk, cantikkkthankyou seller nanti repeat lagi",_
I dont like it on the lips BUT love it on the cheeks,_
"So far, sgt berpuas hati",_
barang baikkkkkkktiada rosak,_
"Beliau berkata perkara yang paling penting dalam perancangan grid ini membabitkan empat komponen utama, bermula daripada sumber air, loji rawatan, cara penghantaran dan prospek pengguna itu sendiri",_
"Effectiveness:I bad severe eczema and when I first bought it,it worked totally fine with me",_
Seller jugak sangat bagus sbb byk kali saya tnya dia reply baik je,_
Beli banyak-banyak senang nak buat freegift dan untuk kegunaan harian juga,_
The 93-year-old heritage building was transformed into the Situlah public digital arts showcase,_
Service from this app is not good,_
thnk uuuuuuuuuuuuu,_
Bhg bawah guna langsir,_
"The fastest and the best services,",_
The boots are great quality and comfy and I'm placing another order for myself,_
"saya sebenarnya order black tapi tak kecewa dapat biru sebab service seller ni laju gila, so saya cam takpe la biru, ha pastu laju gila sies, ingat tak sempat sampai sebelum balik kolej tapi sempat, so cam korang kene beli dengan seller ni, quality luggage dia pun the boommm, hehehe <8888",_
Tp blh la utk emergency,_
"Brg ok, cuma xde button utk control heli ke kiri atau kanan",_
"Terbaiklah bos,",_
Very good item to buy,_
So this is what they did with oneplus regular line up few years back right?,_
Brg cpt sampai n sampul pun baik,_
X sabar nk bg baby mkn,_
Delivery yang pantas dan selamat sampai,_
"So far okay je, semua lock ada, tapi kene fikir sendiri mcm mana nak pakai,",_
my order safe arrive,_
"Baju cantik, saiz ngam mungkin",_
Barang smpai lajuuuuu,_
Dah sampai occ smua okay terbaik ada satu jer xleh gunaaa yang lain cunnn bebaloii lah juga beli dpt free flvor g terbaik gilakkkk,_
"Sukan baru ini adalah lebih sesuai dengan generasi muda, selepas ini mungkin eSukan pula",_
Kalau cepat cepatlah,_
"dari china kan, makanya lambat lah",_
Received the items in good condition with free gift,_
"I swear that the quality of this fabric was very nice, cool, light and soft, now im wearin in winter ice colour",_
Should buy a bigger size but unfortunately none in stock,_
Barang terima dengan selamat dan ok,_
product: quality is good,_
sim card semua ok boleh masuk,_
"Empty spaces, what are we living for?",_
senang nak tanyaaa,_
Taste:local maggi curry,_
25hb ord 26 smpai,_
Mpu milik,_
kecewa sedikit dgn kualiti,_
"Tq seller,delivery ok",_
wangi kecik and bagus sangat,_
Received with good packaging and condition is good,_
"Barang elok, function well harga pon murah berbanding kat kedai",_
"KUMASI, Ghana (Reuters) -",_
beli tuk bwk travel,_
penghantaran tersangatlah pntas,_
nak jungwon teddy bear or sunoo doll tapi bersyukur je apa yg 🤭🤭🤭,_
Barang baik paduu,_
tertarik utk minum panas panas,_
"Very fast deliver, this is my",_
Kecil dan berguna,_
Btw barang terbaik just plug in dan on siap dh boleh guna tq ya,_
"Secndly, this app is soooooo slow",_
Ive been using this for over two years and today I just can't login,_
Goood goood goood gooood gooood gooood goooood goooood gooood goooooood,_
"Thank you also for delivery team,",_
"Quality:Good, noodle size medium like pan mee",_
Good quality bags,_
"barang sampai dalam keadaan baik,good packaging,love it so much🥰",_
POS is no doubt the slowest courier service in Malaysia,_
"Paking ok,",_
Item received in good condition quality okay lah,_
alhamdulillah third time repeat mmg seller nie terbaik dari semua 🥰 terimakasih sangat,_
Tpi time pakai rasa ringan,_
Packaging mantap n laju barang sampai,_
thnkyou seller also fast shipping 🤩,_
It does that by keeping some PC activities running during sleep,_
"Packed and received in good condition, fast delivery, thank you",_
It is at least 10 slower than my recently bought new Samsung original,_
2nd time beli_cutting jenis slimfit-kena beli sz 2x lebih besar dari sz biasa(utk jenis perut bahagia),_
Terima kasih barang sampai dalam keadaan baik kualiti barang cun sangat memuaskan harga yang berpatutan terbaik seller pengantaran pantas,_
Raket cun gilerr,_
"Mudahnya, tinggal bagi link n email je nnti dia akan Post jwpn kat email",_
produk kain cantik penghantaran lambat sikit tapi servis ok,_
good penghantaran sangat cerpat boleh beli,_
"Terima kasih, barang dah selamat sampai, semoga murah rezeki",_
Fast delivery after cny la,_
hihi btw tq taw seller,_
Satisfied with color n material,_
Kawasan rumah dah la banyak anjing liar,_
Memang berbaloi baloii,_
Products received in good order-very fast delivery considering shipping from oversea,_
"thanks seller,next time will buy again",_
moga sesuai la dgn anak,_
a bit baggy but i love it sm,_
First time buying and boiling,_
Basic nude,_
"nice padan dengan harga, tapi untuk orang kurus and kecik cantik",_
"Thanks, brang Selamat smpai, nanti sy mw repeat order lg yah",_
Good though,_
cantik stg2,_
Mma beli ngan seller ni je,_
nmpak cam mahal,_
totally satisfied with the packaging and service from the seller!,_
"Nearly all but a handful of the impacted sites are Verizon towers, officials said",_
But could the government have instead used the RM10mil for the elite programme and saved all those athletes who were dropped from the Podium Programme?,_
leh muat 100kpg gambar,_
ni try dgn seller ni pula,_
hope fully functioning,_
Trus haid trun dan lncar,_
s grass is greener,_
"Alhamdulillah,dah sampai, tq seller",_
Sounds: clear,_
You are here: Home / Thank You For Birthday Wishes,_
"Sorry, video takde kaitan dgn produk",_
"Received parcel in good condition, thanks seller and courier",_
WALAU SATU,_
Bad services for the shoppe express,_
Rupa2nya besar pulak,_
pic lain dan video x berkenaan,_
depan adidas,_
ni blh bw p keja,_
Nice colour bag,_
Dah kali ke berapa beli,_
"seluar ngam ,random tapi dpt kaler nice",_
Gitar dah sampai,_
"Single Takdir adalah karya ciptaan Aliff, manakala lirik pula ditulis bersama dengan penerbit, Jaja Ishak",_
Ingatkan kecik je 200g rupanya besar jugak,_
Seller pun reply laju,_
"5 Stars untuk kedai ni x pernah mengecewakan,barang sampai macam di order",_
29 million units worth RM66,_
Turboik,_
We can't blame only our fans,_
"The socks are a bit transparent, thin and quiet slippery but still nice to wear",_
Taste:good for no sugar drinker,_
cuma adik kene lipat kit sebab die rendah,_
To download and install,_
menang mbeli puas memakai,_
Good product quality & authentic original,_
Sealed and brand new,_
Senang nk gantung mask xhilang,_
Received a free gift of chocolate,_
Sentiasa happy kalau parcel Dr Momo House sampai sebab barang2 nya berkualiti walaupun harganya murah,_
Barang dah sampai ke rumah anak,_
Bsna a sk d sos djprnt tod dka sjdos vsisne lsne keke eboene ebei,_
penghantaran pantas mcm jebon biji kopi fresh,_
Ordered on 31/5,_
Kain tebal x jarang,_
Texture:kuku i jadi lawa gilaaa sumpahhh,_
good products and smell good,_
"The delivery was fast, the courier was friendly and the product was well packaged",_
Took times to arrive but its Okay,_
It's kind of minty but not overwhelmingly so,_
Effectiveness: ok,_
credit for recycling Apple On first few points Recycle,_
Just to make it look nice at d expense of health?,_
And overall is fine,_
- puashati,_
Dah smpai boleh laa dgn harga yg murah cuma ingtkn bole tinggi lg tp tk tinggi sngt pun huhu,_
"Ordered 9/2, shipped out 10/2, received 12/2",_
My late father and I would communicate via Aerogram which took ages to reach,_
"All nicely wrapped, if nice will repeat order",_
"Barang saya dh smp dlm keadaan baik, cantik jubah ni n selesa dipakai, xtebal xnipis",_
"2021 ordered, 31",_
Anyhow no problem coz,_
Tqtqtqtqttqtqtqtqtqtqttqtqtqtqtqtqtqtqt good good good good good good good good good,_
"Hope can get Jay, Jake and SH photo card next time",_
Next time nak beli,_
"Barang sampai dgn selamat, pembukusan cantik, first time beli dgn seller ni",_
"Thank you seller , kasut selesa and kena dengan harga",_
"Received already in good condition, tak tau ok ke tak sbb tlg blikn utk org",_
Packaging bagusss sekali,_
This is certainly an unforgettable gift that is certain to light up the eyes of watch fans everywhere,_
"barang sampai dengan selamat, penghantaran yang pantas",_
"Justeru, beliau berkata, SPR serta Suruhanjaya Komunikasi Dan Multimedia Malaysia (SKMM) diminta untuk memberi penjelasan berhubung perkara itu",_
even baju condition bundle tp worth it la sbb nya bukan pakai belasahan pun,_
Rasanya kali ketiga dah repeat beli,_
video tu x de kaitan,_
Semua order betul takde silap,_
Cantik sangat kain sedap giler,_
"Adidas trainers is the best quality and comfortable choice in the market of trainers out there, I love them if you have one you will understand",_
raya kali ni raya,_
Will buy again if got sale,_
terbaik seller 2 hari ja sampai,_
currier baik,_
Mak saya suka senang masak katanya,_
Ngam ngam sooi,_
"Ok jee tebal wrnaa comell pink² , beli buat gantung baju kt almari, 🥰🥰",_
Material:nipis selesa,_
"Justeru, bagi pemegang ijazah Sarjana Muda Sains Bioindustri dari Universiti Putra Malaysia (UPM), Bintulu,",_
Overal kualiti memang bagus sesuai dengan harga,_
Bought the usual size but this shoes are quite big,_
Bagi gift bath towel lagi,_
tidak mengapa insuran warranty AIA ada,_
That's quite fast,_
"The report showed that while nearly a third of the global population over the age of 15 used tobacco products back in 2000, only around a fifth is expected to be doing so by 2025",_
I took my actual size and it perfectly fine for me 🥰,_
kipas lawa dan laju,_
"Only those with blue MySejahtera status, or at low risk, are allowed to enter the Kuala Lumpur Court Complex",_
"If you let me, I might say too much",_
kain mcm keras sedikit mybe sbb belum dibasuh,_
kalah spec mata yg dimall hahahahah,_
I beli 3 sbb murah gila senang I nak practice,_
Tq tq tq Terima dlm keadaan baik,_
Drlivery pn cpat je,_
Seller packs it nicely and securely and safely and it arrived it good condition so all is good thank you ya seller,_
bubble wrap sgt tebal jdi nak oder xperlu risau,_
"kali kedua repeat order sini, cirst time nak try chingu topokki harap2 kene dgn selera lah",_
sumpah cantik gila taudelivery pun cepat je,_
Quality:very good & comfortable,_
maf gambar xda kaitan,_
"It doesn't seem, with a 6",_
"Nissan hopes that recycling batteries and re-using them in electric vehicles (EVs) would help lower production costs as the price of rare metals rise, Nikkei said",_
"First order my parcel stuck at j&t more than 10 days but eventually refund, second order takes 2 days to receive my parcel, overall the product is good",_
okei2 ajaaa,_
Mantap warna padu saiz yang menarik boleh beli selalu boleh rekemen rakan2,_
Baju mmg sedap di pakai,_
Build quality: 4/5,_
mantappp curier sampai malam di hantarnyer,_
"The product takes quite a long time to arrive, but it's okay",_
Tapak jalan atas tiles x licin & xbising,_
pembungkusan selamat dan menarik,_
berbaloi dengan harga nanti shopping lagi,_
MESRA TRAVEL & PENGASUH,_
My ink was running out so didn't turn out how I thought,_
Best untuk diet,_
Quality:American quality,_
Thank you very much seller for the good service and items received in good condition,_
Ikhlas dari lubuk hati seorang insan yang penuh dusta,_
Pembungkusan baik and siap tolong visor lgi even tak minta pasangkan,_
Beli asing lagi murah dari beli satu set,_
"Beli arini, harini jugak seller post esoknya barang dah samp",_
Thank you seller brg dh sampai tebus baucer dpt air free skali penghantaran free recommended,_
Locked dua kasut dengan seller tapi malangnya satu pair tu heels nye terpeleot sebelah bila dipakai,_
cantik lah sama mcm dlm gmbr,_
Genuine leather,_
", Salute 🫡🫡, bodoh pemandu Honda , not even TQ Auntie",_
Kainnya sangat lembut,_
cantik memang cantik tapi shipping kemain pulak sampai 12hari,_
dapat harga 89sen je 🤣 memang style,_
Has a good directory of food services,_
Quality:sampai dlm keadaan baik n laju,_
Mantap boskuu penghantaran laju,_
Tapi tidak utk saya,_
My cat dah lama consume this treat jadi memang wajib ada kat rumah,_
Memorial is the need for Russia's citizens to know the truth,_
Items well wrapped,_
barang yg ditunggu dah smpai,_
Yg merah tu pun sedap jugak tau!,_
"Purchase on 18 jan , received on today, item received in good condition , expiry date is 2022 sept 16",_
Nice nice pretty,_
one thing was just the box was damaged but thank god the thing inside was fine,_
"Populist politics, the use of COVID-19 pandemic restrictions to silence critics, a tendency of countries to mimic the anti-democratic behaviour of others, and disinformation used to divide societies are mainly to blame, the Stockholm-based intergovernmental organisation said in a report",_
Kasut murah tapi kualiti,_
Good good good good Good good good good Good good good good Good good good good Good good good Good good good good Good good good good Good good good good Good good good good Good good good good Good good good good Good good good good Good good good good Good good good good Good good good good Good,_
"P/s: nak beli GIFTBOX cantik, berbaloi & simple?",_
will repeat the order again next time,_
• Fantastic buying experience,_
Boleh da buat kad kawin utk diri sendiri,_
Spaghetti texture closest to acceptable noodles,_
"barang sampai dengan baik,kain pon ok sesuai dengan harga,terbaikkk",_
"With that, the team is constantly on the lookout for the best opportunities and locations to kickstart production, with a particular interest in untapped Asian territories",_
tp blom bkk cba lg hrp ia baik² sja,_
xleh nk refund,_
First time beli dgn seller ni,_
Stkt dpt 1,_
Kalau nak beli hat tebai mahai sikit,_
Shipped on 16/12/2021,_
kasut sudah sampai dalam keadaan baik,_
1045/1070 and appreciated against the Japanese yen to 3,_
tp terasa byk air lh,_
3xl but doesn't seem to fit (comfortably) on my 65+kg babies,_
3rd times ordered from seller,_
cepat betul oder smlm hrni dh sampaii,_
Wow brg cantik Dan kualiti pon ok,_
Expected already yang organiser ni lembik,_
"While the region was highly successful in curbing the spread of the virus early in the pandemic, it was slow to vaccinate and is now only gradually reopening borders and relaxing mobility",_
Wif coin cashback too,_
I'm not letting my situation consume me anymore,_
