Sentence,Tagged_Sentence
"Thanks seller, courier service and SHOPPEE for the convenience",_
the texture is not really like vaseline,_
Barang ke 3 yang saya beli dgn Perry Smith,_
Pakai dengan kain pleated putih sumpahhhhhh CANTIK !,_
The seller will auto renew the subscription,_
Very fast shipping and safely arrived thank youuuuuuuuuuu,_
Tapi tengok mantap,_
"The delivery speed will not be very slow, and the face wrapped in bubble wrap is very safe",_
Pghantaran kali ni agak lambat,_
Beli barang satu je tp siap kotak dgn balut tebal lagi,_
Ia selepas Telekom Malaysia Bhd (TM) mengesahkan bahawa syarikat telekomunikasi itu akan menjalankan ujian 5G dengan Digital Nasional Bhd (DNB) untuk mengoptimumkan perkhidmatan berkenaan,_
