Sentence,Tagged_Sentence
Item already received tq seller 🥰,_
best stokin silvy nii,_
Good to see that oneplus has given options to buyers $MENTION$,_
"Fast delivery by seller, the shoes is comfortable worth my money and seller is responsible thank you",_
Delivered in correctly and in good condition,_
Overall gooooood,_
Delivery pun cepat aje sanpainya,_
Sorry tau gambar xrelated,_
"stylus pen ni sangat sesuai for those yang nak jimat taknak beli apple pencil, ni more cheaper and sangat function",_
seller tolong la hantar barang ikut apa yang pelanggan pesan,_
Upgraded into pro within 5 minutes,_
kasut nie ringan,_
Received it but theres one of the bottle crack but isnt a problem,_
Phone dpt dalam keadaan elok,_
BANGKOK: Permohonan kewarganegaraan Thailand kini menjadi lebih mahal dengan peraturan baharu yang diperkenalkan pihak kerajaan,_
Performance:Berfungsi,_
and > improved customer experience,_
Tq seller sangat sesuai untuk saya yang tak berapa pandai menggunakan nya,_
He hesitated for a long time before ordering,_
I got my topokki in just 2 days after purchasing,_
Biasa laa murahkan,_
It can also be used as a toy pool,_
Dah lama Sampai,_
"We do our best to also complement the development with sufficient facilities and convenient access to nearby amenities to help make living experiences much more fulfilling and valuable to the community we serve, said Zamri",_
cepat sampai order isnin selasa sampai,_
tawar2 pn xmo kurang kt kedai ni,_
Ingat beli utk time kecemasan,_
"Everything is wrapped perfectly, no worry at all about the bottles",_
🥰 Will repeat again,_
So yg lain pun xnak expect lebih,_
Nike Inc,_
"fast delivery,packing pn bgus,akan cubaa makan kalau okay repeat order lgi",_
Material:Mask ok jer,_
"quality is good, soft to skin",_
NEW AND EXCLUSIVE,_
Nameset juga Cun,_
Kindly decrease delivery charges,_
