Sentence,Tagged_Sentence
Seller so fast & responsive,_
Asalkan function haha,_
"Kali kelima order dgn kedai ini, setiap kali order mesti order Nutrisari Sachet sebab memang sedap dan berbaloi",_
Snowcap cantikk,_
Tq tq tq tq tq tq tq Tq tq tq Tq tq tq tq tq tq tq Tq tq tq tq tq tq tq tq tq tqTq tq tq tq tq tq tq Tq tq tq tq tq tq tqTq tq tq tq tq tq tq Tq tq tq tq tq tq tqTq tq tq tq tq tq tq Tq tq tq tq tq tq tqTq tq tq tq tq tq tq Tq tq tq tq tq tq tqTq tq tq t,_
"Thanks ye seller, moga dimudahkn rezeki",_
Yo i want this $MENTION$,_
"Good product quality, fast delivery with good packaging",_
Terima kasihtk berani nk pkai sbb murah sgt,_
Bru oder brg dh smpai tqvm,_
"Tq, barang diterima dgn baik dan bungkusan keadaan baik",_
Terima kaseh barang dah sampai,_
Took 1hour++ to change all tyres with rubber valve RM4 each and alignment cost for RM30,_
Barang sudah sampai terima kasih seller n abg pos barang semua baik,_
tpi syg nya singkat sma syasmua oke,_
"ugliest phone design ever, why don&$HASHTAG$",_
Memanng berbaloi,_
Jahitan kemas - tak ada kotor,_
My album arrived safely thank you so much!,_
"If zip until neck area is a bit tight, but overall quality is satisfactory",_
semua orang okay,_
insya_Allah Lepas ni saya akn Beli lagi,_
mak ank 4 yg nk pkai baju ni,_
Kain yg selesa di pakaiii,_
Beli as for free gift,_
Sangat cantik dan kualiti memuaskan,_
Send me mi 11 with charger,_
untuk letak hand phone boleh lah,_
Barang helok cantik boleh guna,_
*IBG TIDAK DIBENARKAN*,_
Berkesan terbaik,_
Kain tak panass,_
Can't wait to try next morning,_
Masukkan ke aplikasinya GRAB ku yg blm ada PAK,_
232 hektar),_
good service and good seller,_
Beg cantikk warna sama mcm dlm gambar,_
Box was half opened but luckily items are fine,_
The product received with physical damage seller said can return but its complicated as the price is cheap you can't complain too much i still think ok for the price,_
harap serasi dg badan,_
Alhamdullilah barang tiba dengan pantas dan selamat,_
packing safety,_
Produk sdh sampai dg baik cepat pantas,_
PRICE OK with dome discounts,_
worst application ever,_
oke ada siaran,_
"Quality:Tebal, lembut, sejuk",_
Very recommended beli dkt seller ni,_
Mmg tak beli kat kedai lain dah,_
Package received fast shipping great packging thank you seller,_
"dh psg,angin mmg kuat",_
Cantik nyah baju ni quality pon boek,_
Harao sesuai untuk saya,_
nnt nk repeat beli color lain pulak,_
I am using Lenovo M8 and I am seeing samsung tab,_
Items were all packed well in a box,_
JADI SEMINGGU BARU SAMPAI,_
sesuai dgn cuaca yg panas,_
tunggu agak lama tp dpt jugak,_
Thanks so much tokey,_
"The year-long war between Ethiopia's government and the leadership of the northern Tigray region, among Africa's bloodiest conflicts, has killed thousands of civilians, displaced millions and sparked famine",_
It was good value for money,_
Semua warna tali betul,_
"Thanks seller, Im a happy buyer!",_
The orange is more orange than I see from the picture but I love it,_
dpt warna ok jugak,_
Good product quality and excellent service delivery would buy it again,_
SANGAT PUAS HATIII,_
cuma penghantaran tempat saya agak lambat,_
I hope he can brush his tooth well after this,_
But overally I'm really satisfied with this skirt,_
Kain pun lembut & sejukk,_
alhamdulillah dah turun 7kg mcm tak percaya pulak🥰,_
Camera ok tapi tak reti guna,_
Harap2 berkesan dan cepat baik,_
Good quality jacket,_
Gmbr dengan video x de kena mengena sbb kasut kat kampung,_
"2nd time repeat beli,",_
The less things will arrive in two days,_
Tak sabar nak tryy thank you seller,_
Smothh sedap lah pakaii,_
"sorry gambo tkdo kaitann, beg helok jeeee mantap laaa penghantaran lamooo",_
guna utk blend (telur rebus+oat) dan buat ice blended pakaii ice,_
"I bagi surprise dekat orang , dia suka kut",_
"Btw, pink dgn cream xsama besar, cream lagi cute n besar",_
What a good material ever!,_
Tqsm k,_
Sy newbie baru nk try,_
Thank you seller for fast delivery services,_
"The wood installation, then located in Kuala Lumpur, was shown to the batu Pahat audience through a video",_
"In addition to the 99 Conservatives who voted against the passes, 40 voted against expanding the requirement for mask wearing",_
"Baju ok, bagus,bagus,bagus, repeat order lain kali",_
tetap 5 bintang sebab seller pantas buat kerja,_
Terbaik seller ofer smlm arini smpi,_
Harga promo mmg berpatutan,_
maaf video dan gamba tiada kene mengena tapi barang oke cantik,_
"Saiz L ngam2 je dgn sy, berat 49kg tinggi 150cm",_
Semua bersih,_
So semua cukup tak lebih tak kurang,_
No earphone in the package,_
All were wrapped securely,_
"Item received, great service by seller, thank you very much",_
I like it thank you so much i will buy it again i dont hv ge actual pic so enjoy this edit and this beautiful man,_
I still haven't tried to install it but I hope it will stick in my car for a long time,_
Brang okey okey okey okey okey okey okey okey okey okey okey okey okey,_
dh mcm kain lap dapur,_
Nt rrpeat lg,_
Kamera dpn okay la,_
kan ada gunting aqil boleh tak nak minta tolong aqil adsik saya suka tengok video aqil hari jadi adik saya bulan lima nak buat macam mana,_
"Alhamdulillah, brg sya sudah smpai dengan keadaan baik",_
The illustration is misleading whereby it showed the battery capacity is approximately 4500MAH,_
"Received in safely, nice packaging, excellent service by seller, good product quality, good value for money, thanks",_
"The apparel manufacturer, one of the top gainers on Bursa Malaysia, rose 16",_
"Researchers at the University of California, Los Angeles (UCLA), evaluated more than 10 million patient and health records for UCLA Health outpatient, emergency department and hospital facilities, spanning Dec",_
But its the courier problem and seller was kind enough to follow up and provide me update even I didn't ask for it!,_
tp x pe le kn urgent pn,_
"Bags came delivered quickly, in good condition",_
"Jahitan kemas and cantik sangat,",_
Cantikk kaler die,_
OnePlus me parece una gran marca y se ha ganado un puesto entre las mejores marcas,_
Overall very pleased and will definitely buy again,_
"sumpah kualiti memang padu, cantik sangat",_
brg sampai sehari ja,_
I Iike that it doesn't contain soy protein compared to other organic milk available on the market,_
"Products received in good condition, very fast delivery",_
bau perhhh memang padu,_
hijab kids sudah sampai🥰🥰,_
Baru sampai hari ni,_
smooth and good condition,_
Agent Name :,_
bole pakai bnyk jenis,_
"Design:cantik,",_
Harini order esok jugak sampai,_
"Far from being a covert operation, its evidence and methods are published on its website",_
cuma ketat sikit sbbnya pregnant 5bulan,_
overall really recommend and fast delivery,_
Blh beli lgi lepas nie,_
"(I'm using Kuala Lumpur food prices, by the way",_
Bungkusan bgus sgt,_
Tapak kasut pun bercorak boleh mengurangkan accident tergelimcir,_
"tanya seler ttg saiz,mmg bener 6090 lg kecik",_
80 amid strong volume last Friday,_
Beg cantikkkkk sangatttttt thanks you seller i will repeat another design,_
abit late delivery myb from delivery company,_
Received safely and it seems to be all good in order,_
Satu family,_
tp Servis laju yakmat,_
"Cuma itulah, ada defect sikit",_
i choose the wrong colour but issokay still cantik,_
rezeki la dpt lock jgk,_
HOT CHICKEN FLAVOR RAMEN (CHEESE),_
And you nak bukak window pun mmg akan susah sikit,_
Dan laju terima kasih kepada seller,_
laptop slow cuz 1+Ghz only,_
"Since you need to push it up, it usually glides out whenever I put it in my handbag hence becoming so messy",_
Hahah hope I repeat order it's so niceeee,_
Kali ke-2 beli dengan seller ni!,_
"The guidelines would protect the people from being slapped with unjust compounds for violating the SOP, he said",_
Mujur claim balik dapat,_
dah beli 3 helai kat kedai ni,_
"Expired date long also, confirm will buy again",_
All good all good all good all good all good All good all good all good all good all good All good all good all good all good all good All good all good all good all good all good All good all good all good all good all good,_
WaiWai Yee,_
"Barang dah sampai , pengbungkusan kemas , tiada masalah , terima kasih seller dan penghantar",_
"Order received within 3 days, the packaging is not fully vacuum seal",_
cuma speed sama je,_
mantap gengg,_
"First time beli dgn seller ni , cara pack yg sangat tiptop akan repeat lagi nanti",_
"Btw , nnt nk repeat lagi",_
Terima kasih seller sebab hantar barang saya nie dengan cepat dan selamat,_
nanti nak beli untuk diri sendiri pulak,_
"may delivery, may small order fee, at may patong pa sa item price?",_
weight : 42kg /,_
"Super laju delivery, 2hari je beb",_
This is my second purchase from this seller seller,_
slalu ok je size 36-37 yg ni kne oder 1 size bsr,_
xdetect la pulok,_
Dh 2 kali beli shirt ni,_
recomanded pd semua,_
paling murah utk 50 pcs,_
both bau wangi!,_
"Is there a cork inside so it will be safe if it gets squeeze, it won't go directly to the item",_
Kain sesuai utk dipakai basahan,_
Lama lagi bru nak guna,_
brng mndrat tgn elok,_
ptg ni jgk pkai,_
Then bagi free gift yg sudah nak EXPIRED,_
got the free gift if buy 6 and abovee,_
"This pandemic is nowhere near over, Tedros told reporters from the WHO's headquarters in Geneva, Singapore's Chinese-language",_
H/m is good but the Problem is if you logout once it's so hard to login again even if my e-mail and password is correct I don't know why?,_
klu jatuh macamana,_
Bang tolong bang belikan aku hot wheels Lamborghini Yang atap terbuka warna abu abu 1 sama Audi R8 2,_
"36) a month but, unlike Netflix, it allows users to simultaneously watch content on multiple devices from the same account, and offers a cheaper annual payment plan",_
Cume blom try caj untuk tgk ketahanan btry dy,_
- Foto NSTP/Nur Aisyah Mazalan,_
lepastu tgk size kasut yg ditulis,_
Told as a monor,_
Bought it cuz it got good reviews,_
Semua set baju cukup utk anak i,_
haritu dh order sepasang x silap,_
Functionality:tiada bau langsung,_
"The Swiss Digital Exchange (SDX) will be the first fully regulated market infrastructure to issue a digital bond and use distributed ledger technology (DLT) for settlement, said SDX CEO David Newns",_
can't expect to high on it,_
Beli time sales memang berbaloi!,_
Recycle phone with premium price,_
This is Madness no one can say the opposite $MENTION$,_
"50 more zoom, not 10 times more <a href=$URL$",_
Dh Selamat diterima,_
okay okay okay okay okay okay penghantaran makan masa sikit tapi okaylah hahaha cantikkan,_
Terbaik penghantaran dan pantas,_
"Got these as a free gift from the seller, good quality and simply cute",_
$MENTION$ Kim не обязательно кипятком,_
kalau p kedai korea mkn ramen dorang auto reject sbb samyang lgi sdp dri kedai koreanye ramen 🤣🤣🤣,_
kaler cantik2 secure thank u bosss,_
x sabaq nk mkn ngan nasi kerabu hihi,_
Okey mantap barang nya,_
(Additional reporting by Prasto Wardoyo and Agustinus Beo Da Costa,_
Completed: 4/12,_
Very nice fabric,_
brg pun smpi dlm keadaan elok n cantik takde rosak,_
Aku follow pastu longgarrrrrr,_
hakak seller terbaik dalam mnjalankan servis pertanyaan,_
"4 , to settle at US$76",_
semuanya did dalam keadaan baik,_
Sukaaa delivery pun cpttt,_
Barang bagus nasib baik sebab ada baca review customer ckp kedai ni jual brg fake/old stock,_
Maaf video tkda kene mengena beli utk ank buah,_
beli sbb nak hitamkan topi dgn tudung,_
Thanks seller packing well with bubble wrap,_
This flavour never try it before!,_
ngam2 seluar tu suami suka,_
Lampu led ni cantek nak letak kat suprise box,_
Selesa bila di pakai memang terbaikkkkk(,_
Taste:Barang Baikkk,_
New Sparco Evo Semi Bucket Seat worth rm1800,_
Xtau blh keluar ke x,_
Apa² pun servis laju,_
SSD,_
terma di: bit,_
Seller packing barang kemas,_
Comfortability:kasut cantik dan sesuai,_
t it $MENTION$ $MENTION$,_
Besar pakej nya,_
dalam gambar model pakai awning mcm keras sikit,_
Klu terlebih harap dihalalkn,_
ni rupa teh dan rupa kt dalam uncang tu,_
The app freezes things don't well,_
blh la utk pakai,_
Seller terbaik kalau apa apa sellee inform,_
The watchdog's announcement on Tuesday follows a report from a UK parliamentary committee this year which warned that the ties between music majors and streaming platforms could stifle innovation in the sector,_
I bought it one size bigger but it came out a little loose as the strap at the back doesnt hold on my foot completely,_
fhckvkvkvkvhdjfkgkgjcjcjchcjcjvjvkvjvjcjcificovkbk k kcjxudxkvkckcickdkfkcickckvk,_
Second time beli fast delivery also good product lovee,_
Feels more secured,_
Pppppppppppppaaaaaaaaaadddddddduuuuuuuuuuuuuuuuuuu,_
"Present food plans for primary school pupils, such as the additional food programme (RMT), will be retained with improvements",_
berbaloi la beli tqtqtq,_
Easy to apply also,_
"Kualiti barang ok, no defect",_
"Received the product in few days, very good quality, satisfied",_
"Sy dh minta,design tuk lelaki",_
tk sbr nak bacaa thank youuu,_
Site keeps crashing on me,_
"Semua cukup hehe 🥺 nak try sekarang jugak saya mmg suka pakai bende ii mcm ni dari dulu lagi tapi dah lama stop,",_
Packaging is also acceptable,_
Setakat ni jumpe kedai ni lah murah kualiti memang tiptop,_
3- hokkkkkkkkplp,_
Saya ambil size 36 - 23cm,_
gantikan bateri lama yang kembung,_
harga sgt3 berpatutan berbanding dari kedai lain,_
memang terbaik ringang,_
Nak repeat order lagi next time,_
"without hesitation, i immidiately went and checkout",_
Purchase few times during promotion,_
"Penstriman dan penyiaran kini mewakili separuh daripada keseluruhan masa yang diluangkan di televisyen, dengan pembahagian secara sama rata antara kedua-dua saluran",_
Fast delivery items from the seller,_
bosen harus diupdate terus tapi makin banyak error,_
"Good product, fast delivery, affordable price, will buy again sometimes",_
Niceee best sangat boleh jadikan lampu tidur jugaaa hehehe,_
"M40RM250,",_
Purse dah samp,_
"tngh hari td sampai sdh,",_
Functionality:penghantaran sangat cepat Dan kualiti produk sangat memuaskan boleh repeat order lagi,_
Puas hati corak cantik kain elok,_
bhai muja be ek delwa do 🥺🥺,_
video x berkaitan sb sy beli utk kwn,_
11 Tan Kian Meng-Lai Pei Jing are set to take centrestage as the five-day national team internal tournament reaches its finale today,_
semalam(utk llki) kalau girl mmg x muat,_
Can easily cut with nail clipper if you think it is too long amd wish to reduce the length,_
Buy an apple watch,_
Lepas ni confirm beli lagi,_
Chat seller sepi,_
Taste:so good next time will be by again,_
Bungkusan ok x de masalah,_
Standard delivery within 5days to east malaysia,_
Seller send photos of testing and serial number,_
siap tanya ada nak buat notes tak,_
Barang bukan original SKMEI,_
"Sorry gambar takda kena mengena, by the way this pants very soft material mcm seluar sukan but niceeeee & tak panas",_
Dah lame sampai tp baru hari ni dapat bukak,_
ဝန်ထမ်းများအပေါ် အနိုင်ကျင့်ခေါင်းပုံဖြတ်နေတဲ့ မြန်မာလူမျိုးမန်နေဂျာတာဝန်ခံများကြောင့် အားမပေးတော့ပါ,_
Rugi lak rasa beli banyak,_
"Tak sesuai for college use, but for a daily use then yes",_
free gift dlm bentuk milk type,_
"baju da sampai lama dah cuma asik taksempat nak rate, btw baju ni mmg besttt, kain pulak takde bulu and sedap, memangg berbaloi tau kalau beli ngan diorg niiii, thank youuu apizzz",_
Game lagend semua ada dlm ni,_
cepat betul sampai baru oder smlm harini da sampai,_
"The Tech Women's Award was intended to support exceptional women in the tech world, and encourage them to stand out",_
"good product queality, good value for money, fast delivery, excellent service by seller",_
Fit my ipad well and the pink colour is so cute too 🥰 packaged well with enough bubble wraps and they didnt take long to ship my item,_
Tpi nak cakap kain dia memang best bethol yeee,_
harga murah bbaloi,_
"Good day to you,We are hiring people to increase the popularity of Internet celebrities,RM200 - RM500 will be paid on daily",_
xdapat apa yg diminta,_
Semuanya Ada,_
"The size is very good, can be use for both maa or women",_
"However, Shopee Xpress leave the parcel on top of gate pole without inform, this is not the first time already, if raining and nobody know the parcel will getting wet and the item may spoil",_
"for a cheap price this is a good deal :) i will definitely repeat it again, thank you seller",_
"Long time no drink already, so when got discount fast fast buy",_
"Super fast delivery Received items in good condition, thx my friend recommend such nice seller for me",_
Saya suka kalau lebih tebal,_
i biasa pakai size 37 so ambik ambik size 37/38 longgar sikit je boleh nampak dekat gambar second ni kalau pakai stokin confirm ngam,_
Suite well ngam ngam tapi nak jalan lama kena ambik satu saiz besar thanks seller,_
Kalau sedap saya repeat lagi,_
Mmg bgs kualiti kain tuala ni,_
Panas dia pun Elok Sbb 2000w kan,_
Nice yummy,_
Took 47sec to iron the shirt part in video,_
"Overall ok,harga pon ok",_
"Overall semua okeii, kain dia jenis tebal n tak gatal",_
Where this,_
thank you so much qama n the geng nnt i masuk live kacau u lagi okay,_
"Alhamdulillah, akhirnya gw bisa menjahit apa yang ingin dijahit, terima kasih kepada seller, terima kasih kepada pencipta mesin jahit",_
mmg kulit jadi putih,_
RM0 Air Selangor: Gangguan sementara bkln air ekoran masalah elektrikal di Kolam Sri Gombak A1,_
"Its a good product and fast delivery would repeat again, nice seller as well!",_
Seller cemerlang mantap padu puas hati barang ori laju,_
ni pun kali keberpa sda repeat,_
"Very fast delivery,very nice packing,i will repeat order again and Tq seller",_
This compares to an upwardly revised 1,_
"My 2nd time purchasing this, the colour is the same as in the picture",_
barang dah sampaiiiiiiiiiiiii,_
Hope I can win one these bad boys,_
I like it (SMTrack) for its technology focus,_
Boleh repeat order untuk abang2,_
seller layan nice jerr🥰,_
Ulol,_
buy for my brother he loves it all haha thanks seller for fast delivery!,_
"Cantik yg transparent ni, tp hati² ye gais",_
semoga dipermudahkn segala urusan,_
"first of all, one of my vitamilk yg i purchase is totally broke and pecah",_
Maf ye gmbar x ad,_
thank you seller very reasonable price good quality recommended seller,_
tapi lagi Dan power,_
s a shame I couldn&$HASHTAG$,_
pakaian sampai dalam keadaan baik,_
Kain x memberi sngt,_
vv secure,_
"First time purchased, look nice to use",_
la/infaq22,_
Penghantaran cepat dah pantas packing kemas Dan memuaskan high recommend seller,_
Pilihan dy sndry,_
"Multi function, kotak simpanan macam2, but",_
harga pun bersesuaian dgn kualiti beg,_
anyway satisfy with the product,_
Dibalut dgn bubble wrap yg agak tebal,_
"Finally dpt jugak beli , ambil 2 hari utk delivery je mmg tk menyesal sbb sound bass best and boleh guna utk call jugak",_
Dah Sampai jnt tampin tp lambt for delivery,_
Pm terus jawab,_
U can see the contrast,_
Buy For My Cat🥰🥰 They Really Like it🥰🥰 Saller post out so fast,_
"Apa2 pun berbaloi dgn harga, comel je anak2 pakai",_
kek vanilla,_
Thank you also to the delivery man,_
"Very fast delivery didnt click the received cause got held by the dorm's head ‍ but the item received was perfectly wrapped and in good condition,thank you for the great service",_
This app did not accept my new debit card,_
I got this for half price,_
Work as intended!,_
Brg da smpai da harini,_
kalau beli kedai rm15 dpt 1 ni ni boleh dpt 3 rantai,_
servis seller n jnt pun superrrr tiptopppp,_
Akhirnya sampai jua wpn lama menunggu,_
"Sangat puas ,terima kasih seller Ayu melayan Customer dengan baik",_
Brg2 diterima ngan condition terbaik,_
Maaf video tk barkaitan,_
dh pernah pakai sebelum ni utk penggunaan harian,_
"Tq seller good job, terkezut cptnye sampai, Alhamdulillah",_
Barang dalam keadaan yng baik,_
semalam petang beli,_
"Easy to assemble, lightweight, fast to steam, great that it has ironing board as well",_
Item sudah terima dalam keadaan baik,_
Up warna pink byk sikit,_
Untuk gamerz memang berbaloi beli,_
smua kasut cantik dan puas hati,_
"Harap perbincangan pengembalian hasil, royalti minyak dapat dimuktamadkan",_
sempat bawa pegi holiday,_
"Sementara itu di media sosial, beberapa pengguna melontarkan respons masing-masing dengan ada yang berkata caj RM1 itu akan menyebabkan orang ramai kembali beratur panjang di beberapa buah ATM",_
Harap2 berkesan lah nk turunkan berat badan sy ni,_
Hmmokay la,_
gambar dan video x de kena mengena,_
sibuk skit,_
hoodie cantikkkk,_
Xde barang pecah,_
Ok cantik kain pun selesa,_
Mask yang dihantar cukup,_
nk order shaklee pm sy k,_
dah lama sampai cuma baru nak nilai,_
"Delivery took some time because of ShoppeExpress, but other than that I was very happy with seller's services",_
Penghantaran bit lambat but recommended!,_
Butte !,_
"Sampai dah,dlam keadaan baik, jam berfungsi dengan baik",_
"Kain best, untuk harga camni mmg sangat2 okay",_
Finally barang sampai dalam keadaan baik,_
Taste:Rasa mcm minum air daun inai,_
I know this led tv got mytv built-in,_
Hard to book ride,_
Barang/produk diperolehi dalam keadaan baik,_
Kain baik baju cantik memuaskan,_
Return request also attended fast,_
Terima kasih barang telah diterima dalam keadaan baik,_
"Comel je tisu kat dalam tu, ok la berbaloi dengan harga murah",_
Bila bukak ni?,_
THANKSSSSSSSSSSSSSSSSSSS,_
Thanks seller for a great service fast respon!,_
so smpt ambl 2 gmbr slua je,_
Test ting monny,_
"A lot of people reviewed it as good, affordable steamer",_
"So far so good, shipping lambat aja but nvm might be bcs of restrictions in China",_
Very beautiful design and performance is amazing,_
Ugreen tak penah mengecewakan,_
selipar 22 cantik,_
xpening kepala bau,_
Always buy this lollipops for my kids,_
Good good mood good good good good good gGood good mood good good good good good Good good mood good good good good good gGood good mood good good good Good good mood good good good good good g good g,_
Ninja turtle,_
"Terima kasih seller , memang mantap",_
Pstu sy try cas atas lantai restart phone OK Dah Alhamdulillah,_
First time nak try different beli utk ank juga,_
"Litwak intends to work around these issues by building an entirely new marketplace, called Maxwell Social, rather than relying on companies like OpenSea that act as a kind of EBay for NFTs",_
I never believes that,_
Thank you seller is cheaper than shop,_
Took around 2 weeks to receive (East Malaysia),_
Dries fast and does not smudge,_
Ambik zl tgn pn labuh ckt tp ada skt kt tgn oklah,_
10/01/2022 Mon - goods received,_
fazul,_
Boleh la beli korang yang tengah surveyyy tuu 🤭,_
"Good Good good Good good Good good Good good Good Good good Good good Good good Good good Good good Good good Good good Good good Good good Good good Good good Good,",_
bagus pembungkusan die ade bgi kotak,_
t=2m30s> Tae me representa cuando me doy cuenta que la otra persona no me recibe mi hi five,_
"Terima barang dengan baik, pembungkusan sangat baik, terima kasih",_
Skin Suitability:hbnd,_
warna flask cantek,_
pasni akan repeat lg dlm 2-3 biji,_
Suka yg warna camel tu sb sedap la jgk pakai,_
Beeeeeliiiiiiii,_
Mana tidak ada tanggungjawabnya,_
Perfume wangi2,_
Memang berat la ceramic kan tp Alhamdulillah sampai dengan selamat,_
But then worth to wait la,_
Please beliiii,_
"Grab kenapa si,akun saya ditangguhkan trs,sampe bolak balik ganti nomer buat daftar",_
I can feel and sense the sensation of the crystal vibration,_
Rs mcm kck je,_
lebih baik GRAB aja,_
• Belajar huruf hijaiyah,_
"Luvs the Type-C cable, its so nice but u need to use d'original USB adapter to make it fast charging, if with the normal USB adapter, it will charge like normal",_
I like this book,_
ka medy,_
"The price is reasonable, the service is in place, and the delivery is timely",_
Kualiti padan dengan hrga,_
"Product 4/5 - need some effort to plug/unplug, especially for two pin plug, not easy",_
Gambar & video tiada kaitan dengan barang,_
Congratulations Forever BTS Smile Happy L-Army PERÚ,_
Soon he found his groove vlogging about crypto and meme stocks like GameStop Corp and AMC Entertainment Holdings Inc,_
free gift pon banyak,_
myself,_
tido nyenyak bayi Saya,_
Will repeat order if it's working and good for my hair,_
"T&Cs Perlindungan Tenang: Here is a voucher for 1-year life insurance coverage of RM30,000",_
Always use this one,_
So far semua ok tkda masalah baby pun suka,_
Bang boneka nya bisa kedip gak,_
LOVE TERUK,_
Nanti nak jahit bahagian bawah tepi untuk kasi kemas,_
Best pkai ringn je xrasa pon pki lipmate pastu xmelekit,_
padahal di indramayu banya orang yg membutuhkan jasa ojek online,_
Alhamdulillah dh dpt daa,_
Easy to use and good pictures,_
t afford a phone And my current phone is very older Please give me🥺 $MENTION$,_
Seller balut tebal n cepat giler smpai,_
"VIENTIANE, Sept 28 (Xinhua): The Lao Ministry of Health urged authorities and the Lao people to remain vigilant and help control the spread of dengue fever and Covid-19",_
Love the ease of it,_
comel kartun dan kaler nye,_
Material:asdfgh,_
Barqng sampai in good condition,_
"Kualiti baik juga ni, solid",_
The decos are good value for money,_
kne pkai sock lg selesa,_
Semua dalam kotak,_
"Item received in good condition, super good packaging and fast delivery, thanks seller, recommended",_
Definitely will recommend,_
botol x dak yg kemek love,_
seller siap bg freegift lg,_
Ok barang dah sampai rumah bungkusan produk sangat kemas dan cantik terima Kasih kepada seller terbaik,_
beli kasut percuma bju,_
Sgt berbaloi beli utk bgai gift kpada customer,_
Thank you for your fast service and kudos to logistics team!,_
Delivery laju sangat puas hati,_
gembira tak terkata,_
"In Asia, the growth rate was 31 per cent",_
barang pon berkualiti walaupon penghantaran agak lama nk tggu,_
