Sentence,Tagged_Sentence
"Cantik, phantaran y cepat",_
alhamdulillah semua barang selamat sampai 🥰 tq seller,_
Expected to arrived,_
Murah sangat2 dari seller2 lain,_
semua ok selamat smpai,_
Superb service from seller my personal advise to buyers,_
Tenang hati,_
Item received in good conditon and function as well but very slow delivery,_
Arrived : 2/03,_
Barang smpai n pckaging bagus,_
Terima kasih penjual - saya beli ya!,_
"Fast delivery and received in good condition, product is functioning well, thanks",_
Br sampai tunggu orang dtg pasangkan,_
Saya suka boleh repeat ordr lagi klau ada duit lebih,_
The point system is rubbish the first time i got 2500 points then for some reason they became 0 without me using it and the second time today the app forced me to re-login because of some two factor authentication and also lost another 2500 point what a waste of time it is nothing but deceiving people,_
Fast delivery good for espresso grind condition look to buy again,_
Big fan and kinda in need of a phone,_
Written buy 10 free 1,_
ptt sy ambi size 39 ambil la ikut size kamu,_
"Functionality:easy to use, but need to fix each stacking properly or can become wobbly",_
brg sampao dalam keadaan rlok dan memuaskan,_
cuma lmbat sampai je,_
Alhamdulillah dah sampai packaging,_
"Really satisfied with my order,",_
barang dh smpai 2 ari bru ni smpat update,_
sbb pakai jenama focalure,_
Memeri jugak,_
beli jangan xbeli cuma seller tak layan kalau chat hahahahahha,_
Treats dah selamat sampai,_
"Buy on 18/12 and received on 28/12, worth to buy and TQVM seller",_
Packing good enough to protect items,_
Mgkin pasal sale puluh2 ribu kot,_
Brg xde rosak mmg bgus,_
Barang sampai seperti diminta dan cepat,_
Thanks n fast delivery,_
So cepat,_
Penyangkuk kain ada karat tpi bole je guna mebi stok lama,_
Keto keto tangan nasib jadik,_
Alhamdulilah dah terima tp Lom try lagi nk cuci dulu harap ok la,_
N0 damage 🤲,_
It's nice and definitely worth it on the sales day everything's fine and fits on the wrist,_
Cantikkk Thank u seller Dah repeat beli tinggal tunggu parcel sampai jee,_
Maybe accidentally cut by seller whn boxed,_
Nord 2 is Twitter: $MENTION$,_
"Mula² sampai igt satu lagi x boleh hidup, rupanya satu lagi tu kena pasang terbalik, kena hati² nk pasang sbb penyambung dia agak nipis dan mudah bengkok, pape pon cantik thank you seller",_
cepat pantass terbaikkkkkCantikkk semua gelappp gulitaaaaaa,_
Thank you so much and sorry for the late review,_
Very good quality quality quality quality quality quality quality,_
Fast delivery giler,_
Second times reorder,_
"In 2021, the rupiah dropped 1",_
ntah kali keberapa dh beli tapi memang berbaloi beli tali ni,_
Fast delivery intact packaging repeated many times thanks seller,_
material dia nipis je dan kain memeri,_
Delivery memang laju gile,_
Nice to See That Finally OnePlus Nord 2 did some Valuable Upgrade over Nord,_
Nasib mak ak suka,_
Items safe arrived,_
Dah test suhu semua elok terbaik and so cute,_
cantik long skirt ni,_
$MENTION$ Shah oh segitu Xiaomi mi 11 lite sudah rilis ke Indonesia dengan harga hampir 4 juta rupiah,_
tqtqttqqt,_
Size seems to be &quot,_
Going to buy nude color soon,_
lawaaa gilaaaa,_
$MENTION$ get me that blue hazeeeee!,_
Received the products in well packing,_
Belarusian leader Alexander Lukashenko is facing a groundswell of public anger after declaring a landslide win at last month's presidential election that his opponents say was rigged,_
Pasang kt kedai lebih kemas,_
I think the quantity has been reduced compare to previous packaging,_
Need a phone,_
supplier terbaik,_
"43 billion in 2021, the highest since records started in 1950, up from $523",_
ll have to check them out!,_
pokonya baguslah,_
Kain jenis lembut dan selesa,_
amek masa 10 hari utk smpai sini,_
"Cun cepat sampai pantas mitv senang pasang, cepat setting laju terbaik",_
"Kotak dh terbuka, x dbubble wrap,kotak lamppun semua terbukak,x dselotapnasib baik x pecah & semua berfungsi",_
sangatt cantik dan berkualiti akan beli lagi pengahtaran pun laju,_
Yg nak beli saiz biasa je tak payah ambik saiz bsr sikit,_
Durability:harap tahan lama,_
Katrio Gan,_
Lawaaa tudung ni even material dia xberat tp still flowy bila pakai,_
Ordered midnight 25/10/2021,_
"Repurchase again, the shipment is very fast",_
Mcm baju tshirt sudah,_
Safety:barang sudah sampai🥰,_
Baling pun takjadi apa,_
shopee ni tlg la bg choice pilih courier service,_
Texture:bBabbzbab,_
"Suruhanjaya Pilihan Raya (SPR) menetapkan tarikh mengundi bagi PRN Melaka pada 20 November, penamaan calon pada 8 November manakala undi awal pada 16 November ini",_
"Tak expect lebih pun, padan dgn harga yg dibeli",_
Kain okey cantik je,_
Ok boss tq coolant sudah sampai courier pun bagus terbaik cepat dan berbaloi-baloi,_
Expired date Dec 2022,_
Da bnyk kali repeat order ngn kedai ni,_
For G 3010 series wifi print,_
Boleh buat jubah,_
"My message to the public is to stop all illegal activities that destroy natural resources as it is valuable for human survival, he said",_
Hope it stick well n can take the load,_
"Kasut memang terbaik, berkilat, cantik dan berbaloi beli",_
Beg cantik tp zip patahhhh,_
Branches Always offline,_
Price OK RM56 include postage it's from oversea,_
nmpak serat dia,_
while stock Last,_
Fast delivery n servis,_
Good currier,_
besar maybe boleh ambik size kecil sikit untuk beg kecil,_
"the bag is in great quality, the zipper seems weak/loose at first but it is actually in good condition",_
Barang semua okey semua keadaan selamat sampai,_
seller bagus place oder 10/10 terus post out pada hari sama 11/10 dah selamat terima parcel,_
The packaging is seriously excellent,_
Mungkin anak 5 thn kurus dpd budak lain,_
MALAYSIAN teachers and students recorded the most number of logins to Google Classroom and Google Meet in the Asia-Pacific region,_
Tqqq fast deliveryyyyy hhhhhhhhhhhhhhhhhhhhhhhhhhhhhh,_
Apa ii pon berbaloi dgn hrga,_
Sambal mak jenny x penah mengecewakan,_
"Delivery pantas baju terletak utk tinggi 157 60,recommended boleh repeat",_
Ship 02/02/22,_
principes,_
harap seller lebih alert dgn customer yg suka beli barang dan perlu resit pembelian,_
Yg adidas tu cntik pulak cutting & kualiti printing bj tu,_
Pihak-pihak yang terbabit dalam rayuan itu dikehendaki mengemukakan hujahan bertulis mereka pada 29 Mac,_
Cuteeeee box nice,_
nmpk menarik jgk la bila pakai,_
"This the third time we bought from this seller, very good communication, sometimes even the items not available, they will arrange second delivery when their stocks come",_
sy suka wrna nya dan akan beli lagi,_
"Came in good condition, no leak",_
"In Brisbane's Story Bridge Hotel, however, things are rather more peculiar: the 39th Cockroach Racing Gold Cup will take place there this year",_
Will buy other flavours next time,_
Ini seller memang padu,_
received item as order,_
Baju nice terbaikkkkkkkkkkkkkkkkkkkkkkkkkkkkkkkkkkkkkkkkkkkkkkkkkkkkkkkkkkkkkkkkkkkkkkkkkkkkkkk,_
"'I'm proud of this project, she explained",_
Pasti lebih memudahkan merchant,_
"2022, received on 3",_
order different colour but,_
"Delivered safely, just the right size and comfortable to wear",_
Tpi mmg cantik jam dia,_
Ain't gonna say anything but somehow sometimes yes but no literally and up is not down likewise,_
next nak order lagi🥰,_
Belian yg berbaloi,_
tk pelh jnji dh smpai,_
"Pic xde kena mengena ye, barang dah sampai, nice",_
nt repeat balik,_
"Sorry gmbr & vdeo tkde kena mengena sbb scrub kat toilet serious best sgt scrub ni, lepas pakai mmg wangi dan lembut gila, mmg husband jd gewwamm jeeee tauu",_
This is for you!,_
Chloe Liew,_
"semestinya kain sungguh sedap mcm mahal punya seluarrr hebaattt saiz pun okeee pregnant smpi bersalin pun muat ni best boleh adjust2, barang sampai lajuu thanks seller!",_
Overall 9,_
1 item has some defect but can still be used,_
semua sedapp terubat rindu jajan indonesia,_
"Handbag herlokkk sgt, sesuai untuk org yg tak suka bawak banyak barang",_
"He hailed the healthy development of bilateral ties in recent years against the backdrop of the COVID-19 pandemic, a new period of global turbulence and transformation, and the many challenges and crises facing humanity",_
Brought it during 12,_
can customise colour and the material is cotton and not thin,_
Warna putih cantik cuma lama kelamaan akan jadi kuning itu basic lah,_
Material baju sedap pakai kain jenis sejuk tapi saya beli 5helai,_
material okay & kemas,_
We have also been heavily programmed by the Louis Pasteur &quot,_
tapi ok la pakai untuk tidur,_
Hai barang dah sampai semua ok terima kasih terbaik terbaik terbaik terbaik,_
Nanti i repeat lagi tau,_
mix kaler yg cun,_
mudah membuang,_
suka dooh,_
cantikkkkk tq seller ingt sya nk pki msa rya tp da hbis rya bru smpi🤣 x apa la jnji puas ht sma mcm dlm gmbr,_
barang ok baik sampai lambat sbb shoppe express dah tak express lagi siap extend 6 days 🤦‍ hapoooooo,_
"Selipar okay,",_
s Beautiful Twitter:-$MENTION$,_
The role of prime minister is seen as more powerful than that of president,_
"Barang selamat mendarat di rumah ku ,syurgaku,terbaekkk",_
Sebab laju,_
Delivery service fast and packaging good,_
semoga dapat menyerap air dengan sempurna,_
9 from 2020,_
delivery laju gile2 mmg tiptop seller,_
Rasanya dah berbelas kali dah beli,_
Repurchase N time,_
1st haritu beli sblm bby keluar,_
Baramg harga berpatutan dengan kapasiti penyimpanan data,_
"Menteri Besar, Datuk Seri Muhammad Sanusi Md Nor, berkata keputusan itu dibuat sebagai mentaati perintah Allah selain menunjukkan rasa syukur kepada nikmat yang diberikan kepada negeri ini",_
"ve asked me to be patient until their engineers have a fix, so I&$HASHTAG$",_
cheaper price recommended !,_
Puting jnis pnjg ni sgt suit for newborn daripada puting wide neck yg lain,_
The colour is as advertise as in the picture,_
"Packaging okay, secure",_
Добавить,_
All the sharing on social media makes it worse,_
Brang pom cantik,_
dh repeat kali ke 7 rasanya ni hahaha,_
Kain pun selesa saiz pun okey,_
"Kain sedap berbaloi beli terbaik ,",_
Dapat seperti dalam gambar takde defect takde kotor !,_
"The domestically transmitted cases were reported in Beijing, the National Health Commission said in its daily report",_
Contain BABI FAT,_
packaging paling bagus sekali,_
Ank suke sagt,_
Ha tu dia baru sampai,_
I dont know what am I talking about,_
seller ni bagus jual yg ori so korang rajin2 la baca komen ye,_
"27mil for the third quarter ended Sept 30, 2021 (Q3'21), compared with a net loss of RM2",_
Overall cantik je dan nampak je tulisan,_
"Under Kohli, India reached the semi-finals of the 50-overs World Cup in 2019 but could not advance beyond the group stage at this year's T20 World Cup in the United Arab Emirates",_
ll walk out from this comment session,_
bag tebal dan berkualiti sepadan dengan harga,_
Tak ada color yg sama,_
Barang diterima dalam keadaan yang baik semuanya,_
", aritu saja je belii sbb tgok murahh mmng berbaloiiiii ,",_
penghntrn yg cepat,_
brg semua ok bfungsi dgn baik,_
padU,_
barang sama seperti dalam gambar,_
contoh mcm gmbaqqq,_
"Very good deal also, thank you",_
"Barang okey, tiada masalah",_
Sila ke CAC terdekat bagi penilaian jika masih belum ke sana,_
Blh jd sambal serbaguna,_
seller letak bubble wrap banyak,_
Video dengan gambar takde kena mengena,_
"Color: bright, good motive",_
kasut lawa,_
yg honewdew bau sdp sgt,_
cutecutecuteeeee,_
kali ni barang sampai cepat,_
"Sekarang boleh beli ni je,",_
Coverage:packing mantap,_
Items received in great condition and very fast delivery from The Seller,_
Mesti nak beli lagi nanti,_
Flagship Killer $MENTION$,_
Lawa bajunya,_
Fast delivery abam runner pun cepat hantar,_
Kena chat dengan seller kalau dah teringin,_
Biar larut,_
i luv the material and yk i luv the album and this can be my next cover to be in my wall >,_
Durability:Panjang 2 meter,_
"delivery also okay ,",_
Sale kan kita borong banyak2 nnt kita borong lagi tq,_
Second order have make with seller,_
Bnda ni senang je nk pasang but struggle sikit nk tekan butang tu,_
"Very fast, Thank you So much, very friendly, definitely buy again from this seller",_
Btw cantik sgt nenek suka,_
Barang ok takde defect walaupun sampai plastik koyak2,_
Perfect for overnight oat as it does not have additional seasoning,_
Selipar dah sampai cantik boleh la saya beli ya terima kasih,_
Ambik sluar saiz xl wrna biru kcik htam bsar,_
Yoongi too much pressure for permission to dance to be on the same spot as butter but i guess all we can do is try!,_
Dah bertahun saya guna,_
apa PON saya suka cantik,_
Product is nicely protected and wrapped,_
🤣🤔🤣🤔🤣,_
Material:kain dia berat jadi jatuh helok bila pakai,_
Produk kualiti out,_
Belum cuba lg so akan bg review once dah cuba ye,_
Hopefully ok boleh repeat lg,_
Delivery guys also nice,_
Good and superb fast delivery within 24hrs received in good packaging,_
Except u have big butt tapi baju still labuh utk cover the big butt,_
"So far yg ready stock malaysia, seller ni yg termurah",_
harap2 zip boleh bertahan lama,_
"Barang sampai tersangat cepat, tq bos",_
Buat utk pakai raya done!,_
jam sangat terbaikk,_
Seller punya package teruk,_
"Material kain dia soft giler sama mcm dlam gmbar , memang puas hty",_
Terbaik sller pon baik kompem dlu sblm pghntran,_
Semua barang ok padan la dgn harga,_
SORRY VIDEO XDE KENE MENGENA,_
"Kecik je bekas dia tapi alhamdulillah okeh sngat dgn muka , muka i tak terlalu berminyakk selepas beberapa jam pakai powder ni , i love sngt ii , texture pon ringan makeup tahan lama",_
"After the purchase, the thread was taken off and I sewed it back by myself",_
Cuma terkejut kali ni beli seller balut gitu aje sebaik takde koyak ke apa,_
Love them al delivery are very fast🥰🥰,_
Repeat purchase as milk storage at average price compared to those branded bags,_
Utk yg jenis penyabar mungkin rasa senang utk pasang,_
Asal apa apa diblokir,_
"selalu beli seluar mesti bahagian peha ketat, tapi ni best,",_
Dress ni cantik sangatt sangatt !,_
the price soo cheapp love it thnks,_
Baranggg Selamat sampai dalam keadaan baikkk,_
Okok🤙🤙🤙🤙🤙🤙🤙,_
tersilap pilih kain,_
Tudung cantik dan sy sgt berpuas hati,_
shipping mmg lajuuu,_
Google MeetCaption caption,_
My husband's favourite brand,_
New TNG for rentas negeri,_
tapi kain dia mmg lembut best,_
naega jinja jinja gwenchana after all naega can speak hangul,_
Fast delivery convenient just ensure always remained lower priceThank you,_
Cute sangat and kain pun elok,_
Quality:nice and pack well with double layer bubble wrap,_
"thankyouu sampai daa , cept jugalaa sampai , nnti bolee repeat lgi :3",_
Menarik dan cantik berpadanan dengan harga,_
Muat untuk diletak dalam beg pinggang,_
nk bukak apapun dah tk blh nk bukak my digi pn xblh susah mcmni blh bgi penjelasan,_
Kalini okay,_
I bought from this seller before this order and 3 bulbs malfunctioned,_
ada baca review kata nak pusing button tepi tu susah bila dah pakai case ni,_
"Brng dh smpai,Terbaik bos",_
So far sume ok tqsm seller,_
"Justeru, ringgit boleh menyusut 0",_
The person has already comes home before the package arrives,_
The bag size is perfect for 3D2N trip,_
Kalau melecet,_
Nasib baik selamat je sampai,_
Item dah diterima tapi kuantitinya x cukup 35 pcs,_
superb fast delivery goods is all cute excellent service by seller,_
"Order 7/9 - 10/9 (3D) Scaff tudung jenis terletak, lembut, senang adjust sbb belakang ada tali",_
"very satisfied with my order, the casing is very durable and can protect your phone after a fall or drop",_
"According to Yeoh, Fave Group serves 40,000 small and medium enterprises (SMEs), of which 20,000 are in Malaysia, and are predominantly offline",_
This my second units purchased for the others car,_
Semua Okey okey oky oky oky oky oky okay okay okay okay okay okay okay,_
lg lhkhlghx lg LHDN lg hlxlhxhdlhxyzlhxhhxlhxglxgzhzhzlhhxlgzhlzhlzgzlhzhlzlhzlhzhlzlhzlhlhzhlzlhzlhzlhxhlzhlzhxhzhlzlhzlhzlhzlhzlh,_
"Full of inconvenience, for restaurants, drivers, and every single customer",_
kualit brg terbaik,_
benda dh byar tapi brg tk smpai,_
PUBG review,_
Bagus sngt2,_
Meanwhile 32 refugees & asylum seekers remain detained in Park Hotel,_
"It looks amazing n everything till i find out its still cost around like $1000 like understand the build n quality might be worth $1000, like i know there&$HASHTAG$",_
Size L memang ngamsoi wa cakap lu,_
Flight 2,_
Perkongsian berbayar hahaha memang cepat sampai bag pun padu,_
Sgt2 peramah kaknis nie,_
boleh di buat buaian utk baby,_
beg Comel dah diterima,_
Bajet 2022 perlu teruskan bantuan tunai untuk rakyat,_
"Packaging ok, product is good, delivery abit slow, good value for money",_
"All size received, not open yet",_
Baru tau ada sabun utk samak,_
i have received the crystal i buy from you,_
packagingg kemass !,_
dah received parcel !,_
tpi sya puas hati dgn baju semua !,_
Order watermelon red tp dpt pink hahaha takpelah benda dah murah guna je laa,_
"Harga yg murah, quality yg bagus, barang helok puas hati",_
Seller pos barang slps 2hari,_
"Product receive in good condition, highly recommended if you need to laminate small cards or A4 size paper",_
I gave u first like,_
"Material kain best, lembut je",_
kalau bab washer and rinse mmg bersih baju,_
"Barang sampai dalam keadaan yang baik, quality ok,harga barang memang memuaskan, thanks selar 🤝🤝🤝🤝",_
magnet agak kuat,_
Kok susah banget order ya,_
Material:Material dia sangat selesa untuk dipakai,_
"Penghantaran pantas,pembungkusan pun bagus,siap bubble wrap dan kotak",_
Coklat meleleh,_
nice pakaging safety,_
delivery cepat jugak dalam 2 hari,_
Cuma banyak kali juga la tengok video cara pasang,_
"good quality of liquid product, cloths smell fresh and clean",_
Fast delivery and received in good condition hope all is well functions,_
Siap dpt lucky draw lagi highly recommended utk beli kt sini sbb fast delivery,_
4 per cent of GDP in 2019,_
Sape yang nak cepat baik beli tempat lain,_
Semoga menjadi lebih mudah,_
Puashati dengan barang yang dibeli,_
Baju muat muat ja ngan anak terima kasih seller barang dh sampai terbaik cepat sampai lagi pulak tu pos overseas lak cepat penghantaran puas hati ngan harga,_
Overall products are original and satisfied with the services,_
I am disappointed because the product is also a real picture,_
tp kalo pki ok je,_
"Sorry video x berkaitan, gmba pon ss",_
Seller bagus sebab text to confirm back items before proceed,_
DIGI MANIPULATE OUR MONEY,_
"Packaging pun secure,ada bubble wrap tebal,so dont worries ladies hehehe",_
can put on your desk as well as make it stand,_
!IINI,_
A bit sweet,_
will consider to buy something with you guys again in the future,_
Berkerja sekurang kurangnya 3 BULAN,_
Seller laju ye post out goodjob!,_
Kain diaa jenis mcam lipatan batik tapi kau ikat kat pinggang,_
android tv blom try lagi,_
Nie sy dh repeat x3 dh,_
Kok aplikasi jdi makin susah update terus mohon pncerahan,_
"The conflict in Yemen, everyone knows, is a proxy war between Saudi Arabia and Iran",_
"setara dengan harga, ringan selesa pakai boleh buat utk brisk walk, tq seller",_
"Diterima Dalam keadaan baik Dan cantik, terima kasih penjual",_
Been using this for quite a period,_
Tried once and its nice to use and heat up fast,_
Beli masa pay day 25 hari bulan,_
sesuai utk doorgift,_
Opss !,_
Tudung dalam keadaan yang baik,_
Blue colour is pretty !,_
Hahahahahahahahahshshshshshshshshshs,_
Nak telekung warna putih,_
"Overall seller bagus,",_
12 12 sales got extra coin and voucher,_
"Tapak bawah ada kesan kotor sikit, tapi bila cuci dengan alcohol swab, hilang je",_
now hampir 1 pek tu pampers warna putih mmg x guna,_
Beli siap mahal berganda !,_
Kotak memang ngam,_
Fast delivery which only took 5 - 6 days,_
da banyak kali beli ngan seller ni,_
2045:the apple refrigerator,_
barang baru sahaja mendarat ngam kene dengan harga,_
Duduk kat rumah tunggu barang je,_
"Ingin mencari Gift Set Surprise yang cantik dan menarik,",_
One of the jersey has been swap to another design without permission,_
Xiaomi is getting better and greater,_
Sounds choices are acceptable,_
2hari je sampai,_
barang sampai dalam keadaan baikthank youremote pon berfungsi dengan bagusss,_
"Alhamdulillah barang sampai dalam keadaan yang baik , cantik sngat2, berbaloi dengan harga 🥰",_
terbaiiiiiikkkkk,_
Terrrrrbaaaaikkkkkkkkkkkkkkkkkkkkkkkkkkkkkkkkkkkkkk,_
That Sierra Blue pro max looks amazing!,_
boleh pakai ke tak,_
kalau ambik saiz M dia macam melekat sikit kat badan,_
yg pa,_
0Vinda Deluxe Dry Kitchen Towel (3+1)x80s,_
"Nice thanks, worth the price",_
Good packaging and fast received,_
Wrapping r really satisfied n items received in condition keep it on seller,_
"harga murah , comel jeee sukaaa sangatt",_
Sukerr dan terbaik,_
Barang dh sampai barang dh sampai barang dh sampai,_
This app is excellent for Hiit and keeping u focused,_
🤙🤙tq saleer,_
Ker Shinn,_
Functionality:Rak pelbagai,_
kain pn sedap pkai,_
Kalau mengandung kaki bengkak memang sesuai pakai kasut ni sebab banyak ruang,_
Barang dah smpai terbaikkkkkkkkkkkkkkkkkkkkkkkkkkkkkkkj,_
Really need a new phone thats pretty much it,_
Harga murah Compared kedai lain,_
"dengan begitu banyak pertukaran, pemain-pemain perlu cukup yakin untuk menunjukkan betapa bagusnya mereka",_
i'll sew it again thankyou seller,_
"kain satin cantik,lembut lgi",_
"barang dh sampai dengan elok,dlm gmbr nmpk xdelah tinggi sngt tup ii rupanyer tinggi lah jgak",_
No coverage in my location,_
Dan ruangan yg besar boleh letak barang lagi,_
Saya guna letak sos,_
expired 01,_
"As usual, well packaged with bubble wrap and box, fast delivery",_
vvhvfxbdhfhgdggdggddgxdffgfccfcgfhghgf deffhggghdfhfgfffdhdgfhhg dhrhfdesfghhhdc dgrdhfdgghrtuwh dhfghggdfhhhhh,_
Murah compared to other shop,_
"To buy a new pass, go to Hotlink Postpaid app $MENTION$ $URL$",_
tengok budak gemuk 2 ekor tu dah la,_
seller please reply my msg,_
What can we use other than sausage,_
Kak cobain beli mainan love Diana dongkalau gak ada yaudah,_
3 Hari dh sampai,_
Yang penapis tu macam kemik sikit tapi okayla besaq jugak hahahahahaha,_
Iphone takde masalah,_
Quality of the product matches wt d price,_
5 sen sekilogram,_
Fast delivery and good packing product,_
33126573-1637518915,_
Item arrived in good cond,_
Sorry the video and picture tiada kaitan dengan produk,_
Keith Goh,_
Barang dh selamat mendarattt,_
thanks a lot to seller,_
harap2 menjadi nnti,_
Good quality and fits well,_
"Overall, product quality is comfortable",_
Didnt try it yet but i had tried it before and its so good,_
Beli entah kali ke berapa,_
order wrne putih 2 beg tp seller chat bg tau wrne putih dh abis so pilih wrne khaki pon cantik,_
Crispy anchovy,_
cuma plug ni bkn plug 3pin mcm yg ditulis,_
Balance of RM35,_
Haven't use the item yet,_
Ordered on 29 July and received on today,_
Berbaloi beli dua satu kat rumah satu kat pejabat,_
Same with pictures!,_
Pigment:not really but good for beginner,_
packing tip toppp,_
"seblah hmpir terbuka , dan saya trpaksa gam",_
the quality is so perfect ngl 🤰 thank you seller 🧜,_
Tak yah susah2 dah g kedai,_
Saya try guna pancake cokelat,_
Takde faedah pon,_
"dibungkus cantik,Al quran tak rosak pon",_
"Ship laju, kain pun sedap pakai",_
Alhamdulillah barang sampai dgn cepat n selamat n dlm keadaan baik,_
NICE PARCELNICE PARCEL,_
syukur bleh guna,_
But still ok to wear as it simple n easy,_
memang terbaik ye thankyou seller,_
paling best beli wktu 11,_
mantap Bosque,_
"Second time order, everything is okay, good packing and fast shipping thanks seller",_
Terima barang tanpa sebarang kerosakan,_
Cuma nunggu nk di test di tmpt ada ikan dll,_
"I have been waiting 2hours for my food , no progress what so ever",_
There is warranty card in the box but haven't checked yet if stamped or not,_
Dapat free gift cekelat,_
d buy to upgrade from my LG G7 if I had the money,_
The app cant make payments for my account,_
I will continue to purchase at this seller,_
