Sentence,Tagged_Sentence
anyway mmg recommended n harga pun murah,_
penghantaran cepatttttt gilossssss,_
"Sori lated updated, thorrbaekk packing dgn seller ni",_
"Brg dah lama sampai cuma tak sempat nak nilai,",_
Memang rosak habis dibuatnya,_
Functionality:simple n cantik,_
Ni pembelian Kali k4,_
semuanya cukup,_
"So excited about this latest model, and wish I could get one of these",_
Sangat ngebantu,_
"Order color grey, dapat color lain",_
benda2 kecil la,_
Seller ships out quickly too after payment,_
ada free gift cute braclet,_
kinda fast because it's from oversease!,_
"The material is soft and cool, wearing in aircon room is better",_
muat utk laptop size 15,_
"Currently, I ask the riders if they have Gcash because I don't have cash anymore",_
fit to my body,_
Saiz 2XL & 3XL x byk beza,_
senang bentuk🥰 nanti blh shoping lg terima kasih,_
Receive item in good condition and tested OK,_
Sy beli & terima kasih,_
Senang n sedap,_
Should have wrapped them up,_
Bangladesh customer service employees lack of knowledge and not doing their job properly,_
Very nice in packing,_
"oke sih selama make grab, tapi makin lama makin dikit ya promonya, maklum anak kosan",_
Nasib baik brg dpt complete,_
IncreaseDeliveryRiderFee,_
I went to buy this afternoon but the stall was closed today,_
Brg sampai dlm keadaan yg baik dan mencukupi,_
setakat ni paling suka join live bundle this shop sbb seller freindly,_
2 of them same design,_
"Dr Sha'ari berkata, ICU hospital hibrid dan hospital bukan COVID-19 juga dimuatkan dengan pesakit bukan COVID-19",_
rugi lock 1,_
"Have a bit defect but serious matter, just maybe overlap by other items during delivery process",_
Nanti ada rezeki saya beli corak lain plak ye,_
hrp² dia suka,_
warna sma macam gambar,_
Penghantaran dalam kategori pantas juga walaupun dari Cina,_
Ok ori punya produk,_
"kedai buka, bila sudah order & buat payment, boleh pula kedai tutup",_
"26, 2",_
Shipping quite laju juga tau,_
But beli dgn dasher mmg superb,_
"Thank you seller, shipping laju harini order terus dia pos",_
"All received in good condition, well well well packing",_
"Sy da nk hbis sbotol ,daa hilng 2kg skrg nk order lagi",_
Seller terbaik!ajar sampai jadi,_
terbaik xmnyesal beli 🤭suka sangat,_
puass hati tudung cantikk kain tk lembik,_
Fast delivery from seller too,_
"Ordered 25-01-2022, arrived 26-01-2022",_
5 bintang kita payung,_
CEPAT PANTAS LAJU SELLER MEMEYYY TERBAIK BARANG SAMPAI DALAM KEADAAN BAIK,_
"last time order, lost bcz of flood, then, seller gave me rm10 voucher to buy new one",_
"comfortable to wear just nice lah the color, love it",_
bli utk anak yg nak lahir tahun depan,_
Cepat saller buat kerja,_
dah lama nak beli kasut tapak tebal,_
Everything nice but the size is smaller (by 1 to 2 sizes at least) already get one size bigger but stil small and tight,_
"Good product quality,good value for money,good n excellent service by seller,but hv to improve on product packing",_
Sudah berapa kali saya install aplikasi ini,_
Functionality:2 compartments divided with middle ziped part,_
Definitely will reorder from this Seller,_
dah pasang nanti kita up video,_
Baju cepat sampai,_
"Hahaha tq seller,even beli time sale,seller pos laju jek,cpt smpai",_
sory vdio xdk kena mgena,_
Ever so marvelous packaging,_
klau dh de bgtau ye,_
"But, I believe it will be worth it",_
expiry is good hence,_
Beli 6 sampai 6,_
Investors also poured $31 million into Ethereum products and funds last week,_
penghantaran 2 minggu ok la janji Sampai,_
So far function is ok,_
tapi both sesuai untuk digunakan pada hari panas,_
Senang utk orang bujang macam saya nak masak,_
Auwww thankyouuuu brg dh,_
dh test utk charge p30pro from 30 - 100,_
Adik pun suka kata nk beli nnti,_
Sangat cantik puas hati 🥰,_
Very good quality and very comfortable to make your shoes tight or pain free,_
Very fast delivery received in less than a week,_
So far x pernah kena hujan lg,_
seller pon bnyk share psal skincare,_
"material selesa gilaaa ,",_
"These are real people I'm painting, not just artist's impressions, whom viewers can relate to, he said",_
"When one talks about tourism sites in Zambia, the first thing that people think of is the Victoria Falls and a few wildlife game reserves",_
warna lampu boleh tukar2,_
Barang semua macam dalam gambar,_
terbaik comel je selipar baby shark,_
Functionality:Sensor functions,_
"Quality:barang smpai dlm keadaan baik, mask utk kid sdg elok, getah ok anak2 suka ,",_
It's a question that many Instagram users ask themselves: what's the right number of hashtags to add to a post?,_
but the quality is same,_
berat aku 105kg and tinggi 158cm,_
hehehe~,_
Besar sikit untuk dia tapi dia suka so ibu pun ok,_
Tttteeeeeerrrrrrrbbbbbbbbaaaaaiiiiiikkkkkkkkkkkk,_
The device is not bulky and fit nicely behind the rear view mirror,_
Erghhh sakit hati gila servis yg trbaru,_
May free earphone yan bakit wala andaya naman,_
LOVE SANGATTTTTTTTTTTTTTTTTTTTTTTTTTTTTTTTTTTTTTTTTTTTTT,_
my mum kerat bg pendek,_
hm siapa nak beli kat saya ?,_
good mapping,_
Really smooth results,_
I'm impressed how fast the delivery is from China,_
repeta s terbaibdhd,_
"seller boleh harap punya, jgn risau",_
Barang dan selamat sampai 🤗🤗,_
"The coffee produced using this bean taste very good, it is nutty and sweet taste",_
Nanti kita try moga sembuh la gatal gatal tgn saya ni,_
"oh my god cantik sgt ,tapi yg kecewakan sy cuma colour dia tak sama sgt mcm dlm gmbar",_
tqq so much,_
"1 midnight, SPX pickup same day 330pm!",_
Padahal rumah pagar tk kunci pun,_
Received my bumble bee yesterday,_
Standby untk puasa buat berbuka nnti overall boek cuma lmbt sikit nk ship tpi bila dh ship dlm sehari je dh sampai,_
everything is good as my video,_
Item arrived safely and well packaged,_
"Tudung dah dapat tapi warna biru black tak dapat seller tukar bagi warna hitam seller patutnya tanya kalau biru black dah habis, boleh tukar warna lain, ni seller tukar bagi warna hitam kalau hitam semua tak pa juga ni awning warna kelabu saya tak suka,",_
harapnya boleh tahan lama jgk la,_
Cepat panas & cepat masak,_
bole repeat lagi‍‍‍‍🧑‍🧑‍🧑‍🧑‍‍🤒,_
Saya beli Saje2 bosan shopping maggi kat sini selalu beli baju je,_
Lambat itu biase,_
tapi macam mana nak pakai bagi lawak?,_
Always ship out fast eventhough during sales,_
kopi 3in1 paling sedap!,_
t have Twitter but my Instagram is $MENTION$,_
Penghantaran yg pantas dan harga yang berpatutan,_
So bed,_
Check out my video review!,_
Can repeat for other design and color next time,_
worth it cheaper than market will buy again,_
)berdoza,_
Tudiaaaa,_
Kualiti pun ok biarpun murah,_
TQ Seller n Shoppe,_
Now i learn we always have take out for night snacks,_
I was hoping for birthday note only but i get more !,_
"I'm so happy I bought my Herkimer, Blue Moonstone and Gold Rutile here!",_
barang semua okay takde pecah pun,_
Brang dh selamat smpai dgan jaya nya,_
"Packaging kemas kotak besar, bubble wrap",_
Deliver in good packing,_
Tak gatal dan keras,_
"Serahan pantas, good value for money and very good packagingSerahan pantas, good value for money and very good packagingSerahan pantas, good value for money and very good packaging",_
"BAMAKO (Reuters) - Mali's transitional government is conscious of its commitment to a fixed deadline for arranging elections to restore democracy after last year's coup, Prime Minister Choguel Maiga said on Friday",_
pos sgt cepat,_
"Jalinan kerjasama yang pelbagai, contohnya melalui program Micro Industry Hub (MIH) antara UiTM dan industri setakat ini membuka lebih luas lagi persiapan teknologi serta keberadaan pasaran semasa",_
Harga murah daripada biasa dan daripada kedai lain,_
Sesuai dengan cuaca kat malaysia dan kena dengan harga,_
"Nampak macam tinggi dan keras, tapi bila letak kepala, sangat lembut",_
"Beliau berkata, Malaysia pernah menjadi pengeluar getah asli utama dunia pada 1930-an, namun pada 2020 eksport getah asli Malaysia hanya bernilai RM3",_
"138: Lee Jeong-hyun (Kor) 70-68, Cassie Porter (Aus) 69-69, Hwang You-min (Kor) 69-69, Ashley Lau (Mas) 69-69",_
Repeat again from this seller penghantaran pantas and yang paling penting even harga murah dia punya kualiti tak murah,_
Hair dryer okay sangat,_
"Mohd Yusof berkata, kaedah dakwah terbaik adalah dengan cara bijaksana berpandukan ajaran ASWJ seperti diamalkan oleh masyarakat Islam ketika ini",_
Quality product for reasonable price,_
Wrap by courier bag only,_
warna baju pun lawa,_
Terbaikkklahhhhhhhhhhhhh terbaikkk terbaikk terbaikk terbaikk,_
Jiminiiiiii my love I loveeee you,_
Beli buah potong je,_
Byk kali repeat order dgn seller comey ni,_
cuteness overload,_
kain dia pun lembut ja,_
The8 is so handsome,_
"memang best sangat sangat habis blackhead whitehead keluar banyakkk rasa hidung licin jaa lepastu serum dia best , wangi pulak tuuu suka sangatt dahla harga murah kena pakai 2 3 kali seminggu",_
Vinod Sivagnanam Catherine McGruder-O'Hair,_
tp labuh skit ja,_
Packing kemas tq seller,_
"bestttttt pants for child,",_
"Fast delivery, the quality is good, very soft, comfortable of wearing, only things is too big for me ordered wrong size, have to buy again",_
mmg puas hati dengan packing,_
"Digital pieces can be worn, collected and traded in the metaverse so there's no need for physical counterparts, said The Fabricant, a virtual fashion house",_
Already know that road is famous for racing,_
It a cool app,_
"The economy, one of the fastest-growing in Asia before the coronavirus hit, expanded 7",_
The Kingston Microsd card is fast for transferring data between PC and android phone,_
bila2 bole beli ahazzzz,_
love yourself unconditionally,_
"Barang baik,berfungsi dgn baik,quality seangkatan dgn harga",_
Boleh beli mesin utk wap muka yg kecik² mcm sy punye tu je,_
tak kecik sesuai dengan pingggan,_
Buy 2 shoes with same saiz but arrived with different saiz,_
Seller bungkus produk dengan baik sekali,_
Best sangat senang kemas,_
haha nk bagi family,_
Tasted the crisps and plums,_
shining and the water smoothly spread,_
Tak pernah tak suka jumpsuit dr seller ni,_
TQ seller TQ abam courier,_
tak bukak lagi kotak,_
Barang diterima dlm keadaan baik terima kasih,_
Pasti repeat semula,_
my item missing,_
Already use the washing machine,_
Tq ye seller dah brape kali repeat order,_
Thanks kain micro fibre sangat murah dri kedai,_
So we shared,_
Sambal pack okay je,_
Senang je nak pasang kena make sure sticker 1 dekat bahagian ipad,_
Rm8 UNLIMITED HIGH SPEED INTERNET but speed is 300kbps?,_
products Quality,_
smue cukop laengkap,_
Rasanya akan beli lagi akan datang sebab harga murah,_
Xda wrapping lain d dalam,_
"Condition teruk, logo senget, tak sama saiz, getah stokin pun tak sama saiz",_
Thank you seller for your feedback,_
Sesuai nak buat hantaran kawin,_
kalau yg murah punya kan tali warna putih tu dia punya gam halah senang tanggal(nyesal beli murah haha malu je kalau putus kat public) - sorry for da vd,_
Quite bigger and more than others,_
murahhhhh sgt grab skrg korang,_
saiz 7/8 untuk budak ni yang baru usia 2tahun setengah,_
Perkemaskan pakaging,_
Item received I,_
Memang trusted seller terima kasih,_
"Free jee ,",_
Takde dah masalah heng,_
So far all products are working well,_
Agak sedikit jarang yer,_
What is going on with the app?,_
"Hi MKBHD , As google has confirmed, there is no plan of launching pixel 6 &amp",_
Btw barang dah smpai dgn baik Dan berfungsi dgn sngt baik,_
Just can put clothes only,_
banyak kali dah repeat beli kt shop nih,_
The products was packed in the plastic bag,_
dpt main less than 10 minutes after fully charged,_
Kain nipis igtkan bergetah,_
belum Cuba lagi harap dapat berfungsi dengan baik,_
-penghantaran 2 hari,_
Received in good condition on 1,_
Gosok kuat-kuat pakai mekap remover baru hilang,_
"Yg pink sangat cantik,",_
Effectiveness:Utk mencerahkan,_
"Meanwhile, economists believe the Omicron strain of COVID-19 is unlikely to prevent a second straight year of above-trend growth, even as they - and more importantly epidemiologists and public health experts - try to assess the variant's impact on health services given its apparent reduced severity yet increased transmissibility",_
"function elok, selamat dah pasang, wap pun dah keluar",_
tp tetap,_
Item rec'd in good condition,_
kualiti Barang sesuai dgn harga,_
Bought as a wedding gift,_
Functionality:boleh msukkan kasut dengan kemas,_
And The product is ok,_
senang nak pasang!,_
I'd suggest to put bubble wrap for other buyer,_
seller ship up very fast,_
Looks good but not available at us,_
Very disappointed the seller service~ delivery delay din help me solve it~ after Christmas day just received the product,_
Dia terlalu baggy best dah cuma singkat sgt dpn tu,_
"Fast delivery, package received in good condition",_
Suitable for hanging kids clothing,_
Mmg trbaikkk,_
baru semalam beli arie nie dah sampai,_
Dlivery pantas kilat,_
Tak sempat nak ke eco bulan puasa ni,_
Santekkkk tq sellerr,_
okla dpt harga murah dan penghantaran juga cepat,_
"The stuff is very good, the transportation is fast, thank you the seller",_
saya puas pelayanan mereka,_
"Eczema di kaki saya dah lama tak baik2, kejap baik kejap luka balik",_
beli 5 dpt 2 free,_
"Tq seller , barang selamat sampai dgn keadaan baik",_
barang da sampai dah lame,_
malasnya la nak taip,_
Tp brg mmg terbaikkkkk,_
"Ok untuk awb macam tak sesuai sebab kecik sikit, tapi labelling takde masalah",_
lembut eloksss jeee in loveee sangattt 🥰,_
Good read!,_
also for abam Jnt thanks yea,_
"- Cable nie 50cm, panjang dari cable asal yg 30cm je",_
"OTW Uninstall, grabfood pada ga nyantol",_
ngam2 H164 w59 sz30,_
Veryfast delivery and Excellent Service By seller,_
Asam laksa 30092022,_
Have tried the product and satisfy with the result,_
Beliau berkata Sabah FC terbuka untuk menerima mana-mana pemain termasuk Rozaimi menyertai pasukan itu namun mereka yang berminat perlu menghadiri sesi ujian dan memenuhi kriteria ditetapkan Kim Swee,_
"Walaupun nafas agak susah sikit, tapi boleh rasa confident sikit bila pakai",_
The amount of oil in Cushing would be much lower if not for the White House's decision last year to release millions of barrels of crude from the country's Strategic Petroleum Reserve (SPR),_
Hahahah ok laa nice laaaa,_
Dpt free gift pelekat,_
Creases easily,_
"Good value of money, Good product quality and Excellent service by seller",_
Dah ketiga kali beli baju kt kedai ni,_
Mccedrick,_
Kualiti produk baik🤗,_
"hope takde pening pening sebab bekerja , kalau jadi saya repeat kat sini lagi hehe thankyou seller !",_
Dpt yg sejuk tp xpa lh,_
"Beliau berkata, ia adalah manual yang ditambah baik bagi keperluan berkaitan skim pensijilan halal Malaysia bagi kategori domestik dan pengilangan luar negara",_
minyak sampai semua & takda pecah,_
tq seller🤗 selamat berpuasa,_
Size is smaller than the ones I bought from others,_
Semoga selesa pakai utk ke umrah,_
Tqsm🤎,_
Baju dah sampai tapi bila pakai cutting macam tak nice dekat badan,_
Order at 21/3,_
Finally get a new one after Miband 3,_
which is sufficient (for me),_
vv fast shipment,_
Bad Management!,_
This is the first foldable I&$HASHTAG$,_
"Thank you Aiman Azlan for publishing this book, really help me to understand sekufu in various way",_
Quality:gambar takde kena ngena sbb gmbar dan video dah hilang,_
"Normally pakai M but order XL if not tangan bawah ketiak sempit, i refer other comment",_
"Mantap tp kalau korang nak beli, beli lagi satu model clip tech",_
Quality is soft & cooling,_
beli satu je sebab selalu kat cover rim tayar depan yang tanggal,_
Nyicoh Soscili and cheese tu pun jjadi jugok,_
"Barang ok,sesuai dengan harga y murah",_
kereta smua ok terbaik,_
"Oil spills that happen in rivers, bays and the ocean most often are caused by accidents involving tankers, barges, pipelines, refineries, drilling rigs and storage facilities, but also occur from recreational boats and in marinas",_
pink soft cantik,_
"anyway tq seller, doakan sy selamat bersalin ya",_
: Mi sells thir product for 1,_
"Terbaik, terima kasih barang selamat sampai dengan selamat",_
So seller pun dpt kurangkan cost beli syringe yg halussssss drpd bazir beli yg besar mahal & tk dpt guna langsung sbb jarum besar gilaaa wei,_
rupanya comel je hihi colour pun cantik gila 🥰 berbaloi boleh repeat lagi lain kali 🤗 tq seller,_
Beg tak panjang mcm ala ala beg balik kg tu tp tinggi,_
Cuma ada benang yg terkeluar di lengan baju,_
Texture:Best nmpk kulit mcm basah² gitu bila pkai foundation nie,_
tak sempat nak amek gambar,_
mmg original oil filter,_
Fast delivery and seller bungkus mmg terbaikk,_
"kain best, jarang sikit",_
Ngam2 fit the casing,_
Mmg recomemded,_
Thanks freegift coklat daim tu ehe,_
The mask is soft anda pretty a bit thin but okay since its used for second layer good,_
Kasut dah sampai cantik sangat actually sy bg 5 bintang sebab cantik,_
"Items arrived very fast, very comfortable to wear, knee feels less stress after wearing it",_
"2 hari dah sampai , best gila tau acne patch ni , mmg melekat dengan betul , tarik segala isi jerawat",_
LAYANAN CHAT SELLER TERBAIK,_
Nice bage adidas and fast delivery and Good value for money b,_
It's so difficult to find it nowadays,_
"Penghantaran laju, packing kemas, siap ada gula² free lagi",_
seller klw dapat longgarkan sikit seluar lagi bagus jadi kaki tidak terbentuk sangat,_
selesa pakai boleh repeat lagii,_
so I dont know whether it is true 100 cotton not,_
We didn't have outside exposure and there were no competitions,_
"• the need to equip students with the skills to learn independently, be motivated, resilient, empowered to learn in both physical and cyber settings",_
Buku dalam keadaan baik dan berbalut elok,_
product came in a good condition and also good quality product,_
"Barang sampai dalam best condition, in box and a lot of bubble wrap",_
"brg saya sdh dpt,bungkusan elok takde pecah",_
"Tapi labuh sikit, tinggi saya 153cm je and berat 75kg",_
very powerful protection,_
8 and received on 20,_
but the important thing is to know,_
Semalam order harini sampai siss,_
Received 14/3 shopee express,_
"Terbaik, terbaik, terbaik,Terbaik, terbaik, terbaik,Terbaik, terbaik, terbaik,",_
However it's not easy to fill sanitizer with this funnel due to the air pressure in the bottle,_
Durability:dapat berfungsi,_
:-):-):-):-):-):-):-):-):-):-):-):-):-):-):-):-):-):-):-):-):-):-):-)(‿)(‿)(‿)( ‿)( ‿)˖ᵕ༚ᵕ⑅(∀)(∀)(∀)(‿)(‿)(‿)(‿)(‿)(‿)(‿)(‿)(‿)(‿)(‿)(‿)(‿),_
Mantab2 mantab fast delivery,_
Nak cuba terus ke seller mudah mesra,_
terpaduuuuuu,_
Murah sgt beli online,_
"aku tegas suruh hntr jgak, then dia hntr",_
Walaupun alamat dah request mintak tukar,_
Mmg selalu beli pttern cmne,_
THANKYOU SELLERR,_
tak sakit tangan,_
seller respons baik thankssssssssssssskiu,_
Tanya seller dan seller bg refund utk 10 pack tu,_
"utk ank2, material nipis je",_
"Lapan entiti ini menyokong secara aktif pengawasan dan penjejakan terhadap ahli kumpulan minoriti agama serta etnik di PRC (Republik Rakyat China), dengan kebanyakannya membabitkan umat Islam Uighur di Xinjiang, kata Setiausaha Negara, Antony Blinken",_
Cantik menarik tertarik baju memang sedap pakai baju pakai sedap sedap pakai baju,_
Anime figure yg cantik,_
"Kain okay, tapi ada satu kain macam ada stain, yellowish color",_
Barang elok saiz dia silap tapi tak paa,_
Tk busuk pon,_
tp bleh je guna utk basahan dkt rumah,_
Conte ucap selamat tinggal kepada Itali,_
Small portion,_
pembungkusan memang terbaikk sgt berpuas hati,_
Laju sungguh keje seller nie,_
Like good,_
Then lucky me suddenly check the stock and found out seller restock color white & apricot,_
Couldn't find any local seller,_
"SKS plans to focus on the unserved and underserved routes, according to its statement",_
perhantaran dia lambat cikitt apa2 pn memang cantik,_
Alhamdulillah mmg menjadi utk milk booster,_
Masyaallah ngiler,_
Nasib baik beli 1 je & murah,_
"Dah sampaii , penghantaran yg sangat cepatt",_
Cuma tambah RM100 kira Ok,_
Alhamdulillah ubat resdung dh sampai,_
price is way more cheaper than supermarket,_
Material:brng baik,_
"Sebelum ini, melalui entri Instagram (IG), Rafidah mendedahkan pernah mengalami gangguan seksual di tempat kerja",_
Cantik sgt padan dgn saiz,_
barang baik dan sedap,_
look soft and nice colour,_
Repeating orders here,_
good quality good customer service and fast delivery service,_
Gigih ke tidokkkk 🤣🤣,_
fikir banyak² yer,_
My cats loving it so much,_
luv it 🥰‼,_
berminat nak purchased chocojar or nak jdi agent bole ke shopee saya,_
Seluar xde tgh basuh,_
Oder batery,_
Please give me sir is use my online classes,_
Beg cantik even penghantaran lambat,_
"Cancelled my pandapro subscription right after I saw a complaint about you guys charging so much on the merchants and even getting a percentage from driver's tips,",_
"It hydrates and fix my dull complexion, especially the rose",_
Puas hati boleh sanitize rumah,_
i bought so many times alredi from this seller,_
s why I like them,_
"items is good condition, but nothing is bad",_
Brg xleh guna langsung,_
Nasib benda ni tahan lasak,_
"Cantik cantik, material bagus, harga berpatutan, besar banyak compartment macam2 boleh taruk, puas hati",_
"ank n suami suka nante bleh rpit lagi,",_
Anyone please mark jaehyun&$HASHTAG$,_
Thankk youuu thankk youuuuuuuuuuu,_
Order kan untuk makcik,_
30 pm to 10,_
Pose nanti boleh guna panas makanan,_
"With the art supplies prepared, Alis worked on her mega project painting on a sheet measuring 12m long and a metre-wide",_
Wow so lucky which I had a nintendo,_
Bungkusan terbaikkk!,_
Nnt nak beli lagi,_
berfungsii dgn baik,_
Not gonna lie its still pretty,_
Goods received in good contion,_
dan penghantaran pun cpt,_
Puas hati dgn kain tebal & tak kusut sesuai sgt buat kain sekolah tahan lasak,_
Huggiesss pants Huggiesss pants Huggiesss pants Huggiesss pants,_
selfie ring light pun cun,_
oder utk kawan2 plk,_
I bought this for 10 year old doter but quit big for her,_
"Tha k you,",_
Effectiveness:bagus tak cepat bocor,_
Please Dm for the phone Twitter:NikhilNivas36,_
kasut lawa selesa pakai,_
Material ok baik puashati soft rubber,_
Then sgt best and jimat kertas,_
All this is very meaningful,_
Good product quality really look so so so cute,_
"Mak suka, saya pun senang",_
Setakat aksi persahabatan saja,_
Recieved in good condition in box,_
"Meanwhile, Lavaron Sangsnit, director-general at the Fiscal Policy Office, insisted the government still had cash in hand from the Bt1 trillion relief fund",_
brg ok cntik & murah,_
Kain dia lembut biasa ja and jarang sikit,_
"The verdicts are deferred from last week, with Ms Suu Kyi and co-defendant Win Myint, the ousted president, facing jail terms of two years for incitement and three years for breaches of coronavirus protocols, if found guilty",_
Hihi thankyou will come again goodjob!,_
"Ordered on 11/1, received on 15/1 with good condition, thanks !",_
Superb nice and comfortable!,_
Kasut ngam dan dalam keadaan terbaik,_
Makase next time ripit lg,_
I have not tried them coffee but I hope it is really three beans like the seller's online description & it will be delicious,_
Love it🤍🤍🤍🤍🤍,_
Thankyou 🧡🤎,_
tp kenapa size M lebih besar dari L?,_
Cnatekk,_
"Seriously love it,",_
it's also well packaged !,_
Item received in a very secure and protected packaging,_
JALAN Pekan Ayer Itam in Penang will be closed in stages until Oct 15,_
"Alhamdulillah Barang selamat sampai dalam keadaan baik, mmg terbaik dah 7 thun guna, dari anak pertama sehingga yg no dua,serasi sekali",_
so tinggi i 151cm berat 44kg i ambik size S pon okay je sbb dia besar r skit tapi takpe i bole pakai heels,_
Warna putih nut dan olive,_
"rasanya L pun still longgar untuk saya, saja je ambik besar sikit sebab nak pakai untuk swimming, tapi okay je sebab material camni tak nampak gemok pun lagi selesa ada la kalau ada angin tu normal la nampak kembang sikit hehe in shaa Allah next time repeat saiz L pulak tq!",_
Sejujur saya ckp seller ni memng trbaik,_
"Servis mantap, laju",_
"I suka kaler dia sbb pastel, however color might looking different due to lighting kejap nampak mcm greyish blueish sikit kejap nampak pastel purple",_
BARANG TERPALING MANTUL,_
Dia comel je semanya for those yang kaki lebar like me,_
sy bg direct kat baby,_
Tapi barang dah sampai dengan jaya nyaaa,_
Barang sampai dalam keadaan baik dan kain elok,_
27 Syawwal,_
Cheaper then other shop,_
"Received with good condition, thanks for the free gift",_
it doesn't feel cheap at all~ i will buy more of this!,_
Manis tk berapa kuat sgt so tk hilang rasa kopi,_
Harga murah sikit dari kat kedai,_
"Last week, BTS debuted at No",_
puas hati alhamdulillah doakan Semoga dpermudahkan urusan kami ke umrah🤲,_
"2 carries two additional mutations in the spike protein, which the virus uses to enter cells",_
Thank you for the free gift🥰🥰,_
I dont know why it all mess up when I totally order food from a branch near my house like as always but it pops my order up at a faraway branch & a driver resulting 5 times expensive fee,_
Bau wangi n kuat,_
Tidak rugi kalau beli,_
Brg dlm keadaan baikk tq seller,_
Vlahovic berkata keputusannya ialah untuk kekal di rumah keduanya dekat Florence musim ini,_
"hard to change adress, very trouble,",_
Thankyouuuuuuuuuu ilobrllv,_
"Sgt recommended, tpi mse smpai Tu trkjot jgk SBB parcel besar , igt Kan apa la tdi",_
n i will definitely buy again,_
You guys are not helping SMEs,_
Sngt lembut dan gebu,_
"A, Repair needle:",_
Only packing need to be improved,_
"Alhamdulillah smua socks dh smpai,bole la ank sya pkai",_
"Tak ketat sgt,x longgar sgt",_
In sha ALLAH nk repeat order lagi,_
"They said that while nearly 80 of the adult population in the country has been vaccinated, this does not yet cover 80 of the overall population that is needed for herd immunity",_
