Sentence,Tagged_Sentence
Fast delivery and worth to buy compare to other shop,_
Lilin mmg cantik nmpk mcm mahal tp harga berpatutan berbaloi beli,_
material is soft and good,_
Any move to unlock value at Borsig would not be new for KNM,_
The price is reasonable berbanding beli diluar,_
Tapi petang 4-10-2021 shopee dah hantar msg inform post out dah,_
Dalam hari yang sama seller ship out,_
$MENTION$ 94 94🤗,_
"Done, no more, the point is cheap",_
Value for Money:Terbaik!,_
selamat beg yg smpai kpd penerima,_
"The quality is very good, and it last long, none of it broke yay",_
All complete set but not complete,_
Daebak mantap kebabom meletup sangat terkejut terbaik laju,_
Memang sangat mantap kerana ada cod dalam 3 hari je dah sampai,_
"GoStores, bit",_
Nasib baik la rm12 je,_
HotToys,_
dah sampai tq cu,_
tbh tho 128gb is plenty,_
tq seller moga terus dilimpahi rezeki,_
"Dah cuba pakai, berfungsi elok",_
the packaging was in a bad shape when it came,_
Good good good good good good good good Good good good good good good good good Good good good good good good good good Good good good good good good good good Good good good good good good good good Good good good good good good good good Good good good good good good good good,_
Berpuas hati seller,_
Nice blouse i loved it 🥰🥰🥰,_
Aroma:macam bau teh orang pantang,_
(Fun fact: Exxon's new HQ will be only a two-and-a-half-hour drive from Tesla Inc's new digs in Austin,_
Back beg is tiny,_
"berbaloi sangat2 dengan harga, quality pon ok 7/10 nice2 not bad",_
Puas hati gilosssssss !,_
The company recently announced it would let some iPhone users fix their own phones,_
Pantasssss !,_
"Good quality product same as per advert, bubble wrapped and comes with free gift too",_
"Siap dapat extender free, senang kalau x muat boleh trus pakai",_
yg lain ok shaja,_
dua2 remote function dgn baik,_
"3kali beli kain memang oke punya , betol2 puas hati",_
"Gooooooooood quality ,",_
wrna cantik sama mcm dlm gamabr,_
padahal kita dah cht dan bgitau maslh,_
Yg dtg kaler hijau,_
7181/7211 daripada 3,_
"SYDNEY: Australian casino operator Crown Resorts Ltd says it aims to offer gambling at a new Sydney resort early in 2022, more than a year after it opened, as it works with a regulator to address governance failures",_
mzu koi cne ltacun!,_
Hard to eject and insert left joy con controllers,_
"Size M untuk berat 68kg, tinggi 165cm",_
"Как всегда очень красиво, просто и, похоже, очень вкусно",_
I thing tje seller give me the wrong size of this Silicon Laptop Keypad Cover,_
"Packaging sangat baik, barang pun elok sebab seller guna kotak",_
semoga bermanafaat lah hook ni,_
You man is one of the best in you tube!,_
Barang dah sampai 4 hari dah tapi saya baru sempat nk komen,_
im sorry for the unrelated pic but the wallet is so pretty and istg the quality sumpah mantap iler like u can put a lot of cards in there and banyak lah compartment lepastu memang mantap lah mak saya suka thx seller,_
anyway affordable with the price,_
Nti akn repeat lagi,_
Tapak yg comfortable cuma tapak nya lekas licin,_
hrp batuk ank okeylh,_
InshaAllah lepas ni bole repeat order warna yang lain,_
ni pakai selepas 2 3 kli,_
setakat ni guna ok,_
"Asalnya risau takut courier buat hal, tp syukur",_
Harga pun murah Dari kedai lain,_
MCMC said the individual is not their employee and reported the account holder to LinkedIn for further action,_
"Kualiti, terbaikkkk",_
Murohhhhhh,_
"sampai pun kain oklah not bad, jenis licin dan warna macam biru2 sikit",_
Barang hanta dengan baik,_
2 Perhatian,_
Balabalablanaabalabalanalakshdlzosbskslasvbbdlzo ksbdncjdnkdbdkf lsdbndkfhfbdkdkd dkfbrbkdidbr dkfjebfnckflsmzmznd dkddbdnd kef jec kdd ke dmsoebd dkejd fkedbx kwjebdnxkdhr fkdhdh fkdhd fmfkdhd dkfjdbsmzlajsbzldj d jdnd f,_
cume 2 pasu,_
Come and buy here,_
Taste:perisa vanila sesuai sebab wangi recommended utk siapa yg baru nak cuba,_
Sepatutnya tulis la yang tanpa gula supaya senang pembeli mudah faham,_
perlu pakai kain dalam sebab jarang jg,_
Cuma out kluar brang dri kdai,_
Nice n quality is not bad,_
"Berat 73kg, tinggi 147cm, xxl ok",_
enggan keluar bilik langsung,_
[Surah Fatir 37],_
Service seller bagus dan j&t juga laju,_
Pdhl dlm kl je,_
6 midyear sale,_
bila pakai tak muat,_
pakai mapoh gitu ja,_
Semua size sesuai dengan anak² saya umur 12 dan 13 tahun,_
tq kak bnyk sgt bg free nyer ada rezeki wawa repeat lg,_
Tq seller brg dh smpai!,_
The last part which is verification is time consuming,_
"hi thankyou sm sleeve dah sampai 2 hari lepas actually , all good sleeve pun memang thick",_
Dia bagi ayam semalam,_
"Western Tigray has seen some of the worst violence in the year-long conflict pitting the federal government and its allies from the Amhara region against the Tigray People's Liberation Front (TPLF), which used to rule Ethiopia",_
Srsly baju ni cantekk gilaa tapi besar pulak hm takpalah janji boleh alter jangan kecik jaa mmg takleh buat apa,_
cuma lambat siket sampai,_
Warna pun tak luntur bila basuh,_
btw overall smua tiptop,_
nipis tpi disbb kn gelap tak nmpk sgt jarang nya tu,_
stokin semua cantikkkk 🥺 selesa je pakai,_
Effectiveness:belum cuba lg nnt edit balik,_
Sbb bajunya comel sgt,_
always top service,_
Terbaik boss tq boss barang baik sngt ii,_
Quality:stock received with double wrapping inside carton box,_
Thank you seller for the extra free gift,_
"30, suggesting strong demand, but supply issues prevented this from translating into revenue right away",_
"I'm thankful to the coaches for choosing me for the national senior team for the first time, said Pavandip, who played for Butterfly Roma HCC in the Italian Seria A League from September to November last year",_
Material:PU Polyester not sure what's that huhu,_
thank you gaissssss,_
Aàaaaaaaaaaaaaaaaaaaaaaaaaaaaaa,_
BARANG PADU MANTAB PAKBU SELLER MMG MANTUL HMBOEK GILE TQ SELLER,_
Kualiti kain sama seperti baju harga RM100++,_
"Kain dia tak tebal sangat, tak nipis sangat",_
Harap2 puting ni okay dgn baby,_
tkpelh,_
Random Color,_
ape² pon terima kasih ye,_
Barang dah sampai terima kasih kepada penjual penghantaran yang cepat bungkusan yang kemas harga yang berpatutan terima kasih,_
The pot cover had a slight crack,_
Specifications and design are awesome $MENTION$,_
datang dgn satu set lengkap,_
order received on 2610/2021,_
tak rosak or kemek,_
Best Live seller ni,_
kuali gambar pon sangat cantik,_
ambil masa 25 hari baru sampai,_
"taste good, thank you seller, will buy again",_
Anak dah nak 5 bulan baru nak try,_
Wallet same with the picture,_
Beli utk somi high cholesterol,_
Try to come back and give praise,_
Seller sngt baik!,_
Perfact,_
Setting mudah,_
Ini beli kedua yg lama sudah rosak nak Klaim warantty penjual tak angkat hpIni beli kedua yg lama sudah rosak nak Klaim warantty penjual tak angkat hpIni beli kedua yg lama sudah rosak nak Klaim warantty penjual tak angkat hpIni beli kedua yg lama sudah rosak nak Klaim warantty penjual tak angkat hp,_
mco ni nk keluar print pun pikir 2 3 kali,_
"NO 5G for the pixel 6,",_
"Terbaik, barang sudah smpai",_
dr semenanjung ke sabah,_
suka dgn rasa,_
Blh sangkut towel dgn sejadah,_
Delivery pantas order smlm arini dh Smpai,_
Wong-Theseira's buah keluak with ham hock is a true treat a slightly spicy curry with tender chunks of lean meat interspersed with fat and the buah keluak at the centre of it all,_
"Super fast delivery , paid ytd, got it today!",_
Bakal repeat lagi soon,_
besar ssuai utk nk barut perut bby,_
"Terbaikkk laa ,",_
dulu beli kat daiso,_
"Puas hati, tq saler 2 kali dah repeat",_
Habuan pkp tv rosak sblum nak tukar better layan guna tab lu,_
Do the purchase every month and don't have to do anything,_
Cuma skg rasa light sikit,_
Hiasan sequin da,_
Emmm tkde apa la nk comment,_
baju agak nipis kene pakai t-shirt yg serap peluk bila tengaHari,_
just use 1 weekjust use 3day onlyall item is arrive so nicepacking is nice,_
gembira hatiku,_
Ringan tetapi lambat hangat sikit,_
The signing fee was equivalent to 12 months of his salary,_
"Cuma dia berat sikit, jd kena tukar2 tangan",_
Yg black tu mmg sama dgn gambar seller,_
buku merah jangan lupa bawa moga moga belum tamat tempoh oooo kali ini kita pegi lebih lama pergi lebih jauh,_
"Good quality, cheap too, delivery okay",_
sudah sampao,_
Pkai kain dlm je,_
"Tegas beliau, bekerjasama dijalin dengan tentera untuk menamatkan pertumpahan darah akibat tindakan keras terhadap protes jalanan menentang rampasan kuasa, selain enggan mempersiakan 'kemajuan dalam tempoh dua tahun lalu'",_
Skin Suitability:kulit dah xkering,_
2nd purchase from this shop!,_
ada 1 tshirt benang tertarik sikit,_
RM0 MySejahtera: Sila semak butiran temujanji dos penggalak vaksinasi COVID-19 untuk No K/P berakhir 1111 di MySejahtera,_
Men Shorts Casual Short Pants Men Sports Shorts Cropped Shorts Drawstring Shorts Men's Clothing seluar pendek lelaki M-4XL,_
sangat suka harga murah baloi dengan harga juga stabil tidak jatuh,_
barang pun amat berpias hati,_
Sb muat je,_
"barang sampai dalam keadaan baik,penghantaran pon ok",_
Normal proce would be around rm20 but this one is cheaper and the food is still crunchy and tak masuk angin,_
dont buy chinese nuff said,_
Good product quality and very fast delivery within 48 hours can receive,_
Berbaloi harapnya bertahan lama,_
dh lamo guno sok ok la tu,_
Sesuai untuk moto yg daily,_
fast delivery to swk,_
"Ketika diberi bantuan pernafasan di kepala kanan, kemudian, didapati hanya dinding dada kanan yang bergerak dan bunyi nafas hanya terdengar di sebelah kanan",_
tak try lagi hee,_
Terpaksa beli saiz ladies,_
"And nice , harga berpatutan",_
good quality fast responce n delivery,_
Boleh repeat sebab memang pakai sport shoes hari2,_
50MP camera in a vivo phone is fab tbh,_
everything's good and im satisfied 🥰 jahitan tepi tu yang penting tau sebab i pernah dapat shawl buruk nak mati jahitan tepi so bila pakai tak lawa but this one is babyseam semua good kain pun ok everything nice ah mujur grab banyak 🤣,_
saya beli brg dgn harga tersebut,_
Will repeat buy againt,_
TAKEEE NOTEE THISSSS TUMITNYA PUN GETAHH YAAA JDII KLAU BJALAN TU ADA JGALAA MAU TJATUH HAHAHAHAHA SIAN EKK TPI HRGA NYA OKEYY LA SBB CNTIK JGA,_
Very useful friendly!,_
Time pakai auto confident,_
Excellent sellerwil buy more in future,_
kasut dia not bad laa comeii mang comeii,_
Second time seller ganti tapi ada defect,_
pape pn sy bg jgk 5 bintang sbb dlm hidup tiada sesiapa pun sempurna,_
padding thicker than expected,_
Clothing texture becomes smoother after washing with Nappikleen,_
Pilihan dari kedai ni memang tidak pernah mengecewakan cuma tambah lagi banyak barang,_
anak kecil pun boleh guna,_
Shin QI,_
btw saya orqng sarawak,_
Boleh hold handphone,_
penghantaran sangat bagus dan cepat,_
Sweat on your feet makes them sticky,_
"This version is very pretty despite the very little inclusions from sm this was shipped out right after the release pckaging was actually secure however i got a broken case when i opened it, but im too lazy to do any complaining cause i will never know whos at fault but overall is good",_
Comel je anak suka sangat,_
saya tinggi 157 berat 46,_
promised free also received,_
Tp boekla,_
pretty safe packing too,_
tqttqtqt,_
hopefully it is delicious then will repurchase next time!,_
Tq sellerr 🤲🤲,_
"Makanannya enak, pengantaran tepat waktu",_
Quite thin but worth for the price,_
Woo-hoo,_
Taehyung please merry me,_
betul2 SD865 walaupon 4G,_
terbaik di dunia ini,_
tq nanti sy beli lagi ok,_
Blue color very nice and lucky received before delivery,_
"Overall okay, satisfied purchase",_
Kurang profesional,_
hopefully the quality is good,_
Sgt praktikal utk letak barang2 dapur,_
Dapat suma color spt yg diminta,_
"minyak telon ni sesuai dgn anak2 berbanding pakai yuyi tu tak jadi ape,kembung juga anak sy",_
"Pic dalam gamba x same mcm yg diterima,sangat nipis dan kain mudah berbulu",_
Good price good deal good harga good selling to deal with,_
Dah beli kali ke 2!,_
pas nie amik saiz longgar ckit,_
hntr benda lain,_
"umur 10 tahun,bdn chubby skit & tinggi",_
Dengan ini saya ingin mengumumkan bahawa kopiah ini power,_
silalah beli sebab murah dan function dan memudahkan dan paling murah dari seller lain!,_
take smpai 15 minit siap,_
comel sngt kicil jea,_
ssa℅℅[<,_
mco ni ramai positive xpa lah,_
Tpi tak expect lah besa rupanya beg tu,_
"bau dia kuat, boleh terbenam bau baby hehee",_
Bagusss gilerrr ahhh sesuaii and cantikkk sangatt thankllBagusss gilerrr ahhh sesuaii and cantikkk sangatt thankBagusss gilerrr ahhh sesuaii and cantikkk sangatt thankBagusss gilerrr ahhh sesuaii and cantikkk sangatt thankBagusss gilerrr ahhh sesuaii and cantikkk sangatt thankBagusss gilerrr ahhh se,_
Especially pink color,_
🤗Bole repeat oder lagi🤗,_
Like the cutting,_
sorry last pic tak berkaitan hdjshsjjs,_
Lindo esta de parabéns,_
"besar jugak untuk isi barang kecik2 tapi banyak ni,",_
Performance:good product quality and service packages awesome thanks so much,_
Kain pun sejuk ja bila pakai highly recommended for those yang cari handsock yang selesa di pakai harian,_
Received time: 18/3/22,_
5 hari juga nk sampai,_
Actually kalau nak ambil 2XL pun boleh jer,_
Bought too many wehhhh coz it was superbrand sale,_
barang da sampai dlm keadaan baik walaupon parcel tu berat,_
"Seller clearly states that it ships from KL, but it was actually shipped from China",_
Sbb suami pn cerewet jugak,_
Yang ni memang elok sangat,_
"tinggi 160cm, berat 82kg",_
it was hard to dissolve and it doesn't taste that good for my food or drinks,_
Senang jugak la nak setting,_
Dah beli semua color yang ada,_
Terbaikkkkkkkkkkkkkkkkkkkkkkkkkkkkk,_
Functionality:not as effective,_
Took about 1 week cause of J&T problem,_
saya puas hati dengan kualiti barang,_
barang semua smpai dengan selamat,_
Functionality:sangat lembut n baru,_
nice and yg sbelah tu da guna sebulann still kuat,_
tp padan la dgn hg,_
Nanti nak order lagi 🤭,_
boleh pasang dgn elok,_
"fast delivery from seller and everything came to me in perfect condition,",_
Satisfactorily packed,_
"Mohamad Fawwaz mendakwa, hasil diperoleh dalam industri judi dan arak menjadi dana untuk membiayai kelangsungan politik tertentu yang menjadi 'pelindung' di sebalik aktiviti itu",_
link/3nJeABHbnckEUEy29,_
S EVERYTHING,_
laju siakkkkRecomended seller,_
Thx for speedy delivery,_
Recommend recommend recommend recommend recommend recommend recommend recommend recommend recommend recommend recommend recommend recommend recommend recommend recommend recommend recommend recommend recommend recommend recomm,_
Aroma:aroma wangi sedap mcm teh biasa je,_
Delivery laju juga dalam 2 hari,_
Seller pon peramah dan fast reply,_
tisu basah mmg tiap bulan beli sini,_
Kekeliruan warehouse sbb warna sama pink,_
"Pembelajaran efektif akan menjadikan mereka berpengetahuan, teguh pendirian dan bersedia untuk memberikan yang terbaik",_
Aku takut mencintai,_
Lepas ni boleh repeat lagi !,_
I love my life because my life is BTS,_
Produk kualiti tiptop🥰,_
Sgat2 berpuas hati,_
Biar banyak stoking suami untuk nak pegi keje,_
Functionality:Very sturdy,_
Tapak lembut dan insole berlapik tebal,_
"Baju cantik,kain can ik sesuai anak umur 11y besar ckit jer",_
Recommendedd sangattt,_
All the socks look so pretty and nice!,_
Bayar cuma rm11,_
"Johor public works, transportation and infrastructure committee chairman Mohd Solihan Badri said the project was on track for completion by Sept 14, 2022",_
"Terbaikkk ,🤛🤛 recommend",_
kalau bisa saat kita pesan makanan bisa dibtalkan jika blm menemukan pengemudi!,_
Nice cuk,_
Adik suka adik suka adik suka Adik suka adik suka adik suka Adik suka adik suka adik,_
"Saya amat berpuas hati, terima kasih seller",_
produk okay,_
muat dengan sangat cantikkkkk,_
Your intro was sooooooo fire today keep up the good work man,_
"Memang besar , xdela labuh sangat and ambik 5XL",_
Yeah bro this phone is shitt,_
"Alhamdullilah barang da selamat sampai, penghantaran ok, boleh tahan cepat, tq seller, kalau ok nanti kita repeat order lagi",_
cuma shipping jer stuck,_
You're the best I've seen at this,_
Tqqqqqq sallerrrrrrrrrr loveeeeeeeeee sngtttttttttttt,_
difficult to grab a taxi,_
good small but okay for me good material fast delivery nice and comfy,_
beli harga murah,_
nice packaging and fast delivery hopefully the taste is nice,_
Barang diterima dalam kondisi yang baik,_
"Received well, nicely packed",_
Puas hati brg d bungkus dgn baik,_
The Sierra Blue is beautiful!,_
i really love the pearl,_
Terbaikkkkkkkkkkkkkkk tqqqqqqqq,_
"BUTM race director Claus Pedersen said about 400 people have signed up for the marathon so far, with 25 of them being foreigners",_
Pringles manufactured in Malaysia is Halal,_
Bought cheap at discounted price on Shopee Payday,_
Delivery time is very disapointing,_
The drinks came in nice and good condition in a nicely packaged box,_
"Bagaimanapun, katanya kertas kerja bagi menaik taraf IPD sedia ada sudah dihantar kepada pengurusan tertinggi Bukit Aman",_
Tu pn Tarik Slow2,_
"However, Tsitsipas found solace in his serve, which was virtually untouchable until 4-4 in the final set when he came under some pressure at 30-30",_
Berbaloii beli ngan dia tau,_
Momy sedia siap2 sbb takut,_
sesuai pakai pegi mana mana,_
"Barang juga berfungsi dengan baik, my drone dah boleh terbang semula",_
kl gojek sudah ada,_
Quality = as per brand,_
"Good seller, fast delivery, good packaging, item as described",_
Terima kasih seller n en J&t,_
the best children rice!,_
Beg nyaa cantik gilerr,_
penjual terbaik,_
baggy gilaa weh dah mcm pakai selimut🤣,_
"Fast shipping, good secure packaging, got free gift too",_
this stuff so unique to change me from samsung to oneplus nord2$MENTION$,_
Chat seller dia kata mmg almond warnanya mcm tu,_
Boleh repeat jahitan kemas,_
barang sampai dengan selamat and laju thank you seller!,_
It's huge,_
Beli untuk shave bulu kucing je and kucing pun tak takut dengan shaver ni,_
Kualiti mask agak nipis,_
"terbaik sgt,nnty blh beli lagi",_
Phone works well with no lag at all but require to carry a Power Bank daily,_
"Servis laju, material best, warna cantik, harga murah",_
"Third time purchase this ramen at shopee, so far this is the cheapest I can find, good value for money, strongly recommend tokyo shoyu",_
Gambar dan video tak ada sebab belikan untuk orang lain tapi 5 stars sebab dah 2x beli barang semua baguss,_
moga seller sntisa dmurhkna rzeki,_
Berus gigi sudah sampai dgn selamat,_
cuma tk lekat sangat kat bibir,_
?/),_
tgk feedback pun okeyy,_
Otw semua ok,_
"This is the third time repurchase of LED Lights from thsi seller, is quality and cheap",_
Time nak gosok okay la takyah nak beria sangat,_
"thank u for good service from seller, fast replies and friendly too recommended seller cheapest awb service that i like to repeat",_
"Perdana Menteri berkata, kerajaan komited untuk terus memajukan Kelantan sama seperti negeri lain",_
Dan harga murah dri seller2 lain utk warna2 yg sy nak,_
Yg dipesan 30 bji,_
"According to the order, nothing is wrong",_
cool BUT WHAT KINDA TOOL R U SING TO COOK EM 🥲 can i use oven instead?,_
"Aishah berkata, MAA memuji usaha kerajaan dalam memperkenalkan Baucar Diskaun Automotif Keluarga Malaysia yang bertujuan membantu mangsa banjir",_
Mcd bintaro 09,_
"Open victory on Wednesday, harnessing tennis's global appeal in her fight for racial justice",_
"Kalau korang nak rasa choco jar uqasha ni, boleh order dekat saya yee 🥰",_
I bukak dengan tangan je tau sebab malas nak cari gunting and guest what !,_
i thought it was small in size but it fits perfectly in my kitchen,_
"Terbaik,terbaik,te",_
suami ckp kuat btl vacuum ni sedut!,_
"Cantik , just as shown",_
Ya Allah cantik nya,_
"President Donald Trump has sued New Jersey, following a decision on Friday by its Democratic governor to mail a ballot to every voter in the state for November's elections, as well as hold in-person voting amid the coronavirus pandemic",_
Will decimate but again,_
Jainelle Sim,_
Macam2 hado,_
harga mudah,_
Tak smpt ambil gmbr dan pakai,_
Tan Hee Soon,_
Aerosensa 50 and 60 suitable for intermediate player,_
Cuma itula,_
Tapi akhirnya kopi sampai setelah seminggu disebabkan banjir yang melanda malaysia,_
maaf video dan gambar tiada kaitan sebab order untuk orang lain,_
"Sandals ok, nampak mcm waterproof lah belum try",_
best saya suka sngt penghantaran pon laju je,_
Barang sampai complete macam dalam gambar dan diterima dalam keadaan baik,_
cpt sz x betol,_
95 time shocking sale,_
"very recommended,berbaloi dgn hrga",_
"Finally, tried the reserved approach:",_
awful website to navigate,_
Seller proses order laju sungguh,_
doesn't smudge the makeup and yet sufficient for protection,_
Vacation,_
(( ~ ),_
Bznznzjxjxjxkzkkxkxkxkxkxkxkxjxxjjxkdkdkdkdkdkdkdkxkkxkx,_
"Terbaik seller, kali kedua repeat oder",_
Good packaging and delivery also not bad,_
semua Rasa cukup,_
"bahagian camera tk tebal sangat yaa, but gwenchanaaa ,",_
pampers pun ok,_
"Kualiti lawaaa, worth for the price but design biase2 je will gonna repeat for future",_
Don't know what to do with it,_
"Bestt sangattt cuma ketat sikit, korang amiklah saiz besar sikit dri saiz sebenar",_
Boleh la mkn xde la sekat sgt selera mkn tu tapi harga murah,_
"My 3rd Skechers, another max cushioning",_
Maaf gmbr xde dh selamat masuk perut,_
"Fast delivery, function OK",_
"Pigment:Warna sangat pigmented, tapi tidak matte ya",_
Tengok lh sy byaar bila dia pos out bila,_
Hadiah untuk kawan dan dia sangat suka,_
Bunyi tak padan ngan kecik comey loteynya,_
Suke suke suke suke suke suke suke dls,_
"But the pandemic has delayed efforts to finish this towering architectural masterpiece, which has been under construction for nearly 140 years, and it is no longer clear whether Fauli will still be in charge when it is finally done",_
product wise is good just the box looks like very simple,_
hopefully it works well,_
Awesome love it bro hope is everything let&$HASHTAG$,_
and dia wide shawl jadi memang labuh,_
"PUAS HATI GILAÀAAAAAAAAAAAAAAAAAAAAAAAAAAAAAAAAAAAAAAAAAAAAAAA THANKIESSSSS ,",_
kain nampak elok tebal,_
Taste:great flavor great packaging great price great quality great service number one,_
Know what you're getting into,_
Sy dpt trunkn 6kilo dlm sbulan,_
Thnk you 🤗,_
It good quality too thnk u seller,_
Print terang,_
Game performance,_
"Order pada 30/1, baju sampai pd 1/2",_
"Super fast delivery, good service by seller",_
Kelambu baru jugak dlm keadaan yg baik,_
", , 3",_
barang smpai dengan selamat dan baik,_
"Kecewa sikit, tak best lah macam ni tak dapat nak kasi 5 stars",_
Me every time 🤣🤣,_
dapt corak lain,_
Xl pun mcm m je cutting kecik,_
"however, the quality of the lomocard is a bit meh tapi still okay laa barang-barang lain semua okay,",_
lepastu banyak poket,_
Success for the store & shopee,_
good product valued for money,_
Dapat barang seperti yang di lock dalam live,_
"Semuanyaaaa okayyyy,cuma saiz dy kecill sikit,sbb rambut sy jenis tebal",_
Correct and consistent,_
Tp ninja van lambat la pulak,_
Nice nicee niceee,_
"Tp okay je , jahit tu boleh je anta kedai hehe",_
Elok ii ja pinggang pon xyah dok jahit ja cuma peha mcm sendat sikit ja tpi oky jaaa nk pkai nmpk mcm palazo,_
"bgkusn pon ok savety,kain bukn jenis cotton,klau musim panas guna",_
Fresh herbs from this seller,_
adik dh bwk balik rmh dia,_
Besar juga saiz,_
"The item has arrived, sorry because the expedition took so long to arrive at my house in 7 days",_
dh bnyk kali repeat order terbaikkk tq tq,_
Soft comfortable with it,_
tp xsempat nk cek semua,_
Hope seller improve lagi bagi ada rasa manis nutella,_
Boleh pakai sebulan,_
kalau sedap boleh order lagi leas ney,_
Utk kegunaan rumah sgt² tdk sesuai,_
Parcel has been received safely with good wrap and envelop,_
Thanks Shopee for the quick delivery tho I didn't enjoy the noodle,_
Penghantaran pantas juge,_
Superfast delivery with wrapped well,_
Received the parcel the day after I ordered,_
Very fast in response,_
Calla Lily dia memang cantik & macam bunga hidup,_
tp boxer bli xl sbb biasa bli buyer xl kcik skli hahahha rse xmuat laki pakai,_
da byk kali repeat oder,_
Ohh at last my order has arrived today safely,_
Effectiveness:bau ok,_
order tak sampai 24jam barang dah sampai,_
Like the white colour but green and blue colour abit different,_
All colours is nice,_
Warna soft,_
"Puas hati beli,barang bungkus dengan elok dan saiz sesuai untuk baby",_
This item looks OK but not really useful though it's cheap of its value,_
Thanks very much for your great service 🥰 will repeat order again,_
Barang sampai selamat cuma ada kemek sikit corn flakes tu but sokayy bubble wrap dah tebal letak,_
"06 malam dan kedudukan rumah yang rapat menyebabkan kebakaran cepat merebak manakala punca serta jumlah kerugian masih dalam siasatan, katanya ketika ditemui, malam ini",_
penghantaran sangat cepat dan ada free gift lolypop candy untuk anak saya,_
Brg sampai bodo bodo je macam ni 🤷‍ seller postout brg lambat !,_
7 arrive on 30,_
kakajahshwhwhwjwjjwwjwjwjjwjwjwhhhahwhaniveeeeeeee,_
bolh tengok n tanye2 lg,_
Wlpun seller xrespons kat chat tpi tkpela dh smpai,_
kind of regret that I bought 2 hahahaha,_
Tq menyedapkan menu saya!,_
"Worth for money, and well packaging",_
ini sangat mempersulit dan pasti berpengaruh besar trhdp driver nya karena pelanggan dipersulitkan dgn aktifasi grabnya dan driver akan sepi job,_
Quality:the quality is okay,_
is my power bank problem,_
"Material:Tak tebal, tak nipis, just nice",_
"responsible , good",_
When you don't understand Korean : *switches on subtitles* *Korean auto generated * Me :,_
Wow sangat penghantaran cepat skali kemarin order harini dah sampai superb tq seller,_
"To all of those who tick BN in the recent elections, thanks and don't complain",_
"pembungkusan baik, penghntaran ok, anak suka",_
Sangattt cantikkk& materiql ok nicee& husbandd likee it,_
beg dia cantik sangat2,_
x kira pulak,_
