Sentence,Tagged_Sentence
"TEL AVIV (Reuters) - Israeli warplanes bombed Hamas targets in the Gaza Strip early on Wednesday in response to Palestinians in the enclave launching incendiary balloons towards Israel, the military said",_
Arap bermanfaat utk pantang nnti,_
It's my second purchase after the blue one,_
"packaging ok, cuma ms delivery tu plastik wrapping koyak sampai ke dalam",_
"The online edition of the Singapore Comic Con lasts nearly a month (now until Jan 2, 2022) and it has a full programme of activities",_
kualiti okay sangat thanks seller,_
but lately it keeps on crashing,_
Very nice seller with very unique tourmalines,_
"Don't just straight wrap with thin, loose, transparent bubble wrap",_
tq sellre,_
"Russia said on Thursday it was clear the United States was not willing to address its main security concerns in their standoff over Ukraine, but both sides kept the door open to further dialogue",_
barang Selamat sampai dengan cermerlang,_
"Black XL 163 , 63kg",_
it's accepted,_
"shopee express sending item also fast arrive, thank you seller",_
jam lawaa memang berbaloi gila dengan harga yang murah penghantaran pun lajuuu thank you seller will repeat,_
"Good product, good value, taste delicious and received in good condition",_
Quality:rasa sakit perut,_
"Thank you, Thank youThank youThank youThank youThank youThank youThank you, sorii pic dan vd tiada kena mengena",_
In Shaa Allah will repeat order,_
Cuma skrin jela kecik sikit,_
Kena amik size bsr sikit,_
Kain tak terlalu tebal,_
Good packaging and fresh product with long expiring date,_
"Bitar had originally issued the warrant when parliament was out of session but security forces held off implementing it, leading Bitar on Friday to call on them to execute it or risk facing prosecution themselves",_
Harge mmg berbaloi,_
Beg dh selamat sampai cuma lmbat sgt nk sampai,_
tenqiuu seller,_
Mmg sgt2 cantek,_
orde lagi,_
price is cheapest too,_
Mohon yer tolong perbaiki sim digi dulu baru buat app dia,_
So far servis penghantaran sangat bagus,_
Ambik gambar banyak banyak 🥰🤣 Tapi sayangnya saya terbeli 2 warna sama,_
🤪🤪🤪🤪🤪🤪🤪🤪🤪🤪🤪🤪🤪🤪🤪🤪🤪🤪🤪🤪🤪🤪🤪🤪🤪🤪🤪,_
"Ada bubble wrap, tapi kotak still ada kemek2 sikit",_
"fast delivery, good packaging, thankyou ,",_
"Due to a technical glitch, you may have received multiple SMS on service interruptions from us",_
Terbaik rambang mate betul semua cantik² saiz pon ok,_
"And in the small hours of Sunday, a 21-year-old soldier stabbed his 27-year-old girlfriend, also a soldier, to death after an argument near Saumur, eastern France",_
memang berpuas hati,_
"Not sure can change to a little bigger size, say M",_
s a dope color,_
Tak sesuai kalau rumah jenis xpasang aircond waktu tidur,_
"tq seller, kami beli Barang da sampai",_
Saya akan repeat untuk hadiah kawan pulak,_
Order 1 hitam 1 putih Tp 2 2 putih,_
"s right, but the older versions don&$HASHTAG$",_
Deliveryy lajuuuuuu,_
Dapat barang yg I nak,_
SOOOO NICEEE !,_
Very faster laa penghantaran dieee semalam order hari ni sampai,_
overall brg smpai elok hrp brg sgt mmuaskn,_
"He added that he never forgot how, as a young officer at the anti-corruption commission almost 30 years ago, he served ham sandwiches to visiting Malaysian Muslim guests from Malaysia, who could not eat pork",_
Enjoyed the great service n fast delivery,_
Received in good condition and recommended to purchase from this seller,_
Barang da smpai🤗🤗🤗,_
"Lepas ni ditambah dengan armpit putih menawan, lagiii laaaa",_
Maybe from the production process,_
harap jadik laa kuat sgt semut ni serabut da aku,_
"Tapi takpe, pakai dekat dalam rumah takkan perasan",_
"Fast delivery, parcel received in a good condition",_
Sekali2 bikin konten maen REAL DRUM donk beberapa lagu,_
Item da smpai dgn baik,_
fast delivery 🥰🥰🥰🥰🥰🥰🥰🥰🥰🥰🥰🥰🥰🥰🥰🥰🥰🥰,_
Akhirnya setelah berminggu2 tunggu,_
"FIRST MY ORDER JUST DISAPPEARED I DIDN'T EVEN CLICKED ANYTHING, GOOD THING I DIDN'T ORDER AGAIN BECAUSE MY ORDER CAME IF I DID ORDER AGAIN IT WOULD BE DOUBLED",_
nice dah dua kli repeat dgn seller ni seller ni peramah siap bole pilih baju lagi thanks seller hensem semoga murah rezeki aamiinnnn,_
x tahu boleh tahan berapa lama,_
"Pengerusi BN, Datuk Seri Dr Ahmad Zahid Hamidi, menyifatkan kenyataan Pengerusi Perikatan Nasional (PN), Tan Sri Muhyiddin Yasin, yang mudah mengisytihar kononnya sejarah BN sudah berakhir, jelas menunjukkan sikap hipokrasi pemimpin itu",_
The face sheilds are fitting my children well,_
Rezeki anak tak salah alamat,_
Ala ala zara pun ada,_
Its been few days but notung happen,_
Saya 156cm/60kg ambil 3xl okey la,_
"Good wrapping, well protected nothing to complain",_
"All of the products from packaging to the contents itself are quality assured, they look, feel and smell nice too!",_
"semua ok, tapi penghantaran lambat",_
Great deals 1111,_
So far so good thank you very much So far so good thank you very much,_
"Not only will TimbeReality be a marketing tool for timber companies to share with their buyers, MTC will also be employing the virtual showroom as part of their marketing and promotion efforts",_
No bubble at all,_
250 pesos delivery fee from Goldilocks Liloan to Poblacion Compostela?,_
"terima kasih seller, barang elok sampai",_
Aqil boleh la,_
Yeayyyy barang dah sampai dalam keadaan yang baik dan dibungkus dengan baik,_
Good product fast delivery thank youu will repeat order again,_
Pengguna jalan raya mungkin mengalami kerugian besar jika mereka tidak bersedia dan beranggapan bahawa mereka tidak akan terjejas,_
"received in a very good condition and i love love love my pulls,",_
The items received and tested is work for my washing machine and clean,_
Mcm xxxl size la gitu,_
Pemasangan kerusi agak susah tetapi berpatutan dgn harga sangat recommended dan sangat berpuas hati,_
Thanks seller sgt membantu mintak pos awal alhamdulillah selamat smpai dgn pantas,_
Can not open it,_
"I never got their names, but at the time it wasn't important, we just knew that we had to help others",_
Alhamdulillah berfungsi dgn baikkk,_
Parcel dibalut dengan bubble wrap,_
"Kotak kemek sikit, balut camtu je",_
Texture:smoothly,_
My fav place!,_
Respon penjual tersangat mesra dan servis penghantaran tersangat pantas,_
"7 DAYS,",_
Okay kualiti dia cuma tk berkenan betul ngn kain lapik dia huhu,_
tidak lupa juga kepada abg jnt gambar sebagai hiasan tq,_
suka sesgt,_
brg x ade cacat cela,_
comey jee bajunyaa kain agak kasar sedikit tapi kalau basuh maybe okay kot,_
Toooorrrrbbbbbbbbbaaaaaaaiiiiiiikkkkkkkkkkkkk,_
but the bottle still in good condition,_
Kain selesa dan mudah di seterika,_
Bancuh sendiri lg jimat,_
smpi Pon laju,_
will repeatt again,_
berbaloi la dgn hrga murahbeli utk kwn jgak,_
Brg smpai dlm keadaan baik penghantaran pon laju layanan seller mantop sorry gambar xdk kaitan,_
Late delivery and this time the items arrived in not good conditions,_
bila mak dduk,_
Received item good value for money,_
Material:jersi tak jarang tk lebat,_
Tengah test keringkan baju,_
Sorry gambar x Ada kena mengena,_
i received the parcels already,_
nak repeat oder lagi,_
Phone has all the specs i wanted for myself keept it up🤙 $MENTION$,_
"maxis recommend ,",_
"Seluar dh sampai, dh kali kedua beli, mmg best kain dia, next time boleh repeat order lagiii, tinggi 155cm mmg ngam pakai, penghantaran laju thankyouuu seller 🥰🥰🥰🥰🥰",_
Dah cuba semua nya ok,_
"Barang tip top,",_
Just fit me well,_
Terbaik Sampai dengan cepat,_
More varieties to choose food around the areas or even from further distance!,_
jam sampai dalam keadaan baik,_
So what&quot,_
Sory lah,_
"Gotta admit, I&$HASHTAG$",_
Damage box due to logistic,_
Expiry date is year 2023,_
lengging budak prempuan cntik kain tebal wlpon hrge murah,_
Beli size besar sikit baru muat,_
You tell another story,_
Overall kain sedap and murah,_
Warna2 yang sangat cantik dan menarik 🤩🤩,_
the colour is what i expected it to be,_
"Nice and clean, good quality, happy to have it, will get more strap",_
One dog fry recepie please,_
Sambal diterima dalam keadaan baik & sempurna,_
"Servis seller mantap,smlm smlm order smlm jugak pos",_
tq sellerPengha,_
nk psg utk alas tido kucing je,_
"Texture:Smooth like silk, slippery, dissolve in water easily without applying much water, quite concentrated",_
guna utk kemasukan tadika transit anak 5tahun,_
Received but the courier not good,_
Mungkin seller boleh improve packaging lagi,_
Received product in good condition and correct products,_
Received in good condition and thank you for the free gift (key chain),_
"SCAM app,",_
Barut besar heloks cantik,_
"haha, never expected that long",_
"76m, which was outside his national record of 68",_
Has it's own bubble wrap pocket,_
"tak nk merungut pulak,harga dh laa murah kan",_
Delivery a bit slow maybe due to 11,_
Ok Penghantaran cepat,_
beg berbaloi,_
Harga murah baju cantik,_
lawa untuk ootd,_
"He said that visitors were also required to check-in using the MySejahtera application or manual registration as well as adhere to the SOP, which includes having their body temperature checked, wearing face masks and maintaining physical distancing at the beach",_
Will repeat buy this air fryer again!,_
Mount tidak ketat?,_
Penghantaran pantas dapat free gift lagi Penghantaran pantas dapat free gift lagi Penghantaran pantas dapat free gift lagi Penghantaran pantas dapat free gift lagi Penghantaran pantas dapat free gift lagi Penghantaran pantas dapat free gift lagi Penghantaran pantas dapat free gift lagi,_
The reviews are on the towels I bought here,_
"Taste:Received with good condition, seller service very good thank you very much",_
Loving the traction and elasticity of it,_
"Jeruk dah tamat riwayatnya, masuk perut",_
"IPOH: Traders at the Buntong wet market here are being targeted by thieves, with fish, vegetables and other fresh produce stolen",_
Good good fast delivery fast delivery product good quality product good quality good packaging good packaging thanks seller thanks seller,_
HAPPY GILAAAA STAN DC 🦋🦋🦋 STREAM MAISON !,_
Cuma beg tu kene pasang sendiri lah,_
Harga ok la murah juga,_
good product quantity good product to purchase good packaging and shipping and excellent service,_
This one a bit thin but i think its okay,_
"This means that the average number of deaths was only reduced from 18 to 12 daily amid Covid-19 (restrictions), he said",_
Package was very secure,_
delivery super duper fast!,_
Agak susah pakai dan rasa berat masa saya pakai dan size ngam,_
"Prompt delivery, good products",_
Servis Cepat,_
"Item sampai dengan selamat dan baik cepat berkualiti tinggi dan berfungsi dengan baik, selimut motor cover berkualiti tinggi",_
tp ni sy xslhkan seller,_
Tqsm besar,_
It clearly strays from the definition of sexual harassment as stipulated by UN Women [the United Nations Entity for Gender Equality and the Empowerment of Women],_
"terbaikk, berfungsi dgn baik, semalam order harini smpai, penang ke kelantan, mntp seller",_
Ngam sedap pakai,_
"Velcro mmg tajam sikit, tp senang nak guna",_
Any help on this ?,_
"Kurg pedas seperti yg diminta, sangat berbaloi terima kasih",_
I use it every morning and evening TQ seller,_
terbaik terbaik terbaik terbaik terbaik terbaik terbaikterbaik terbaik terbaik terbaik terbaik terbaik terbaikterbaik terbaik terbaik terbaik terbaik terbaik terbaikterbaik terbaik terbaik terbaik terbaik terbaik terbaikterbaik terbaik terbaik terbaik terbaik terbaik terbaikterbaik terbaik terbaik t,_
Kos logistik saja mungkin lebih tinggi kos,_
s colour processing is shamefully detestable compared to the most generic gaming centric phones out there!,_
jumpsuit tu bgi sesiapa yg 155-165kebawah berat 42-50 better ambik saiz XL,_
Mmbantu sgt klip ni bby dh xbuka laci,_
Packaging pun secure gila and also got a free gift,_
* T&Cs apply,_
"Please fix your apps, I know you guys have been working hard but we as a consumer also deserved to get the best internet quality as we pay for it",_
Semua baik baik sajaaaaa,_
maaf gambar teda kaitan sudah bagi hadiah tali nya,_
kain oke lembut,_
Char Zaku last time I was referring to this,_
kain jarang sgt walaupun jenis dark green,_
Mantap mantap mantap mantap mantap Mantap mantap mantap mantap mantap Mantap mantap mantap mantap mantap Mantap mantap mantap mantap mantap,_
Semua muat dengan mifit4,_
Senang nak cari cookware yg sesuai,_
"Like non-communicable diseases (NCDs), many describe antimicrobial resistance (AMR) as a silent epidemic",_
ingat dpt warna lain2 tapi semua sama,_
Order 12/12 sampai 13/12,_
"However, the pitfalls are plenty and it's as well to understand a little about how e-bikes work if you want to avoid landing yourself with a lemon",_
Belum try kt minyak wangi,_
Siap dapat free gift wire tape,_
"Well, it happened guys, more than twice",_
Very Good app launced,_
product quality is great,_
Spend the summer of a lifetime with me,_
Received in good condition worth and nice !,_
"The judge later assigned mediators, and all parties submitted a settlement proposal in July",_
maybe bnyak customer kot,_
Always coming back to buy samyang from this shop,_
is big enough to fit all of my cosmetic,_
"fair shipping time,",_
Very nice and delicious,_
Sara kuch achaa bus video editing nhi ho sakta hai,_
smbal bilis lgi sedap,_
"lighting pon cantikk berbaloi la harga mahal sikit , janji kualiti baikkk",_
Last time I bought at shopping mall they sell it at rm10,_
Quite protected,_
"said it provides several controls to identify speakers even when that person isn't visible, and in this case it banned the offending user's account",_
Selamat Hari Raya 'Idulfitri 1442H/2021,_
"I bought the USD hub with 4 ports and it seems to be working well so far with my laptop, external keyboard and USB mouse",_
Kain berat and terletak,_
"Very nice, dah tak buta dah lepas ni nak swimming",_
Lampu berwarna warni,_
Boleh repeat order with this seller,_
"haiii , yeayyy my treasure green pb dh smpi hehe",_
Tidak ada pengalaman,_
Dibalut macam beli emassssssssss🤣 sgt memuaskannnnnnnnnn,_
love it tqtqtqtqtqtqtq will repeat it again 4th time buy set,_
order saiz 37 macam saiz 38,_
no 0172737877,_
App's yg mudah digunakan,_
"According to official figures, a total of 6,910 Malaysians headed to the US to pursue their higher studies in that period",_
Walaupun covid ni,_
Trusted saller n brand,_
It's matched with the price,_
SAMA MACAM DIIKLANKAN,_
"Received in good condition and fast delivery, it's taking 3 days only",_
Free gift (picture shown) received,_
"Thanks to the seller for guiding me and assist me step by step, able to use them when it failed first",_
"GOOD SERVICES , GOOD PRICE , FAST DELIVERY , GOOD VALUE",_
Box was properly sealed & received in good conditions,_
tambah plak item nampak padu,_
"Globally, the industry has already taken off and is projected to reach US$7",_
"for those yg pakai size L, I think korang should buy yg size 2XL sebab 2XL ni dia cun-cun kat saya eventho saiz saya L",_
Mantullll bos,_
Ketebalan mask agak tebal dari sbelum ni,_
Kain napkin super comfort,_
"overall okay tapi , brg lmbt kluar",_
Will repeat order yaa,_
Shipping & packaging satisfactory,_
Luckily everything inside still ok although not bubble wrapped,_
IT WONT LAST FOREVER,_
Only took around 3 days to arrive,_
MATERIAL QUALITY SO SO ONLY WORTH FOR THE PRICE,_
Jumpa bulan depan bos ya,_
"masuk kedai ni mesti tak tahan nak lock,sbb baju2 nya terlebih cantik",_
Although a bit difficult to adjust with the compact F1-F12 keys (have to press Fn + F ket at the same time to function),_
"Good packaging, parcel received in good condition",_
all good i think thank u so much for the parcel i appreciate ur service,_
MeiMei Chong,_
Thankkyouuuu selllerrrrrr,_
"first at all, JNT said the items is missing",_
"KUALA LUMPUR: Ketua jurulatih skuad kebangsaan, Tan Cheng Hoe disaran memberi peluang untuk penyerang tempatan seperti Luqman Hakim Shamsudin atau Shahrel Fikri Fauzi sebagai penggempur Harimau Malaya bagi aksi kedua Piala AFF berdepan Laos di Stadium Bishan, Singapura esok",_
Brg dh sampai dgn pembungkusan yg selamat serta penghantaran yg cepat,_
So far adik kata okey je bag ni,_
"Beli bnyk2 pon exclusive sbb letak dlm box🥰🥰 lurveeee sgt,",_
x sabar nk buat utk ank2 nti,_
Ngam n selesa,_
Ramen topokki ni saja nak try,_
Musim pkp ni tak boleh nak keluar,_
Ringan nak bawak,_
Samyang tu biasa lah dh pecah sikit,_
Quality:good gilaa,_
•) /&gt,_
"$MENTION$ Kalau x prcaya x pa, terpulang kpd msing2",_
🥰🥰🥺,_
scuba gitu pastu labuh pun elok ja cuma ada belah pendek dekat belakang tapi takpa usaha lah pakai apapun supaya tutop orat noh,_
Tetapi klu Nut Jenis Cop Rays Tu keluar Warna,_
🤭pengantaran pulak laju seminggu lebih macamtu,_
Boleh bawa time balik kampung,_
Memula takut jugak sebab baca review cakap daging nya keras macam batu but Alhamdullillahhh tak keras just nice wei dahla harga murah cenggini,_
"Semalam payment, harini sampai",_
bungkusan yang terbaik dr seller,_
good good good very Fast deliverygood good good good good good good good Wil buy againexp on June 2021,_
50mnit hayun bini smpai dia surrender,_
rupanye ada cara dia,_
Mop self-wash sampai dalam keadaan baik,_
Man that alpine green is nice!,_
yang lebar memang sendat,_
"thank you seller barang sampai dalam keadaan baik,semua casing cantik tapi harga murah ilerr",_
Biasa bau,_
"dahh laa seller buat kerja laju, harini order, esok dah sampai dengan selamat",_
"received in good condition, thanks seller for the good packaging!",_
puas hati main,_
req xnak warna hitam dan putih,_
Nampak bag kecil,_
I love it very good quality fabric and its fullfill my taste fast delivery tq seller,_
"Overall, there were 12 deaths in the placebo group, and none in the drug group",_
Rase lembut je pp,_
Besttt wangiiii sgt,_
easy to wear and not really crumple,_
"Popular TV actress Mira Filzah had some words of encouragement for those sitting for the upcoming Sijil Pelajaran Malaysia (SPM) exams beginning on Jan 6,2021",_
I love h&m products but the app is not working how its supposed to,_
"the suction is not strong enough, it is easily drop from the glass",_
Performance:Water flow smooth,_
"Thank you seller for very fast ship out and very fast delivery next day received ,Good quality",_
terima kasih lain kali boleh tengok boleh bli lg,_
"Udeh sampai lama da, tapi baru nak review",_
"Terrible customer service Why people like this can still get payed ,",_
"I love them thank you seller, shipping also very fast will by again",_
Btw stay safe and take care yall 🤎,_
ingatkan satu baju je,_
penghantaran kira ok la ke Malaysia ni harga berpatutan,_
yg penting murah sgt,_
Brg smpai dlm keadaan sederhana baik,_
Sangat love dan jadi favorite ye,_
"Apapun, TQ Seller",_
kain best pakai katanya,_
"Anak suka, ibu pun suka",_
"I know the rules now, I did not get involved too early",_
"Kualiti bagus, dari nampak kulit kepala, terus dah tak nampak",_
Alhamdulillah selamat smpi n berfungsi dengan baik cuma shipping ada lmbt sikit,_
Fast shipping & secure packaging,_
the free gift is a small nail clipper and not as what is written,_
"Kecik je sesuai utk budak, dewasa rambut pendek boleh la",_
Dah guna utk 2 projek,_
Ambik masa 10 hari jugak la utk dpt kasut ni,_
hope elok la mnyala lampunya,_
Soup pack all came in good condition,_
23 ogos 2021,_
Brg diwrapping dgn baik,_
"WASHINGTON: As the Trump administration moves toward antitrust action against search giant Google, it's campaigning to enlist support from sympathetic state attorneys general across the US",_
"Worst experience, can't even login the app despite putting in the serial number",_
"Shares of Walt Disney Co were the heaviest drag on the Dow following its disappointing earnings release, in which the media company reported shortfalls in streaming subscribers and theme park revenues",_
Belian kali ke 2 dgn seller ini,_
cuma purdah punya jahitan tak kemas sangat,_
Selamat hari raya maaf zahir dan batin buat semua yang membaca,_
blh utk sorg - 2 org mkn,_
Need to practice,_
Just nice stuff,_
Beli untuk anak yg nk balik asrama,_
"kasut cantik, nmpk mahal ank suka sgt",_
Kualiti bagus elok aje anak pakai,_
"Joining Ooi for the same award was 49-year-old Mohd Shamsol Arabaye, who is The Star's Health, Safety, Security and Environment officer",_
And the machine works great !,_
the magic sponge is good if your hair is not too thick or if you have a lot of hair that is the same length,_
"Paid on 25/6, seller ship out on 26/6 and received on 28/6",_
Delivery to East malaysia took about a week,_
patut laa mahal pun,_
kejap jer dh sampai,_
Order 12/12 and received it on 13/12,_
cantik warna baju ni,_
"i dah beliiii u guys bila lagiii,",_
walaupun nampak besar dah palazo ni huhu,_
Sorry gmbr and vid tkda kena mengena,_
I love your videos but girl are you for real eating slices of lemon like it&$HASHTAG$,_
Packaging from Wako veryyyy secure memang tak kemek langsung barangnya,_
Tq brg smpai dgn selmt dan elok,_
I'm a Nike fanatic!,_
I gave up,_
Dalam dia xde zip atau compartment tau,_
Barang sampaiiii dgn selamatt dan cepat,_
This is my forth times facing the problem with this app,_
boleh repeat lagi untuk corak lain pula hehe,_
[cute],_
Mask sesuai dipakai harian,_
Tp suar kecikkkkk sgt,_
WALAUPUN WARNA LAIN YANG SAMPAI,_
"Item received in good condition, this product is good",_
"however packaging n one of the box is broken,",_
Saya beli sendiri ditempat yang sama hanya butuh waktu 30menit PP,_
Corak bunga purple ni dah ada,_
"third times repeat , the quality is very good, dia punya tempered tu tebal and harga pun affordable and delivery only takes two dayy",_
Lepas ni tak susah nak fikir nak letak mask kat mana kalau kita pegi makan ke,_
Memang memuaskanPenghantaran pantas,_
cantiknya colour ni 🤍 beli time flash sale hritu,_
mcm ripped jeans,_
Service selalu tiptop,_
Effectiveness:Trying soon,_
Good delivery and fast delivery and murah Dan berpatutan pada makanan,_
Best pakai jersey tu sbb kain lembut tak panas,_
Tengkiuuu rekomended sngt,_
Baju cantik sama je macam dalam gambar,_
The pyjamas were very nice and good quality,_
Received barang selamat dan dalama keadaan baik terima kasih,_
Don't hesitate to buy from zanzea guys,_
padahal tak boleh nak betulkn sgt pun,_
Effectiveness:Biarkan pada semakan,_
"received item in good condition, expired date lambat lg",_
MADRID: Berikut keputusan La Liga sebentar tadi:,_
confirm sis beli lg & lg,_
nampak bagy,_
91 juta sudah menerima dos pertama,_
Anak suka sbb gun ni pamjang dan besar,_
"Barang2 dah sampai, terima kasih",_
"5 , 6 , 7 , 8",_
"Very high quality and perfect for keep the lappy inside, the fabric was nice and thick too",_
beli la banyak ok baju dalam,_
Very smooth drawing,_
memang sesuai utk dewasa,_
Packaging kali nie lain macam sikit,_
Seller packed this with Fabuloso,_
Barang ok semua lengkap,_
good productnice packingfast deliverylike it but more good,_
this texture is not chunky,_
Overall OK but just the waist a bit small,_
Will repeat order againn,_
"Delivery speed is average, packaging is still consider good, but the outer box is dented, maybe is courier company problem",_
"semua dalam keadaan baik ,comel sangat bag ni ,anak suka dan minta beli lagi",_
!thanks for your info today and I will have to cancel it for you tomorrow at the end of the week I have to,_
"nmpk sempurna,harap2 takde mslah",_
Received in a good condition just the quality of material is so so not like cotton shirt,_
Good with free gift provide by seller,_
"Good quality product,received with good condition,will buy again,thank you seller",_
Expiry date is on December 2021,_
Mmg terbaik dan x rugi beli,_
They work perfectly,_
Nice jelly powder,_
"pantas seller buat keje, good job",_
"Hii seller, Item dah sampai ye",_
Products received in good condition with layers of bubble wrap,_
"PSG coach Mauricio Pochettino, however, was confident he would play at the Parc des Princes for the first time since the transfer window closed amid media reports he was willing to join Real Madrid",_
bra sampai dgn selamat,_
the load is 1,_
The delivery time sangat pantas,_
Sure will repeat again soon,_
They are super ultra pro max plus beautiful and powerful,_
saiz ngam utk anak,_
shoppe lahanat,_
quality premium dari beli kat kedai biasa,_
Why is everyone posting at the same time?,_
Pinggang ok xketat xlonggau,_
Bezza 2022,_
recommend betul,_
Kena ambik size yg besar lagi,_
Machine wash cold with like colours,_
Sb bundle kan,_
"The KRI Bung Tomo head's of operation, captain Edo, explained that the operation followed reports from another navy ship that picked up the signals of a foreign fishing vessel during a sea patrol code-named Rakata Jaya Operation in Natuna Waters",_
"sangat puas hati,tq seller",_
"Tug boats have towed free one of the world's biggest container ships, the Mumbai Maersk, which had run aground off the German island of Wangerooge in the North Sea, Germany's Central Command for Maritime Emergencies said on Friday",_
Functionality:rak fungsi dengan baik,_
"Bag design is nice & like the design, quality is good and price cheap",_
Nice and tight packaging,_
"com Inc, so long as they got inventory into the United States in time",_
berat anak 40 lebih,_
"Penghantaran mmg laju, produk smp dlm keadaan baik",_
"My kid 4 years old, she like it very much, easy to use",_
memang selsa n loose,_
Seller dia baik dooh,_
CepatPantasSangat Semuanyaaaaa okayyy lahhhterbaik sangatttEhhh barang sampai selamat,_
good gonna repeat again buttt nipis la jugak tak tahula berapa layerr,_
$HASHTAG$ love DJI,_
Thank you Seller for the fast shipment & courier for the speedy delivery,_
Many scar on ring,_
"Very good service, will repeat order again, tq very much",_
Luckily good packaging on the wrapping as the seal is broken,_
Effectiveness:brang baik,_
Lily+eucalyptus+ocean,_
Siap dapat extra lagi,_
Packaging - N/A,_
We so love it,_
