Sentence,Tagged_Sentence
barang dibungkus dengan bubble wrap dan dihantar dengan baik penghataran pun cepat tq seller,_
smpai 1,_
cepat untuk kebutuhan,_
"Dah sampaiii,dah pakaiiii",_
suppose value between 1,_
Lund's message could not come at a better time,_
Saya beli yaa Saya akan repeat beli lagi,_
Second time purchase!thanks seller for the cheaper price and this time got free recycle bag,_
Penghatran cepat walaupn dri china,_
Very sturdy and fast delivery,_
"banyak pilihan game ssuai tok anak2, mak n apak",_
The sound is okay I guess,_
Brg elok and servis tiptop,_
harap2 okeyyy & sesuai laaa kalau okeyyy blh repeat order,_
Bought for my dad!,_
-thx for the free gift even just min purchase!,_
cuma xpasti saiz 4xl ni muat ke tak dgn sya yg berat 90 tinggi 156 sbab tngok mcm kecik,_
Cuma salah diri sendiri sbb salah pilih size 🤣,_
What a waste of users time!,_
Belon n brng2 smpi dengan selamat,_
Boleh bergaya time raya,_
vibrator semua function,_
"All are goods, thankssss yaaaaa",_
"Smua dh smpai dh 2,3x repeat kedai ni sgt cpt buat kerja smua item ckup trima kasih saller",_
"sesuai dgn hrga , penghntrn cepat",_
"Kain dia pun elok jeee, nanti nak beli colour lain pulak🥰",_
Kain seluar sedap pakai lembut,_
"Very good, i thought with that price, i can sell them in this great quality",_
51mil via a renounceable rights issue of seven-year redeemable convertible unsecured Islamic debt securities and is planning to raise up to RM400mil in additional capital this year,_
trbek laa seller pn baik,_
Barang dah selamat sampai tapi saya di kampung tak berkesempatan snap gambar,_
"07 mata kepada 1,535",_
they rolled when u are not aware,_
AJA KALAH LEMAH LO!,_
Similar to pic,_
kain dia bukan jenis knitted but kain voile chiffon gitu,_
REPEAT ODER KALI KEDUA NI,_
jayanya,_
Kain dia jenis licinn and size elok ssuai: utk bra plk saya rasa tk tahan lamasbb span dia jenis bole bukk and tkde jahitan tepi,_
Parcel hantar cepatt,_
Okay sgt ok,_
nnti boleh beli pattern yg lain,_
"Kajian penting ini menunjukkan dos ketiga Vaxzevria selepas dua dos vaksin yang sama sebelum itu, ataupun selepas vaksin-vaksin mRNA atau yang tidak diaktifkan, memperkukuhkan lagi daya imun terhadap COVID-19, menurut Ketua Pasukan Vaksin Oxford Andrew Pollard dalam satu kenyataan",_
"Setiap mau pesan grap disuruh dowloand ulang,bikin ribet,biasa ngk gitu,masak tiap bntr diperbarui",_
Barang lebih terjamin elok,_
wrap yg kemas,_
"PENGHANTARAN BAGUS, KAIN PON OKAY JE, Semua okay",_
soalan ditanya semua jawab,_
from 6 to 9 Jan,_
suka lawa2,_
Thanks seler,_
Barang sampai dalam keadaan baik cuma kotak agak kemek,_
"Beli utk hadiah kawan, dia suka sangat !",_
"06 pagi, petunjuk pasaran FTSE Bursa Malaysia KLCI (FBM KLCI) naik 2",_
Thank you dh byk kali dh repeat beli borong,_
"Kain tebal, Quality sama macam jual kedai",_
Kecik sngt beg nye,_
Cuma spoil dekat sulaman logo,_
not original,_
ank x puas hati order merah dpt pink,_
barang sy hilang kt jnt dia siap setel gan jnt sampai jumpa,_
Baju dapat sama macam dalam live muat untuk anak pakai,_
Looks like oats hand packaged,_
Aroma:full of nice aroma of arabica plus robusta coffee beans,_
"material ok, taktebal taknipis, sejuk, warna pon cantik, penghantaran sangat laju, order 25hb tengah malam, 26hb dah sampai rumah",_
Dah beli 2 sebelum ni,_
Hindi na sya pwede gamitin para kumuha nang taxi or umorder nang pagkain useless na ito kung di ibabalik ang old version,_
Everything is delivered accordingly,_
Pembungkusan ok sgt Dan delivery laju,_
01 points or 0,_
"PENGGUNAAN meluas telefon pintar telah mengubah corak penyampaian perkhidmatan kerajaan yang dahulunya berbentuk konvensional kepada lebih inovatif, kreatif, moden dan digital dengan matlamat mendekati rakyat",_
Ok lah save utk budak susah utk mak budak nak duduk,_
19/0421/04,_
very reasonable price and good quality the design also cute suitable for any range of age,_
very fast delivery good packaging good quality product zasssss satisfied,_
Con l'ultimo aggiornamento continua ad uscirmi che il servizio myorder non è ancora attivo in NESSUN ristorante in Italia,_
The item just received today,_
17/9 dah Terima,_
harap berguna dengan elok lah,_
Semua bau sedap n rilex je,_
"If I did pay that price for a wagon, and it was as poorly assembled as either of your examples, I would return it and request a refund",_
"tudung cntik, labuh,",_
Thank you for your service!,_
On the 6th in California,_
btw thanks harga murah sangat sangat tak jumpa kat luar macam ni moga murah rezeki kita sume,_
HARGA PUN MURAH!,_
sgt cantik kain lembut x pamas,_
"Saya kini bergantung dengan ubat anti-kemurungan, selain mendapatkan rawatan pakar psikiatri",_
Terbaik seller layanan tiptop dgn Customer next repeat lg Ank pon suka dpt kreta remote yg hebat bg dia🤭tenq seller,_
Item received good as well,_
it came with brush which is good for those who doesn't have a brush,_
best gila worth it gila beli confirm repeat lepasni baggy pun takdela baggy sangat suka suka suka ^^ w:69 h:162 baju cover punggung okay sangat,_
But counted only have 43 pcs,_
Semua parts cukup dan mudah je nak pasang,_
🤣 Jadi saya repeat order extension pulak,_
The mask however feels quite thin for a 4 layer mask,_
"91bil) in December, putting it on track for its strongest month since July, according to Refinitiv Lipper data",_
Baby selesa dalam swaddle ni takda terkejut2 lagi,_
bahu ada span,_
Good product same as picture and will order again next time,_
Alhamdulillah dh smpi dh on 2 hari semua ok hotspot pon xtelan,_
I tried the washing machine when it arrived yesterday,_
Beli utk my 1st baby & tk tahu size newborn baby mcm mana tekejut sbb rse mcm eh kecik nye tapi bila difikirkan semula baby kan mmg kecik,_
Terbaik brg dh sampai bolih beli lagi lepas ni🤩,_
"2) material a bit hard but its ok, match with the price",_
"It is worth that too, in the storefront",_
xsabar nk bg anak buah pakai,_
ll say it: F-U-G-L-Y,_
Sorry seller takde gamba n video,_
baru hari ni nk rate,_
akan repear lagi,_
Cantik n terang,_
Kaftan ni lovely sangattt,_
kipas pon ok tp knapa cume boleh pakai kat fon yg charger nye hadap kedepan,_
so far tgk blanket ni okay je kain gebu je,_
🤩🥰🥰🥰🤗🤗🤗,_
Kartolo gemblung🤣🤣,_
Mkn letak dlm bubur mmg umphh nanti dah habis kita repeat lg,_
Terima kasih seller and and jnt,_
Anakkkkkkk suka cuma tak boleh nk gatih lagi kaki belum smpaiijji,_
"Penghantaran cepat,smlm order hari ni dah smpi",_
Ade sale lg baik beli dgn brader ni,_
LEMBUT & SEDAP BILA NK BUAT KERJA,_
Lawa zip pon okay banyak ruang boleh letak kad kad ic,_
Jika pihak Singapura ada yang sudi menerima seperti mana yang pernah dibincangkan berdasarkan keadaan semasa (kalau ada keperluan boleh ditambah),_
ThankQ so muc seller,_
Sangat recommended kedai mainan anak,_
ni kali ke 3-4 dh beli dgn saller ni,_
Semua function dgn baik penghantaran cepat,_
"fast delivery, good packaging, cheap price, thank you",_
cheapest compare than local item,_
yg ni cutting dia kalau yg peha besar tu agak ketat sikitla,_
seller pos out ljuu,_
Yang paling buat aq excited ialah buku seni tu haaa,_
"x rasa bersalah dah nak mkn mee grg, kwe tiow grg walaupun dlm diet",_
wangiiiiiiii yakmat harga beebaloi murahhh gilerrrrt,_
"Paling suka bj jersey sbb ngam2 dgn ukuran yg diberi cuma seluar tu tak tahulah silap kat mana, besar sgt drp ukuran sy",_
"Minister of Post and Telecommunications, Dr Thansamay Kommasith last month signed a new ministerial regulation, authorising the Lao Computer Emergency Team (Lao CERT) to accept complaints from people defamed by other social media users",_
Alhamdulillah dh smpai game ank2,_
Mata wang tempatan itu jatuh berbanding pound British kepada 5,_
Received on 5/6,_
Repeat second order from the same seller,_
so memang tak kemek la cap,_
Tp seller bagus!,_
"Monica Vitti, one of Italy's most beloved actresses, celebrated for both her wit and beauty and famed as the muse of Michelangelo Antonioni, has died aged 90",_
Wishfully it can be last longer,_
"Pagi order,petang shipout",_
So far so good mmg bebetul labuh even bidang 48,_
Makin kesini makin g jelas,_
Pghantaran sangat lambat,_
Ant,_
Pnghntrn laju sbb dekt je kn,_
You guys must try using this app,_
Tq saller nnti repeat oder lgi,_
"seller, product quality, packaging, courier service, shop voucher",_
what other arkham skins are on your wishlist? mine are arkham asylum (different but fixes rubber from city to screen printed material) origins knightfall (origins) city beyond but unlikely first appearance (arkham knight) noel(origins or preferably knight as it&$HASHTAG$,_
Malas dah Nak bising,_
"Tak try lg for my baby, harap ssuai utk baby i",_
Tak pernah tak excited tunggu parcel ni sampai,_
song aur game to karte hi the ab phone unboxing and review bhi waah,_
Cantik sangat 🥰 dan penghantaran pun pantas 🥰 suka sangattttttttttttttttt🥰,_
sticker comel sangat & kualiti dia elok je bagi saya,_
BRG sampai selamat,_
anyway nak tukar sendiri makesure extra berhati hati,_
But colour is a bit different from pictures,_
Cemin mats anak suka,_
will repeat again and again and again with same seller,_
Harap balm nie dapat bantu redakan selesema dan batuk anak,_
"Canon being Canon, everything amazing and 100 what it's supposed to do, from apps, softwares and products",_
Kalau baru knp ada kesan tompok² putih mcm tu?,_
Falling in love with Mark Ryden,_
Barang selamat sampai dalam keadaan yg baik sangat berpuas hati dgn barang yg dibeli,_
Banyak benang sejadah yg rosak,_
There's internal setting that depletes your data,_
The texture is soft and breathable,_
Saje beli banyak saiz,_
Penghantaran lmbat coz pre order,_
"The bag is good with cheap price, but it is not cheap",_
sᴇᴍᴜᴀ ᴘᴀᴅᴜ2 ʙᴏssᴋᴜ,_
Beg nie bagus jenis sandang kalau pakai takde rasa gatal kat bahu barang yang boleh Di Simpan memang padat tapi cukup untuk letak power Bank Dan sebagai nya siap bagi free USB LG boleh cocok tepi delivery average maybe delay 1/2 hari tapi barang yang sampai quality memang cantik,_
"Guna plastik ni utk buang najis kucing, so mmg sennag eventho kecik ok je nk buang banyak najis",_
Zubida and to be the first time soup oui and the same time to ur and 555889 8,_
ty saller next time repet lg best2 sesuai utk ktinggian sy 173cm 🥰🥰🥰,_
Saya dah guna pun,_
x terkoyak pun plastik ni,_
"Items received in good condition with super duper slow delivery, delivery part should be improved",_
Everything arrived in a cardboard box with extra bubble wrap protection,_
boleh repeat order again later,_
Design cantik Overall semua elok!,_
Love terokkk wehh,_
"Items received in good condition, neatly bubble wrapped",_
pun order lain dpt salah saiz,_
"The packaging was very tip top, very secure and i really appreciate it because not all of sellers could be able and willing to do it, tqvm dear",_
Pasang no 1 pon dah ok,_
"Delivery sangat cepat, semalam order harini sampai hehe thank you seller",_
Sorry gambar x ada kaitan 🤍🤍🤍🤍🤍🤍🤍🤍🤍🤍🤍🤍🤍🤍🤍🤍🤍🤍🤍🤍🤍🤍🤍🤍🤍🤍🤍🤍🤍🤍🤍,_
"Barang dah smpai dalam keadaan selamat, penghantaran sangat pantas,harge Baik",_
puas hati dengan kasut ini terbaik and recomended,_
Don't place an order from the app if you don't have address proof,_
Dah repeat few times dengan seller ni,_
Beli masa kne covid,_
Gestation simulator new update,_
baju cantikkkikkkk molek padan tpi penghantaran lambat dgn poslaju sbenarnya smpai 11hb tpi poslaju peram barang 12hb bru sampai harap lpasni xpkai dh poslaju,_
Seller ship awal,_
membantu buat kerja nt,_
Functionality:as stated on seller page,_
kain sejuk best pakai,_
Yg lain2 smua ok,_
"Taktau lg hasil camne, beli sebab sy mmg suka jenis talkum",_
"Very convenient, not the best in the shop",_
"Anyhow, decent curtains, just make sure to iron them first before using okay",_
"Products very good ,Nice ,quality boleh tahan lama made in usa",_
lambat sikit sampai Kali ni,_
Dah try sekali dimintanya beli lg,_
"sayangnya jam cover belakang dh tercabut, serta jam tidak berfungsi langsung",_
iphone x dia bagi semua kuning weh,_
2 warna hitam gan grey,_
casing shiny,_
"Ring light cantik sngt ada 3 tahap kecerahan murah pulak tu 24sen je free shiping lagi, beli time 11",_
At RM6,_
seller please back buyer rating tqtqtqtqtqtq,_
It's like used product,_
penghantaran ke sabah cepat,_
Dan tidak panasss,_
just nice dan fit kt kaki anak,_
"Turut dibina, lima jejambat serta membabitkan skop menaik taraf dua persimpangan iaitu persimpangan Tok Molor dan persimpangan Tok Ku kepada persimpangan bertingkat",_
Ada yg pleated rapat sangat,_
termasuk Malaysia puas hati,_
This one or the mi lite 5g?,_
Cuma nanti nak potong la sikit,_
Simple and quick to use,_
price also afordable,_
kampong baru,_
Durability:LEMBUT SGT,_
anak suka dan berpuas hati,_
Furthermore its very very cheap,_
Have 2 compartment - main and a smaller front side suitable to keep smaller but slim items,_
Tq coins 500,_
Yang 3 in 1 skrg tengah pakai,_
setkt ni paling murah ngn seller ni,_
Terima kasih barang yang saya order dah pun diterima,_
boleh pakai balik kampung nanti,_
Alloy tire ni besi tau bukan plastik mcm seller sebelum ni beli plastik Dkt seller ni berkualiti tauu harga mampu milikk 🥰🥰🥰 thank you seller pos out awal tpi tahu jela j&t peram skrg seminggu baru dpt 🤣🤣,_
"MELAKA: The world's biggest rubber glove manufacturer, Top Glove Corp Bhd is working to address the detention order imposed by the United States (US) Customs on imports from two of its subsidiaries to ensure undisrupted supply of rubber gloves supply amidst the global COVID-19 crisis",_
Good job from supplier,_
Sharon Tan,_
Texture:bau ubat-biasa la,_
Beli untuk anak buah dekat sabah,_
"Quality:sangat sangat sedap,macam eskrem rasanya🤤",_
"All hand-made, nutritious, delicious food, you deserve to have",_
cantik murah thankyou sori gmbr tkde thankyou sellerrrrrr,_
01 pc Sport Breathable Knee Guard Protector Support Brace Pad Single,_
Harga terbaik masa sale,_
Memang sejenis asal xde tu replace je ke any colour without informing customer,_
Thankyou happy sangat dapat free sample ni,_
Parcel arrieved safely with good in condition,_
Sape nak beli digalakkan ambil size lebih besar dari asal,_
suka warna lipstik ni macam natural je murah beli time shocking sale,_
Its new,_
It didnt used to be this way,_
Ksut cntik jh pstu ingan plak tu,_
"kadang2 ayah tengok orang pelajaran tinggi ni bila bagi alasan atau jawapan tu,macam bahlol tu dah jadi amalan hidup",_
Ibu saya suka kopi ni orang johor la katakanmhehe,_
Texture:watery tapi non-smudge!,_
bijak berbelanja save untuk masa masa emegency nanti,_
bare jdi,_
Simple design yet look elegent,_
And cant notice anything artifact,_
x de rezeki,_
Kali ketiga repeat,_
Seller so friendly and helpful,_
Smua ok cma ad bintik merah je kt bju tu,_
Maybe sbb musim perayaan kot,_
Tonkatsu soup is very savoury,_
It is a must product for white sneaker lovers!,_
Hopefully muat dgn kaki pemilik nanti,_
"Goooooooooooooood, gooooooooooooood, gooooooooooooood, selamat sampai,barang tak rosak",_
Look at the crema!,_
Getah pon ok harap dapat pkai lma,_
"The most important thing is, its not expensive hahahah",_
we holler,_
Cuando se publique el vídeo sabremos quien estará en el número 1 de la sexta semana&quot,_
Thank you for the small gift from the boss,_
Cantiknyaa warna ni,_
"Vibration is there, very nice, worth the price and service",_
bagus lah murah berbaloi baloi seller packaging tiptop,_
"Good quality, good in packing and good in condition, fast delivery Thank you seller",_
$MENTION$ Hi Lew!,_
Buy here gais,_
"The small town of Mayfield, Kentucky, was obliterated and 74 people died in the state",_
The express is also very fast,_
Skin Suitability:okay je semua cukup cuma mntk warna putih dpt mask hitam,_
Perhantanran pantas sgt,_
I beli this item 2 x but only came 1 x,_
Friendly user la,_
Senanggg nk tukar bila dh rosak,_
"Casing cantik & sampai cepat,",_
Still cannot found a channel,_
"I would never stop talking about how beautiful the packaging are, the foundation provides full coverage, the formula that they used for the lipstick is good too definitely suggest you to buy this product if you're a lip mate fan",_
"Death rates have similarly dropped from the seven-day average peak of 1,700 in early August to around 100 in early October, and 11 on Wednesday",_
Dapat dengan harga yang murah sempena CNY ni,_
"ada kualiti, tebal,",_
mantap terrrbaaikkkkkk,_
barang dh sampai serius cantik gileee memang lawa la tk tau nk ckp sesuai untuk remaja,_
thankyouuuuuuuuuuuuu sellerrrrrrr,_
good goood goood goood good goood goood goood,_
Harapnya berkesan dan tiada kesan sampingan yang tidak baik,_
Delivery: Fast,_
real wrna beige lawa sangat,_
Siap ada berus lagi comel lagi,_
Next timeee nk beli yg saiz i,_
Sticker sangat cantikproses pembuatan sticker tidak mengambil masa yang lama,_
The packaging is good and no dent at all,_
For camera no problem but performance belum Tgk lg sbb nk download apa dlu,_
Istimewenya ape?,_
Kain dia beza dgn telekung SK,_
Keberkesanan tdk psti,_
W: 85kg,_
"Packed in box with plastic, noodles still a bit crushed, but can accept",_
Wash item before use,_
Ok ngam saiznye selesa pakai utk 4xl berat 90kg,_
Cantik tp kualiti padan dgn harganya,_
Dan tidak bs dcancel,_
Cuma shipping mahal la since this luggage berat kan tapi bila total up dgn shipping still murah dari belu dekat kedai,_
my workspace,_
Brg dh sampai walaupun dkt seminggu baru sampai,_
Quality: seluar putih jarang sikit,_
cukup 10 tq seller,_
"Dah try, elokkk, ringan dan senang nak guna, thankyou seller!",_
Tngok la korang,_
"May god widens your rezeki in this world,",_
Meta isn't going away anytime soon,_
Sah sehingga 26/06/22,_
tq sller,_
Kualiti pun nmpk okay,_
"Nor Hisham agreed, saying development, should not interfere with the natural processes of the river",_
banyak kali repeat dengan saller ni,_
Dh 2 kali repeat brg dari kedai ni,_
"The most comfortable panties for meeeee ,",_
"Fast delivery, this really useful when closeup unfinished food",_
My order is received in good condition,_
Fast delivery and good quality like originalFast delivery and good quality like originalFast delivery and good quality like originalFast delivery and good quality like original,_
"cadar kain lembut macam cotton tuu , cantikkk",_
"As time passed after his election, he showed impatience with the messy politics of parliament and a succession of governing coalitions",_
"This workshop is not only about drawing Mickey Mouse, it is also for our children to learn how to interact with members of other communities",_
"Took this every morning with Milo, taste really good and easy to make",_
Punca awal kerosakan itu dipercayai disebabkan oleh kegagalan kuasa berikutan letusan kuat berkenaan,_
Dah biasa beli takde masalah,_
Qty produk betul,_
Dkt kotak siap letak sticker fragile lagi,_
"4 or 282 of those tested, he said",_
dpt free pun bnyk,_
Nnt try,_
by the way i add on brooch buy 3 but seller give me more,_
"Item received in good condition, everything is good no damaged",_
"dah sampai budak punya, ok la muat je, saya mmg badan kecik, beli mask mmg kena kid punye thanks seller semua cukup, yg nak beli boleh beli sini trusted ok🫶🫶",_
beli untuk kawan hehe,_
Walauoun gambar xberkait tp nak bgtahu seluar tu mmg tebal n harga murah,_
pastu ngam dgn macbook air i dah test dah buka tutup camera memang mantap,_
Morena que,_
Beg kecik comel je tapi boleh letak banyak barang,_
terbaik Tm ksih blako,_
"kain cantik,Murah plak tu",_
Warna2 semua cntik,_
I ordered something online from Fashion Valet app to have it delivered to a friend via Grab Express,_
rupa nya pnjg,_
🟢🟢🟢         SOLANA - SOL -,_
I have cnvnced my mom to buy it ty for the info,_
packaging pun sampai cantek,_
Memang case sebijik dalam gambar lawaaaaaa,_
"What do you need an app when you are not even taking in order, and what is the purpose for having the app ?",_
sometimes buffer sikit2 je tp overall ok,_
Cuma seller tak bubble wrAp,_
Recomeded bole beli d kedai ini,_
fast delivery well packed items as described in great condition will be happy to deal with again,_
Best nescafe ever,_
"seller pon ok, baik bila kita bertanya sesuatu yang tak faham",_
ALL THE ITEM WAS GOOD AND REALLY RECOMMENDED FOR YOU TO BUY IT FROM THIS SELLER!,_
"President Joe Biden's election victory in November 2020, the European Union also removed EU tariffs on U",_
ada double tapee and skru sekalii,_
Harga yang berpatutan dan agak murah,_
Esta niña es muy mimada no puede ser,_
Sorry got no pic and vid for this but it safely arrived and function well!,_
Satu rumah boleh dengar,_
"My mom meninggal dulu, jenis tak share ngn ayah i",_
"whos read these comment section,please buy without worry",_
"Berfungai dengan elok, cara nak pasang pun senang, harap2 lekat elok la sb macam xda gam je just letak mcm tu je",_
The packaging were well wrapped & neat Thankyou seller & postmen,_
"Lepas bayar online, the restaurant said they never received my order",_
Wong Jin Quan,_
laju buek kojo,_
my ordered is arrivesoon i will repeat again hehe🥰,_
"Btw, cepat nya sampaiii sabah, dlm 3 hari ja",_
"But not that I found the right app, works like a charm",_
tqqveryymuchhhh,_
Kotak dia hidup segan mati x mahu gaisss,_
cpt dan selamat,_
Got free gift sommore so good thanks seller,_
So I just pick any shade that I think suit my skin,_
Cantik2 barut even random je,_
"Proses dari seller cepat dan pantas, courier pun laju",_
m never gonna win(smiling in pain),_
Overall okay tp tkyahu nanti kot dia rosak ke sbb tk pakai lg ni apa apa kalau rosak kita update 🥰,_
Mcm vape stick tapi keberkesanan nya mmg tak dinafikan sngt berbaloi,_
Kasut padan la dengan kaki,_
"brang dh smpai,pnghantaran pntas",_
Quality:looks like good quality,_
"lain kali boleh lah order lagi,",_
saya sahaja yg tk ok,_
"Cognisant of the rising environmental impact from consumer packaging waste, industry leaders in FMCG recently formed the Malaysian Recycling Alliance (Marea)",_
Untuk rujukan future buyer: tudung putih XXL kecik sikit dari tudung hitam XL,_
"BTS DESERVE ALL THE LOVE AND SUPPORT , NOT THE HATE ,",_
Siao Yen,_
I have decided to change to another app that actually lets its users use promo codes,_
"Item received safely, laready installed and word perfectly tq seller, in deed i also ordered 160mm dics, but i order it wrong size",_
Ngam2 di badan suami sy,_
Sudah smpai dengan selamat tampa sedari ia sudah dirumahhh,_
semua ok x de masalah,_
"Seller fat reply,",_
pasal baju ok cantik kain lembut sedap je pakai x panas cumanya terBesar dengan saya ambik saiz xl klu ambik saiz L ok da kot,_
bukan pesen gantung macam sesetengah cordless,_
Stuff well received and the jelly drink expiry is nov,_
Tp ttp cantik sgt,_
"Good product and quality, value for money",_
Tilam agak keras sedikit untuk baby,_
Penghantaran yang agak laju,_
semoga dpt slim la,_
"cantik, kecil comel sesuai untuk saiz tangan perempuan",_
bearshit,_
"Beli masa 11/11/21,baru hari ini sampi",_
Puas hati dengan berbaloi dgn harga,_
"Second time repeat, thank you seller ,",_
Tq Bagi Gift tuk lips,_
Bahagian dlm ada ruang kecil untuk simpan brg yg kecil mcm kunci,_
AWS said about nine hours later that it had resolved the network device issues that led to the outage,_
"barang dh sampai, cantik insyaallah akan repeat lagi tq seller",_
Good condition good good tq tq,_
Penghantaran shopee express laju,_
barang cantik sampai sesuai sgt untuk baby sy umur 2tahun,_
"Tq, Da sampai, bungkusan kemas, bau sabun wangi🫶",_
"Barang sampai cepat,cukup dan dalam keadaan elok",_
"BARANG CANTIKK SGT II,",_
Penghantaran sangat cepat dan item,_
One of the best things I like about the Oneplus camera is classy and also the smartphone design is totally stunning,_
So no complain,_
Product arrived at good condition,_
"Brg da sampaiii, terbaik bos",_
"The standards and benchmark have been set quite high this year, with quality content in the submissions for the innovation and best technology use categories",_
terima kasih penjual yang ramah dan cepat membuat penghantaran kepada pelanggan,_
Brg pon terbaikkkkkkk,_
"penghantaran pun laju, saya d sabah",_
Tqtqtqyy,_
"Long expiry date mean fresh new stock, taste good as usual, will buy more soon",_
"Thank you seller and courier, my parcel is safely arrived!",_
"Peng Soon pula terlebih dahulu membentuk gandingan bersama Valeree Siow bulan lepas dan sudah pun membuat kemunculan pertama di Terbuka India 2022, baru-baru ini",_
Ok la kalau untuk memgemop bilik or ruang yang kecik,_
Functionality:usefully,_
Received it the next day of order!,_
PARCEL STOLEN,_
"kuali beg macam beg sekolah, ruang dalam beg agak kecil tp dengan harga yang murah, memang pembelian yang berbaloi",_
"Mineral powder ni best sebab finishing dia matte and tak buat muka nampak kelabu ponsesuai untuk oily/combination skin, yang penting authentic",_
"kualiti okeyyy,cntikkk🥰next time repeat lagiiii🥰🥰🥰🥰🥰🥰🥰🥰🥰🥰🥰",_
"kasut cantik sama macam gmbr , longgar sikit kalau pkai sock ha muat la , ada bekas gam sikit tepi tu tapi overall oke la , thnkyou seller",_
Fast delivery good good good good good good,_
"Hal ini diperkukuhkan melalui hadis daripada Abu Hurairah RA, bahawasanya Rasulullah SAW bersabda yang bermaksud: Tanda orang munafik itu ada tiga, apabila ia bercakap berdusta, jika membuat janji mungkir, dan jika diberi amanah dikhianati",_
terperonyok,_
Pigmentation:Bagusssss,_
Nice Mobile and lovely colors,_
