Sentence,Tagged_Sentence
Mask semua sampai dalam keadaan baik & cantik2,_
"Dah guna this one almost 2 years, love this product so much",_
Barang ni memang sangat murah,_
All item packed with bubble wrap and well received,_
tp pghantaran cpat,_
3rd kalibrepeat order from this seller,_
biasa klu saya puasa,_
Sbb terambil size M,_
Ngam teruk if pakai dgn stokin,_
KUALA LUMPUR: Police have busted an online gambling call centre following a raid at two condominiums here,_
Purchased during 3,_
Well done for the great service and good packaging,_
Terima 19/5,_
This is killer,_
murah & sesuai buat lap2 makanan tumpah,_
Jimat dan harapnya kekal lama,_
"Penghantaran yg cepat ,warna dan corak yg menarik,suka ank2 bila dpt mask spt yg dia org suka,lembut dan selesa bila dia org guna pakai,kuantiti dan corak dpt sot yg di order",_
"penghamtaran pon laju je ,kejap je sampai",_
"Barang sampai dgn baik dan mantap,packaging pun cun mmg safety,kalau ada sesiapa nak tukar battery siap hntr dan pasang area kl selangor boleh wsp saya 0146416640",_
quality and price is so unbelieveable!,_
prhntaran cpat amek msa 2 ari je brang smpai,_
"Penghantaran sangat cepatttt,",_
"moga Allah permudahkan dan pelihara, lancarkan proses melahirkan, aamiin ya rabb",_
memang takkan repeat lagi,_
"Received in good condition, reasonable price and well packing",_
Boleh masukkan duit keping tp tidak boleh masukkan dompet panjang,_
Will repeat again 🤍,_
"Semalam order harini sampai, kelantan - selangor",_
"As borders reopen and travel restrictions ease, the airline said it will resume regular flights, including to cities in mainland China and Australia",_
Everything works well for me,_
"Do not use this to pay expensive items, for you may end up paying twice if the first attempt crashed, then pay again to prove to restaurant",_
Penghantaran sangat sangat sangat sangat sangat sangat sangat sangat sangat pantas,_
ingatkan pendek sampai siku ja,_
"Barang dah sampai,barang belum guna lagi,kaler gincu cantik dan menarik",_
t have so much storage $MENTION$,_
Awesome printer!,_
Veryyyy disappointed!,_
"Baju Yang cantik, kemassss",_
Tq tq tq tq tq tq tq tq tq tq tq tq tq tq tq tq tq tq tq tq tq tq tq tq seller tudung cantik hehe will repeat order sooooonnn,_
Very fast shipping& delivery,_
TERIMA KASIH SELLER & DESPATCH,_
1/3 Rm405,_
Battery 6000 dena chahiye tha,_
Dude U Rick rolled me at <a href=$URL$,_
Terima kasih daun keladi nanti bole beli lagi,_
Comfortability:baju sangat selesa d pakai,_
Thank you seller to send in time,_
Shipping took only few days to arrive and products are well wrapped in bubble wrap good value for money and good product quality I had checked the autenticity and it's autentic,_
Good quality good quality good quality good quality good quality good quality good quality good quality good quality good quality good quality good quality,_
"product is good,but shipping 10day too slow ,ship out from China",_
Kucing mkn berebut nk kna bli tmbh lgi nmpk gayanya ni hehe,_
best pakai and cantik sangat boleh beli lagi,_
Received so far so good,_
West malaysia to east malaysia only took less than 5days to receive once the seller has shipped,_
tadi stress dengan soalan addmath yang susah nak mat* but this two sampai and stress i pon hilang 🥺 tapi nanti stress balik tengok result btw thankyouuu ya min,_
crocodile dh selamat mendarat,_
"Fast delivery and good product quality, thanks seller,",_
30sen,_
Hopefully this colour is nice,_
"Chan Seng, a father of three, said he was first contacted by a company director, known only as Ng, over the matter in June 2020",_
packaging pon ade bubble wrap,_
"Kain ok lh,sesuai dgn harganya",_
Memang bagusss sngt sngt sngt sngt sngt sngt sngt,_
btw maybe seller boleh letak bubble wrap lebih utk penutup tu sbb takut pecah,_
S our Pleasure (AFER 7-8 YEARS),_
Dapat baju lawa lawa,_
"Napaka BULOK NG SISTEMA NETO,",_
"It is the ideal size that i need, will continue support after finish use, thanks",_
Texture:The conditioner very good and smooth,_
"Item packed in a box, but should use bubble wrap to cushion the items next time",_
cuma letak mcm dlm gmbr tu,_
kita memang jenis tak buang sembarang pampers anak,_
org order 2 ny bukan satu ny satu nike lain kali chat dulu kalau nak tukar order adoi jadi hal kena beli yg lain pulak apolah hm,_
"Taste:It's nt a new stocks, Sept'21 produce",_
Mmg slalu beli dgn seller ni,_
Luckily there will be ios software updates coming out later this year that&$HASHTAG$,_
Sesuai UTK remaja,_
terim kasih for free gift,_
"Satisfied with the switches, feel smooth and sounds better than the stock rk red switches",_
1unt racun pokok,_
Untung beli masa sales 11,_
Penghantaran pantas walau cuti raya,_
"Beli 2 pek sbb sedap sgt, terima kasih",_
hands and legs fingers crossed $MENTION$,_
I bought at RM1,_
Items very well packed and secured,_
yeay thank you!,_
Quality:ò,_
"Sementara itu bagi kes yang memerlukan alat bantuan pernafasan, setakat ini terdapat 274 kes iaitu 184 kes disahkan dijangkiti COVID-19 manakala 90 kes disyaki, berkemungkinan dan dalam siasatan, katanya dalam kenyataan hari ini",_
Everything is tip top!,_
The cords looks nice & really flexible,_
blh repeat lg klau mcm ni,_
Bought it for my partner,_
"Seller pun ramah, tq",_
Cleaning Effect:Belum Try,_
Love my new Moonstone,_
"I've made a few complaints when food is cold or damaged, they usually give vouchers which is nice",_
And if I stare all of the stars at the night sky,_
"good product quality, shipped out fast too",_
nnt ad sale lg blh grab yg lain plak,_
It has also been expanded beyond the Klang Valley to Pahang and Johor,_
"Fast deliveryyy and good product quality, btw happy birthday dong sicheng",_
Ketebalan & kualiti semua okay !,_
Cepat giler seller buat keje,_
Thanks NinjaVan for the delivery,_
Sangat senang berurusan dengan seller,_
Not 1 complaint,_
Ordered L but gave me M,_
Produk berfungsi sepenuhnya seperti yg telah dipromosikan kpd pengguna,_
Mmg wangiii sabunnn niiii,_
pelangi kan,_
Cepat proses tapi ninja van lambat btl nk sampai ke tempat saya kena sabar sikit lah,_
Feel light and my face became soft and super glowing,_
"cantik berbaloi,harga pon berpatutan",_
Ramai sangat yang tanya kan bila plain nak keluar,_
blh buat ketuk kpla org gitu,_
Promo juga setengah ga jelas,_
Tong Yam Wan🤨,_
Utk 5month ke ats ok,_
and sorry for the video/pics,_
Org cakap sesuai untuk kawad atau sport,_
Labuh Smpai bawah punggung,_
muat muat dengan bantai saya,_
n better galas pakai tali biasa sbb yg sling boleh mnybbkn jatuh n rosak awak punya laptop,_
Lembut jee and bau dia sedappp,_
50 sen 2GB untuk dua hari,_
warna yg di hantar sama dgn order yg Di minta,_
"tested one night and happy with the purchase, it's a worthy buy",_
My tablet bag is safely arrived 🥳,_
Tp review mask mmg okay,_
DTV+ booster=x jumpa siaran jugak,_
memanglah boleh dipakai -_-,_
"9th just make order, 10th received!",_
Gd value for money n received in gd condition,_
Awesome real picture,_
"The People's Court of Haidian District in Beijing ruled that Zhang Chaojie, whose company operated apps that faked location, WiFi and photo data, was convicted of sabotaging computer systems",_
"Taste:rasa sambal hitam dia boleh la , tp kalau pedas tu mmg pedas la, sedap mkn dgn nasi putih panas2",_
"Cantik sangat casing ni, tunang saya pun suka",_
so far so good cuma kecik sikit la saiz 2xl dia hm,_
murahh n berbaloii tq sellerrrr,_
Everything satisfied by to this seller,_
packing dibalut dgn kemas,_
Even its from hong kong the delivery is good and the packaging wraped safely,_
I can't place any order,_
Ambik masa sebulan,_
Nak cepat dapat order seller ni,_
ly/3DpARWO & enjoy 8x points with any purchase!,_
"Secured and a variety of products at shopee supermarket, worth the deals esp on 10",_
But this boots is standered size ya,_
A first hearing in the court case will take place on Feb,_
"Harmful app or root detect, my phone not rooted, and dont know what my app that harmful is, so its a waste",_
cheap and easy to install,_
"Suka sangat2 dengan case airpod ni sangat2 cantik nanti nak repeat yang lain pulak la, thankyouuu seller, penghantaran pun cepat even dari china tapi yang penting lawa sangat2",_
seemua color da ade,_
pls la bgkus elok2,_
This is such a weird app,_
bukan jam apple tp muat,_
For sure not the second time,_
Doa Rasulullah Saw ketika menunaikan qiamulail,_
Beli masa 9/9 hari tu murah sangat beli 10 biji tudung pin ni kurang dari rm 1 🥰 berbaloi & quality pun semua takda masalah,_
No picture or video to show,_
cuma packging kurang memuaskan,_
Barang boleh digunakan xda kerosakan,_
overall ok jer utk basahan,_
lubang hub cun cun,_
"but overall, its cute and nice!",_
The delivery was pretty fast too,_
"If nak baggy, one size up",_
Im 52kg 156cm,_
"Seller pos out dengan cpat dan penghantaran pm laju,barut baby jnis cotton dan besar,design pm cantik2 tak sabar nak tnggu baby keluar",_
The one for adult and height is only limited to the chest,_
Waterproof:I do not think it is water proof,_
Aplikasi belanja online yg paling tidak recommend,_
One of the oats is the one mentioned above,_
"tak tengok lagi, jauh",_
W : 70,_
Mintak kaler hitamm,_
penghantaran pon ok lah,_
Ambk m,_
"Good product quality, good value for money, no need to go buy at jakel anymore",_
musti nuntuk kemana,_
Tapiii okkk laaaaa diaaaa jawabbbb msjjjjj,_
kain nipis but for kids just ok,_
"OVERPROMISES As recently as 2019, Tesla's Musk had promised a million robotaxis next year for sure, but self-driving cars that can navigate safely anywhere are still a long way off",_
"Open, where she double faulted twice while serving at 4-5 in the last set of her semi-final against Leylah Fernandez",_
and will auto log out after several hours (need to reinsert the id and password),_
Please recommend me to buy here,_
Blh recomand dgn kwn2,_
Item ok and fast delivery thank you,_
also thank you for the little candy gift,_
Beli dekat si dia and dia sukaaaa gilaaa 🥰🥰🥰 siap bgi paper bag apa semua mcm ori thnkyou so much bleh repeat lgi nampaknyaaaaaa arh love terokks,_
"First try, hope it tastes good",_
"When people are telling you that it is not right to use, just hear them out",_
"Kualiti kain memuaskan,",_
Good value for money with bundle packed,_
Cancelled order 23/2 cause seller did not ship out on time,_
Good to taste and fast delivery,_
Cute je rupa nya,_
Hehe kartun tu mcm hagemaru,_
Alhamdulillah brg sampai tak smpi 2 hari,_
but will learn them sooner or later,_
Tapi tu la bila dy start mngelupas penat skit la asyik nak kena buang n sapu lantai,_
tulisan besar sangat mudah dibaca,_
tq seller dh repeat kali kedua,_
Towel sangat bagus menyerap air,_
good items n excellent service,_
"Cenggini dah byk kali repeat & as usual la applecrumby is the best thank you so much ,",_
"Mudah di bawa kemana2 , cantik sejuk mata memandang",_
Takde langsung kerosakan pada sambal ni,_
Do the iPhone 13 mini because everyone will do first the iPhone 13 Review,_
"Penghantaran pantas,maaf video tiada kena mngena dgn produk,produk bagus",_
"Baru sempat cuba, so far okay",_
something is wrong in the Map,_
"Recived today,",_
"Good product , easy to use , value price",_
🤦🤦🤦 Xpala blh bg anak pakai,_
Tapi ok laaaa thanks seller,_
Asam laksa ni macam pengubat kerinduan nak makan laksa penang yang mak buat,_
Memang terbaik semalam order,_
Tp agk ketat kt dada,_
"Pen blh guna dengan baik n berkualiti, n semuanya okkkk",_
I love the ballerina doll and the blonde with the plaits they look adorable,_
(Reuters) - Rory McIlroy and Patrick Cantlay were tied for the lead at one-under par after the second round of the BMW Championship on Friday as the Olympia Fields Country Club continued to torment the world's best golfers,_
Receive Parcel,_
Murah pun murah seller pun baik cepat je respon chat delivery laju seller pos hari yg sama order,_
Pigmentation:pekat gilaaaa,_
The tech bays and private suites are powered by Foresight Sports' GC Hawk launch monitors,_
puas hati everytime purchase from this seller,_
Bukan kedekut ye adik kakok,_
kain jenis tak susah nak iron,_
This is my 2nd time purchasing the taste of this coffee is really good,_
video clear berbaloi baloi,_
Not sure the teat is original or not,_
Now to test the product,_
Ok brg dah sampai dlm keadaan baik,_
"Tq seller,semua ok",_
Boleh ganti yg baru ke,_
Price consider ok,_
"BENDA JALAN DEKAT SAJA NAK PERGI 6KM KENA BAYAR RM30++++ FUVK USELESS GRAB ,",_
Ini adalah pembelian saya yang ke 5,_
this book is for you!,_
kain sedap je pakai,_
"Fast delivery, Received in good product,Good value for money, i use 1st then i come back to review",_
baju cantik cuma yg warna putih agak nipis,_
"Paul Francis Chong, 37, who is an operations director at global integrated facilities management company Sodexo, is among those in Singapore who are feeling the impact of work-from-home arrangements",_
turn off you air conditioner vents please!,_
Hanya mengunakan bawang dan cili sahaja,_
penghantaran kira okey la,_
Berat yakmat,_
Hebatttt boleh lah murah jeeee hahahahahha,_
Kualiti yang bagusss dan cantikk,_
"Good service , nice packaging n good quality dash cam",_
Beliau berkata demikian ketika menggulung perbahasan Rang Undang-Undang Perbekalan 2022 peringkat dasar di Dewan Rakyat hari ini,_
"good product,my child enjoy it",_
cuma warna khaki panjang sedikit dibhagian belakang,_
Penghantaran yg pantas!,_
Dah siap basuh n iron,_
"Though very big, but come very small only",_
Kain cantik cantik semua,_
Shipping dari malaysia,_
"Thankss seller , ingatkan besar sikit tapi okayla ni hehe",_
paling murah n quality ok cuma kecik sikit,_
Kaler pink cantikkk,_
macam biasa kena potong labuh baju,_
"Thank you seller Barang dah sampai kat rumah tudung sarung cotton 3 warna, cepat juga delivery Worth it for Money",_
Sedap la jugaa not bad,_
nnti insha allah akan rpeat lgi,_
"Gelap kan, ha cmtulah saya tanpa kamu, gelu siak, ejheiekeheiekbwu eieowbge",_
Id say it was worth it!,_
"Ni dah tk thu berapa kali repeat dh dgn seller ni,kain selesa sngt and awning mudah bentuk!‍‍",_
The look of the umbrella is good but the action of the open and close feel very rough,_
Can you please put the amount of the ingredients in the description?,_
Quality:terbaik cepat gile,_
re idiots,_
Agak kecewa tapi takpelah saya bole dapat rasa flavour yg lain2,_
Not just the quality is superb but the quality is *chef's kiss,_
"In the first quarter, Micron reported sales of $7",_
": SHOPEE: TO CREATE YOUR ACCOUNT, use OTP code Valid for 15 mins",_
"dataRm15,",_
Following diligent research we've integrated a combination of the most commonly used and desirable ef,_
t jin cute?,_
8451 ~~~~~,_
"Yayyyy, barang dah sampai",_
"Material:kain best dah, tapi ingat kan beli ni, dapat sebijik cam dalam gambar, jenuh cari kekabu nak sumbat",_
but its a free gift,_
Slightly damage on the drawer,_
"Effectiveness:on black hair, turns it copper red than light brown",_
P/s : tali kasut asal wrna putih,_
tapi nak buat mcm mana saiz ni yg ada,_
"Awal bulan ini, pelbagai poster yang memaparkan imej burka ditampal di kafe dan kedai di Kabul yang mengarahkan supaya wanita Afghanistan menutup badan",_
"gambar dan video tiada kaitan,",_
"LONDON (Reuters) - Lewis Hamilton could stretch his record tally of race wins to 120 after becoming the first Formula One driver to reach a century, the sport's managing director Ross Brawn said on Monday",_
Sangat berfungsi bg wanita sperti sy yg Bf utk anak sy,_
Jam dah sampai Tq seller,_
🧡 terima kasih seller 🤩🤩🤩🤩🤩🤩🤩🤩🤩🤩🤩🤩🤩🤩🤩🤩🤩🤩🤩🤩🤩🤩🤩🤩🤩 terbaikkkkkkk 🥰🥰🥰🥰🥰🥰🥰🥰🥰🥰🥰🥰🥰🥰🥰🥰🥰🥰🥰🥰🥰🥰🥰🥰🥰🥰🥰,_
Really loves shopping at jashion store,_
Minta dgn seller utk tukar size S sbb kaki anak kecik baik seller melayan,_
Packaging kena,_
"Sementara itu, Pengerusi Pameran Jabatan Perdana Menteri (Tugas-Tugas Menteri), Mohd Ikhmal Abu Bakar, berkata melalui program ini, Jabatan Perkhidmatan Awam (JPA) menawarkan perkhidmatan memperbaharui kad pesara yang hanya boleh siap dalam tempoh lima minit",_
semoga kita jua selamat sampai ke syurga Firdaus ameen,_
Definitely will purchase the others soon!,_
Third time puchased with this seller,_
com/results?search_query= 23packagingadalahsahabat>$HASHTAG$ karena ga berani banting packaging soalnya mahal <a href=$URL$,_
penhantaran pun Cpt,_
Bridget Gynna Jenny Lestiani bh jomm,_
HAHHAHAHAHHAHAHAHAHHA,_
tq seller dapat free 1,_
Yeayyy my parcel dh smpai dengan selamat cepat dan laju jerr penghantaran brg pon cantek dan harga berpatutan tq seller selamat hari raya maap zahir batin,_
"Cantik, pakai tu terus auto cun, tak tau lah karat ke dak, hopefully tahan laa",_
So let's bake!,_
"Thank you seller for fast shipping, all worked well so far , thanks again",_
I'm 155 and 53 for refer,_
Kat luar negara xkan jumpa servis mcm ni,_
Thankyou brg dah sampai,_
Received the package in the good condition sewing machine works well and very convenient,_
bungkusan pon elok jea,_
"The IPO comes as global battery-powered electric vehicle (EV) sales, estimated at 2",_
"sori bos,gmbr xde kene mengena",_
boleh buat hadiah utk bby newborn,_
Brg slmt sampai tiada kerosakn memng puasa hati trima kasih shopee,_
worth value buying trusted seller tq free giftsfast shippingreccomendd,_
good product quality good value for money excellent service by seller fast shipping and delivery thank you so much seller and shopee express rider happy shopping from your shop will buy again later thank you,_
t buy pc unless you don&$HASHTAG$,_
Functionality:Just ok kena dengan price,_
the colour and quality is good but for the khaki colour is a bit small,_
"kualiti ok,wrna pn cntik sma mcm dlm gmbr",_
Saya bi,_
cover ade pecah sikit,_
Quality is according to the price,_
Very fast reply and good product,_
Semua barang order dapat,_
ape pn parcel dlm keadaan baik,_
"Sya coba dlu ye,klu ok sya bgi 5 yq",_
sbb ada Banyak pilihan,_
anyone who willing to buy my brother?,_
Berbaloiii sgtttt,_
harini dah sampai guna j&t,_
Received in good order & working well,_
great transport app,_
"Of course, although tattoos are permanent, this is only to a certain extent",_
Received in good condition recommended,_
Coverage:full coverage!,_
recomended lahhh,_
"Mum said very small, L size still small leh hmmmmmmmmmm",_
Sukaaaaa🤲🤗🤩🥰🤩,_
TAEHYUNG apir hahaha,_
Kualiti barang kurang memuaskan,_
x rasa bersalah mkn sbb low calorie,_
Sume lawa,_
Mantap dah repair line,_
"correct amount thanks for the free gift nice packaging, bubble wrapped yeah",_
FOUR out of six business premises in Penang have reopened their doors to the public after being slapped with temporary closure orders for not complying with the Covid-19 standard operating procedure (SOP),_
"May pa-50 off pa kayong nalalaman ,hindi naman maka order sa inyo",_
material mcm jersi,_
Kerusi cantik !,_
But I'm 11!,_
Seller shipping and the courier delivery service was also superfast,_
the material is pvc and somehow it will faded by hook or by crook,_
Will continue to buy online,_
Not so strechy but strechy sikit lah,_
Progress has been made on investigations towards launching a World Trade Organization (WTO) case against China over its alleged coercion of Lithuania,_
thank you seller <333 barang sampai lajuuu,_
This OnePlus Nord 2 is mine Never Settle 1+ $MENTION$,_
Fast delivery and cheaper price compare with other shop,_
dah sampai seronok sgt,_
ank suka duk dlm tu smpai tak trun haha,_
BARANG SAMPAI DENGAN BUNGKUSAN BAIK,_
"kasut okay,cntik",_
", sampai 15/5, melampau dhl Punya lama shipping , beli barang mahal seminggu xbergerak langsung, risau kita",_
Ini kalilah champion,_
laju lah kali ini,_
Hopefully dia suka and ok,_
Soft to feet,_
Tapi intim tak sama mcm yang di order,_
tudung dgn baju,_
Thanks dah sampai ke rumah beli lebih untuk anak2 guna ke sekolah senang dan mudah bila stok banyak x perlu,_
kepala hotak kau,_
96 to 1,_
This problem persists inspite of updating the app,_
The delivery was quite delay but still not so late,_
Nurul Afifah,_
"Thank you seller, actually seluar ni ketat sikit sbb before ni beli kat seller yang sama warna hitam dengan size yg sama okay je",_
awal 5 hari dari tarikh yg sepatutnya,_
"Packaging terbaikk, bubble wrap tebaiii, siap dlm kotak pun bertkotak2 tebal, beli satu botoll jaaa",_
Buku bagus utk anak buat latihan di rumah,_
Ovarall belt so nice,_
Dh 2 kali repet kt kedai ni,_
mmg murah beli kat sini,_
Kualiti bersesuaian harga,_
terima kasih abang JnT,_
The cloth is very thin and airy,_
Mula² ambil XL,_
they send only 1 to me,_
dah masuk mesin basuh daa,_
"untuk yg bersalin bau dia tak kuat sgt,",_
I want rtd,_
Berkali repeat dah ni,_
s it i am getting one,_
chaan teng dishes,_
Tapi takpalah sebab saya tak guna sangat hd mirror tu,_
Recieved with safety so far ok,_
"Penghantaran laju, bungkusan sgt kemas",_
tiber bagi pikachu,_
"50, overall is great!",_
if anybody want to trade it w jaehyun can hmu at carousell $MENTION$/tyongcult,_
Cxf Su Zhe,_
With a net price of $19,_
cepat fasterrrrrrr deliveryy6yyy,_
Nti2 nak repeat lgii,_
senang nak bukak nak pasang,_
Mmg best sedutan kuat,_
Beli utk cek saiz,_
pembungkusan yang kemas dengan buble wrap,_
Mmg Recommended,_
Pigmentation:VERY GOOD,_
"Penghantaran yang sangat pantas, baju yang cantik,",_
Repeat2 xcari dkt lain dh berbaloi,_
"Kalau dahulu, latihan mengambil masa sehingga dua hari",_
Cantik sangat quality elok kain dia pun bagus,_
energy ice mcm ubat batuk sikit,_
com/results?search_query= 23soldyoutuber>$HASHTAG$,_
tq seller n akan repeat order soon,_
pahtu ko tgok ler tu,_
Beli dah kali ke berapa tah kat sini,_
Harap semua sesuai dan saiz yang betul,_
Ia membimbangkan walaupun ada menganjurkan masalah ini boleh diatasi jika tahap produktiviti dipertingkatkan dan usia bersara dinaikkan kepada 65 tahun,_
The delivery was quick and the quality is good,_
sedap ii bergitu di makan,_
Seminggu saja dah sampai,_
Hrp seller pastikn lain kali brg yg dihantar brtepatan apa yg diorder & diiklankn,_
"Through dance, music, and video images,xplores the continuing impact of development, construction, pollution, diversion and canalisation on the natural state and flow of the Sungei Pinang that has resulted in perennial flash floods",_
"Meskipun mengakui tertarik dengan lagu ciptaan Omar K, Firdaus Rahmat, Iqie Hugh itu, namun, Anuar menafikan, dia bakal menggantikan tempat Ernie",_
"Btw , saya regular customer dah nak masuk 2 tahun",_
Some of the mask are thin and the color are quite different from the picture stated,_
"Support slow fashion, go thrifty!",_
Luar Malaysia,_
"KUCHING: AirAsia Bhd will increase its Kuching-Sibu flight frequency to three times daily from next month, says Sarawak Transport Minister Datuk Lee Kim Shin",_
Goooooooood pantassssssss Goooooooood pantassssssss mmmm,_
Murah sangat gila murah and sgt lah cot tu suka beli tu masehh,_
"Saya tak sempat snap, terus basuh",_
m so satisfied with it,_
mcm mana nak buat?,_
"Kain cantik, mcm biasa baju putih tak berapa jarang tapi lebih selesa untuk memakai tindanan",_
received product in good condition thankyou so much,_
Seller ship out cepat betul,_
He has faced a barrage of criticism since a video emerged showing his staff laughing and joking about a Downing Street party during a 2020 Christmas lockdown when such festivities were banned,_
kmera ok terang hrga pom murah mmg puah terbaik,_
Kualiti setimpal harga,_
Like to eat this Coco crunch,_
shoppe axpres lembab,_
"thanks seller, bole repeat lgi lepasnii🥰",_
"But, best sangat bau die",_
Vlive&quot,_
Dh terima bju tido Elmo,_
Anyways produk tak mengecewakan,_
Pengepit kuku dh sampai,_
Taste very good and excellent packaging from the seller,_
"Just the delivery man sent my parcel to other houses, luckily it's was my neighbor and she returned to me",_
Bought ont 10,_
Tq so much tq ye atas penjualan ini semoga pembelian ni adalah belian yg tiada pembaziran,_
Quality:baikla,_
** Tambahan daripada 151 keping ke ats akan,_
">Ini adalah di antara usaha MOSTI dalam menginsankan STI kepada Keluarga Malaysia dan akan memberi manfaat secara langsung kepada rakyat dalam memacu sosioekonomi negara ke arah kualiti hidup lebih cemerlang menggunakan kepakaran dan inovasi tempatan, katanya",_
Saya order 16/1,_
"Screen lari, belakang pecah",_
tpi pembungkusan kene buat lebih baik ye,_
5 million vehicles on Deepavali eve,_
Their intention was to keep him engaged in some form of educational activity,_
Can't remember how many times I've purchased storage bags from this seller,_
Rsanye kalau x pantang pun bole buat pkai jenjalan,_
"Sy berat 82 tinggi 161, preggy 4 bulan",_
- x³+2x²+5/4x + ¼,_
My 2nd bought from this Seller,_
walaupon covid X banyak,_
"suka 🥰 senang bawa travel, takyah susah2 nak pakai kasut lagi hehe size accurate untuk kaki saya yang guna size 36 ni",_
Saya nak return/refund ubat nyamuk ni tp saya takde masa utk poskan balik,_
Already use this items,_
But im a little bit disappointed when i cant used the rebate weekly voucher,_
Texture:soft & delicious,_
"The Deputy Chief Minister said the Bah Arnab cluster in Kuching was detected after 16 close contacts of the index case, who was reported to be positive on Oct 6, were screened",_
tq terbaik penghantaran CPT,_
Very cheap and free shipping also,_
0 points,_
Seller terbaik tapi courier airmataaaaaaaa,_
AAAAA finally dah sampai dah sunscreen paling best <3,_
ll give a person to them,_
20 skrg lg murah hehe tq seller 🤍,_
Detox bagus saya minum 8hari turun 2kg,_
Washing machine still washing clothes,_
Seller ckp ada tp dpt tak sama mcm dlm gambar,_
"JOHOR BARU: The status of former Johor mentri besar Datuk Osman Sapian does not change the present Perikatan Nasional state government as it still commands the majority of 29 seats in the state assembly, says Mentri Besar Datuk Hasni Mohammad",_
Design:Comel sangat kecik je,_
