Sentence,Tagged_Sentence
Tp mcm kecik sikit kalau nk bedung baby bsr,_
Thank you for this good services,_
My nieces are very happy,_
Ntah yang berapa kali dah repeat order dengan seller nie,_
kain cotton lembut dan sejuk,_
Harga sangat beroatutan berbnding beli dekat Kedai,_
"cantikkk warna pink and khaki i dah pernah beli, cantik betul mantapp cuma i salah beli size so pls pick one size bigger, ok!",_
Apakah digrab diwajibkan uang tunggu waktu kita pesan makanan,_
Suka betol,_
"Nice packaging with box, definitely worth for value, thanks",_
"All the assets have been cleanly cut off from me, as if you're so deeply afraid that I might 'take advantage' of you",_
Beli sbb ingatkan water inlet valve yg rosak,_
Dah sampai alhamdulillah thankyou seller semoga dimurahkan rezeki,_
"really like it and worth the money , thankyou so much will repeat again soon 🤗",_
First time nk bt makanan anak,_
I have received my bag condition tiptop no defect tkdak yg terkoyakka apaka semua perfect tpi dia mediumjalah xdaklah besaq beg balik kmpung yg biasa tue 🥰 berbaloi dgn harga nampak mahal lgi ada beg shipping tk sampai seminggupown terima kasih,_
Coin cashback pun banyak,_
"Fast delivery, murah dan terbaik",_
Much cheaper than store,_
its fit with my vac card thankss,_
I ordered 200pcs but I only get 197pcs,_
Harap dan doakan susu melimpah ruah utk bayi tercinta,_
"Dah la bole compass lagi , bole tasbih lagi siap ada LED 🥰 TERBAIK ,",_
The product so far ok,_
"Cantikk, pakai pun okey jeee",_
rasa mcm ringan sikit la,_
Bahagian bercantum dah pecah (besar) di beberapa tempat,_
"received in good condition, good product quality, value for money and TQ for fast delivery",_
Fast delivery by J&T courier service and also the items received in good condition,_
nanti boleh grab warna lain pulak,_
"okay overall semua okayy , the material is not that bad okay la dengan harga 🤩 lepastu yang putih tu dia macam pendek sikit daripada yang nude tu tapi dia still labuh tutup buku lali kay !",_
Betul betul buruk Internet,_
"l miss you guys, good job nice",_
boley repeat lagi kat kedai ni,_
Thank you barang dh sampai semua ok saya suka,_
Baju cantik overall,_
Bau mcm sirih,_
Tahniah untuk Kelabu 2,_
Yang suka style baggy ambil XL,_
terbaik terbaik terbaik terbaik terbaik terbaik terbaik terbaik terbaik terbaik terbaik terbaik terbaik terbaik terbaik terbaik terbaik terbaik terbaik terbaik terbaik terbaik terbaik terbaik terbaik terbaik terbaik terbaik terbaik terbaik terbaik terbaik ter,_
kat awning pun kedut sikit,_
tqtqtqtqtqttqtqtqtqtqtqt i love it so muchhhhh,_
puas ati dgn ni,_
Makin lama kok aplikasi ini ribet terutama utk promo grabfood knpa harus minimal harga diatas 50rb utk grabwae,_
TAKE NOTES : pls choose 1 size bigger than your actual size!,_
Material:Good3,_
Sorry gamba x berkenaan,_
Comfortability:barang ok cantik,_
fast delivery n comfortable,_
The price cheap also fast shipping,_
Boleh letak kasut spare,_
Texture:cantik cuma warna macam pen marker mudah tanggal tpi berbaloi lah dngn harga yng murah,_
"great value, fast delivery",_
Warna hitam nampak style gila !,_
Barang sampai dlm keadaan baik dan sangat cantik! penghantaran juga pantas!,_
Good dash cam,_
7 peratus jawatan dalam lembaga pengarah dalam semua syarikat tersenarai (17,_
barang sy order sini suruh pomen pasang,_
ukuran dia tepat,_
Design kemas dan menarik,_
Tq brg free,_
Harga murah lagi2 masa sale,_
tqq cantik sgt🤍🤍,_
Kasut ok size pon ok cuma sedih skit la ada kotor dan mcm kopak ke ape ek hm huhu,_
Baranggg dahhh sampaiii dahh,_
ALBUM IN A GOOD CONDITION Suho so handsome,_
Apps pun Lifetime memang No Monthly Fees,_
Its take a long time to arrived at my place,_
Functionality:boleh untuk gantung seluar jeans / baju yang berat,_
"Tunggu 4 hari jerr Kain best semua okay takde rosak jahitan pun kemas , Baju ngam ngam",_
muat 2xl,_
Kena amik size yg lebih besar dr biasa kita pakai,_
idk abt others maybe bc my skin type but I love the scent!,_
Dah banyak kali beli jaw white tu mmg ok sgt mjd,_
kualiti tali berbaloi dengan harga,_
idk how seller buat kerja tapi nasib boleh order lagi lepasni harap jangan cuai dhla,_
kain mmg agak keras sikit tp xpe asalkan terletak elok kat badan,_
Kain lembut sangat berbaloi dengan harga,_
Size pon ok cun,_
The proposition would have required the city of Austin to hire hundreds more police officers,_
"Hvnt try those flower tea, will gv further review in future",_
Udah diperbarui tapi titik lokasi rumah masih belom bener alhamdulillah dapet driver yang pengertian,_
Bekas sedang molek utk letak minyak,_
"Ketua Polis Daerah Kota Kinabalu, Asisten Komisioner Mohd Zaidi Abdullah, berkata pemandu kereta berkenaan ditahan oleh unit kereta peronda MPV di Tanjung Aru, di sini, selepas menerima maklumat sepasang suami isteri bergaduh dalam kenderaan terbabit",_
"Penghantaran laju , gambar takdak kena mengena mahupun",_
Mask ok jee,_
"I'm uk 8, taking 39 , a bit tight",_
kejap dah smpai,_
"nasib beli banyak 21 pack berbaloi la juga menunggu lama, kita faham preorder tapi takkan la lama sangat kan",_
Cari Keropok Keping Ori Terengganu,_
Dah samp berfungsi dgn baik,_
"Tq bos,brg dah sampai",_
"While many of us found comfort in communicating and transacting online during the pandemic, Alia Affendy had to deactivate all her online profiles because she was bullied and harassed online to the point that she felt attacked and physically unsafe",_
Kasut agak kotor sebab takde kotak tapi nak expect apa en haaa takpelaa okay je thank youuu,_
"Fast delivery, product quality ok",_
in shaaa Allah lain kali nk beli lagi,_
tqpi kalau gitu2 jek,_
ช่วงนี้กดใช้คูปองที่ซื้อไว้แล้วเด้งออกตลอดเลยนะคะ รียแก้ไขหน่อยค่ะ เสียเวลามาก ต่อโปรฯ ครั้งหน้าคงต้องคิดใหม่,_
Comel jeee parcel air ni pun sedap pastu dapat free gift gula² ni srs favv seller pun baikk also fast delivery thank youuuu saya beli yaa,_
"Keeps logging out, this is nonsense,",_
Barang dibungkus elok bersama bubble warp,_
Sockngan telah diterima dengan selamat,_
Order received in good condition cantik sangatttttt,_
harapnya boleh guna la,_
"Laju btl penghantaran, j&t pn mantapp la",_
"Seller yg terbaik puas hati recnded seller, fast dlvry puas hati harge murah Dr kdi lain maaf gmbr dan vdeo tiade brkitn",_
"Well packed, price cheaper with coins cashback",_
Hopefully effective as reviewed,_
Given that Allianz's market share for the general business stood at around 13,_
Personal income in Minnesota went from lagging Midwestern neighbours like Wisconsin in the 1940s to pushing past them by the 1960s,_
Barang semua diterima cukup dan dlm keadaan yg baik tq tq tq,_
Aaaa brang x de kt sni tpi srs puas hati,_
Thanks seller and shopee express,_
"penghantaran cepat, bungkusan kemas, berfungsi dgn baik",_
Seller respond cepat dan pantas,_
Quality:cntik,_
"s a waifu figure, Lol, I&$HASHTAG$",_
order 10,_
tak kecewa puas hati,_
"TEGUCIGALPA (Reuters) -Leftist opposition candidate Xiomara Castro raced to an early lead in the Honduran presidential election on Sunday, partial election results showed, putting her in pole position to become the first female leader $URL$",_
Xtry lagi tapi cantik betul la hehe,_
Kain rasa lembut senang bentuk,_
"Omicron was classified the fifth VOC, the fastest any emerging variant has shot to the top of the table",_
"Just nice, boleh la angin dia tu sejuk2 sikit je",_
time nk byar dh naik harga sikit,_
"14 inch tiada protector, 12 inch ada protector",_
I consider it as fast delivery to Sarawak,_
"Fast delivery really gladly, and the seller was really kindness",_
Functionality:produk terbaik penghantaran terbaik layanan penjual pun terbaik,_
The service is amazing!,_
Kain molek sedap dooh pakai kain sejuk gambar bju xdok sbb basuh dh,_
Penghantaran cepat kain selesa sesuai dengan harga warna mask ni cantik sangat,_
Saya beli barang berkenaan,_
Good value of money as usual with Decathlon,_
Cpt hntr,_
"Good item, fast delivery, good services by supplier",_
Cleaning Effect:rasanya ramai dah tahu,_
Relatively slow delivery compared to other purchases,_
t hear it) Remember the first Switch&$HASHTAG$,_
Rino loves attention and will try different tactics to get it,_
"Skirt cepat sampai, harga berbaloi sangat berbanding dengan kedai kat luar,",_
"GAMBAR & VIDEO TIADA KENA MENGENA,HARAP MAKLOM,",_
"Dalam pada itu, Aminuddin turut menzahirkan penghargaan kepada Kerajaan Persekutuan yang menyediakan peruntukan RM7",_
Good chat respon,_
"Tp utk hitam,kelabu & biru gelap agak nipis",_
Cntik cute sgt hair pin ni,_
servies mmg puah hati,_
Effectiveness:Barang sampai dengan selamat mantap terbaik puas hati kualiti,_
semua yang dipesan dapat,_
"(pink ) user manual ada d dlm, rajin2 baca however haven't tried it yet",_
Ank buah happy,_
easy to contact with,_
Sangat membantu sih cuma sering pembaruan trus setiap buka aplikasi Setiap grabfood juga sekarang ada biaya pemesanannya,_
Kami terpaksa berulang-alik sebanyak tiga kali untuk memindahkan semua lembu kerana lori hanya bermuatan tiga tan sahaja,_
"Have yet to try it, hopefully it will function as great as it looks!",_
6d958d8d858ss8t8t88ttxx8ixxtiostiydufudydydfuudydududduudufuf,_
"mesin sangat ok, kecik comel saya suka",_
Product ordered on 13/6/22 and received in good condition on 18/6 from WM to Sabah,_
ဝန်ထမ်းများအပေါ် လူအခွင့်အရေး ချိုးဖောက်မှုအတွက် မသုံးချင်တော့ပါ။,_
Quality is so so but good value for money,_
Takut rosak bila jatuh,_
Nk guna untuk meja register,_
"Katanya, kesemua kapal berkenaan sepatutnya dibina serentak dengan kapal pertama dijadualkan diserahkan kepada Kementerian Pertahanan pada April 2019",_
Love all the 20-30 coupons!,_
kena banyak sikit baru xnampak parut,_
murahhh glerrr!,_
Teh dh smpaj,_
"All can use, the device also ok, just the free watch cannot use",_
Mnta maaf la gmbar xda mngena tpi trbaik laaa,_
Perfect for x70 for size xxl,_
Hamdok said he agreed to the deal to prevent more casualties,_
memg sentiasa repeat order bila habis,_
"This album looks so beautiful and I love it so much,",_
kali ni besar pulak,_
"In the first set I had so many breakpoints, I felt like I missed my chances because she broke me on her first breakpoint, Swiatek said on court",_
main lembut,_
Material:Soft and machine washable,_
I have been ordering clothes online for years,_
"Not just about winning this series, you're playing for something bigger than that as well",_
smua cantik coraknya,_
"Mercedes F1 and Red Bull today reached an agreement regarding the appointment of Ben Hodgkinson, Mercedes said in a statement",_
ruang pun ble tahan besar,_
Selimut tak nipis sangat tak tebal sangat,_
Last2 fuh sekali tampal je lekat terus!,_
"jd mcm cacat, nk refund pun mcm byk kerja pulak",_
Order date: 17/7/2022,_
bag xbesar sangat xkecik sangat bag,_
The packanging was so good so secure,_
tp x buka lagi,_
Terbaik penghantaran cepat barang sampai Degan keadaan baik 🤩🤩🤩🤩🤩🤩🤩🤩🤩🤩🤩🤩🤩🤩🤩🤩🤩🤩🤩🤩🤩🤩🤩🤩🤩🤩🤩🤩🤩🤩,_
Arrival fast,_
Beli sebab nak hadiah kat mak,_
beautiful but I think it's more beautiful if it's bigger than this one To put money and small items only okayla,_
oneplus has literally killed the competition from 24k-30k pricing,_
so cantikkkberbaloi beli and cepat gilaaa sampai,_
"Dah dua hari pakai ok, putih sikit, tapi tak sesuai untuk gusi sensitif, sebab gusi saya bengkak sikit",_
V slow in shipment arrangements n the quality so so,_
Wasting my time,_
c pnasa,_
"The rider took my order, I already paid for it",_
"Nak tebal pergi beli stoking rm6 tu,",_
We will suggest to the deputy public prosecutor for them to be charged soon,_
"11, sampai Sabah 25",_
korang nak coway 01126115824 ok,_
baju dah selamat smpi dan dlm keadaan baik,_
GoodMarketing,_
tapi x nampk murah ye,_
YOU DEFINITELY DESERVE MORE THAN 5 STAR !,_
"order 25hb,27 received",_
Lain Kali bole repeat,_
Received faster than the estimated delivery time,_
ny seller kne bgthu la kalau abis kan,_
Material kain pun okay sejuk,_
big offer on time only RM102 to me,_
"seller ni post lambat, a week after baru post tu pun lepas i chat 2 kali",_
"Hobi: Jiminssi Kookie: ese compa ya esta muerto, no más no le han avisado",_
Finishing dia ada yg kemas and ada yg okay,_
"Niat mula nak hadiahkan ke mak dan adik beradik perempuan dan keluarga isteri, tapi bila tengok design dia lawa lawa saja belikan untuk diri sendiri satu",_
panjang dah okay,_
Plugging in the socket was not easy though- the socket is very tight,_
abg pos baik,_
Sesuai pakai time pregnant sbb flat dan tak licin,_
Can used longlasting,_
terbaikkkk saya suka saya suka,_
"Kain memeri, jadi masih boleh pakai",_
Its okay lahh,_
"On the index board, the FBM Emas Index surged 313",_
"Tanam stiker for better results, make sure yg decal ni takde reaction kalau kene clear sbb ade yg decal bila kene clear dia berkedut",_
sampai betul amount nya 10,_
Baggu style,_
Rasa macam L pulak,_
Untuk tinggi 167cm singkat sikit,_
Overall terbaikkkk,_
Lambat sikit dapat tapi ok je,_
"Very good seller, recommeded seller, best for buy,will buy it again",_
Corak yg nak habis seller contact bgtau dan blh tukar corak,_
They make u have wild goose chase,_
Received 9/10,_
ÇOK TATLISINIZ SİZİ ÇOK SEVİYORUZ TURKEY ARMY,_
Product received in good condition and well packed with great discount and fast delivery Excellent service by seller 🤗🥰🥰🥰 TQ,_
"Berminggu2 Tunggu JNT Hantar, Last2 Shopee cancel, Katanya LOST IN TRANSIT",_
Check2 dia ubah dah description pre order,_
Ada reset dan mode buttons,_
maaf gbr x berkaitan,_
",ank suka",_
Puas hati sangat dengan barang ni,_
Sangat-sangatlah terbaikkk!,_
kalo dpt cotton sy bg 5 malangnya bukan hehe,_
semua ok semua ok semua ok semua ok semua ok semua ok semua ok,_
"This is because aerosols remain suspended in the air or travel farther than one metre (long range), it said",_
"Item arrived safely, but 15 inch its too big for me",_
Seems like a quality built,_
"Kalau pakai kasut tutup ok, klu pakai open sandal, ken re consider",_
"The 3rd photo is from 70mai A500S,very satisfied,",_
Jasmine Siew,_
Safety:memang safety tapi kalau kuat lagi kaki besi kena ikat skru kt katil baru ok,_
"Pi website yoodo an, pastu claim free sim, dan masukkan refferal code tu, dpt la data 7gb, klu xmasukkan refferal code tu, dpt 5gb ja, tq, bole gak menyumbang kt aku rm20 hahahaha",_
Very nice jam!,_
"laju gila delivery dia,",_
Semua cukup terima kasih seller,_
Berus gigi for braces brand colgate ni mmg selesa pakai,_
Colour boleh tahan cantikkk,_
Cantik sgt amat² puashati dpt zikir,_
Seller pos semalam harini dah sampaii,_
"Yeassssss,",_
"Since the sales launch almost a year ago, it's been virtually impossible to buy the devices and that doesn't look like it's going to change any time soon",_
Not so hot when iron it,_
Semua dah selamat buat bouquet dah,_
"Fast delivery, good product quality , package wrap well",_
"Seller pn peramah, semoga rezeki melimpah ruah",_
Semuanya baik dan kualiti pun bagus,_
tebal & serap air,_
"For other times, there are instant noodles, said Chen, deputy director of the water conservancy project operation division at the Changjiang Water Resources Commission's Flood and Drought Prevention Bureau",_
Hip 92cm,_
Quality socks at low price,_
Taken 4 days to prepare and shipping taken for 2 days,_
Okay bagus cantik gempak berbaloi comel cute suka cinta dia,_
Hwhshshajajajajkakakakakakakakakakakakakakakakakakm,_
sorry xde gambar baju,_
Received the item in good condition fast delivery and pack nicely and thank you seller,_
Thanks you for thank you thank you thank you thank you thank you thank you thank you thank you,_
Gak tau kenapa tiba* mau pakai tiba* akun ditangguhkan,_
And also it have many small blocks left that not use,_
OnePlus is back! $MENTION$,_
Cute colour too,_
Request Seller to sell more color/design straps,_
Order 18/10/2021,_
Terbaik jnt & seller,_
take almost 3 week to received,_
tak ketat sngt and tak longgar sgt,_
amp ni kaji punya kaji kena tambah pasang converter bru dpt suara,_
Ni kali ke2 order dkt sini,_
"Tuala okay, serap air cuma a bit nipis",_
Bukan inch walaupun dia tulis 12 tnda tu utk inch,_
"selalu beli dari kedai ni,terbaik",_
Beautiful 7 chakra,_
Kain dia lembut yg sedap dipakai,_
akan mari beli lagi bila ada offer lagi bagi tau,_
warna dia bold /pekat sy sukaaa,_
comel je kotaknya,_
terbaik penghantaran sangat cepat,_
Packing dlm buble wrap n plastik je,_
I bought 2pcs but I got 1pcs only :(,_
"I'm glad I bought it, it's overall a good buy",_
Seluar ni mcm dah Ade orang pakai,_
Kena guna 5 bateri AA,_
Cantikk sgt warna brown tuu,_
Semunggu baru sampai,_
Beli pun bukan satu dua helai tapi angkut banyak terus,_
"Excellent seller, ship out 23",_
"Ringan, tanpa wayar, boleh cas, vacum dlm gelap pun boleh ada lampu",_
Mesin basuh terima dalam keadaan baik,_
boleh masukkan handphone dalam ni,_
kasut lawa warna pn lawa,_
Cermin comel jer,_
Thank u admin,_
Diterima dgn baik je semua,_
msg byk kali lmbt respond,_
Material:Polistren best quality,_
xlama sngt,_
Lambat bagi review,_
Satiesfied with the quality,_
ADA DUA JENIA TAU !,_
"If possible, diversify your portfolio with debt and equities as it helps to balance out risks and factors in inflation, a report said",_
Kecik jer beg nie rupanya ingatkan besar tapi Xpelah,_
xde kemek bocor selamat sampai,_
"I bought 10 units, they were packed securely in a box, so no damages happened",_
Trying new flavor french roast sb on sale,_
support org pnya bisnes,_
************Okay*********,_
"Manual book given, easy to install",_
"third time buying from same seller, harga okay, service laju",_
rangka gerak kerja bersepadu merentasi pelbagai agensi,_
"Nice flavour and taste, good product quality, good value for money",_
they delivered me rotten,_
Pengesahan itu diumumkan menerusi akaun rasmi Facebook Sri Pahang FC hari ini yang memaklumkan bahawa penyerang berusia 31 tahun itu berpengalaman beraksi di Ligue 1,_
"if the seller say padu, its padu guys",_
"However, there were telltale signs that GPS had won in Mulu as Gerawat was seen together with the rest of the coalition's candidates at Borneo Convention Centre Kuching on Saturday night",_
gmbr dan vdio tak ada kaitan,_
too bad that 70Mai 1s no parking surveillance,_
Most of them are oval or round,_
Tq seller brg da smpai sory lmbt bg review bz ckit,_
Tapi quality bagus ok would repeat,_
"Received all item ,",_
"very appreciate doorstep delivery, even though high floor condominium",_
Parcel agak lambat sikit mungkin sebab kawasan pedalaman but all good,_
dok bajet igtkn muat letak fon dlm tu,_
If you want to buy the phone I think this is the perfect time because you will get galaxy buds for free if you are in uk,_
Apa yg x best?,_
Mula2 test 4 je boleh on,_
sller dh pos out awal cuma curier je lmbt,_
Terima kasih seller kerana memberikan servis yang terbaik,_
Tq seller terbaikkkkk laju penghantaran tqqqqqqqqqqqqqq,_
Delivery juga memuaskan,_
Masa sampai dah jadi ex boifrend,_
muat untuk saya,_
"So fast and efficient, i like the color and hope this is sustainable",_
Jesus Christ bless you,_
"KUALA LUMPUR: Sepakan penalti pemain Johor Darul Ta'zim (JDT), Safawi Rasid ketika berdepan Sabah FC dalam saingan Piala Malaysia di Stadium Sultan Ibrahim malam tadi, tular namun bukan dalam situasi diinginkan",_
Am sorry mw son touch my fone but Good item recommended seller,_
fast delivery nice packaging and received item in good condition,_
"dh try, hammering tu xbrp la sgt tp mesin drill ni kire sesuai utk kje2 rmh",_
62 in early trading - opening below the $100 mark for the first time - and were still off about 11 in the afternoon,_
Kasut memang sudah lama datang cuma hari ni baru sempat bagi rate,_
penghantaran cepat bajunya lawo dan sesuai dgn harga,_
"Can't remember how many times to bought it aldy, good value for money and really good taste to drink",_
"beli untuk mak, sesuai utk mak-mak yang suka design kayu macam ni",_
Recommended to buy for live streaming,_
It is cute but too small,_
klau double XL baru cun,_
Trusted seller!baik seller ni guys,_
lagi bagus klau ada byk lagi pilihan,_
Only buy 2 bottle drinks but give me the free gift,_
5/ 10,_
Best pkai yg ni wngi oren,_
Q lindooos,_
xsabar nk jadikan gubahan hntaran bunga to,_
No standard shipping turnaround time,_
bukaan muka fit dengan muka saya yg kecil ni,_
They are so confident,_
ok telekung cantik,_
tapi awning x cantik,_
Rrceived on 27aug,_
Second order dgn seller,_
"It's very thick, quality the best!",_
Dah terima dan item berfungsi dengan baik,_
Thank you for the great and fast service,_
xxl pun muat2 pakai je,_
"Order Well received and in good condition,",_
"Fast shipping process, nicely wrap and got free gift some more",_
"selesa pakai di rumah,x tebal x nipis sgt",_
!terus boring stok berbulan2!,_
quie big but it fit nicely,_
sesuai dipakai ketika hujan,_
"87 million), closed/fund (3,000), energy (159",_
Kena ambil 1 size besa dari biasa,_
Utk maklumat Tuan/Puan berikut adalah senarai nama & no giliran terbaru,_
then promote & jual dkt kwn?,_
Smpai2 terus rendam dlm air panas,_
The quality is very good and comfortable,_
"cantik cantik menyesal beli sikit, tahu beli semua colour nanti boleh order lagi",_
Hehehe 🥰,_
seller dan jnt pantas buat kerjaa,_
didn&$HASHTAG$,_
Kain memang nipis ye jgn expect hrga dgn Kain,_
50 (NP: RM16,_
Cumanya setiap mask chain tu takde magnetic buckle tu tau,_
"The products are good, the response is less",_
very satisfied <3,_
For the price it seem very valuable too me,_
"kalau ok nnti sy repeat lagi,tq seller",_
Seringkali kita dihantui rasa cemas dan takut setiap ada orang yang menghidangkan makanan pada kita,_
Kalo uptade itu harusnya lebih bagus malah jadi jelek,_
"Overall not bad, nothing much to comment",_
Consider okay since from China,_
Keren jossssss mantappppp,_
tapi barang boek,_
Twiter:-,_
Quattro taste like a supering but spicy a little bit,_
Barang dah sampai cantik sangat hadiah untuk cik suami,_
"12 sampai 13,mmg padu astu cable ni ada cahaya hek,so far ok je,aku belum try ah tapi,gi lah beli,okbye,cable dia panjang,astu tak senang rosak sbb material luar cable tu,bende tah namanya",_
mmm nugs from the future,_
"Saya try sendiri, memang best slipper ni",_
Design:design biasa je sesuai dgn harga dia tu,_
Rabbit tu nama coney,_
Terbaikkkkkkkkkkkkkkkkkkkk terbaikkkkkkkkkkkkkkkkkkkk terbaikkkkkkkkkkkkkkkkkkkk terbaikkkkkkkkkkkkkkkkkkkk terbaikkkkkkkkkkkkkkkkkkkk terbaikkkkkkkkkkkkkkkkkkkk,_
Tq seller barang sampai dalam keadaan baik bungkusan produk kemas,_
Taste:payauu,_
Alhamdulillah Buku Penghayatan Etika dan Peradaban dapat dalam keadaan yang baik!,_
sangat recommended untuk yang lain mencubanya,_
kedai ni,_
She's happy with it and it's functioning well,_
Abit rough,_
kepada pihak yang telah berada disana ada yang,_
Cheeper than others places,_
Samsung: Let me introduce you to a foldable phone,_
Thanks seller foc 1 more pack to me,_
Ada bahagian tak berjahit,_
"Penghantaran laju, walaupun dari oversea",_
Functionality:wall stagger diy project,_
"Thanks seller, nanti boleh repeat order",_
Bought it because the new bra I got was too tight,_
Functionality:untuk pantang,_
Confirm repeat lagii!,_
seller posted a bit slow nasib baik courier sgt laju,_
"Boleh nampak buncit if buncit if ada size besar lagi, lebih selesa",_
Barang dh sampai di bungkus dengan elok,_
Thank you for sanding fast it's Very good quality thanks,_
haha okay aayang just wanted you to know that we have the same thing with your family and your family so much orang you are,_
"So crazy, received the items within 24 hours",_
tq pada abang2 penghantar tadi,_
"Btw tq saller, penghantaran cpat dan slamat",_
Good quality of clothing,_
"28 (Xinhua): A total of 37 Myanmar nationals, 35 migrants and two drivers, were arrested on Friday for illegal entry into western Thailand, an army officer has announced",_
Jadi simpan dulu nnt dah tinggi sikit boleh pakai,_
"Seller lupa bagi free gift, tapi lepas inform seller hantar cukup semua barang",_
"Tapak keras jadi untuk lebih selesa, sendiri kena tambah span dekat dalam",_
Tapi baby boleh cabut 🤣 cukup lembut,_
pakai gam ape,_
rase nya semacam basmati lainnya,_
omg thank you!,_
In life you have to remember the people who have done good things for you in the past that you couldn&$HASHTAG$,_
good quality's good good very,_
You don't deserve even 1 star,_
Ia tidak mengira taraf sosioekonomi mana-mana individu,_
Need to read the instruction first,_
Barang telah diterima dlm keadaan baik dan memuaskan packing pun cantik,_
Cuma jngn pakai lama sngt lah nnti sakit tapak kaki,_
Memang slalu beli kat sini,_
Kang kalau korang amek saiz S jgk memang tak muat lah,_
One scoop choc chip,_
my fifth time buying from this shop,_
but I was very disappointed to only receive one pair,_
Delivery pon laju walaupun dari Indonesia,_
item received fast and good service,_
Seluar diterima dlm keadaain baik & sempurna,_
Mosquito King sangat murah tiga puluh batang baru satu ringgit,_
Mmg cepat bantu berat badan turun tapi makanan still kawal juga,_
x dela nk guna urgent,_
"Ketua UMNO Bahagian Ketereh, Tan Sri Annuar Musa, berkata maklumat diperoleh daripada jentera parti di kebanyakan kawasan mendapati Barisan Nasional (BN) sukar membaca sentimen rakyat di peringkat akar umbi",_
"The company, which has struggled with poor yields on advanced chip processes for years, has been improving and accelerating its capacity expansion at home",_
Diterima dengan selamat dalam 3 hari,_
hargailah mak anda selagi dia masih ada,_
Design:Easy to use,_
Kain sedap tapi agak nipis untuk jersey,_
