Sentence,Tagged_Sentence
Barang semua sampai dlm keadaan ok,_
"Teh xkaww,colour kurang,rasa xsedap",_
"All receive in good condition, thank courier and seller very much!",_
Tqtqtqtq saller brg dh selamat smpai,_
Kelvin Leong 100,_
"I still think monkeys are useful tools in picking coconuts, she said",_
", I will choose this shop",_
cheap & received in good condition,_
The refrigerator cools very fast,_
tnks seller,_
"Penghantaran pantas, makanan sampai dengan selamat dah cepat",_
overall satisfied 🥰,_
Very nice and fast delivery by seller,_
Harap merasi dengan badan saya,_
The 'Sprinta' font on the back has a shadow compared to Petronas,_
Size of battery is larger than original,_
Great price and will purchase again,_
tq² will repeat again,_
Worth to buy in here,_
penghantaran seminggu juga la dapat barang ni,_
Seller response laju mcm ketapi Jepun,_
Sound n battery r so good n last longer,_
Very recommanded seller🥰🥰🥰,_
Beg xsama mcm gambar,_
"The app, accessible at kitajaga",_
Nak Delivery cepattt kena chat seller for urgent order overall everything okayyy so satisfied tudung pun murah and lawaaaaaaaaaaaaaaaaa,_
First time beli underwear online,_
- Vienam News/ANN,_
Alhamdulillah dorang makan dan suka,_
Yg red tu mcm tak function je,_
cpt smpinye semlm oder hr dh smpi,_
Just hope the courier service handle the goods gently,_
aduhhhhhhjj,_
murah la dari kedai lain,_
Pam berfungsi dengan baik even harga dia murah,_
Thank you thank you terima kasih banyak banyak banyak banyak banyak banyak,_
"This kaftan is only suitable for people who are tall, so it didn't look nice on me",_
Cheap during sale day,_
Saya dah oder 2 kali,_
"Seller bertindak cepat dan pantas cara dibungkus dengan baik dan sempurna, penghantar boleh laju lagi tapi diperam oleh J&T N9",_
Good value for money and good quality of product,_
Cuma ada bahagian getah yang gelembung sikit tapi alhamdulillah masih boleh pakai thank you seller,_
Bought for my father's birthday hehe thankyou!,_
Cpt plk tu smpi,_
jahitan kemas kain pun jenis x panas,_
"They also enjoyed music performances by the AXR band Alex Rocksta', 38, who strummed on his ukulele, while his wife Lum Yi Mann, 30, played the guzheng (Chinese zither)",_
Order last min seminggu before raya n seller very helpful untuk ship awal,_
Baju selamat sampai tiada kerosakan,_
"Harini order, esok dah sampai terengganu fast reply jgk dekat chat",_
okokokokokokokkkk,_
Kain batik bawh tv,_
That is the worst customer experience for customer interfacing app,_
kelmarin ship hari ni sudah smpai,_
siap bg note return lagi,_
Mmg suka sgt!,_
boleh bawak pegi menjaring,_
Phon memang best,_
KUCING SAYA SUKA MAKAN,_
satu saiz xl satu lg xxl,_
"Thanks seller bg free 2,3biji",_
Dah la cantik gila,_
Baru 2hari buat patch test,_
Recieved:14,_
Dapat 5 bag air ais,_
Kain sejuk ok,_
ape pn sgt2 recommend utk semua,_
boleh kiro,_
"Kah Woh yang juga Ahli Parlimen Ipoh Timur, berkata PAC sudah menjalankan lapan prosiding membabitkan projek LCS setakat ini dan saksi yang dipanggil memberikan kerjasama penuh kepada jawatankuasa itu",_
"penghantaran cepat, tudung cantik sangat semua okay la warna pun cantik semua okay",_
but poor service by ninja van,_
Shape: ceramic,_
"thankyou seller , dh smpai delivery lajuu dpt sama mcm dlm gambar",_
Thank you kpopmerch for your good packaging !,_
cantik Dan berkualitiiii,_
Terbaik kemas dan cantik,_
ngam sampai wktu mau buka skola,_
"Thanks, stock arrived and kuality ferry good",_
Brg belum try lg tp sexy sgt cokkk,_
"Fast delivery, well packaging, good product quality",_
design boek body lawa design boek body lawa design boek body lawa design boek body lawa design boek body lawa design boek body lawa design boek body lawa design boek body lawa design boek body lawa design boek body lawa design boek body lawa design boek body lawa design boek body lawa design boek,_
"The most distinctive flavouring for this dish is doubanjiang, which is seasoned with Sichuan peppercorns that gives it its characteristic numbing spiciness",_
Easy to flush,_
tampal dh,_
"When she was in Secondary 2 and 3, the pair would watch pornographic movies with the girl on the man's mobile phone",_
"pertama sekali, terima kasih seller",_
pn sama saiz terbesar sgt,_
tahu ambil size L takpe,_
"lmbat respond ,brg smpai xckup accessories, seller susah nk respond , brg smpai 23/11",_
pengiriman cepat laju walau dr china,_
Yg lain mcm koko2 idk why hmm,_
yg baju color baby blue tu saya beli masa raya di lain kedai,_
"Nak cepat kaya, tindas orang",_
Dah banyak kali beli dngn seller ni,_
Takde duit tkpe kita kumpul,_
Cant wait to try if its good,_
Tk de kemek,_
Mic: 3/5,_
thank you so nice the colour is wonderful and amazing too,_
thank you so much shopee for the discount,_
mungkin sebab anak saya terlalu tinggi,_
"Best je , size betul macam size selipar biasa",_
Meet the One plus NORD2 $MENTION$,_
"Childfree, too",_
The gift is super adorable,_
membantu sekali bisa naik transportasi senyaman dan seasik grab ini,_
I get my parcel ready,_
Memang laju giler sampai,_
semua isi dalam ok,_
sudah sampaii,_
"Fast delivery punya,",_
"Kain nampak cantik, belum cuba, harap muat n selesa bla di pakai nanti boleh order lagi",_
wauuu dah sampai kualiti dia elok beli tiga tapi bagi kat kawan haha,_
"Hi guys, i need your helps to support my business",_
Sy tak selesa berpijak pada kasut kiri tu,_
tp nasib dlm brg ok,_
suke anak dapat main game,_
sukaaaa sangat sangatttt tq seller boleh repeat order kain lembut,_
Anak terus pakai,_
"The bag is very good, not disappointing, the material is thick",_
Tinggi beg lebih kurang sejengkal,_
Original G SHOCK,_
penghantaran mmg laju terbaik,_
Semuanya okay dan memuaskan hati pembeli,_
Expiry date 06/2021,_
Cuma material kain ni jenis tak kawan dgn pantiliners,_
Lawes is still recovering from concussion while Hill has a stress fracture and both were unable to train properly this week,_
Cutting yg hitam a bit loose,_
"Delivery cepat dan barang balut dengan buble rap walau pun beli 1, recommended this seller harge pun sngt berbaloi",_
Allhamdulillah barang sudah sampai,_
kita repeat lagi🤗🤗🤗🤗,_
Amik masa sebulan lebih baru sampai,_
Received it within half an hour very fast services,_
cuba utk terbangkan kertas tp batteri habis,_
Masa penghantaran pantas,_
Shantik sgt,_
Cleaning Effect:belum nampak kesan cerah,_
"when received, it is only bangle",_
Air better isi sebelum garisan pertama takut tumpah,_
Bekerja dengan perefesional,_
Quality:cukup seperti di pesan,_
bukak tutup takde masalah,_
"No additives, no preservatives, no colouring",_
very cheap and worth it!,_
kena pandai pilih saiz ye,_
Ok cantiknya Ok cantiknya Ok cantiknya Ok cantiknya Ok cantiknya Ok cantiknya Ok cantiknya Ok cantiknya Ok cantiknya Ok cantiknya Ok cantiknya Ok cantiknya Ok cantiknya Ok cantiknya Ok can,_
"lain kali boleh repeat order ,",_
Lampu cantek,_
Recommended for mommy semua,_
"Tastes amazing, simple to prepare and healthy too!",_
Srs weh tinggi,_
Ok la takde masalah pun,_
"I HAVE FOLLOWED THE SHOP, BUT DIDN'T RECEIVE ANY VOUCHER STATED IN THE PRODUCT DESCRIPTION!",_
"Kelmarin BH melaporkan, burung sekendi sudu muka hitam yang terancam dan dijangka populasinya berkurang kepada kira-kira 500 ekor sahaja pada masa hadapan, dikesan muncul di muara Sungai Lahar Endin, Penaga, Seberang Perai Utara, Pulau Pinang, pada 15 Disember lalu",_
And quite panjang jugak untuk orang yang tinggi 156cm,_
?$&$HASHTAG$ *+¥ im so so happy !,_
"Beg lawa, nanti boleh repeat lg",_
Arrived in good condition and works well,_
"Dah sampai dahhhh, mmg mantap lah,",_
Yang penting Saya tak keciwa,_
"padat tapi lembut, sedap",_
"The $HASHTAG$ campaign, which runs until Jan 2, 2022, is made even more timely as it coincides with year-end festivities such as Christmas and New Year celebrations",_
"First, and most importantly, ensure that all the health and safety measures and precautions have been taken",_
"product safely arrived in good condition, very fast shipping but i dont know what happen the box look damage but the goods okay",_
Beli time sale lagi puas hati boleh dpt free delivery,_
In sha Allah moga murah rezeki seller,_
mask sampai dalam keadaan baik thankyou seller,_
He added that the process went smoothly as it was managed well by the authorities,_
Biasa kat china,_
Good services from seller terbaik dan bertepatan dengan keadaan yang terlibat dalam aktiviti sukan dan rekreasi dan seller terbaik,_
Dia lembut je and tak sakit sangatt pun bila guna,_
Setakat ni hanya sedap minum tapi x mengenyangkn pada diri saya lah,_
Good kualiti puas hati srlesa pakai harga betpatutan,_
Nice cun fit to fit,_
Will definitively purchase again,_
Semlm order rini da sampai,_
"Fast shipping, the product is exactly like what they advertise",_
Tp kalau harga Rm1 lagi ok sbb ambik,_
Saiz ni perfect untuk saya,_
Brg dh smpai bgkusan kemas elok je,_
Durability:High,_
Ada dekat seminggu juga baru dpt,_
Omaigadsss in love terukk🥺,_
Size/Perfect Fit:molek ada jugak se dua yang selalu bocor,_
"Daripada jumlah itu, RM22 juta akan digunakan bagi membangunkan perniagaan pengedaran jenama baharu manakala RM160",_
Penghantaran pun laju 🥰,_
Material:harga baik,_
"City police chief Comm Datuk Azmi Abu Kassim said that after City Hall (DBKL) evacuated eight households there last Sunday (Dec 19), they have been monitoring the situation closely",_
Ive been trying to add my card details since yesterday so I can process my order but I keep getting error card info is incorrect/make sure that card info is correct,_
Dia punya tahap kelajuan max dia mcam tahap 1 utk kipas jenama lain,_
Terima kasih seller sebab jual barang2 dengan harga yang sangat patut ni sampai dengan cepat dan barang pon dalam keadaan baik,_
Thank you seller q,_
Good fabric for only RM 10,_
kecuali beg kecik tu 1 mcm ade buli2 terkeluar n 1 lagi mcm ade kesan lilin,_
The packaging also okay,_
"Video takde kaitan , btw cantik , boleh laa padan laa dengan harga",_
Smua mitten & bootees dh slamat smpai dlm keadaan baik,_
Sory bru sempat bg feedback,_
"Editing by GV De Clercq, Richard Lough and Hugh Lawson)",_
ordered on 07,_
Dh test mmg mantap,_
", genuine trustworthy definitely worth for money",_
delivery quie fast!,_
"Abdul Aziz Buhari, Cheah Hock Cheok, N",_
buat keje menang laju,_
Always trust kpopmerch for the pull~~love this purple Chenle so much!,_
Warna sngt cntik walaupun kosong,_
Tak sia-sia berjaga tengah malam sebab nak dapat harga rm288,_
Effective sgt,_
Brg dh smpi tp Belum buka lg,_
Mask ricoco cantik senang matching dgn banyak kaler,_
Ordered item took some time from overseas to arrived,_
Design yang dipesan habis stok,_
Worth to buy yaa gengg,_
Beli untuk suami baju ni,_
You can't order,_
Order : 9 okt,_
Yg nk pkai loose size L ni mmg sesuai,_
Please make video on mi notebook 14 ic Vs Acer aspire 5,_
World Triathlon said in a statement that they had contacted the KTF and the South Korean Olympic Committee (KSOC) to gather details about the death of the 22-year-old,_
"Brg cantikkk sgt2, simple but nice, kalau tmpt letak duit tu selalu ad yg bila zip duit kapit then nk bukk zip duit koyak kan?",_
sy akn tambah sikit knows pasti sedap ½ sudu teh,_
Really dude,_
Safety:Not yet try,_
Barang dah sampai tapi tak guna lagi,_
"Please allow the review page does not expired, i keep miss the review window",_
"If skin irritation occurs, discontinue usage",_
"Sis ambil saiz L, mmg berbaloi beli",_
Material:Besi lembut x sama mcm dalam gambar,_
packaging amat baik,_
Terima kasih seller bagi free,_
Saiz army green lagi cantik sebab labuh tutup punggung depan belakang,_
"Sebelum ni beli extra fine jenama lain, ok je boleh hasilkan espresso dgn baik",_
Just on and can straight away use,_
"Kain okay sedap pakai, cantik !",_
Nescafe always good,_
Beli utk pakai masa pantang nnt,_
Dapat ikan masuk dalam bubu,_
Durability:not sure if will last long as finishing is average,_
VLT005SR,_
"good product delivery is okay, packaging also nice",_
Great Offer,_
Terima kasih seller nanti saya repeat lagi,_
sir i am already your youtube channel subscriber and follow instigrm and Twitter and Facebook i am win this phon sir,_
Great phone for the price!,_
We are waiting for the review of the flip 3,_
"Alhamdulillah mesin okay, dah try basuh baju, bersih elok",_
kualiti nya elok,_
expires on 02 October 2021,_
Si Bae fast delivery macam roket,_
Trusted seller tau xcuba lagi,_
"Lawa tshirt pengakap ni , siaze 3xl muat untuk anak saya 12y 53kg, size L untuk anak saya 9y berat 25kg",_
Fast shipping with good packaging hygiene,_
This is my second time purchase it,_
"The increase in recyclable items and membership also shows that the reward programme, which allows people to redeem their points online, is becoming popular among Negri Sembilan folk",_
saya dah jadi pelanggan setia,_
Very good very good very good very good very good very good very,_
"murah dan senang untuk di pasang,",_
TQVM seller and Shopee for the pay day special!,_
Maybe salah cara pasang,_
Material:kurang okey,_
penghantaran seller ke kurier lajuu berdesup,_
nasib baik ada 2 zip,_
"Opponents say they raise the risks for civilians, pose problems for accountability and increase the chances of conflict escalation",_
bole beli la sapa nak,_
Hanya masuk direct plastik bekas jadi rosak dan tak kemas,_
Quality/Material:is very good,_
Janji mesin basuh hidup,_
Lips treatment,_
t be added?,_
Terima kasihhh sis,_
Mco kan,_
02 ni macam sesuai utk org yg sawo matang,_
t have one of those things ( don&$HASHTAG$,_
Mujur la cpt dia htr sb x sabar nk mnm,_
Order warna lain sampai warna lain,_
Ale ale,_
penghantaran cepat baru order semalam dh smpai harini,_
Fast ship out fast delivery service however one of the stand leg cracked but still can be used,_
"It's sad that actually the space when connected with computer, it has 57GB",_
Memang puashati agi,_
"item selimut mmg tebal,sejuk ja",_
hope yg kt kl tu slmt smpai la sbb sy dh tekan received,_
Belum cuba lagi sebab Pasir masih di pejabat suami,_
Cantik kasutnya dgn harga yg mampu milik,_
belum test lagi ok ke tak,_
"Mouse terbaik, tak bunyi bila guna Penghantaran pun cepat",_
So far guna ok,_
"Barang smpai dlm keadaan baikk,dibalut kemas",_
"Penghantaran yang sangat pantas,Barang sampai dalam keadaan yang baik",_
Alhamdulillah barang sampai dgn keadaan yg baik,_
"Anwar, 4 wakil rakyat gagal cabar Muhyiddin nasihat gantung Parlimen",_
"Customer service terbaik, laju respon chat!",_
"Good good product, delivery fast",_
"really worth the price , harga dri malaysia mcm ni payah ye nk dpt !",_
ssh nk cari seluar,_
"frust jg, hrg rm28 satu",_
Sebab sebelom boh rasa gatal sangat lepas boh dah tak gatal,_
Packaging not so good as all products put inside 1 individual plastic and wrapped with thin & tore abit parcel plastic,_
Kira berbaloi kot dgn harga?,_
"Brg cpt smpi, packaging ok sgt",_
They improved their packaging!,_
"will buy again soon, tq",_
"Good product, price resonable",_
All they do is make money by disappointing others,_
My wife order using my acc,_
Roast dia lebih banyak kepada dark berbanding medium,_
Material:semua cukup,_
next time bole repeat ag,_
Btw corak bunga daisy dia cumell,_
Terbaik cadar dan sampul bantal dari kun,_
(u‿ฺu),_
I will update this review after I wear the mask,_
belit duit org,_
Ingat botol kecikk rupanya besar,_
seller so friendly & baik when jawab questions!,_
"Ketua Persatuan Antara Disiplin Jerman untuk Rawatan Rapi dan Perubatan Kecemasan, Gernot Marx, berkata beberapa hospital sudah menghadapi 'beban akut', menyebabkan pesakit COVID-19 perlu dipindahkan ke luar negara",_
Layan semua soalan,_
dalam 15 jam juga sejuk,_
Overall selipar best,_
pos je mcam slow skit,_
"barang sudah sampai, terima kasih bang!",_
Lepas pakai turbo mode baru senang,_
Beri untuk hadiah kahwin,_
Stokin ngam cantik lawa menarik nice sedap tebal ngam ngam terrr,_
the item looks stiffffffffffffffffffff,_
Order 4/8 Received 6/8,_
"Indicators on fuel consumption suggest the barrels can be absorbed, with all but one major Asian country registering a rise in mobility month-on-month, according to data compiled by Bloomberg",_
Pnjng 200cm fit well,_
adjustable and tak perlu guna lubang,_
"Taste:sedap, enak",_
Barang diterima dgn keadaan baikltk fragile lg jd tkblh lh mreka lempar sna sni brng tu,_
"Puas hati dengan keadaan barang, dapat dust bag untuk memudahkan bawa kemana2",_
Murah boleh beli bnyk,_
Harga:,_
Cuma saya luper nak suruh seller tolong pasangkan terus visor depan tu,_
"Barang berkualiti , sangat sangat recommended beli dengn seller ni",_
Ok la kot noh,_
Tq seller penghantaran cepat dapat juga guna hari ni,_
Bag receiived in good condition,_
Terbaik saler,_
5 star is liye diye hn k food mil jata h ni to sb kute wale beghairt hn,_
Kalini beli 15 kilo terus,_
"On top of that, it also risks more capital outflows and a weaker ringgit amid rising global interest rates due to normalising global monetary policy, the rating agency says in its recent report",_
pastu suami suruh bli lainalhamdulillah dapat 2 kasut raya,_
The monopod is smooth and function well,_
masih sama,_
Saya review semula lepas beberapa hari pakai,_
Taste good and delicious and fast delivery,_
xgelap xcerah,_
Okay kain berkualiti,_
panjang okay je untuk tinggi 150cm,_
Buy fir my mother,_
almari sudah sampai dengan selamat,_
Gmba n video xde kaitan sje nk kmpul coin,_
"Barang dah smpi dengan selamat,bungkusan ok xder masalah ap² kain pun ok lembut",_
Thank u for the best service and the fast delivery,_
Sorry the video and picture not the true,_
"Quality:Tali elok, klip pon ok, besi kan",_
But the size a bit different,_
Tp kaler mcm lari skit dari dlm gmbr,_
"Fast delivery and good value for money as well, thanks so much our local seller for providing the excellent service",_
Pigment:all color so beautiful,_
Material not tht bad,_
walaupun lambat sikit Sb guna pos laju tapi puas hati,_
I thought we were love but you said we were friends🥲🤦,_
$MENTION$ Nice phone its good,_
thankyou hehhehe,_
dan jenis kain microfibre yg lembut dan mudah kering dan meresap peluh,_
Grabfood Subscribe just to use the discount is a joke,_
Each bottle individually packed in plastic bag,_
Effectiveness:kena guna banyak baru nampak menyerlah warna dia tu,_
"Puas hati, fast delivery",_
gud job seller & courier man,_
Will buy album from this store again 10/5 stars for you,_
sempat dpt yang ni je,_
But the slippers are not soft as what they showed by the pictures,_
"Thats it, im still buying the a52, since they remove the jack and the charger",_
Ape² Sy berpuas hti,_
Bantal jenis ni lembut sikit,_
"Love the Channel, Thanks",_
"Topi cantikkk and murahh, jatihan pon kemas je muat kepala",_
kualiti kain cantik dan sejuk,_
"Makes the car looks much more sporty, very cool,",_
Do I have a chance to win,_
Boleh try yg lain pulak nanti,_
apa pun nice la overall cantik kasut,_
The product is good enough according to the price and description,_
Loose screw,_
lain kali bli yg kcik jer la jimat ni sbb byk bli smlm esok dha smpai cpt,_
Material ok lembut cantik,_
"Taste:taste good,won't too sweet",_
Mmmmmmmmmmmmmmmmmmmaaaaaaannnnnnnntttttttttttaaaaaapppppppppppp,_
Everyone opens the package gentle: Namjoon pulling it out in 3 seconds: BAM,_
Kalau pakai cermin mata pakai mask ni tak berkabus,_
Kualiti produk sepadan dengan harga yang ditawarkan,_
Packaging dia better kena naik taraf sikit,_
Fast printing!,_
Kalau nak test maybe kena charge full dulu baru kita tau berapa jam dia boleh tahan,_
"Sumpah cantik, tak menyesal beli",_
de yg berbulus I trim sendiri,_
Penghantaran sgt pantas even beli 11/11,_
Almost ya not totally,_
The bag has a few dirty spots but unnoticable,_
🧕🤣🤣🤔🤣,_
Ketika kejadian motosikal yang ditunggang Anas bersama dua pembonceng dalam perjalanan dari arah Ulu Melaka menghala ke Ayer Hangat,_
"Thankyou seller barang smpai dlam keadaan yg baik, puas hati dngan packaging beg cantik, dpat freegift pulak moga dimurahkan rezeki",_
barang ok smpai cepat jugak,_
"Fast delivery, good value and nice kolomee, cheap price",_
worth the money and waiting,_
Excited nak tengok anak duduk dalam rocker,_
"Ada bubble wrap, dan ada kotak yg dilabel fragile",_
s another great product form OnePlus $MENTION$,_
Hmmm after this no worry if no current,_
barang sampai dengan cepat walaupun dari luar negara,_
Cube mmg super best & senang je pusing2,_
ingat boleh 4 hari sampai tapi takpe barang order terbaik dari ladang,_
"curated by Malaysian art researcher Roopesh Sitharan, is put together to spark dialogue, and explore the existence of difference in the expression of order",_
writer I&$HASHTAG$,_
1st time testing new taste,_
berbanding dgn jenama lain agak mahal,_
Overall 4 star and I like it!,_
"Fast, convenient, clean, and safe",_
Dahlah telat mlu,_
Brg diterima dlm keadaan yg baik dan selamat,_
xyakin rs nk pkai 1 tu je,_
boleh repeat beli yg lagi besar,_
"It is very convenient to use and suitabls for all devices, recommended for phone that have small internal storage",_
tak sabar nk pakai pg wedding cousin,_
Sebagai Ketua Menteri Melaka yang baharu saya akan menunaikan kewajipan seperti rakyat negeri Melaka mahukan serta menggalas aspirasi Tuan Yang Terutama Tun dalam memasyhurkan negeri Melaka di persada antarabangsa,_
"Received in a very good condition, with proper packaging as well",_
Kena pakai double layer,_
"Dalam masa sama, beliau berkata pemaju hartanah itu menyasar untuk terus melakukan aktiviti pengambilalihan sama ada tanah atau bangunan sedia ada tahun ini",_
Abam posmen send Pantas betul,_
De mi 9note is a trash I wasted my cash on it sad mood,_
Item as described and worthy for the amount paid,_
My cat love it my,_
Sorry if gambar takde kene mengena,_
Bunyi bising jugak suction okay kuat,_
ChkxigjcjcmydmyxngxjgxjyxjgfjyxngxjvzjshfshfzjzjfxhfzjfsugziGAjgsfusfjsjfs,_
Hope this will not hurt my skin,_
Alhamdulillah sampai sudah barang saya cantik sangat terima kasih,_
Parcel received in good condition with extra bubbles wrap as requested,_
"barang dh smpai , penghantaran pun laju ,dn barang dipacking dengan kemas thank you",_
Murahla sabun cuci baju baby tu,_
Suka suka suka suka sangat-sangat,_
Li video ke starting main,_
The kids satisfied,_
So it&$HASHTAG$,_
penghantaran dn pembungkusan baik,_
Cepat ship out barang,_
so kena ambil size besar sikit,_
Happy mummyyyyyyy,_
"Items packed neatly by bubble wrap, extra bubble wrap for food item",_
barang smua dlm keadaan ok,_
kalo bsuh arap lagi lembut,_
"tapi Yang pending sekali gosok, depan belakang xkedut",_
Baby cot ok cuma manual nya punya laa seciput secoet diberinya,_
Aroma:best sgt especially for night tea,_
the bubble wrap sealed perfectly,_
"Fichot dilapor melancarkan mogok lapar selama tiga minggu ketika temasya Sukan Olimpik di Tokyo, awal tahun ini, bagi menarik perhatian terhadap kesnya",_
Thanks very much from Spain,_
Padan dengan saiz sy,_
Thanks for sharing this with us,_
Arghh love terukksH 161cm W 48kg ambil XL labuh elokk cuma pinggang longgar sikit,_
Lock pn pn tbaik,_
Jockey preview,_
lalalalaalalalalalaal,_
semua dah dapat,_
Seller ship out : 25/02/22,_
Es I will be there in a few minutes if you want to come over and help me with the stuff I need to do for you and I can do it tomorrow if you want to come over and I can bring it to the bank and if I need to come over then I can come over and help out with the stuff I have for the weekend if you can,_
Mybe kalau amik size L bru tk besar sgt kot,_
Baju ni harge dia murah,_
nanti repeat beli untuk anak,_
sesuai dengan harga yg di tawarkan,_
Brought this for the second time because my friend ask me to buy mask for her because she is in asrama (crush sv back no),_
The debate centred on,_
my brother has the purple one and i think i like the purple one more,_
Prompt delivery from china,_
boleh la diterima selamat sampai jugak bagus,_
syukur barang tak kena banjir,_
"For Zii Jia, it's a great learning experience, said Hendrawan",_
kita yang da besar ni pn excited,_
sesuai untuk tadika dan darjah 1,_
So Beli La Geng,_
Penghantaran sgt pantas boleh beli lagi next time,_
Kedudukan kewangan pengendali kapal persiaran itu merosot dengan pantas selepas pandemik COVID-19 menyebabkan pelbagai sekatan yang mencetuskan penstrukturan semula dan kemuflisan dalam kalangan syarikat industri perjalanan di seluruh dunia,_
boley pergi jauh,_
His latest Cabinet still needs to be confirmed through a Congressional vote,_
Lost count on the number of times that I purchase,_
Soryy gambo takde kne mngenee🤣🤣,_
"Terbaik, dengan penghantaran yang baik dan cepat, excellent service by seller, good value for money",_
Best sgt tlekung ni serius xnyesal beli,_
Huiming Neo,_
Can function easily thankyou so much,_
Recommend everyone to buy!,_
Maktok sayaa sukaaaaaa,_
Its like wet tissue,_
"Walaupun kejadian ini disebabkan hujan lebat, tetapi ia tidak akan berlaku jika penyeliaan sewajarnya dibuat di situ",_
balutan kemas sebab guna bubble,_
next boleh oder warna lain pula,_
"Service is tiptop like always, thank you so much seller",_
"Hello beautiful, how are you doing",_
so many things can do with this,_
kalau cun hasilnya pasti repeat beli lagi,_
Congrats to you new tech chanal,_
all size is right,_
Fit dekat tilam super single,_
Product quality is worth with the price,_
that&quot,_
Aroma:aroma yg menawan,_
Alston said however that the 5,_
"berbaloi beli dh la harga murah,selesa plk tu",_
Tgk review semua ok jadi saya cuba la hihi,_
"tak pedas sangat sukaa dengan perencah, kicap dia, overall puas hati beli sini segala rasa cukup",_
Suitable for below 300m hills and short hike,_
tq seller pos segera,_
Kain terlalu nipis dan there no metal strip for the nose attached,_
got for only 88 sen on sale,_
sesuai harganya murah,_
Maaf gambar tak berkaitan tak sempat nak ambil,_
Pada minggu kedua persekolahan bilangan kluster pendidikan meningkat sekali ganda kepada 33 kluster,_
kalau tak memang tk pakaila bnda ni,_
Kain baju pun best,_
