Sentence,Tagged_Sentence
Thankyou seller ðŸ¥° maaf gambar dan video takde kaitan hehe,_
Better pilih size sebenar jangan amek 1 bigger size,_
Kasut agak keras,_
Biar viral,_
item smpi dengan cepat,_
"No folded no damaged maybe bcoz of I bought 50 pcs, thick and nt easy to fold, thank you",_
mmg ori smbal hitam pahang,_
saja try bwk anak jln2 kt luar tp ada je nyamuk gigit nya,_
"harga okay x mahal sangat, x murah sgt, barang okay x tebal sangat x nipis sangat, seller okay x peramah sangat x sombong sangat, overall semua dekat dunia ni",_
"thankyouuuuuu thankyouuuuu thankyouuuuu thankyoui barang sampai dalam keadaan baikkkk , kainn helokkkk jeeeeee thankyouuuuuuu",_
"But in that month (June), the temporary room was used only once to store evidence and those were the exhibits for this case, he said during cross-examination by defence counsel Tan Sri Muhammad Shafee Abdullah before Judge Datuk Ab Karim Ab Rahman on Monday (June 29)",_
Stokin jenis tebal,_
very very very nice lah this cap i loikeeee hehe thank youuuu,_
anak cakap selesa dan tahan lasak,_
Delivery delay from courier service side,_
order 25/9 sampai 4/10,_
The junta says those figures are exaggerated,_
Ð¯ Ð¿Ð¾Ð½ÑÐ» Ñ‡Ñ‚Ð¾ ÐºÐ¸Ñ‚Ð°Ð¹ÑÐºÐ¸Ð¹ 5 Ñ€Ð°Ð²ÐµÐ½ Ñ€ÑƒÑÑÐºÐ¾Ð¼Ñƒ 4ðŸ¤”,_
Pengahntarn memang pantas,_
Cuba letak dlm satu kotak semua sekali,_
& tq for the free gift,_
"Ketika pemain dan kakitangan kedua-dua pasukan bersalaman, Ronaldo dihampiri pemain gantian Serbia, Nemanja Radonjic dan kemudiannya mereka berpelukan",_
"Just blur time masuk cart terbeli 2 baju pattern sama, lol",_
Srs purse dia mmg lawa gila i suka sbb tempat letak untuk card ada banyak and ruang letak duit pun banyak,_
mcm x sesuai hadiahkan kt org,_
dah mandi guna sabun ni and so far got no sensitive reaction or harsh on skin,_
t wait to see the batteries in real life use!,_
fast delivery also and the seller is very responsive,_
barang mencukupi seperti yg di order,_
"coins,",_
kurier pun handle dengan baik,_
but if tknk nmpk jari tu mcm terkeluar mungkin kene beli size,_
"Lampu bulat berfungsi dengan cemerlan , overall memang mantapp",_
tiada apa nak komplen,_
"Smua ok, kite ok, kamu ok, smua ok",_
Komen dia: ngam untuk kepala dia,_
Terima dlm keadaan kotak kemek but the items in the box are all fine and received in the quantity as requested,_
Kain lampin berwarna menarik dan kain pun sesuai sebagaimana yang dikatakan,_
"so far, everythings is okay",_
All the adobe successfully installed as the instructions are actually pretty easy to understand,_
"Barang sampai dalam keadaan baik, true to size",_
Not going to use the app for transportation ever again,_
9 sale and its very2 cheaper,_
Berbaloiii dan murahhhh lah,_
"South Africa had to replay a World Cup qualifier they won 2-1 against Senegal in 2016, after Ghanaian referee Joseph Lamptey was found guilty by FIFA of unlawfully influencing a match result",_
lancar Jr bunyi pun smoft je,_
bukn sebijik lebih dari 5 bijik bola barai,_
Harga murah dqn kualiti produk baik,_
GREAT GREAT GREAT GREAT GREAT GREAT !,_
Kualiti baju cun,_
Kiplepay Sdn Bhd acting chief executive officer Ricky Lew said the move would encourage communities in rural areas to embrace digital solutions in their lives and in turn bring them more opportunities in the future,_
Baling bungkusan pin,_
"Thank you , so many times i buy from this seller",_
innerside dia warna putih,_
Hrp ada stk la,_
Sesuai utk bromeliad saya,_
Baju yg beli dari seller nie semua cantik2,_
n betul-betul 30 hari bru brg post out,_
Received safely with nice Shopee carton inside bubble wrapping,_
JDT bergaya ke final,_
Tekan tekan je settle,_
"madami foods mpagpipilian, reasonable naman ang price and delivery fee according sa layu ng location",_
"Finally! Received in good condition er, not high waist more like semi high, it's okay can wear at home",_
Ingt kn besar lg,_
barang sampai dalam keadaan baik dan dibalut dengan kemas,_
"My mom dah pakai, sukaaaa!",_
ssuai sgt nk letak dlm bag,_
"Quality:, ,",_
Saiz mmg ngam,_
"Thanks to the shop owner gave some free gifts, coffee and mask",_
"Nasib baik shawl ni flowy, pernah beli kat tempat lain kain dia keras",_
Sebelum ni dah beli pastu hilang so kena beli lagi lah,_
"Good quality and fast delivery service, recommended to buy",_
Item received in good condition in 3 days,_
Cepat smpi cuma lmbt update,_
Penghantatan pun laju,_
Safety:Soft material,_
Harap mnjadi la buang ketuat yg makin naik 2 3 biji ni,_
Courier laju as always,_
Saiz beg tk besar tk kecil,_
"sardin, telur dada",_
Full sudah kedai,_
Barang murah dan berKualiti terima kasih seller,_
Penghantaran yg cepat dan harga berbaloi cuma tak puas sangat sbb inai die kecik je comel,_
Terima kasih bola lawa sgt,_
terbaikkkk seller tkiuuuu,_
"Barang belum test, overall puas hati, shipping cepat",_
Expiry dates are on 6/2023,_
"Penyair dan pembuat filem Iran, Baktash Abtin dilaporkan meninggal dunia dalam tahanan di Tehran selepas jatuh sakit akibat jangkitan COVID-19, kata kumpulan hak asasi manusia",_
"Barang dah sampai, penghantaran yg cepat",_
tngok blkg no,_
Sean boleh kirim ke Indonesia tak?,_
"Cantik kasut ni,suka sngt,tak sabar nak pakai,next time repeat order lagi,",_
walaupun beli 3 ja pistol,_
Taw2 je memang suka ala2 kimono ni,_
Cun fit,_
Son muy guapos,_
Already tested and working fineðŸ¥³ðŸ¥³,_
"Best services by seller,",_
"masa anak pertama,agak memenatkan asyik nak jaga buai shj",_
No need to buy the rm200+!,_
mouse bfungsi dgn baik,_
Hazel Choong,_
"Kain cantik, warna pun lawa plus labuh yee",_
2nd time buy from this seller fast delivery thank you so much,_
"Blue, white and green are a bit of jersey type which are stretchable and hence more comfortable in my opinion",_
"haritu nak beli purse ni guna free pos , lastlast tak dapat jugak sebab LUPA BAYAR inshaallah payday sale ni sayaa beli hihihi",_
Overall is great and will buy again from your shop soon!,_
"Item look quality item, satisfied with this purchase",_
Lama tunggu nak sampai,_
-- -,_
"Sebanyak 527 kes dirawat di unit rawatan rapi (ICU), membabitkan 484 kes disahkan COVID-19 dengan 43 kes lagi disyaki, berkemungkinan dan dalam siasatan",_
Total barang ni rm20,_
hopefully can get good result,_
Satisfied & colourful product,_
"Good quality, nice and decent,wont stop buyung from you, tq",_
Maaf gmbar tidak kena mengena,_
Kalau menjadi boleh repeat beli,_
"Barang semua bagus, seller bagus",_
Stay safe stay home cook maggi drink beer when hungry ok,_
Texture:fix,_
Not relatable photo and video,_
Alhamdulillahh semoga dapat berterusan dalam amalan sunnah terima kasih Tuan Alhamdulillahh semoga dapat berterusan dalam amalan sunnah terima kasih Tuan Alhamdulillahh semoga dapat berterusan dalam amalan sunnah terima kasih Tuan,_
Good really recommended service super fast n easy to contact,_
seluar sgt2 cantik,_
Sesuai untuk mommies yang nak pack bajuÂ² baby bila bsalin dekat hosp nanti hehe,_
Dia ikut berat,_
Safely recieved in good condition,_
Tlis preorder 14hr,_
ðŸ¥´ðŸ¥´ðŸ¥´ðŸ¥´ðŸ¥´ðŸ¥´ðŸ¥´kualiti kain sesuai ngan hrga,_
"puashati dgn produk serta servis oleh seller dan kurier, both pantas",_
Pastu besi buai plk banyak calar,_
"Barang elok, superb",_
Dngann,_
First time dpt beg secute gini,_
Tak berapa nak slim,_
Ok bag dah sampai dgn cemerlang,_
Received on 12th Jan,_
Dapat colour yg aku order and penghantaran laju,_
Hopefully it fits perfectly!,_
Ni belikan utk suami,_
Kain selesa very affordable!,_
iPhones have some of the longest software support of any phones?,_
The photo look nice but the quality is low but it is cheap so ok lah,_
Benda ni sebenarnya ade je dkt mrdiy bahagian pet,_
"In fact, the Fourth King of Bhutan, King Jigme Singye Wangchuck, conceptualised and coined the term GNH in 1972 and declared that GNH is more important than GDP",_
mic cun,_
"ongkir mhl gk mslh tapi resto yg dpsn lemot, masa masak berjam2,Anjay",_
"brg sampai dgn baik,tiada defect,kain tebal bagus utk kids,recomen beli kat seller ni,murah,sesuai pakai utk sekolah, ,saiz 12 utk anak saya umur 9tahun",_
Ada yang terjungkit kebelakang dan kedepan,_
Tgk lepas charge ni mcm mana,_
habis je beli habis je beli,_
Secure well!,_
make a report one week later received a new unit,_
Penghantaran macam biasa cepat tak pernah lg mengecewakan,_
"winken maybe slow skit, tp semua paham",_
T SOLD A SINGLE PHONE,_
Baranv sampai cepat,_
6 year-on-year in 2022 and exports growing at a slower rate of 10,_
Cepat sampai belum test,_
Agency for International Development (USAID) and the U,_
agak Susa jugak nak sting tapi alhamdulillah hahaha dapat jugak dgn cari cara,_
Suprising,_
"Excluding one-off transaction costs, UOB expects the deal to immediately boost the group's earnings per share and return on equity",_
"the packaging wrapped well, i hope the primer and concealer work well on my skinðŸ¥º it quite small and the sponge so fluffy u guys should try, very recommended,",_
Weight :51,_
Cuma manis sikit,_
colour ni paling mahal & memang akan cepat habis,_
kasut berkualiti dan selesa digunakan,_
tak expect kain murah mcm ni selesa,_
tech burnerr,_
Effectiveness:sgt memuaskn,_
Wanna be my first OnePlus phone,_
Sampai : 16,_
REALLY RECOMMENDED COZ ORIGINAL FROM HUAWEI,_
95 dan CIMB berkurangan lapan sen kepada RM5,_
hope seller can put rubber wrap,_
Beli time ada promotion 28/2 dapat diskaun 18 Dan free shipping,_
My favorite brand always,_
5/5 recommended,_
Ada 2 besi macam tak selesa sikit,_
trima kasih seller tksure post awal ke cepat tapi barang smpai lambat sbb sy dduk diluar kawasan,_
Thank you reseller welcome on dari suaminy barang bagus cantik puas hati dengan barrang ni seronok penghantaran laju tag reseller broduk berqualitas,_
The cartoon is cute,_
I got the diff shoes and I've been waiting for that shoes to arrived for 3 days,_
As you say no hiccups on the decoration you panned over a hiccup where the straw outer lining crosses the black inner lining on the running plate cut out on the rear driving wheel,_
"Quality:shipping was fast and package was secure,",_
Order take 2-3 days to delivery,_
Oder haro ni esok sampai da,_
turut menampilkan Aina Abdul dan Adira sebagai penyanyi undangan,_
ank sy always use drypers,_
"Suka sarung kaki ni,",_
Good GoodGood Good Good Goodyes,_
safely delivered ðŸ¤—,_
Quality:Bagus n pembungkusan baik,_
bngkusan okey,_
Okay bos brg sdah smpai,_
seller servis cepat,_
The delivery is fast and seller well package before deliver to buyer,_
Please next jgn pakai pos laju yaa,_
"Taste:Texture are not as chewy as mo yu suang, coz the cutting and shape,",_
Thank you seller hope to buy from you againðŸ¤—,_
If u aren't those who can wait will hv to shop else where,_
tutup rapat,_
"Selain itu LDP menyewakan Jubah Konvokesyen(only for regular customer NOT to photographer)spt Jubah Tadika, Jubah Tahun 6S",_
"I have bought it many times here, the buffback lover",_
suka beli kt sini sbb harga murah,_
Mula mula nk ambik saiz L tapi takut besar and labuh sngt,_
"Walaupun peram berapa hari baru nak pos, okla barang sampai dalam keadaan baik",_
"What I like about them is that you can really save a lot money, especially during special day",_
Item is received in good condition and the delivery time is okay,_
"Pesanan yang diterima dalam keadaan baik, terima kasih penjual, penghantaran cepat, hadiah percuma semua tersedia, lagi tq",_
Dalam keadaaan baik dan tiada koyak,_
minyak lintah sampai dengan selamat serta boleh di gunakan kalangan lelaki yang dah berkahwin dengan izin Allah,_
then laju seller buat kerja,_
- Inside Camera,_
smoga anak mkn & bulat mcm sumo,_
"A private poll from Cadem, which surveyed 1,007 people with a margin of error of 3",_
Will order again once consumed,_
"Item sampai dalam keadaan baik, kalau selalu pakai saiz biasa better amik saiz besar satu saiz dari biasa",_
Selagi anak minum susu ni selagi tu la akan repeat beli sebab harga murah dari kedai ada voucher berbaloi terbauk,_
"Shipping = ok, fast",_
Apa lagi yang anda mahu?,_
Speedy delivery and great quality!,_
Linda Hfz,_
u guys are doing a good job $MENTION$,_
This product is affordable especially during sales,_
"Ð¡ame without any damage, colors as in the photo, white and dark gray",_
"biasa makam shin ramen, now nak try yang lain",_
Puting laju je sampai,_
mjur tiada sebarang kerosakan,_
Esas son sopaipillas con manÃ­ :v,_
Tkde kurang,_
Decent quality for cheap bundle pants,_
x tebal n nipis sgt,_
Sampai sekarang barang tak sampai,_
"Wong Pei Ying, 19, will spend her New Year's Eve at a rented accommodation with some friends from secondary school",_
"worth buying, terima dalam keadaan baik, belt pun ok,sama seperti pesanan",_
"Barang semua cukup, received in good condition",_
Decided to buy at shopee though it's a bit expensive (plus the shipping),_
Cantiknya shredder ini,_
For those with small faces mask is a bit large but still comfortable,_
t even bother putting an effort for the Indian market,_
"Quick delivery, excellent service, goods received in good condition, excellent packaging",_
Both of them a bit not so tight but still can use,_
so next beli at least yang bampoo tu ya,_
Yg bwk family pegi picnic hjg mggu bru ni hatiÂ² je la,_
Very fast delivery & responsive,_
"Good product, and fast delivery thanks to the seller",_
Cantikla jugak,_
recommended to you all,_
the server keeps crashing,_
Terima kasihðŸ¥°ðŸ¥°ðŸ¥°ðŸ¥°ðŸ¥°ðŸ¥°ðŸ¥°ðŸ¥°ðŸ¥°ðŸ¥°ðŸ¥°ðŸ¥°ðŸ¥°ðŸ¥°ðŸ¥°ðŸ¥°ðŸ¥°ðŸ¤©ðŸ¤©ðŸ¤©ðŸ¤©ðŸ¤©ðŸ¤©ðŸ¤©ðŸ¤©ðŸ¤©ðŸ¤©ðŸ¤©ðŸ¤©ðŸ¤©ðŸ¤©ðŸ¤©ðŸ¤©ðŸ¤©ðŸ¤©ðŸ¤©ðŸ¤©ðŸ¤©ðŸ¤©,_
lambat sikit sampai,_
badan dia je huehue,_
Buyer should be notify if it's late delivery,_
Packaging siap dapat kotak lagi,_
The postage is fast,_
"Kualiti elok, sampai pun dalam keadaan baik",_
hahhaha padan ngan harga la cheq oiii,_
try letak kat tgn mcm gelap tpi mcm okay harap harap okla bila pakai kat muka nnti,_
Fast shipping by the seller and Poslaju,_
Barang sampai dengan baik dan okay good good good,_
terima free gift bag kasut,_
Produk is okey,_
Cepat sampai and kualiti kain bgusada hari repeat lagiðŸ¤ª,_
Nice <a href=$URL$,_
sec purchased,_
"Niceeeee barang semua elok, delivery pun cepatt terbaikkk",_
"Fast delivery and good price for this product, I love it so much ðŸ¤­ðŸ¤­ðŸ¤­ðŸ¥°ðŸ¥°ðŸ¥°ðŸ¥°",_
The packing is nice and hygiene as all packed individually,_
out at 26/10,_
tali jam plastic,_
Wkwkwkwk,_
"Bowling with two new balls has effectively killed reverse swing in one-day cricket, according to Tendulkar, whose 49 ODI centuries remains a record",_
"one of the product leaked, hopefully next time you can vacum seal the product tightly",_
Already auto deduct through bank but outsanding balance still showing for few days,_
Harap ok ok ok ok ok,_
buying other things,_
Originally order CR but no stock n got this one but no prob i ok je design ni pun cantik,_
My man loves it,_
"all well packed, with seal packed and ziplock after open",_
His former writer Sarina Mohd Som said he was never tired of teaching her how to be a journalist,_
Dia tk ketat very strectable thank you seller Kain cantik mmg tebal mcm kain mahal,_
Material:terbaik laju buat kije,_
Always satisfied with the quality and price,_
"PETALING JAYA: The controversial Taman Beringin solid waste project, which was alleged to have been directly approved by former finance minister Lim Guan Eng, was negotiated by the Barisan Nasional government in 2017, says Datuk Tamrin Ghafar",_
hermÃ¨zeeeee&quot,_
so nanti dah tau senang repeat yg saiz bersesuaian,_
okeyla kualiti sesuai dengan harga sebab dia macam plastik kalau pakai bnyk ii kali luntur gak ni so better beli yang mahal terus kalau nak pakai lama yah,_
"Random colour tapi saya request nak colour darkÂ², jadinya saya dapat hitam , blueblack , silver dan royal blue",_
pasang pada tv,_
"When we come back next time, QR codes both of us doesn't work, and we just activate it 10 min before arriving there",_
Alhamdulillah oder 2-3 hari dh samapi barang semua ok,_
puas ati!,_
Effectiveness:suda sampai,_
Kejohanan Siri E-Sports Malaysia sampai kemuncak,_
Faizul Ismail,_
kain blouse biasa,_
Boleh muat small size of wallet dan satu handphone,_
Thank you seller 2 times I ordered again,_
lelaki pon cantek jgk pakai,_
Quality:memang helokk,_
Starr Ooi ?,_
Repeating cust here,_
"60 (2 unit) spt yg di order tak dapat, dapat item lain",_
Just Nice la,_
A decent temporary fix until we're allowed to try clothes again,_
Taste:taste,_
sbb dua buka sme jns,_
00 hingga 9,_
Dengan harga 18 sen,_
so kalau nak,_
Kirimkan kepada 20 orang,_
"Bagi lelaki, hukumnya:",_
Memang terbaik servis seller,_
Happy ðŸ¥°ðŸ¥°ðŸ¥° collection btambah bli random nasib dpt yg blom ad ðŸ¤©ðŸ¤©TQ seller,_
Smpai rumah tanggal 4,_
thank you seller jual barang bagus,_
Tudung okay memang bidang 50,_
I like it because it is so spicy and sour,_
Sealed well for delivery,_
can be considered fast shipment from seller,_
"Penghantaran cepat,semua pakaian dalam plastik",_
6000,_
Good value with Shopee voucher,_
Taste:taste like vanilla,_
sesuai ngn sy yg berat lbhkrg 67kg tinggi 160cm,_
Selamat sampai terima kasih byk2 kepada seller,_
Seller tak bagitau ada reject pen,_
Skirt ok cantik,_
ðŸ¥°ðŸ¥°ðŸ¥° second repeat order dgn seller ni,_
It's actually quite small and the compartments are smaller,_
"Semua Okay, senang",_
that egg separator is so cuteee,_
Completed order,_
"Alhamdulilah dah sampaii, walaupon Kain 100 cotton n Kain tebal tapi tak panas",_
Product shipment speed and arrival speed are very fast,_
tp hasilnya cantik cuma tak blh nk matchkan dgn ikea punya compartment,_
"The original remote is longer with more buttons, but this has just the right buttons to use",_
extra,_
Comfortability:haj,_
seller pon cun,_
Barang serupa dgn gambar,_
Rasanya enak tidak sangit,_
kertas nipis,_
"A bit cheaper than going to shop purchase, now fmco is better to buy on line and free shipping",_
ni pelembap bibir yea,_
lega hati tengok fon dah ada screen protector,_
Tried to hit the back button nothing happen,_
"Received in good condition,Cheap",_
Ordered 30/7,_
"tapi barang semuanya cukup,tq seller",_
payment trus shipped out item,_
kna ambik 1 size lbih besar dripada size biasa,_
barang agak baik padan la dengan harga,_
tp kalau boleh sebelum post tu siap2 setting ye seller,_
I have ordered this soundbar should come in a couple of days I usually just have my soundbar connected to my TV by an optical cable and then my PS5 to my TV by hdmi - should I be connecting the ps5 direct to the soundbar or is it fine through the TV?,_
Kuantiti - terima seperti yg di order,_
Ohsem angat,_
ank suka tukar2 so kna beli buat stok byk2,_
but i just received email from shein that my oder don't successful and rejacted but grab already cut my balance and no notification,_
affordable pricing The colours looks nice,_
"Second buy from the seller, item received in the good condition",_
Lawa sangatt,_
Sedap saya pakainya,_
Taste:Good taste and it's very spicy,_
penhantaran pun cepat,_
Tq Seller for good job,_
ssuai bwk travel sbb nipis,_
gov database last month,_
"Haven't tested yet, but look promising",_
supportso fast so good la,_
Been cctv SSLINE29 for so long,_
Ok dpt sudh barngnya,_
"The 11 imported cases involved four Malaysians and seven foreigners returning from Saudi Arabia, Ireland, South Korea, India, Russia, the United States, South America, Britain and the Philippines",_
Beli kali ke 2 puas hati,_
"Be aware, this 3 len camera, it only record 2 camera video at any moment ( it only record 2 camera not 3 camera at once) edit feedback , i apologize,",_
nnt bole oder lgi,_
Penghantaran agak lmbt sikit la,_
murah dn sangat berpatutan,_
Terbaikkkkk maaf gmbr x de kaitannnn,_
Effectiveness:berkesan utk sakit pinggang,_
Material ok n can repeated order,_
Great service fast delivery my item was packed well overall good experience thank you thank youu,_
KECEWA SANGATT,_
Tebal n kalis air,_
pls rate me 5 stars for my effort in reviewing,_
Just good quality of small saiz of bag good recommend seller,_
Expiry 09/24,_
Quality:sedap sangat sedap sangat bileh repeat,_
"A total of 10,000 residents from 22 blocks initiated the project to show their way of celebrating the National Day",_
tp kt sini paling kecik 36 tp ok je selesa pakai,_
semua okay aja,_
diaorang sukaaaaaa,_
Totally functioned worth it as not required battery just need to charge if out of power,_
It looks strange and feels like something is missing if we don't put up a signboard here,_
baru berapa menit udah ramee wih parahh,_
Baju lama dah sampai baru nak rate,_
Harap xbuat hal la,_
Semua barang selamat diterima dan dalam keadaan baik,_
Tq Saller harap barang semua boleh on,_
smlm order arini dh dpt,_
Brg pon dbungkus dgn baik siap ada bubble wrap setiap coklat,_
:) gimmie $MENTION$,_
kali ni repeat 2 colours,_
Using a handwritten thank you note to express your gratitude is one of the most personal ways to show your appreciation,_
Easy to fix as well,_
Cepat pantas suka sgt2,_
Seluar sukan 3/4 diterima dalam keadaan baik,_
Minimalistic design,_
15 mins je bersauna,_
tapi video ade kene mngena,_
Recommended sangat for those yang nak simpan stock for family,_
"Fast delivery by JnT, the price was okay",_
affordable gilaa kot!,_
"Sorry,",_
Some of the vouchers are working,_
Barang dah selamat sampai dan barang berada di dalam keadaan yang baik dan sempurna dan kasut cantik puas hati,_
delivery so fast and thank seller,_
Gud materialðŸ¥° good value for money and the bracelets are pretty thankyou,_
Skt hati rse,_
"Thanks alot, received all in good condition",_
"Dah try yg cafe latte, sedapppppp",_
so senang kalau ade masalah boleh pegi vendor teruss,_
Full support Bhai logo amazing video ðŸ¤—ðŸ¤—ðŸ¤˜ðŸ¤˜,_
Mmg brg selamat sampai,_
"The seller, product quality superb",_
Penghantaran laju thanyou,_
Before this beli wrna putih kain agak kejungðŸ¤£,_
This app is expensive but they have nice things,_
"Mula print kabuk sikit, dah lame tu okay je",_
Kesan menyental watermark menjadi,_
warna dia nice as my expectation of bby blue,_
"The product is real picture, it's okay to subscribe, the store is trusted, thank you",_
Sesuai untuk saiz xl,_
"Kain mmg tebal, sejuk, selesa pakai",_
6 growth in the previous three months,_
Effectiveness:repeat,_
even without bubble wrap,_
Alhamdulilllah kipas dah sampai,_
Nxt time will repeat again,_
Sibu instant kampua premium packet with longer expiring date December,_
Delivery pun laju yamat,_
Pakai sudu utk elak berkulat,_
"Dua ii baju kurung tu dh sampai,",_
Ambil saiz yg biasa kita pakai,_
nak kena beli rak lain ni adoii,_
So far Ok laa,_
Effectiveness:Terbaik sangat,_
nk ok lagi,_
seller yg bleh dipercayai,_
baggy n ttup punggung,_
Good value for the price but the size is a bit small,_
For my sister actually,_
Alhamdulillah sempat sampai sebelum Raya dapat buat Raya,_
ini brg bru smpai smlm,_
The best of the best on Shopee!,_
Kualiti brg mmng padu,_
Purchase for the third time,_
"I know many of you are out there and you miss him and still wish to see his brilliance on the court, and what he was doing as a dad, Lakers great Kareem Abdul-Jabbar said of Bryant, who was the father of four girls and husband to Vanessa",_
Great quality for price,_
"penghantaran agak lambat, kualiti tu ok la",_
love ðŸ¥º,_
Kena ambik 1size besar dri slalu pakai,_
"Look good, packing and wrapping good, quality",_
Brgvtak ada rosak,_
"Tapi kalau saya pakai baju kelabu, kena ada baju di dalam sebab boleh nampak tubuh badan saya",_
Anak umur 7thn ambil saiz 8,_
"Best of best,thank you seller,barang bagus penghantaran laju,",_
tidak ada gratis ongkir nya,_
Mmg ok saiz dia,_
s Nerf Zone no problem thank you,_
Tapi barang diterima dgn sempurna,_
"Bajh slim fit AHAHHAA kalau kurus boleh pakai ye kalau boroi jgn buat malu mukaðŸ¤£ðŸ¤£ðŸ¤£ terhibur AHAHAHAH kain okay, harga okay, tq",_
Super thick bubblewrap so you dont have to worry abt damages,_
Quality:Cukup,_
Waterproof:sedikit waterprood,_
"non other better than grab, tq",_
Maaf gambar tak ada kaitna sebab bg hadiah,_
But very function and good!,_
Kata dpt free gift tp xde,_
