Sentence,Tagged_Sentence
Couldn't figure out how to tell it to print on one side of the paper,_
Next 3 day courier by jnt,_
Rasanya airnya seperti gula merah,_
so sy bg 4 bintang la,_
Ape ape pon design dia cantik jee,_
"kain bedung semua cantik2, tebal dan besar",_
"Size kasut slim fitt, biasa pakai size 39, tapi ni size 39 mcm size 38 agak ketat",_
Actually you can message or call before courier if you don't have the colour,_
Harga murah tp kualiti,_
All same type,_
Tekan on je astu dye terus boleh detect pencil tu,_
"The box is big, quite solid and looks nice",_
sebelum ni beli kat seller lain,_
Sandal quality so good,_
"Though i faced some issues during check out during the wknd,",_
Video sampin kena reject sebab blur,_
Terima kasih seller dan akan repet order lagi,_
Packing kemas siap buble wrap,_
Received : 26/10/2021,_
"all complete, received as ordered",_
Ngam2 untuk anak saya umur 4 tahun,_
"Inner dah sampai, delivery laju sangat",_
Effectiveness:good for self wear,_
Woot keplians !,_
Oh my Goddddddddddddddd,_
Got a nice smell,_
Kain sangat sangat laaaa terbaikkkk,_
order la,_
nnti repeat lagi tau,_
Terbaik laju sampai Terbaik laju sampai Terbaik laju sampai Terbaik laju sampai Terbaik laju sampai Terbaik laju sampai Terbaik laju sampai Terbaik laju sampai Terbaik laju sampai Terbaik laju sampai,_
s Jimin?,_
brg da sampai seperti yg d oder,_
Mask agak nipis drpd mask ada cop korea seperti dalam gambar,_
happiness to many peopleThat looks so good!,_
buy with voucher,_
dh 2x repeat beli kt kedai ni,_
"Terbaik, fast delivery, product in good condition, boleh repeat order lagi next time",_
Quality:barang baik tapi nipis sikit,_
jhitan xkmas bnng serabut,_
X sabar nk jhit bju raya,_
"Ismail Sabri yang ditemani isteri, Datin Seri Muhaini Zainal Abidin, mengenakan pakaian sedondon berwarna merah, tiba di pusat jagaan tersebut pada jam 11",_
9000 won),_
"Kali ke2 beli,tak mengecewakan",_
they've promised us a namjin vlive but prepared,_
Fast delivery well wrapped and good quality product recommended suitable for small condiments like sauces,_
Effectiveness:bagus banget aku sukaaa🤗🤗,_
ambik masa dalam 2 hri je,_
Thank you raket dah sampai!,_
"Taste good but the bottle like soft plastic one, if glass will be better",_
It's unlikely to be a game changer as,_
"Desas-desus menyatakan UMNO menawarkan empat kerusi kepada PAS dengan parti itu sebaliknya menuntut sejumlah 20 kerusi, adalah cerita lama",_
"Even though schools are not deemed a public place, it is indeed a place where crowds interact",_
Smellss good but does not last that long,_
"European tech moved in January in tandem with the Nasdaq index in the United States, which also registered its",_
Walaupun sedikit,_
Works like a charm,_
recomended sellerrr,_
Mesej pun respon,_
After waiting for 2 hrs,_
Lamanyaa bethol,_
Suit well with my 13 inch laptop,_
"Thanks you seller kasut en suami sampai dah,berbaloi harga, condition 5*****",_
Good value and taste,_
Cukup la tu kot,_
brg ok berfungsi dengan baik dan xder masalah,_
sape nk makn nasi kukus boleh Datang kedai saya sorry Saya promote sikit,_
I preordered this like a year ago from Sideshow and just yesterday got an email saying it would be delayed until May or June,_
i think yoongi posses jimin&$HASHTAG$,_
tali kena ikat sndri,_
"Barang original,trusted seller & cepat posting",_
The hybrid-powertrain trailblazer known for the Prius has acknowledged being a little bit late to fully electric models and that was four years ago,_
qualiti pun baik,_
cantikkkkkkk sesuai dgn harga,_
xnk pon komen ii nih,_
Can buy with discount voucher,_
x tau masalah apa skrg ni smua oder lambat smpai,_
"Barang sudah selamat diterima dalam keadaan baik, terima kasih seller dan j&t",_
"Received with thank,",_
Good good good 17/1018/103 ln 1,_
Super fast delivery o,_
"Hanya seller ni je yang boleh bantu,",_
and i like my pulls sm!,_
My family also like this stuff,_
Can't fit my dashboard,_
jam pon cantik juga,_
kualiti kainnya pun ok,_
dh 3 kali beli dgn seller ni mmg puas hati,_
Army opening the album very carefully so that it does not tear,_
Functionality:no stuck when pulling or pushing the drawer,_
"Back to , some Korean viewers found it odd that overseas viewers were so deeply offended by the white skin comments, especially when there was another scene in which another participant compliments a person with tanned skin",_
Tgh charging,_
ll take it :) $MENTION$,_
"Penghantaran Yang cepat, Ada karat sikit, berbaloi dengan harga",_
spai 16/11 kul 1,_
Item receive in gud condition,_
"Highly recommend this seller, fast delivery, will buy again in future",_
t have one,_
after TWO WEEKS I only received them,_
Tq seller shipping pantas,_
these bras are so comfy and easy to purchase bcs free size hehe the beanpaste colour is pretty btw !,_
"Period, Sanders wrote on Twitter",_
Mmg ori pastu metarial dia sedap,_
mmg hilang kedut cuma belom try kat kain tebal,_
"With the development of China's astronomy education and the space industry, there has been a growing interest in stargazing among Chinese people",_
I like it and worth the price,_
Saya amat berpuas hati dengan servis dan kualiti produk yang disediakan untuk saya,_
I always have bloated tummy & it's impossible to find clothes that suits my body,_
А ещё вкуснее яичница на сале,_
"bubblewrap tebal,tambah kotak keras",_
"Pasu nipis, lembut",_
Mmg akn repeat lg n lg,_
Fast delivery by seller with good packaging,_
harp sgt2 seller tukor syrikat kurier,_
Barut berkualiti,_
Kualiti product superb,_
Even the price is expensive,_
Nice momo,_
"Selain itu, Saifuddin menjelaskan pihaknya tidak menganggap jangkitan COVID-19 ke atas Khairulazhan dan Faisal sebagai ada unsur sabotaj serta tidak mengetahui berpunca dari mana",_
"Ordered on 7th Feb, received on 15th Feb",_
pembungkusan yg cantik nak beli lagi,_
"Terima kasih seller , barang sampai dalam keadaan baik bungkusan pun bagus takdelah nanti kena koyak dgan orang tut tut kan hahahah 🤣",_
"Sudah bbrp kali beli, mmg the best makanan Indonesia dn diantar dlm keadaan baik dn kemas 🥰",_
terbaikkk samyang tk pecah langsungggggg lovveeeeeeeee trurted seller,_
Si cute,_
TQ FOR THE FREE GIFT,_
"Fast delivery and the parcel was well-packed, will buy again!",_
baji cantik okay n saiz semua okay,_
Woot woot terbaik Woot woot terbaik Woot woot terbaik Woot woot terbaik Woot woot terbaik Woot woot,_
"Penghantaran yg sgt cepat,barang sampai dlm keadaan yg baik,cantik,selesa dipakai,ada surat lagi,tq seller",_
Eye liner pekat hitam mascara tu terbaik pnjg bulu mata saya,_
lembut weh suka sangat cuma lambat but its okay ha lan la weh wuh lepastu suka sgt lembuttt je,_
"548,000 views in an hour is incredible,",_
"korang should buyyyy,",_
"Those who still survey this bra, i think you should go buy",_
"A man came to try safe us, he got to flipped my son",_
Mayhwa Yuan kl banyak this type coffee shop,_
I can't use it at all since the check is implemented,_
beli 2set,_
a bit berat utk org yg suka card holder ringan,_
Berfungsi dgn baik tq anak pun suka,_
and 1 distance plus,_
ada yang kemek sikit tapi semua okay je delivery pantas mantap,_
"Great service, recommended",_
Kuantiti item cukup 2 pasang,_
"It is also important for them to have enough water tanks and electricity supply at these centres, he added",_
"Seller was very fast,",_
Seller post out size 3XL,_
Material:kain nipis tp selesa,_
I received very well,_
(RM9,_
my nephew like it very much as there is lightning,_
Ngam² dgn saiz,_
"Good packaging, good service, super super fast delivery, thank you seller",_
Cantik sangat n sedang2 besar,_
But i suggest size M is more better!,_
Mask ok la sesuai dgn harga,_
Bagi saya xmemuaskan,_
"Beli semalam, sampai hari ini",_
heheheh seller siap tnya dh terima brg ke belum,_
"Overall, meja okay la not bad",_
Happens everytime,_
It wrapped nicely!,_
Same as bought from the shop,_
Seller is nice and the quality is good,_
"COMPETITOR ACCESS Facebook bought Giphy, a website for making and sharing animated images, or GIFs, for a reported $400 million in May 2020 to integrate the operation with its Instagram photo-sharing app",_
"thank you seller even the delivery agak lama sebab guna ninja van, but its worth the wait 🤩",_
Quality:good produck,_
semoga kamurang dimurahkan rezeki,_
"Can take a shoe one size larger than usual, it will be more comfortable",_
Suction is good,_
yang mana murah tu boleh la kite beli,_
Cuma tak try zip dalam aje,_
Penghntr sangat cpt,_
Abang nak nombor telefon saya peminat nombor satu abang aqil,_
nti oder lain pulak,_
Never go to Thailand also can order with Shopee this price not much difference buy at Thailand,_
Harga murah drpd kedai luar,_
dn memang seller xsecure pun produk bubble wrap ke apa memang xade beli atas risiko berbaloii dgn hrga,_
Muat dgn anak 1 tahun 9 bulan+,_
"Pack with box n bubble wrap, arrived undamage",_
Dah smpai kasut raya,_
Tqtqtqtqttqtqtqtq,_
Terima kasih seller atas perkhidmatan yang bagus dan terbaik tapi dhl lmbat skit,_
"Effectiveness:Penghantaran terbaik,",_
5 offer day buying save money next time I will order from you,_
Tak sesuai utk budak sekolah,_
Those figures represent a significant hurdle for an athlete from a country where the minimum daily wage is about 176 Indian rupees ($2,_
The order received within 2days,_
"Dah terima,belum guna lagi",_
"Effectiveness:first time Cuba, beli terus 2 botol tahan sebulan",_
"Look for cybercriminals to take advantage of the shift to alternative digital payment methods, such as payment apps, digital wallets and peer-to-peer services, Velasquez said",_
"Kasut pun sesuai bukan untuk jalan-jalan naik motor atau kereta saja,semua",_
"Short trips in winter time should be avoided, especially if there are long idle periods in between, German auto association ADAC advises",_
Drivernya sigap dan cepat,_
Dl 2016 grab bagus tp d thn 2020 sampai 2021 kl LBH dr 2 hari ga BK aplikasi grab knp harus daftar LG daftar pakek no yg sama ga bs harus no yg beda dasar grab bagus ny d awal ajaa,_
"Bila anak² nak tema warna brown,khaki, unta, emak ikut saja",_
tali tak berapa panjang tapi tak apa lah sebab murah kan,_
Kain sedap pakai mak saya suka <3,_
Second purchase because the socks are good,_
"kabo nye ori , korg rse ?",_
Penghantaran pantas dan berkesan pembungkusan produk yang baik dihasilkan oleh syarikat,_
Nice packing and fast delivery and nice products quality,_
Nur Fariha padu maggi dia,_
barang boleh guna dan berfungsi tapi tak semua channel dapat,_
sorry gmbr tak berkaitan sbb nk kmpul coin,_
Original from panasonic,_
Rather to spend,_
"Much love, k",_
Nk beli satu lg,_
Effectiveness:saya terima kinoki sahaja,_
"Wow , so cute n worth to buy",_
Ya allah cepat gila sampai,_
"nak kawin dengan Tan sri Jeon Jungkook boleh,",_
Maaf x dk kena mengena,_
Tottally semua mantap bohh,_
"Gooooooooooooooooodddddddddddddddddddddddddddd,",_
"Dia punya pengikat tu pendek, sepatutnya bagi panjang sikit pun takpe",_
Terima kasih dgn brg sampai cepat dan free gift yg diberi,_
Kainnya lembut dan ringan,_
warer proof ni,_
"Barang dh selamat sampai, Penghantaran cepat dan pantas",_
sygnya yang warna putih tue boleh masuk sekerat pale ajew jep,_
harga barang baik dan penghantaran yang pantas,_
Barang pun baik cantik cun mantul terbaik,_
Material ok lah setanding harga je,_
insyaallah kalau ade rezeki lebih nnti beli lgi kt sini aminn 🥰🥰,_
"I thought it was a bit big, it seems like a waist bag, but it's okay, the one that is wrong is just the expectation",_
Really worth it with the price,_
1pcs skru - tiada threaded,_
Jenis getah so kalau nak beli kena pilih size besar dari size biasa pakai,_
Berpatutan dengan harga and u know this case cuma satu ringgggitttt,_
I've received this item in a good condition // suka sangat cute,_
Beli je okay,_
sorry gambar dan video tidak berkaitan dengan barang,_
Boleh la pki,_
i literally just subscribed to digi by buying rm28 for 1 month in about a few days ago,_
"So far so good, 0121 manufacturing date",_
"Kain lembut and sejuk, fast delivery, will repeat again in the future",_
Get free gift short,_
Byk kali dah repeat pampers dgn seller ni,_
Omggg cantik gilaaaaa n selesaa gilaaaaaaaaaa beli la guyyssss saya beli sbb nk berpantang nt walaupun blm kawin lagi ahahagwgwgwgwgwgag,_
beli aje minyak angin,_
ni dapat apa yang saya minta,_
Functionality:ok sangat lps ni x dh la penat sngt nk elokkn cadar lps bngun tdor,_
dalam gamba,_
"However, KAB's share price has declined by some 62 since August to 34 sen each",_
maybe i will repeat and buy here againnnnnnn,_
JOHOR BAHRU: Jumlah mangsa banjir di negeri ini semakin berkurangan apabila hanya 309 orang daripada 89 keluarga ditempatkan di sembilan pusat pemindahan sementara (PPS) setakat jam 8 pagi tadi,_
Tracksuit dalam keadaan baik Dan tiada apa apa yang rosak,_
Twitter: $MENTION$ I&$HASHTAG$,_
semua baik belajaaa warna cantikkkk,_
Bolela guna tuk sarung bolster tetamu,_
"Effectiveness:ok, boleh digunakan, air pun kuat jgak la,",_
I hope thatvthey will fix this,_
Takyah nak beratur lama-lama dah,_
"Safely arrived, penghantaran quite fast",_
i think this is the 6th or 7th purchase in this month,_
Taste:shortage 1 botol but still give 5 stars because seller very good,_
Respond pon laju dari seller,_
"Memang paduuuu,",_
"overall semua okey,",_
"Secara asasnya, sebelum layak menyelam di lautan lepas, penyelam skuba perlu mendapatkan lesen asas iaitu Open Water Diver Certification",_
яйца - пашот,_
Okayylaa kotI tak try lagi but my little sis suke je,_
brg premium,_
Blum guna lg n penghantaran pun ok,_
Terpaksa beli dua kali sbb tersalah bagi link🤦‍ tapi apa2 pun seller memang terbaik sbb reply chat cepat,_
"Thank you seller,seller pun baik tolong guide kan mcm mana,dan apa perlu beli,apa apa patut tanya dulu utk pastikan ya,semua barang smpi dlm keadaan baik",_
Fast and easy service,_
cantik sangatt boleh buatt byk style,_
"Value for money , will definitely introduce more and buy more if got better offers",_
Cuma Sangat² besar Untuk saya Yg tinggi 156 berat 88kg nak beli saiz lagi kecik,_
material xtebal sgt xnipis sgtt,_
Banyak kali dah repeat order from this seller,_
now no,_
dpt mcm yg d oder,_
Terima kasih bagi baucar,_
baju pn sedap pkai wlupn kain nipis ckit tp pdan la dgn harga kn,_
"Beg okay, material okay, sama macam dalam gambar",_
size chart acurate for 3xl just nice,_
Kuality padu,_
also dpt freegift tau hehehe,_
harap2 memuaskan hati anak-anak,_
Warna pon terang x pudar,_
"penghantaran cepat, tapi dilambatkan oleh j&t",_
Good quality and secured packaging,_
pape pun sdap sngat tambah2 lagi mkn ngan nasi panas,_
dah banyak kali beli seluar kedai ni,_
service by seller is good,_
Bosan sering abgraet,_
Barang sudah sampai penghantaran laju terbaik terima kasih saya beli ya,_
Buyers should expect this from the price offered,_
Dapat dlm masa 5 hari,_
Amik 1 saiz lbh besar,_
Not in my BLUR Me:🥺🥲,_
Ingat kecik so beli 2,_
"Inisiatif ini telah dimulakan di Iskandar Malaysia menerusi pelbagai inisiatif termasuk Masyarakat Rendah Karbon menerusi kerjasama erat pihak berkuasa tempatan (PBT) selaras dengan matlamat yang digariskan di bawah Matlamat Pembangunan Sosial (SDG), katanya dalam kenyataan, hari ini",_
S love the vids man,_
ps:video dn gmbar xdakaitan,_
kalau nak beli baju ni make sure twice bigger than your sctual size and material is polyester,_
"Keempat, bagaimana peranan sektor industri kita memanfaatkan pemegang PhD sedia ada?",_
I really love this mascara bcs it's easy to apply bcs it has small brush,_
Better beli yang quality bagus lagi,_
saya suka sangat,_
"semua cukup, packaging sangat tiptop",_
Sudah beberapa hari tidak upload,_
usha shopee shop saya hohohohoho,_
"Beli UTK suami,kain best padan dengan harga",_
Jack Ho Wei Gie,_
Sangat murahhhh,_
Anak selesa sangat pakai,_
Overall terboekkk,_
Kasut keras dan nampak tinggi,_
I bought the wrong sizestandard +30 and standard +40 luckily +40 is come with 20cm x2,_
Hmmm will reapet again soon,_
And instructions are in Chinese!,_
‍‍$MENTION$,_
Sorry pictures are not related just collecting coins tq,_
TOLONG LA BUAT KEJE TO BIA AMANAH SIKIT!,_
"Barang yg di terima memuaskan, lembut , berkualiti dan sesuai kerja- kerja di site",_
Hahahaha ingtkn mcm kain lampin gebu tu,_
seller was very helpful and accommodating throughout the process,_
25 Aug Payment,_
"Tmpat yg susah nk capai time ketip bulu mata tu xdak masalah klw pakai jenis ketip ni,",_
John Wong,_
"Quality:Product quality is not bad, recommend to all and thank you so much ya seller",_
cantikkk thankk u nt i repeat lagiiii tk lembut tk keras bestt pakaiiiiii,_
Mcm mcm gaya boleh digayakan,_
kain elok cantik,_
"Barang ok, wrap dengan baik",_
Less than 4 days received from order,_
cuma bj agak singkat,_
TerbaikkkkkkkkkkkkkkTerbaikkkkkkkkkkkkkkTerbaikkkkkkkkkkkkTerbaikkkkkkkkkkkkkkTerbaikkkkkkkkkkkkkkTerbaikkkkkkkkkkkkkk,_
"Im not trying to sabotage this company/product, but Im giving honest review",_
Hal yang bisa merusak pahala puasa,_
Barang sampai terus anak main,_
Her last post was about turning 32 on her birthday on Jan 23,_
Pos pun tidak ambil masa yang lama,_
"thin and cooling fabric, a bit see through but still acceptable",_
Ordered on 7/11 and received on 14/11,_
Brg dlm kdaan baik,_
itself for haemodíalysis and must be diluted,_
"MEMANG BESTT ,",_
Jika saiz 2xl ni mmg elok ngan berat 74kg tggi 161,_
Try a few and it works,_
Item received in good condition but the seller have to improve the packaging,_
"Baru guna 6hari dah nampak perubahan, rambut ada kurang sikit gugur",_
Safely arrived Good condition Trusted seller Very recommended,_
suggest seller do some protection before ship out,_
okay2 je,_
beli buat jualan kedai runcit,_
balut dgn buble wrap,_
Effectiveness:Sngt Wangii,_
Received parcel in good condition and short turnaround time,_
Functionality:i use it for my shawl,_
corak cantik dan terang,_
"Barang sampai dengan cepat tapi lambat review sebab sibuk sedikit,apa pun baju semua ok,elok padan dengan harga tq seller",_
wow wow wow wow wow wow wow wow wow wow wow wow wow wow wow wow wow wow wow wow wow wow wow wow wow wow wow wow wow wow wow wow wow wow wow wow wow wow wow wow wow wow wow wow wow wow wow wow wow wow wow wow wow wow wow wow wow wow wow wow wow wow wow wow wow wow wow wow wow wow wow wow wow wow wow,_
"Pembungkusan yang baik, siap bubble wrap",_
Hari Raya,_
"BAJUU SUMPAHHH LAWA CAM DLAM GAMBA ASTU MURAHHH,KAIN BAJU SUMPAH BESTTT ,POSTAGE BAPAK LA CEPAT SMLAM ODER HRINI DA SMPAII SNGAT BERPUAS HATTIIIITQ SELLER",_
Wraping satu2,_
kena bukak casing phone dulu,_
Banyak sold yang cantik cantik tu uhuks,_
better the seller have be honest when do business,_
Xckup staff agknya,_
Really great value for money!,_
barang selamat sampai dan sangat selesa bila pakaii,_
"The government expects gross domestic product to expand 4 to 6 this year, although growth could exceed the upper end of that forecast",_
Don't forget to restock the tuna,_
Barang mantap mantap mantap mantap mantap mantap mantap mantap mantap mantap mantap mantap mantap mantap mantap,_
"tested & working ,",_
WAYMO'S ROADSIDE ASSISTANCE,_
Mantul seller barang dah sampai dengan selamat,_
"item wrapped in plastic bag, reached in good condition, cheap to buy during sales",_
52 bilion saham bernilai RM2,_
Harp semua berfuangsi dgn baikk,_
Edmond Yong hahahaha,_
"Item received in good condition,and functioning well",_
but engraving named,_
Alhamdulillah memuaskn,_
94 trillion,_
Do you still have your Pixel3?,_
Good seller terima kasih sbb pos cpt nk gne raya hehe love u lah boss,_
But still consider ok,_
boleh berbaikki,_
"To be honest in my opinion, without offending anyone or being condescending, and without triggering anyone, i just wanna say i got nothing to say",_
I love gadgets of all kinds,_
Lawa bossku!,_
beg okey kain okey aja,_
be/jjxBEc_MJFA,_
Bola dia pun best,_
sangat kecewa sebab dapat courier shopee express,_
"memang trusted , delivery laju , siap bagi sarung simpan pen lagi",_
lain kli i repeat lg taw,_
"Minimum price, the quality is very best",_
I have been using this for a year,_
tk mcm beras besa guna,_
Nak tunggu boyfriend lanje hmm lambertttt lagiiii,_
design mmng lawa simple je mmng recommend,_
"Barang selamat sampai, order jumaat lepas, hari selasa sampai, memang cepat",_
"First of all i would like thanks Nukilan Biruni for deliver the items and accept my request to proceed with postage a bit earlier, appreciate it lot!",_
///////////////,_
Penghantaran sepantas kilatSudah test boss,_
It is quite big for a petite / xxs girl like me but comfortable to wear,_
RM0 MySejahtera: Sila semak butiran temujanji dos penggalak vaksinasi COVID-19 untuk No K/P berakhir 5278 di MySejahtera,_
Semua okay and cantik,_
9070 Notary Papers Sales Price,_
Letak kolam atas strip biru 3,_
"PBD TP5, TP6",_
The start of next year's Tour was brought forward by six days to avoid clashing with the men's road race at the rescheduled Tokyo Olympics,_
"As for tab, So far so good",_
"Nice quality very soft material, comfort to wear n the price oso reasonable will order other colour again",_
terima kasih tereeeerbaikkk,_
Tq seller fast arrgmnt,_
Puas hati dengan produk dan bungkusan dari seller,_
"Tak sampai dua hari dh dpt, laju pghantaran",_
udah terima baju ujan teman,_
High quality template thank you so much for helping :)))))),_
mmg repeat byk kali dah,_
packaging not that good this time compared to the last delivery,_
Wow cantikk,_
Date ordered: 25/08/2021 (afternoon),_
xtry lg muat tak tuk ank umo stahun lebih,_
sampai je adik terus pakai buat kerja,_
Senang ada shopee supermarket,_
vacum perfectly,_
Nak guna nanti dalam pantang🤭,_
25 hb order 27 hb smpai,_
Gak sesuay dengan watne sye pesan hitam putih brang sampay putih hitam,_
The only downside is that Gaabor does not have a physical store in Malaysia and any complaint has to deal in shopee chat group,_
"Functionality:sangat bagus, dibungkus dengan bubble wrap yg sangat tebal",_
anyway i complete by myself already,_
Thank you seller for fast delivery and proper packaging,_
Cantikk sangat warna biru ni Nampak ala ala hipsterr gittewww hehe Sangat berbaloiii worth it !,_
Kolam ok tiada bocor,_
"Safely arrived product package well,",_
Order hari Selasa,_
We'll wrapped with bubble wrap,_
"harga pun murah,terima kasih ye saya beli",_
Brg sampai cpt tq tebaik kedai nie chat pon cpt blas nie oder yg ke2,_
Dia fit just nice & cantik!,_
Ok so hoodie ni dh lma dh dpt tpi tulaa bru dpt hidayah nk review hufufuf so yeahh,_
Ddddddddddddddddddddddddddddddddddddddddddddddddddddd,_
Penghantaran sangat pantas and packaging secure siap bagi sticker fragile lagi huhu,_
"Barang sampai cepat, seller update barang cepat",_
Ia penting dalam memberikan input bagi tujuan pembangunan yang bukan hanya untuk kepentingan mendapatkan pulangan hasil kepada kerajaan negeri tetapi memastikan pembangunan terkawal sekali gus dapat melestarikan alam sekitar,_
Mcm biasa penghantaran super laju next time mestilah order lagi tq seller,_
"A bit big for my spac, but still can use",_
kalau ada kasut kotor/kuning tu try lah beli memang berbaloi dahlah murah penghantaran pun pantas semoga murah rezeki slalu🤲,_
Alhamdulillahthank youuu,_
selalu repeat order dari kedai ni dan penghantaran sangat sangat cepat,_
delivery on lju,_
OK wor,_
Seller folded the bag when packing causing the bag run out of shape,_
com/world/europe/finlands-prime-minister-was-nightclub-after-being-exposed-covid-19-reports-2021-12-08 her night out short after finding out she had been exposed to COVID-19 the day before,_
Will repurchase because you earn my trust,_
"Berat 74kg, 151cm",_
sudu pun chomellll je,_
Overall good quality video and detects motion,_
"Kecewa oi,",_
Frozen when sharing a product,_
tp ade 1 bra tu tali dia psg terbalik,_
Tapi takda panduan,_
Selesa untuk diguna,_
kekalkan service macam ni,_
nanti nak repeat lagi kain mmg mantap thankyou lembut caktikkk,_
No mood,_
Itik sudah sampai,_
Delivery: Slow (took almost 2 weeks+),_
Ini kli k2 saya bli,_
Cantik sgt tudung budak lazy ni,_
Wipes pon elok,_
Hanya 4 lai jer muat,_
Selalu bermanfaat,_
11 dapat rm5 sepeket,_
Lepas ni pasti repeat ordee !,_
i give 5 star now then,_
$MENTION$ Please god let me win this one thing 🤞,_
Life has a 100 mortality rate (and we are now nine months closer to death since the pandemic began!),_
tapi ada contact seller nak tukar warna,_
Very nice scent,_
I've received my cotton buds liptint alreadyyy might try each of them soon,_
"Size pun ok, tak singkat & tak labuh sangat",_
Sesuai sangat untuk kanak kanak,_
its black not greyish black,_
fast ship out fast delivery Thank you,_
With doorables specialty packs you get all 12 and if you're lucky plus a bonus so you will get 13 they don't switch out figure for the mystery So only 12 and if you are lucky 13 figures So one door will have two packs,_
Received free 1 year kaspersky Internet security,_
with this seller,_
tak lah lambat sangat,_
lepasni dah tak payah 24/7 hadap buai,_
twitter handle: $MENTION$ thank you,_
Everything okey Thankyou seller Will repeat again,_
Gambar takde kena mengena tp barang kualiti,_
Cable blh guna,_
2021/ 07,_
Tapi still stuck,_
"Gambar tiada kaitan, brg selamat sampai dgn kotak",_
5 bintang ok,_
Terbaikkkkk 🤲🤲,_
Quality baik sgt,_
Kain serap air senang nak lap sesuai untuk baby sebab kecik comel je,_
"Good product, fast processing and delivery",_
Nothing is new,_
beli kali kedua dkt sini,_
Service tiptop from this seller,_
