Sentence,Tagged_Sentence
If u want to boost ur tosteteron this can help,_
Cuma pelikat camera tu tak kuat asik jatuh je,_
for other colours,_
"senang guna dekat muka ,high quality product",_
service laju sekali,_
Tq seller pantass,_
Nak repeat hitam dgn light blue,_
"Sedang elok je saiz baju ni, saiz L okay cun material bestttttttt pengeposan pun lajuuu",_
okay jaa nak pakai pgi kelas for students,_
takpola,_
"haritu dh grab color grey dgn skin, skrg tambah purple",_
"kasut selamat sampai,memang cantik gila,beli utk anak",_
Cantek warna itam,_
elok je pki saiz M cuma lbh dikit kena potong,_
Yang pasti quality jumsuit dan service dari seller sangat baik,_
Terima kasih seller and and ninja van,_
Kain tak berapa lebar sangat (40 inci) so kalau terlebih kangkang boleh nampak kain dalam 🤣,_
6k Rate4,_
"Good value for money and fast delivery service, thanks for the sellers",_
Kalau boleh jangan beli mcm ni,_
color a bit different than the previous fabric that i,_
Cuma penghantaran lamabt sikit,_
is priced at RM240 and is available on major e-commerce platforms,_
Very quick and fast delivery!,_
Aaaa mcm nak beli semua color,_
"The resistance generally employs hit-and-run guerrilla tactics, to which the army often responds with brute force",_
x suka wrna trag2,_
boleh guna terus sbb bateri pon dh bg,_
Nice but definitely not healthy,_
dan cuba sekali lagi,_
Item receipt in nicely packed parcel,_
Corak dan design yang menarik,_
"PORT DICKSON: Ahli Parlimen Pasir Mas, Ahmad Fadhli Shaari, dipilih sebagai Ketua Pemuda PAS yang baharu bagi sesi 2021-2023",_
- Foto e-mel,_
May you always success !,_
Barang semua okay xde rosak semua boleh guna,_
Totally satisfied with the service!,_
I rate five stars for this seller,_
"In Kelantan, the number of flood has dropped slightly to 814 people from 258 families at noon, compared to 974 people this morning and all are at five relief centres in the Pasir Mas district",_
"Okay la, nipis, tetapi padan dengan harga, boleh beri 5 haha",_
Penghantarannnn cepattt thanks youuuuuuuu sellerrrrr kualitiiiiiii memangg okay,_
"Effectiveness:ok laa , baru sekali penggunaa , nampak mcm ada perubahan",_
"i just bought some subscriptions, but i got nothing from that",_
Cover je kemek ckit yg lain semua cantik jee,_
"my 5th time purchasing from this seller bcs this is the only wetfood brand that my cat likes, plus the expiry date is on 2024",_
"The items are suitable, very good and safe, thank you",_
Tebal sejadah ni,_
"Barang dipacking dalam kotak, takde sebarang kerosakan",_
"Received it ,",_
You are wonderfully made,_
takde kotor pape,_
Dah jumpa kedai murah,_
saya jual makanan korean,_
Alhamdulillah cpt sgt sampai,_
"Penghantaran super laju , barang nice , terima kasih bosku",_
Amek 1size besar dari biasa,_
🧿 $MENTION$,_
Both working out well,_
I am not sure what to write here bcuz I'm just doing a task sent by the seller to get a lifetime warranty and that's of course,_
job market data triggered another bout of dizzying trading,_
No doubt about the originality,_
Tak sabar nak novel yang ni pulak,_
Beg coklat tak ok,_
"Kualiti cm harga mahal, tp murrr jer",_
kuetiau konjac ni mcm kenyal and degil gitu ye mee tu buat spaghetti tunaa sedaapp sangat mcm mee biasa tp dia keras sikitla compared yg biasa,_
now i stay in cyberjaya also got problem with coverage,_
I like it so much affordable and good quality,_
Of course akan repeat Oder dekat sini,_
Nescafe Dolce Gusto (chococino)- chocolatey taste,_
"Pembungkusan parcel memang mantap, penghantaran pun cepat",_
Recommend to buy if you don't wish to spend so much,_
Comfortability:X nipis x tebal,_
tanya soalan reply pun mcm tak puas hati bad service,_
Lagle ami alada tv kine saradin add chalay rakbo,_
4 device guna ok je stabil,_
pada perempuan iaitu *IBU*,_
Recommended seller boleh repeat order,_
Very fast delivery good product and price also very resonable,_
Dasi buleulsu eobseul geos gata tto hanbeon bulleobone,_
Dddhhhhhh pppaaaaakkkkaaaaiiiiii bbbeeeesssttttt bbbbaaaauuuuu,_
btw sorry gmbr tkda baju tengah basuh x sabar pakaii,_
Dah sampai Tapi kecewa takde kotak!,_
"Beliau berkata, seandainya kerajaan boleh memberikan bantuan tunai yang mencukupi dan secara berkala, pengeluaran dana persaraan ini sememangnya tidak diperlukan",_
Jahitan kemas ie double stitching cuma material quite questionable not exactly 100 cotton more likely cotton plus polyester,_
"hope it'll work for 6 months, thank you seller",_
Habis koyak nantinya,_
Sebaiknya ke depan ada fitur konfirmasi untuk pemotongan biaya tambahan melalui ovo agar kejadian ini tidak kerapkali terulang,_
so far okay la ingat dapat wrna nude hitam putih rupanya tak HAGHAHAHAHA beli yg mix okay la murah 50 pcs tak sampai RM20,_
Good job seller dua hari je masa untuk hantar nak pasanh pun sgt senang,_
All time favourite noodle,_
Dn terus suruh pulang brg semula,_
Thanks seller like it so muchhh~ good material & quality too🥰🥰🥰 very cheap buy at here,_
"However, you still need to get it checked, said Prof Ong",_
"Belum try, sampai cepat, bagus, terima kasih ye",_
"Punya mengidam bini aku nak makan makanan mcm mre ni, haish mujur jumpa makanan ni, nanti nak try sedap ke tak, btw terima kasih Allah, terima kasih seller, terima kasih semuanya",_
Harap2 tak bocor kalau hujan lebat,_
His father Srdjan said last month that Djokovic was unlikely to play and described the vaccination requirement as being akin to blackmail,_
Alhamdulillah kasut dah sampai dalam keadaan yang baik !,_
Mmg pantas delivery packing mmg terbaekkk dan berbaloi beli kat sini murahhh brgnya tq seller very good seller,_
Tqtqtqtqtqtqtq tqtqtqtqtqtqtq tqtqtqtqtqtqtq tqtqtqtqtqtqtq tqtqtqtqtqtqtq tqtqtqtqtqtqtq tqtqtqtqtqtqtq tqtqtqtqtqtqtq tqtqtqtqtqtqtq tqtqtqtqtqtqtq tqtqtqtqtqtqtq tqtqtqtqtqtqtq tqtqtqtqtqtqtq tqtqtqtqtqtqtq,_
3 hari dah dpt 1g2w,_
Design:Warna ok la,_
"Both clothes fits me perfectly, the material is not hot but I think kena baju with inner because baju ni jenis melekat dekat badan and kalau peluh, it is visible overall 5 stars and will repeat it",_
"kl x,kosong sgt rsnya",_
"T , so I&$HASHTAG$",_
Next time boleh mark dengan marker sikit kot setiap jenis perbezaaan,_
Products received in good condition and fast,_
"Browse from a great selection of gastronomical delights from Lemon Garden, Zipangu, Arthur's Bar and Grill, Lemon Garden 2Go and Shang Palace",_
ok thanks dh smpai,_
"popcorn sleeve really worth the hype gais sumpah best,",_
berbaloi dan murah 🥰,_
barang pun boleh gunaa,_
Magnet lekat okay,_
Nampak elegan,_
The cheapest price I've bought RM41 for 2⃣!,_
This MAGGI Hot Cup Curry (59g x 6 Cups x 2) very good,_
overall semua it oki🥰,_
Repeat order ngan seller sebelum ni,_
Rasalah ketupat ini,_
PETALING JAYA: Outstanding Malaysian students who lack the financial means to study at Cambridge University in the United Kingdom will now have an opportunity to do so,_
He said transit passengers will not be allowed to enter Vietnam,_
Hope it works and give a new effect,_
I give 4 star due to the mouse i receive had defect (refer photo) that i need to attach back properly,_
"The protector is thin, but i like it",_
"According to SoftBank, this power, which has a range of about 10 meters, will be completely harmless to health",_
Dengan penyertaan generasi,_
Recommended seller ni kalau boleh dah bagi 10 bintang hahaha,_
thanks for youfastdelivery,_
tiap 2 bln order,_
Cantik sangat2 laaa,_
Bila sampai memang nampak besar,_
the curry puffs from here and the pickled onion,_
tgu span sampai dlu,_
Bosqu terbaik barangnya saya sangat puas hati mantaplah,_
"Relatives of Tang Jitian, a human rights lawyer who vanished last month en route to an EU Human Rights Day event in Beijing, told AFP they believe he is being held under a form of secret detention commonly used against dissidents, possibly in his home province of Jilin",_
Keep ask me to log in but still didn't show the second phone number,_
Sangat sangat kecewaaaaaaa,_
Tq seller n shoppee too,_
"Order & seller posted yesterday, received today",_
Less than 5minutes,_
Laptop size 342,_
parcel received within expected time frame and in well packing thank you very much seller for your service,_
material rasa mcm plastik jee (plastik keras),_
masa smggu lbh jgak,_
Nmpk tahan,_
Mask semua bgs berkualiti,_
tak tahu lah tahan ke tak besi tali dia tu,_
takde koyak or stain apa apa,_
Done sub,_
alhamdulillah smp dlm keadaan baik 🥰🥰🥰🥰🥰🥰🥰🥰🥰🥰🥰🥰🥰🥰🥰🥰🥰🥰🥰🥰🥰🥰🥰🥰🥰🥰🥰🥰🥰,_
Senang bawa pergi jenjalan,_
More of everything! TW: $MENTION$,_
"Nice packing, received with good condition",_
contoh baju xl kena ambik M,_
Ok barang okay dan dalam keadaan baik and selesa,_
Barang cun semua lengkap siap pasang dah fungsi dengan baik gambar jelas tinggal test malam pulak,_
The only good thing about this app is the delivery fee,_
Thanks for the intact parcel,_
"keadaan yang baik, harga yang sangat murah sebab beli time offer",_
lama teringin mkn,_
"Material is rubbery, colour is nice",_
dihantar menggunakkan kotak,_
highly recommended seller and thank you seller ^_^,_
"Coins worked, good qualities shell, and printed prettily!",_
"But one chip executive, who spoke on condition of anonymity because he is not authorised to talk to the media, said the industry has long worried about Taiwan's limitations on land, water and electricity",_
Mntp beli beli murah sgt sgt okey recommmended uhuuuuuuuuu,_
"12 sale,",_
12 buy buy buy,_
Link :dapatfreeongg,_
Sbb kain elokk,_
Rcvd in good order,_
"2nd buy,delivery's very fast & quality very good",_
Quality:Okay sesuai dengan harga,_
terima kasih banyak2!,_
mmg frust gilerrr,_
Seller should wrap it with bubble wrap next time,_
"Suka la baju dia, cantik kawan² pun tanya beli kt mana so I suggest kt kedai ni",_
"Positive photos of customers using your product or service or displaying it in real-life situations demonstrates an extra level of effort that not only proves their loyalty to your business, but it allows other consumers to see your goods in action, which can help them make informed shopping decisio",_
"A good example is when slavery was abolished at the beginning of the industrial revolution by giving rights to the workers everyone thought this would be a disaster, Italy-based asset management company Etica Sgr's chairman Ugo Biggeri tells StarBizWeek",_
Mostly tk boleh guna but this one can,_
🤣🥰🤣🥺🦶🥰🤣,_
"Thankyouuuu sangattt berpuas hatiii delivery pun lajuuuu,",_
Mmg cun ii kat badan,_
Poor quality of product,_
Barang dah sampai terima kasih seller Penghantaran yang pantas puas hati,_
smga trus mju Jaya,_
Tapi product boleh guna,_
Barangan diterima dgn selamat dan keadaan baik,_
"They would contact potential victims via WhatsApp and use bank accounts of other individuals to run the scam, DCP Mohamad told reporters yesterday",_
ntahhhlaaaa,_
Maaf video tiada kaitan hehehe,_
Has tried it out,_
Dah sampai seluornye,_
Received as a picture,_
"WITH bated breath, management at Samsung Electronics is waiting to see if the conglomerate's leader, Jay Y Lee, will be released on parole this month",_
"Selamat sampai dalam keadaan selamat,penghantaran pantas dan pantas dan pantas dan pantas dan pantas dan pantas dan pantas dan pantas dan pantas",_
well function and very nice to use,_
Brush so cute and so soft,_
Shipping lambat sbb dr obersea,_
"Hi Seller,",_
s 4k,_
bersesuaian sangat dengan harga,_
The necklace so cute,_
"Fast deliveryorder semalam, harini terus dapatmurah gilerrrseller baik🤍dya bagi warna purple which is my favourite colourdefinitely will buy again🥳thank you sellee and j&t",_
Biasa lah dari China lambat sikit sampai dalam seminggu,_
cuma baju ada bau sikit🤣🤣🤣,_
and also can adjustable very recommend,_
nak buat surprise birthday gift utk anak 20/11 ni,_
Effectiveness:tak pekat sgt gel noh,_
the material of jeans also soft n very recommended,_
$MENTION$ Daammm i wnt thisss,_
Very Fast and good service!,_
Seller pun sgt mmbantu,_
"Hobi: You can open it with your teeth Jimin: No, I don't want army doing anything dangerous proceeds to put on the biggest smile He is so precious",_
Anyway delivery is fast!,_
Tq seller for the fast arrangement,_
I play for a while before giving to my niece,_
Merata2 letak kipas,_
pandan chicken got heavy raw chicken smell to be exact the food is not worth the price,_
Will try other soup later,_
"Baru instal Apk nya mental2 terus,",_
Ok la brg selamat smpai,_
Anyone want to buy hueningkai mess full set can find me in ig $MENTION$,_
The colour very beautiful🥰,_
Ok setanding harga pakai sementara je nak tutup cela kt mata,_
barang sampai ke sabah dlm keadaan yg baik,_
"Selain tu, Morrison turut menyenaraikan sembilan teknologi kritikal yang akan menjadi tumpuan untuk pelaburan, sambil berharap dengan kepakaran itu ia akan membantu 'menegakkan tradisi demokrasi liberal negaranya' dalam apa yang disifatkannya sebagai era persaingan strategik'",_
tp 3 hari guna dh xbrapa nk bau walaupon sehari guna buka tudung sikit je,_
sambal tempoyak ok,_
Quite pricey for black and white book,_
Berfungsi dengan baik dan elok,_
received item and good packaging,_
Nasib baju ok,_
Harap dapat kekalkan dalam memberi harga berpatutan,_
Beli 2 kali,_
warna oak tu mcm dark sikit drpd gmbr,_
"Kualiti memang terbaik, tebal dan sangat selesa",_
? What kind of crap is that?,_
Your system doesn't work properly as well as your management,_
"For admission into specific schools for 2022, application to enter Form One can be accessed at spskt1",_
"Neway, thanks seller!",_
Fast good nice and great item,_
tak rugi beli 2 terus,_
Yes it is nipis,_
packaging so far okay,_
Baju dah sampai awal,_
Always fresh and fast delivery,_
Topi nie dia punya depan besar,_
"Product received in good condition, fast delivery, order on 7/9/21, received on 9/9/21",_
"S10 in comparison to the bag size, multi compartments and free gift",_
"terbaik, packaging okay topi cantik semua okay ah terbaik terbaik",_
Sesiapa nk young living bleh roger2 i,_
"The Austrian is seeded second at Flushing Meadows in the absence of Rafa Nadal and is expected to pose the strongest challenge for top-ranked Novak Djokovic, who beat Thiem in a five-set thriller in this year's Australian Open final",_
The bag look simple and great,_
"Kasut cun, saiz ngam",_
slegesbssmwnajejeekasmmamama anamama a a a anamamamamamakahsuahaja,_
Later might repeat order,_
Picture n video not related but the dress was really nice,_
"DigiBos messages me and say that there are box of surprise for me but when i press the link i can't find the package,",_
Anyways thanks seller,_
Item cantikk,_
"cantikk jeee , nampak macam garang sikit hahahahah thnkyou seller",_
"terbaik, boleh guna, takde masalah",_
"Quality:10/10, expired date lama maggie still in good shape",_
Tq for free tea beg,_
"Tested, works and functioning",_
Thank you seller for great products and immaculate service!,_
Barang panas!,_
adoooiiiiii,_
xmnyesal ambik 6helai,_
Quality:Box Broken,_
Must have sunscreen,_
Lepas upgrade firmware sme baru bawak dia jalan2,_
Thus far the crystsl are genuine i have a few personal favoirite,_
Cpt sgt pengeposannya,_
Cara-Cara,_
Mw ngajuin banding ah sudahlah ribet,_
Cantik puas hati tangan my husband sy guna tKsub nk kuku kilat2,_
My 2nd time beli dgn seller ni,_
"Kali kedua saya shopping di kedai ini,saya sangat berpuas hati",_
Tqsm to all,_
Item made in Indonesia,_
"Tq seller,apa pun cuba psg dulu",_
Penghantaran laju gila 2 hari dah sampai,_
Sumpah cantik nak mati,_
kalerr cantik,_
Lizha Wong,_
1st purchase: SOL,_
"came in great condition and i love it so much,",_
feel slippery after wash it,_
but she said it was very pretty!,_
boh kat sinki sumbat,_
"For inner baju, bagi sy nipis mcm inner biasa",_
Texture:sy ingatkan ada berus kening sekali rupanya x ada,_
"Topping helok sangat²,tak berminyak",_
CNY promotion buy buy buy!,_
Harap sesuai dengan masalah kulit n segera sembuh,_
Tq penghantaran yg pantas dan terbaik,_
Very satisfied and affordable,_
"price is higher, but service are worse than ever before",_
Wish to give no star at all!,_
"Alhamdulillah dah selamat sampai, sbnaryer dah lama Smpai,tapi kami tiada dirumah,tq seller",_
Baju murah terbaik penghantaran yang pantas,_
my in it,_
The approach may have considerable merit in making the hiring process more inclusive and fairer,_
"A total 1,864 pigs confirmed ASF positive in the Paya Mengkuang area have been culled as of Friday (Jan 7), she said",_
nak warna lain tgk xde stock amik jela nie,_
"Students can get all the information about Sunway College's award-winning and internationally-recognised programmes, and all can be discovered at the click of a mouse without the hassle to travel to campus especially for those from outstation",_
"Brng pansat, tq free gift sekli bole pakai gak ni",_
Come on guys its a great app if it could actualy be kept online for more than 1 hour once every 5 days,_
and thank you seller bagi pin tudung,_
"Hence, we see producer inflation to eventually seep through to consumer inflation",_
"Delivery took 6days only🥰🥰 Everything is good,",_
Looks Dope,_
Love the bigger screen and a lots of wallpapers to choose,_
Sampaii dengan elok,_
bsujud Dan terus meminta,_
Dh lepas delivery date baru dpt baju,_
"Selipar lembut, sedap pakai dlm rumah",_
This phone is really really great i wish i have could own one,_
Tapi semua looking good,_
dah berapa kali repeat,_
Sebab request (berbayar) untuk satu lapis bubblewrap dan letak dalam kotak,_
In kota kinabalu Sabah,_
Received all with good condition thank you Shopee Mart,_
Repeat order utk mak dan adik beradik,_
terima kasih seller cuma kasut ad kotor sikit tp xpe,_
mmg xde nyamuk kalau pakai ubat ni,_
Gambar tkde kena mengena tp barang sampai cept dan kualiti sgt baik,_
Just nice utk pegi mana2 pun,_
Barang dari china mcm barang dlm malaysia je,_
I just bought this TV and can&$HASHTAG$,_
"Kain nipis, selesa, murah, delivery ok",_
if taste good sure will repeat order again,_
All items beautiful,_
Me and housemate enjoyed playing together very much,_
taste yucky!,_
"lps bt aduan dan hantar email, bru brg sampai",_
Noy urgent to use,_
seronok sgt anak2 dpt pkai jam,_
Thank u utk servis,_
Loose blade dia tu,_
Package came in absolutely good condition,_
Plus dpt free gift sampul raya dgn mask,_
"Bought many times already,good value and quality good!",_
Tapi ada la org tebuk tgk dlm🤔,_
"Complete all set, fast shipping and easy to installed",_
takde sakit tapak kaki,_
selamata sampai ke srawak,_
Fast shipping and good product packing,_
trima kasih delivery,_
Brg mantap smpai tepat pada masa dia puas hati dgn kualiti dan harga,_
Bukan rezeki nak jumpa seller yang baik,_
Barang pun cukup seperti yang diorder,_
colour hampir sama,_
but dia ni buat for content which is bodo sbb sanggup,_
brg brquality,_
It fits properly,_
Seller is very kind and considered to customers request,_
nd if in case u are thanking me,_
Shipping laju je,_
Was not allowed to access app,_
Suka beli sini daripada beli luar sbb tak jumpa yg affordable macam ni,_
Smpai elok x dak pecah apa,_
Love the cute tree,_
jnt pkai f1 ke ap laju jnt trbaik,_
Istidraj itu apa?,_
"Video tak de kena mengena, so far barang sampai dengan baik",_
"Ordered 12/9, shipped out 13/9, received 14/9",_
Siap bagi cadangan apa yg perlu di buat,_
Dr Fitri Fareez also urged healthcare professionals to keep abreast of advancements in the medical field by referring to authentic medical journals and experts before simplifying the information and explaining it in a language the public can understand,_
My second order selamat terima,_
not try yet not try yet not try yet not try yet not try yet,_
Barang dah sampai terimakasih j&t pelayan sangat bagus dan baik hati,_
Nice nice nice nice pnghtran laju belum try lagi harap okey la,_
Arun: talking me: seeing never gonna give you up on the back display,_
Corak and warna pun cantik 🥰,_
saya tinggi 165 berat 80,_
seller please pack the shoes with BOX next time,_
"Semua cantik-cantik rasa nak repeat order lagi, warna memang cantik",_
Kids love this unicorn froot loops,_
"All themes coincide with the Penang 2030 vision of 'a family- focused, green and smart state that inspires the nation'",_
Very fast delivery within 24hrs of ordering,_
Dalam gambar tak clear sbb quality camera tak elok,_
Just received the package!,_
The Attorney General confirmed that there has been no action taken to cease the court proceedings in London towards IPIC to undo a settlement agreement entered into by the 1Malaysia Development Berhad (1MDB) and Abu Dhabi's IPIC in 2017,_
"I love these two flavours, really good taste and healthy",_
! -,_
Very easy to settle things out and the customer help service is responsive,_
ayah kita suka sangat,_
but the payment accepted please repair your system apps,_
Cleanliness:terbaikkk packaging mmg terbaik with box sbb byk kan,_
rupanya malaysia je,_
"Cantik sangat ,kualiti puas hati",_
"Unfortunately, the outer box was dented",_
Comel sangat pop it ni,_
"Very cute cartoon, quality ok",_
dia balut dgn bubble wrap lain aku cam bapaklaa srs la ada seller cmni,_
"Parcel baru sampai,thank you",_
Super good and fast services Free return and exchange services provided very fast and no single cents needed in the process,_
if anyone want to trade jake no pc to hoon pc can dm me on twitter $MENTION$,_
Senang nak cari barang baby n ibu kat sini,_
"Fairly fast delivery, The product arrives in",_
I received it very safely,_
Nicenicenicenicenicnenicenice Nicenicenicenicenicnenicenice,_
Jangan tanya batrai nya,_
"Very good will try again , recommended for everyone,thumbs up",_
"utk org first time pakai Netflix macam saya, memang sesuai amik sini utk 3 bln",_
muah ckitttt,_
terpaksa potong sikit sbb besar sangat,_
All ok but im not received the top cover,_
ShoppingMall super high risk for me,_
"Item dibalut kemas, berfungsi dengan elok, tq seller, cuma mouse tu comel sgt dan wayar pun dah terkopak but its ok, sbb saya dah ada mouse sendiri dah, its not a big deal lain2 semua ok",_
Love the colour thankyouuu 🥰,_
Barang sampai dengan baik penhantaran pun cepat dan pantas jaa,_
Tq Saller barang dah sampai dalam keadaan baik dan tiada sebarang kerosakan,_
The delivery literally took me only 4 days,_
weh tak fham la asal ni aku nk submit tkle lak haih ni malas ni pls la btw belije,_
penghantaran sangat pantas dan produknya dilengkapi dengan bubble wrap!,_
delivery fast in PKP,_
"Manakala, Mohd Izham dalam hujah balasnya pula memohon mahkamah agar mengangkat hukuman mati sebagai hukuman kepada tertuduh seperti yang sudah termaktub dalam peruntukkan Seksyen 302 Kanun Keseksaan",_
Seller post out items immediately,_
Oder tghr smlm tghr ni smp,_
One pack already break,_
Ok ngam tqvm,_
Thanks for rider for super fast delivery arrived the next day after Ordered been placed,_
"Awesome delivery action from seller and courier too, within some 2",_
Ship out pon lambat,_
"Ship out on 29/1 and today 12/2 baru sampai dekat I courier yang sangat² teruk , 2 minggu tunggu kalau nak sampai ke Sarawak sampai terkoyak parcel sebab courier peram barang seller okey yang tak okey courier",_
Here I&$HASHTAG$,_
"(Reporting by Nick Mulvenney in Sydney, editing by Lincoln Feast",_
Durability:Dont test it yet,_
"Everything works well, seller is very easy to deal with",_
Sedap jalan walaupun jauh,_
Item delivered hope no problem item shipping and later i check all,_
Comfortable to daily wear,_
"bungkusan dalam keadaan baik , lembut mulus dan cantik^~^",_
CUMANYA gambar tidak sama dengan apa yang diterima,_
"with good packaging , nice product , will buy it again",_
mintak lain lah,_
Siuuuuuuuuuuuuuuuuuuuuuuuuuuuuuuuuu Siuuuuuuuuuuuuuuuuuuuuuuuuuuuuuuuuu,_
Xtahu i salah ukur ke macamana,_
santik sangat,_
Ada pouch skali cuma a bit berbulu sbb xkelim tepu,_
"Suitable with my kids,",_
Sampailah juga gelang silver dari Cina ni,_
Absorption:Ok sangat,_
Barang da smpai wlwpn pnghntaran lambat suka sgt berbaloi dgn hrga tq sellerrr nnt repeat lg dgn seller nie trbaikkk,_
Sayfamda görmek istemiyorum engele bastım gitmedi,_
lambat betul sampai,_
Thankyou seller beli masa 18,_
cantikkkkr,_
dah bape kali repeat order kat sini,_
harga pun murah nanti boleh beli lagi,_
Sma mcm yg kita nak,_
Tbaik tv box ni sesiapa nak beli jangan tggu lame tau,_
Penyangkut bagus,_
Quality:good quality except the glue abit sticky,_
Hopefully no problems arise while using it,_
Serius trusted dealer n recommended sgt,_
dapat beli masa sale 25 harituuu arghhh rm 22 je tolak coins tak rugi beli tengah boring boleh main,_
Post out sgt pantas,_
But late to ship by seller,_
Kainnya cukup2 je utk dicantum,_
Dm $MENTION$,_
So kalau pakai dengan outwear memang elok dah,_
Packaging bleh lah dri xde kan,_
Superb secured packaging,_
Sejadah lembut tebal,_
selesa tebal sedap sikit lps nie naik basikal tq seller,_
Production date 13/08/2021 Expiry date 13/08/2023,_
1 drpnya rosak dan seller terus ganti baru,_
