Sentence,Tagged_Sentence
"cuma, bile on music",_
Camera came in with clear instructions/manual,_
Functionality:Overall satisfied,_
sgt2 lawa xpayah pegi alter dh mmg ngam2,_
"Seller post out smlm, ptg ni smpi cargas btol shopee express",_
Semalam ordar harini dah sampai giler2,_
Easy foam and has a bit sticky after shower effect depends on your skin sensitivity,_
Berat 74 tinggi 159,_
sikit tawar,_
Sy plussaiz 97kg,_
mungkin disebabkan Dari china,_
SIMPLE AND CANTIK,_
"🦸 mendarat sudah,barang diterima dengan baik eloknya dan seperti yg di pesan,suka semua semua suka 🦸",_
"Laos has tested over 30,000 people for Covid-19 since January, but dengue fever could pose an even greater threat",_
Sampai aplikasi yg penting2 jadi korban penghapusan,_
tapi tak effect sgt,_
Cantik gila ye bag ni and spacious jugak,_
"Syukur sgt yg kipas ni elok,cuma angin slow wlupn speed 3",_
however i use a pliers to fixed back the chain and now it's functional and userable,_
Therefore,_
anak kata sedap,_
xyah susah2 daa,_
"Brng dah smpai dgn baik,kain boleh la,penghantaran cepat biarpun ke Sabahngam dgn anak saya umur 4 bulan",_
Even on low light,_
harga x murah sangat x mahal sangat,_
sebab stok habis,_
Especially with uk kitchens being fairly large and availability of ingredients,_
pisd,_
Corak cantik utk boy,_
katanya colletor marvel sejati mana iron man mark 1 tercium tidak mampu hmmm bener gak ya,_
I don't think the RM 1,_
All items received in good condition(11/11),_
Seller provides good assistance during purchase and installation,_
"kain memeri dan sejuk, ok padan dengan harga",_
kualiti pun macam mahal,_
"very fast delivery, packing has bubble, product received and recommend to buy it",_
Pas ni bolh bli lg,_
ordered on Saturday received today Monday,_
Selamat terima dan dalam keadaan baik,_
J&T courier works fine in my area,_
very fast delivery Terbaikkkkklah,_
Jenis kasut getah lembut selesa pakai,_
"nanti jd mcm yg 1 tu, jatoh² pastu xboleh guna dah",_
Design:2 design cantik,_
received well even the item arrived at puchong on Saturday,_
tunggu malam sejuk² baru pasang,_
Recommended seller utk produk ini,_
is good value for money and excellent service by seller,_
sentiasa ambik satu saiz lebih besar,_
Tak rosak !,_
My mom positif covid and less 1 wk consume already recovery,_
atau gred brp nir tuab?,_
belikan untuk my mom sebab senang nak sangkut dia suka sangat cantik simple,_
will repeat another order with you,_
Saya sudah lama guna produk ini,_
"Good product quality, fast delivery, Excellent services buy seller",_
Puting botol lembut,_
"takut gam tak kuat, hiking pakai kasut, turun kaki ayam hahahahahahh",_
Lawa tpi xde bau klau ade bau wangi2 sikit lg best,_
10 received on 30,_
"We had planned to start work in the middle of March, but it had to be postponed because of the movement control order (MCO)",_
I wonder what the market will be like next fall,_
It funtioning well tq seller beautiful light good great bravo,_
Im loving the cases🥰,_
Cuma rasa dia pedas kosong je,_
Received in good condition because it wrap with bubbles wrap and it has box to protect,_
Keep it up Seller's packing team,_
"The optimal scenario saving as many lives as possible envisages by 2050, various measures implemented, such as the development of cycling infrastructure on major roads and thoroughfares, as well as on small residential streets and interurban roads, or the implementation of a vast bike-sharing effort",_
Design:received with border,_
wlaupon ade kekurangan,_
This is the perfect foldable for me,_
Dh byk kali beli puting botol anak dgn seller ni,_
The material was soft & suits the prices🤗 Will definitely purchase again for another color soon🤭,_
Received my parcel and love it,_
Anak anak sukaaaa,_
I had the chance to use the Sierra Blue Pro Max for a while and the color reminds me of my old Note 8's Orchid Gray,_
tapi Dalam jangka masa panjang zip ni Akan tercabut,_
product are same as in promotion,_
i like it🤗🤗🤗🤗🤗🤗🤗🤗🤗🤗🤗🤗🤗🤗🤗🤗🤗🤗🤗🤗🤗🤗🤗🤗🤗🤗🤗🤗🤗🤗🤗🤗🤗🤗,_
"sorry gmbr tiada kaitan, smua okey",_
Need to download the apk,_
Item safe delivery Fast delivery,_
so kene beli yang tebal,_
EXPIRED DATE IS NEXT YEARR,_
I love the colour and the material,_
2 short sleeve je betul yg 2 lg tu dpt short sleeve,_
tp xbnyk pilihan,_
"Delivery through sea, items well packed and received in good condition",_
Ingatkan mauve to warna lilac,_
thinking wan to buy a slightly bigger bag for my off day use,_
Fast shipping and very recommend,_
Delivery time acceptable and worth to buy during sales!,_
$MENTION$ Yen !,_
The adhesive is not able to support the weight of the kitchen tissue,_
cantik masknya,_
"Taste:baby makan, masalahnye sekarang kakak dia yg 2 tahun pn nak jugak🤣",_
Penggunaan pun senang,_
Taste:Taste like the Japanese tea served in common Japanese restaurants if just put with hot water,_
It can fit the bed perfectly without using any pin,_
Haven't try it yet since my due is on September but I can say it good quality,_
The bag is cool but the quality of the fabric is a bit rough and that is all furred,_
tapi xsmpt nk belek2,_
barang sudah sampai dibungkus elok dan penghantaran pun cepat,_
These are cute weh!,_
Dptyg baru,_
seller pun baguss layan cust cpt je reply,_
bdk² suka main,_
not all understand typing method,_
So no issue for this,_
Bought similar item before,_
Taste:creamy spicy,_
Bukusan sangat memuaskan,_
Kdhusaiksbdialamdnkalambshqiakdndbiaoqnsbjdkanxjkdnavxjjs d d d d d djchxukccii,_
minyak dekat app yamaha bgtaw seperti d gambar nk kata ori pn x taw,_
seller simpan dulu,_
Got it during 10,_
"Super fast delivery, good service good product and cheap price",_
No pictyre coz i buy its as a surprice for my sister and nieces,_
Pakai ubat gg ni daa lama gg tak sakit tu bertahan sampai skrg dgn sensodyne,_
This service treat the employee like a slave with underpaid fee,_
Bolehlah beli untuk buh phone masa mandi laut guys,_
x pans n ringn,_
ambil 2xl mmg fit2,_
Fast delivery can get free gift,_
really helps with my chapped lips,_
SATISFIED CUSTOMER HERE THANK YOUUUU SO MUCH FOR THE GREAT SERVICE overall is okay cuma box dia je rosak sikit but it's okay !,_
ก่อน9พัน🤩,_
"According to NHS Inform, there are two types of phobias",_
Lain kali beri nama acep,_
"Much thanks to seller and j&t courier, kudos!",_
"Nanti nk repeat lagii,",_
Cuma sampai sekarang masih tak dapat siaran,_
sangat2 rekemen,_
pretty much everything I could ask for from a budget phone,_
package dgn baterii tp bila masukkn bateri x hdup igtkn rosak,_
so kite try la,_
Tudung ok sangat,_
"Suka sgt deal dgn this seller pnts,jujur dan mur2",_
Item very cute!,_
boleh repeat oder lagi barang sampai takde cacat cela,_
Aroma:Havrnt Try Yet,_
kain yg lembut dan besar,_
"received in a good condition , fast ship and fast delivery , good packaging , thankyou seller",_
hideous,_
saya just tolong oder,_
strap dia besar sesuai untuk tangan yang comel,_
Hopefully working well with A800s,_
ve ever had the chance to win that phone Twitter: Johny_Skweggy,_
Cantik jer casing comel cantik macam sy thank you seller kerana habis kan duit sy,_
Ngan harga dibeli,_
2020 hijau pastel,_
Automatic connection,_
Tapi xpe boleh utter sndiri,_
i really love the heels,_
"Bungkus kemas n terima kasih Sis, penghantaran cpt",_
Berapa kali dah repeat order dengan seller ni,_
cade as b-armys,_
Lpstu nk hantar pun problem sptutnya 6hb tpi delay smpai 10hb alasan mcm2 tkda dlm sistem,_
Good for travelling and emergency,_
penghntaran laju tyou sellerrrr,_
Mudah regang,_
Op ujjwal bro,_
rasa taknak buka bila pakai telekung ni,_
smp sdh,_
kain dia ok x tebal sgt & x nipis,_
tips kalau nak kurus guna jenama green tea,_
"sangat selesa, ngam dengan kaki dia",_
Sorry gambar dan vid tidak berkaitan,_
"Produk cantik, terbaik",_
"seller laju,shopee express lembab mcm siput b",_
Tak sangka ada design mcm ni yg murah (below rm80) untuk plus size mcm saya ni,_
"kualiti produk baik, harga baik, penghantaran yg pantas, kasut dalam keadaan baik",_
"The shipment was displayed in the middle of the night, and it actually took a few days to process",_
Bought during the shocking sale with the cheapest price yet the quality still the same at the store,_
kotak pn ade,_
Tak payah pakai kerogsag,_
Bisa membantu saya,_
anak 6thn sesuai la saiz m,_
Senang pasang meja dan kerusi berbaloi beli,_
Dah jahit dah pun,_
You do really good reviews,_
Received:9 nov,_
sampaiiii dalam keadaan terbaiikkkkkkkk,_
Just take 7days from tarikh order,_
not good bag sudah R OS AK,_
Can fit a phone and small purse,_
Kanne dh smpai,_
mungkin karena lama g pakai,_
"In a small pan, heat ghee on low heat, add mustard seeds, wait for the seeds to pop, add the slivers of sliced ginger andsauté for a minute on low heat",_
shelamat,_
cangkuk berfungsi dengan baik,_
Size mcm yang diberi,_
All very sweet and QQ,_
Alhamdulillah tak sampai seminggu pon order dah sampai,_
X melecet kaki,_
"Order 10 hb, smpai kt tgn 14hb kira laju la",_
Request untuk urgent terus dia pack dan post,_
Jallow wrote in the judgement,_
Taste:Extrajoss Anggur,_
Thank you for the free gift green tea Almond chocolate,_
lambat sebab dari china,_
Ngam untuk yg pregnant tu,_
"thanks seller, gdjob",_
A bit late update by J&T,_
Puneetha Rajendran Tharani RazYgurl Nithiyan Raja Thivyan Raja,_
"very fast delivery ,love this strap very much super good quality on this strap ,fully recommend",_
Rupanya singkat (midi skirt),_
Cantikk dan mantap sekali suka2 sgt2,_
99 for six pieces) which features perfectly battered crunchy chicken replete with all the requisite sound effects when you bite into it,_
harap sedap ya,_
packing pn cantik kemas,_
"No dent , all perfect",_
kualiti biasa jak,_
Barang sampai dalam keadaan selamat walaupun tersangkut dkt j&t,_
Received in good condition and thanks the seller wrapped the parcel nicely,_
Cantik warnenye,_
luckily item function well,_
maybe dekat shoppe express delivery barang jatuh lepastu pijak sampai bergesel,_
Maaf gmbr dan video xde kne mengena,_
This seems a perfect size of the contents of a tin of condensed milk,_
"Lapan orang lagi dibunuh tentera ketika berdepan dengan orang ramai yang marah, dalam kejadian yang turut menyaksikan seorang askar terbunuh dan sebuah kenderaan tentera dibakar",_
Dah manis just nice,_
Repeated too many time from this shop,_
I can assure you that Aston Villa are no stepping stone for anyone,_
kain yg cantik dan mudah di bentuk,_
Kualiti nye bagus,_
THE BLUSHER'S SO CANTIK AND THE GLITTERS MADE IT EVEN LOOK PRETTIER IN REAL LIFE,_
crab n fish lembut,_
"Thank you seller for the fast delivery, received in good condition",_
Cuma xtau guna laju dia,_
Beli dekat mak kat kg,_
Penghataran tak cepat n tak pula lambat,_
Suami berat 52kg tinggi 160cm just nice saiz ni,_
"/> Asyraf mencadangkan jemaah yang ingin menunaikan solat secara berjemaah membuat saringan awal secara kendiri terlebih dulu, selain sudah tiba masanya saf solat di masjid dan surau dirapatkan",_
Pre order USA 17/9 dan available 24/9,_
Segala niat dan Perbuatan merupakan Doa,_
cepat pantas kilat,_
(free),_
🤷‍or just use grammarly,_
"Haven't try yet, hope it works",_
Cleanliness:terbaikkkkk,_
KUALA LUMPUR: Persatuan Nelayan Kebangsaan (NEKMAT) menyediakan kira-kira 100 tan ikan sejuk beku kepada pengguna menerusi Program Jualan Keluarga Malaysia (PJKM) yang bermula semalam,_
sale 25/10 dpt voucher kedai lagi,_
Thanks seller for the good and excellent services,_
Kucari semua yang telah padam,_
looking slick!,_
Barang biasa² je,_
penghantaran lmbt sikit d sbbkan dari oversea,_
Thank youuuu penghantaran pon cepattt bole repeat lgi ni,_
dont ever use,_
Haha igt warna biru gelap,_
ada rejeki kita order lagiii,_
Texture:n,_
sesuai la utk anak pakai ke sekolah,_
"Tq seller,barang selamat sampai, packaging bagus",_
saiz ngam² nasib baik,_
Sampai dh tripod nya,_
onnn,_
"Order 10/02, receive 13/02",_
servis paling mantap saya bagi 64747474474646363646485847373 bintang,_
Niceeeeeee!,_
"Haven't try yet, hope can use",_
Muito bom e tem legenda,_
"Good product quality,good value for money, fast delivery & excellent service by seller!",_
diapers sangat soft dan baby pun takda rashes bila pakai,_
"Sorry gambar takde kene mengena,tapi memang cantik gile,saya suka saya suka",_
Arrangement:packaging good,_
"klu kita pakaikan kat kuku tapi bancuhan tu color hitam, maksudnya dia x kan jadi",_
Maintance errors always,_
"Yeaayyy dh smpai cepat n pantassesuai utk tggi 161 berat 60kg🥴cantik n kemas kain mmg labuh wlaupn tggi ttap labuh jugak takut sbnrnya ingt pendek atau ketat,rupanya elok n x ketattq seller",_
arrived safely and wrapped with bubble wrap,_
5cm and have to choose size 40,_
Nanti salah kan seller 🤣 tayar diaa ade lampuu,_
"Ia mungkin menjadi satu kelebihan kepada mereka kerana boleh melakukan persiapan lebih awal dan secara keseluruhannya, saya lihat peluang adalah seimbang kepada semua pasukan untuk mencabar kejuaraan",_
"Getah bonet senang pasang, dijamin ori",_
s not going to age well,_
"158cm 48kg sedang ii pakai saiz M , packing pon elok ,ship out pon cepat",_
saiz kanak2 ni,_
Nnti cari sy kat padang mahsyar ya,_
boleh terus grab produk ni,_
Material:nice hard like stone,_
cuma satu Tali pendek,_
it work finely my lips turn a bit red after use it,_
kalau berdiri lama fuhhh lengah baii,_
RM 17,_
"My order has arrived, sorry for the late rating, the price of this bag is pretty cheap, i ordered only one, i was trying it but it turned out that it was good, hopefully it will be good, one time when i order again, thank you",_
Kira okay jelah en en en?,_
I haven't wear it because it is heavy and I scare it will drop hahahah,_
DHL do their job very fast,_
sebijik macam dalam gambar !,_
The z40 has a clear video during day & front,_
pghtran pun cepat ja,_
saiz xl 2xl both can wear comfortable,_
"Kotak pic lama, dlm packaging baru,",_
beri extra days,_
Again thanks seller,_
atau 40,_
Definitely akan repeat lagi tq seller,_
easy to log in also,_
Staff sgt rajin melayan cust,_
"kain tebal, pinggang getah(strechy), labuh utk tinggi 160cm",_
The fan is so noisy and only have 2 speed,_
I'm so satisfied with this band,_
"Barang sampai cepat, selamat dan berfungsi dng baik",_
Seller ship out next day after placing order,_
"Dulu pernah beli tapi kat kedai lain, tapi jenis yang seller ni jual lebih tebal dan kualiti berbanding yang saya pernah beli dulu",_
"Looks tasty, can't wait to try it,",_
"Taste:is a question mark,",_
Nn n nn nn nnn,_
shall trying tomorrow morning,_
hope I get one,_
t have money to buy it $MENTION$,_
Yg penting cepat Dan pantas,_
hrap bentuk elok la,_
Tapi tak sama macam yang di pesan,_
"This is a very useful product, I use it everyday from day to night",_
Rated it 5 stars becuz this helps alot,_
Order ytd and received today,_
And thanks for free gift lah,_
Sedap dan memang meberi tenaga sy sangat berpuas hati tq seller boleh kalau nak beli lagi,_
extra 1pcs,_
pun sng,_
Effectiveness:Smell good,_
Untuk buat biasa2 boleh lah kalau nk heavy duty memang x lepas sebab plastik nipis je bahagian tu kalau utk 2 org boleh lah dan kena buat atas meja bawah dia x leh nk kunci,_
Ok jugak quality dia,_
Buat jeruk maggi jela macamni,_
"Wet food saya sampai dalam keadaan yang baik, harga pun murah",_
The colours are beautiful can match the dress 🤩 Like all of them,_
The Republic of Korea (RoK) came second with more than $4,_
"Tqsm seller terbaik,",_
It was the first place I traveled to when Europe opened for tourism last year,_
& J&T sebab,_
"Abit sad because the milk powder change to 600g, but this not the seller wrong so still give 5 star",_
"Last year, the export turnover of leather, footwear and handbags saw a modest yearly increase of 4",_
tgk review smua grey yg buyer order dia bg brown,_
kalau j&t baling leh pecah tray ni,_
Penghantaran yang agak cepat walaupun dari china,_
"Wanita itu diciptakan dari tulang rusuk laki-laki untuk berada di sampingnya, bukan diciptakan dari kepalanya untuk berada di atas laki-laki, atau dari kakinya supaya bisa diinjak-injak oleh laki-laki, tapi dari bawah lengannya untuk dilindungi oleh laki-laki, dekat ke hatinya untuk dicintai oleh la",_
Very saved money when I buy on 31,_
Nadie absolutamente nadie: Yo apunto de irme a dormir AM después de hacer stream a Permission To Dance y,_
Semua mantap bayek!,_
Poket dua2 belah,_
Thanks to seller for the good offer,_
The order was marked delivered,_
Worth it xx,_
"Nicely fit my 3yo which is 14kg, waist around 19inches",_
Alhamdulillah thank you🤗🤗🤗🤗cepat gila penghantaran dah 2 kali beli,_
mahkamah syariah,_
Anna and Ivy the best always give affordable price,_
Kualiti bola sgt baik dn cantik,_
didnt expect the shipping is quit fast,_
excellent services by buyer very fast,_
Sdgkan dr driver jg ga bs cancel malah d limpahkanke driver lain,_
"Namun, lain pula jadinya apabila Sheryl berjaya menurunkan berat badan pada era pandemik",_
Tapi mmg selesa pakai,_
asked for full refund but only get RM 10,_
just belum guna lagii,_
Packaging pun bagus dalam kotak limau Mandarin,_
"Good buy, worth it, cantik pulak tu",_
Dh smpai dkt hub hari sabtu pg lg,_
"2nd time order, soup taste good and good quality",_
Dah lh lambat,_
sudah sampai dgn baik,_
Will but other clothes in the future,_
Zip ok (hidden),_
Does not print a doc,_
Clear instructions on the storage,_
I hope the seller need to check the message frequently,_
🤩 Ada mugiwara no Luffy,_
Tq for the biscuit,_
next Monday Tuesday Wednesday Thursday friday Saturday Sunday,_
tq for the excellent service 🥰,_
~dapat free gift bentuk pendrive & micro sd card adapter,_
🥰can't wait for another parcel,_
LOGO,_
Lembut & tak bahaya untuk baby,_
"Kita hanya merancang, Tuhan yang menentukan",_
"harap² sesuai dngn sy, nasib baik",_
"but the film arent waterproof so careful when touching it, make sure hands are dry",_
gambar dan video x de kene mengena ye,_
"Pfizer did not provide details on side effects, but stated that the problems were mild and similar in the two groups at about 20",_
Arrived in the morning that I straight away unpacked it for breakfast drink,_
"An Se-young (Kor) bt Ratchanok Intanon (Tha) 21-17, 22-20",_
Cuma belum test,_
Saya tnya boleh restock atau x barang pun terus dia restock,_
Sesuai bawak travel letak dalam beg,_
Nt boleh repeat lg kalau serasi,_
Kk k,_
Puas hati dan terima kasih,_
Barang diterima dalam keadaan baik dan ngam dengan casing tapi tulah cume belum teat lagi sebab tgh tunggu plug and play cable,_
Selamat sampai barang dalam keadaan baik,_
Love u hogy,_
maaf klu salah,_
I cant wait to try this,_
Done sampai tshirt hehe,_
Dapat freegiftt sampul duit raya!,_
"Okay saje, asalkan dpt tutup rambut panjangnya",_
Taste:sweet but not too sweet,_
Thanks for the great experience!,_
"Aive been looking for a new phone for a while, and this could be a good gift for my upcoming birthday",_
"Effectiveness:nice to use, no smell",_
Tulis dpt,_
sudah repeat Oder berkali-kali,_
"Top-seeded British welterweight Pat McCormack took a split-decision win over Uzbek Bobo-Usmon Baturov after suffering a cut over the eye in the final round, his opponent throwing everything at his head including 'the kitchen sink'",_
Took some time for delivery but it is acceptable because from oversea,_
"Based on a study the ministry conducted last year to assess varsity students' political literacy, it can be improved on by consolidating and strengthening their appreciation of existing policies and Acts",_
"Tunisian judges on Sunday rejected President Kais Saied's moves to disband the council that oversees them, a move they see as undermining their independence, setting up a new struggle over his consolidation of power",_
lg sedap minum sejuk2,_
"fast delivery and good packing,cheaper price,thank sellerand shopee",_
Thank you sangat sangat,_
Sangat sesuai untuk bedung baby yg besar dan sesuai jugak untuk new born,_
"Texture:Soft, but sticking to each other",_
Yg bekas dlm tu beli asing hehe,_
L besar,_
Restock Freegift for my customer thanks so much for your service!,_
For the item free gift I didn't get it,_
Seller is very nice the things is good quality,_
Kain sesuai ngn harga murah terbaik,_
tp paling wangi yg purple ni,_
Tq seller dpt free key chain skali,_
kualiti yg puas hati sgtt,_
Dapat : 30,_
tapi nampak fresh n sedap,_
Not sure if cool though,_
$HASHTAG$ btw my cat really like it before this I use to but ciao brand (idk it's right spelling) then I found this more cheaper than that brand even so not same quality but it nice since my cat love it!,_
yg pnting trusted seller,_
Dua2 dpt sm warna,_
Repeated buyer many times,_
Secure molekk,_
perlu tukar courier,_
Dua2 mantap,_
Berpatutan mcm beg mahal gitu,_
Wehh apa nie line digi kate no1 bapak dia services ape niee line cam siput dah 1bulan lebih ade je masalahnya tolong lah baiki services digi kota Kinabalu sabah inanam woiiii,_
Seller buat good job,_
"Untuk buat pembayaran, boleh direct Transfer ke akaun dibawah",_
"Noordin Darus) has very high in content of Omega-3,6,9 (polyunsaturated fatty acids), it can help in all kinds of health issues that arise from unbalanced diet in the modern era",_
"Semoga sedap di makan, ni first time order",_
Sudah kuduga bakal beli,_
Cant even set a location?,_
ke mmg jual sbelah2?,_
Tpi tak pe i x bawak bnyk barang heheheh muat untuk fon n dompetthe product quality is good,_
"This year, the family will be having their celebration dinner on Boxing Day instead of Christmas day, as Loraine will be returning to her in-law's place in Ipoh, with her husband Adrian and their two children",_
Design:small and nice,_
8ml fast shippingHaven't started using it yet hope it works,_
"Kemek kemek semuanya,boleh tgk sndri melalui video saya share",_
penghantaran yang pantas dan bungkusan yang baik,_
"So if hangpa tak selesa kasut ngamngam kaki hangpa, beli 1 size Besaq from your original size",_
Thanks will buy more !,_
This app is the best!,_
kedai nk jahit logo xbuka lagi,_
Tak sabar nak tggu 2nd parcel pulak🤭,_
"Yeay dh smpai, sumpah cantikkk sngatttt fakenail ni, really love it murah sngat will repeat soon,",_
Packaging semua okayh,_
yg hijau tu beli kdai lain,_
Ade dua jenis taki kasut,_
"Tngi 153cm, berat 70kg",_
Dpt claim voucher so kita beli 🥛utk,_
Sbb pernah tnya seller ukuran utk shawl satin ni,_
Jeruk pun nampak sedap & segar,_
It s too small when it is unfold campered to fold 3,_
Its perfect except u have to make ur own hole for the button,_
"Good product, good quality, fast shipping, responsive seller, will repeat order soon",_
i love this colour,_
Cannot hold,_
seller was kind & the shipping surprisingly was really fast veri veri happy!,_
"Yang satu lagi patah, i dont like the service",_
Kalau tak jenuh gak,_
pakai2 bergaya putus buang,_
fit my 2 litres big tumbler,_
barang Selamat sampai dengan selamat,_
Slh size pulak kemaen laju susu turun,_
Good camera senser Twitter : $MENTION$,_
Will definitely buy from you again in the future,_
Mantapppppppppppollllllllllllllllllllllllllllllllllllllllllllllllllllllllllllllllllllllllllllllllllllllllllllllllllllllllllllllllllllllllllllllllllllllllllllllllllllllllllllllllllllllllllllllllllllllllllllllllllllllllllllllllllllllllllllllllllll,_
Jadi contidion barang semua baik,_
Will repeat for purchase,_
"Packaging okay lah, kotak kemek bila sampai nasib baik bekas jam masih utuh",_
Dh byk order ngan seller nihhh,_
Ok brng nye,_
in chat seller refuse to replace the item,_
"It was wrap nicely, purchase at a cheaper rate, will purchase again from the same seller",_
warna sweet seperti dlm gambar,_
"Bau vanilla pun x mcm bau vanilla, mcm bau minyak wangi kasturi pun ada vanilla tu",_
Selamat sampai tapi belum test harap ok dan boleh pakai lah,_
Speaker x try lagi x pandai guna,_
wangi dia ok,_
Cant use ovo points for grab food,_
tq seller for this product cuma tu lh time smpai tu terkejut jgk lh sangka seller bagi brng yg salah sbb case nya tu dragonball pnya anyways tq again seller,_
Barang diterima dalam keadaan baik dengan bungkusan yang selamat dan berfungsi dengan baik,_
yaahhhoooooooo,_
"The dual driver is not real, all housing",_
Yg kecil belum cuba lg,_
Thankssssss seller for good packaging and nice services,_
"sorry,all good insyaAllah",_
hi received in great condition !,_
"omg very fast delivery and worth the price,",_
by ShopeeXpress from JB to KL taken soooo long,_
Terima kasih seller!s,_
siap free gift seller terbaikk,_
terima kasih seller🤗🤗 terima kasih DHL🤗,_
"Good, luckily can fit, washed it but not much colour faded in the water",_
Satu berlubang satu jenis bertutup penuh,_
Easy installation by referring to instructions at the plastic cover of the grip tape,_
ship out dn develiry very good,_
No issue here,_
"The appeal hearing concluded on May 19 after 15 days, which has been described as exceptionally long by Justice Abdul Karim",_
workmanship is good and neat,_
"Cepat, brg cantik, blh repeat order lg",_
"Ank2 pn suka, ibu pun suka, ayah dia pun suka, pengasuh dia pun suka",_
warna dia pigmented,_
jnt oky,_
Semua barang diterima dengan baik sangat!,_
"Saya melihat sentuhan lagu lama dengan baharu berbeza, itu membuatkan kenapa peminat sukar menerima karya baharu penyanyi lama, katanya kepada BH Online",_
Finally received the parcel after waiting for 21days,_
"The package has arrived, the packaging is neat, the shipment is according to the prediction",_
"Will repeat order soon Thank you seller,",_
Functionality:for sleep,_
Children will like it,_
Atuk dengan nenek saya suka sangat,_
Share my experience to help others make better choices and decisions and actions,_
2 bekas sambal kentang rangup pecah,_
takde rosak semua menyala,_
The casing is soft,_
"Bag same like description, material and size pun bagi sy worth it la for RM 5 +",_
bubble wrap+the bag is in the dustbag),_
Puas hati walaupun ada defect sikit,_
brang smpai dlm keadaan yg baik tq seller dan jnt,_
