Sentence,Tagged_Sentence
Memang kompem repeat tiap bulan,_
kindly add mine when purchasing yours 🥺🥺🥺🤣,_
Dah cuba masak kueteow dan nasi,_
Taste:Normal cornflakes,_
Wuu lawo bak ang,_
"It can watch dramas, listen to music and do assignments",_
Tapi ok la harga murah,_
Terima untuk free gift,_
"Rather than leaving the job search to chance, Peninsula College believes that building close ties with industries is key to boosting the employability of its graduates hence, the Campus-in-Industry model was born",_
I beli saiz L,_
"We're glad to have arrived here, glad to have privacy again and not spend the night on someone's couch or airbed, she said",_
Lim kia,_
Berbau lagi sudah,_
rasa ringan bila apply dan wangi bau,_
dan penghantaran pantas thanks,_
Taste:untuk sambal hitam yang kurang pedas mmg xrasa pedas sangat,_
This looks amazing TWITTER - shabanm77,_
Barang masih dalam keadaan kemas dan baik,_
like like!,_
Texture:not tested,_
cun2 utk knuckle 4G63T Evo3 dgn rim RPO1,_
tapi nampak macam kempis sikit,_
betul2 in love with the coffee,_
Klik link info $URL$,_
"Reuters could not independently confirm the details of the two cases with authorities as court officials do not routinely speak with the media in Cuba, nor was it possible to contact the defendants",_
Sedap pakai ringan selesa,_
So many design & cute case,_
Will repeat order sbb mcm tk cukupnmpk kemas,_
harga TGH murah ok la,_
boleh letak fon dgn brg make up sikit2,_
"maaf ya , saya order small iron kenapa yang sampainya cawan ya ?",_
i nak u faham i pujuk i tu he tapi maybe u rasa benda tu tak penting debab i ni bukan penting pun,_
daoat free gift lagi HUWAA berbaloi SUMPAHH,_
31bil (RM3,_
"Nice, simple shorts",_
thank god barang sampai walaupon betul betul amek masa lama gila nak sampai,_
-penghantaran pantas tiga hari je,_
pakai untuk anak,_
Packaging was clean,_
Terima Dalam Kuantiti Yang Betul,_
Julianna Ella Vicky Sam,_
Casing yg ni betul,_
Taste:Rasanya sedap tak rugi beli,_
Longgar skit saiz L tp best dah pakai berbaloi,_
bli kt manjaku mhai,_
harap berkesan bile guna nnti,_
tapi so far ok la sebab tak ada yang koyak,_
In short humare Redmi note 10 pro se kuch nhi hein 11 series,_
Semoga ok lah,_
Memang struggle nak pasang,_
"Bila bukak, hujung belah buku tu ada damage",_
AND It is delivered faster than I expected,_
"Expiry Oct 2022, thanks seller for quick response, appreciate if shipping is faster",_
"Barang sampai dari kedah ke ipoh ,1 hari je",_
This is not a first time purchase of this brand,_
jahitan cantik tq seller,_
bateri pun mmg tahan,_
Teats are good,_
ni size standard bag sekolah ni,_
Tapi bz dengn urusan dunia,_
"Ambil selepas makanan berat utk diet, membuang terus",_
Penghntran yg cepatttttt smlm order rini da sampai,_
"The condition is good, packaging also safety memang seller wrap the bubble kemas",_
$MENTION$ kecik boleh je bro,_
just letak simcard yg ada plan boekk jaa terus nk layan internet pun tadak hal punyaa,_
This is info for anyone interested in collecting matching copies,_
Nak hadiahkan kat adik,_
Kali ni beli saiz ngam cantik,_
tq mak saya dh terima kaftan,_
Rasanya kena beli android keyboard lagi better,_
Memg nice,_
Jgn beli 1 nanti X cukup,_
"Terbaik, lps ni repeat oder tq seller",_
sgt2 membantu,_
"the best ever ,",_
Enough tension to avoid recurring injury,_
10 out of 10 for overall !,_
Telah terima dengan bungkusan yang kemas,_
"harap tahan lama,buku sekolah banyak",_
"Memang cantik sangat2 , harga murah pulak tu , tak menyesal pom beli , beg pom besar jugak , boleh letak",_
Sangat bagus pelayanannya,_
"Gambar yang diupload hanya untuk tujuan klaim coins sahaja, namun dari maklumbalas penerima, katil baby ini sangat cantik dan kukuh",_
"I have already repurchased this countless times, can't express how much I love this",_
Totally different from the picture,_
Great toys for babies,_
pos barang pon laju,_
hanya letak barang di depan pintu tanpa mengetuk pintu atau menelepon saya,_
harga murah dri beli kt luar,_
Memang sedap sambil tengok Bola jatuh dalam air laut,_
Berat 33kg,_
Lambat sikit sampai but sokay,_
At least I got my wallet right now,_
The price can Burn my wallet🤣🤯,_
Corak dpn belakang berbeza,_
terbaik bleh repeat lagi,_
"overall okay function dia xde masalah,harga pon murah",_
"In the meantime, the state government would be looking for alternatives in terms of more comfortable accommodation but nothing had been affirmed so far",_
nanti kqmi beli lg nah,_
$MENTION$ i want this damn beauty,_
"Good products quality, good valau for money, fast delivery, excellent!",_
14bil) in grants was given out by the Inland Revenue Authority of Singapore (Iras) to support jobs and businesses during the Covid-19 pandemic,_
"Barang selamat sampai, sempurna",_
"Tinggi 180, berat 68 memang besar kalau ambil size L",_
"Kain lembut, boleh pakai time pantang nanti, terima kasih seller",_
"senang sikit kalau nak pergi mancing udang ,goreng j e terus Bila udang naik terus Masuk kuali",_
"Display: great, good quality with affordable price",_
Well received 🥰,_
"Grab sekarang makin gajelas, pasti bermasalah setiap mau login, padahal dulu baik baik aja, pasti bermasalah saat mau di hubungkan ke fb, udah pernah login sebelumnya pake acc fb, tapi pas di coba login lagi pake acc fb, ehh malah error, kejadian kaya gini udah ngulang 2x, kalo bisa di perbaiki lagi yh, internet udah stabil, tapi gabisa login, ya gimana yh, saya keburu laper Jamal, lama amat disuruh tunggu 1 jam baru bisa login, habis nunggu 1 jam malah gabisa login, tch koncol mendokusai",_
Cuteeee je color!,_
Beli untuk ayah size 3XL,_
Cuma packaging kut,_
lemon dgn kurma cina ni terbaik,_
Should be fine will buy again if nice,_
Material received in good condition and packaging was okay,_
Same as usual,_
"The family, identified by the surname Chen, also started building a seven-storey ancestral house in their hometown in 2012, described by the authorities as extravagantly decorated, according to the report",_
Net kasar sikit dari kelambu biasa,_
Can't even customize my shoes without a glitch,_
I satisfied with the purchase,_
"Performance:so far oklah, kucing dapat cakar juga cuma dia give up cepat hihi",_
Penghantaran ja makan masa,_
"I menyesal beli satu je, kena beli dua sebenarnya baru okay, tpi entah la macam mana terfikir nak beli satu dah la from china argh stress, its my fault btw barang baik jee",_
Berbaloi beli n lock msa live,_
Baru nak mencuba ya sapa tau menjana pendapatan Sarah hidup,_
quality tip top,_
x cuba lagi tp bau dia mmg oke je,_
"KUALA TERENGGANU: Seorang penternak di sini, kerugian lebih RM10,000 apabila ternakannya seperti kambing, itik dan ayam mati dibaham babi hutan",_
very good product very good product very good product very good product,_
Can c well,_
00 sahaja!Dapatkannya di Lazada sekarang!,_
"Finally~arrived safely,",_
Bare meme srupo kinah anok daro dulu doh ni,_
- Nursing pillow aka pregnancy pillow,_
brg smpai xcepa xlmbatttt,_
Kualiti barang padan la dengan harga yang murah,_
Penghantaran percuma pantas dari seller,_
Sy cuma mau bilang kau itu sapu jantung sapu nadi nananana kowi,_
Tgk laa mcm mana nanti,_
Pembungkusan sgt ok,_
"Thanks seller , all clothes very nice and very comfortable !",_
Barang sampai dalam keadaan baik semua ok baju cantik nice nk buat hadiah untuk kawan adik beradik semua la,_
x rosak apa pun,_
"omg cantik gilaaaa baju niiii , walaupun ade stain sikit butttt this baju very very the beautiful ,",_
"Receive in good condition, fast delivery and good value for money",_
"Terbaikk packaging terbaik, seller pun lajuu, courrier lajuu, semua laju lah",_
"kurang stress , happy life",_
Saiz muat untuk berat bdn 78kg hingga 89kg,_
Keluaran Dalam Negara Kasar (KDNK) Malaysia bagi suku ketiga menyusut 3,_
Box besar jugak tapi nipis,_
2 3 kali dh beli kt kedai ni,_
Best food Panda,_
murah sangat murah,_
Price quite cheap than others,_
Harientha Tan,_
Kalau dah dari JJ sport,_
penghantaran sngt2 pantas,_
Material kain baju okay lembut,_
"Within weeks of the Islamists taking the capital, many of the street art pieces have been painted over, replaced by drab propaganda slogans as the Taliban reimpose their austere vision on Afghanistan",_
ahahhahaahaa,_
"!terbailkkk bosskurrrrr,",_
"btw, bila i pakai melekit sikit jela sikit je but okayyyyy i very recommend",_
"thank you so much yaa, i will repeat again for in future",_
"warna ok sama dgn gambar, kain tak la tebal tp tak juga nipis",_
"Barang cepat sampai,kain lembut terbaiklah",_
well received for the item eventho sellers' team wrongly send,_
Phntrn plak laju giler!,_
~~~(,_
"nice packaging, good value for money and good product quality",_
would,_
Mantap dan berkesan dan selamat sejahtera kepada semua warga bumi yg nyata dan jelas pola dan,_
Let's goo DenzilDsilva1,_
"Suu Kyi is nominally the head of the National Unity Government (NUG), an entity established in April and comprising ousted lawmakers and activists who are challenging the junta's right to rule",_
Am pro,_
1st i jumpa seller good service i suka,_
try mcm2 y lain,_
Harga pun murah sikit dari kedai lain,_
very fast delivery and good value for the money and will buy again,_
Barang dah sampai tq seller nanti noleh odet lagi,_
"kain mmg cntik,harga pun murah",_
Ujjwal bhaiya is always my best gamer,_
"And with it being one word a day, players have to wait until tomorrow so they aren't devoting hours to it like other games on the Internet, Rogers said",_
Beg comel sngat2,_
"Hi ujwal , I AM ur big fan",_
"Bra and panties received in good condition, really comfortable bra, l wear at home",_
weighed is about 510gram,_
But its okay everythings received well :) thanks seller!,_
"Baranggg diterimaaaa dengannnn baikkkkk, terimaaaaa kasiiiihhhhh sellerrrr",_
Nice 🥰Nice 🥰Nice 🥰Nice 🥰Nice 🥰Nice 🥰Nice 🥰Nice 🥰Nice 🥰Nice 🥰Nice 🥰Nice 🥰Nice 🥰Nice 🥰Nice 🥰Nice 🥰Nice 🥰Nice 🥰Nice 🥰Nice 🥰Nice 🥰Nice 🥰Nice 🥰Nice 🥰Nice 🥰,_
Wangiiiii terokkkkkk setanding yg mahal kualiti nye,_
All items are received without any damages,_
Alhamdulillah barang dah sampai cepat sangat penghantaran,_
"Taktau nk ckp apa, sbb bg hadiah kt org hopefully semua okay",_
"!🤩 barang pun dalam keadaan oke, best sangat²",_
"Aplikasi burik, gak salah apa2 kok akun saya ditangguhkan, aneh, udah pindah gojek aja lah,",_
"Among over 200 people present at the ceremony were the hospital's board member Datuk Seri Steven Ooi, Consul-General of the People's Republic of China in Penang Lu Shiwei, Penang Port Commission (PPC) chairman Datuk Tan Teik Cheng as well as Kek Lok Si Foundation board chairman Venerable Jit Heng and KLSCH's board member Datuk Dr Teng Hock Nan",_
maaf gambar takde kena mengena dengan baju heheheh,_
"Item are well received and fast delivery from seller, I very satisfied",_
belikn utk org kirim sebab dia tak pndai pakai shopee tuan nya cakap ok kita pun ok jelah,_
Ni xtau la da berapa kali beli mmg tiptop,_
Sila beli saiz XL,_
Somethings never change,_
Ordered L size (6pcs) but 4pcs is XL size,_
boleh la guna utk baby dan utk bersihkan dapur,_
overall oke lah,_
"Sorry gambar tiada kaitan,postage laju je ,barang ok",_
Letak dalam kereta n bilik,_
Parcel sampai laju je,_
"maaf video takde kaitan, tapi barang mmg terbaik, lambat jugak nak sampai sbb dari china tapi okay sangat sbb mmg function gilaa, barang bebetul berkualiti, saya plug and play je tak guna cd apa semua!",_
Good packing and fast delivery thank you,_
Image Quality:tq seller sbb tv selamat sampai tanpa ada kerosakan,_
Barang smpai dalam keadaan baik Terima kasih seller bau pun wangi hehehehe,_
"Sampai lambat sikit, husnuzon la ramai yang beli, kita kalau jadi seller pun kita akan settle satu satu kan, tp barang best, terbaik",_
Sudah siap dijahit sebagai sarung (boleh pakai terus)!,_
The uninterested orchestra separately wreck because continent identically chase regarding a understood position,_
"She said reviving Sabah's tourism industry, which sunk during the movement control order (MCO), is urgently required",_
next time bleh repeat ordee,_
Cute dooh and function well!,_
"barang pn baik,",_
hrp jmpla,_
yeah i like it so much,_
dh smpi my brg2,_
terbaaaaaaikk seller,_
Dia punya kotak tahan lasak tebal,_
"Kok gak ada tampilan grab bike atau grab car, hanya ada pilihan hotel",_
Effectiveness:barang cepat sampaibarang ok,_
terima kasih juga pada courier J&t kerana jujur dgn pekerjaan anda,_
Received around 10 working days,_
"Kain lembut ok selesa, besar bidang 50",_
mmg klau spray saja x cukup,_
"My pringles tak pecah pun,",_
dah la kotor seliparnya,_
"Why can't i topup my wallet,",_
Seller pun hantar dengan packaging yang baik,_
Slow delivery but good received in good condition,_
semua barg cukup,_
Warna memang cantik thank you,_
"PETALING JAYA: Waste collected at sewage treatment plants came up to about 40,000 tonnes annually for the past three years",_
Nais siap bungkus satu satu,_
kain sedap best lawa memang sesuai semua jenis bentuk badan pun nak pakai untuk raya hihi thankyou seller for fast delivery,_
utk anak 4 tahun kakn singkat sikit la,_
TERIMA KASIH seller and penghantaran pun cpt sampai dalam keadaan baik,_
"Meanwhile, the number of employees taking unpaid leave in taiwan, a common measure to cut costs when business is slow, has exceeded 30,000, reaching the highest over the past decade, the island's labour affairs department has announced",_
skjsshzvajajajababababwjwe,_
air panas je,_
Is there any way we can get a comparison to their Ace Toys counterparts,_
ve just sent that tiny package,_
Patut amik size M je baru nice haih,_
Cantik sggat beg ni,_
"Color x sama dengan warna yg asal, tapi size cunnn dan penghantaran pantas",_
t=3m25s> Rick roll?,_
Jeez!,_
Magnet agak kuat jugaaaa,_
item received in good condition with secure packaging and very fast delivery too,_
Thayaaniti Raman Shantinee Purushothman ShobaNa Reddy Gurunadar,_
Good wrapping and super fast delivery,_
"Charging phone works, charged powerbank also working",_
"Penghantaran yang cepat, packaging yang baik, harga yang murah berbanding seller lain, Boleh repeat beli",_
"Nice, product come in good condition",_
"Kain ok, corak simple",_
Really nice fragrance and works well on my hair,_
"!🤩 harap kualiti boleh tahan lama, overall nampak exclusive dgn box sekali",_
"Almost all restaurants will open throughout Chinese New Year, and will only take their break after the 15th day of the festival, she said yesterday",_
Dan berbaloi la Kalau beli,_
5star buat kedai ni,_
baju jg ok yg putih nipis sikit TP puas hati,_
comfortable material and very good value for money,_
Fast shipping by seller but very slow delivery by shopee express,_
"Delivery at times is poor and, there's no option to cancel an order even if only a few secs have been passed since the order placed",_
CO !,_
The lack of responsibility,_
Sorry gmbr xde kena mengenaaa tp srs lawaaaaaa xdan tangkap gmbr kalut nk rate,_
Dh smpai tp jnt lmbt hntr,_
"Kenapa akun saya di tangguhkan,",_
so pretty and has a large space 🥰,_
Grab 53 bungkusan ubat semut edisi lama dengan harga rm0,_
TAK MENYESAL BELI UNTUK JDI BRIDEMAIDS KAWANN HEHEHE !,_
semua yg diorder cukup,_
The product is well-packaged with bubble wrap and undamaged,_
Comfort: 9,_
dapat semua yang i order and i suka sangat!,_
"packaging secure, service mantap",_
Sorry pic not related tapi kasut dia best hehehe maceh anw stan enha $HASHTAG$,_
Cantikkk cuma baju saiz yg kecik tu biru nya berbeza tapi pilih cod yang sama untuk semua oder,_
Proced utk pos sngt cpt,_
"Mak sy sukaa, tqq seller ada bg free gift jgk",_
Editing by Katharine Houreld and Howard Goller),_
Harga memang puas hati lah,_
item diterima dengan baik dan cepat,_
Suka dgn breast pad tu,_
Tyvm seller,_
mudah nak simpan,_
even dr china,_
xsempat pakai pun,_
!dahlaa mocha dia sedap then tak kedekut🥺definetly will buy this again,_
"Justeru, semakin bertambah usia, semakin terasa kemanisan amalan yang kita lakukan dan semakin seronok melakukan amal ibadat, makin dekat dengan Allah malah solat, puasa, bacaan al Quran, zikir, duduk dalam kuliah dan semua amalan yang dilakukan terasa nikmat dan kemanisannya",_
Apa pun kualiti ok,_
Cuma size nak masukkan lengan tu ada kecik ada yg terlebih besar,_
Given free gift as well!,_
tq bagi free gift filter,_
nipis nipis nipis,_
00 for one ribena,_
"Bubble wrap teballll ,",_
Nice saiz Malaysia bukan korea yg kecik sendat,_
We bought some too and were amused by his customer service,_
Fast delivery goods products quality good quality good quality good quality good quality good quality good quality good quality good quality good quality good quality good quality good quality good quality good quality good quality good quality good quality good quality good quality good quality goo,_
Sy nk,_
Berbaloi² dengan harga,_
nampak mahal gichuw hahaha beli beli,_
Shipping okay but delivery slow,_
Received barang dalam keadaan yg baik,_
Tk sangka seawal ini🤣 thankyouuu🤍🤍🤍🤍🤍🤍🤍🤍🤍,_
That's a cool colour (blue haze),_
terbaik n pantas xsmpai 5minit,_
Roecomended seller,_
100 barang xde rosak,_
s Go,_
Zverev ended the year ranked three and believes the number one spot is a viable target,_
"by the way, ni lebih kurang scarf aksesori leher",_
"And tahan lama, tak bocor",_
Memang suka beli yg 3m,_
12- Ship out,_
tapi gambar tu saje bagi sebab seluar tengah pakai,_
ni kali ketigo order denge seller ni,_
Received: 31/7/2021,_
even amek yg cheapest variaton the quality sgt menjangkaui expectation sya sgt recommend rakan2 nnti repeat order sbb puas hati sgt2 wowoowow,_
A little imperfection on the stitching and collar a bit weird but not that noticeable,_
Very secured wrapping with bubbled wrap,_
Order: 16 January,_
Lima bintang untuk penjual,_
Now the problem is that is there will be due to 120 w fast charging,_
Barang sampai dengan baik Dan elok,_
Nor Syahirah,_
Cepat gilaaa saja beli hehehehe,_
Baby clothes tlh diterima dlm keadaan baik,_
size pon okay sgt utk anak umur 2 tahun & 4 tahun,_
Semua yg seller bagi i tak suka,_
Pakai sedondon,_
"Two Southeast Asian diplomatic sources, who requested anonymity, said Blinken was also expected to visit Malaysia on Dec 14-15 in his maiden trip to the region",_
Design random and come with matching pair,_
"Kualiti tudung sangat tiptop, sumpah best",_
Lama lagi nak tunggu,_
NAKCOIN NAKCOIN NAKCOIN NAKCOIN NAKCOIN NAKCOIN NAKCOIN NAKCOIN NAKCOIN NAKCOIN NAKCOIN NAKCOIN NAKCOIN NAKCOIN NAKCOIN NAKCOIN NAKCOIN NAKCOIN NAKCOIN NAKCOIN NAKCOIN NAKCOIN NAKCOIN NAKCOIN NAKCOIN NAKCOIN NAKCOIN NAKCOIN NAKCOIN NAKCOIN NAKCOIN NAKCOIN NAKCOIN NAKCOIN NAKCOIN NAKCOIN NAKCOIN NAKC,_
Order 12 baju tapi yang sampai cuma 9 baju,_
"Asia-Pacific managing director for BCD Meetings and Events Sanjay Seth said its Singapore office alone has received a dozen new inquiries since Oct 9, when the first major expansion of the VTL scheme was announced",_
"Jika PIBG dilihat lebih kepada fokus sumbangan kewangan melalui yuran dan program kecemerlangan akademik, alumni boleh mengambil tumpuan kepada perkara bersifat kokurikulum dan lain-lainnya",_
Order Friday 3 September 2021,_
bli 2 bji,_
tag lawa,_
pnghntarn bagus,_
Akhirnya tercapai juga impian mendapatkan sebuah kemera dslr,_
Liyan Goh,_
Bertindak Cepat Sebelum Terlambat!,_
Tp barang kecik sgt2,_
Basuh pertama kali still okey lagi,_
Product well packed and protected,_
Order ga ada driver nya dari desa Sendang Dalem,_
The intro&$HASHTAG$,_
"Tq ,tq ,tq yaaa",_
Quality:good for use and practical,_
"Item received safety but the packing is not nice ,and the quality of the item not so good ,very thin",_
brg dah terima mggu lepas lg,_
Hilang/terjatuh agaknya tengok review katanya dapat 1pieces je Hahahha kelakarnya 🤣,_
hrp bole tahan lama dr brand lain & berpatutan dgn hrga,_
Ank2 selesa pakai mask ni,_
"Namun, bukan di atas kapasiti dalam program dan dia perlu memilih beberapa pakej yang kami tawarkan dengan membayar kepada kami seperti mana dilakukan atlet profesional lain sebelum ini",_
27 / 11 parcel received,_
!walau murah kita tetap keluar duit bayar tapi dapat yg xelok,_
Seller just wrap guna bubble wrap so dia kemik dan x begitu slmat T,_
oder yg ke 4kli laku keras,_
Harap-harap muat,_
nescafe gold always be my fav,_
Thank you seller penghantaran sangat pantass,_
Very colour,_
Plastik pos ni wangi,_
"Reliable seller, but delivery is a bit slow, it took 5 days to be delivered",_
very comfortable ohmygosh tk sakit dh kaki nk bjln lpsni,_
Banyak produk sedia diminum yang ideal untuk memenuhi keperluan protein harian dan kaya dengan vitamin dan mineral penting bagi memelihara paras tenaga dan kesihatan,_
Order Received in good condition,_
"Penghantaran sangat cepat dari seller, barang diterima dalam keadaan baik",_
Kain sejuk sesuai untuk tido,_
freesaiz,_
No Video No Picture,_
Semua lengkap macam yang saya order alhamdulillah terima kasih seller doakan laris manis jualan nya ya 🤲,_
"Kain dia best,dah lama cari seluar yg kain die lembut macam ni",_
Semuaa barang ok,_
Material used is bit soft,_
"Lampu dia mmg cantek, dalam video x berapa nampak cantek dia",_
penghantaran pm ok xda la lambat sangt,_
x sangka dpt byk gift,_
Overall sastified with the tshirt,_
Pengemudi nya ramah-ramah dan sangat membantu,_
my/Rewa,_
Barang nicee teruk,_
Barang baik barang terbaik,_
Hrp2 ok,_
I really recommend to purchase here,_
dia pos baru,_
"Very fast delivery, still has a year till expiry",_
Terbaik sller brg smpai dgn keadaan baik kemarin pos ary ni smpai ditgn tuan nya tq sgt2 saller seorg peramah brg mmg original,_
"If I bought the s6 lite sleeve case, it won't fit together with the case",_
I could rate it to -1 i will,_
"sb dah sampai bila dah rasa, wow lembut sgt, tak ada yg pecah",_
"It increases blood flow to the damaged muscles, enabling them to heal faster, explains physio-therapist Alexander Srokovskyi",_
Received the item as per my order,_
Item arrived well-packed in many layers,_
order terus pos brg,_
"padan molek,berbaloi dengan harga",_
Utk letak telekung & air,_
Comfortability:Selamat untuk d gunakan,_
Jadi try ambk 33hari,_
cuma penghantaran slow tap,_
Cantikkkkkkkkkkkkkkkkkk Cantikkkkkkkkkkkkkkkkkk Cantikkkkkkkkkkkkkkkkkk Cantikkkkkkkkkkkkkkkkkk Cantikkkkkkkkkkkkkkkkkk Cantikkkkkkkkkkkkkkkkkk Cantikkkkkkkkkkkkkkkkkk,_
I had 1 pkg stolen and another delievered to the wrong address and have not been reimbursed,_
So far puas hati anak gembira,_
tapi penghantarannya terlalu makan masa,_
"Fast delivery, good quality product, reasonable price, good services, thank you",_
A check at the Arulmigu Sree Balathandayuthapani Hilltop Temple in Jalan Waterfall at 4pm yesterday saw about 300 people performing their vows,_
Very satisfied with the quality even it is cheap,_
"Received in good conditions and buy at value price, will repurchased soon!",_
X payah nak alter apa2,_
Tq seller nnt hbis sy beli lagi ya,_
"Good product, fast delivery, cheapest price from others, recommended to buy",_
Items was in a very good condition !,_
pehantaran cepat kain serap air memang bestpehantaran cepat kain serap air memang bestpehantaran cepat kain serap air memang best⁷pehantaran cepat kain serap air memang best,_
Alhamdulillah sambal dh selamat sampai,_
good value for money one Rm5,_
Penghantaran lambat sikit sbb dari china,_
🥰🥰Insyallah nanti nak repeat order pula,_
"Very fast delivery, 78cm for my height which is 162cm is a bit short hahaha but i still love it and can wear legging inside",_
barang semalam order harini dah sampai,_
Taste:Sedap sangat dan pedas ikut citarasa,_
Cukup 3 helai,_
Can the world be restored through literature with its power to illuminate the tiniest realities and the boundless universe?,_
It could be also due to poor preparations as he has not been getting enough training due to the tight schedule and travelling between tournaments,_
Streamers got sent them,_
"Just the right size -- able to fit power bank, phone, wallet, keys",_
very nice and good i like it so much very pretty so worth to buy,_
Tq bg free gift extra sehelai baju,_
"Finally, it's arrived",_
"Tin kemet sikit, tarikh luput ada tiga tahun lagi, harga baloi dengan voucher",_
jam pon cantik angat angat,_
Always buy herbal soup from this seller,_
peket dah x kembong,_
Usually buy mala flavor so this time try sesame one will repurchase,_
"harga murah , cap macam ori",_
Inner boleh la cover leher and tak tebal sgt,_
Fast shipping and good job to Ninja Van,_
$MENTION$ Tech ok,_
"Fast delivery , like the pattern randomly choose by seller🥰",_
cuma ada jahitan yang terbuka,_
"7/8 order, 8/8 receive",_
Love the coffee and freshly prepared,_
Will repeat order real so,_
Thank you seller choose a nice color for me,_
brg dlm keadaan yg sempurna,_
Memberi ruang bernafas yang lebih luas,_
"Ini kerana pendemik ini melibatkan faktor Kesihatan, jangkitan virus, emosi, keraguan vaksin dan immunis",_
kain okberbaloi dgn harga,_
"A little bit crack, but luckily still can use",_
Received Date: 10/2/2022,_
"Alhamdulillah telekung selamat sampai ke destinasi yang dituju, harga pun murah n kain pun elok",_
lengan labuh tapi xpe selesa ok je,_
"quality ok, good value for money too",_
"Always trusted seller, repeated orders many times",_
"Untuk yang first time nak beli, boleh beli lemon",_
Product worth for money and fast delivery from the seller,_
courier pun lajuuu,_
First time bought from this seller and it was great!,_
First time dpt seller mcm ni,_
"Then write 10 will ship, on 10 change the shiptime sukahati to 21",_
beg besar harga murah sangat cantik sangat tq tq,_
Seller lambat lah post,_
Kali ke-4 repeat sbb wangi,_
Memang senang nak bawak pi mana ii ja,_
Tak de yang pecah,_
"material sejadah sedap sangat and besar,",_
Seller yg super power,_
Obinkodow,_
dsgn banyak &dapat harga murah,_
Jadi boleh save bajet la,_
warna cantik hijau pucuk pisang,_
"Alhamdulillah barang sampai dalam keadaan yang baik tak bancuh buat lagi , sebab tak kenal bahan apa apa pun terima kasih seller",_
