Sentence,Tagged_Sentence
Very excited to get my very first Nintendo Switch,_
silap tulis,_
Sesuai bli borong kt momo ni,_
"Kain Elok je, size ngam",_
bolehh repeat lgi nnt,_
Tapi besar jgk kn,_
"Tapi seller memang terbaik, penghantaran sangat pantas!",_
Post dari Indonesia consider cepat la ni kain baju tidur cotton tk panas,_
It's finger looking good!,_
Dfgg ke dalam rumah tangga yang dibina oleh kerajaan negeri dan negara ini yang mana satu yang berjaya dalam bidang ini menyebabkan Ahmad Said berkata pihaknya akan terus berusaha membantu kira-kira jam yang lalu dan dia,_
"The seller is so kind, they give me extras 3 hand cream",_
Pm Cust bgtau klu brg tu takde stok,_
Kasut lembut & sangat ringan,_
dia pon jadi kering sekali,_
Wah kualiti kain tebal sangat,_
"packaging very good, and delivery was very very fast, thank you so much seller !",_
The lack of a tactile touch point is only one issue,_
Parcel is well bubble wrapped and not dented,_
"On Monday, a video of a naked man riding a motorcycle with a food delivery bag on his back was shared via social media on Kanchanavanich Road",_
"You can be utterly totally frank, even indiscreet with the queen, John Major, the British leader from 1990 to 1997, said",_
"Abdul Rasheed berkata, usaha bagi memajukan fintech Islam di Malaysia perlu ditingkatkan dengan kerjasama",_
then when they serve somehow it drop to floor,_
Good product quality Excellent service by seller,_
Sangat mudah untuk digunakan saya suka,_
bantal selesa anak pun suka terima kasih seller,_
Terbaik sampai cepat,_
Will check on other products that I can buy from your company,_
lum nampak kesan,_
Botton kuat,_
Skylark guitar string classic guitar string acoustic guitar,_
Harga pun berbaloiiiiiiiiikkkkkk,_
"Anyway the shipping is quick, will come back for more",_
Sis terjebak lagi baju bundle,_
", everything receive in good condition",_
Xsabar sgt nk try,_
kwalitas barang bagus,_
The color same as advertised,_
tak sabar sangat,_
Affordable price for good quality,_
This time buy Thailand version,_
"Good Packing, remote put in box n wrap with bubble wrap",_
Worth to get this cotton shirt for leisure and wear at home,_
"Kain dia lembut, cuma tertinggal snowcap, dah dapat refund",_
sedikit kelabu dan gelap macam ada tompok2 kotoran berbanding dari gambar sebenar yg nampak macam all plain beige,_
pembungkusan ok ta jga buat saya,_
Tak berbulu nnt,_
9 export growth,_
Repeat Repeat Repeat reapeat Repeat Repeat Repeat reapeat Repeat Repeat Repeat reapeat,_
🦋🦋🦋🦋🦋🦋🦋🦋🦋🦋🦋🦋🦋🥵🥵🥵🥵🥵🥵🥵🤭🤭🤭,_
Memang seller yang best ah,_
25 at the meeting,_
At first,_
yg tebal,_
Order 9/9/2021,_
"Recognising the challenging economic situation, Sunsuria has been proactively employing innovative solutions to enable Malaysians to purchase their future homes",_
Quick and neat,_
sure will order again with this supplier,_
kasut cantik sama boek macam hargaaa 🤣 🧡‍🩹🥺thanks seller,_
gmbr n video xde kaitan just nak kumpol coins ja,_
"Belum guna lagi tapi bagi lima bintang dulu, hopefully nak pakai nanti masih boleh digunakan",_
Good haul from shopee mart,_
smp 26/3,_
Dah lengkap dah koleksi KTDD 🤗,_
confirm ngam,_
Tali dia pun kemas x mudah cabut mcm seten² mask tu kan,_
Jk wrote on butter album cover permission to dance,_
Barang dah sampai cntik sangat sangat next time blh bli lagi,_
Always my favourite place to buy ipad's accesorries,_
Puas hati dgn kaler yg ad,_
Penghantaran cepatt gilaaaaaaaaaaaaaaaaaa,_
Barang ok tebaik,_
Barang baikBarang baikBarang baikBarang baikBarang baikBarang baikBarang baik,_
not too say is good quality but worth the price,_
Aku tq tq tq tq tq tq tq tq tq tq tq tq tq tq tq tq tq,_
Maaf video n gambar tak brkaitan,_
casing tahan lasak even rm1 lebih jetapi cantik and boleh cover camera belakang so nk letak phone dekat mana ii tu dont worry tak crack sebab casing tu cover dia punya camerahalahpenghantaran pun awal jugak dia ship thankyou,_
Remote senang nk guna,_
The products safely arrived to me,_
bfungsi ngn elok,_
"so prettyyyyy , soo cantikkkk , recommend to buyyyy, go buy now",_
thank you so muchsecond time bought from this seller,_
Happy sgt2 penjual pn ok,_
tak try lagi tapi memang wangi,_
skali cenonet je,_
Terima kasih atas kerjasama semua ibu bapa,_
Tq seller semua seluar selamat sampai laju giler,_
Barang dalam keadaan sangat baik cantik nampak swag tq seller 🤗,_
Yummy and Spicy,_
Delivery okay and seller sangat baik,_
Alhmdlh slmt smpi ke destinasi wktu mco ni,_
"fast delivery, good quality, good value for money",_
vakum berjam2,_
Tq seller baju mmg cantik,_
Kali ini saya bleh bgi 5 lgi,_
terbaek seller smlm order arini dh smpai,_
"received in good condition,big packaging and will buy again",_
Seller terbaik yg perna berurusan,_
"Produk baik beg dia memang puas hati cantik terbaik,harga pun berpatutan dan penghantaran yang cepat tq",_
Essays can be formal as well as informal,_
mula2 bahagian utk letak hp tu susah sgt nk buka,_
Thank You for a beautiful gift,_
Refund due to package breakage,_
"Não tem preços nenhuns para quem só quer passar pelo mcdrive, e o pior é que o livro de reclamações online, propositadamente, não funciona",_
The context appeared different in Guinea-Bissau,_
BAG CANTIK GILAAA DAN BAG DALAM CONDITION YANG BAIK,_
Excited 🤩🤩🤩,_
siap da extend gurantee,_
Pghantran yg sgt laju cepat je dah smpai,_
Adjust potong bawah nanti kat kedai je,_
John Ng sunway,_
tqtqtqtqttqtqtqtqtqtqttqtqtqtqtqtqtqttq,_
barang tak try lagi tapi rsenya okay je alhamdulillah pasni boleh repeat lagi thanks bi dah kali ke 8 order,_
6257/6311 daripada 5,_
Material:kain sejukk,_
"ingtkan saiz besar, rupa sama saiz dgn napkins",_
Tpi kalau guna lame panas,_
Puas hati dengan bahan dia lembut,_
Isnin dh sampai barangnya,_
kena Kurus,_
hmm tq seller,_
TERIMA KASIH PANTAS SANGAT SUKA TERLAMPAU SUKA THANK YOU TERIMA KASIH SAYA SANGAT SANGAT SUKA TERUJA TERHARU HARGAI SANGAT THANK YOU ATAS KERJASAMA ANDA TERIMA KASIH SANGAT BYE!,_
Fast delivery form oversea !,_
nyaknyo fon teman kpanasan,_
packaging superb mantap mantap mantap mantap mantap aku bagi 5 bintang !,_
Ok tapi lambang nike kurang nice,_
"Di Sepanyol, perayaan awam dibatalkan di kebanyakan wilayah dan di bandar terbesar kecuali di Madrid, yang mana perhimpunan dihadkan kepada 7,000 peserta berbanding 18,000 pada 2019",_
N wangi je bay dia,_
nak guna poslaju,_
Terok sangatt,_
Baik pergnantaran sngt laju sepantas kilat di lngit sngt sangat laju,_
Barang dah sampai terima kasih pada pembekal dan pihak shopee memang terbaik semua cantik,_
The quality is not bad but received both de same design n colour,_
"barang sampai elok, kain lembut sejuk",_
",saya pm dia ignore",_
seller responsive when my parcel no movement,_
Thanks safely arrived even though its take a long time to receive it,_
Save value money,_
received the item in good condition and in a short time as well,_
ninjavan sangat lambat,_
Glittery sgt,_
Good luck every buddy,_
Wangi baru dia,_
xpasal2 kna cari hadiah lain bila mouse xckup item,_
"Menteri Besar Johor, Datuk Hasni Mohammad, yang juga Pengerusi Perhubungan UMNO Johor, berkata PRN itu perlu diadakan berikutan kerajaan negeri berada dalam keadaan amat tidak stabil dan berada atas ihsan pembangkang, yang mana ia tidak harus berlaku",_
X mudah panas,_
"lambat mcm beli barang luar negara , saya punya barang daru china pon dah sampai hahah , dngan leakingnya adehh",_
"barang mendarat dalam keadaan baik , selesa pakai dan ringan",_
"Product received in good condition, only that a bit delay from the delivery",_
"TQ JUGA SELLER SANGGUP TUKAR SIZE SEBAB TAK PERASAN SIZE M KECIK, SO MINTA ADMIN TUKAR SIZE XL",_
Russia's massing of troops near its border with Ukraine has sparked Western concerns that it may invade,_
ok juga siaran dia,_
Value for Money Rm30 for Shoes + Rm4,_
Thank you seller semoga ibadah kita semua diterima Allah,_
"Thankk youu thankk youu, dpt stokin sbgai gift sbb beli baju thnk you",_
_Mata tak bertentang_‍,_
"Delivered with good condition, quality look good, useful",_
Barang selmat smpai lme jugk dlm 2 minggu x silap,_
Pembungkusan yang baik dan harga yang sangat berpatutan,_
Perfectly comfortable,_
s the future of foldables!,_
"Selamat sampai semua, puas hati alhamdulillah",_
WL Kiew your love,_
I bought the wrong size at first but managed to return and get a refund and bought the correct size,_
Dah byk kaki repeat beli kat seller tetap tak mengecewakan,_
Thank you for the free underwear and sample perfume wana recommended seller,_
Thankyou seller kain cantik je,_
Thank you so much will place order again soon !,_
Braang dah smpai dgn selamat xde yg rosak,_
besar pun besar gila macam macam boleh buat dengan napkin ni,_
nice quality of mask,_
Kebanyakan universiti juga sudah bersedia untuk menerima semula kemasukan pelajar secara berperingkat yang dijangka bermula Mac depan selaras dengan kehendak Kementerian Pengajian Tinggi (KPT),_
Hope the product can work for long time,_
Jnt peram 8 Hari,_
Berbalo dengan harga murah,_
"shipping laju, order semalam harini dah sampai",_
"barang memang nice klau korang berhasrat nak cari beg mahal2 hm tak payah laaa bel ,yg ni pun sedah cukup nmpak mahal,tapi hrga murah mmng nice dh lama cari beg kecik tapi lawo mmng nice la bagi aku takda kekurangan langsung beli woi ruang dia ada 3 tapi bila dah guna tak rasa sempit langsung pun",_
star sbb kipas nya comel & delivery service laju,_
ni masa lom tau guna,_
BTS BTS BTs BTS bTs bts bbts bts bts bts bts bts btsbts bts bts bts bts,_
Parcel delivered safely to the rightful owner,_
"masa paket langganan yang grabbike dpt voucher potongan 6k, 7k, 8k, udh ngga ada yaa",_
9) in the last 16,_
Good value for money fast fast delivery good product good value,_
11 murah cuma rm1++ aje,_
Letak 1 je x brp wangi,_
"Ehh, takpa mommies",_
Sampai terus on & try,_
Worst platform ever,_
Delivery superb really recommended,_
"t give any recipe, but you&$HASHTAG$",_
nanti repeat lagi bnyak2,_
timakasih ya shopee,_
dpt free gift jgak,_
utk bulu roma ok la tp utk bulu yg tebal mcm misai xbrp nk ok,_
"I think this is original product sebab dia warna oren bukan kuning , and one more kalau pakai dia memang melekat warna oren kat tngn sebab yela kunyit kan",_
Suka gila kasut ni sebab dia bagi effect tinggi gitu and takde kotor pun memang totally putih bersih,_
Powebank selamat sampai,_
Love their service so much,_
Masing2 dh hilang rasa hormat pd org tua sbb depa angp mcm kwn2 je,_
The item is cool and good,_
Sesuai tuk spupu saya,_
fast shipping not more than 1 week already received tq so much,_
seller bagi lagi free mini kelender,_
Satisfied with the order,_
Senang bila nak makan buka mask,_
smua oke,_
New nord is definitely better than old op5,_
repeat order kli kdua beli lebih stok terbaik bosku,_
penghantaran pantas dr shanghai china,_
so i topup my wallet and want continue to pay but suddenly one of my menu is unavailable,_
Rates are increased on food panda and not giving as best rates as they were given at start,_
Beli awl2 utk baby nk lahir nnti,_
puting siap balut plastik,_
"Baju cantik, harga ok",_
Wahh sampai dah,_
"Pada hal, masa saya order, x ada mention pre-order pun",_
boleh next repeat,_
seller dah seal cap detergent ni tp still ada bocor sikit,_
i really need the coin,_
fast delivery and good service from the seller the product also good and suitale for pc,_
The item with long expiry date,_
The Ribena Concentrates are ok - these are my repeat purchases,_
thanks again🥰,_
Jsshjssjsjhskaajtdjttdjgjtdtdjtktsjfsjgjsjgsjgsjtitditdjtd,_
My discount for first time user wasted,_
maaf gambar video takda kaitan but seller very fast response,_
ee/4r4mp3t,_
Once of cheapest I've found in Shopee,_
Boleh purchase next time,_
hari ni 25/11 pukul 11 pagi dah sampai,_
Taste:my favorite 🤩 !,_
Tak salah saiz,_
"I never knew what it meant at all to live with a chronic illness until I got this, she said",_
DD s ddry see it ft t RSS feed for you see rdd Dr Dryer dsrr Dr to see d tree err TT f I d tggu nk RRr no doubt RR f see,_
2x dh beli ngn seller ni,_
Penghantaran sangat laju order kemarin harini dah sampai,_
Terbaik terbaik Terbaik terbaik Terbaik terbaik Terbaik terbaik Terbaik terbaik Terbaik terbaik Terbaik terbaik Terbaik terbaik Terbaik terbaik Terbaik terbaik Terbaik terbaik Terbaik terbaik,_
"SUIT PERFECTLY ,",_
"thought im not going to fit this but it act fit me well, the colour were so beautiful and the material were like the premium quality",_
nak sarung tu okay tapi ketat sikit kat peha maybe kalau ambik saiz L selesa sikit okay tuje,_
Seller shipped our within 24 hours,_
Iphone‼,_
He was replying to a question from Ahmad Tarmizi Sulaiman (PAS-Sik) who wanted to know the proposed asset acquisition to tighten the country's border control next year,_
Received in good condition will repeat the order fast delivery,_
"The courier service is really bad, like literally really bad, they kept my parcel for week",_
Just tips system should be after grabfood arrive not before,_
good product qquality,_
"Fast delivery, barang sampai dengan selamat, harap barang bertahan lebih lama,",_
"got small dent on the corner but overall, i like the services given by the seller good packaging as well 🤗 tysm for the freebies ^^ i was hoping to pull jay but i got ramyeonzz and group pc instead, it's okay",_
very good very good itemmm,_
Layanan penjual baikkkkkk,_
Tq igtkn barg smpai 17/11 tapi tkpe tahniahla smpai awal sebab aritu pos pakai sea huhu thank you yer,_
Tq everybody helping me to get this valued item,_
Seluar muat dan selesa pakai,_
Nasib mc bole bfungsii,_
"Okeyyy sukaaaa gilaaaa delivery lajuuuuuu pastu wallet cantikkk, comellll, and tak mengecewakan pastuuuu zip semua okey takde koyak ke apa, hahahahaha thankyou seller, teruskan bagi service tiptop mcm ni tauuu, semogaaa business terus berjayaaaa aamiin, beli je guysss takya fikir daaaa , berbaloii",_
harga pon murah highly recommend to buy,_
Does it work with US carriers?,_
"Dah sampai, semua okey",_
masa yg pantas,_
Brightness also good for u are hobby in fishing,_
Fast respond seller mmg terbaikk i hope the acc can last for 1 year as advertised tq so much seller,_
My granolas are arrived in perfect condition,_
"Usb light tersangat pendek, walau flexible tp lampu hanya mengadap ke depan, kalau sambung ke pc or laptop lampu akan mengadap ke atas je la",_
"Kali ke 3 repeat order, Nestle dari dulu sampai sekarang produk tak pernah mengecewakan customers",_
its soo bagus,_
Korg kena try brg pun berbaloi beli,_
Xpakai pn,_
Di update malah keluar sendiri terus gabisa checkout,_
Size memang kecik seperti dalam gambar,_
Such a great service,_
kualiti nampak sep3rti diiklankan,_
You can also choose m size,_
Ngam saiz Tq,_
hope after 1 months i can get my jawline,_
Tobat tak mengesai kalau hampa beli,_
🥰🥰🤩🤩🤩🤩,_
omg cute love gila this bag aaaaaa🥺🥰,_
Item's received in a good conditions,_
"Beg ni cantik, and besar juga boleh muat wallet, phone, powerbank & lain2 Suka sangat, delivery pun laju!",_
tak sabarnya nak bawak anak naik bot,_
This casing it's a great deal,_
s a sign of the devil presence in his house,_
"The state's Justice Department, which had previously identified Rusten Sheskey as the Kenosha officer at the scene who shot Blake with a gun, for the first time on Friday disclosed the names of two additional officers who were at the scene: Vincent Arenas and Brittany Meronek",_
Senang nak guna memang membantu kerja harian dirumah,_
need to be patient and must in a sunny day to get a better result,_
Effectiveness:very thick and high quality,_
Plan nk repeat color lain pula,_
Susu ini baik,_
ceritanya baru balik keje so unboxing lah korang boleh refer this video i ada masukkan bahagian dalam sekali basically seller respond well beg cantik sesuai untuk bawak sekolah pun okay sangat cantik love it so much semoga dimurahkan rezeki selamat berpuasa untuk semua umat islam,_
The delivery was so unexpectingly fast actually The packaging is perfect no holes on the plastic the collar has arrived very fast,_
elok baca manual betul2,_
Sy suka suka sukaaaa,_
"material nipis sangat tak macam stokin biasa , tapi kenalaa dengan harga",_
kualiti kain okeyy,_
bungkusan kemasbuku menarik,_
x de calar or rosak,_
tapi kalau kemek besar mungkin kene beli yg besar,_
Previous individual packaging look nicer though,_
Comel je sesuai sgt buat pakai hari2 xsakit kaki sbb material dia getah je bukan keras,_
"TEʀɮǟɛK ɮ$MENTION$ H$MENTION$,",_
"Best quality, good packaging",_
sekarang dah ada 3 color,_
"Among the homes that will benefit from the contribution are Charis Old Folks Welfare Home Shah Alam, Aiyide Old Folks Home, Lighthouse Children Welfare Home Association, Rumah Titian Kaseh, Persatuan Kebajikan Kanak-kanak Akal Tercacat and House of Joy",_
siap day free gift lagiii,_
Quality:5pcs cukup lengkap,_
Use it to connect Bluetooth speaker fast delivery everything works fine,_
warna maroon ngam,_
Baya2 ibu sya,_
"product Quality is fine, not too bad and just nice to wear",_
3 exactly,_
Untuk penghantaran mmg superb 🥳 order semalam arini sampai🤍 thanks seller,_
"We have to be on our guard, said Soon Huat",_
"Manhaj Rabbani, Ummah Berkualiti",_
wah banyaknya boleh dapatkan coins terima kasih bagi freegift,_
Expect you more authors,_
kotak hancurrr,_
"sedappp sangat, pacakaging pun mantap",_
the product totally same as the video and picturestrechable goodjust when first wash the greasy feel are muchneed to rinse,_
"First time dulu, beli satu",_
00am : Keadaan terkini di Tol Plaza Gombak hala timur,_
"Baju lembut, kain jarang sikit, biasa la kena pakai kain dalam",_
Pakaging mmg mantap,_
Maaf Gambar tk berkenaan,_
Emblem H gold,_
Lom cube AG,_
same pigeon nipples,_
Hati,_
Tq sy dh terima greentea,_
"Ngam2 je labuh dia, tak singkat tak gelebeh",_
iaitu barat,_
"Majidi has presented his film Sun Children (or The Sun) in competition at the 77th Venice Film Festival, which was held from Sept",_
Thankyou so much seller done well received,_
RECOMMENDED SHOP !,_
Rasa memang okay,_
cepat btl pos,_
8 hari dah sampai kl,_
Display punya la cantik berkilat,_
3 compared to Q3 2020 with an estimated sales revenue of B$74,_
s a pity they didn&$HASHTAG$,_
"Aside from making Padungan a tourist attraction, Wee also said if he is elected, he will ensure that the ageing population in his constituency would be cared for",_
Sangat- sangat puas hati,_
Cantek sgt bag tu nnti nk oder lgi,_
Inner dh selamat sampai,_
Step-parent,_
Maaf video n gmbq xda kena mngena,_
Great touch,_
Seller dpt ode trs hantar,_
tq bos klau rase cun nnt bleh oder lg,_
Asam sampai dgn selamat,_
Faye Chen double fillet o fishdouble,_
"Glue marks all over tyre, paint on rim got chipped",_
Tq seller sebab fast shipping dan sangat berpatutan harga,_
barang dh smpai dlm keadaan baikkk cntikk sngt ii saiz M fit untuk y15 thank you,_
Although we are seeing increased case numbers,_
Seller did not pack the item well,_
Hope I win I will gift it for my mom I don&$HASHTAG$,_
brg dh selamat smpai dan sgt cepat,_
btw towel ni nice,_
all items are good in condition,_
Kuali mantap,_
"Seluar muat elok, harga murah",_
Hey lu ada ini ngak <a href=$URL$,_
Saja beli saiz plg besar and x nyesal pun,_
"The Camera Works well for me , but I clearly understand",_
sedang elok dipakai,_
"Good product quality, received in good condition, FAST DELIVERY, good value for money, excellent service by seller",_
cuma courier buat plastik koyak,_
penghantaran pantas sangat,_
Hope it wil not too hot,_
"selesa di pakai,",_
"batal niat, guna kat rumah jela",_
ni murah,_
compared to other eyeliner,_
recommended seller sya tinggi 157 berat 48,_
Seller membungkus produk dengan bubble wrapped,_
sumpah best gilaaaa ngam2 muat,_
Apa yang menarik mengenai Event Orizon?,_
tpi tulahh,_
Our family favourite drink!,_
Made in Malaysia lg,_
Faat shipping!,_
Dlm ni ada wipes shj,_
jenis kuku kcik pun in shaa Allah boleh,_
yg pakai saiz biase better besarkan satu saiz,_
Aroma:Angry taste,_
ada satu yg rabak kt no 5 tu,_
Mantaaap boss,_
Penghantaran pada kadar biasa sebab dari china,_
The glasses didn't break into pieces,_
"Saarani, however, said it was not that simple to carry out mining even if a licence is secured, as the final say would always be after the EIA report is out",_
ink cntik dh test print,_
anak suka botol susu ni,_
suka sgt sbb effect nya cepat,_
Absolutely will purchase again,_
"Fast delivery, ordered on Monday received a week later",_
Cuma penghantaran dari kurier agak lambat,_
I bought all flavours,_
Taktahu muat ke tak untuk my dad tapi memang lawa eheks,_
barang sudah sampai penghantaran,_
But so unreliable for Grab Car,_
Lai YeanTeh Winnie,_
yang ni cair and ade bau yang kuat,_
2 days for delivery,_
Sebenarnya bukan sy punya,_
"The item received was good, no damage at all, will repeat again from this seller",_
Mmg puas hati sangat sebab tu beli ada next 2nd and 3rd purchased,_
WASHINGTON (Reuters) -The United States said on Tuesday it was pausing some cooperation with Guatemala's criminal prosecutor after last week's ouster of the head of an anti-corruption prosecution unit,_
tak tau apa yg patah,_
"Puas hati , meja okay",_
"Sesuai untuk baju dan kain,",_
3xl utk ank 12thn 4xl utk ank bujang 23thn,_
Anak saye suke sangat,_
Sesuai dgn cuaca sekarang yg panas lit lit,_
"Safely arrived, boots ok perfecto, i selalu pkai size 41/25",_
cepat n pantas sungguh seller buat keje,_
Accesories shop cost me rm80 for installation on my toyota Innova $MENTION$ KL shop Laser car audio,_
nanti kt repeat LG,_
I guess suitable with price,_
iron bsungguh2 pun tetap nmpk bkedut & mmng jarang,_
"Not working for a long time, I often use this app",_
tapi saiz nya tak sesuai dengan sis huhuhu,_
Very fast delivery & nice product,_
"I was updating it,if it was Worked well i will give 5 star Update:yep it kinda works good ngl- ty so much for making this app,salam dari kalimantan selatan!",_
Okokokokokokokokokokokokokokokokook,_
Doakan majlis saya berjalan dgn lancar okayyy!,_
Tested the selfie stick with the remote control,_
Mostly korean product,_
It is quite good for this price,_
Akal nk bgi cukup 50 word ja,_
mujur x sempat beli brand TRB lg,_
Nak ada lampu kena tekan lama sikit baru lampu on,_
It is also nice to see that residents have a space to go to for evening walks with their families,_
"For now, the research house is maintaining its projection for exports to grow by 19",_
Cun Cun cun cun cun,_
"Terrrrrrrrrrrrrrrrrrrrrrrrrrrrrrrrrrrrrrrrrrrrrrrrrr ,",_
Can protect my child's head,_
baju cantik semuanyer,_
Taste:sedap rasa coco tok abah,_
"SINGAPORE (The Straits Times/Asia News Network): Singapore and the United Kingdom will work more closely to facilitate digital trade between the countries, as part of a partnership that will make digital transactions by businesses easier, safer and cheaper",_
It is originated from Korea,_
"It is our responsibility is to protect the country, he said",_
smoooooooth!,_
More slowly than usual but still good,_
Program latihan khidmat di bilik mesyuarat pejabat pos n alamat e-mel ke gane bleber ke arah kebaikan untuk ibu yang menyusukan anaknya yang masih hidup atau telah ada sejak awal pagi ini saya dalam hal nok di bilik,_
"Alhamdulillah, elok functioning, dah 2kali buat",_
sy ambil hp zbook 14u g5 (v3),_
"Lampu terang, nampak masa depan",_
Loved this app,_
First time bought this to try,_
affordable pulak tu takyah beli yang mahal dah,_
macam skaf rambut ja HAHAHAHA cuma tebal la,_
Kain swaddle agak keras berbanding jenis dlu pernah beli,_
tapi Kali ni beras tak mcm selalu,_
The process is fast,_
Recommended seller Ni,_
Panjang dan terbaik!,_
"Thirteen of these are already in effect, and three more with Malaysia, Sweden and Finland are due to start on Nov 29",_
cantik n harga baik,_
Akan repeat design2 lain,_
terbaik pantas mantap,_
Great content man,_
broo this shop is superb la,_
Kudos to UI/ UX Team 🥂,_
Thankyou seller semoga dipermudahkan segala urusan 🥰🥰,_
Thanks for the fast and great service,_
"penghantaran pantas, beg cantik",_
Terima kasih bare baik,_
"Sudah sampaii ,",_
"Good quality, good price, fast delivery, overall good, tq seller",_
"Received everything well, no dented boxes, thanks!",_
thnkyouu for free gift tooo,_
dah banyak kali repeat kat shopee yang ni 🥰,_
Item received in good condition fast delivery agak susah nak guna tp boleh lah kena dgn harga terima kasih,_
Penghantaran 30,_
Parcel arrived safely and good value for the money thanks for the fast delivery,_
Hope it works well on the shoe,_
