Sentence,Tagged_Sentence
letak beras pun masih kukuh rasanya,_
Beli bantal utk sumbangan mangsa banjir,_
Smlm order hrnie sampai,_
Really fast shipping out my order,_
"My wife love its, will repeat again with you",_
Saya ambk saiz biasa saya pkai,_
pic&video just for coins,_
"ITS SO COOL,",_
but cannot using for call even on the Bluetooth,_
Thank you to the seller for amazing and such good packaging and also good service 🥰,_
Don't compare it to Edifier or Harman Kardon la k,_
die jual dgn kawan sek,_
didn't try to contact me about delivery,_
mmg nak pakai loose,_
"It won't open,",_
Selamat diterima pembungkusan yang baik,_
"Good profuct quality,good service from this seller,good price,good packaging,My order arrived safely",_
"Sbb kaki lebar kita ambik saiz 45,ingtkn dia besar lah tpi cuma dia pnjang je biasa pkai saiz 43,mybe klw ambik saiz 44 ok kowt Nie nk pkai ketara btol pnjang dia tuTpi tu lah dia punya tali atas tu x besar mne jdi nk masok susah ngn nk kluar pn susah",_
In love dengan all panties dekat sini,_
"hard case , tebal and fit perfectly",_
Nice packing🥰,_
"semalam beli, hari ni smpai",_
Puasa kn Harap sedap sebab tgk review org kata sedap,_
Barang dah lama sampailupa nak updatebarang terbaikkain cantiktak jarang,_
It's bigger than I thought hahaha,_
Buat kerja elok sikit decathlon!,_
"labuhh lebih bontot, tangan pon panjang elok",_
"Internet giant Tencent is among the Chinese makers of 118 more apps be targeted in the latest Indian ban, which follows a rumbling territorial dispute along a disputed Himalayan frontier",_
