Sentence,Tagged_Sentence
Jgn ragu2 beli disini,_
Cantik and comel tpi calar dekt kunci nya tu,_
"The material so besttt,",_
tpi penghntaran lmbat,_
guna inkjet,_
How the hell can we find wifi outside?,_
Kain cantik n murah,_
"Lancar, meskipun kadang2 tidak tahu apa yang harus dilakukan",_
"Kadang-kadang ongkir bisa berubah ubah, hari ini lain, besok lain, dan lusa lain lagi",_
memang sesuai bawa kemana mana,_
"Small in size, easy to",_
Tiba2 ada hutang 135,_
"Asri Hamidon, Ralph Marshal dilantik terajui Digital Nasional Bhd - MoF",_
and thanks to seller sebab bagi freegift,_
kalau sedp nnti beli lagi,_
Okay bag ni cantik sesuai untuk ootd gitew,_
they nice,_
Ordered on 11/1 received on 14/1,_
Terima kasih seller untuk layanan perkhidmatan anda,_
Lebih cantik dari sangkaan Thankyou A Lot Seller !,_
ank²,_
"It said access to hospitals was difficult and that security forces had stormed Al Arbaeen hospital in Omdurman, beating medical staff and arresting injured protesters",_
"Just one thing, alot of notifications (which you can turn off",_
Toilet bowl berbau harum,_
Apa apa pun terima kasih pada yang menghantar,_
Kualiti elok habaq hang!,_
Got black and blue colour,_
bukan nak rushing pun,_
Thank you seller fast delivery product is original not fake,_
nice seller nice product :) will deal with this seller again,_
Masuk renyuk2 je,_
ffjkfhgdddghjhfdfgjkivfssweetuip7743399fsrgbji5e3380igybkommmkjxzsaaaipoevnojxdehjii,_
penghantaran cepat Dan dibungkus dangan baik,_
Barang ori tk perlu risauu,_
Service lambat sedikit shipping,_
"I received it in three days, and the packaging is very good",_
sediyyhyyyyyyyyyyyyyyyhhhmmm,_
The cap is quite big but who cares,_
Sya BG,_
"15 confrontation at the Kabul airport that injured two airmen, airfield security forces stopped yet another Afghan Air Force helicopter from taking off",_
"Tp tnya seller sblom beli, dia kata 2xl muat klu 90kg nk pki",_
Feel light on face and good coverage,_
Bubble wrap dia tebal sangat jadi tak pecah tq seller terbaik,_
I am running out my toilet paper,_
And enjoy your shopping time!,_
5 as the year began,_
Suite to use in every corner and car,_
"Dah guna sehari, nice berfungsi dgn elok",_
baru oder dah sampai,_
Shawl yg super selesa & sejuk,_
Brang dh sampai tq seller n ninja tudung ok murah n cntik berbaloi nanti oder lagi walaupun murah tapi tetp yg terindah,_
ganti2 pakai dan utk gift jg,_
Will order again with seller but will never choose J&T service again,_
"weekends plak dia pos,terbaik",_
Sesuai dgn cuaca kt M'sia,_
Dan sangat kukuh dan kuat,_
"Alhamdulillah,Barang selamat sampai Thank seller,Barang dalam keadaan baik",_
Looks bigger thsn i expected but it is still pretty,_
Jd saya pun beli jgk la,_
No spill or damaged item,_
Siang Pure work the best of all,_
ok nanti Beli lagi,_
"Cantik-cantik jam nya,murah pulak tuu!",_
Berat 45 tinggi 154 amik size M,_
order 2xl,_
Functionality:besar dan berbaloi dngan hrga,_
Lawaa bag,_
"Good quality, good product, fast delivery Good service thanks",_
saje je beli nak cukupkan jumlah,_
"Mask quality is good , soft and comfortable, no strong smell",_
Naren Ren,_
Order 20 naskah sekaligus,_
seriously sorry for money,_
"Ramuan: Akar Teratai, Kentang, Kulat Hitam,",_
Received in good condition this is my second purchase :) this is my fav seller to buy casing,_
"Super super super fast delivery,",_
Harga tak sampai rm10 tp kualiti bagus,_
Boleh dimakan dengan oat,_
Not yet open and see,_
"The albums are very secured, no dented at all",_
Tak sangka kualiti materialllllllll best macam material topi have2 gitewww,_
"Aku beli M,sampai pun saiz sama mcm M yg selalu aku pakai",_
Saiz ok utk anak umur 3tahun,_
"all items at the right are free gifts, thank you",_
Quality:plastik elok,_
sori xsmpt ambik gmbr,_
Very recommended the delivery so fast,_
"BALING: Pelajar Terbaik Sekolah Menengah Agama Kedah 2020 maut selepas motosikal ditunggangnya bertembung kenderaan pelbagai guna (MPV) di Jalan Baru Baling-Kupang berdekatan Charok Nau, di sini, pagi tadi",_
membatu bgt,_
Not sure how long the vacuum will last but suction is definitely strong for such price paid,_
"Good afternoon,item received of good condition",_
"Baju smpi cpt, design menarik, kain pun cantik memuaskan spt dlm gambar",_
Saya beli utk raya haritu and sangat berguna,_
Brg dah sampai siap pasang,_
kain pun sedap giler,_
the apps easy and more professional than this,_
mmng maggi goreng paling sedap mcm nama dia juga,_
"besar mmg besar tapi klau selalu pakai nnti dia jadi kecik sbb saya dah beli sebelum ni , ni mak punya ngan nenek",_
my/ for more info,_
Akhyar dan Quentin yang terlepas aksi berdepan Laos selepas didapati positif COVID-19 dalam ujian yang dilakukan sebelum itu dan perlu menjalani pengasingan selama 10 hari,_
Feels luxury,_
tpi material mcm agak nipis toi sesuai la dgn harganya,_
"Product received in good condition, good product, good quality",_
mula2 xberani jgk try brang 3 4,_
"worst is you are at Shopee's mercy, as you have already paid",_
Taste:tak try lagi haaa,_
good when hungry,_
ada jahitan pinggir,_
sarung bantal dia ada 1 ja,_
Shan Chong,_
"We agreed to hold elections before July 2023, Al Jazeera quoted him as saying",_
Received in good condition all the products,_
"TOKYO (Reuters) - Finishing a dismal 42nd in the Monday's individual triathlon, American Morgan Pearson had a small plea for his mixed-relay team mates this week: 'Every so often, just tell me that you believe in me?'",_
Brg smpai dgn baik n cepat sampai sarawak ambik masa 5 hari,_
Aroma:just nice and bau dia wangi,_
"PENGHANTARAN CEPAT BAGUSS , KUALITI BARANG PUN TERBAIK , BOLEH BELI LAGI",_
I bought almost 600,_
Arrangement:quality is okay worth the price,_
produk ok xde masalah,_
"Video putus cinta, kecewa dan sedih pasal cinta - Dengarkanlah",_
Makanan sedap elok sampai takde koyak pecah,_
Design:langsir cantik🥰,_
"84, Hong Kong's Hang Seng Index increased 1",_
"Thats all, no hate to seller",_
Delivery was very fast too!Thanks for the freebies!,_
"Expiry date is ok, delivery as expected",_
Aku ke sini sbb dia yg bongkar illuminati kat msia,_
i Like will repeat,_
zip ok smooth je,_
skg dah bersalin repeat order lg utk pakai rye,_
Thankyou seller 🥹,_
"lepasni memang repeat ,",_
Elaine Goy,_
kain mmg cantik la,_
New Zealand's decision to delay the reopening of its border has forced a reworking of the schedule of the inaugural Super Rugby Pacific season with the competition split into two for the first eight weeks,_
baju jenis RAGLAN,_
iph 13 is the most balance,_
"Good product quality, good value for money , have some defect but it's okayyy ^^ , i pull my own biasss tooo,",_
com/watch?v=1wR2wYpWZGk,_
Seluar dalam pun sangat sangat okay,_
"The university was looking to work with entrepreneurs interested in commercialising the technology, so Syafik acquired the technology which at the time only incorporated a flexitarian option (70 jackfruit and 30 chicken/beef) but over the years, he kept working to produce a 100 plant-based jackfruit-focused burger patty",_
Sampai = 4,_
27419874-1632671606,_
"They've won a European Cup (in 1982), they're the biggest club in the Midlands and one of the biggest clubs in the United Kingdom, Carragher said",_
Terbaik seller cepat sampai tq tq,_
cantik dan nice je tula kena lipat sendiri hahahhaha,_
RM0 UMobile: One step closer to WIN RM100 Shopee voucher with UMerdeka Giveaway!,_
Cantik semua katanya,_
E-Takaful Certificate will be ready at MyZurichLife soon,_
Pemilik kedai cuba mengejar suspek namun gagal,_
"Semalam order,ini hari dah sampai",_
Quality:cantik dan selesa,_
Tinggi 167cm berat 95kg,_
Untuk pakai harian jam ini mmg ok ngat dgn harga yg reasonable,_
Penghantaran laju tp j&t peram barang,_
Terbaik dah banyak kali order saller pun peramah terbaikkk,_
Tapi tak try lgg,_
"Jaehyuk holo postcard,",_
Putih atau kuning saya suka je,_
!ank2 pun suke nk vacuum rumah,_
pakai lama lama jadi tak selesa,_
im a fully satisfied buyer,_
83 sen as compared with 2,_
so boleh lah ank minum utk 2 kali,_
Scrub pon wangi jeee lepas pakai tu,_
Good to finally taste this product,_
Poslaju lebih pndai jaga barang drpd jnt,_
hope lost lasting,_
Arrived safely after more than a week,_
Received in good condition love the color,_
"slate gray, turqouise, flamingo pink, nude, thulian pink",_
"Salam ramadhan n selamat hari raya,",_
Kualiti biasa je tapi tak expect lebih la ikut harga dia pun gitu je lah,_
"Double tape is 3M, quality is acceptable, price is cheap",_
takpe nti sy beli lg saiz yg kecik,_
I Like to have this one $MENTION$,_
Fzjtskgdifsyrsjtdoufkhdkgxkgxkgxkhxkbckgxjtsifaifkhxkhxkhxkgxkhcohclhclhclhbckbckhdjgdjgxkhckhckhck,_
Zzxxxxxzzxxz,_
Pembungkusan luar ade sticker fragile,_
Comel dooo love sangat2,_
Sorry gambar video takde kaitan sbb beli bagi kawan,_
RM0 TRIIS (I-Isolate) - Sekiranya didapati positif segera lakukan kuarantin/pengasingan kendiri dengan penuh disiplin supaya tidak bahayakan,_
"Material:bagus, lembut",_
Baju dah sampai dlm keadaan baik 🥰 puas hati sgt beli kat seller ni tau,_
Nakssss🥺,_
Value for money trustted seller,_
It kills small business owners and their own delivery riders,_
harap2 muat,_
"Penghantaran ok,packaging pun terbaik",_
Just nice not healthy as compared to others roasted coffee,_
sngt puas hatiii,_
Umur adik 1y 6m,_
Seller pon cpt je post brg,_
Akan selalu repeat sebab anak mmg pakai brand ini,_
daa siap gubah daa pn,_
good qualityand goodservies,_
adik suka sangat nanti nak beli lagi,_
Sgt berbaloi dgn harga dan penghantaran agak pantas,_
(Sebaliknya mendakwa ia) hanya mendoakan keselamatan semua penduduk supaya tidak berlaku banjir,_
"terus rasa nak repeat,nak grab color lain terima kasih seller",_
Letak lah alquran kenapa tak letak,_
tak reti baca kee apa yg kita order,_
Just follow the instruction in the youtube link given,_
"Beg comel , tp jahitan tidak kemas ,mcm cincai nasib la beli dpt 18sen seja jadi tdk rasa rugi , tq seller",_
Penghantaran yg sgt cepat & packing yg bagus,_
Indahnya ciptaan Allah SWT yang maha pemurah lagi maha penyayang,_
Mmmm patutu tunggu lagi lama,_
kain pn cantik2,_
Barang sampai dengan selamat cukup 3/3 overall okey,_
Terbaik seller🤝🤝🤝🤝🤝🤝🤝🤝🤝🤝🤝🤝,_
"She will try to go soon but the conditions have to be right, he said",_
"My baby 2months, weight 4kg, pjg 58cm masa dlm gambar ni",_
Baju anak kaya dah sampai tq uni baju cantik sngat soooo cuteeee,_
2 hari yang lalu,_
"Air Selangor ingin memohon kerjasama orang ramai untuk mematuhi penjarakan fizikal dan memakai pelitup muka semasa mendapatkan bekalan air dari lori tangki, kata kenyataan itu lagi",_
Taste:Premium Taste,_
Laju je pos,_
5/5 not the best quality,_
Delivery time was about two weeks or so but was ok,_
penghantaran agak lama tp nasibla kualiti kasut amat2la mmuaskan,_
sirplease make more and more videos please sir your style is the best in class most valuable,_
apapun tak boleh expect byk sbb harga pn murah,_
"MUNKIN SAYA NAK ORDER LAGI ,KALAU BOLEH BERI LAH SAYA FREEGIFT NANTI",_
So everytime I download the apps myself and uninstall all the apps that seller giving,_
Everything seem ok,_
Barang dalam keadaan elok semua,_
Telecom Italia (TIM) board members will face off this Thursday over plans to reorganise Italy's biggest telecoms group and extract value from its main network assets as top investor Vivendi challenges TIM CEO Luigi Gubitosi,_
REALLY RECOMMEND TO BUY HERE CAUSE YOU WON'T REGRET IT,_
Brg semua sampai cukup,_
Can't wait to try it soon,_
Such a reasonable price,_
"My order arrived safely, but it took longer than I expected because J&T courier is rather slow in delivering the package",_
Barang sampai dengan baik selamat,_
Kain renyuk,_
"TQ Tolong subscribe,like,komen channel YouTube badanorangbesar bob",_
"Labuh okay, ngam2 je",_
Tali dia longgar,_
Absorption:Blum cuba harap ok lah sbb tgk kotak dia mmg mcm ori,_
BAGUSSSSSSSSSSSSSSSSSSSSSSSSSSSSSSSSSSSSSSSSSSSSSSS,_
Very good toothpaste,_
Bungkudan diterima dlm keadaan yg baik,_
Order received with good condition and no damage,_
merasa jgak pakai btol ppsu,_
Fast delivery and its really works very well,_
Very cute & suitable for everyone,_
"He spoke after Russian President Vladimir Putin said the United States and NATO had not addressed the Kremlin's main security demands in the East-West standoff over Ukraine, but that Moscow was ready to keep talking",_
100kg ++ pon muat,_
Anyway like the taste,_
It's arrive safely,_
Okay utk pack barang baby nak bawa ke hosp,_
Puteri Wangsa incumbent Mazlan Bujang claimed that 23 Tebrau Bersatu branch chiefs and action committee members have decided to leave the party when in reality there are only 17 branches,_
Tq seller barang dh sampai 🥰🥰 penghantaran pun laju cantik sbb tu sampai 3 saya beli sbb ank suka & lgipun dia punya besar²,_
cover jam elok dan bkn silicon biasa,_
Penghantran laju yakmattt,_
Tab matisempat masuk gmail,_
Thanks you for the item the item was in good condition with bubbles wrapped,_
Perfume ok dan wangi,_
"bagus,bagus,bagus,bagus,bagus,bagus,bagus,bagus,bagus,bagus,bagus,bagus,bagus,bagus,bagus,bagus,bagus,bagus,bagus,bagus,bagus,bagus,bagus,bagus,bagus,bagus,bagus,bagus,bagus,bagus,bagus,bagus,bagus,bagus,bagus,bagus,bagus,bagus,bagus,bagus,bagus,bagusbagus,bagus,bagus,bagus,bagus,bagus,bagus,bagus,",_
🥝 NANTI NAK BELI LAGI 🥰,_
Love sungguh!,_
in Glasgow (1500 GMT),_
Ee Boee jeng f5,_
Packing good!,_
Poloroid sampai dengan selamat,_
Suit well for daddy just wrong size for daughtr,_
Printer sampai cepat tapi nak install susah sikit,_
barang semuanya elok tak rosak,_
Taste:Try,_
"Kiriman bru smpai,lmbt smpai d j&t almt sya sbb sesat ke Kuching tpi sykr akhirnya smpai jga",_
Design yg comel,_
Stok bila,_
"Dapat bantal, bantal peluk, selimut dan tilam",_
It only took 2 days to deliver to me,_
Affordable and cute tau!,_
Thnkyou seller !,_
kain okayy cntikk,_
penghantaran sgtlahh lambat,_
"Kasut memang cantik tiada kerosakan yang penting semua ok , cuma kotak je yang rosak tpi dalam semua ok memang terbaik lhh",_
Harga sehelai murahhh,_
kalau kaki jenis kembang tk sesuaii beli nii,_
Safety:terbaik jugak,_
Laju gila delivery smlm oder harini dh sampai,_
will repeat again n again soon🤭,_
packaging ok tak rosak,_
Quality:wrna seperti dalam gmbar 🥰,_
Effectiveness:haven't used yet,_
Yee Wau,_
"pening kepala $MENTION$ senggugut kalau sapu, auto ok",_
tetap kena pakai mask sebab covid kan skrg,_
Boleh bawak pi jalan2 dahh,_
Ninja Van 27/7/2021 28/7/2021 🥰,_
"if you wear it for long period, it feels like nothin on your lips",_
Anak pakai pon tksakit sbb takketat sngt,_
"Btw, tudung kain best, xpns",_
She was just four years old when her book,_
very fast shippg,_
ttteeerrrbbbaaiiikkk,_
nanti repet lagi,_
Postage seminggu okla,_
"Harga murah & berpatutan, produk berkualiti, rasa sedap, penghantaran pantas",_
Sorry for the bad quality review,_
"Well Packing, good condition, 100 Original, good value for money",_
🤣🤲🤲🤗🤗🤲🧸🧸🤗🤲🤗🤗,_
jarum semua tajam2,_
"I want to reset password but when I want to insert new password,I cannot proceed to the next step for the unknown reason",_
Absorption:Good absorbtion,_
()5shopee,_
sibuk sikit lately,_
Yaya Manan,_
This have slight fishy taste just make sure to drain and rinse before use,_
suka sangat yey,_
Waterproof and sesuai utk org2 bujang bwk pegi travel dekat2,_
Cheaper than others and fast delivery to east Malaysia,_
"Sepatutnya shopee kena buat dua jenis penilaian,",_
"However, those who always insist on decisions based entirely on reason will find it difficult to see the benefit in allowing some things, such as hiring procedures, to chance",_
"WITH the resumption of physical classes, Carlsberg Malaysia has given out 622 facial recognition infrared thermometers to 300 schools nationwide",_
5xl is like 2xl,_
"Xde tanda halal, tulisan bhasa tamil",_
~MİN YOONGİ ~AZERBAİJAN ARMY,_
Suits my 7yo and 11yo boys,_
Kalo line internet lambab jgn mimpi dpt lock,_
Harga pon xmahal,_
Very huge but niceeeeeeeeeeeeeeeeeeeeeeeeeeeeeeeeeeeeeee,_
tapi oklah sampai awal daripada yang dijangka,_
2 hari je penghantaran cepat da sampaiii HUWAHAHHAH,_
Harga almari murah,_
"this is disaster experience with the ui , cannot properly point my address , the ui break randomly , facebook login still in dev mode",_
"In fact, I campaigned for it, to make sure that we had a more true-to-the-book Geralt in the show, Cavill said",_
Good quality fast delivery best materials thanks 🤍🤍Hihi,_
Biasanya saya pakai saiz M standard,_
"DHL, very rough",_
Nice bag with zip,_
Fast delivery by seller and also courier company,_
Btw i like it Sy beli ye,_
Thankyou ya 🫶,_
"Pmpers smua ok , nti blh repeat order lg",_
Murahhh dengan free shipping,_
Nice purchase Alhamdulillah kami puas hati,_
oneplus never fails to impress $MENTION$,_
"cepat dapat, seller response pun cekap",_
not all the clips fit the original pieces in the myvi,_
It was a fast delivery and received in a good condition,_
& kaler coffee tu brand B,_
thank u for this pretty comfortable cardigan!,_
xde pn free gift,_
Sepatutnya ambik 41 sedih kene beli sekali lagi adui adui,_
Taste:malaysian - style starbucks,_
saiz m buli muat 50-60kg,_
cuma plush toys tiger je slh anta,_
teh ori rasa pure tanpa uncangggg thankhou selllerrr,_
Mula mula susah jugak nak pasang,_
s plant based oyster sauce!,_
Seller provided enough dust removal sticker,_
bungkusan elok xde kerosakan,_
All the products are safe in bubble wrap thanks seller 🥰,_
"Tp sebab jiran dah mula kerja balik, tak sempat nak buat",_
so u guys yg nak beli anbik yg 1 besar size asal kalau nak nampak longgaq,_
"Google berkata, jaringan itu merangkumi kira-kira satu juta peranti pengguna Windows di seluruh dunia bagi tujuan jenayah termasuk mencuri tauliah pengguna dan menyasarkan mangsa dari Amerika Syarikat (AS), India, Brazil dan Asia Tenggara",_
boleh la kena la dengan harga,_
lainkali saya pasti beli lagi,_
"Рис-дело тонкое, как Восток",_
"Ice pack, cooler paper n cooler bag terbaik semuanya",_
boleh la buat hilang boring,_
"Seller took 1 day to post out, received the next day",_
i dah pakai,_
Nvr tried yet,_
my second time using this service,_
sempat pack dlm beg,_
air pon cepat kering,_
dia letak,_
Apa pon thank you bila respond kat chat,_
Get RM5 FREE Internet credit when you spend RM38 on Internet passes by 31 Jan!,_
Tapi baju ni mmg jenis cutting loose kennn,_
very tasty health soups with lots of choices and affordable price!,_
This is my 3rd order with SOL,_
The hangers are solid ya,_
"cntik sgt2,smpai td trus pkai,i nk oder lagi tp dah hbs,next oder lagi,tq cntik",_
earbud berfungsi dengan baik,_
skrit lawa kain tebal harga berpatutan penghantaran cepat puas hati dengan service tq seller,_
elok packaging x pecah,_
1 kira cepat juga sebelum ni beli dan smpai skrng masih dalam keadaan yg sama tk putus,_
Oke bgt,_
Effectiveness:fast delivery service and very good packaging good value for money,_
"Alhamdulillah, repeat kali ke lupa dah",_
terima kasih lain nak beli lagi,_
FYI made in Australia,_
A statement released by the New South Wales police said that a man had been arrested at about am local time after allegedly breaching a restraining order,_
tq seller yg sgt nice,_
Received Storage Box in good condition with bubble wrap,_
"Beli diri sndiri,umi,kakak n adik",_
"Percuma banyak promo g bisa d pake, paling Jakarta, bandung dan kota besar lainnya",_
so beautifullllll,_
Taste:Good for me,_
next boleh order LG🥳,_
I gave it to my mom as a birthday present,_
But not received,_
"warna masih lagi sama dengan masa mula2 sampai, merah menyala",_
Thriving community farms,_
"It is cute & pretty, comfy to wear, fit me well, thank you <3",_
penghantaran lambat barang semua okey nice cantik worth to buy,_
180 selepas ia melepasi paras sokongan sebelumnya pada RM4,_
"It is a symbol that is very close to the hearts of PKR members, he said",_
Semua swaddle comel2,_
Desmond Chui,_
blh la lanje akk,_
sorry for the unnecessary photos^^,_
At first salah print then seller minta maaf and hantar yg baru,_
These kept happening for 4 days,_
Bateri lama btul2 dah kiok,_
Dalam nie nampak besar,_
Lawa tp agak besar pulak,_
"Thanks seller, got one free gift, fast delivery, good value of money",_
terbaik murah dan penghantaran sangat pantas 🤍🤍🤍🤍,_
Akan dapat ikan klau tempat terbaik,_
GITARRR CANTEKS,_
Thanks shoppe give free voucher,_
fast delivery and well received and nice packaged,_
"Love the special fluorite bracelet,",_
"Bekasnya tak ssh pun nk psg, kejap je dh siap",_
Sudh sampai bju ank sya,_
Penghantaran yang boleh dikatakan cepat la jgk,_
"Menteri Besar, Datuk Seri Aminuddin Harun, berkata bantuan itu sebagai tanda penghargaan dan terima kasih kepada penjawat awam yang sentiasa mencurahkan khidmat bakti tanpa berbelah bahagi kepada kerajaan dan rakyat",_
Will come again if needed,_
Kena oder besar lagi dari yang biasa,_
I like your hair color j hope,_
mujur betul2 dpt straight cut punya,_
stocking murah dah comey good value for money sangat affordable suka suka,_
kenapa tak balut milo tuu,_
Thank you seller barang dah sampai cantik sgt,_
Effectiveness:baru 1st time nak try,_
Spt brg reject je,_
Tudung sampai dengan selamat tiada sebarang defect,_
I'm so dissapointed with this new update,_
One packet arrive not in vacuum,_
selesa sangat2 mcm kasut harga ratus2,_
Item good! Thank you $MENTION$$MENTION$,_
so beli 34,_
Kain pelikat yang cantik dan menarik 🤩 kain batik yang cantik dan menarik 🤩,_
Kopi terbaik sudah pun selamat sampai dan mendarat,_
I'm super satisfied hehe,_
Tq dah sampai td,_
"Kain okay , material okay",_
perfume slmt smp 17/10/21,_
"sorry for the random pic and video cause i forgot to take a pic of this jogger but it is okay, i use it for my part time job",_
"I was not at ease before, but now I'm at ease, The workmanship is very, very delicate, the effect of shooting video is really good, the picture Very stable",_
"sorry gambar takde sebb beli untuk abang, thank youu barang sampai dengan pantas, dan good quality product, thank youuu",_
Try to review or unbox M51 for the next video,_
Barang2 momo semu puas hati tqttqttq,_
"Sedapp dah try 1 sachet, masam manis",_
Lalalalalaalalalalalalaalalalalalalaalalalalalalalaalalalalalalaalalal,_
crazy about oneplus nort 2 best features camera battery love you sir$MENTION$,_
senang sarung je nak pergi jogging ke pasar,_
Barangan yang dipesan telah diterima dengan selamat,_
gamba dengan video tak ada kaitan,_
Apa apa tq seller,_
Barang saya selamat diterima dlm keadaan baik dan teratur,_
My Dream Smart Phone,_
"Really trusted sellerrrr,",_
Just an add in and extension to chrome,_
next boleh repeat lg every month,_
"buku sampai dalam keadaan baik, bungkusan yg sgt kemas, penghantaran pantas macam kilat",_
"Mula2 steam nak start mmg ambil masa,bunyi mcm motor rosak,bimbang juga",_
Hsjsuehdjdusjsushdegejnehevevhsubdbhsnjsihsnsnjshdbb,_
Will have to get a size smaller,_
Boleh Cubaaa,_
tempat menghabiskan duit,_
Kualiti gamba hasil kamera sangat cun,_
harga berpatutan dengan quality,_
Semua ok and sesuai saiz nya,_
"Battery provided, so easy can test it faster, function well",_
Dapat digunakan dengan baik dan berfungsi dengan baikk,_
Purchased many time from this seller because I love their pan mee taste so good and delicious,_
Walaupun kotak kemik2 tapi barang ok and stand ni very sturdy,_
masing² nak selamatkan diri,_
Tp kena blend buah hat lembut sahaja etc pisang,_
Gerard Chan this bak kut teh looks nice bro,_
"The increasing demand for contact-less service during the Covid-19 pandemic has boosted the application of restaurant robots, which are already helping China's labour-intensive catering industry tackle mounting labour costs and improve efficiency",_
Barang mmng a+++++,_
The companies said they plan to put thousands of Stellantis Ram ProMaster electric vans on the road every year,_
selebihnya minta tech,_
Tapi lastly sampai juga sebelum tarikh d perlukan,_
Terima Kasih Courier & Very Recommended,_
I chose black colour for buying,_
first nak setting kelam kabut jgk tp overall ok,_
Mesin basuh dalm keaadan baik,_
"B staff weekend Danyway, weekday brunch",_
Tapi material kain not as per expected,_
"Only the paint is not so good, still acceptable",_
🤲🤲🤲,_
"Terima battery dlm keadaan yg baik, Battery berfungsi dgn baik",_
Siew Kai Wen,_
Alhamdulillah muat elok je baju,_
"Received product in a good condition as per order, fast delivery & thank you so much seller",_
Yg penting lembut xsakit tumit kaki,_
DIA KATA NEW PACKAGING,_
Has no regret to buy this,_
Group tours that arrive as part of the Green Travel Zone reopening scheme will also be required to test for Covid-19 (RT-PCR) and await the result in an approved hotel within 48 hours before commencing tourism activities,_
Sampai penghantaran ok cepat packaging baik,_
apa pun xpelh mana2 pun xpakai dh,_
Jangannnn lupaaa,_
"39 jelah,",_
"Service pantas, kain elok sesuai harga",_
OMG so in love with this sunscreen,_
then boh topping,_
🤢🤢,_
kalau ada tolong info,_
Seller was really nice and item are all good condition,_
Have a as free gift,_
And seller bagi gift lagi,_
Very fast delivery & secure packaging by seller,_
"Delivery was okay,a week but parcel ni lagi cepat smpi dari parcel dlm negara punya lol btw my h-163-165 cm,w-48-50 kg & the size is okay je x terlalu besar,x terlalu fit & vest jatuh smpi part tgh pinggul",_
Delivery quite slow but worth buy,_
Botol besar jari telunjuk je,_
belah kiri beli dekat sinii,_
Quality:Seller bagus,_
shipping pun lajuu jakk,_
untuk anak-ii pakai dorang suka sangat,_
"Presiden, Muhammadu Buhari, dalam kenyataan semalam mengutuk serangan bersifat kejam dalam pembunuhan terbaru itu",_
"Kf94 so nice, sama tali dia kuat, and ada lekuk di hidung",_
puas hati beli beg ni sbb ternampak seakan2 mcm ni dekat cotton on harga RM75,_
Too Good,_
