Sentence,Tagged_Sentence
Good good good good delivery laju good good barang pon okayy bGus,_
"Really like the colour of the bag, quality also nice",_
Barang sampai dgn baik cantik,_
dia sdp pedas2 manis bungkusan pon dibungkus dgn baik 🤩malangnya penghantaran lambat smpai,_
xsabar nak psang kat kereta,_
sedap dimakan also,_
Dua dua barang sampai dalam keadaan baik,_
mmg sedap boleh beli lagi,_
"Color Quality:better than laser printer, quite good",_
nt blh repeat lagi sngt2 recommend pd yg nk mudh susu tak tumph,_
Pasni boleh order lagi,_
niiiiiiiiiiiiiiiiiiiccccccccccceeeeeeeuuuuuuuuuuuuu,_
Yeayyyyyyyyyyyyyyyyyyyyyyyyyyyyyyyyyyyyyyyyyyyyyyyyy,_
Size : Quite thick,_
Mbok jangan b3sa4 2 aplikasinya,_
Sorry xde gambar semua dh basuh & simpan,_
harus memang beli lain,_
Effectiveness:refreshing,_
Display: good material and comfortable to use,_
"Average quality bean, the beans are not evenly roasted",_
"terima kasih seller , penghantaran laju gilerrr",_
Harga mmg xmasuk akalcantik sangat,_
"Another tactic deployed by Cheung which he wasn't too proud to admit, was when he attended wedding ceremonies of his friends",_
2 sudah smpai depan umoh,_
Smpai dalam keadaan selamat tanpa sebarang kerosakan,_
"Tudung sampai selamat & elok, delivery memang laju",_
graphics by Gavin Maguire,_
"LONDON: Bintang Arsenal, Bukayo Saka dan ejennya berminat dengan prospek untuk berhijrah ke Liverpool pada masa akan datang",_
masalah senggugut saya sdh kurang berbanding sblum ni,_
"chain of command personnel landed at Rzeszow-Jasionka airport as preparations continued at the base, which is near Poland's border with Ukraine",_
Akun saya di bekukan ga tau gara2 nya apa padahal sebelumnya saya sering pake jasa ojek online grab apk nya ga membantu banget saya kecewa,_
"Kain serious sedap and puas hatiii,",_
Kali ni beli size ngam,_
Satu jam je siap,_
Tp utk sandal ne myb perlu beli saiz 38,_
Thanks ^^,_
"President Joe Biden's administration seems in no hurry to cut a deal unless Kim shows a willingness to wind down his nuclear weapons program, a treasured sword he sees as his biggest guarantee of survival",_
5 billion purchase of automotive technology firm Veoneer Inc last year,_
"Banyak promo, tp akn lebih baik promo unt pembyaran cash ditambah lagi",_
Hope to carry this on my hand!,_
Cuma satu yg kurang,_
Effectiveness:nnt nk try bg anak guna,_
T-shirt dh sampai,_
dress n seluar dh smpi,_
sehari je brg dh smpai,_
"pembungkusan yg kemas ,x tumpah atau bocor",_
Ada kecill skit je,_
Brg dh sampai muat ka dk tu xtau lah sbb brg ad rumah Tpi kasut mmg style ala ii stylo,_
"Received all in good condition, speedy delivery",_
barang sudah sampai elok kemas,_
Is find my integrated in them?,_
Kecik jeee tpi cuteeeeeeee heheehehehhehehhehehe,_
Overall semua okay cuma biasala kotak je kemek sikit,_
Puas hati dngn kualiti gambar,_
Gmbr n video xde kene mnegena,_
Barang selamat sampai barang baik terima kasih,_
"Received in good condition n well packaging, will order next time with this seller",_
biasa lh smpai masa tertentu pasti uzur ampai ni🤣Dah uzur kita beli je yg baru,_
"She'll also refer patients to physical therapists for pain in their necks, shoulders and backs",_
Pump pon berfungsi dgn baik,_
Cantik kasut lembut ja bila pkai,_
Function good,_
Tpi better amik saiz besar sbb saiz L dia sies mcm saiz s je,_
GOOD,_
"tapi sayang, colour yang di tengah tu pecah :((((((((( why like thattt",_
tu gambar sekerat,_
I end up pay extra rm2 for parking and extra rm2 for tol to collect the parcel,_
menaip kt office,_
Sgat puas hati,_
Thanks seller n abg posmen,_
Rasa mcm kicap takoyaki,_
Goooooooooooodddddddddddddddddddddddd goooooooooooodddddddddddddddddddddddd goooooooooooodddddddddddddddddddddddd,_
okla bole buh byk2,_
Free gift baked bean expired Dec 2023,_
Cuma sekarang dh susah nk dpt free shipping guna shoppee ni,_
10hb baru sampai,_
Labuh Smpai ke lantai,_
! terbaikk boleh repeat lagi!,_
bergizi,_
Kain ok sedap tapi warna tu agak beza sikit dgn dalam gambar,_
Pembungkusan baik & comel,_
mehhh beli beli beli tshirt murahhhhhh,_
12 & received 3,_
Tuala lembut,_
New mop cloth is also thick and absorbent,_
"(FOCAC) on Monday, Xi outlined nine initiatives China planned to implement in the next three years, most of them relating to , growing trade and encouraging private Chinese companies to invest in Africa",_
brg lmbat smpai,_
How long it will last?,_
Item sampai tanpa defect,_
Gasing berkualiti banding dgn yg plastik,_
ve considered getting their phone and then there is something that prevents me from buying it,_
Brazil has registered nearly 1,_
88 have been drawn to face Fitriani Fitriani-Yulia Yosephine of Indonesia in the opening round and should make it to the last eight,_
Seller only ship out on 24 sept,_
Thank you seller for the very fast delivery & good product,_
Good deals and loads of Great choices to have,_
maaf xde gmbar topi beli untuk ayh kt kg,_
The delivery was quite fast and this is perfect for a temporary lock!,_
Post with many bubble wrap good,_
seller bls ok tp brhari2 tggu x pos2 jgk,_
"hrtu bli yg saiz s,skrg saiz M",_
aaa tq seller item safely arrived takde pecah just nice but pls put fragile sticker just in case it might be broken but overall item is nice and sooo cute,_
Durability:ya,_
Durability:reallyy good,_
Quality:texture is good,_
utk saiz s sesuai utk Sy yg biasa pakai 32B,_
"berbaloi dgn hrga, boleh beli & confirm puas hati dari beli dkt downtown",_
kualiti & penghantaran semua ok,_
Functionality:Functional and works great with minimal noise,_
I would love to try this one out TW : $MENTION$,_
had to stop halfway,_
5kg per person per year,_
Bungkusan letak dalam gabus,_
"MPK serta ANULAE berkolaborasi dengan GM Klang dengan menyumbangkan keperluan harian, kelengkapan tidur, peralatan pembersihan juga makanan, katanya",_
Tkde koyak atau kurang corak,_
clip agak keras mcm nk patah je,_
dh spai brg oder,_
Barang lambat sampai walau seller area kl juga,_
Beg sampai dengan keadaan cantik gila🥰 serius cantik kualiti luar dalam meletop serius harga dah murah kualiti kayangan hahahhahaha tak rugi beli,_
letak dalam rumah dalam kereta,_
mask chain paling cantik,_
all product good,_
Harap2 boleh terima tekak,_
2 amek jela 23,_
That would be badass!,_
Ngam terokssss dgn mcm ni punya kualiti saya hanya lah pemburu coins,_
Sya hrap psni letak lah bubble wrap,_
Very impressed with how everything is and I LOVE the colour!,_
Bener ga sih,_
Try kat badan mmg jd putih on first try,_
kita x try lagi so x tau mcmana ok ke x,_
Safety:tali pinggang keledar bagus,_
There are also times I cannot search my address,_
trima kasih bgi dodol baby,_
Definitely will repurchase it again,_
🤐🤭🤐🤭,_
"The aroma and bitter taste i really like it,",_
thanks seller jual item ni,_
Saya try guna Spay,_
In my country already 12,_
very nice🥰,_
* Resourcse management,_
Can repeat buying,_
X kena dgn tekak,_
overall semua okay barang diterima dalam keadaan baik takde calar ke apa ke thankyou!,_
"In a report published on Thursday, the central bank said speculative demand primarily determined cryptocurrencies' rapid growth and that they carried characteristics of a financial pyramid, warning that bubbles in the market could form, threatening financial stability and citizens",_
t=3m23s> bruh i got rick rolled,_
recommend for everyone who wfh,_
I beli utk kwn I,_
Pernah beli kat seller lain scrub lama dan hitam dah,_
but wat cant i say,_
tersgt cepat,_
KAIN SEDAP SANGATT,_
"Tebal, selesa, tali panjang",_
aku betul2 kecewa,_
Paduuuu,_
"Tak ketat, tk loose sangat",_
"Alhamdulillah brg dh smpi,cepat penghantaran dh smpi",_
It comes with dust bag too,_
nk rate pn susah dh smua tak bgi guna,_
Pesan lain smpai lain,_
Penghantaran dari johor mengambil masa beberapa hari untuk sampai,_
Yang dye tak luntur sangat,_
produk dah sampai alhamdulillah 🥰,_
xmelekit sgt,_
Raya haritu dah habis mkn,_
sebaik tak ada sekatan jalan raya,_
"Once the pandemic is over, Chan has her sights set on elevating the makers and their heritage food even further",_
"Barangan diterima dalam keadaan baik, penghantaran yang pantas",_
KUANTAN: A bank employee crashed her car into her workplace in an accident on Saturday (Sept 19),_
The movement is suitable for newborn,_
Best Aaaaa,_
terbaik buku buku keluaran patriot,_
"Among the categories in the competition are embroidery, floral arrangement, painting, cooking and photography",_
Value for money but the size is smaller than expected even though had expected to be smaller,_
taktahu ori ke fake tapi kita rasa ori je bcs tulisan korea and number dia timbul shhshsh btw my skin type is combination and dia cepat absorb,_
dgn nut tayar hitam,_
Got black for me and other two as gifts,_
Nnti saya beli lagi,_
Comfortable soft and light material used,_
Tpi tk pe harga murahh dan berpatutan lah,_
"super fast delivery from seller, value to buy , thank you seller will order again",_
Cuma sy rasa tepi tu agak singkat berbanding dpn dn blkg,_
Thank you 10,_
Luckily no damages or lost of cargo,_
emoji🤗,_
Barang sampai dengan selamat dan kain pun berbaloi dengan harga,_
Mantapp mantapp mantapp mantapp mantapp mantapp mantapp mantapp mantapp mantapp mantapp,_
Super fast delivery as it only take one day to receive my samyang ramen,_
"Dan yg saiz s , bahu baju tu akan jatuh",_
sorry for different pic!,_
"Terima parcel dlm keadaan yg baik, seller pos cepat terima kasih seller penghantaran pun cepat by shopee express",_
Yg saya pakai tu warna dark maroon,_
"She aims to excavate pre-colonial Balinese culture, and understand how the perspectives and aesthetic criteria formed under colonial rule still persist",_
But still kain dia sedap je pakai,_
"Parcel arrived within 2 day, seller reply my msg OTS, very fast delivery and good service",_
Have not opened the items yet,_
long time no eat le,_
"Got extra battery, strap and also warranty card",_
cepat sampai dan mmg besar ya,_
korang disyorkan beli sebab dalam buku ni semua cukup,_
ckp kat seller nk pki blik kg,_
complete dfn tools skali,_
Nie dah kali berapa repeat sy pun xtahu,_
kain die sedap katenye,_
Persediaan utk lepas bersalin nanti,_
Is a free gift from the seller,_
Tak jarang tak pendek,_
thnk saller,_
cuma kain dlm dia lembab sikit ler,_
I recommended this app to everyone!,_
The material of purse is good,_
super fast delivery only take one or two day then product arrivesound can receive very clear,_
Good packaging Fast delivery Product quality is good,_
t embed pieces of glass occasionally,_
Love sgt and recommended lah,_
Welllllllll packaging,_
Have bought this baby oat for several times,_
stretchable bahagian muka,_
"Morrison also completed plays, poems, essays, and short stories, one of which is coming out as a book on Feb 1",_
"In a press statement published on Wednesday, the U",_
"However, there were others who defended the party, saying: How many regular people have been dressed up in Squid Game costumes and been recreating games but somehow it's horrible that she did it",_
memang power barang ni,_
seller pun begitu behati²,_
beli time sales 2,_
Get rewarded for shopping at CapitaLand malls,_
Puas hati sebab kainnya memang cantik,_
lambat betol dhl htr,_
Texture:yas,_
"The New York region has been hit hard by this winter's jump in infections, raising concerns about what will happen at office towers and in schools after families return from gatherings or vacations",_
"Citing the Tepadung Cave in Ulu Sungai Segama, she said it had its own attractions and capable of attracting tourists to Lahad Datu",_
Sbb br beli tp ok la brg murah,_
Lantaklah nyahhh,_
Seller guna bubble wrap n kotak,_
Barangg elokk warna & size betul,_
Kotak pasta je kemik2 gitew,_
So far xpakai lg dgn baby,_
mmg meletop,_
I can't check out my items,_
Just put into a box without bubble wrap,_
"She is able to live two very different lives, which says a lot about her penchant for adventures",_
"Elections to the state assembly in UP , home to over 220 million people, are scheduled for early next year but final dates are yet to declared",_
The colors are nice and do not stain fingers,_
Kyra Lai AH V Piong,_
"Packing ok, no dent, expiry date on 2024, good value for money after voucher discount",_
Baju saya tak tengok lagi nanti sy tengok tapi thanks bang baju sampai cepat,_
Kalau habis repeat lagi,_
"Second time beli kat seller ni, trusted + recommend",_
Texture:pekat elok,_
Pilih tali besi supaya tahan lama,_
Komplainan di kerjain nya lama amat,_
"Murah, cepat, barang baik, memuaskan hati, recommended,",_
Services terbaik drp Seller dan Delivery team,_
i pull jhope this time thankyouuu,_
user friendly and super fast,_
dalam keadaan baikkkkk,_
Good discount worth it good packaging free shipping good product like it,_
No complaint very good and fit well,_
"Barang cukup, pos laju, barang comel belake, no defect, tak cuba pasang lg, nnt kita pasang",_
Tp tissue dia mmg betul2 wet la,_
nasib jumpa parcel terselit celah pagar,_
Superd,_
Klip besi untuk sambun dengan mask mcm dlm video,_
Durability:PON BAGUS,_
Tried many times also still the same,_
"Good product, fast delivery, price acceptable, recommended",_
Nak design lain tapi dah sold out,_
Delivery yg lembap,_
"thankyou seller, baju sangat cantik",_
fikir lh sikit orang ni mcm mne susah nk cari duit,_
Kualiti kain Not bad,_
Faster from seller,_
Pesan : 3/10,_
x pedas sgt untuk org yg biasa makan pedas,_
Bunyi dari Mini4 ni bagus dan senang connect dari Bluetooth,_
Lama betul barang nak dapat,_
sehari je dah sampai macam tak percaya je hehe,_
$MENTION$ AM BATMAN thanks for valuable suggestion bro,_
Chew Fei,_
"After they leave, I will sanitise the place thoroughly",_
Cereal box is damaged but inside all ok,_
is good to use for kill bacteria,_
"Semua okay, takde koyak2 walaupon packaging nye gitewww",_
Warna cantik & pigmented,_
"Shipping very fast, yesterday order and today received the items",_
-sgt sesuai utk kecemasan,_
Kain ok sedap pakai,_
tq seller gambar quality cantik mantap saya suka saya suka tq,_
"Pc dah sampaiii, cantik gila by the way service pun baik and seller post semalam harini dah sampaii",_
"sy suka,sy suka,sy suka",_
"berat 40,45,50",_
just received 5 packets as ordered,_
This is my first year getting a pro-model phone,_
Cuma kecik dr expectation,_
No more ankle blisters after use both items especially when wearing heels,_
"lepas bukak span bawah nye,terus longgar",_
Akhirnya dapat jugak beli beg bagasi combo ni,_
Safe packaging with air bubble bags and fast delivery,_
Terbaik penghantaran laju seller pon post laju yg oenting bel 25/7 harga murah,_
barang baikkkkkkkkkkkkkakakkkakakakkakkakakakkkakkkkka,_
Item is neat packed with resealable bag,_
"Thanks saler, fast delivery and good quality",_
penghantaran pun lajuuu je,_
Thank you also I love my everline POB PC,_
Sleep mode not functions and wake up sensitivity quite slow around 2 second,_
Penghantran lajuuu,_
Nasib barang ni tak hilang,_
Kualiti baju yang cantik,_
Recieved what I ordered and fast delivery too,_
Penghantaran pantas Kasut cantik,_
CAN YOU PLS DO THE IPAD MINI 6 AFTER TYYYY&lt,_
Byk kali dah repeat beli kain kt sini sebab murah2,_
mask cantik anak2 pun suka sangat,_
"sumpah doh best gile bag ni, zip okay, takde any jahitan koyak, so far so good",_
Pinggang saya 31 memang sesuai dengan size M,_
Is it worth it to take AU9000?,_
Terims dlm keadaan baik cuma kotak jer xde,_
tq 4 t gift,_
Mop sudah sampai,_
"I'm sorry no pic, bought it for my brothers but I can assure you guys that everything is good, didn't take a long time to arrive",_
Saiz yang dihantar sama dengan saiz yang diminta,_
"He was charged with six counts of insulting a woman's modesty, though court documents did not state if the videos were of his students or colleagues",_
2) Good pakaging,_
"Terima kasih, ini kali kedua beli dgn seller ni dan saya sangat berpuas hati",_
Saksikan AFF U23 CHAMPIONSHIP 2022 &byk lagi,_
Belum pakai sbb beli utk bagi hadiah kat orang lain,_
"Barang dah selamat sampai, packaging bagus, harga barang pun reasonable nanti boleh repeat lagi",_
semantap mantap ahhh wuuuu,_
baiklahhhhhhhh hehehhehehe murah tapi selesa hehehheheheheheheh,_
X perlu ambi saiz lebih bsar,_
VE BEEN TELLING PEOPLE!,_
"Penghantaran pon pantas, terima kasih seller",_
The seller will recommend for you,_
Ada pelbagai saiz senang untuk kegunaan pada kereta,_
Seller dgn J&T bt qeja cpt,_
"Terima kasih seller, brg dh smpai wlaupn agak lmbt sb dr china",_
Tapi so far semuaaaaaa ok sangat!,_
Okkokokokokokokokokokokokokokokokookokokokokokokokokokokok,_
"loveeeee betholl, thanks seller",_
It's take about 7 days to arrive and hopefully and long lasting,_
"Received product in good condition, EXP DATE year 2025, thanks for the test product",_
Yg love (corak) tu susah nak kluar but overall okay n nice,_
fatir u really the best shop i ever,_
kli dh bli,_
Sayang kualiti,_
better beli smua warna,_
kaki dia cuma kemek sikik tpi xpe kena dgn harga yg murah,_
"Kok Thay, who keeps a low profile, and his father worked to expand and diversify the business beyond Malaysia, building it into one of the largest gaming and entertainment conglomerates in the world",_
"Terbaik, saya berat 54 tggi 165",_
Comellah 🥰 eii geram je pearl dia omel hehehe jarang shopping handbag 🤭 selalu pakai beg cam budak sekolah 🤣,_
Aroma:traditional coffee aroma,_
Bang mata nya ngedip,_
mmg nice murah dr yg lain,_
lock 2 helai je baju ok cantik,_
"European Union member Latvia has deployed 3,000 troops for a previously unannounced military exercise near its border with Belarus this weekend amid an escalating migrant crisis along the Belarusian-Polish border",_
"'However, in light of a number of prevailing risks, including raw materials prices and a shortage of semiconductors, the second six-month period is likely to be more volatile for the BMW Group",_
Long time for shipping and delivery because of Chinese new year holidays,_
Only this time got 1 bottle damage a bit,_
Long shelf life until year 2026,_
Maaf Gambar Dan Video Tadak Kena Mengena,_
after 2-3 days,_
🤑🤑🤤,_
"Penghantaran pantas , kualiti terbaik, rega ga yang berpatutan",_
"Selain Azreen, pelari lain juga wajar diberi pendedahan berlatih di luar negara sebagaimana atlet terdahulu bagi meneruskan kesinambungan dalam sukan itu, katanya ketika dihubungi hari ini",_
"The rules would also prioritise onshore debt repayment of developers with better credit profiles, the fourth source added",_
Semua ok only one things jee,_
Love to have oneplus device,_
Keep my 12 mini,_
After waiting for more than one month,_
It's an honour,_
ve heard abt the news weeks ago that they have a new bulding,_
How I going to check my balance and promotion?,_
rupanye can be adjusted,_
Baju dah basuh lupa ambil gambar,_
seller not rply any questions anymore,_
very fast deliver order on sunday and received on Tuesday thanks a lot,_
"There is a defect on the front but all are okay, i want it to be in the future",_
harap muat la boleh buat jln2,_
"Regulations, supply chain requirements, availability and cost of financing and stakeholder demands all come into play",_
maaf ye gambar dan video tiada kaitan sebab belikan untuk kakak tapi kakak ckp kain agak jarang tp selesa pakai,_
"Jurucakap Pusat Gerakan Operasi (PGO), Jabatan Bomba dan Penyelamat Malaysia (JBPM) Sabah berkata, pihaknya menerima makluman berhubung kejadian itu pada jam 3",_
tak suka,_
"Beliau berkata demikian ketika berucap pada majlis perasmian pelancaran Tindakan Pembangunan Bumiputera 2030 (TPB2030) di Pusat Konvensyen Kuala Lumpur, di sini, hari ini",_
Dan kekalkn services yang cemerlang,_
"Tiap dibuka pasti suruh Update, dah diUpdate buka apk yg lain cuma bentar trs ketutup dibuka lg suruh Update lagi",_
"Presiden Persatuan Perusahaan Kecil dan Sederhana, Datuk Michael Kang, 25 Oktober lalu dilaporkan berkata pembukaan semula ekonomi negara menyaksikan isu kekurangan pekerja dan jumlah kekosongan yang perlu diisi dalam pelbagai industri dianggarkan mencecah satu juta",_
MAKIN MAHAL YH KNPA,_
Ermmm blehhh laa,_
"A cup nescafe a day, keeps the doctors away",_
*Update*,_
Weh wangi gila,_
"chat seller maklum skru takde, then seller pos smula skru",_
"Ketua Polis Daerah Kuala Selangor, Superintendan Ramli Kasa berkata, polis sudah merakam percakapan pemilik video berkenaan iaitu pemandu Nissan Serena",_
Oren dia mmg tacuuuudddd tk dlm dlm gmbar,_
"Received my parcel in good condition, pillow nice and soft",_
Have 3 level blow,_
First nak cancel sbb ada tulis dkt situ yg seller ambil masa lama sikit utk post out,_
The packaging is very secure with thick bubble wraps,_
Cannot FREELY switch from data to wifi and vice-versa,_
but murah okayh cun gila lawa nyah,_
"Separately, Carlsberg promotion and function executive Phang Kee Fatt, regional sales manager Toh Swee Huat and key account manager Lee Chee Ching presented a Chinese New Year gift set to Teng at Star Pitt St on Tuesday",_
Tkpe bagi mak jela,_
Brg diterima dlm keadaan elok baik dan tidak rosak mmg bagus,_
"im love in it,",_
hahahahhaahahahahahahhaahahahaahahahhaha,_
pantassss sampai,_
Saiz pon okayyy,_
Barang sampai okay semua elok ja cumanya seller terbagi kurang satu hanger untuk warna gold,_
"Terbaikkkkkk boooooossssskkkkkkuuuuuu brng dh smpai,laju btul order 9",_
SELLER:-,_
Barang sampai dengan selamat alhamdulillah semua okay saya beli ye terima kasih,_
sebelum raya ritu,_
Selalunya toys macam ni mahal,_
Design pon ok je,_
Most of their drink is taste just nice,_
xde la rasa berat,_
Cuma seller mennyakitkan hati sgt2,_
Angelin Yap An Qi,_
Product bagus n berkualiti,_
"Barang sampai cepat, sangat berpuashati dan boleh repeat lagi",_
Dah bnyk kli beli,_
"well packed, fast delivery & nice",_
Saya dari Indonesia,_
1bingkal patah,_
luckily not too 'crack',_
"Melalui arahan pertama dikeluarkan kepada media Afghanistan oleh Kementerian Penggalak Kebajikan dan Pencegahan Maksiat, Taliban turut meminta wartawan televisyen wanita memakai tudung semasa menyiarkan laporan mereka",_
Fast delivery and safety packaging thank you so much seller,_
"KUALA LUMPUR: Malaysia Venture Capital Management Bhd (MAVCAP) akan menawarkan pembiayaan ekuiti kepada syarikat permulaan tempatan dan serantau melalui dua dana modal teroka (VC) baharu, iaitu Orbit Malaysia Fund I dan Ficus SEA Fund, dengan jumlah saiz dana sasaran sebanyak RM160 juta secara keseluruhannya",_
"Suka banget sama bahan dia , gambar pun cantik tidak Kecik sesuai dengan gambar",_
"Lorem Ipsum has been the industry's standard dummy text ever since the 1500s, when an unknown printer took a galley of type and scrambled it to make a type specimen book",_
bungkusan kemas xde kotak yang rosak,_
"Good product, very helpful",_
"Seller bagus, barang baik, delivery cepat, wrapping cantik",_
"Meanwhile, Terengganu Perhilitan director Loo Kean Seong encouraged the public to make a report immediately if they find wild animals so they can take appropriate action",_
sopir sangat baik,_
Muat dengan eos 400D,_
Seller shipped out parcel cepat,_
"Product fast delivery and nice outlook, value to buy will recommend friend and family to buy",_
"Cheap in price, thank you seller",_
"This is one of my fav sandals, right now",_
"Terbaik,terbaik,terbaik,dah macam2 order dengan suplier ni,service memang tip top,layanan penjual bagus,mesej je reply,penghantaran cepat,saya suka,akan tetap order lagi,tq bosgambar dan video tiada kaitan",_
"Sy oder stoking tpi smpai stoking,tq seller",_
Cuma agak lama jg brg baru sampai,_
"very fast delivery, even though ship from overseas",_
my laptop size is 14 inc but i choose 15 inc bag to make it more spacious,_
"Pembungkusan terbaik, harga yg berpatutan dan layanan terbaik",_
kena gosot kuat2 baru hilang 🥵,_
"Jadi, apakah langkah terbaik untuk berbuat demikian?",_
Superheroes dah sampai,_
Alhamdulillah barang dah sampai terlupa nak rate maaf gambar xde kena mengena dengan apa yang berlaku di kawasan tersebut sambil ditemani oleh anak saya yang baru sahaja selesai menjalani ibadah berpuasa pada bulan Ramadhan yang mulia ini,_
Its my first order and Not tested yet,_
Barang dah sampai belum bukak lagi,_
Twitter: jovan Alvarez,_
Received mine yesterday I ambik 1 size bigger and it fits nicely,_
Auwwww tq seller,_
Watching on my moto g31 🥰🥰🥰🥰🥰🥰,_
"Beli untuk anniversary, dapat terima sebelum tarikhnya",_
The product is great and worth the price,_
Penghantaran yang pantas!,_
"But sokey, pdan dgn harga la",_
SEKARANG APLIKASINYA JELEK BANGET UDAH 4X DOWNLOND GAK BISA,_
Tq seller harga memang terbaik,_
"Beli 2, tp 1 rosak",_
baik baik baik baik baik baik baik baik baik baik baik baik baik baik baik baik baik baik baik baik baik baik baik baik baik baik baik baik baik baik baik baik🥰,_
Of the total 122,_
Phynix Lee,_
Its Penang director Mohd Ridzuan Ab Ghapar said the teams would conduct checks under the Chinese New Year Festive Season Maximum Price Control Scheme from now until Feb 4,_
terimakasih saya beli yee,_
Packaging: Secured,_
Tk tau la camne,_
"Penghantaran pun pantasssssssssss, thank you also for the free gift",_
He also loves it,_
Tempat pesan makanan cepat promo lagii luvvvvv,_
Memang terbaik bosskurr,_
"Sy berat 67,tak sesuai ambik 2xl",_
Wasn't that stretchable too,_
"jarang 7/10 , kain lembut je takdela keras mana pun pastu senang nak bentuk awning",_
minta teliti pesanan pelanggan dengan betul,_
Can easily take it off and clean,_
fast delivery samapai dalam 3-4 hari je,_
"Beli dengan voucher RM8,buatan malaysia",_
anak2 suka xpayah nk beli dah,_
cuma yg coklat kain dia nipis sikit,_
Seller pos 08,_
"Though the item is in a box, seller wrapped with bubble wrap",_
m waiting for it🤩,_
Harap2 sesuai dengan anak-anak saya,_
Quality:ringan dan agak nipis tp ok lah dr sudu pakai buang tu,_
Baru nak feedback,_
hoping also that this giveaways are not exclusive to one country,_
"Mask sampaii cepat , kualiti sgt baik",_
Material:ok lembuttt,_
mudahkan kerja saya bila laptop xde camera,_
