Sentence,Tagged_Sentence
Dapat hari tu pun 2 bar juga,_
Comfortability:overall is ok but need to change a better inner sole for best comfort,_
cable protector yg smpai,_
"Memang puas hati penghantaran tersangatlah lajuu,",_
Dlm gmbr besar,_
MCM cita mr Bean,_
"ALHAMDULLILAH DAH SAMPAI , THANKYOU SELLER",_
"Material dia best, memang ngam teroks bila pakai and tak labuh sangat pun",_
baby sy sblm ni colic,_
Terima kashh,_
ga punya twitter jg,_
"Insya-Allah, selagi diperlukan, saya akan terus berlakon, katanya kepada BH Online",_
"Perhantaran yg laju, tq saller good",_
bawang goreng tu banyak sgt so hilang rasa bilis tu,_
ok dh ckup nk submit 5 coin,_
"safely arrived, just bought for my lil cousin and he like it, tq so much seller for this shoes🥰such a trusted seller and highly recommended shop, the item received exactly same as shown",_
Just that the delivery fee to east malaysia is soooooooo high,_
"Even don't have slits the side, the bottom shape still look nice",_
Very disappointed with it,_
Goodproduct qualitygood value for money,_
Da sampai murah sangat a ak anak2 suka,_
"Simple installation,seller very promt to sent the product",_
"Alhamdulillah, tq seller, brg terbaik",_
"beli untuk adik, 3 minggu juga nak sampai tapi takpa, cute sangatttt",_
Mmg bbaloi sgt,_
"Gambar xde kaitan, pembungkusan kemas, no leaking at all",_
Cantikkkkkkkk helokkkkkk,_
sorry abt photos sbb sandal xde kt i,_
Compatible to my ipad 7th generation!,_
start out,_
Dkt 2 minggu tunggu,_
jika baunya lama bertahan boleh repeat lagi,_
tak sabar nak cubaa,_
handsock ni bolehhh laaaaa cuma kat i ketat sikit tapi overall okayy,_
Dia balut gini je,_
"Harga murah sesuai dengan kualiti, rasanya tak tahan lama",_
hehehehehebebe,_
Mmg sesuai ngn harga,_
"everything good , seller replied within a minute",_
Safety:kain agak keras sikit tp lepas cuci mungkin lembut,_
Jersi dah selamat terime,_
fast deliverygood receive and packing well sofar okgoodbeautiful rose,_
com/channel/UCRaUoHRtIF7MVzcxF-K3Xhg>$URL$,_
xberbau sgt kot,_
packaging mamtapppp,_
5 per cent in November,_
"Thank you seller ,my mom will love it, thank you",_
"Smoga bermanfaat , sbb nk buat goodies utk majlis tunang adik",_
Seller is very kind and perform lah!,_
reply cht memang aq report lahhh,_
Dan sesuai utk ank sy 1y4m,_
this two guys tak buli lah,_
"Sorry, the bag is okay",_
Seller terbaik perhantaran sangat cepat,_
pakai solat pon ok,_
Tinggi sy 168cm,_
Xnak naik pulak,_
"My most important point, however, is that it&$HASHTAG$",_
Functionality:easy use,_
Trust me la gais,_
Tak terlalu bising,_
Meanwhile i am watching from a samsung note 3,_
Benda tu la yang penting,_
Quality:lembut dan sejuk,_
Produk yang sampai sama seperti gambar yang diiklankan di dalam shopee,_
Quality:very very low,_
Terbaik seller cepat hantar barang dalam 24jam sampai dah barang,_
90/m seems a bit of waste,_
delivery cpttt,_
why do high quality phones have shietty colors and cheaper versions have better colors?,_
Benar dalam 1 jam sudah nampak cicak mati,_
"Aaaaa tq sellerr i likeee pnghntrn yg sngt pantas smlm beli hrini dpt dh tq ,",_
This shop sell very cheap & fast respond,_
Labuh sikit xpe pkai lama kain sdp,_
super duper fast delivery and recommended saller,_
srs muat weh,_
Fast very fast delivery,_
Product pun dalam keadaan baik,_
oyfofoufoufoufpufupfpufoufo6do6d6yc,_
ఇ ‿ ఇ,_
Ukuran memang betul macam yang dipaparkan,_
"More than 200 households who live near the fire were evacuated, Vietnam News Agency reported",_
"Kami akan gunakan kreativiti sama ada dalam aspek kostum, jalan cerita dan penggunaan lampu Light Emitting Diode (LED) pada malam itu",_
All item ada,_
KF94 FACE MASK,_
Also no tissue was served,_
"Worth it for the price, recommended",_
Fast delivery from seller and jnt courier,_
Walaupun mengambil berapa hari selepas order,_
Ringan and kecik,_
Yes mmg 5ply,_
boleh buh phone juga,_
nanti nak beli warna putih,_
kain die nipis sangat,_
Tak bancuh semua pun buat separuh je sebab first time kan hehe lepas pakai tak nampak mana pun perang tu so okay laaa,_
Barang cukup & berkualiti,_
"Good product, very worth the price",_
Most of the times it wouldn't let me pay from my card and ill have to use my sister's account,_
Tapi perkhidmatan penghantar luar lambat,_
second time beli barang yang sma dengan kedai yang sma,_
Very well packed and the delivery is quite fast as well,_
Wrna pon soft ja,_
Bhai GTA 5 ke video upload karo,_
Takdela kemek or ape ii jadi right,_
"Not worth it, but I'll just let it go because it's only RM2 something",_
Boleh cuba dgn izin Allah mna tau ada rezeki,_
Received in great,_
($2,_
harga pn murah mmg berpatutan laaa,_
Only a bit defect on the edge of one of the board,_
About time for an upgrade $MENTION$,_
"Good design, nice colour, like it",_
"I love this, some ppl find it smelly but my whole family like this, it taste so good, dont knw about about other brand but i like this brand, bought 4 packet after my first try",_
Whay laaaa,_
sesuai dgn abah,_
Quality: daily use,_
"Kalau lambat pon jgn salahkan seller taw , kesian seller ranting drop disbbkan courier yg lewat hantar brg",_
dah kesekian kalinya repeat kasut ni,_
"Received in good condition, all more than 6 months expired date",_
"Blm prnah rasa perisa ni, nmpk",_
all goods thank you so much seller gonna repeat soon,_
Pos out slow,_
Next time bleh repeat order lagi sini,_
Service seller sangat memuaskan hati,_
fully getah so selesa,_
Thank you I will try in Thailand,_
AlhamdulillahAlhamdulillahAlhamdulillahAlhamdulillahAlhamdulillahAlhamdulillahAlhamdulillahAlhamdulillahAlhamdulillahAlhamdulillahAlhamdulillahAlhamdulillahAlhamdulillahAlhamdulillahAlhamdulillahAlhamdulillahAlhamdulillahAlham,_
Mesra wudhuk,_
Warna x berapa sama dlm gambar tapi Selesa and cntik sangat!,_
tak gitu brother,_
Received in good condition Fresh & Quality Good Portion Responsive seller Recommended,_
Received item in time,_
Seller terbagi extra plastic size medium 1,_
tiada kualiti mudah koyak,_
"He added that the 120m vessel was seized and would be investigated under Section 491B(1)(L) of the Merchant Shipping Ordinance 1952, which was punishable with a maximum fine of RM100,000 or a jail term of up to two years, or both",_
"The package was received, and the service was quite fast",_
belum tgk lagi harap2 ok je,_
29 mlm order,_
kuantiti x ckup,_
"Color cantik takde kekotoran recommended,",_
Korang boleh try beli jugak ea,_
"Formulation:kena rebus baru lembut, guna air coway xberapa kembang",_
!Very cheap compare to others seller/shop,_
Boleh buat freegift n hadiah cabutan bertuah,_
"Kalau ada warna gelap yang baru, nak repeat,",_
"terbaik, layanan penjual sangat baik sangat recommend rugi mampuih tak langan syber tv,",_
"Cantik sangat corakkk , kain pun best selesa je pakai",_
Maybe sbb jauh dan pakai pengangkutan sendiri,_
"Item received ahead of predicted delivery date, new sealed box but shipping packaging was ok",_
Taste:Good & not disappointing,_
Lai Kian Wah,_
Penghantaran yg cepat harga yg berpatutan dia punya material dia okay tpi licin sikit x kesat tpi okaylah dia petak punya maaf kepada kurier tu sbb x dengar apapon terbaik,_
"Item ordered safely received, item as advertised many thanks to seller for swift delivery",_
"penghantaran pantas,barang sampai dalam keadaan yang baik",_
"Price is so cheap, material also cheap as well as quality cheap",_
kopi baghuih utk kecerdasan,_
AAA AAAAAA AAAAAA AAAAAA AAA,_
This new phone is dope af $MENTION$,_
Arrived safely 🥰 thankyou for bubble wrapping all the glass bottles,_
Quality:BAGUS NAK MAMPOS,_
Good good good good good good good luck with your interview Puan dari mart adik kerja tu blh je ne sais pas de deux trois wine and spirits are you doing today I kerja pgi ke ptg ni no kuni switch to the tv tutp lampu so I can get the tv show the tv show the tv show the tv show the tv show the tv sho,_
Tunggu sabtu or ahad ni lah br try,_
Bungiusan krg kemas,_
Nanti nk repet oder lagi,_
Barang ok spt dlm gmbar,_
Lighting tak berapa terang Tapi still boleh guna,_
tidak jadi panjang cerita nak minta tukar ganti,_
lampu pn berfungsi dengan baik,_
Seller terbaik lah penghantaran cepat sangat,_
Mempermudah pelayanan,_
*Sorry video tak ada kaitan*,_
cancel order‼🤔,_
"Size is slightly better than expected, good quality and fast delivery",_
gambar boleh,_
Komen :,_
siapa je tak suka megi cup,_
takpernah try pink tapi bau dia wangi weh,_
Cadar tu elok semuanya,_
cable pun ok try jadi je,_
Although the tablets came with bubblewrap but packaging insufficient as some of the chlorine tablets were found to be broken,_
bila pakai lawa tp tula quality sesuai harga,_
kemas & cAntik,_
Its not really tight,_
"Mungkin tahun depan baru saya bela misai atau jambang seperti yang diharapkan, katanya sambil tertawa",_
Saiz XL ngam2 dgn sy berat 71kg tinggi 156cm pregnant 8month,_
Barang baik padu mantoppp boleh repeat order,_
"Kinston data traveler 32gb, 3pcs purchased, tested 1pc, consistent and fast data transferred",_
buku ni antara buku RM yang saya cari,_
"ermm,tak taulah kot2 seller rabun warna",_
but then it is not like what i thought,_
Next time kena triple check the rest semua okay,_
"Worst ever mcd outlet station18,ipoh",_
Overall semua barang okay diterima dgn baik,_
"amik dua sekaligus standby takut 36 tu ketat ,so salah satu boleh pakai",_
Thorrrrrbaiiiikkkk n gud servis,_
Seller yang bagus dan pantas,_
Dapat barang spt yg saya mahu,_
Beg oke memuaskan,_
Penghantaran pun samgat cepat,_
Stok penyepit rambut untuk anak,_
Get with very good packaging!,_
rumah takde aircond sesu,_
Cuma buku kemek sikit dkt hujung2 tu maybe jnt main campak2 dgn kena hjn sikit,_
1st time nk try set ni hope sesuai dgn kulit🥰,_
cantik jew colour,_
Kira jadi la ni ye,_
Inshallah akan repeat 🫡🫡🤣,_
antr rmh org lain,_
"It might look and for better but from what I heard it sound like they took kindergarten art class paper and made a mask out of it with it origami style so question is does it actually perform better in regards to keeping your bacteria and particles in as well as the particles it's rated for out,",_
kiterr beli ye,_
Memang borang banyak la,_
perfume kereta tahan lama,_
Received my parcel in a good conditionwill repurchase again,_
Lupa letak mana item,_
Best cermin ni,_
"The Belarusians have achieved this right through suffering, Igor Leshchenya, the envoy, said in the video",_
The quality of the image/video is nice,_
Kali kedua beli ngan seller nii sebabb ramen murah and shipping lajuu,_
The delivery was not so fast,_
"Very fast delivery and the expired date is 2023, already bought many times, nice",_
Nasib baik still elok ok,_
t want ARMY doing anything dangerous Me - 🤧my heartu get melt,_
Nanti nak repeat warna and design lain pulak,_
Boleh charge lampu tu,_
"Received the product in good condition, the delivery is fast",_
"Murah beli kat sini, pghntran pun laju",_
Will buy more in the future!,_
"11 juta pada 2020, kata Menteri Pembangunan Usahawan dan Koperasi, Tan Sri Noh Omar",_
Semua berpungsi dengan cemerlang,_
belum cuba lagi harap manfaat untuk kesihatan,_
i really satisfied plus the material not really thick,_
Tapi harap okay la dengan skin,_
3⃣ Keletihan,_
Kualiti bagus dan cantek kaler dia,_
"Thank you, will definitely buy again",_
Just take and put inside the box,_
It has the best offers,_
good my friend love it i brought it for her bidday at she loves it,_
"Saiz ok ngam, kain xtebal dan xnipis",_
nanti kt goreng,_
With jimin,_
Barang sampai dalam keadaan baik Boleh repeat lagi lepas ni,_
Banyak Kali dah order asyik tumpah je,_
"apapun, saya beli",_
Dah siap masuk balang sendiri hehe,_
"Quality so so only, the zip seems not so smooth when open /close",_
Taste:taste like original one,_
Works great once you figure out how to set it up,_
Books were packed nicely and received in good condition,_
"cpt jgk la ,kain tdung lawa,msti ank² suka",_
Ok baru nice,_
Delivery was speedy and package was safely & securely wrapped,_
The jacket is everything,_
Thanks fast and good service also good price ty bro have a great day,_
Settle tukar tinted sendri,_
Ok la tuuu,_
6cm saja gegatal amek saiz 42/43 sepatutnya kena amek saiz 40/41,_
"Comel sungguh,",_
sorry lah gambar dah takda baju dah seelamat pakai semua nya hahahahahaha,_
Kain panas skit sbb tebal,_
Barang sampai selamat walaupun kotak dia kemek sane sini btw perhantaran laju gile dan terima kasih jnt nasib baik kali barang ni x hilang heheheh btw thankyou for this service dan terbaik semua nya dua ii berfungsi dan cepat connceted dgn blutooth dan beat dia mmng power mcm dkt konsert 🤣🤣🤣🤣🤣,_
"i got giselle inclusions do pm me if u want to trade, i want ningning inclusions 🫶 twitter $MENTION$",_
Liiiiiiiiiiiiiiiiiiiiiiiiiiiiiiiiiiiiiiiiiiiiiikee,_
u all are the best,_
Berbaloi sangat beli dengan harga 12 sen 🤌,_
Yang ni lagi x leh brain harga dah la murah pastu kasut dia mcm getah getah,_
Very fast delivery item received in good,_
"gifted, receptive tune",_
Ok brg sampai elok tp lom psg lg hrp² elok,_
suami saya saiz 40 (mcm M ke L),_
penghantaran laju denim kualiti seller peramah next time boleh repeat,_
This would be perfect for those with small hands (me) lol compare to the fold,_
Sangat membantu di saat kita memerlukan perjalanan yg darurat,_
NNTI bolh beli lagi,_
Cantik sangat dalam pon cantik,_
Fresh dan Rangup,_
Kosovo's government on Tuesday introduced a ban on cryptocurrency mining in an attempt to curb electricity consumption as the country faces the worst energy crisis in a decade due to production outages,_
"Thankk you, akan repeat lagi",_
minum panas2 time pg as breakfast rasa ringan je badan haha,_
sakit perut,_
"sedap dipkai~nice,",_
"Limited quantities only, first come first serve",_
"Sy bg bintangg,",_
"Well,you get what you paid for",_
"Finally, while pets are amazing, do remember they are individuals and they don't all react the same way all the time",_
cuma x pasang lgi,_
"Good product quality, good value for money , fast delivery, good service by seller,thanks for free gift thank you very much seller",_
"Antara negeri menerima pemberian defisit adalah Perlis, Kedah, Kelantan dan Pahang",_
nak buat tak buat buat aduhai,_
barang sampai dlm keadaan baik pembungkusan kemas terima kasih seller,_
Ok kualiti produk sangat cantik warna pun menarik penghantaran sangat cepat ok boleh beli,_
"alhamdulillah puas hati terima kasih🤗Barang selamat sampai,semua cantik dan keadaan yg baik",_
Barang semua tiptop and just nice,_
lastly pls dont expect to much for low price,_
"Dahhh sampaii byk hari lupa rate , brg bekas okeyy cantik bentuknya mcm diamond ,",_
Kemasan cantik tiada tumpah pengiriman pun cepat tapi kurir jnt hantar lambat,_
Thnx seller for the free gift,_
Wish can use and last longer for coming months,_
cool xda gmbr cuz barang kat kg,_
Tk rugi pon kowg beli baju kat sini,_
"setakat sebuah buku,pensil cam tu ok lah kot",_
"EY Consulting had acted contrary to its undertakings in the letter of engagement when it provided a 'Factual Finding Update' to the Securities Commission without seeking Serba Dinamik's consent, Serba Dinamik said",_
Finally no more Octa FX or any other ridiculous ads,_
Kualiti sgt superb,_
sangat berpuas hati dengan barang yg sampai dan apa yang aku dapat,_
"besar,berbaloi dgn harga",_
muat letak telekung nipis,_
Seller hantar cepat dan item dibungkus dengan baik,_
Barang dah sampay thanks,_
HAHAHAHAHHAHAAHAHHAAHHAAHHAAHAHAHAHAHAHAHAHHAHAHAHAHA,_
It's almost as affordable as a mobile phone,_
Really love the b5 moisturizing gel,_
Quality:will repeat order,_
Dah tak ingt bape banyak kali order hahaha,_
My items arrived safely although the packing isn't secure enough,_
Connect seamlessly with my old LG TV &,_
"okey , fast delivery , bought it time sale so worth the price 🫰",_
Well it works the way it should A perfect app with all the necessary settings It's easy to use and always gets me what I want,_
"2, received by 8",_
"i got giselle and karina ,",_
maaf gambar xdak kna mgena sbb bli utk fil,_
td try 1 biji kemam,_
kualiti x pasti belum try lg,_
Kuality okk setanding harga,_
laon kali blh repeat sz 12,_
kualiti brg y sgt bagus,_
The shipping is a bit long because the event effect is 11,_
Setiap bulan memang saya akan restock dari seller ni,_
mmg sgt2 la membazir beli puluh gini tp baju rm10 direct kilang lg ok,_
Korang beli la dgn seller ni,_
"But it took ages to deliver, it stuck in sorting center for several days",_
overall is okay & fast delivery,_
Sbb bentuk pacel tuu mcm kotak phone maybe,_
"I am searching for warm peachy nude tone, asked the seller to suggest",_
Saya sangat berpuas hati dengan perkhidmatan anda,_
A dog's qualities are pure,_
2bil in allocations,_
PETALING JAYA: Alyaa Abdul-ghany looks set to advance to the LPGA Tour Qualifying School (Q-School) stage two after producing another steady show in California,_
Ok smua ok ok,_
Laju pantas service,_
Overall semua ok thankyou seller!,_
Kain lembut dan cantik penghantaran pun cepat terima kasih saya beli,_
"Cleaning Effect:sabun ni bagus, boleh hilangkan gatal2 badan",_
"Too late ,",_
Items received in good condition no damage but a bit disappointed cause both also black color,_
"Material nipis, tp ok padan dgn harga",_
Tapi ape2 terbaek,_
only received 7 pcs,_
"This is the first time purchase,",_
Packaging pun ok even beli sikit je,_
Fast delivered (thank you too seller & delivery man),_
", tq seller sy beli dgn harga tersebut🥰",_
Stray Kids ( ) is a South Korean boy group under JYP Entertainment,_
Ada 2 Huo Zun dan Li YunDi,_
"Fast delivery, so far it worked in superb condition",_
"Good saler , I get very good price during shopee sales",_
Cutting cam kecik kit,_
Trm ksh bang sudah smpai mmg terbaik cara pakingxblh kata,_
Harap okay ngan anakk,_
kualiti okkualiti okkualiti okkualiti okkualiti okkualiti okkualiti okkualiti okkualiti okkualiti okkualiti okkualiti okkualiti okkualiti okkualiti okkualiti okkualiti okkualiti okkualiti okkualiti okkualiti okkualiti okkualiti okkualiti okkualiti ok,_
Barang sampai dalam keadaan elok dan barang pun mengikut apa yang kita nak,_
ส่งก็ช้า ของก็ไม่ครบ แถมจ่ายเต็มจำนวน rider ก็โกง ขอบคุณมาก แอบดีๆ,_
"So they know the connector exists, slap it on the phone&$HASHTAG$",_
Senang contact and peramah,_
Nice material with affordable cheap price,_
Nasib baik tak tggu payday sale,_
beli masa sale dapat murah dari harga pasaran,_
tp corak ok so acceptable la,_
"Thank you, it's according to the order and the shipping is also very fast, so my customers like all, thank you",_
Amazing packaging and prompt delivery,_
Kali kedua beli dr seller nie,_
Fav drink in the family~~,_
"Quality baju okay , for me 56kg , 158cm size XL ada loose sikit",_
Choon Loy yu guo la,_
Sambal nye sedap nyummy,_
"and i got hyunjin too <3 i hope one day i got lee know felix and han so we can eat roti tisu together lmao btw the packaging is well secured too, thankyou seller ,",_
belum bukak lgi,_
Siew Ling Jowei Tng,_
very nice on both hot or cold water,_
bnyk kali dh grab sunscreen dgn kedai ni,_
"Texture:texture pun okay, x melekit sbb x suka yg melekit",_
Kain freelock pon kembang2MashaAllah byk sungguh seller kongsi rezeki kt sini,_
Memang puas hati Kali kedua repeat suami suke,_
H: 151cm W: 42kg,_
don't look nice to give as a gift,_
"received in very good condition, hope",_
The Bavarian Consumer Advice Centre recommends cooking them for at least 10 minutes,_
e04 🤣🤣🤣,_
Material:Material Terbaik,_
Not to big and not small!,_
Mmg salu repeat detergent anakku,_
Tp esoknye (selasa) bru bg feedback sbb kna cari tube dulu utk smbung kt paip,_
sbb xyah risau bateri habis,_
Parcel was wrapped nicely,_
Xtau la fast ke idok,_
Ayah kata nk bawak pergi masjid,_
Boleh recommend dkt kawan2,_
sgat mengecewakan,_
4 Hari penghantaran,_
Delivery cepat 2hari sampai,_
My height is 175cm and my weight is 103kg,_
ARGHHHHHH,_
Tinggi 159 berat 55 helok je,_
suka Kain ni sebab boleh buat macam2,_
Murah dan kain bestt,_
Items received and some dented on box,_
"Huhuhuuu finally, tengah confuse nak beli ps4 or switch lite, so ambil keputusan beli switch walaupun game ya mahal huhu",_
Penghantaran pun pantas TQ,_
So good good good good good good good good good good good good good good good good good,_
stoking comel dah pakai banyak kali baru nak review anak umur 4 bulan setengah muat saiz xs,_
She continued to be shaken by self-doubt,_
25/3/2022 ordered,_
tinggi 150 berat 43kg selesa pakai sorry gambar xda kaitan,_
Boleh la beli buat lapik untuk baby mama,_
fikir berkat tak claim coins tp review natang lain,_
"Semalam pagi order,tengahari hari ni dah sampai",_
dah siap masak api jgn tutup biar je sampai esok pastu mmpus umah kau tebakar nak beli gas baru,_
"Parcel well received, no broken and leaking, thank youuuuu",_
cuma warna mcm byk beza dr gmbr,_
Suke sngattt,_
ke sy yg xreti pakai eh hahahaha,_
"Dah 2x repeat , kain tak berbulu ,sangat cantik lahhhhhh,",_
Maskara maybelline dah selamat sampai,_
kucing pun suka sangat la,_
dari Grabike sama Grabfood,_
hopefully a good quality,_
mslh skrg wrna sma,_
Tpi x pelh,_
"Sangat sangat murah dan berbaloi dgn harga ,",_
Wraping tak de lah secure tapi tak pernah pecah sepanjang berapa kali beli ni so macam nice lah eebab bagus untuk sakit perut jugak hahah beli sampai 19 untuk perut je mat,_
Have been buying different types of noodles from this shop,_
wangian semerbak serangga pun takot masuk keta sy🤲🥰🤩🥳akn repeat lg,_
Bole repeat lps nie,_
Dah try semuaaa okayyy tapi ada satu skruu dia tak sesuaiii longgar sangat so senang tercabut,_
"Quality kain cantik, penghantaran cepat, packaging pun ok",_
Barang dah smpai at first ingat kan tak elok sbb lampu dia tak nyala pun,_
kerana hilang rasa letih,_
overall beg mmg cantik,_
Bungkusan okay delivery okay and antara yang murah tapi ada nampak serpihan ramen terkeluar,_
"Packaging: Nice & secure green courier plastic, my favorite colour",_
loveeeeee sgt,_
sangat terbaik dan terbaik,_
Seller sangat terbaekkkk,_
Barang sudah sampaiiiii sangat cantik harga berbaloiiiii,_
Kain best tak panas sangat sesuai pakai time wfh ni hehe thank you seller,_
Seluar kualiti tip top harga murah,_
the colour actually near to mustard but a but dark,_
Saiz sampai betul,_
Mudah kerja kalau nak berjalan,_
Click ordered and I received it less than 5mins,_
"serap air dgn lembut kain,sesuai utk bby dan kanak²",_
Alhamdulillah buku-buku sampai dalam keadaan yang baik dan elok,_
ikut je size biasa korang,_
Functional design,_
Alhamdulillah pnghtran sgt pntas,_
Dah sampai cuma lambat skit,_
Dpt kopi semua kemek,_
terima kasih seller barang dah pkai memang terbaik,_
"I try to help cats with difficult backgrounds, to heal their physical and mental wounds, said 24-year-old cafe owner Nguyen Thanh Binh ahead of International Cat Day yesterday",_
"9 to 1,010 tonnes, according to the U",_
Penghantaran cepat kain yg berkualiti,_
"They have two Labs of their own and miss them already, Jeff said",_
"Penang Island City Council (MBPP), in a statement, said the road closure would begin from 12",_
"tpi xpe, hrge pun murah so okeyy jer",_
14hb post sampai 17hb,_
Berbungkus kemah dan laju,_
Item 3 hari dah smpi,_
Ttuala sedap,_
but for the ppl like fit de,_
"Tp apa2 pun ok la, beli utk mak",_
The US can work more closely with international institutions to build support for global policies,_
I felt very disappointed with this service,_
seller ambik masa dlm 4 hari unt pos out barang,_
"(Reuters) -New Zealand Prime Minister Jacinda Ardern stayed in self-isolation on Sunday, as the country recorded 103 new COVID-19 infections and its tough border controls were highlighted by a pregnant journalist who said she was trapped in Afghanistan",_
Taste:jeruk sedap tapi kuah rojak pon sedap,_
1 size besar dari size biasa pakai,_
Botol susu dah sampai packaging sngt ok letak dlm kotak dan dibubble wrap dgn elok,_
"KOTA KINABALU: Dua pemain kebangsaan, Baddrol Bakhtiar dan Dominic Tan sah bersama Sabah FC selepas nama kedua-dua mereka diumumkan secara rasmi berada dalam senarai pasukan itu bagi menghadapi saingan Liga Super musim depan",_
Semua cukup 39pcs,_
"Barang okay sesuai dengan harga, memuaskan thanks seller",_
semua itrm dibubble wrap dgn baek skali,_
Gambau takde sebab aku bagi hadiah kat ex nunang 🤭 Tak tau reaksi dia suka ke tak sebab aku dah block dia,_
"Good quality, so smooth, bateri tahan lama",_
saiz pn helok dengan anak,_
"hope you see this comment i badly need a new phone for my studies im so stressed on my iphone 6 its so laggy and very fast to lowbat we cant afford to buy a new phone because my father is just a truck driver and his weekly pay is almost exact for our budget in food, any iphone is really appriciated hope you see this",_
Senang nk kembangkan,_
wrna pink,_
awning pun ok nanti bleh repeat lagi,_
saiz pun besar dan sesuai dengan jari kanak- kanak,_
Gooodddddddddddddddddddddddddddddddd thankkkkkkkkkkkkkks sellleeeeeeeerrrrrrrrrrrrrrrrrr 🤍,_
Ni selonggok masuk kan dalam plastik pos mcm tu jak,_
thanks to seller / shoppee to get have items like this!,_
Kualiti puting botol setanding dgn yg original,_
barang baekkk sudah sampai,_
"Excellent service by seller, good value for money, bought it with vouchers",_
Although wait quite long for it to be shipped all the way from China,_
"Bang request bikin video tukarin emasnya ke toko emas,biar tahu itu real atau cuma hoax aja",_
Kualiti pun best laaa,_
nnt sy repeat order lg ya tq,_
cuma L kecik skit klu badan sado skit,_
"tiada kerosakan,servis tiptop",_
Kali kedua order mmg terbaik,_
Delivered intact and undamaged,_
"good absobtion,",_
🤣🤣 quality bag nice,_
He send late n inform,_
rm 89 after claim voucher dd 7/3/22,_
