Sentence,Tagged_Sentence
tak tau lah kot memang mcam tu,_
Barang dah spai,_
klau nk bli kecikkan satu saiz dari yg biasa,_
Good evening everyone from Canada,_
Penghantaran pantas dan dapat rebate,_
products price are cheaper than others,_
Ni saja nk try kedai ni,_
"Alhamdulillah dh sampai baju saya, cantik sangat",_
besar saiz,_
Update: Ok seller,_
srs cantikkkkk nnti nak belii lagiiii,_
So far kualiti camera sangat jelas & terang,_
Suka dapat cantikkan garden kecik saya,_
ok laa luar negara kan terbaikkk,_
Kualiti ok padan dengan harga murah,_
Letak 2 design yg sama,_
The World Health Organisation (WHO) updated its Q&A,_
Harapnya menjadi,_
Functionality:very like it n very good things,_
Baigan ko aise hii katke masala bhar ke khana chahiye maza aayega,_
Verry nicee with a good packaging fast delivery nice and superbb,_
10 helai Takde yg tersalah saiz,_
Suitable to be worn to beach or yatch parties The bust area is a little loose for me but still works well,_
Semua ny pngaruh tiktok,_
"Very thin and poor quality, not same quality as in the same picture, quite disappointed",_
baju ok cuma lengan pendek sangat,_
"Meanwhile, Muhammad Daniel Hakime expressed his happiness to be able to pursue studies in a field that the is interested in",_
Parcel was delivered machine working in good condition thanks seller good job will repeat in future,_
"SYDNEY (Reuters) - Reigning champion Ash Barty will not play at the French Open later this month because of health concerns and a lack of preparation, the world number one said on Tuesday",_
very cool product,_
Malas nk pegi ambik gmbar kt dapur,_
Bagi 4 star sbb double tape dye x kuat,_
Seller response to chat dengan baik,_
"The first few uses of this app was fine but these few months when we tried to use it again, we can access the account but it will eventually crash and a pop up will say that I have to re register again",_
"The international digital commerce unit will include AliExpress which sells to retail buyers particularly in Europe and South America, its South-East Asian e-commerce business Lazada and Alibaba",_
Busy with work la miq hahah,_
"Ko gini si aing teh arek berangkatkan eweh motor, pesen di grab klik gambar motor nu muncul na car wae, coba solusina na mang",_
brbaloi tunggu,_
Item was delivered safely!,_
Tak boleh pilih but so far semua lawa,_
Pghntran yg cpat,_
penghantaran pun pantas recommended,_
"Penghantaran yang pantas, pembungkusan pun terbaik",_
Perhantaran memang laju,_
botol susu cantik,_
"The product is very good, not detrimental, you did not deceive me, like in the photo, the product is good",_
"Impressive,",_
x urgent nak pakai tp sula klu sampai awal,_
Sya dah lar ulang alik dri tmpt kerja lbih dri 20kM,_
Kasut cantik saiz pon muat jaaa,_
"surely buy again next time , thank you",_
the design oky but not too cute lol and whats w the size its too big for me T T,_
PKG terbaik,_
Vid dan pic xde kaitan,_
Baju sampai on time cuma nak kena otter je sbb saiz M dia ni mcm pakai saiz L je,_
"This lipstick is a gift, so I didn't open it",_
"Barang sampai dgn selamat, still need to buy sbb wajib mask kene pakai,",_
Barang semua baikkk!,_
memang ngam soiii cantik gila sandal ni,_
Fast delivery in good condition very good quality,_
Brg sy sume ok,_
Barang pedu mantul terbaik tq,_
Yeah dude can you solo like me,_
Hujan pon sanggup hantar,_
why do verified youtubers comments get more likes and replies than normal people&$HASHTAG$,_
Besides that it is worth it to buy these shoes since it is very cheap,_
Original stove and box was damaged by J&T courier wven though Seller labelled as fragile,_
Pic xde kene ngena tau,_
Quality:not sure 4ply or 2ply had to cut open,_
"Servis pantas mcm biasa, order hrini, esok sampai barang smua ckup",_
"However, too tight",_
"Postage paling laju didunia , good packaging ,pakaian yang berkualiti",_
Kene dgn saiz dan material pun sesuai utk ank2 nak pakai,_
cutting cntik,_
Bgus terbaik,_
Safely arrived and game works really well,_
"Kegagalan enjin pesawat pula boleh terjadi akibat beberapa faktor seperti masalah elektronik, limpahan atau tumpahan minyak pesawat dan beberapa faktor teknikal yang serius",_
Ambil masa 5 hari utk pack brg nak pos walau hari bekerja,_
Doesn't Show Nearby Restaurants/Fastfoods despite having it kilometers away,_
OMG THANK YOU SO MUCH SELLER,_
Thanks man for such fantastic review!,_
Oke lah ya,_
Item terima dengan cepat dan selamat,_
Fast delivery good packaging hope got cheaper price but hope is full leather lah,_
$MENTION$ Marley I watch on Flixzone,_
🥰🥰🥰🥰 Thank you po,_
"Starting she couldn't accept the different taste but now i mixed with old milk powder, she is ok already",_
The game has also brokered deals with Sony and Nintendo to make it available on the PlayStation and Switch consoles,_
lawo komeeee,_
Da try baju ni,_
blom melebatkan lagi tp da kurang menipis,_
sayu sayu je,_
"Kain elok, besar dan selesa",_
Sy besar bhagian paha jadi bila nak pakai tu ketat sikit tapi dpat jugalh pakai,_
Trima ksih tok lie,_
Good to give as a gift to them,_
This has been my repeat purchase with additional new items,_
It uses the type C charger,_
Army can put this on fridge and practice whenever they pass by smooth like butter how cute,_
Gambar sebelum dan selepas,_
item receive thank you but still not check yet item receive thank you but still not check yet item receive thank you but still not check yet,_
Selalu beli simpan sebagai stok,_
ítєm mαntul,_
Item has arrived thankyou so much i likeee it i will but again soon,_
Laki den sukoo,_
"staffers for the world's biggest online retailer have aimed to unionize this year, following a failed effort $URL$",_
laju smpai berdesuppppp,_
dont waste your time and money to buy this cable,_
Lajuuuuu gilerrrr,_
"No spoil although delivery by sea but waiting too long, more than 1 months",_
Already mi,_
yeah barang dah sampai walaupun lambat sikit ya la china kan tapi okay la tak try lagi insyaallah kalau elok beli lagi !,_
Take 2 weeks to received the order,_
Terbaik terbaik terbaik terbaik terbaik terbaik terbaik terbaik terbaik terbaik terbaik ride on,_
Becareful if used Shoppee express as they might not call you and I ended up calling the customer service more than 4 times to relay the message of sending the parcel at the date when shop is open,_
Sedangkn rider2 lain hanya amik gmbar parcel seje,_
Kondisi blm tau lg ok ka x,_
Dented abit although ard packed very welll,_
dh byk kali repeat dgn kdai ni,_
Barang lambat sampai macam dalam tiga hari macam tu tapi bagus,_
X delah tebal cam beg mahal,_
Super fast as usual,_
"Awesome cabinet tv, fast delivery, very cheap, quality very good",_
"Arrived 7 days later, to EM",_
nah tq ya,_
Gak punya venompool ya bang? Moga ae di baca,_
My order arrived in time for me to pack for my overseas trip,_
Selamat sampai tdi baju nya,_
"The allegations, which Georgieva strongly denied, were contained in the investigation report of a law firm $URL$",_
Pigmentation:hitammmmm,_
Only JnT slow the process,_
this is the happiest sweetest cutest video of all time aaaaaah I love seeing the bean all curled up in the leaf just transformed into a massive puffball with a liddol face :3,_
x ok sgt sbb nmpk mcm mngandung 2 bln stgh ke,_
I know I say this a lot but I don&$HASHTAG$,_
bleh basuh baju dlm 4-5,_
"Just buy online, everything is cheaper",_
yg kali ni beli semua material dia jenis flowy dan sejuk,_
saya suka barang saya !,_
jenis yg bdn besar tpi bolelh,_
"It peaks again between 6pm and 8pm, after which it declines",_
"kain nice tak kejung sangat tak lembik sangat okay jaa, delivery mantap harga pun murah dari other store btw warna silver tuu kalau depan depan dia nice jaa macam light gray dalam gambar je macam white yang amber tu lak depan depan warna dia gelap tapi lawa",_
"easy preparation, suitable for meal in busy day",_
sorry gambar tkdk kena mengena tp sgt recommended nanti nak repeat lgi !,_
Barang dah sampai alhamdulillah cantik sgt tq ya sis nanti In shaa Allah repeat order lagi ya,_
Goooooooooooooooooooooooood and fast delivery,_
Barang sgt murah berbanding kedai $MENTION$ Mall,_
"While ordering it gave error so I tried again, I order became double, once I didn't found any option to cancel, I tried to chat with customer service, Lady Aqsa Saleem as per her even she will cancel the order she won't refund my amount that's how you get 1 star and bad service next time I will take bykea for better services",_
It was packed with bubble wrap and cardboard but the item is still crushed,_
Recommended sgatt spe nk beli jersi,_
seronok anak² dapat,_
Worth while,_
"harga murah, dah 2x repeat order",_
penat nunggu,_
"Warna lawa , lembut , glossy",_
🤣🧘,_
Good quality Worth to buy worth to buy Thanks Seller Will support you again,_
3030,_
Alhamdulillah dah selamat sampai baju kurungnya,_
The boots were wrinkled but there's no damage on it,_
Seller baik sangat bagi 2 free utk tiap size kecil and besar,_
"Bila pakai earphone, still berfungsi,",_
Agak lambat shipping out tp x pe x urgent pn,_
Kasut dia lembut,_
ank² pon suka mkn,_
saya sucject beli jus ni,_
recommended lh bli sni,_
"Yg lepas beli ade 3 jarum jam, yg ni tiber ade 2 je",_
Dua output utama Banci Malaysia 2020 adalah Malaysia Statistical Address Register (MSAR) dan MSPR,_
"nice packing, thanks seller, nice value for money, good quality, thanks for free gift",_
"Ketua Penyelidikan MIDF Imran Yassin Md Yusof, berkata ini secara tidak langsung boleh merangsang pasaran pekerjaan tempatan kerana pengguna akan bersemangat untuk menghidupkan semula 'perbelanjaan' mereka di dalam negara",_
Stakat ni okay lagi la gune,_
"A little thin, but it works",_
next Time boleh order lg,_
"Barang berkualiti, penghantaran cepat",_
Hasil tngok tiktok,_
kotak dah penyek,_
"Water Blue pekat jgk warna dia ingatkn soft² , tapi ok je matching kan boleh tukar² pakai",_
Cartoon is looks cute and nice,_
"Baru-baru ini, Azalina mempersoalkan sama ada Tan Sri Muhyiddin Yassin sebagai Perdana Menteri ketika itu membuat semakan latar belakang Azam sebelum beliau dilantik memegang jawatan Ketua Pesuruhjaya SPRM",_
He stressed that regulations were also important to control farming activities in the city,_
Why this app is not working Solve this problem,_
yg sorg tu je nangis sbb patah,_
'znznznznnznznnznnznsnsnsnsnsnsjsjsjsjjs,_
mantap pak abuuubdhdjssjvsjsksvskssbsbsksssknvv,_
"Receiveee,",_
Fast delivery and nice packaging expired date long time,_
delicery pun pantas guna ninja van,_
So sy naikkn je alas besi tu letak atas skru mne yg lubang xselari,_
บอกว่ามีส่วนลด แต่ไม่มีช่องให้ใส่ กดดำเนินการต่อ เป็นการคอนเฟิร์มออเดอร์เฉยเลย ยกเลิกก็ไม่ได้,_
kondisi beg sama seperti yg seller review,_
"Also, I love to cook food together with my family",_
RM0 redONE: Enjoy a FREE cup of BlackBixon coffee today!,_
maybe sbb order byk kot,_
dkt dlm ada inner tpi kalau pakai tu agak panas laa,_
Material:belum buka pakai lagi,_
Refund was made,_
so total dlm ni 4rolls,_
Terima kasih saller barang sampai keadaan baik berfungsi,_
Titik dire,_
Delivery was super fast and product came nicely cushioned with bubble wrap!,_
Design:shark,_
teballllllll bukam nipis,_
sngat cantik saya bagi 5 bintang tq so much,_
Insyaallah nnti nk repeat Oder lg,_
quality : 100/100,_
And the light very nice,_
Thank you very much seller:),_
"dah bnyk kali beli kat kedai ni,sngt3 puas hati",_
Apa2pun dh bnyak kali repeat di kedai ini,_
"Good packaging to ensure no spillage, happy with the service =)",_
Able to activate the sofware but reuqired to uninstall n reintall the softwarr few time,_
Barang sudah diterima terbaik bos barang ok memuaskan anak suka sekali,_
Nih tebal gila,_
2$MENTION$ kali tgok kt tiktok pasal kacang ni,_
the fabric is nice to wear,_
It always went wrong where I wanted to buy groceries,_
Camera dia tak cantik harga bawa 100 dapat camera tu rasanya bonus,_
She also called for a proper whistleblower channel in schools for the children to safely report on bullies,_
"The Health DG also said there were 14 recoveries on Thursday (Sept 17), bringing the cumulative total to 9,264, or 91",_
I cant wait to use it to improve my drawing skills!,_
Baju cantik nampak macam mahal,_
Fast reply and excellent service,_
Just a spinning icon showing trying to connect,_
"Cantikkkkkk sangatttttt,",_
But better amik yang besi kot,_
Banyakin lg dong promo nya,_
The entire 2020 edition of the league and the second half of last year's tournament were held in the United Arab Emirates as India grappled with the COVID-19 pandemic,_
sesuai utk budak2 je org dewasa rasa tk berbaloi,_
servis terbaik dan penghantan cepat,_
utk goodies kahwin,_
"seperti dijanjikan, buy 10 free 2",_
ngam dgn muka boolatt kita,_
Sbb urgent nak bagi hadiah kawan nak balik indo,_
Hrpnye ok la,_
"[11-12, PG] YaAllah Rahmatilah Nurul: Klu nk oder pyment mula buat pd 12/12 la ye",_
com/p/CR-3Nf6n2yn/?utm_medium=copy_link$URL$,_
Terrrrrrebaikkkkkk,_
ada masa sangkut2,_
Selipar sgt seles utk pakai harian,_
The vaccine will not magically stop the clusters,_
THANKYOU FAST DELIVERY URGENT SANGAT NASIB SAMPAI CEPAT,_
thank you seller n semua yg terlibat,_
Purchase during sales with only 9 cents per pair delivery is fast too,_
The material is comfy enough 🤩,_
"best terbaik, inpod function dengan baik and dah try semua best",_
"fast delivery,good packaging,value for money,good quality of product,nice color and material",_
This is my THIRD time buying from Meet Mee,_
Dah sampai make sure kalau nk beli better amik besar satu saiz dari saiz sebenar,_
fast deliveryFriday morning paymentFriday post out Saturday receivetqvm,_
Cantik2 swaddle dia,_
"Anyhow, items are well packed with hard box and securely sealed",_
Semua cukup Dan ikut saiz yg diminta,_
overall quality and really supper fast delivery,_
"Kain seluar ni best, lembut jee",_
would be better if sm gives more inclusions just like what they did for dream albums :(( hoping that repackage album will have more inclusions pleaseee,_
"The size also suitable to pack papers/files, office stuffs inside",_
7bil) in potential dry power assuming the bank maintains its common equity tier-one (CET1) buffer in the range of 12,_
Pengaruh tiktok kte cuba try,_
So kena ikat mask sikit,_
Skin Suitability:I honestly don't know,_
warne cun,_
dpt harga rm 60,_
Size is correct and perfectly match my baby cot,_
"Menteri Komunikasi dan Multimedia, Tan Sri Annuar Musa, berkata ini penting berikutan MSC Malaysia perlu berkembang sejajar perubahan pesat norma sosioekonomi yang menjadi tindak balas terhadap kemajuan teknologi digital secara berterusan",_
"Tapi sehari je barang dah sampai 🤗 packaging ok, ni kali kedua saya beli dekat sini",_
ngam boss kurr,_
utk lap dapur,_
HAHAHAHA MASEH NOH SELLER,_
Overall not bad experience,_
Both material is nice,_
Material:cantik sesuai la dengan harga,_
"thank you seller, cantik barang dpt free gift comel ii",_
"Fast delivery , comel ja semua , good value for money :3",_
1 ja nk pesan kalau pakai saiz 7 elok ambil saiz 8 sebab kasut ni dia mcm fit sikit,_
"Suction ok tp ikut keperluan, sbb saya da ada robot vacuum",_
"Malawi have three points from two games and lie third in the group behind Senegal and Guinea, who each have four",_
"thankyou seller bagi free gift belt,",_
Tp klu jns yg suka pkai full nk tutup lemak tepi n blkg badan baik beli yg sulam wrna grey nk hijau tu dgn kuning tu,_
Semua seluar dan boxers selamat dibasuh,_
Warna as per shown,_
"penghantaran yg cepat,barang ada kemek sikit mybe sebb transpot sebb seller wrap dngn baik dh",_
Good product but should change the shipping/delivery method,_
"overall semua ok, cantik & cepat sampai",_
"Many officers have already been absolved of any wrongdoing during internal police investigations, ACLED added",_
ukuran ngam dgn sy,_
PLEASE PICK ME $MENTION$,_
Alhamdulillah cepat sampaiii haritu sedih nk order tapi dh cepat sold out hehe sebaik seller bgitau dia nk restock hari apa hehe,_
Sauté for 10 minutes on low heat till oil starts to release from the sides,_
alahaiii kecik nya beg dia,_
seller siap inform bila barang akan di post,_
"bole adjust lgi,zip zap jetq seller",_
Courier delivery laju,_
mujarab hendaknya,_
best wangi sgt anak2 suka dan puashati beli kedai ni,_
"tq seller,saya suka sangat beli dgn sis,next time saya borong lg ye",_
*You are recommended to provide full focus & high commitment*,_
tapi masih blh pakai,_
"So whether you want to gently clarify butter for that macaroon recipe, do a sizzling stir-fried crisp veggie dish or roast the chicken with the potatoes -- all at the same time -- this is the combo cooker for you",_
The gamblers,_
"Christmas in Latvia known as Ziemassvetki is a melting pot of ethnic, religious and modern traditions",_
"Terbaikla seller ni, smlm order hari dah sampai",_
tiada bunyi,_
"Material selesa, saiz ngam dengan badan anak, kali kedua beli dtp seller yg sama",_
Pengenalan penggunaan sumber khalayak di negara ini asalnya adalah untuk meningkatkan pendapatan golongan B40 yang dipertanggungjawabkan kepada Malaysia Digital Economy Corporation (MDEC),_
Sorry laa video tkde kene mengena dh habis bedal dah tk sempat ada video and gambar,_
"Lain kali bole repert lgi n lgi,trust seller",_
3rd time buyinggggggg,_
Kta cuba,_
htr bagus kualiliti,_
saye tinggi 157 die punye labuh tu betul² atas pinggul,_
I really waiting for this phone from 2months,_
"Worth of money ,",_
Abg yang hantar parcel OK,_
Suggest sangat,_
"anak suka , saiz ngam dgn kaki dia",_
sesuai untuk polaroid,_
kenape ye,_
"6 of them have savings not more than RM50,000",_
Kain mcm inner lengan,_
perfume bau wangi,_
Kipas sampai dalam keadaan baik laju sejukkk boleh la pasang time panas,_
"Received in good condition, good quality, good value of money",_
Tiga Hari Sj,_
Asyik melayang jer fikiran,_
hah okey bye,_
Tq kasut da selamat sampai tnpa ada sebarang kerosakkan,_
"Over the past year, the glove maker has made headway in terms of reducing carbon emissions at its factories",_
Penjawat awam perlu ketepi budaya kerja silo,_
cntik² barut,_
It works like champ,_
"Good packing, product received in good condition and very fast delivery",_
"Terima kasih penghantaran cepat, baby belum pakai lagi, tapi stokin cute sangat",_
thank God received before she will back to her campus,_
Barang kualiti memang padu gila,_
Bottle was wrapped in thick bubble wrap together with hard board,_
Roughly six in 10 said they were at least somewhat likely to seek such remote care after the pandemic ends,_
"Understandable on why it takes time to arrive since its a pre order item so if you re not rushing, I recommend to get this mask",_
Packaging tak memuaskan tp barang okPackaging tak memuaskan tp barang okPackaging tak memuaskan tp barang okPackaging tak memuaskan tp barang okPackaging tak memuaskan tp barang okPackaging tak memuaskan tp barang ok,_
seller ship item fast,_
Stokin xnipis,_
What a perfect little girl welcomed into your family,_
Material:nipis sikit dr yg sebelum ni,_
Twitter:Stupidodo1234,_
Hehehe thank uuuu,_
Akan beli lagi kalau ada promo,_
Reasonable price comparison to others,_
Yah gada pakaging adalah sahabat,_
(happy to be corrected if that is wrong),_
Dah biasa bl dari kedai ni,_
dah pakai hampir sbulan untuk kerja2 yang lasak dlm keadaan panas dan basah,_
This omni-channel approach will also help SMEs buffer against any unforeseen shocks in the future,_
"good, thanks the free packet",_
Pekena plak dgn nasi lagi laa padu,_
The phone and those cases are amazing $MENTION$,_
It is true that daily essentials are more expensive now,_
simple but look modern,_
Thanks will repeat order when needed,_
6- Cannot edit Call history,_
jpg alt=Uqasha mengajak Kamal mengerjakan umrah bagi memanjat kesyukuran apabila doa dipertemukan jodoh diperkenankan Allah,_
Cantik kiut kiut je,_
masa beli 12sen je,_
"contact seller utk tnye, ble bg video bukti, seller trus snyp tnpa khabar",_
memang selalu beli dekat sini,_
im sorry for the not so nice pictures and video,_
Order barang dari korea lagi laju dari local sampai,_
"Tapi tidak tahan sangat, senang putus",_
47pm 25,_
Gambar ke 3 tu free gift,_
Wish you more success Kiki love youuuu,_
"Saiz okay delivery pun okay tak lama sangat sebab takde urgent nak guna, just prepare untuk bob je",_
"Fast receipt, good packaging, great quality, easy installation, suitable for many places in the family, very satisfied!",_
"Among many changes, our priority is in liquidity control through tighter ALM [Asset Liability Management] and a credit screening model, in which we added more categories such as adjusted cashflows and recovery potentials",_
memang sangat berbaloi membeli dengan seller ini,_
Cpt sangat barang sampai,_
Tq seller kain sarong bpantang kite da smpai,_
Always Best And Better Good Luck Borther,_
The material is not bad,_
my new collection nak letak kat kereta,_
Fast delivery within 3 days from kedah to KL,_
Effectiveness:soft and worth it!,_
"Semalam, video ritual menolak musibah banjir yang dilakukan indvidu berkenaan di sini, tular di media sosial",_
Item Delivered In Perfect Condition,_
"Biar ada sistem yang boleh melindungi sebarang perubahan selagi tidak sampai ke arah matlamat ditetapkan, katanya selepas mempengerusikan Mesyuarat Lembaga Eksekutif MOM kali kedua bagi 2021-2025 di sini, hari ini",_
Pelayanan masyarakat kecil yang sangat penting,_
seller pun senang nk berbincang,_
Double box in a box good product good packing good seller good all good abd buy more more more,_
19/11-order,_
Attractive colour lights,_
brg sudah diterima dalam keadaan baik dan pembungkusan kemah,_
Kain best semua best,_
Bgkusan okay,_
Bang menit <a href=$URL$,_
Tastes super good Very recommended to buy,_
Sepantas kilat Sepantas kilat Sepantas kilat Sepantas kilat Sepantas kilat Sepantas kilat,_
Barang semua elok terima kasih nanti saya beli lagi,_
Baju menarik te tarik kau memang debom,_
Barangan sangat berbaloi dan harga yang sangat berpatutan,_
sukaaa sangatttttttttt,_
order 8 hari bulan,_
"it taste suprisingly good with a lil bit of bitter aftertaste but it didn't affect the whole experience so i'm good,",_
Warna brown sy pilih ni sama macam gambar,_
Kne hntr kedai la jawabnye,_
Imagine Getting heart&$HASHTAG$,_
Quality:legit guys,_
Can't find best before/exp,_
murah jnis long bru rm10 cas shipping rm2 je,_
Sari jah spa dih klu dok klatey gak,_
Smpai semua okay,_
Terima dgn ok terima kasihh brg smpai etah brapa hri dah bgi nk review,_
80pkr delivery for 0,_
nak kabo brg ok boleh bli,_
Sangat cantik harga pun murah dpd kedai lain,_
Quality:Original taste,_
Your order has been delivered on 01/10/2021,_
"14 Cut the cake, pour the champagne, and let the good times flow you're turning 50, and it's time to party!",_
"Barang mmg berkualiti, penghantaran mmg pantas packing mmg kemas dapat harga yg mmg berpatutan okay bye bye for now and selamat memandu jaga jgn masuk air banjir yer hehe",_
500g ni agak2 utk berapa biji donut ye boleh salut,_
is a very good choice,_
Items received over the weekend,_
Ini pertama kali nak cuba 4t jenama Mizu dekat motorsikal,_
Biase pakai losyen anakku yg biase je,_
belikan tuk kwan,_
"Really Love everything about this binder , It perfectly fit my pc and thank you seller for the freebies !",_
parcel come with complete items and good condition!,_
"Some of the key issues and challenges facing the industry included protectionist policies such as non-tariff barriers, restrictions/bans implemented in some countries, withhold release order and change in PV value, negative consumer perceptions, low awareness of palm oil and its attributes, and trade disruptions mostly due to Covid-19 related restrictions, he said",_
sesape nk beli ubt nyamuk beli dr seller ni,_
That fell short of analysts' average forecast for 107bil yen (RM3,_
Neither the third grader nor the second grader considered any worth pursuing,_
cuma agk kcewa skit sbb seller lmbt prepare brg utk delivery mkn msa,_
laju je,_
Tapi repair ni ambil masa yang agak lama,_
Quality never drop,_
Banyak soalan latih tubi untuk anak yg umur 9 tahun,_
Dah banyak kali repeat dengan seller ni memang terbaik harga pun berbaloi dengan item yang kita dapat,_
Bau wangi i suka,_
"for the purpose im using it, it's enough",_
"Camera Resolution sangat cantik cuma delay sikit camera die,So far masih memuaskan",_
"Good product quality and good price,thank you boss and we have receive the items",_
hulkbuster,_
Nice quality nice colour,_
Pembungkusan yg Kemas,_
"In an ideal world, you'd like more overs with a newer ball",_
Kualiti memg okay sbb penah bli tudung souk nie,_
The latest progress of the two young ladies comes on the back of their participation in the Patriot All-America Invitational championship staged at Wigwam Golf Resort in Arizona at the end of December,_
Kapan posting vidio lagi bang,_
Service seller sangat cepat Tu sbb dah banyak kali beli dekat sini,_
Tali dia cam plastik so tak sakit kalau kena and nampak macam tahan lama,_
"Pengarah Urusan Kumpulannya, Datuk Zulkarnain Md Eusope, berkata langkah itu adalah bagi mengukuhkan kehadirannya dalam pasaran tempatan dengan memantapkan lagi logistik dan pengedarannya di negara ini",_
"If you wanna get with me, better make it fast",_
Sangat cepat servis penghantaran boleh repeat order,_
"baru beli smlm, harini dah sampai terbaik",_
yeah good,_
Texture:tak lembut tak kasar,_
dompet boleh tahan la cun,_
As my main concern is 5G I can switch to iPhone 12 Pro but in India we don&$HASHTAG$,_
Item arrived safely good response from seller will repeat again,_
Cantik kiut kecik molek je,_
Seller pon bagus!,_
Sangat Pekat,_
Terima Barang dalam keadaan baik,_
buat sapu kat roti,_
my last one was broken in 3 months let's see how long this can last,_
mmg sgt sgt protected kotak,_
Ade tag Zara,_
Dah pakai dekat aircond semuanya okayy,_
