Sentence,Tagged_Sentence
"Selain daripada itu, tidak dibenarkan masuk demi keselamatan dan kesihatan diri sendiri, katanya kepada pemberita di sini, hari ini",_
Delivery very fast and can buy if urgent,_
bungkusan berada dalam keadaan baik,_
klu beli kat nsk dia xde warna hijau tu,_
It took 1 week to get it from overseas,_
Size/Perfect Fit:sesuai sangat untuk newborn,_
tp cutting nesar skit la,_
masuk tahun baru je caj delivery naik,_
Texture:Kali ke-2 repeat order,_
"Goods received with good conditions, delivery lead time and products meet my expectations",_
ada mic,_
"Nice Quality,",_
Kecewa sbb seluar line putih singkat dari seluar line grey,_
Usually kat luar pakai saiz 40 tapi amik 41 utk yang ni just in case tak muat,_
Thank you seller for the free gift one black dress So satisfied and feel worth to buy it with the promo n sale all the condition of items like a new,_
Taste:heavenly good,_
"Quality:Packaging baik, expired date pon lama lg",_
Weh serius cantik tkyah fkir dah,_
Tq abam,_
Cantik dooohh,_
Bubble wrap tebal sangat,_
"Saya selalu pake grab loh, kalo pelayanan begini mending saya gak pake lagi grab",_
lmbt sngat2,_
KUALA LUMPUR: MIDF Research has maintained its 'neutral' call on,_
Sesuai saiz ngam,_
Sampai selang sehari,_
"Everyone at the market was then coaxed into singing the national anthem, Negaraku",_
"Good product quality, fast delivered, price is cheap",_
Assalamualaikum bang saya pengen itu karena untuk adik saya dan emas nya untuk orang tua saya assalamualaikum,_
Beli 3 sampai 3,_
warna cantik saya suka,_
Thicken with corn flour and a little warm water,_
Received in bad condition Noodle cracked half and small pieces,_
Dari anak kecik smpai umur 3 tahun,_
Tq seller siap dapat tisu,_
"Even pakai time preggyy, helok je muat2",_
Terima kasih saya beli dengan nilai tersebut,_
tudung free gift pun cantik,_
Bau krim ni wangi,_
"Order saiz 12 dpt saiz 14, adidas grey dpt adidas putih",_
"With the economy expected to recover and inflationary pressure to return, MIDF Research also expected Bank Negara to undertake a rate hike of 25 basis points in the second half of 2022",_
cepatt penghatarannya,_
Puas hati dgn barang nih,_
"second repeat,1st beli saiz besar skit,40 saiz ngam kaki",_
Barang cukup walaupun packaging koyak,_
Arrived a bit slow but everything is is fine,_
Mmg sdp bau perfume ni,_
Taste:terbaik nanti kita repeat order dari kedai boss lagi,_
Sebab nampak murah terus beli 4,_
It will look disgusting in a Month,_
"Kao Kim Hourn berkata, Perdana Menteri Kemboja menzahirkan kebimbangan kepada Min Aung Hlaing, mengenai ketidaktenteraman yang tercetus sejak perbincangan diadakan",_
Size 1 kasut Skola amek XS,_
"Jika kita masih ragu-ragu untuk bergerak ke hadapan dan tidak berani melakukan perubahan selaras perkembangan global yang begitu pesat dan dinamik, kita khuatir JPA tidak lagi menjadi relevan sebagai peneraju dalam perkhidmatan awam, katanya",_
beli 4biji,_
En fin todos mis varones,_
Selalu lmbt,_
Shower yogurt ni pun bau sedap,_
comel2 bajunya,_
Item have been received a week ago,_
"Sebagai panduan, Allah SWT berfirman maksdunya: Dia menundukkan apa yang ada di langit dan apa yang ada di bumi untukmu semuanya (sebagai rahmat) daripada-Nya",_
"Awesome review bro,",_
penghantaran lambat skit but isokay,_
"Fast delivery,terboekk boss",_
This is a ridiculous app EVER you can only choose two types of ID a senior citizens one and the other is PWD?,_
$MENTION$ honestly she is,_
Omg Cassie congratulations!,_
works well and functioning,_
First time lock dengan seller cantik betoi baju2 nih love sangat harap2 boleh shopping lagi kat kedai sis hihi,_
Manual is missing,_
Dia juga masih mempunyai status perbicaraan di bawah Seksyen 506 kerana mengugut dan mengurung bekas pekerjanya serta kesalahan rogol di bawah Seksyen 376 di Mahkamah Sesyen Muar,_
Terbaik terbaik mantapppp barang bagussssss dan berkualitiiiii,_
Last2 mak berkenan,_
Mnis dia oky je,_
dah repeat kali kedua dengan seller ini,_
Boleh guna untuk hospital beg mummy,_
Three others have exceeded the warning level,_
Tapi macam ada yang bocor sebab air terkeluar,_
2hari dah sampi(order 11/11) dapat offer murah plak tu,_
Lebih optimal lagi,_
Saiz L ni sesuai untuk org yg nak labuh tutup dada sampai pusat,_
The Bank of England is hoping for a revival of business investment to help improve Britain's longer-term growth prospects,_
"$HASHTAG$ first started by Swedish feminist and Make Equal founder Ida Ostensson in 2016 encourages conversations on different themes about what it's like to be a man, and it's based on the idea that the dialogue about gender equality also needs to be owned by men and boys, not only by women",_
Dah sampaiDah sampaiDah sampaiDah sampaiDah sampaiDah sampaiDah sampaiDah sampaiDah sampai,_
Strawbery 1,_
so cute and cheap price,_
Nice and secured Packaging,_
no more sticky sticky on the windscreen,_
Kasuit lawa naihhh ampa,_
"Penghantaran terbaik,laju je seller hantar",_
Sangat sesuai untuk my girls,_
php/s/1SSH5cggQKbembl,_
Grab nya gratis ongkir,_
Btw very good quality item,_
Pos agak lambat jugak,_
Alhamdhulillah,_
Tak menyesal beli 🥰🥰🥰,_
Nanti patah tgn dia,_
Very nice sand set,_
from me thanks a lot seller,_
harga berbaloi dan kain dia best warna cantik,_
"Pedas gila tapi sedap,",_
Parcel arrive in good condition the sleeve is good and okay to use,_
"belum try, harap sedapp",_
Paymeny 12,_
Chat seller amat berpuas hati,_
THANKYOU OMG,_
Blh bli lg len kali,_
penjual layan baik soalan2 yang ditnya,_
Satisfied even though a bit late,_
cepat respon seller,_
The assembly of over 60 athletes and coaches from participating states will spearhead MTA's programme to develop a new vision for triathlon in Malaysia,_
Best phone in the market $MENTION$,_
"Tempat penarik dia tu tak de la mcm beli mahal, tapi still kukuh utk ditarik, cuma kena hati2 la kot jangan ganas2 okie",_
apepun ngam la harga pun mirah beli time sale,_
Tq seller sbb beri layanan yg baik 🥰,_
Lumayanlah,_
Fast delivery good product quality nice packaging thanks seller,_
Quality:thanks barang sampai,_
Then lari laju2,_
bg 5 starr,_
"The mangroves on more than 20,000ha are now 43 years old, twice as old as a mature planted forest, and thinning is no longer an option, said Prof Nam",_
Mudah nk buat untuk anak anak,_
Hello BANGTAN,_
selesa sgt walaupon getah,_
cepat dipos n sampai,_
Very recommended this shop to u gaisss,_
I ordered 3 singlet 3XL & 2 singlet 2XL size,_
Okay la notbad,_
"The Philippine death toll from Typhoon Rai has crossed the 400 mark, the disaster agency said on Friday, as officials in some hard-hit provinces appealed for more supplies of food, water and shelter materials about two weeks after the storm struck",_
Kain buai yg besar sesuai un,_
One of the best mobile phone,_
inside no USB cable,_
"pretty and style , same like picture , everything is perfect",_
"The item is appropriate, it is quite expensive with that price",_
Reasonable price & good products,_
Barang cantik tp penghantaran agak lambat sbb dr luar negara,_
Sy order dua,_
Love this Pixiu bracelet,_
Barang sudah selamat diterima dan tiada kerosakan thanks so much,_
kasut best ringan,_
I am happy with the products and the deal with the seller,_
will definitely visit again,_
"Compared to the first purchase, this one looks quite old, bcs the box came a little dented, and no warranty or manual card inside, however the device can still be used without any problem",_
Dasher's staffs were very responsive & helped inquire j&t,_
VC has a more subtly elegant curved octagon shape - a little more dimension than the AP design - both are nicer looking than the 5711 TV screen I would say,_
barang selamat sampai sebelum hari khamis,_
Tdk ada solusi sampai saat ini,_
Kain tebal n best n kembang mcm yg sy nak,_
But I bought 100 packs and he missed me one pack,_
Sy beli 3pcs,_
Baju saiz 4xl tapi rasa mcm 2xl je,_
Jimat paper cups,_
brg selamat sampai dan best kualiti,_
Able to quick charge as per describe,_
sangat delicious,_
"Former US President Donald Trump , the WTO's Appellate Body, by blocking appointment of new judges in 2018",_
Terrbaikkkkkkkkk,_
Terbaik barang sama seperti dalam gamba,_
Pantass terbaik chun,_
Saya udah pake soalnya,_
Cantik dah la murah,_
jam cantik and berbaloi padan dengan harga,_
Parcel has received in good condition satisfied with the product and seller highly recommended,_
"I ready bought 4 pairs from the saller,",_
tudung tu dah sampai lama dah 20/12,_
"26pm, Malaysia",_
All four bottles arrived safely,_
Lampu cerah puas hati tq tq,_
3 more free gift,_
menyenget sikit,_
"Best price in here, supermarkets more expensive",_
"Walau beli 2 je, parcel balut dengan bubblewrap",_
"Iraqi Airlines has confirmed that it will not resume flights to Minsk, and Turkish Airlines will also suspend sales of one way tickets to Minsk from Turkey",_
"Penghantaran cepat, cuma nya seller je lambat ship out",_
dr 15 sachet dpt 5 sachet,_
suka dgr seller share kelas,_
The condition is very good,_
Free palestine Free palestine Free palestine Free palestine Free palestine Free palestine Free palestine Free palestine Free palestine,_
One of the best value for money clothe brand,_
it i received in good condition,_
Beg sangat cute saya suka,_
Blh pakai g travel,_
barang ada sedikit calar,_
"not sure if semua org tahu ke x, tapi dkt pintu bhgian bawah tu ada mcm sendal utk bagi kotak2 tu stick with each other",_
Received in light speed!,_
Yep it&$HASHTAG$,_
besttttt sangatttt,_
semua cantik2 tq tq,_
received in good conditionbought 10 but only received 9,_
Heng added that the PAP is not just here overnight to suddenly come up with some slogans,_
Convenient for breakfast and on the go,_
Expired date bln 11,_
cuma pasrt letak apple pencil longgar sikit,_
Gmbar xde kena mngena smua ok nnti boleh repeat lagi brg smpai laju,_
Dah try pasang semua kaki dia pun okay takde masalah,_
Dapat bateri,_
SS AS BACKUP ONLY,_
tp kalau nk longgar amik stu size besar,_
All others items also stick with the milo powder,_
but okay laa sesuai dgn harga,_
semua bgus cuma tak kena dgn selera saya dah adjust air dia tp still tak kena dengan tekak tp rse syg pula nak buang yela beli pkai duit sndiri dah tu beli 2 pula tu HAHAHAH ASTAGA PAPEPON ANYONE YANG BACA NI AND NAK BELI NI PLS BELI DARI I LAHH SEBB I TAK MAKAN SO NAK JUAL BALIK THANKYOU SELLER🤍,_
Kat luar yg kotak biasa tu kat dlm ada kotak yg putih,_
Bru nk pakai utk esok,_
"Craving nak mkn ramen ni Thank you seller, semua cukup",_
Ini barang saya manyak Saya suka saya suka,_
Baik bagus muat muat je,_
Order hari jumaat petang ahad dh sampai,_
First Roomba-type vacuum,_
bayar bil mahal-2 tapi asyik berpusing loading tak habis-2,_
"Fast shipping, seller respon chat pantas & jwb semua pertanyaan",_
Ok la kasut ringan sgt tapi tapaknya licin kena hati2,_
Fast delivery but packing is very minimal,_
Receive product as per advertise,_
All pants are perfec,_
Owsme apps,_
"Item received in good condition, recommended",_
Veryyyyyyyyyyyyyyyy gooooooooooooooddddddddddddddddddd,_
"Penghantaran yg cepat,seller pun balas cepat 3 hari dr order n dah sampai terbaekkk seller",_
instant film pun lambat lagi expired,_
"There will be 4,000 cabins on cruise ships that will dock in Doha for the tournament",_
Everything fresh,_
Cara pembungkusan amat menyedihkan( tiada kotak walaupun bekas ini mudah pecah ),_
Nanti nak cuba sambal lain,_
Terbaikლ(^o^ლ)⋋ ⁰ o ⁰ ⋌⋋ ⁰ o ⁰ ⋌⋋ ⁰ o ⁰ ⋌⋋ ⁰ o ⁰ ⋌⋋ ⁰ o ⁰ ⋌⋋ ⁰ o ⁰ ⋌⋋ ⁰ o ⁰ ⋌⋋ ⁰ o ⁰ ⋌,_
Cuma tinggi seluar tak sama,_
kesudah nya beli la yg murah tpi nampak elegant,_
good good good good good good good good good good good good good good good good good good good good good,_
tq seller 🥰🥰🥰🥰🥰🥰🥰🥰🥰🥰🥰🥰🥰🥰🥰🥰🥰🥰🥰🥰🥰🥰🥰🥰🥰🥰🥰🥰🥰🥰🥰🥰🥰🥰🥰🥰🥰🥰🥰🥰🥰🥰🥰,_
Overall good experience with seller,_
Lap u so much,_
Receive item aa description,_
pek check,_
"In explaining the issue on Wednesday (Jan 5), Azam said his brother had borrowed his trading account to buy shares in the open market and financed the purchases on his own",_
jauh² Smpai juga Selamat dekat Sabah hehe,_
I sbenarnye kecewa sikit sbb I nak warne lain tapi dpt lain,_
"Barang dah sampai,sedap pakai saiz memang cun terbaik seller recommended",_
Terbaik dan terus digunakan segera Penghantaran cepat,_
Xtry lagi minum,_
"good nice , puas hati sory gmbr xdk kaitan good nice , puas hati sory gmbr xdk kaitan",_
Items recieved in good hand,_
rm35 mane nk dpt mcm nie,_
first time beli jenis bentuk macam ini,_
Material:getah la takkan kertas pulak,_
Best pakai baju ni lain kali boleh repeat order lagii 🤗🤗,_
"Officially launching on Oct 15, this food hall is located on the fourth floor at the main wing of Gurney Plaza and is arguably the largest upscale food court on Penang Island",_
items nicely wrapped with bubble wrap,_
"Barang dalam keadaan baik, penghantaran agak cepat dan secara keseluruhan sangat berpuas hati",_
Seller ni antara yg paling murah dgn cotton shawl lain,_
Hahahahahahahhahahahahahahah,_
dapat cadar and satu sarung bantal,_
buku takde yang terkemek atau terlipat,_
barang dlm keadaan yg baik,_
"36g of etizolam tablets, 0",_
Maniiiissss,_
Kurang 2 biji lg,_
Hadoii kene kencing laa,_
"the other item come together with shoe, so no take picture and video separately, thank you",_
Robot lah agak nya,_
Anak amat sukakannya,_
can't wait to use it!,_
nice gila!getah kat perut strechable tp utk mom yg perut besar ada rasa ketat skit,_
Beli untuk goodie bag majlis farewell anak,_
Belt ni lawa sgt and sy dpt free je time sale tq so much seller,_
"Delivery pntas,",_
"Order tahun lepas (2021) , tapi tahun ni (2022) baru dapat",_
Nanti boleh repeat size besar lagi,_
Took 3 days to arrive 🥰 Good suction too!,_
rasanya sbb anak laki sy ni tinggi jugak la,_
Brg bagus ok ok ok balut mmg ok,_
"Nice, dulu guna kertas dengan selotep je, now senang jeeeee",_
"The quality of the clothes is good, the color is very good-looking, I like it very much, this color is really good-looking!",_
Me encantan tus recetas,_
Selesa terukkk,_
Thank you seller ‍‍‍ fast delivery,_
"Repurchased order again with this Seller,",_
Ahhaahhahahahaahahahhaha,_
"mula mula beli amik saiz s sbb kalau tshirt sllu paki s , tapi smpi mcm kecik sikit so this is sec time repeat for m size and size m fit me well , loose and muat dia cantik cantik je",_
Boleh je lah nak makan tu,_
THANK YOUU SELLER GOOD PACKAGIN,_
mudah buang,_
hopefully berfungsi dengan elok laa,_
Tak murah tak mahal tak rugi,_
Dragon blood oilment is like a,_
Terbaik seller n j&t buat kerja,_
Super satisfied sebab laju gils,_
pengemudi nya jujuuuur,_
ko rase?,_
cm tgk luaran shj,_
Con/s : Seller lambat ship out barang tp it's okay for me,_
"Netflix co-Founder Reed Hastings told investors there's ample room for growth, as streaming gradually replaces traditional television over the next decade or two",_
Order dated - 30hb,_
nicenicenicevery faster delivernice qualitynice packing,_
"At least three militants, including two 'high value targets' were killed in a clearance operation conducted in Kech district to flush out militants from hideouts linked to Wednesday's attacks on military bases in Balochitan province, Pakistan's military media wing said on Friday night",_
"Alhamdulillah barang selamat sampai pada saya ,keadaan pun ok dapat free lg 1 biji",_
"Well packaging, new stock, good delivery but without KKM approval",_
"Seller shipped out parcel quite fast, quality looks not bad",_
Lampu dah smpai dengan baik,_
So far baju ok jaa kena dengan harga,_
Colour of the product receive exactly as shown in the picture,_
bekas vincci tu di buat market,_
Box mcm nak tekopak kau tapi tkpelah wrapped tebal,_
"In keeping with restrictions on public gatherings, police limited the number of people allowed into Tel Aviv's Rabin square for the rally as nearby streets filled with demonstrators wearing face masks",_
Everything's here!,_
sesuai🥰nnti boleh repeat lagi,_
"Tak lag, dah kali kedua repeat",_
will shopping again with wish2u,_
kasih terima kasih terima kasih,_
"Barang terima dalam keadaan baik, size agak Kecil bandingkan dengan standard size, Dan kain nipis",_
Penghantaran cepat jgk dari seller,_
Quality:oklah,_
this is worth buying 🤍 gonna repeat it soon,_
Glad that parcel arrived well,_
Helen Lee,_
Malas nak buka sebab saya beli untuk abg saya nanti masa kenduri kawen saya,_
I wish i had one,_
Penghantaran agak slow oleh shopee tapi seller laju,_
Tapi clour maron tu kain benang tercarit sikit apa pun puas hati dengan pembelian dari kedai aimarra,_
harap2 muatlq,_
"Should have translation for menus built in, as is difficult for a non-local to understand",_
3 layer no need filter,_
beli 4barang tpi smpai 3 barang,_
kabel type c overall sgt ok for Android je ada masalah,_
Maybe sbb warna tu kut,_
Services 100 Terbaikkkkk Terbaikkkkk Terbaikkkkk Terbaikkkkk Terbaikkkkk Terbaikkkkk Terbaikkkkk Terbaikkkkk Terbaikkkkk Terbaikkkkk Terbaikkkkk Terbaikkkkk Terbaikkkkk Terbaikkkkk Terbaikkkkk Terbaikkkkk Terbaikkkkk Terbaikkkkk Terbaikkkkk Terbaikkkkk Terbaikkkkk Terbaikkkkk Terbaikkkkk Terbaikkkk,_
actually dah dua kali beli dgn seller ni,_
Penghantaran juga dibuat segera,_
"Fast response, fast delivery,kain tk tebal sngt tk nipis sngt,mantap",_
cp9002,_
"Look out for their promotions, worth buying",_
Mcm mana nk tgk power kt xoos g+ ni?,_
order:25/3,_
Ada jgk yg bocor,_
Feels a bit flimsy when walking but fit the price I guess,_
Arrived in less than 48 hours after ordered though there was a dent on the box but it arrived safely,_
would recommend to anyone who are still in dilemma of buying shoes from this store,_
Dah order berapa kali,_
Balai raya pun okey,_
The products are awesomeee,_
Good product quality good value for money excellent service by seller Good product quality good value for money excellent service by seller Good product quality Good product quality,_
"Tapi puas ati gais,",_
Received in good condition with a good bubble wrap packaging,_
kalau nk lagi selesa ulter kain ikut ketinggian masing2 baru rasa ngam bila pakai,_
And buble wrapping,_
"- sound from cam, not bad",_
well-packaged,_
Items recieved in a good condition the price also affordable from this shop,_
buat masa ni kite pilih passion fruit & coffee warm dulu,_
borong 10lai teruskain nipis,_
kualiti stnding hrge 🥰,_
Memang kilat lepas lap,_
Pajdb dksosj slaid kxia aku s do rod ebcl sochf kxis,_
Han Bin,_
Debretsion said he hoped the Tigrayan withdrawal would force the international community to ensure that food aid could enter Tigray,_
kalau elok kita repeat,_
Barang sampai dalam keadaan baik n fast delivery jugak tautopi cantik sngt2,_
Seller has packed it properly,_
please vaochar code,_
Tinggal nak try je belum lagi,_
"Kopi dh smpai,rasanya sdp sekali",_
dh beli 5 set soo far,_
Hope this help others,_
"Cantik,senang nak pakai mask lepas gantung jer",_
For more than an hour waiting and due to rider's availability the delivery is delayed,_
And packaging is good,_
Assalammualaikum dan selamat malam boss,_
Not good for bgmi players don&$HASHTAG$,_
Dan kereta ni pun sangat laju,_
i open youtube so my problem was resolved,_
Penghantaran yanh sangat cepat,_
semoga dpt bantu mengenyangkan perut yg asyik lapar ni,_
But the face of bear bear some look nice and some are not nice,_
"Bungkusan diterima dalam keadaan baik sekali, saller balut semua barang dengan kemas tiada kerosakan pada barang, puas hati beli dekat sini dapat harga murah brbnding beli dekat kedai",_
packaging secure,_
Jam dh terima dlm keaadaan baik,_
cuma kki tk ckup labuh,_
Already used it before and I know it smells great even without softener,_
Pusing p pusing Mai kenaaa,_
Perintah berkurung akibat pencemaran tidak pernah berlaku sebelum ini,_
Tq tq tq saya beli ya,_
Sonok shoping semua cantik,_
Baju ni cutting lelaki,_
Can hold ipad also,_
amik saiz yg biasa pakai je,_
total tinggal rm4,_
Super fast delivery by this seller and good packaging,_
best ever and cheaperrr,_
Texture:all is good,_
Paan nnti unboxing realme gt,_
this is soooo cute for 2xl can fit me 171cm 82kg,_
Tq seller fast delivery and good packing,_
Functionality:pyjamas,_
Pembungkusan kemas Dan baik memuaskan terima kasih gambar xde kaitan,_
"Taste:rasa konfem kaww,buat layan nescafe tarik",_
cantik color Tali ni,_
Kualiti kain bag okay berbaloi dgn harga nampak mahal tapi tali bag terlalu nipis dan ringan bila pakai asyik jatuh jee tak terletak diam kat bahu,_
Stand ni boleh guna jgk utk ipad,_
craving lama dah tapi baru nak order sebab baru je habis semester 6,_
"Brg smpai lma dh bru nk review , sllu repeat breastpad kt momo",_
Beli 2 pek dapat 20 peket kecil,_
"Fast shipping, good product, original item",_
e e e r r r r r,_
Pasti sy repeat order lg lpsni,_
Terima kasih saler pantas sampainye,_
Beg pun okay zip semua okay,_
"Waterproof, material excellent,",_
"Bungkusan siap Bubble wrap, nice Mydin",_
Barang diterima dalam keadaan yang baik Dan elok,_
"barang dah sampai, cukup semua",_
hrp seller lebih berhati2 lps ni,_
Penghantaran laju beli online lagi murah dari beli kedai kat luar tq seller,_
but overall kelabuhan tu puas hati,_
", nice beg",_
Terang siak mentol ny,_
"Delivery very fast, price is very cheap for this quality, very clean and white",_
"The purpose of the conversation is to continue discussion of all questions that were on the agenda of the fairly recent video call talks, Kremlin spokesperson Dmitry Peskov told reporters",_
"item selamat mendarat , thank bos , bole repeat order lagi , semua mantap",_
dah abes stock,_
nice color and the size suits me,_
tapi klo fon jenis besar,_
Comfortability:sedap pkai,_
tp worth it la,_
Comel mcm lolipop,_
Tq saller & j&t,_
kualiti kain sepadan sama harga,_
cntik teruk la,_
"Barang ngam dengan kereta, chevrolet aveo kat kedai susah nak dapat",_
Effectiveness:I think,_
Thanm u thank u thank u thank u thank u thank u thank u thank u thank u,_
"Harga memang murah,tapi packing kurang elok,1 botol pecah tq seller dah pulangkan wang dalam shoppe pay",_
maaf lmbat rate sbb da kt kampung masa brg sampai,_
terima kasihh yee,_
Sorry irrelevant pics and videos but fast delivery,_
Satisfied with it & will definitely going to buy again,_
"51 mata kepada 12,276",_
penghantaran pantas oo,_
bepergian,_
Pembungkusan jugak baik,_
China Mal No Like,_
Baju sgt berkualiti tapiiii harga sgt murah,_
"USTI NAD LABEM, Czech Republic (Reuters) - Hungarian Prime Minister Viktor Orban backed his Czech counterpart Andrej Babis' re-election bid on Wednesday, making a display of the close ties between the two central European leaders who have supported each other in disputes with the EU",_
service customer cun & sgt helpfull ya,_
tak rasa pahit,_
Good products quality products fast delivery excellent service by seller good products quality,_
penat dah ni,_
Pastu dpt lg 1 free lock mse Live seplastik singlet ada 8 sehelai dlm tu,_
"H : 154cm & W : 65kg ok size M,kalau nak pilih size S pun boleh sebab baju ni cutting besar",_
"It's a soft case, full cover on the camera lens",_
packaging pun tiptop sgt xad leaking langsung,_
Wow~my flavour and also thanks for the well packing for shipping will buy again!,_
"I'm very satisfied,thank you, will repeat again because cheap and very quality",_
dh kali ke 2 belii,_
Cumaaa seller sumbat je dalam kotak,_
Gambar xdew kene mengena,_
pkp lagii,_
harga pon murah berbanding beli dekat luar,_
Tidak expect barang cepat betul smpai,_
"Rasulullah SAW bersabda: Barangsiapa berselawat kepadaku satu kali, maka Allah akan mengucapkan selawat kepadanya sepuluh kali, dihapuskan darinya sepuluh kesalahan, dan ia diangkat sepuluh darjat untuknya",_
"yeahh dah sampai patutnya lagi awal tapi jnt klang pehal tah peram barang 3 hari , yang pasti berbaloi beli time shocking sale beli 3 lagi satu beli asing white sebab masatu dah habis ttbe dia buat lagi sale so grab la lagi hehe memang cantik ada masa repeat lagi🥰🥰",_
Sampai tamat tempo belum sampai juga,_
Dh lah,_
X tau hasilnye mcne,_
Oldtown coffee is the besttt,_
Basketball received in good condition and no damage,_
Murahh gilaa Thankyouuu,_
"Order2 cukup, gambar dan video tiada kaitan, Order2 cukup, gambar dan video tiada kaitan",_
Sepatutnya 14,_
n joint lagi nanti tq bey lanja jacket lotto,_
Harga dan kualiti berpatutan dengan item,_
Walaupun anti sweat tapi tidak ye,_
Never can get a new release shoe,_
teruknya perangai,_
"If my job is to hit the stumps, then that's what I'm going to try and do, he said",_
A bit late on the delivery otherwise it is okay,_
package received in good condition and the delivery is okay,_
barang telah saya terima dan penghantaran yg cepat sgt,_
"warna sangat sesuai dengan kasut,selamat x salah beli",_
paling best fast deli 🥰🥰🥰,_
"Very good packaging, value for money, thanks seller, keep up the good job!",_
"All the goods are packed well in box & delivered in good condition, thank you seller for the products",_
Thank you bossku!,_
"Fast delivery, received super fast, good product",_
"Received in good condition, thank you seller for the seaweed as free gift as well^^",_
Barang cantik cuma tak pasang lagi tq,_
"Penghantaran cepat, buku dalam keadaan tip top & dibalut dengan bubble wrap",_
anaknya&quot,_
"Vacuum cleaners work because of Bernoulli's Principle, which states that as the speed of air increases, the pressure decreases",_
"i ordered on 14/10 morning, received the next day the quality is so good for such a cheap price!",_
