Sentence,Tagged_Sentence
drop to 4 star coz a bit late on the delivery,_
not sure functioning or not,_
Dah 2 kali repait,_
"The product is good as the photo, thank you very much, very much, very satisfied with the seller",_
tidak menyokong keperluan makanan tambahan itu,_
good product quality good value for money 🤑🤑🤑🤑🤑 excellent service by seller Nnt Sy beli lagi,_
Will repeat again next,_
I bought this for birthday party goodiebag,_
So easy to use from your phone,_
Thanks seller dan Sis J&T,_
*HARGA GRAB*,_
Sorry gambar dengan video tkde kaitan,_
BIGHIT PLEASE JUST CLOSE THE DAMN GYM WE CANT TAKE THIS ANYMOREEEEEE NAMJOONAAAHHHH,_
Someone form a company to compete with them please this may remind them,_
Tak sampai sehari dah dapat dah email,_
Repeat yang kali keberape puluh dah,_
klu dewasa elok beli yg jenis besar lagi,_
Jakgi nak order lg satu,_
Fast shipping even from china,_
nice gak ah product dia cuma aku order time banjir seminggu lebih baru sampai ngen tpi overall recommend ah eh,_
"I put 5 of my book and try it, the durability are good,",_
PENGHATARAN CEPAT,_
"The high waist area is not TOO tight, but it still helps to keep the tummy in",_
Bungkusan kemas dan selamat diterima,_
menipu ney saller indonesia,_
Baikkkkkkkkkkkkkkkkkkkkkkkkkkkkkkkkkk dan mantapppppppppopp,_
its so cute n nice,_
Like the semi transparent black color,_
This is my second purchase with this shop!,_
Pembungkusan pun ok tiada masalah,_
Missing suga unboxing every their new album,_
Ni paling pelik yg penah aku beli,_
Aroma:the aroma is superb as if coming from fresh coffee beans,_
This seller is more cheaper price with free shipping,_
"Thought you'd never leave me,",_
Dah cuba guna kasut sy jadi bersih,_
Tq2x bleh pakai buat tido musim panas ni,_
"order 4/10 sampai 6/10 ke jb 🤩 serious fast delivery, and also saya order syringe 3 dapat free lagi satu apapun THANKYOU SELLER",_
Hahhahahhahahha,_
"good product quality, good value for money, thank you seller, p/s: video",_
Tq seller memg terbaik,_
Cepat smpai good,_
Barang dah sampai kena ambil sendiri di pejabat pos mini tapu dekat saja l minit tak sampai dengan tempat di tuju,_
Brg dalam keadan yg elok,_
better beli black kot,_
"once again, tqsm",_
scale berisiko tuk rosak,_
patut amik saiz lg besar,_
"Mahadir Amboala, 35, berkata idea mewujudkan pusat khas itu timbul selepas dia menyedari ramai pelajarnya ketika itu tidak bersolat kerana tidak tahu membaca ayat suci al-Quran",_
"Ordered on 6/10 evening, received 8/10",_
The spinner function well,_
bgkusan kemas dgn buble wrap,_
Damn this look so sleek,_
"Harga murah Size L tapi kecik, better beli size besar dari biasa",_
baju seluar besar bole pakai smpi 2025,_
saje beli banyak,_
cepat jak pghntran,_
"sangat² recommended ,",_
Alhamdulillah Brg sampai Selamat & cukup,_
"Servis baik, packaging baik, barang baik, posmen baik, awak baik ke tu?",_
An amazing masterpiece $MENTION$,_
Barang dah sampailawa sngttq seller smua oktnggi 156 berat 49 ok sngt saiz m,_
beli untuk mak kat kg,_
belum Cuba lagi harap boleh bfungsi dgn baik,_
Thank you for the fast delivery it's really comfortable,_
It is big actually and nice size for my baby to roll over,_
brg cantik xde cacat,_
Past efforts from Chinese authorities to crack down on certain types of information have backfired,_
"Taste:sedapp ,",_
"Anyway, sangat berpuas hati dengan kualiti barang",_
Packing is safe,_
nanti beli lain patern lain ckt,_
takda alasan beli awal takkalut la beli awal sebab suka makan sejuk2 la apa laa,_
"Agenda memperkasa pembangunan mampan di Asia Tenggara menuntut ahli akademik menyumbang bagi pembangunan sumber manusia, iaitu generasi muda memiliki semangat kerjasama serumpun",_
"87kg di sebuah rumah di kawasan Sungai Lokan, Sungai Dua, Butterworth dekat Pulau Pinang lebih kurang 12",_
The item is pretty good with that price and the courier is also friendly,_
"If you don't mind it should be fine, it's just a larger button that clicks",_
"tunggu 2, 3 jam confirm status dah update to receive",_
The quality also nice too,_
The good has been delivered safely,_
Volleyball was exciting,_
"Ok nice ,",_
Hbs nnti repeat lg,_
thank you seller saya suka jenis earphone ni tahan lama dibanding yg lain,_
sellee paling bermalsah ‼,_
"sorry gambar takda kena mengena , but service tiptop , memang laju n mantob",_
baby baru 1thn4bln,_
I didn't cut it,_
Macam mna harga mcm tu kualiti,_
sesuai untk baby bawah 2tahun yang tak lasak,_
"Tiap kali lock, mesti rasa x sabar tggu parcel drpd Imaan",_
"fast delivery, all packing well & have free gift aslo",_
"Nasib diselamatkan dgn material getah,jd takdelah bila jln tu kaki asik terkeluar",_
"Well, i can't say i had a good experience with you guys, 3 times i orderd with you, 3 times i had bad luck",_
hope can last for years,_
"puting susu dah sampai,sangat sesuai untuk botol anak",_
"It all comes down to who performs better over 180 minutes, added Gallifuoco",_
Fast response fr seller,_
Love only,_
Tq again and happy shopping!,_
"Hmm Bunga white tu saya order 7pcs, tapi dapat 6, nak buat kan Bunga tangan untuk kawan kahwin, dah tak sempat dah , nampak rongak kat situ sbb Bunga tak cukup 🤦‍",_
Beli untuk anak n cucu2,_
After scan 4th cafe unable to scan 5th cup,_
Shoot out from philippines while we are experiencing a typhoon,_
Thank you seller will buy again in the future,_
Tapi memang sangat berkesan menutup uban,_
"Sekarang dah ok beli huggies, sbb dia dah ade tape nak bungkus balik",_
mudah jugak sebab pakai magnet je,_
"Seluar je labuh sikit tapi xpe, janji kain best, warna lawa thanks seller",_
"Tq saler, barang sdh sampai",_
Ingat aku petik duit dari pokok ke?,_
"size okay, kain sedap, recommend, tinggi 176+ berat 62kg size M ok",_
The Packaging Was Good But It Can Be Better,_
"Length as purchased, fast delivery",_
Thanks seller and courier penghantaran,_
"jadi aku mau grabfood, ada opsi tunai ovo link aja sama kartu kredit/debit, semua nya pembayaran ditolak, jadi aku mau bayar pake apa?",_
Semalam beli dapat harini,_
Will make your legs looks nice and slim,_
Cuma leher je kdg besar sgt,_
kain licin so bila pakai dia akm flowwy gitchuwww all good,_
Will repeat again as usual,_
Yeayyyyyyyyyyy,_
"I think in the end people will sit together, and go back to the constitutional declaration, and see how they can adjust it",_
Dapat battery skali,_
212 sexy man 1,_
baby 2 Bulan lebih berat 5,_
Really love the material of the tudung,_
Penghantaran untuk seller keluar ambik masa sedikit tapi semua smpai elok,_
00 using voucher,_
00 cutting dia besar jgk kalau pakai size 38 patut ambik size 38,_
Barang selamat mendarat di bumi kenyalang terima kasih barang selamat mendarat barang ok manntap,_
"Sehubungan itu, penulis mencadangkan penubuhan Majlis Banjir Negara (MBN) yang akan menjadi penyelaras induk bagi menghadapi bencana banjir berlaku setiap tahun negara ini",_
"Parcel dah sampai, tq seller 🥰 kualiti elok, terbaikk",_
This device must give a amazing performance,_
Cleaning Effect:sabun safi selamat sampai dengan selamatnya tq seller penghantaran sangat pantas tq seller,_
"Alhamdulilillah, brg slmt smpi dgn baik",_
Baru tergerak hati nk join live sbb nk cari tudung utk event,_
GoodgoodgoodgoodgoodgoodgoodGoodgoodgoodgoodgoodgoodgoodGoodgoodgoodgoodgoodgoodgoodGoodgoodgoodgoodgoodgoodgoodGoodgoodgoodgoodgoodgoodgoodGoodgoodgoodgoodgoodgoodgoodGoodgoodgoodgoodgoodgoodgoodGoodgoodgoodgoodgoodgoodgoodGoodgoodgoodgoodgoodgoodgood,_
Material is good quality just like an expensive mouse,_
barga biasa je,_
Better beli L kot,_
Have purchased so many items from this seller,_
"Received item in good condition, expiry date March 2023, 2 in 1, non sweet, like the taste",_
"Penghantaran laju , harga berbaloi , dan cantik sangat puas hati",_
Item sempurna,_
This is my Second Purchase from HSK Mall,_
Penstock 1: OFF,_
"Kain selesa, ringan dan xpanas",_
this is my 2 nd time buying frm here cuz the seller is very helpful n always so fast in Seattle cus problem n fast sending yr item out,_
Best boleh repeat order lagi nanti semuanya puas hati seller best yes,_
"brg smpai dngn baik , nnt nak try kalau okee sya repeat lagi hihi",_
Indin price kya hai,_
panjang giler nak kne tambah lubang lain,_
MMG berkualiti ikut harga nya,_
Barang okkkkkkkkkkkkkkkkkkkkkkkkkkkkkkkkkkterbaikkkkkkkkkkkkk,_
Yes betambah jugak 2cm,_
so far mmg berbaloi dan murah,_
mcd xda burger ada pizza saja,_
Semakin teruk line digi ni buat main pubg ping naik terus,_
sngt2 berpuas,_
"warghhhhhh,",_
semoga brg baik2 sj,_
Functionality:mudah dipasang & kukuh untuk melindungi bayi dr jatuh,_
Oh the delivery super fast and srsly trusted seller!,_
Saller didn't wrap it at all,_
beli untuk adik sedara,_
ketiga,_
a normal,_
168128,_
"Penyokong Parti Nasionalis Bangladesh (BNP) menuntut kerajaan membenarkan pemimpin mereka, yang juga bekas Perdana Menteri Bangladesh, Khaleda Zia, mendapatkan rawatan perubatan di luar negara",_
Taste:delicious choc nutty bar,_
"No Matter How Hard things get, Only Use your strength to protect",_
Nasal aspirator murahh,_
"Tiada koyak, harga sesuai dgn harga",_
"Good quality product, reasonable price for this quality",_
"VERYYYY SATISFIED 🥰🥰🥰🥰 Dah la murah , cantik pulak tu takyah beli mahal²",_
baru ada masa nak review,_
"Order sabtu, isnin dah sampai",_
Ni kain dy sedap best berbaloi ng hrga,_
Tade dah habuk tertinggal lagi,_
"Barang diterima dengan baik, pihak kurier pun amat bertanggung jawab",_
Among all youtubers I think that you&$HASHTAG$,_
quality ok and cheap,_
tq ninjavan brg smp depan rumah,_
"Delivery in good condition , first time try avocado multigrain",_
"Fast response, clear instruction, easy to deal",_
Jahitan kemas baju sedap dan tak panas dipakai,_
ta sabar nK mkn,_
Amatlah baik untuk menjaga bentuk kasut untuk sentiasa dalam keadaan yang baik,_
Mantap terbaik faster,_
Item received in good condition and works,_
Roslan Abdullah Geisha Pasha MOntelo Geisha Muhamad Ibrahim,_
Alhamdulillah sesuai dgn dorg,_
next time still repeat this seller,_
Hm will repeat soon,_
Kualiti kain dan jahitan setanding la dengan harga,_
Skin Suitability:melekit,_
"A Joe Biden victory along with Democrats winning control of both houses of Congress is likely to spark substantial fiscal stimulus, benefiting Asian stocks by reviving the U",_
Terima kasih abg penghantaran,_
Beautiful leggings for my little daughter,_
Parcel delivered quite long as its stuck few days in Shah Alam,_
"It's not bad, the price is very high, you can buy it if you like wearing armor",_
Items boleh digunakan dengan baik,_
"Eventhough late, its OK",_
Come back and shop woth this seller,_
"terima kasih boss barang sudah smpai , faster terima kasih sangat sangat bosss nanti repeat oder lagi ya boss terbaik boss tq tq tq very very muchh ‍‍‍",_
Editing by Tony Munroe),_
*Gambar dan video takde kena mengena dgn produk,_
Barang sampai pun okey,_
Good value product and the price is cheap,_
Function helokkkss,_
Nyaman dan ramah,_
Saiz kalau 41 lg selesa kot,_
"There's elastic band behind, so if you have a bit more weight on your backside, it's not gonna look flattering",_
Recommended to buy here guys,_
Janji saiz baju ngam dengan badan,_
i felt happy my wife love it,_
tp xthu nk pasang tali beg merah tu,_
"Meanwhile, Datuk Seri Richard Riot anak Jaem (GPS-Serian) and Datuk Mohd Salim Sharif (BN-Jempol) are expected to bring up issues related to Internet coverage and reception in rural and remote areas",_
Just in time for my coffee refill,_
Primer comentario en español creo,_
1 peratus tahun ke tahun setakat September 2021,_
Warna pun okay je makin pekat bila dah kering,_
I bought 8pcs and seller give 3 variation,_
"Order 23hb pos 28hb, itu pon selepas chat baru nak post",_
aww suka sgt tq seller fast shipping jgk la tq tq tq dh byk kali beli sini recommended hrga pn murah u olss kena beli ok br lah nmpak cantik gtu haaaaaaaaaaaaaaaaaaaaaaa,_
Teh tidak pahit,_
walaupun tulis jenama ada calar sikit,_
cntik gilaa suka sgtt mmg nice dlm duniaaa fast delivery murahhhh plak tui nice,_
klu selesa sy repet lg,_
i really need one,_
Beli banyak2 ada 38 item semua nya tapi xde free gift,_
Excellent Fast Delivery Good Quality of Products cantik setanding dengan harga sangat berbaloi,_
tapi utk kali ini saya tidak puas hati dari segi packing seperti yg lepas,_
All herbs are fresh,_
Barang dah sampai and so far okay takde rosak pape sbb packaging dia tersangat la secure ye,_
barang pon x de rosak atau bocor,_
Saya suka sangat coffee espresso,_
The seller is so recommended and responsible,_
"Secara umum, MPA gembira dengan keputusan ini",_
"comel sngt,",_
Dapat wane pink la pulak,_
jzfmztkdtketkstkgmxgkdtlyldtldxtlxtldtldykxykzylstkstkstlstlstkstlstl,_
barang okey xdk ap2 masalah,_
jnis cotton x stretchy,_
"Good product quality, fast delivery, good value for your money, good quality material",_
Like melonjak,_
sdp jgk bau nye,_
Very Reasonable price and yet my car shine like a star,_
"Namun, katanya, beliau percaya dunia mampu mengubah perjuangan dengan merujuk kepada 'daya tahan luar biasa' ditunjukkan komuniti, curahan tenaga sedaya upaya oleh petugas kesihatan dan kerjasama saintifik yang tidak pernah berlaku sebelum ini, sejak pandemik itu tercetus",_
Cantik je warna pink,_
A beveled edge on the strip would have been better,_
pasar sotong Sotong Ngabang Sotong katak Sotong Kurita Sotong Torak Sotong Ketupat Sotong Jarum Sotong Cumit,_
Towel nipis sesuai bawak pegi travel cepat kering best terbaikk penghantaran pantas,_
"anyway i really loveeee the lip tint omg,",_
Ps:Bukan untuk coin semata,_
Courier service is ninja van,_
Mula2 ragu2 pinggang kain tkut xlpas msuk punggung tp alhamdulillah,_
Barang keperluan bagi masa pendemik ni,_
First time buying make up items,_
abe makin rancak berdosq,_
Menang tahn,_
I got the red ones the day they released,_
Penghantran pn laju sgt,_
But the design of the black shirt is different and quite thin from the other shirts,_
the size just nice,_
Sesuai utk letak barang2 kecil,_
Ovos escalfados devem ficar com a gema líquida: deita-se,_
"Great packaging, items are intact",_
Klau ikutkan mmg nak beli byk2 smpai 50 keatas tp kita ni just niaga sikit2 je takpela ada rezeki boleh upgrade lagi tqsm arezprint,_
penghantaran pantas memuaskan,_
"Tq seller, barang dha terima dlm keadaan baik",_
delivery like xpected,_
Saya ingt green light mcm dia tunjuk dalam iklan rupanya dpt green grey gitu,_
- canva can be use really well,_
luggage dia betul2 cantik,_
overa ok,_
Tolong tempah untuk paksaudaraaaa,_
Beli buat alamt kt kg pnya pasal,_
Tq aina jual kaftan sedappp,_
Harga pun cukup murah & tetap berkualiti tinggi ok,_
Pantas dan tepat semuanye,_
I love the colors $MENTION$,_
Gmbr x da kena mgena,_
"Really good with this product, will buy it next time",_
tinggi 164 amik 4xl senteng sikit je,_
"Some things you can take into consideration during this assessment include how much income loss or pay cut you've experienced, are you still unemployed due to Covid-19, what level is your business operating at versus pre-movement control order, and the number and type of loan commitments you have",_
and services from seller,_
$MENTION$ Chao,_
penghantaran mengambil masa selama lima hari sahaja,_
"Thankkk youuu sellerrrr,",_
Gambar takde kene mengena ye,_
hopefully benih berkualiti,_
Beli time sale rm3,_
and kalau org plus size mcm saya dia singkat sikit,_
Belum try lagi hope berkesan la,_
Everything is good video xda kna mngena dgn yg hidup atau yg mati 🤭,_
mgkin stiker nie dah trlalu lama sbb tulah gam pom dah xkuat,_
the ginger tea pack are suitable small cup,_
Lama jugaa,_
SANGAT BERBALOI DAN TIDAK PERLU KE KEDAI,_
"11 pagi, petang tu seller terus post",_
17 nov dpt barang,_
cantik sngt penghabtaran pom laju,_
TV smpi dgn selamat,_
Fast delivery during MCO where I received my parcel in 14 days after seller ship out,_
hmwatchmanager&via=ANDROIDWXZ,_
Next time kite repeat order,_
Didn't the restaurant give allocated time to prepare the meal,_
The quality of the trenchcoat is superb,_
harap ber puas hati dgan order and lhamdulillah,_
Sekrang grab susah ya dapatkan point,_
pasti order lagiiii,_
Sapa dah eh,_
Always slipped towards the front heel on every step I walked,_
fast deliveryyyy and items arrived safelyyy,_
I will delete my account,_
Kualiti mmg superbbb,_
fast delivery than what I expect,_
Ugghh annoying,_
Mak xdpt bli L SBB singkat,_
Lihat kepada jenis kasut,_
Received accurate product,_
Anak umur 8 bulan dah boleh makan nak bagi try makan mee organik ni,_
all the good safe and nice,_
Tak basah & tak rosak,_
"thank you dah dapat,belom cuba",_
harap2 xjatuh la,_
All items in correct quantity and working order,_
Thoroughly useless to me as a shopping app and means I no longer shop with H&M as I used to do loads on my phone,_
"Okay, the item is cool, the material is good, i'm satisfied",_
Gambar takde kaitan yaa,_
"tapi seller bagi 1 jur hmm tapi overall semua cantek, agak agak kalau hilang lagi, saya roger seller ye",_
Baraang dah selamat sampai,_
Sesuai dijadikan gift utk customer jgk,_
pengantaran yg cepat jga,_
Barang ni comel jaaa,_
this is my 1st time buying a shoes from XES shopee,_
Item working nicely no problem,_
mantul mantul mantul mantul mantul mantul mantul mantul,_
"His other corporate sector experiences include positions as group chief strategy officer at , CEO of TM Ventures and CFO at , where he led the listing of the company on its own exchange in 2005",_
Dhiah Najwa,_
Alhamdulillah dah selamat sampai harap berkesan terima kasih terima kasih terima kasih terima kasih terima kasih terima kasih terima kasih seller,_
Kualiti dan rasa sentiasa sama,_
stok makanan kat kolej,_
"Goodpackaging fast delivery, good packaging, good quality",_
Ehh pastu kita pun join lock,_
Plastik luar x koyak,_
kondisi barang just OK,_
dengan reben ini ia membantu,_
Terima kasih untuk seller yang baik hati,_
A spokesperson for Canada's Global Affairs department said Canadians should email them,_
Wanted to find a nice shoe with affordable price?,_
thank you very much seller and jnt express,_
Recommended to buy and can with any kind of condition such as sport and recreation,_
Ini pon saya suka,_
HAHAHHAAHHAHA,_
Klik di sini untuk menyertai!,_
tq jnt laju bt keje,_
Super cute colour!,_
"brand ni, kualiti pun ok",_
Barang tak sama langsung dengan gambar,_
"Pen function dengan elok tapi pen takleh tulis kalau letak tangan dekat atas ipad, so bila tulis lama dia akan jadi lenguh but its okay as long dia boleh function takde delay and smooth",_
"'It is my hope that the establishment of the YKSKM will truly help ease students' burden, especially those who are less privileged",_
"Suka sangat baju ni, rasanya dah ada hampir semua warna",_
Selesa sngat sngat,_
Berbaloi beli Masuk dalam peti pun still sedap hee thanks,_
Thank you seller everything came in good condition !,_
Barang tu ok cepat sampai,_
Contact: 012-316-4375,_
Courier abang very nice still remind me to state clear and send me pic when the parcel reached,_
looks super fresh!,_
Packging tiptop,_
memang the best lah,_
Sedang-sedang saiznya,_
overall satisfied bcs beli utk student yg need laptop asap,_
Love this book,_
Lepas basuh jadi lg panjang,_
Product all functions,_
nak pakai gi picnic yeyy,_
tq seller tq dhl fast shipping fast delivery,_
"alhamdulillah walaupun kain dia kasar, tapi dh basuh lembut",_
terima seperti yang di orderbag cantik,_
corak pon cntek,_
Cuma selipar hitam saiz 42/43 dan 44/45 sama besar,_
Rugi jer voucher free shipping,_
"Fast delivery, great service by seller regarding postage",_
So niceee,_
Lol maybe by paid YouTubers comments like that makes me turn off right away,_
Everything tested all ok good function,_
nmpk mhl tp murah jh,_
i actually thought the 6 pro on the front was a samsung galaxy note phone lmao,_
ada satu bubble wrap,_
Packaging okey siap dpt tq card yg comel lg,_
Delivery time- Fast,_
dpt free baucer KFC lg tq,_
"Penghantaran cepat, barang semua nya okay hehehe",_
puas hati Used rice cooker je put all together,_
blm try jahit lg,_
Ringan giler,_
amount cukup,_
t show DC much love,_
Kain best jenis jersey yg tak tebal & tak terlalu nipis,_
Nahito a phone hi Bangladesh ma aye ga to 20k,_
belikn utk mak dan adk,_
Casing screen protector pun boek gila,_
nak kena beli buah dulu,_
Working fine la,_
s make our Minstradamus&$HASHTAG$,_
Kain Yang sangat berkualiti,_
"I'm not sure I would send that tweet again, said Colombo, who began programming when he was 10",_
Budak² pun seronok main,_
Kualiti jam okay lampu nyala nak set kan masa pun senang je jam pun made in china kena dengan harga yg murah harap dapat tahan lama beli pun untuk anak,_
Aroma:hopefully the best,_
"Besar bruhh JAAHA beli wktu sale so xkesah sangat, shipping lambat sikit sbb dri Vietnam",_
Ji Yeng,_
Kualiti pun ok cuma tak guna lagi fungsi bluetooth tu,_
Good condition and very quality,_
Seller post sangat2 cepat,_
Some charges are not displayed correctly,_
Terimakasih seller barang sudah sampai,_
Siip dah pokoknya top markotop,_
thanks sgt inshaallah ade rezki sy repeat lg,_
"Next2 order mmg takkan cari seller lain dah,",_
Sehari dr tarikh seller post barang dah sampai,_
"Thank you, received in good Condition, good wrapping fast delivery",_
Naise untuk pondan mcm saya,_
"Received in Good Condition , price is reasonable , worth to buy again",_
"Barang sampai dalam keadaan baik, memuaskan dan berfungsi dengan elok",_
Omg tooo early armyssss -from fangirl,_
Ok good good good good good good nice nice nice nice nice nice nice nice🤎🤎🤎🤎🤎🧡🧡🤎🤎🤎🤎🤎🤎‍‍‍‍‍‍‍🩹‍🩹,_
je,_
Aduhhhhh tak muat,_
"Parcel received in good condition, product quality and pricing are reasonable",_
Siapa tgok tahun baruu arini 1,_
"saya amat menyukai produk ini ,produk ini amat bagus dan berguna",_
"Good wrapping, no leakage, received in good condition thxx",_
Haiii barang sampai dengan selamat warna casing phone sebijik dalam gambar,_
sebelom htr die update dgn kita,_
Berbaloi nak beli,_
tp material sngt elok,_
Can stick well,_
bungkusan dibalut dgn SANGAT cantik!,_
I truly like is so much,_
Order~~~~2/10 Received,_
COMELLL TAK RUGI BELI!,_
Thank you saller dan abang j&t laju buat kerja,_
"Recycle phone design, cough cough",_
Kent Yong Wai Kin,_
sapa Yang nk beli,_
", keeps us energetic and alert",_
"Apabila kami mahu menukar corak permainan kami, ia sudah terlambat",_
Seller got wrapped bubble and nice packing,_
Tu pun masih besar lagi,_
sebelum ni cepat,_
"sebaik tk hilang,",_
"Quality:Jaga makan, exercise",_
hight rekemen,_
Takdelah hitam bawah mata For beginner macam iols ni memang sesuai sangattttt,_
PETALING JAYA: Malaysia's monthly export and import unit value indices continued to record a positive growth in June 2021 at 1,_
onegovappstore,_
Serius cantik gila,_
Utk budak2 buat main,_
Barang dah sampai didepan pintu rumah dlm keadaan selamat dan baik,_
"The price of the camel is determined according to its beauty, health, and how well-known the breed is, he said",_
Items arrived in a good condition and accurately,_
Quality:thick and strong,_
Very low price and seller packed in separate packing,_
yes walaupun wrna silap its okay lagi tapi blade pun salah aduhai hahaha tapi tkpa seller pun ramah,_
"Minum sejuk2 sedap, panas2 pun mengancam",_
terus reepat order beli 40pcs,_
Goooooooooddddddd nnti boooooollleeeeeh repeattttttttttt lgiiiiiii,_
"Good and friendly seller, fast response , will purchase again",_
Teerrrbbaaaaiiiikkk,_
"45bil), is expected to report tax revenue data along with the central bank's monthly survey of economists",_
"Would you recommend it, thinking about buying one now",_
Product low kualiti,_
Effectiveness:barang berfungsi dengan penyerapan yg baik,_
"earphone mantopp,aku suggest korang untuk main pubg,boek tho geng",_
Packaging wrapped nicely,_
Consumers are very used to the digital lifestyle now due to the pandemic that has changed the entire digital landscape and behaviour,_
Cuma yang warna putih perlu pakai inner sebab jarang,_
Kemik dan remuk,_
kena follow ig dan screen shoot yg mana berkenan dan bayar dekat shopee,_
"next time bole order lg ,fast delivery jgk tq",_
Mantab servis,_
Tuala pun cantik,_
Safe and secure packaging all the way to sabah expiry date is 2024 overall very satisfy,_
kain kemas jahitan semua baik,_
Tak sesuai dgn promosi,_
harga murah untuk dibeli,_
"GOT MARKKKK,",_
Agnes Vanora Bucketlist in Oct?,_
ada disertakan sekali beg kecil,_
Trima brg dlm keadaan baik,_
kenapa atasnya terbuka,_
Value for money product and recommended for purchase,_
Baru smpai dengan selamat,_
Iklan beg forever young tp dpt forever better,_
"Its good, affordable, usefull item",_
Masalah kami hadapi untuk mendapatkan air minum dan kegunaan masak apabila tiba musim kemarau,_
Bubble wrapped at box,_
"Namun, saya kena lebih berjaga-jaga kerana masih baharu",_
It was widely reported in the media,_
belikan utk org tp kasut sedang elok,_
Terbaek dan pantas abg J&T hantar,_
11 but arrived on 8,_
Walk in pun boleh,_
Damn this looks delicious,_
Super fast delivery speed but item just put inside the parcel bag without any plastic bag,_
"Tp kalau duk dlm aircond, ok la",_
Kualiti material baik,_
2nd purchase because I love the 1st piecevery much!,_
"Barang sampai dengan selamat, sangat puas hati, nanti oder lagi",_
Niceeeeeeee murahhhhhhh and smua bagussssssssssssssssss,_
pertama kali try wipe tissue,_
packing kemas dengan bubble,_
Apoooo 🤦‍🤦‍🤦‍,_
Kereta yang tiada Bluetooth mudah untuk digunakan,_
Size fitting too,_
Dah try yg peanut,_
Suka sangat jeans from this seller,_
saya beli stokin ni utk berpantang hihihi,_
Coverage:Belum try lagi,_
- Material kain ok,_
baju pun brrkualiti wlpun item bundle,_
kain sejuk & sooo suit to asian cutting,_
"warna dia cantik sgt penghantaran pun cepat, harga murahh so berbaloi gila",_
wlaupon brg made in china tp kualiti jauhhhh lebih baik dpd beli di kedai alam nyata,_
Shipped out 29/11,_
Satisfying pre order,_
