Sentence,Tagged_Sentence
Bau wangi n best,_
"5 , fast delivery good thickness good value for money recommended",_
"Abang Johari berkata, manifesto berkenaan akan memperjuangkan hak Sarawak, menjamin hak rakyat, menjaga kebajikan rakyat dan membangunkan masa depan Sarawak",_
In sha Allah nnt beli lg d kedai ni,_
"kain cantik elok, harap nnt bby pun selesa",_
"Jimat minyak, jimat tenaga, jimat nak angkat barang",_
"Ohh yesssss,",_
took long time to arrive,_
Terima kasih seller sorry gmbr tidak kene mengena dgn barang🤣 memang mantap seller,_
puah ati🥰pghntrn pn cepat,_
Enjoy the Dabao function,_
Kain nipis tp sedap n sejuk ja pakai,_
"Bagus bagus, sampai dalam keadaan baik",_
bru je tngok smua psal princemeed,_
"Western governments have lined up to warn Moscow that any movement of military forces across the Ukrainian border would draw a strong response, including stringent financial sanctions",_
the earphones arrived safely and quickly!,_
"order jumaat, isnin pos selasa sampai",_
Tq thank you,_
Di bikin emosi bngt sumpah sgitu bnyak ny promo 1 pun gx bisa di pake padahal baru bngt aktifin paket dan masa kadaluwarsa ny masih jauh 🤬,_
item reject kala nak jual jgk patut bg harga lebih murah,_
Plastik tebal ok sgt,_
Saya rekeman kat kwn2 mereka pun puas hati memang terbaik,_
"Got the hair clips TODAYYYYYYYY YAYYYYY i love itttt the designs and everything ,",_
"Aaaaa thanks seller ,",_
The package broke on the part where the blades were not protected with bubble wrap and could slide out and the sides of the blades that were exposed scratches (the black paint gone),_
sebelum beli chat dulu seller tnya Ready stok atau x,_
hrga murah & cantikkkk sgt2,_
trusted and worth it!,_
"Delivery efficiency is OK!The product quality is not bad!Generally speaking, it's OK!",_
Baju dia tutup sampai peha,_
Really Worth & Good,_
Mohon pilih unit-unit kokurikulum berikut untuk tindakan segera,_
brg spai dh,_
"Quality:Jahitan kemas , kain elok , zip pun ok",_
3 for product and 4 for seller,_
collection,_
senang btul hdup dorg,_
"Kali ini beli borong terus banyak,memang sebelum ni beli pakai sangat selesa,tidak gatal di muka time berpeluh,sangat berbaloi",_
"dua tiga hari lepas bayar , terus sampai depan pintu !",_
Packaged really well and sturdy,_
sorry gmbr tk de kaitan barang smpai dlm keadaan bauk kain best pakaging pn bgus,_
tpi srs selesa wllpon murh,_
"I usually wear size 37 for slippers/high heels, and size 38 for sneakers",_
STAY TUNE TAW,_
Good pricing during campaign sales,_
"Beliau berkata, hasil daripada mengumpul barangan terbuang juga dia dapat memberi pendidikan kepada anak-anak termasuk anak kedua, Nur Anis Zulaikha MohdAsri, 21, yang kini melanjutkan pelajaran di Universiti Malaysia Kelantan (UMK) Kampus Jeli",_
the delivery quite fast!,_
"maaf vid takdak kaitan, delivery laju dan selamat, baju cuting dia okay",_
hope to win this masterpiece $MENTION$,_
Semua sampai dalam keadaan elok tapi bau lemongrass dia menghampakan laa hmm,_
ok la barang kena dengan harga,_
"Sy dah cuba, semua ok",_
xsabar la nk rye,_
"Open and 2019 Australian Open champion now gets to test her mental strength against a revitalised Victoria Azarenka, who stunned Serena Williams in Thursday's other blockbuster semi-final",_
Will definitely come and buy lot more item here,_
NICEEEE I LOVEE ITTT BEAUTIFUL COLOUR THANKYOU SELLER WILL REPEAT AGAIN FOR TRAVEL NEXT TIME,_
Dah sampai terima kasih seller baraeg selamat sampai,_
super saving deals,_
tk pyh tnggu lma 2ari je dah slai brng!,_
Kualiti kasut pun cun macam Fazura,_
"Good product, good value, received in good condition and fast delivery",_
Beberapa pakar menyatakan kerajaan sedang mengusahakan langkah bagi meningkatkan bilangan kerabat diraja tetapi kebanyakan mereka gagal dihubungi,_
Will grap oneplus $MENTION$,_
"55kg, 146cm",_
cth 41 kene beli 42,_
Not yet to try on my jeans but yeah okay good product,_
"best, tak tebal",_
Awesome rack!,_
"Terbaik Laptop cun no problem,speaker ok dapat Leptop Jenama Lenovo sngat puas hati,sedikit tips buyer yg tenga cari scroll review if cari laptop pastikan beli ram yg tinggi utk mengelakan daripada lag lgi bagus anda google psal SSD,DDR,HDD seblum beli",_
packaging mask pun cantik,_
Size yg bethol,_
Cheaper other shop,_
"Kita juga akan melakukan pemantauan berterusan di kawasan itu supaya semua pengguna jalan raya mematuhi peraturan, katanya di sini, hari ini",_
Terbaekkkk dan puas hati,_
ngam plak tu ngn bdn,_
Opacity ddlm 80 la,_
Before this ada juga beli tp yg dulu kena bayar RM1 and packaging pon lain,_
m more of a traditional smartphone I would buy a tablet then affordable phone anytime,_
kuar daki jgklaa,_
sudah 2 kali repeat,_
"Tudung dah sampai kali kedua dah order , mula tu nak test dulu bila pakai rasa selesa sangad sangad terus repeat",_
kene matahari dia jaranglah,_
Cuma ada sikit kerosakan pada satu butang & penghantaran sangat lambat,_
Telekung rin gan Dan lembut,_
hope dlm ni ade code bole redeem,_
Alhamdulillah telekung terima dgn keadaan baik,_
9 during promotion,_
"Lim mengambil alih 60 peratus pegangan dalam SSBB pada 2018 selepas membeli kepentingan berkenaan daripada Tan Sri Ravindran Menon dan rakan niaganya, Datuk Aisamar Kadil Mydin Syed Marikiah melalui jumlah yang tidak didedahkan, dengan cadangan untuk membangunkan semula tanah di sekitar LTSAAS di Subang",_
Really next day delivery,_
"So far okay je bunyi nya, siap bagi free adapter suis tu",_
aaaaaa yassssss my baby arrived perfectly fine and in good condition !,_
Pei Pei Seow,_
sy beli neh,_
Will repeat order !,_
Bagusssseeee,_
Cantik sangat2 nampak elegant bila pakai,_
"Amazing service from the seller, thank you so much for the quick delivery and lil free gifts",_
Has been using a few brand of wet wipes but i love anakku's one the most,_
item wrapped well,_
beli ni,_
barang ok cuma takde line color merah kuning je,_
So dapat lah beli dengan harga murah hehe,_
"Material best, corak pun cantik",_
This is my second time repeat order for this item,_
in Shaa Allah nanti repeat lagi,_
setapak sambal🤦‍,_
"Satisfied with the shoes, thank you seller",_
"good condition, good value for money, great service by seller!",_
laju seller buat keje thankyou seller,_
Brg smpai utk hadiah kwan,_
seller pos pn laju,_
jam ni cute & penghantaran cepat !,_
Jam lawaaaaaa sesangattt,_
Ketebalan kolam yang tebal,_
Amanda Soo,_
"Packaging wise quite bad, box dented",_
hopefully can last long cause i love all of them,_
but the material is nice,_
sedut pun ok la kuat igtkan sbb murah slow je,_
"Coach Gregor Townsend kept faith in the team which ended this year's Six Nations with a win against France in Paris, with only prop Rory Sutherland missing through injury and replaced at loosehead by Pierre Schoeman who won his first cap last weekend",_
"And we all like your channel and your honest review, video",_
Borong 7 pack sekali,_
Help me unloading washing machine and move in my house laundry area,_
Bfre nk post cek blik brng ok ke tak,_
Trusted and fast seller,_
Cantikknyaaaaaaaaaaaaaaaaaaaaaaa,_
"The San Jose, California-based company added 9",_
tq seller nanti boleh repeat lagi love sangat🤭,_
Design:cute teddy,_
Treat your riders as ur partner and also the vendor,_
I ordered 3 Brown Sugar Soy milk and 3 Honey Melon Soy milk,_
Muat and oversized sebab saya suka baggy,_
"With more than 5,000 U",_
packing dia lain sikit biasa biru dgn pink,_
NEW YORK: Asian equities were set to follow Wall Street's late session retreat on Thursday after the Federal Reserve warned the U,_
Bestttttttttttttttttttttttttttttttttt,_
the cheapest shop i could find,_
LAYANAN SELLER PON NICE,_
nanti repeat insyaAllah 🥰🥰,_
Sedih sangat sebab saya mengidam nak makan sambal ikan bilis YK tapi tak ada rezeki,_
IM EXCITED,_
Terbaik la penghantaran pantas,_
"Berat 66kg, tinggi 174",_
i have insta $MENTION$,_
tqtqt seller,_
suka sangat dgn kualiti baju🥺,_
Will repeat order with another design,_
"Researchers shared their information in an open source format online, so that other researchers can replicate and expand on their work",_
"The trial is set to commence soon in cooperation with Padjadjaran University in Bandung, West Java, as well as the Health Ministry's research and development agency",_
-incline,_
Delivery standard laaaa sbb dr china kan so lmbt sikit,_
2g lg tu masi dkt kilang🤣,_
Ada lipas mati,_
"The chart show 112, however when measuring it is less than 112",_
"Fast delivery by seller and courier service, thanks a lot",_
but its a bit small for me,_
good product to buy and cheap,_
tp kalau dh anak dok kcau mmg jd lmbt lah pasang sorg2 ja,_
Btw penghantaran pantas dan kualiti barang baikk,_
protection okay tapi tak pakai lagi tapi so far best je pegang dia kecik comel je thankyou,_
Super fast delivery valve of money good product will buy again,_
"Trusted seller, will buy again next time!",_
xrugi lock byk,_
"By 10, it has no internet access",_
Good condition while received,_
Ada benang terkeluar aikit but ok la utk rm11 kan,_
delivery super fast take within 3days only,_
Terbaik cantik labuh selesa thank you seller,_
Good for discounts,_
"The packaging as always, VERY SECURED,",_
anything that that you to do with you guys to be a lot of them things a very,_
This wallet is so elegant n nice!,_
"and added, To be a family, a country, doesn't necessitate that we be the same or agree on everything, only that we continue to try to see the best in each other and move forward into a shared future",_
Legging paling best!,_
padan dan kena ambik saiz besaq satu kalau heels tu buleh saiz biasa kita pakai takpayah ambik saiz besaq nahhh sangat terbaik servis laju dan ssyaa sukaa kasut berkualiti dan sangat sayaa berpuas hati sangat puas hati dah bye,_
Received item in good condition quality also nice,_
Boleh laa Kalau nak buat lompat suka2,_
didn't pull my bias sunghoon anyway thank you seller i love to buy albums here hehe,_
I bought two but it come with different shape,_
Im going to give it 5star for quick delivery and the customer service is really good,_
"saya kacak ,",_
cuma yg ijau kain die cm ade lain sikit kurng lmbut dr yg lain,_
"Maaf gambr video xde kaitan, kasut ok cantik murah, berbaloi",_
"Fast delivery, order and receive item in 3days,",_
IT LOOKS LIKE EXPENSIVE PRODUCT BUT ACTUALLY AFFORDABLE WITH EXPENSIVE QUALITY,_
dibgks dgn baik,_
"The Bill, which was earlier tabled by Minister in the Prime Minister's Department Datuk Seri Wan Junaidi Tuanku Jaafar, proposed to amend Clause 2 of Article 1 of the Federal Constitution to say the states of the Federation comprises: (a) the states of Malaya namely Johor, Kedah, Kelantan, Melaka, Negeri Sembilan, Pahang, Perak, Perlis, Penang, Selangor and Terengganu",_
lawa terokkkkk,_
Por favor si pueden traducir,_
Actually bought this for my lil sister,_
baju besar seluar besar,_
Span sudah sampai tuan,_
Sampai cukup quantity,_
safety rope dye x sure pasang macam mana,_
Comfortability:Comfy af,_
Dompet agak lebar berbanding saiz biasa,_
Semoga business u maju jaya,_
Honestly not yet try sebab current sabun tak habis lagi,_
Besar2 buahnyaa,_
t=3m23s> BRUHHHHH was it really needed to rickroll us?,_
Seluar memg elok je,_
kecik putingnya x wide mcm pigeon or pupici,_
"tambah megi, fishcake dengan bijan",_
suprisingly good quality,_
warna cantik dan menarik 5 strs,_
barang baik ***Buyer's review has been hidden due to inappropriate,_
"Order 5 pasang tapi sampai 2 jerrrr , hopefully sellerrrr cepat2 post lagi 3 pasangggggg",_
harap2 wangi,_
"good good good, fast delivery, 3day working day arrived",_
The quality is good la at its price,_
Been looking for this product,_
kelabuhannya pn elok,_
alhamdulillah baranag dah sampai,_
Light and smooth to wear,_
Hope ot works well to me,_
Beli hari tuh belum dapat pakai lagi,_
seller pon ramah time tanya nak guna macam mana,_
Siap bagi surat 🤣🤣🤣🤣🤣,_
Ringan sgt2 kat nie pkai pn selesa je,_
My father yg nak check surat yang pick up,_
Guna untuk acara rumah sukan,_
Ok sudah terima barang dengan pantas,_
Mengujakan apabila melayari internet,_
"Standard benda ni mcm kerongsang jugak, asyik hilang",_
"Comfortability:need to order 1 size bigger, bcs of cutting is a bit smaller",_
Seller letak bubble wrap which is good,_
X menyesal beli 3 terus,_
Harap seller lebih alert lepas ni,_
Yg lain boleh beli kat seller ni,_
Fragrance:tq sellers,_
Tak payah hantar kedai,_
Boleh detect syiling 10 sen ke atas,_
If buncit bela la saiz besar dari ni + kene oter kaki lah sebabnyaaaaa selua ni labuh untuk saya,_
dah chat knp xboleh beli 2 kotak,_
"Penjaga warga emas lazimnya membabitkan pasangan anak dewasa dan menantu, selain ahli keluarga lain seperti cucu dan adik-beradik",_
Kakak saya suka,_
sama mcm mask yg slalu bali kat diy,_
kaler orchid more to mauve purple and sage green memang cantik and aesthetic,_
"Cantik2 sejadah, alhamdulillah",_
"In use, hope to be durable",_
4 billion services business as the smartphone market has matured,_
Saiz M sama mcm saiz XL yg biasa sy oder kualiti kain ok,_
Delivery lagi laa mantop,_
then will start record another 3minute,_
Packaging terbaik akan repeat lagii lain kali,_
"Packaging bagus, ada bubble wrap, buku pun tak ada dent semua perfect",_
"He added that if a couple does not get along, they should part ways quietly and try to be friends and continue to provide their children with support",_
"Bungkusan ok ,penghantaraan lambat ,barang ok Tak ader kerosakan ,tq seller,boleh la padan dengan harga",_
"Using artificial intelligence, the SI PPS and the MIT Sloan School of Management developed a predictive analytic program that will pull data from more than 70 providers and partners on Staten Island to identify who is at highest risk of an overdose",_
", gak downlod rugi",_
Terima kasih seller hantar parcel dengan pantas,_
"com's most valuable customers, has eased as well, the company said",_
semua tiada cas masa terima,_
Quality:Membuang lawas giler,_
Servis agak mengecewakan,_
MKBHD studio,_
"Seller post out early, but Jnt decided to keep it stored for few days",_
Ok la not bad at all for 6 90,_
"Presiden Rodrigo Duterte, yang menerajui tampuk pemerintahan kerajaan dan dikritik oleh Pacquiao kerana didakwa gagal merintis usaha bagi memerangi penyelewengan, tidak mengisytiharkan aset kekayaan kepada awam sejak 2017",_
laju penghantaran cantik nti klau tak cukup saya oder lagi terimakasih sis,_
siap dgn sticker free,_
so layan je,_
tutorial,_
seller okay lah juga,_
Cepat ya deliver,_
Cuma kena jahit kt bahagian dagu sbb my head is quite small and need to potong bagi pendek dpn & blkg,_
Surely there was a dent on the plastic bottle,_
Tq seller babytoratora,_
Sbb salah frequency,_
Cntikk tq,_
Terbaikk terbaik terbaik terbaikk terbaik terbaik terbaikk terbaik terbaik terbaikk terbaik terbaik terbaikk terbaik terbaik terbaikk terbaik terbaik terbaikk terbaik terbaik terbaikk terbaik terbaik terbaikk terbaik,_
Agak besar jugak utk letak brg,_
repeat order many time good shoppe market,_
Cuma lambat sikit lama di bhgian courier,_
Saya bg 4 bintang saja sebab seller salah hantar warna pillow case,_
I can use it for my notes and drawings,_
ikut je saiz dekat size chart seller tu sbb mmg sama je ukuran dgn kasut sebenar,_
Sampai pula 9/6/2022,_
Warna yang sangat cantikkkkk dan agak besar,_
expired date pon lamaaaaaa lagi,_
Functionality:kain best lembut sesuai utk baby,_
ttbaikkk,_
Fits my 13 inch laptop,_
Yummy taste with sushi rice or porridge,_
Jam memang padu,_
adik saya main ff tapi suruh beli team secret tapi kualiti baju memang padu,_
Tebal sumpah,_
"9 to $1,895",_
tq abg pos cermat deliver barang,_
sound dea pon ok(∇),_
"Worth the price, pretty",_
Semua handkerchief comel2,_
keep up your good service,_
"It's only works after you immediately download the app and use it for the first time, but after that it's useless and will always display an error message",_
"Keluarga Glazer yang juga pemilik United, bertindak selepas protes terhadap kelab berikutan pembabitan mereka dalam Liga Super Eropah yang turut disertai 12 lagi pasukan elit dunia",_
recommended used laptop spec tinggi dgn hrga brpatutan,_
Barang memuaskan hati tq seller,_
Jom dapatkan baju darinkami,_
"Selamat diterima, Alhamdulillah, ukuran semuanya baik, Seller pon pantas pos",_
Lepas ni boleh beli kat sini je senang,_
Kain x jarang sgt x tebal sgt,_
Seller responded to my enquiry in timely manner,_
Berbaloi dengan harga sangat2 murah & anak2 pon suka main,_
Free² makan duit customer,_
terbaik la seller memang puas hati dengan barang,_
The engineering services company's orderbook at present stands at a record-high of about RM1,_
Mmg okey sangat,_
pnghtran lambat mngkkn dri jnt xda gmbr sbb tolong kwan beli,_
F23 tu kain agak keras sikit n warnanya agak suram,_
Quality:Noodles are good,_
malas nk crk tempat lain,_
GOODpackage is new and definitely have 20 packs,_
Sharon Sandhu somewhere new?,_
Product came with a bag and a mouse,_
thank you seller5 star premium,_
tudung jenis cotton ceni laa i cari,_
The 70mai series really trusted and the camera is really clear even night,_
Dxjdjuxohxisysyusjddjdjjdujfjjdudjjdjdjdjjdjdjjdjdjd,_
It's a hanger,_
Siew Lang,_
The product quality was fine along with the price,_
Penghntaran sgt cpt,_
Ok nice simple,_
"I dont use it because i dont know how to adjust the timer, but thank you anyway",_
Kalau tak melopong jugak la,_
em apa lagi eh,_
Memang kemas & chantik ikatannya,_
Unexpected quick delivery process which takes a total of only 2 days,_
Rugi betol beli sini,_
Tahun depan baru bukak,_
Cume post out je lambt,_
Posto pun laju jugak,_
slim bag dah sampai,_
Size M a little bits loose for me,_
711!,_
Mantap laju dh sampai x sbr nk pasang tq,_
"PETALING JAYA: Securemetric Bhd has launched SigningCloud, its cloud-based pay-per-use digital signature platform",_
Dh byk kali repeat kat Seller ni,_
The mat has three main assets,_
Pakai masa zumba,_
Yeah baby bear,_
"Packaging kemas, brg xkemik, barang cun xpadan dengan hrga murah",_
excellent service by seller as they wrapped each bottle,_
Weight : 85kg,_
Eiran (left) and Wayne showing the wooden stand they built for their aquarium at home,_
Masalah banjir melanda,_
standby utk raya,_
best sangat sambal hitam ni,_
Pesanan dah pun diterima,_
delivery ok laju barang elok dh try tadi berfungsi dngn baik guna kt apps pun jadi thnk u ye !,_
Taste:of course i like it,_
", 38/85",_
"good packaging, item receive sama as ordered",_
cute🥰🥰🥰🥰🥰🥰🥰,_
"Nice tv, fasy deliveru, easy to install",_
Terbaik sehari sampaiiiiiii iiiiiiiiiiiiiiiiiiiiiiiiiiii,_
"Kaler pun cantik cantik, tapi x berapa nak pandai pilih size 🤣🤣",_
jnt jugak yg terbaik,_
nak bawak g bercuti,_
Dpt harge murah dr seller lain,_
If iqoo had give punch hole in display and fast charge so that it gonna better deal,_
everything look good no damage at all the album is fine as hell and most exciting thing is that i get my bias YUNHOOOO,_
Lets see how it goes,_
Material is thick and the item was received in good condition,_
Mantap mantap cantik lawa Mantap mantap cantik lawa Mantap mantap cantik lawa Mantap mantap cantik lawa Mantap mantap cantik lawa,_
",kfxgxoxofufpcoycyodyocoycocicoycof06dyofof9fpf0fydocoydofyocyococyocoyclyfpfoyfoycocpycococpyc",_
maybe rambut saya yang problem,_
belum kesempatan untuk gunakan dalam air lagi,_
cantik penutup botol ni,_
"10 terus beli, delivery cepat, good seller",_
Very good and cute,_
Kain tebal so x jarang,_
"Packaging tersangatlah mantap, kemas dan tebal",_
Expiry date 11/2021,_
"Telekung elok sgtt, jahitan kemas",_
All the items in right number,_
saiz kereta,_
"BARANG OKAY , FAST DELIVERY BY COURIER CUMA SELLER NAK SHIP OUT TU LAMBAT , LEPASNI NAK COLLECT WARNA LAIN PULA",_
i likeand also to handsock sedap ja pkaii kain dia oke sngt and tk panas,_
blh gam blk,_
Packed elok,_
Agak besar untuk anak,_
DADA AYAM R,_
BAITULMAQDIS: Seorang penduduk Palestin ditembak mati kerana cuba merempuh askar Israel dengan keretanya di Tebing Barat semalam,_
Sejadah dh smpai,_
potongan agak besar sikit,_
barang cantik tpy to la nama je shopee express tpy hold 2 hari haizz,_
Camera pun berkualiti,_
Baju sudah selamat di terima,_
Quality:terbaik sedap ya amat,_
aplicación muy amigable y de buen interfaz,_
Barang sampai dalam keadaan yang sangat baik!,_
tapi yg leher turtle tak ada label hanya ada label tepi baju no 5 sama dgn baju leher turtle warna pink,_
"Fast delivery and sandal cantik sangat,",_
Sensitive skin might love the green one,_
thank you so much the jersey safely arrived and fit my lil bro well,_
Kemudian baru senang nak,_
Cepat sampai dan tulisan cantik,_
kualiti produk setanding dengan yang berada di pasaran,_
saper nk sponsor,_
Repeat order sebab murah & berbalooooi,_
SOP di homestay kami:,_
"We will launch our Cabify Super service next year in Latin America, Chavarri told reporters at an event celebrating the multi-mobility company's 10th anniversary, in a move designed to capitalise on a pandemic-fueled boom in quick e-commerce",_
50mp Sony imx766 camera same as the one on Nord 9 pro is absolutely amazing for Nord 2,_
Parcel is well received in secure packaging,_
Seriously service pantas,_
Taste:goodd n kualiti elok sngt,_
packaging so good🤩 very fast delivery 🥺🥺 semuaaaa ramen cukup,_
Pen drive dpt dlm keadaan yg baik,_
Fast delivery and free Miso Soup,_
Material kain best utk dipakai dan cuting yg elok,_
sebelum packing hantar gambar tentang condition barang ya di order,_
It lags like hell,_
kemarin submit oder,_
dan klu habis nanti mau repeat order lg,_
suka sangat design ngan warna tu,_
semua elok je,_
X rugi laa beli 4helai,_
"Ausgesucht,bezahlt und in kurze Zeit angekommen!",_
Kumpulan H,_
my album arrived in good condition,_
mesti la ramen sedapppppp tapii kalau bole time ship tu cepatkan sikit yeeeeeeeeee next time i will repeat oder,_
second Order 30,_
"We can see that when you are young and female the hate speech that we are facing is often sexualised, Marin told Reuters in an interview on Wednesday, a little more than two years into her term as Finland's state leader",_
"Fast shipping, thank you",_
terus sambar 2 biji,_
Baby cotton legging safely arrived,_
Design:Smaller than expected,_
nipis sangat pon tidak,_
Charged for few min before able to start my car,_
memang super cepatlah,_
Even the advace stores which selling pricey items also will not do such a packing,_
Kali ni beli bnyk2 dpt yg nipis pulak,_
sedap dimakan utk breakfast and anytime,_
Aiii qricoUuu,_
Functionality:I think is okay,_
"Kotak sampai terbuka sbelah dalam,powerbank xrapat mcm terbuka",_
Seller respon pon bagus,_
Penghantaran cepat dan elok balutannya,_
seller tak mentioned pun dlm live,_
drama mlm2,_
kuantiti juga cukup seperti yang diorder,_
belum tahu ok x,_
Sedap makan dengan nasi atau roti atau apa2 je lah,_
Ku beli mahal line hilang apa macam,_
Wow banyak ye abang Aqil,_
lepastu salah bagi perfume!,_
so intai masa sale,_
heck if juz giv 1 mask hook still tolerate able,_
Tp warna dia lawa,_
Can repeat order next time ^^,_
Video not related tapi kedai ni baju dia mmg cun melecun & murah,_
Cuma colour gelap ckit dari gambar,_
Penghataran pantas & terbaik,_
"Arrival took around 3-4 weeks ,",_
Jordan Thin,_
"GOOD UNBOXING ,IMPORTANT COLOUR INSTA - hitensaini13",_
Kapan medi dapat emas: Tidak pernah,_
Nasib sempat smpai hehehe urgent nk guna hehehehehehehehehe,_
Sorry gambar n video takde kena mengena sbb dh bgi adik,_
!lovee lovee lovee,_
Super fast delivery this round unless short of stock,_
Kasut cantik seperti dalam gambar,_
So sick,_
Yg mangga sala tu agk keras mungkin ad yg dh sikit tua,_
Gmbr elok cantik je dan terima kasih bagi saya free gift foto card exo,_
good good good good good good good good good good good good good good good good good good good good good good good goodgood good good good good good good good good good good good good good good good good good good good good good good good,_
Bang ada Kamen rider gk?,_
Kalau tgk kat shopee mcm terkandas ja,_
ini mcam,_
nice colour suitable for adult and kids,_
good value for money for simple bt device,_
thank you seller even though very late but its okay not urgent overall nice,_
T: 158cm B: 46kg,_
Barang cepat sampai tapi itulah sebelah adjust loose,_
gam sticker lekat sepenuhnya atas tangan,_
Receive all the items correctly,_
"Even then, some may question: Is an industrial park a suitable place to live in and study?",_
Semua jam lawa🥰,_
"bubble wrap tebal, x tumpah",_
"Will trade again,",_
"Saiz compact, senang nak letak dalam beg bawak ke mana2",_
Hopefully penerima air fryer ni,_
Perolehan aset baharu ada tetapi saya telah meletakkan keutamaan terutamanya kepada penyelenggaraan aset sedia ada,_
Guided me to setup,_
Gambar tiada kaitan dgn brg yg dibeli,_
Fast delivery good servis,_
Frequently delays/ extends arrival times on the whims and fancies of the algorithm,_
n tggu kita balas bru dya pos barang,_
Hehehe dlm proses nk susun gmbr² lama,_
Justttt nice!,_
Barang dah sampai dengan selamat & penghantaran memang cepat,_
dua² berfungsi dgn baik,_
but kalau nk adjut tinggi kene letak lemberat dkt bawah,_
Cepat pantass berbaloi untuk gift fibermeal,_
BARANG DAH SAMPAIIIIIII CEPATTT SGT PENGHANTARANNYAAAABEG CANTIKKK COMEYY JEEEE NANTI NAK REPEAT ODER KAT KEDAI NII SUMPAH KORANG BOLEH BELI DEKAT KEDAI NI,_
Tapi takpee ocerall saya okay jee berpuashatii thkyouu seller saya beli yaa selamat maju jayaa,_
"Thank you,thank you,thank you,thank you",_
tp sy ukur hya 38,_
Kalau beli dkt luar mahal beli dkt shopee lg berbaloi hehe,_
Presiden Mohamed Bazoum baru-baru ini berjanji untuk menggantikan struktur sekolah kayu,_
"As usual, all dresses are lovely n fits me well",_
seller pon ok sgt,_
Performance:tnks smua,_
beli time sale pakai voucher berbaloi sgat2,_
Memang jenis kalau beli underwear brand h,_
so kena sopan2 sikit guna,_
(1000mAH),_
barang pun secured mmg terbaikkk,_
bdk2 pn suka,_
