Sentence,Tagged_Sentence
Barang sampai dalam keadaan baik dan di bungkus dengan bubble wrap,_
repeat order yg ke berapa kali dh,_
Jangan nak raya jaaa,_
Super fast delivery and packing is nice,_
"Tq seller, barang sdh sampai",_
seliparnya tak bawa,_
You might also constantly feel the need to double- or triple-check that your passport and other important documents are packed before heading for the airport,_
Pretty funny how your buying a mask from China where the virus came from to make you wear a mask lol,_
Camera is clear and worth buying to spy on my pet,_
sempat pakai utk bercuti,_
Pictures will tell u everything,_
Performance:gooddd !,_
"Barang dah slmt terima smlm, bungkusan yg baik, item semua ikut pesanan, tiada kerosakan",_
Boleh repeat order untuk warna lain pula nnti,_
OkGood,_
"Always the man, i didnt have time to finish and farm but this team did it in a record time and even added some extra",_
Nak bf bby pun senang,_
thanks you thank you thank you thank you thank you thank,_
"Good value for money, paling murah",_
Periuk arrived safely and I already used it,_
5 peratus Keluaran Dalam Negara Kasar (KDNK) dunia,_
"dah berapa kali dah repeat dengan seller ni , so far semuaaa okayyyy ,",_
"Fast delivery, received on the 3rd day after order",_
"size semua okay untuk adult, tak terlalu besar simple je cute cute",_
viral katanya,_
sorry video n photo x brkaitan,_
dan delivery pun cepat,_
Texture:rasa licin sgt kuku,_
"Come with nice packing, good product quality and excellent services by seller",_
Socks might be out of shape once wash it in washing machine,_
"The product name honey&nut cornflakes but no nuts, only with honey coated cornflakes",_
"My regular places that i usually order from months ago are no longer available for delivery, which hinders choices of places to order from",_
10 million soon sir Congratulations in advance 🥳🥳,_
Maaf gambar takde kena mengena BTW barang perfect thankyou seller,_
Beg still in good condition,_
terima kasih kpd seller n abg shopee express,_
"Received all items in good condition, so far trying once",_
kualiti tuala bagus,_
"i received the item with a good condition i really love it,",_
s an absolute massive device 🥰 Twitter $MENTION$,_
Brg yg Sye order dh sampai dgn selamat kerumah saya,_
sopan grabnya,_
Material:plastic set,_
Belikan unutk adik,_
Material:OK some heavy material some is light material,_
"Kain sejuk tauu , recommend sangat kalau nak beli🥳",_
Good value for money fast delivery good product quality poor packaging,_
Terima kasih untuk penjual,_
Sekejap je buat benda ni,_
Hbag cantik,_
"Overall material is good (thick), sponge might not be durable",_
Cantek terlalu selesa sebab tebal nak mampos terbaik ah seller boleh repeat order next time tapi tktau lagi bila nk rosak thank you,_
Bought time,_
like just nice,_
- okay lawo gak,_
beli utk anak saudara di kampung,_
Okey sangat dengan harga nya,_
Dyson said in a statement that its virtual-reality showroom was an extension of selling direct to consumers though its 318 stores and website and would be available through VR headset Oculus' headset store from Friday,_
ni gmbo kain yg mmg dh ada kat rmh ni,_
pasti lima bintang,_
"walau jauh,tp cpt penghantarannya",_
"Heavy chiffon, cuma kualiti kain keras ckit",_
Harap seller boleh perbaiki,_
Kita menyoal bagaimana AIM sebuah pertubuhan yang memberi pinjaman kredit mikro boleh membayar gaji puluhan ribu kepada lembaga pengarah dan pengurusan AIM,_
Sape yg beginner nk pakai heels tu haa pakai laa ni konfem kene tiup angin tak jatuh support kedai ni please,_
Bang mata nya kedip,_
re RM0 Kerap basuh tangan anda menggunakan air dan sabun atau gunakan hand sanitizer dengan cara yang betul bagi mengelakkan jangkitan Covid-19,_
Overall ok thanks seller🤗🤗,_
"Agensi angkasa lepas Amerika Syarikat (AS) semakin beralih kepada industri swasta bagi membangunkan perkakasan pernah dibuat sendiri untuk mengurangkan kos dan memberi tumpuan kepada matlamat bercita-cita tingginya, termasuk membina habitat di bulan dan bersiap sedia untuk misi anak kapal ke Marikh",_
"Functionality:macam ok, tapi belum guna lagi",_
Quality:mask ni tak berapa teballl,_
"and ya one more thing look at the secure do taktau la nak cakap IT'S WORTH IT thank you seller ,",_
Only bought during sale and for Cappuccino,_
Good product i like,_
Mmg molek sedap pakai,_
Even pakai lama pun masih kering,_
"0, bukan 3",_
siap ada kotak,_
"Seller di kota kemuning sahaja, sementara saya di shah alam",_
Lama gileerr,_
Side mirror moto lakiku,_
Stay fragrant my teeth smashing children,_
Yeh i expected hate comments about covid 19 cuz shes chinese and all that but this comment section was really nice,_
Beli utk anak anak,_
"Best price,Best fast shipping",_
"Kalau tiup guna mukut , esok pagi bangun hilang mulut",_
"Langkah-langkah itu termasuk menutup sekolah dan tempat hiburan, dan menguji orang yang pernah berada di kawasan umum yang sama dengan seseorang yang didapati dijangkiti",_
Seller akan selit dlm next punya pembelian,_
"Setelah selesai menunaikan solat, duduklah dahulu",_
Great product quality and cheaper too,_
"Alhamdulillah, sudah smpai mask yg di tunggu-tunggu",_
yayyyyyyyyyyyyyyyy,_
the company said,_
Panjang pun ok,_
Boleh cuci laptop,_
"Good product, the sound is the best I've ever heard, the screen is very clear and thin, everything works",_
"paper bag parcel been tear off,paste back &1item missing",_
dah pakai and tgh pakai lagi,_
Why pay 10 inch Love gold get 5 inch,_
Malas amat,_
ya sya tau sya yg accepted 50 refund krna syamalas nak pos,_
lagi gk hoki bang awokwk,_
"Well received package okay item no smell at all 🤣 warm saja, not really enough hot",_
tpi alhamdulillah slmt smpai jga 🤍,_
"Items order time 11/1/2022, Shipping time 12/1/2022, Received time 17/1/2022 Delivery times below expectations",_
cuma tgn je terlebih baggy and pnjang dri tgn aku,_
"minat sungguh,",_
"These include practising recycling, using reusable bags when shopping, buying food or beverages using their own containers and producing compost from kitchen waste, he said in a statement",_
Warna pon nampak cantik,_
"Walaupon random, corak nye cantik",_
Good good good good good good good good good good good good good good good good good good good good good good good good good good good good good good good good good good good good good good good good good good good good good good good good good good good good good good good good good terima kasih,_
"Good, fit for women 2",_
Saiz agak kecik dari standard saiz,_
Penghantaran cepat wpun order raya pertama,_
terima kasih seller bagi byk free gift,_
Tq saller item already received,_
Yg ni kali kedua beli,_
motivasi untuk diri sendiri dan penghantaran barang dah sampai rumah ke rumah saya di mana ada duit lebih,_
Kami menggunakan sebuah ambulans milik BSYJM dan sebuah kenderaan pacuan empat roda untuk operasi ini,_
tip top tip top tip top tip top tip top tip top tip top tip top tip top tip top tip top tip top tip top tip top tip top tip top tip top tip top tip top tip top tip top tip top tip top tip top tip top tip top tip top tip top tip top tip top tip top tip top tip top tip top tip top tip top tip top tip,_
"Sorry gambar tak berkaitan, so far dah beli 2 kali with this seller",_
Items expire on 5 Aug 2023,_
"Quality:so excited to play this, glad that receive fast than I expect",_
Thank you freee gift,_
Yeay sampai dahh !,_
Great app and nothing else to say other than sometimes packaging can be a bit messed up but otherr than that it's an awesome food delivery app,_
Kualiti pn padu,_
"Good product quality, good value for money, very fast delivery, excellent service by seller",_
Ade gambar dan video xde kene mengena,_
t really mark the model down as it&$HASHTAG$,_
Fast delivery for oversea product,_
Tahunan yang lalu telah mengambil keputusan memohon kepada pihak Ustaz Dato' Bentara Kanan supaya dapatlah mendirikan sebuah surau untuk kegunaan penduduk muslim dan muslimat di kampung ini,_
cantik semua suka sangat worth it,_
26/10,_
/ to get to site of amazing deals),_
Planner okay je takde defect,_
Taste:bagus cepat cepat cepat,_
No nono,_
Kemana saya harus menghubungi cs nya ?,_
Fast delivery 🤩🤩🤩🤩🤩🤩,_
"The product is good, the thighs are neat, the holes are tight even though it goes into the inside, it is more tight but so far good and cheap",_
Terima kssih seller dan dhl,_
sesuai utk free size,_
sgt2 murah dan warna yg menempati citarasa,_
Seller apologise & said give it on next order,_
repeat ok,_
Very useful for organizing cable,_
peringatan kasutnya getah semua,_
"Very nice, comfortable, lightweight, affordable",_
The campaign achieved its first victory when cosmetics giant Unilever dropped the word fair from its popular Fair & Lovely skin-lightening cream,_
no damaged to the shoes,_
Functionality:Ok cun,_
tp next time leh beli kecik sikit kot,_
Very fast delivery time and good product quality,_
Comel nya dia cakap dalam bahasa,_
Boleh pasang dengan mudah,_
Belikan untuk mak sebab dia nak try pakai yang jenis macamni,_
"Following business interruption for the most part of 2021 due to the movement restrictions, gaming-related companies such as casino and number forecast operators have once again seen increasing footfall",_
Unlimited Pelan Celcom Home Fibre 300MBPS hanya RM119,_
Are we getting this tv?,_
cma nk pesan ambik saiz biasa pakai,_
Packed nicely with bubble wrap but the wrapper is still crumpled,_
"Kain ok, ada satu kain yg corak grey, kasar sedikit",_
Lengkap 1 kedai,_
"Jadi tahun ini dengan kehadiran beberapa lagi pemain baharu, kami semua akan cuba membantu pasukan sebaik mungkin untuk raih sasaran itu, katanya",_
Suka betul,_
Tq Mr Victor,_
But the material comfy,_
tapi sokay 🥰,_
ATHENS (Reuters) - Greek Prime Minister Kyriakos Mitsotakis said on Sunday the return of Turkish survey vessel Oruc Reis back to its southern province of Atntalya was a positive first step to ease tensions with Turkey over offshore natural resources,_
Mudah untuk dibuka dan ditutup,_
"I bought M, the size is about the size of the XL size",_
Mudah dibawa kemana-mana sahaja senang disimpan boleh digunakan untuk anak saya,_
"Imo, manufacturers are not actually thinking straight about the charger",_
"2 warna yg sampai sgt cantik, biru & hitam, senang dipenggang utk dibawa kemana2",_
"terbaikk, barang bfungsii dgn baikkk",_
hopefully sedp la,_
"fitting pun kemas dan murah, tq seller , dah pasang semua item2 yg beli sama seller, mak suka sangat 🥰🥰🥰🤗🤗🥰🥰🤗",_
tak menyesal beli weyhhh,_
"Diaa suka sangatt sebab kulit dia putih , so kena laa dengan cap nike putih ni",_
barang bekualiti,_
Sedap ranggup mcm keropok lagi sedap makan dengan nasi panas2,_
Boleh beli go go!,_
The color was so fresh and attractive,_
Good product quality good product quality good product quality good product quality good product quality good product quality good product quality good product quality good product quality good product quality,_
"Yeung ,",_
Received in good condition!,_
Barang murah dan berkualiti,_
"maybe tgn i yg terlebih oanjang kot hm btw thanks saller,",_
Aku bukan pertama kali beli dengan seller ni,_
"Dah try sebotol habis, mmg ada perubhan dari segi tenaga, habiabterus repeat order, tapi yg 1st beli dgn seller perlis yg 2nd ni beli dgn seller selangor, harap barang sama n puas hati, packaging mmg terbaik bubble wrap khas utk botol",_
🥰🥰🥰🥰🥰🥰kasut cantik mcm dlm gmbrkualiti brbaloi dgn harga,_
"Kain comel,puas hati lembut🤲🤲🤲🤲🤲🤲🤲🤭🦽🦽🦽🦽🤲🤲🤲",_
"Terbaik, barang berkualiti",_
time xde org dia suruh cencel je,_
"Quality:jeruk macam stock lama , poor packaging, sampai dalam keadaan bubble wrapped bocor, air jeruk keluar",_
Hli,_
"penghantarann Yang sangat cepat, dterima dalam keadaan baikk",_
Penghantaran lambat skit la sb pkp,_
dapat freegift lagii,_
the keyboard is working well too,_
Sorry ya bos,_
Murah berbaloi 2nd time order,_
Ето не пашет ето пашкено яйцо,_
Cantek seliparnya kualiti baik,_
"Mak cakap depa pasang semua memg bagus, siap test lagi",_
kalau ok saya akan trus shopping dengan seller ni lagi,_
"KOTA TINGGI: The Ministry of Science, Technology and Innovation (Mosti) will scrutinise and assess existing Unmanned Aerial Vehicles (UAV) flight guidelines in the country",_
Quality mmng boom boom kebaboom,_
49 billion versus Monday's 3,_
sampai² 1 ank pakai trus bwk jalan,_
"Sekarang mesan makanan di grab ada biaya pemesanan lagi biaya kemasan lagi bukan pula murah tambah lagi ongkirnya naik, lu buat dagangan orang gak laku tau,",_
Ciri sumbangan zakat MyPay sudah dilancarkan dengan PPZ-MAIWP dan disiarkan secara langsung dalam aplikasi tepat pada musim kemuncak sumbangan zakat iaitu pada Disember,_
This app is sick,_
Barang dihantar dengan baik dan cepat !,_
Sesuai lah utk anak,_
Barang sudah sampai sangat puas hati kain sangat selesa tak pansa next nak rply oder lagi,_
first time beli n nak try hrp elok la 🥰,_
Cantik Sgt kaftan ni,_
Taste:Memang takleh bawak bincang,_
Coverage:pertama kali user,_
Baju selamat mdarat,_
Yeayyyy the album is safely arrived,_
"Dah sampai, kali kedua beli selang sehari lepas sampai first barang ni, terus order balik haha x rugi beli masa promosi, kain dia lawa kot, x panas, delivery pn cepat, semalam order harini dh sampai boleh kasi 5 stars for this seller",_
Baby I baru 2bulan,_
baju cantik n selesa sngt2,_
tapi tengok komen semua cakap air ni sedap so try LH beli,_
Tidak rugi beli memang berbaloii,_
Sampai dengan baik cuma parcel koyak sikit sampai nampak item dalam,_
1800ml tu memang tak muat letak spaghetti,_
Macam mane,_
Product always correct size and fast postage,_
Will recomend fren to buy,_
Fast response from seller after payment made,_
So tak tau kondisi barang jadi ke dok,_
Cute design and pattern,_
en suami suka boleh la untuk projek kecik2,_
"Seller respond fast, even help assembly, good product, decent price, worth buying",_
Cepatnya dah smpai,_
Barang padu sedap pakai,_
"Stok lama, tak boleh nak nampak berkilat, ada la calar sikit",_
Cantik gilaer,_
Aroma:like no others,_
tapi tak sempat ambik gambar,_
never try the cream carbonara,_
kain ni jenis elastik,_
Stiap kli bli msti puas ati,_
IMO the optional charger ist an exellent idea,_
Items well wrapped too,_
Murah n berfungsi dgn baik,_
Want to switch this with my nord ce 5g $MENTION$,_
Order untuk anak sedara kt sabak bernam,_
"Thank you app creator for this app it's made my life so much easier,",_
"Thanks seller for the best price, proper wrapping and quite fast delivery",_
Not sure what missing,_
Tak tahu repeat yang ke berapa kali dahhh,_
Correct colour',_
memang okey la dh try lawa je warna dia,_
Dah sampai pun call,_
com/b5/2020/10/23/a102970169,_
"harini order esok terus pos, esoknya dah sampai by j&t",_
be/SQ1AfRSWVds <a href=$URL$,_
Bad flagship phone,_
Even lambuh gila tapi its okay boleh lipas sbb kain dia niceeeeee,_
Wlupn pilih saiz palg besar tp tetap xmuat dgn suami sy,_
adik laki suka sangat,_
they keep your parcel for on hold for so many days before holiday and that is NOT GOOD,_
Gambar takde kaitain tapi baju memang ngam,_
Thankyou 🥰 akan repeat order sini lagi,_
Saiz ok mengikut ukuran sebenar,_
Sangat puas hati dan terima kasih banyak,_
Packing wrap with bubble wrap and box,_
TQ J&T sya bgi 5 bintag,_
"Good Wrapping and Packaging, Fast delivery, Recommended Seller",_
for the price yg lagi murah dari ikea,_
"Everything is okay, just slow delivery even stated 24 hours delivery, almost 2weeks to arrives",_
Good looking recipe,_
thank you 🤍🤍🤍🤍🤍🤍🤍🤍🤍🤍🤍🤍🤍🤍🤍🤍🤍🤍🤍🤍🤍🤍🤍🤍🤍🤍🤍🤍🤍🤍🤍🤍🤍🤍🤍🤍🤍🤍🤍🤍🤍🤍🤍🤍🤍🤍🤍🤍🤍🤍🤍🤍,_
alhamdulillah brg smpai dlm keadaan yg baik,_
Sangat disappointed second time order,_
tapi anak tak bagi berus gigi dia,_
Jersey is very awesome,_
"No fuss, straight away can use",_
nanti lain kali repeat order lagi yaaa,_
semua okey n cantik,_
Expired date pun lg 2tahun,_
siap demo lg,_
"First time bought this brand, the cotton tissue very soft!",_
H - 153cm W - 45kg,_
Pelaburan kami dalam UTM bertujuan mempercepatkan transformasi digital Malaysia termasuk membina tenaga kerja mahir 5G,_
Seller & jnt fast service,_
Seller pun peramah & cepat respon,_
Of course it is recommended,_
Barang berfungsi dgn baik utk melindungi mi band 6 drpd menjadi mangsa anasir2 tajam yg boleh mencalarkan permukaan band dan juga frame plastik,_
Ok la kot tak tau laa ni ayah yg bukak hehehehe katanya ok je,_
"Siti Nurafiqah Satal 2085, 3",_
Terima kasih pd seller dan penghantar,_
semoga saller terus success,_
"Alhamdulillah brg dh sampai, tq seller 🤩 tq tq tq tq tq tq",_
comelNye bag ni sesuai dgn anak umur 2 tahun,_
brg dh smpai lama tp jnt buat harta karun,_
"Baju cantik warnanya, selesa dan ringan",_
"Niceeee , thank you seller",_
"Thank you sellerrr, anyway saye ade jual kuih bakul jemputlah singgah 🥰",_
Harga murah boleh la,_
Plz try to make some parts In HINDI,_
memang sedap dan nice semua and so on,_
I ORDERED A FOOD AND IMMEDIATELY TOOK THE MONEY WITHOUT CONFIRMING THE ORDER,_
shankyou,_
"Seller cakap pre oder, payment 6hb",_
bungkusan kemas & cpt smpai,_
Says suka sangat berapa kali Dah beli ni,_
"Definitely, I would buy again",_
1free gift baju berkolar yg wrna putih,_
develop a thesis,_
Functionality:berbaloi beli dengan seller ni,_
hbis 1parcel basah tkena sabun,_
"Tak npk reject tang mnn,dok belek2 smua elok ja,murah pun murah",_
Taste:memang terbaik sedap gila rasa sebab tu selalu orda kulit pom putih lembut badan kurus,_
Terima kasih kerana menyediakan produk yang bagus,_
memang keperluan sekarang,_
Mlas plak nk return,_
Barang baru sampai ye,_
Husb size S,_
"Nvm, thanks",_
satisfied with service,_
"Mak suka, anak pun suka",_
Surely will come and buy from here in future too,_
"the account totally valid, safe and",_
Mmg semua cantik2!,_
Safety:Puas hati cantik²,_
"Dalam pada itu, Ismail Sabri berkata, trend peningkatan semula sektor penerbangan dijangka pulih menjelang 2025",_
Check my twitter $MENTION$ to buy,_
"utk plus size, harap seller tambah lagi warna yg lain",_
Barang baik berfungsi dgn baik,_
"kain jenis X panas,X tebal, X nipis",_
Taste:The soup are delicious,_
25bil (RM5,_
Cuma socks jelah ada 1 pasang tu sebelah kecik sebelah besar but no prob lah since nak pakai kat rumah je,_
Design not too bad,_
harap sedap lahh,_
Reached my expectation,_
warna warna dia pulakkk cantik warna pastel gituuuw and mask trending kan lawa,_
Nampaknya ibu saya sangat menyukainya,_
Pghtrn pun cpt sgt,_
"Too delicious, all the snack is eaten",_
Hari jadi kawan harini dan harini lah baru dapat kotak ni,_
not try this yet but hopefully nice packaging overall secure but the delivery a bit late but it's okay,_
Functionality:mudah di kendalikan,_
"good quality, fast delivery, excellent service by seller",_
>Pengambilan produk kolagen tambahan juga pilihan yang harus dipertimbangkan,_
"Nice, tp terambik besar skit hahaha, btw baju ok la quality pun cntik, tq tq tq",_
"Fast shipping, good product and trustable product",_
"It is cheap but not cheap, it is really good, and the material is also very thick",_
Terpengaruh dgan ria ricisdya makan mcm sdapp jadi kita try kalo sdapp,_
Kali kedua berurusniaga dgn seller,_
Untuk org berpeluh okay la,_
Durability:not sure if it's durable,_
Cheaper of course cuz it's 100mg,_
My phone to be new good,_
Had been buying this brand only since I was able to buy online,_
"A storyline full with sad and happy journey, hoping for a good ending",_
"Every time give me the driver which is quite far until 15 or 20 min and end up with all the drivers don't want to pick up ask me to cancel the booking until i cannot book the next ride,",_
Aroma:wangi sangat2,_
"Yea looks like a real coach purse, worth the price and extremely fast shipping speed",_
dah ambik satu saiz besar,_
I terjebak tgk dianjaunah pakai,_
love always!,_
Baju kurta utk Raya da sampai,_
berat saya 55kg selalunya kat tempat lain saya amek size l supaya tak ketat kat bontot tp ni size m dah nicee gilekk,_
Parcel sampai dalam keadaan koyak koyak dan kain di dalam tidak di lapiskan dengan plastik,_
Fast Delivery Packing is very Good,_
"Barang baru dapat n belom try lagi, kalau bagus maybe next time boleh beli lagi",_
Terima ladih seller,_
kain mmg best gila x gatal x kasar,_
sme seperti dlm gmbr,_
kasi warna hitam,_
barang cantik Dan berkualiti very reasonable price and good quality,_
Ade free gift note book dia bg,_
Item receive in a very good condition,_
Good quality love to drink,_
"On Monday (Aug 3), some 1,773 rounds of inspections were done throughout the state, it said",_
Ok je (jgn baca bawah tu ) aku copy je,_
So much good,_
XtW sedap ke x,_
"Good product, takde kerosakan",_
/* Force table to not be like tables anymore */,_
-- China Daily/ANN,_
"Barang sampai cepat Baru order semalam, tahu² sampai",_
"Order on Friday night, posted out at the next day and arrived in Sunday",_
Material:Keras skit,_
Saiz ngam ngam ngan saya 🤭 dan selesa hehe!,_
Would appreciate if the options to select have translation,_
Seler pun sgt membantu,_
"dapat 2 helai,",_
"sebb dia cutting body korea HAHAHA thanks seller, wlaupun preorder ttp laju sampai",_
lawa la esbok aku pasni oiii siap organise!,_
Alhamdullillah kasut dah sampai,_
Fast delivery great item value for money working well good product quality and excellent service by seller trusted semmer too keep it up,_
Lembuttt suka sngtt penghantaran juga lajuuu,_
"second time with pink flash eyeliner, never disappoints us,",_
"its good to give to your dad, brother, or boyf",_
Makan satu pack sekali hadap je,_
cuma satu je klu boleh pos la pakai j&t atau poslaju cepat sampai,_
Compensation have been done with both parties agreement,_
Taste:goood coz my fav,_
X sbar tgok anak sedara pakai,_
Omg I da mokk,_
Material:sangat lembut dan tak mudah koyak,_
Nnti nk repeat order plk warna lain,_
$MENTION$ SeokJin love love love army,_
Jam cantik sangt smpai dlm keadaan baik,_
dah test berfungsi dngn baik tp brush dia x bnyk pilihn laa,_
"12 haritu baru beli, 13",_
Berat dlm 50kg tinggi 149cm,_
Sticker sudah selamat sampai Fast delivery by seller & jnt,_
zipper bag cantik,_
Barang semua dapat & berfungsi dengan baik,_
"Alahamdulillah, sgt besar beg ni",_
Sesuai letak atas stroller buat alas,_
bungkusannya dh trkoyak ckt,_
"The order has been received, the bag is good, the price is cheap, the shipping is fast, the packing is neat, thank you seller",_
"PETALING JAYA: The unemployment rate has dropped two months in a row due to the economy's reopening and rejuvenation during the recovery movement control order (MCO) period despite there being 745,100 people who are still unemployed",_
Purchase many times from this seller,_
dengan sabar menunggu,_
semoga dipermudahkan segala urusan yang tengah baca rating ni,_
"Alhamdulillah, khemah dh smp",_
"Buat kopi botol, double shot dengan susu cantik ier kaler",_
Tp tu leee rambut gugur jugak,_
Goods received in good cond,_
Take few days to arrived Selangor as this chocolate from Langkawi,_
sy order pda 25,_
Gambar x lagging,_
Order Time: 23-09-2021,_
Sy terima sah berus gigi qnak,_
Xde la perfect tapi boleh la pakai,_
Tqqqqqqqqqqqqqq sellerrrrrrerrreterbaikkkkkkkk,_
The packaging is ok so I will continue buy from this shop,_
"Yang penting, harga berbaloi baloi",_
on l ok I am ppp on Om ok I'll be Loo mp,_
Might repeat order,_
pastu sesiapa nak badan bau wangi korang belila scrub i boleh visit instagram $MENTION$,_
"However seller is responsive, offer to return both module and recorder for check, but too troublesome to do that",_
amat berpuas hati dengan produk cuma sedikit kecewa disebabkan saiz xmuat,_
kira ngam la dengan harga dia,_
Tak best key chain tu je sebab tak muat utk masuk dlm kunci myvi 2022,_
tq u so much cantik bole lah untk budak 2 3 tahun main kn so okey tktinggi mana pun oke semua,_
mcm pelik sikit bau dia,_
Terbaikkkkkk ok lah ok,_
Taste:Everything is in good condition,_
m a & w,_
So not user- friendly,_
$MENTION$ The case on the phone at <a href=$URL$,_
ngam2 paras buku lali,_
Tq bos atas penghantaran sangat laju,_
"It is broken, i don't know that it can be ate or not",_
"baju semua paduuu yang pentinggg dpt baju knitwear HOODIE hoiiii lame dah nakkkk ,",_
kalau berkesan mesti repeat order,_
Cantikk gilaa,_
Akhirnya semua dh settle,_
"Fast delivery, parcel received in good condition, good product quality, good value for money after less coin cash back, worth to buy",_
🤲🤲🤗🤗🤗🤩🤩🤩,_
milk storage bag pun sama,_
"1st time order, very bad experience, they will update status had ship after place order, but take more than 2 week they just arrange and update status preparing to ship, chase seller many time, but never ever expect seller will help u",_
Super duper faster seller,_
"Delivery took too long but otherwise, its good",_
"Received my parcel, thank you seller!",_
Terbaikkkkklllllllllahhhhhhhhhhhhhhhhhh nanti bli lgggghhhhhhhgggghhhhhh,_
Taste:sedapp la of cos,_
frust sikit sbb dah excited nak menjahit skali pin plug plak xleh masuk,_
maalomlah dari chaina,_
The robotic visitor then turned around and rolled away,_
Tp 1 ada gambar anjing/fox,_
Da kali ke berapa pon xtaw la repeat sbb sdp sgttttttt haihhhhhh,_
Barang sampai dengan selamat dan dibungkus dengan baik,_
"tiptop, lajuu penghantaran",_
Dalam waktu singkat ini,_
the product is very well packed,_
Ok good tip top baik comey cantik menawan hensem dan seterjsnya hu hu,_
Cheapese price,_
"8 people, and this situation will accelerate the ageing process",_
Tq seller product dah sampai dgn selamat ke tanggan saya,_
yg saya order tu,_
"Baju sedap pakai, kain elok, cuma cutting mcm kecik sikit",_
thankyou for free gift comel ni 🥰,_
Favorite misua,_
Oh and tq for the free gift,_
sesuai untuk muka yg bulat dan bsr,_
