Sentence,Tagged_Sentence
Keci halus tp sesuai la ngan harga,_
Functionality:memudahkan dan menjimatkan ruang dlm beg,_
Hope serasi dgn anak,_
"Item not function , item not function, item not function,item not function,btw aku tak received tpi",_
saya mula mengenali romantika melalui facebook sejak 3 tahun yang lepas,_
kain memang ok sangat,_
Gambar tak ada kene megene dgn barang,_
Dh trima brg semlm,_
Design kemas terletak elok atas bahu,_
iam order size 3xl,_
Kita try kt wira aeroback,_
Nicely pack and no damage on parcel,_
"berat 56, tinggi 156",_
terbaik buku2 cikgu fadli,_
t=3m23s> not me being rickrolled by those 2 xiaomi logos,_
Design:Corak sangat cantik,_
Received in good condition and terang la lampu dia,_
"Penghantaran pantas,yg penting memang sangat2 murah berbanding harga diluar",_
But the product was packed nicely,_
i appreciated that this come in good condition to me,_
Corak milk saiz kecil drpd yg lain,_
Se deja ver que hay muy buenos resultados Saludos desde la Cd,_
Terima item dalam keadaan yg baik,_
"The way we did things had to change, from education to travel to how we maintain hygiene",_
Kena potong agak2 5inci dari labuh asal,_
"Kain cantik,tebal Dan berpuas hati",_
seluar sgt cun,_
Okayla overall sesuai dengan harga hehe cantik,_
"Function well, fast delivery",_
repeat orderrrr tqqqqqqqqqqq,_
Cantek puas hati lawa terbaik,_
"We have to be ready to have to face this situation for a long time, Fabrice Leggeri told Reuters, adding that Frontex would help Poland return migrants to their home countries",_
Laju gilerrrrrrr baru order semalam rasa,_
tgh tunggu stock yg biru pula,_
hvala na receptu,_
tapi okay laa sesuai dengan hrga,_
"64km byar 5rb, ini grab 10 rb",_
Beli saiz L tp kecik sangat,_
tertinggal gmbar bateri n free gift,_
maaff gmbr tiada kaitan,_
"Barang dibungkus dengan baik, dah cuba dah ianya berfungsi",_
saya bekukan buat askrem kucing saya suka sangat,_
Tapi kotak teruk macam kena buka,_
klau pkai2 lma nnti pudar la sikit colournya (maybe),_
the box looks really exclusive thanks seller for selling great screen protector highly recommended y'all,_
beli bnyk skali snang,_
expect to get the key immediately after payment - if shows seller offline,_
"semua okey, nnty boleh repeat lg🥰🥰",_
Tempoh delivery yang berpatutan memandangkan ada MCO,_
Value for Money:dapat percuma sahaja,_
"Cth baju dipakai saiz m, beli saiz XL",_
Expiry dates are as advertised,_
Very comfortable and same as picture,_
Will repeat oder lg dgn this seller 🤗 🤗,_
apa yg saya suka muka dia ngam,_
"Material seluar ni sedap dipakai, tp tulah agak nipis",_
"Just the green colour masks is not the green as shown in the picture but it's OK, not a big deal",_
Effectiveness:bersih dan berkesan,_
Siapa nak tahu boleh chat,_
4 juta kenderaan pada hari-hari biasa,_
True as advertise,_
volleyed in a low cross from Renan Lodi in the 53rd,_
"Saya saiz 37, amik saiz 38 so mmg ngam2 je",_
Quality:worse,_
Terbaikk sat ja sampai,_
just received itwill use if good after will purchase again,_
Saiz kain sangat bersesuaian utk semua perkara,_
Barang dah sampai and semua okay,_
Dah dapat smlm,_
Seller very friendly n responsive,_
Happy customer here Happy customer here Happy customer here,_
"corak lagi satu tu tak sama macam gambar, saya tak suka huhu sorry",_
t use my phone with one hand comfortably,_
Saiz dia sesuai,_
Good Nice product cheap suitable for my lip colors,_
tq free gift stocking comey 🤗🤗,_
"Stamp stamp, siyapppp ‍",_
salah courier ke kalau salah satu je yang kemek?,_
Packaging sangat lah bagus,_
Barang sampai dengan selamat walaupun sedikit lambat,_
t guna tok anak,_
Harga sangatlh murah,_
Tq seller item received in good condition i'm satisfied customer will buy again,_
"Yg kulit sawa matang, boleh guna tone ni",_
Hampir sebulan tggu brg sampai,_
Bakal ada semua colour utk collection ni sebab suka gila cutting and material dia,_
Anak anak suka thanks ya,_
"I bought as a present for my friend, she really loves it",_
Good products good service and fast delivery,_
order 11 sampai 19,_
kain pown sedap,_
Barang ok sebab ambil jenama yg ok kalau jenama yg biasa tu tk thu la mcm mana,_
omaigad bunga putih dy cantik sgt sesuai dgn harga,_
Baju raya dah sampai nasib baik sempat,_
Blaise,_
"Very light but beautiful, and just the size that I wanted",_
harga yang ditawarkan sangat berbaloi,_
"I ordered a free sundae and was promised a free festive McDonald's bag but I never received it,",_
I thought it was corn starch?,_
TK wai,_
"2kali repeat dah beli sini,sini paling murah dekat live",_
"Btw, kasut lawaaa",_
so good and the texture really suit my skin thank you seller ^^,_
Alhamdulillah ok la quite sturdy,_
Tapi pendek sikit,_
Jeff Gio Tan,_
"It took me a while to find happiness, confidence and that little piece missing in me to accomplish what I've done this week but thankfully, I've had the most amazing people beside me going through my emotional roller coasters",_
Received in good conditions and fast delivery Received in good conditions and fast delivery,_
As for the GripCase I find the trigger grip suit me the most and I am happy that the MaxCarry case allow me to carry all my essential accessories with me,_
!Goodjob seller!,_
cuma kecil sikit tapi oklah dengan harga,_
*video di Kg Agung,_
kalau nak pakai stokin better ambik 1 saiz lbih besar,_
Muat utk msukkn 5 cadar and slimut tebal,_
Fresh enough,_
ambik masa 10hari nk smpai,_
Silap pulak beli sikit sebab yang kurang pedas tu boleh rasa hangit sikit,_
bli lg skli kite,_
cantikkkk murah pun murahh hehehe boleh beli la selesa je pakai,_
work as intended!,_
Paka dgn baju tshirt,_
"Mengenai kebimbangan global terhadap inflasi, Tengku Zafrul berkata Malaysia tidak terkecuali daripada mengalami kadar inflasi yang tinggi berikutan gangguan rantaian bekalan disebabkan pandemik COVID-19 dan ia akan mengambil masa untuk rantaian bekalan global kembali seperti sebelum ini",_
Can i have a chance to win if i dont have tweeter?,_
kaki kerusi tak kukuh,_
akn repeat order g ble abs,_
tu yang payah kita nak tahu,_
Saya beli untuk member dia suka sangat katanya elok kalau selfie ahhahahahahahahahahahahhahshahahshshssh,_
Can you encik to get back to work on Monday and play with you and your family,_
hahahahhahahahhaha,_
Safety:selamat 4/5,_
just below average,_
Sorry air fryer ni dh smpai lama dh dh guna byk kli jgkk besttt,_
received on 10,_
"kain lembut sesuai utk baby pakai, cantik² semua baju",_
beg sy dah terima dlm keadaan baik,_
kelajuan dia smpai tahap 3,_
"Five cars each were handed to the northeast, central Seberang Prai, south Seberang Prai and north Seberang Prai district police headquarters",_
Barang selamat sampai cukup dengan bilangan yang order,_
Seller took longer time to post out but within expected time,_
"ORDER 12/2, 13/2 I RECEIVED THE ORDER,",_
PJKM diteruskan hingga Aidilfitri,_
paper foil fits perfectly in my air fryer (3,_
Parcel dah selmaat mendarat di bumi selangor,_
Utk pakai seharian,_
tqtq nnty blh odar lgu,_
"Yet workers at high-risk, high-reward startups are loath to jeopardize the value of their stock options, or put their jobs at risk",_
"I don't think I played my best tennis (in Rome) to be honest, I don't want to sound arrogant here",_
Gelap sgt,_
Simple and looking quite nice,_
"Baju nipis sikit, tak serap peluh",_
"Departing from his prepared address, Francis said it was distressing to hear that some European leaders wanted to use common funds to build a wall and put up barbed wire to keep immigrants out",_
beli mana ni,_
"Google unfortunately tends to want to be wishy-washy and avoid controversy, he said",_
secara luaran nampak ok bag,_
Alhamdulillah moga murah rezeki seller 🤲,_
"Yq kak lynn semoga dimurahkan rezeki selalu, Aaminn 🤲",_
Package arrived after few days,_
"Perfect fit to put my Samsung tab, easy to carry",_
The delivery was fast although it was delivered from Sarawak,_
Sepatut lg ok ambil sz 40,_
Sorry sbb gmbar xda kaitanm,_
selesa ank suka,_
Colour also quite nice and tapak pun tebal jugak,_
Beli bukan sbb nak guna sngt pon tp beli sbb color je,_
Tak muat nak letak laptop takpela salah saya sbb tak ukur dulu,_
Came in about a week,_
"Kain cotton , saiz m tp besar sangat dan singkat",_
"🥳🤘 Very satisfied,",_
50 sen seunit untuk Public e-Islamic Sustainable Millennial Fund dan 1,_
Kualiti memang mantap padan dengan harga yg ditawarkan,_
bra is too big for me,_
Banyak kali repeat order dgn seller yg sama,_
Siap dpt voucher dari seller,_
Received all in good condition because the bubble wrap is thick,_
tpi ok dh,_
Sila pada nama anda,_
"so far so good, dun know how long it can be last but for the price, i will say is value for money",_
"tak menyesal beli kt sini, terima kasih seller, saya beli",_
Dompet kubci kereta,_
"However, a spike in COVID-19 infections prompted India to tighten restrictions on Thursday, including night curfews in all major cities",_
Reply W87 now!,_
mcm jumpskirt,_
"Arrived just in time in good condition, really appreciate your service",_
Memnag pUas hati sngt tq la ye,_
sekarang ni charge fon pakai ni je tak pakai cable dah,_
Tapi patutnya letak sticker fragile,_
"For the kits, it&$HASHTAG$",_
"Baranh sampai dengan selamat,x de apa ii yg rosak,tq seller ramah",_
$MENTION$ tr,_
terima kasih nanti boleh tengok2 yang lain n beli lagi,_
kain nipis je tp xpela murah je pun,_
Yang ni cepat sampai,_
"Terima kasih seller,item dah smpai pghantaran pantas,kain corak cantik nti boleh repeat lagi",_
cume ade kemek belah atas tu,_
Apa2 pun service dia bagussssss,_
"Yesterday order,today Already received",_
Bad experience as seller ignored and blocked me even i asked for a discussion to change size to 45 mm for my straps for Apple watch Series 7,_
Batalin stelah 3 hr org bayar,_
Reiko QuahMiKo JiNgVejenie ChinYounis PhoonKelly Lee,_
kalo nk rse cakoii meh la kt kg delek klang,_
Beli untuk kakak pulak sebab terbaikk sangattt recommended !,_
Tinggi 152cm berat 57kg,_
Effectiveness:Try beli 2 flavour,_
Will try to use for a time and give comments again,_
Sooo lawaaa beli utk adik,_
Motorola Edge 20 Pro?,_
Baju semua nyaa okeyy je dengan suami,_
Good product qualityyy and good value for moneyyy,_
Suitable for pregnant woman in her third trimester,_
"Barang sampai dlm keadaan baik , penghantaran cepat",_
g keje ke,_
"Berdasarkan kepada pemerhatian output pengeluaran ketika ini, pengurusan mengunjurkan pengeluaran FFB bagi tahun kewangan berakhir 31 Januari 2022 dianggarkan 95 peratus daripada kuantiti yang dicapai dalam tahun kewangan 2021 selepas mengambil kira impak program penanaman semula yang sedang dijalankan sekarang, kekurangan tenaga kerja dan faktor musiman bagi trend pemangkasan, katanya",_
baby pn tak reject,_
Quality:good price and quality,_
Tp tu la seluar rosak pulak,_
Quality:thin n bad,_
This box arrived the latest by sokay overall im pleased with the pricing n products,_
xtaw laa macam mana rasa nya kan,_
erika,_
Size muat ikut keperluan,_
Me to be a super hacker?,_
risau jgk nak beli sbb mahal,_
Thanks for fast delivery n free gifts,_
Nota good,_
nampak cantek kualiti blom tau nengok berapa lama bertahan kale die menurun atau tidak,_
Cheaper than buy at shops,_
"GUANGZHOU (Xinhua): More than 33,000 residents have been evacuated to safe places as Typhoon Lupit, the ninth one this year, made landfall on Thursday (Aug 5) in coastal areas of south China's Guangdong Province",_
Kita try cuba test dulu tengok anak bulus kita makin gebu takk klau oke boleh repeat beli lagi,_
Barang dah sampai dalam keadaan baik dan pembungkusan pun ok tq seller,_
tq seller cntik sgt,_
"Eroding that trust will transfer not just to voting in the midterms, but just overall disengagement from your government",_
Recommended beli drpd seller ni sebab laju!,_
"Pernah beli sebelum ni, okay je - fast delivery, material okay cuma warna seluar cepat luntur",_
Terbaik2 pakai usb nak charge,_
SJE CHAT SELLER NAK KAN KEMAAFAN DR DIA,_
Works fine and it heats fast,_
"Sudah tentu ia dapat menyediakan ruang perkongsian ilmu dan interaksi antara satu sama lain serta menjana cetusan idea dan sumbangan amalan terbaik bukan sahaja dari kaca mata profesional penjagaan kesihatan, bahkan penggerak industri, penyelidik, ahli akademik, penggubal dasar, penguat kuasa dan mereka terbabit dalam bidang kejuruteraan biomedikal",_
"As for the cash rate target, UOB believed wage growth would be a crucial factor to the policy outlook, going forward",_
Received in good condition anda last delivery,_
Size is bit small even for XL,_
kalau kat pasar malam smpai rm10 nii,_
The items received in well condition and I believe my kid will like it so much,_
muah kt bella,_
Wrna dia pinkkk pinkkish gituuu lawaaaa sukaaa bangettt heehhe,_
Barang sampai dengan selamat tadi dah try main dah memang ok,_
saya tinggi 146cm pon rasa macam singkat sbb pakai atas sikit dekat pusat,_
Good pen and beautiful ball thank you for the beautiful item,_
Barang terbaik perhantaran cepat,_
Babat Champion,_
awal sampai2 jam rosak tapi bila mesej seller seller reply dgn baik n ajarkan mcm mana nak refund,_
Fall in love with this dress!,_
Just still not try yet,_
Functionality:Kotak keras sesuai utk kuih muih,_
"Recommande,",_
I would very much like to have one Inbox,_
I drink this everyday now n my first bottle dh nk abes,_
‼maaf gambar tak sempat nk snapLoveeee sbb lawaa,_
Stream pop mv,_
"Kl di bawah minimum order kena fee, atau order brp pun semua resto kena fee juga (khusus grabfood yaa) Lainnya okelah",_
boleh letak dlm dashboard kereta,_
So far dia suka gila,_
CANTIK SKIRT,_
Colour pun cantik sama dgn gambar,_
"Tengah tu bleh cbut if tknk, ni baru beg skincare, belum beg makeup lagi byeee, love sangat",_
So boleh terima shipping fee nya,_
thank yousellerz,_
Sanitizer sudah sampai,_
"Barang dah Smpai,",_
"Thanks seller and and excellent service, good service",_
Tanjong Sepat assemblyman Borhan Aman Shah (pic) and Sungai Kandis assemblyman Mohd Zawawi Ahmad Mughni will be sworn in before Selangor Ruler Sultan Sharafuddin Idris Shah at Istana Alam Shah here at 9,_
Thanks for the items received,_
Purse dah sampai and cantik,_
Being drinking this tea for a long time and it's really nice serve in chill,_
s still a Xiaomi,_
Helmet dh smpai smlm,_
Barang kemas yang buat saya tau dimana ia adalah satu kalau bilas sehingga ke hari lain2 dah lama tak jumpa pun aku nk bayor gaji dan elaun yang dikeluarkan dalam tempoh yang sama juga dengan berwuduk dan sini dah lama je insyaallah akan dtg ke dalam rumah tangg mereka,_
Belum trai lgi,_
ari ni tghri smpai,_
"biskut sedap, rasa lebih kurang biskut gerry!",_
Will buy again again and again!,_
I want to change adapter and it slow and i want to ask about admin system is also not read my message,_
Kain ringan tak tebal dan tidak panas,_
"The Nasdaq on Wednesday closed more that 10 below its November all-time high, confirming it was in a correction",_
Wrap kemassss mantullll,_
Grab gak jelas,_
Kasut mmg cantik elok,_
"Bzbee,",_
Dah la refund pun lembab,_
Pigmentation:cair lil bit but its okay still nice kalau pandai alter,_
barang samapai dgn baik,_
belt semua lawa2,_
Anak kata perisa ni sedap,_
Kali ni lock yg kecik² je,_
However it is really mini bottle!,_
Fragile jatuh terus berderaiiiiiiiiikkkkkkjjjjbsjsnsbsjs,_
Display: spot spots pleaseket,_
"Penghantran pantas, barang berkualiti 🥰 tq seller n shopee",_
"Kain pun elok, cotton cantik je",_
packaging pun di wrap dgn bubble wrap,_
"sakit2 urat,sakit lutut sakit tumit dah berkurangan",_
Kali ni beli untuk mak saudara pula,_
beg nampak jenis tahan,_
Items wrapped with bubble,_
Nice wrapping as the seller wrapped all the angles of the box,_
Second time beli dgn bam,_
Bagusssssssss bagussssss bagussssss bagusss,_
Suri rumah sepenuh masa pon kena elok2 ehhh,_
"Performance:barang selamat sampai, berfungsi dengan baik",_
nnti boleh repeat oder lagi,_
Yg berbadan jenis besar bahagian atas sesuai cutting ni,_
Takde kena mengena pun tapi barang ok ok ok ok ok ok ok ok ok ok ok,_
harap2 takda masalah,_
Can't buy any beverages don't event get into the cart then say payment fail,_
Koko krunch tu pula buka² dpat warna pink,_
:) pemilihan kaler yg diberi oleh seller tk berapa puas hati tapi tak pelah,_
Gambar bermutu tinggi,_
"10, Expiry on 10/12/2024, Item received in good condition",_
Memang spare untuk mudah xyh cari2 kat kedai dahh,_
I donno y i beli 1 je,_
memang kena dengan seleraa,_
Padan elok dengan anak umo 9tahun sbb dia besar,_
Btw seller cepat giler hantar,_
Color pun cantik jee thank you so much seller!,_
"Good wrapped by the seller, sec purchase from this store the matte one is best for gaming thankyou 🥰",_
Bang 4,_
1st time buy not sure the cutting,_
It looks stunning though,_
Quality:As promised,_
penghantaran pun ambik masa kurang 48jam nk sampai,_
Saiz yg baik dan warna yg menarik,_
Azhar Khan I am from Hyderabad,_
barang lengkap dan tiada rosak,_
"seller terbaik,barang pun baik",_
Texture:halus sikit than biasa,_
Quality:very sturdy,_
Penghantaran sepantas wabak covid,_
Barang bagussssssss,_
Klu suami suke nnti boleh shopping lagii,_
Quality:Mantakk,_
tolak coins n free shippingg mmg berbaloi2,_
fast delivery and friendly,_
sorry gambar xkaitan,_
dpt masa flash sales aritu,_
maaf kerana gambar dan vid tiada kaitan,_
Product is working fine without any error,_
Boss excellent service,_
"Meng Yueming, a researcher at the Liaoning Academy of Social Sciences, said in a Global Times article that the RCEP has also laid a good foundation for the negotiations on the China-Japan-South Korea free trade zone",_
That's why I consider content moderation to be primarily a tool of brand management for firms,_
Memang worth it nak pakai raya nanti,_
Apple watch ka clone unboxing karo,_
Have a nice,_
Semua helokkkkk cantikkkkk mur2 puas hati best glerrrr mantullll superbbbb yeahhh jom nari2,_
I can tell that's not authentic Thai boat noodle,_
puas hati walaupun lambat,_
Can u just give a box for the shoes,_
Nasib baik muat amek size L ngam2,_
"Very fast service, good",_
"2 in the first quarter compared with the final three months of 2019, the Cabinet Office reported yesterday, with business investment showing more resilience than expected",_
At the end barang selamat sampai setelah hampir 2 minggu dipos oleh penjual,_
sy bygkan warna light pink tp bila sampai lebih ke arah peach,_
warna & saiz semua ok ngam,_
No dented &amp,_
"Sehari aje,",_
First time purchase for my newborn,_
Barang2 semua sampai dalam keadaan baik,_
besar la juga,_
Fast delivery good product thank for the gift luv it thank you thank you Seller TQ,_
"Wkwkwkwveiebd rjrhr r8e db8dbe dueifheh3h4u4uruu4ururuururhrbr ehdjic9eoq91nz b icifisjdidirirfuutieie5irwiwtkfzmafktejrajfajarjadnfn,gltkrDbq45ank",_
takde barang katenye,_
delivery pantas walaupun dari luar,_
why is the image resolution so low at these zoom(1,_
"Cantik, harga berpatutan, yg paling penting bby sgt selesa duduk dlm tu",_
"However, the risks to inflation are skewed to the upside, Schnabel said",_
All individually packed nice,_
Sebab wire hdmi lumos pendek sangat beli la yg panjang terus,_
Items received successfully and the product quality is very good,_
good and fast Delivery,_
Need to more easyer reached to customers hand,_
Saiz ni ok,_
Excellent!>< Received it well in good condition!,_
A really good phone,_
new date for expl favorite the taste of chocolates,_
Effectiveness:lap² perkakas baby,_
Various frames,_
Dia pos barang yang kita tak dapat,_
"Honest review, seller sangat responsive!",_
"Tilam tak tebal mana, beli utk alas baby bednest ni je",_
This shop provides good service and delivery,_
Terbaik produk sampai ikut masa harga lebih sikit tapi masih belum guna,_
easy for kids to wear,_
"Alhamdulillah kasut selamat,penjual lmbat pos barang niy adoiii sampai nak cancel baru pnjual kasi lps barang",_
"KUALA LUMPUR: As part of its efforts to improve the annual budget preparation process, the Ministry of Finance (MOF) has agreed to publish four public consultation papers (PCPs) and invite the public to share their ideas for Budget 2022, Finance Minister Tengku Datuk Seri Zafrul Abdul Aziz said",_
Have purchased from the seller many many times already,_
"18 / 1 placed order ,",_
Beli warna white cantikkk,_
- NSTP/Danial Saad /> Masyarakat Cina tidak melepaskan peluang merakamkan gambar kenangan sempena sambutan Tahun Baharu Cina di tapak warisan dunia Georgetown di Lebuh Armenian,_
"Kecil comel cute but a little bit heavy, maybe bcoz of 20,000mAh",_
Baju pun labuh dan sopan,_
"Barang terbaik, sampai pun dalam keadaan yang baik, tapi bukan fast charging la",_
Tali panjang and comel sgt,_
cantik material dia🥰,_
heepii,_
"The price of the bag is pretty expensive, there are three rules / zippers for my child likes it",_
Moderate :) thank you seller!,_
"they said they refunded it but when i went to the bank, foodpanda did not even initiate the refund",_
Value for Money:berbaloi sbb murah je,_
Previously bought from this seller,_
Gelang oke laa,_
"Can't read the 64gb Sd card , seller sent another one to replace but still not working , the camera can't read the SD card at all,",_
Warna sangat biru,_
Cleanliness:90,_
Selamat smpi kat kg untuk mak tersayang,_
"Bila buka apps ni tak keluar apa2 menu pun, dah update still sama dah beberapa hari macam ni",_
Functionality:fit perfect for single bed,_
"Kenapa ya, saya di suruh update, udah di update tp ga selesai updatenya, udah 100 pasti ngulang lagi ke awal",_
Cantikkk will repeat 🥰🥰🥰🥰🥰🥰🥰🥰🥰🥰🥰🥰🥰🥰🥰🥰🥰🥰🥰,_
dh bnyk kli repeat kat kedai ni,_
Absorption:great!,_
ngam2 sampai mase birthday kawan,_
Well wrapping too!,_
Its very user friendly and was very quick to set up,_
Nick Lee,_
_FREE SIZE_,_
Tempat sangkut tuala n alatan mandian sedikit ringan,_
Nasib baik betul warna,_
"Baju cantik, kain elok,",_
"RM8 per kg,",_
Sally Phoon Lim Yoke Wah Lily Phoon,_
very hard to order food,_
trma ksih ya,_
Barang dalam keadaan baik berfungsi sejuk terbaikkkkkkkk,_
tpi bole pkaiii,_
baju okay muat dan kain bagus,_
Next time nk oder lg,_
"The item is in good condition, good packing",_
Terima kasih Momo house 🥰🥰,_
Wrapped so well by seller,_
simple design,_
Received the item in a very good condition,_
Kualiti okay mcm kain jersi tu tapi agak panas sbb tebal,_
Gambar takda ksna mengen but nak coin jaa memang miat walaupon badan besaarrrr suka sangat berat dalam 70-73 la ok sangat sedap ja pakai banyak banyak komennie sebenarnya nak coin ja,_
boleh la wak pkai raya nti btw selamat hari raya semua 🥰,_
Effectiveness:good good good good good good good good good good good good good good good good good good good,_
Harga pun murah boleh beli lagi,_
tq sellerIn love sgt dgn baju ni dah 2x beli,_
nantu boleh beli lagi terima kasih,_
sebab ingat kain dia tak best,_
ninjavan boleh bertukar siputvan,_
Xin chào,_
Hanya dpt 1 shj,_
yg pedas tu pedas gilerr,_
Just tekan dua kali bahagian atas pencil untuk on/off,_
Overall terbaik recommended sangat,_
everything ok and good,_
Fast delivery and good condition for the product and good value for money,_
Yg penting selesa ketika solat,_
Jgn ragu2 oki!,_
Exelent servis by seller,_
THANKSSSS THANKSSSS,_
order byk buat stok,_
"In shaa Allah, nnti dh abis stok, kome beli lgi",_
"Kain bedung besar, corak cantik, jahitan kemas",_
"Penyokong privasi mengalu-alukan perkara itu, tetapi ada yang bimbang ia sekadar usaha memperbaiki imej syarikat tersebut di tengah krisis perhubungan awamnya baru-baru ini",_
The rainbow design only received two but my order I pay for 3,_
as key beneficiaries of Petronas' domestic activities over the next three years,_
Functionality:Untuk my baby yg senang masuk angin,_
ank ckp selesa pakai Dan muat dgn kaki nya,_
Value money of the goods,_
gambar tiada kena mengena sbb sudah dilekatkan pada fon dan tgh pakai so takleh nk tangkap gambar dan rekod,_
Cleaning Effect:Not using yet,_
Senang simpan dlm bag dan bawa mana2 pun,_
penghntr mmg cpt aa,_
Sangat sangat murah,_
Sory gmbar takdak kaitan,_
"Namun pada pusingan pertama kejohanan terbesar dunia itu, Olahragawati Sukan Malaysia (SUKMA) 2018 di Perak gagal mengulangi pencapaian berkenaan apabila merakam catatan masa 11",_
Not going to lie but the pineapple cations are really good,_
Jahitan pun kemas and guna kain nila biru,_
Kesel2an terus sama driver jadinya,_
Not Palazzo,_
Semua okey kecuali plstik tu dah koyak bila dah smpai,_
semua muat dengan ank,_
Fast delivery service function well,_
Macam knitwear,_
Sejadah mcm karpet velvet,_
!stay safe and take care during the pandemic,_
"6bil through Budget 2021 for 434 development projects, including 79 new projects in Johor, says Datuk Seri Mustapa Mohamed",_
Good service good quality good value good product good price,_
pembukusan dalam kotak,_
9/8 sampai,_
Penghantaran mengambik masa,_
Second time beli trs bwk kedai tukar,_
"Xhal, boleh potong",_
However kat hujung carpet ada rasa lembab sikit mungkin terkena air tapi x effect pun,_
Jam sangat okey pos pun laju beli jgn tk beli nnti rugi yeah,_
Tetapi Ada sedikit kekoyakan disudut bahagian bawah hoodie,_
"penghantaran seminggu jugak lh tggu, tapi ok lah",_
"Thank youu, overall puas hatiii, toblerone cair teruk hahhaa yg lain semua okk",_
Beli 2 helai je dulu sebab risau awning x elok,_
Rommel Fox your favourite,_
will update again if it works 🤭,_
Utk nk kurangkan berat bdan,_
no more 2nd time,_
kena sendiri pick up kat corier,_
Barang padu tapi fit dan labuh skit yg lain quality semua ok postage pon laju pape pon thank you seller,_
Akun anda ditangguhkan,_
So nice omg!,_
The airmen decided to have their party at the club and they were a bit of a relief to be back in the office with a team of a team who is a very well established and a very talented team member with a wide range of skills 31,_
tekstur tak sama macam kat watsons punye,_
Meet mee chili pan mee tomyum dry noodles received in good condition,_
Harini order besoknya udah sampe barang terbaiklahh,_
