Sentence,Tagged_Sentence
"Dia tak rosak atau tak calar ,dia just protecter",_
Produk xde yg bocor,_
"These little toys are fun, but the Sticky Hand will lose color if stick on the ceiling",_
Saiz XL dia kecik ek,_
"Isi minyak fulltank, Bismillah kita gerak",_
Bagi free gift pghntaran cepat nnti repeat oder,_
94 for 2pcs,_
"Line digi nie teruk , sy bayar bil mahal² tapi line mcm siput , harap pihak yg berkenaan ambil laa tindakkan lanjut ,",_
"(triple underscore) I am not giving up trying, for your give way",_
"However handle quality dosen't look too good, also the bag capacity is small, only able to put few stuffs",_
walaupon dr indonesia,_
Received in good condition and the delivery guy is very fast and reasonable prices for the item,_
Functionality:barang yang sangat berkualiti,_
Handsock cantik sgt,_
"Sorry, video x ada kena mengena",_
Order arini esok smpai,_
The magnet is well function,_
tp alhamdulillah semua ok,_
Will repeat order other design,_
This is a free gift sample,_
thank you thank you same as measurement,_
Seller wrap with bubble wrap even though there's no glasses product,_
The most adorable tech person aapke true videos ko ek saal se follow karke bohot kuch seekhne ko mila love u and support u till the end,_
Good product quality nice product super fast delivery up till the end,_
Murah dan seller pos out cepat,_
Selalu dah beli skirt kat sini,_
"Love the bag, murah!",_
Items well packed and came good,_
nipis sikit tp sesuai dgn hrga,_
Terbaikk terbaik terbaik terbaik terbaik terbaik terbaik terbaik terbaik,_
"Hmmm brg selamat smpai, semua okeh",_
"But it was forced to close in March 2020 as the Covid-19 pandemic took hold, with its doors staying shut for almost a year",_
kipas belikan utk org,_
Gotta repeat it again,_
Kuran Best lah kalau ikutkan,_
"2nd time purchased this spare part and previously, iron working well after installation",_
gggggggggggggggggoooooooooooooooooooooddddddddddddd,_
can't trace an address in Dubai,_
Kualiti ok jelah,_
Shopee sell mamee cheaper than mall,_
Easy to use and tak payah nak set masa pastu terketek ketek nak tekan,_
All tea is complete and cannot wait to start consume it,_
Bajet rm10 haahaa ngam ngam soi,_
"Delivery fast, packaging also ok, easy to install",_
Kya aab gta5,_
"Baju serius cantikk,tak rugi beli",_
"Barang dah sampai, sudah try cantik sangat², ada rhythm synchronize, ada butang mode boleh pilih², brightness boleh adjust, suka sangat²",_
Maybe should put any weight on it,_
Saya beli nah,_
"Before this beli yang travel pack punya, tak cukup, now beli yang pack besar",_
Better make it as ice tea,_
Items came as per ordered,_
xde mslh lg,_
"Size M dengan L tak ada beza sama saja, mana yang pakai M lebih elok pakai L,yang pakai L lebih elok pakai xL atau XXL kalau nak tutup belakang ingat kan L besar rupanya kecil saja macam pakai M,thanks seller baju cantik penghantaran dari luar negara pun pantas",_
"I think you should review the normal 13 first, cause most people will buy that one",_
Mantap Abisss,_
appreciate it,_
"habuan utk anak² menakan main, asyik dok hadap fon, sekali sekala bg depa main kt luar pulak",_
fast delivery good packing love this product,_
dan kedai ni paling murah thanksss,_
This Chinese New Year classic symbolises wealth and prosperity,_
baguss sangat kasut nya🤍,_
Overall setakat ni saya berpuas hati,_
Djskwwowowowkwks tq hsshsjsnsnwkwlwoaksksndrbtbyvyvyvyvyvyyvyvyvv,_
"Adik saya puas hati, mak saya puas hati, saya puas hati",_
Fyi (file system is:EXFAT),_
bg bby main,_
be/0kReBbsiHOg>$URL$,_
Expire date on 2022,_
puas hati dan sangat selesa,_
Material:walaupun bundle tapi quality dia tip top la,_
Плотность и солёность бульона не даст,_
Aroma:Bau ok kena dgn jiwa haha,_
toys ok baby suka,_
"Waiting a month, finally Items received in good condition",_
Wat jogging je,_
Tk hidup,_
Siapa nak diet nak kurus boleh lah beli nak buat yoga ke sennag sikig klau guna tikar g,_
Shipping terbaik,_
Grab 2helai semasa offer RM39/item,_
haha series seller memang terbaik,_
Aq dah naik lebih 25 KM,_
nak beli boleh wasap 0196299343,_
"Goods received in good condition, good product quality, thanks for the free gift",_
"Bubble wrap, Terbaik,",_
Baju ni beli untuk anak dara,_
"alhamdulillah cantikk , penghntrn pon cepat , sngt berbaloi , thankyou seller 🤗!",_
Seller malas nak bungkus betul2,_
Tapi kali ni sangat lambat ship out,_
Kualiti jgn cakaplah,_
maklum la beg murr murr,_
Order 26/2 sampai 27/2,_
អរគុណសម្រាប់កាដូ7$ពីFood Panda,_
xcepat sangat so kalau urgent beli kat kedai dulu,_
Sesuai guna harian,_
"s going to be used primarily in a single location is something that really bothers me about this being battery powered - the thermal cycling will degrade the battery faster, and we have too many battery powered devices that will go in a bin after a year&$HASHTAG$",_
00pm byr pun terus post,_
bersihkan meja study,_
best value fo money and it was cheaper,_
Tiba2 esok dah sampai,_
yeay dh ade bju raya,_
good product quality good value for moneyfast deliver excellent shopee express,_
Overall is worth it<3,_
"In addition to the incentive factor, the two main factors affecting the increased participation in 2018 are existential anxiety and social bonds",_
Berat 62 size XL ngam,_
maap dev sy mau login pake email tp gak bisa msk trs malah kesambung ke akun lama tp akun lama itu udh gak ada di email sy,_
: 600 X 390 X,_
Cuma team pembuatan sticker mgkin kne upgrade lg sbb corak dpt ok je tp x smua betul2 sama,_
Sorry tau gmbr dgn video takde kaitan,_
the design so slick and cool,_
Barang sudah sampai dengan selamat dan dalam keadaan bajk,_
Order received in good condition very fast delivery thanks seller,_
yang ni confirm original,_
Puas hati dgn pembelian!,_
nampak nipis jer,_
Brg cantik n nampak elegant,_
No second thought,_
Barang sampai bagus terbaik suka lawa baik sesuai,_
"oke jgk la , terbaikkk tq seller",_
wpun sdikit delay tapi puas hati,_
cintan,_
Sangat berpuas hati dan cepat sampai,_
Mmg mantappp bebbbbbbbbbbbbbbbbbbbb truss dpt,_
Love 🤍 cantikk sangat,_
Chat dgn seller pun on je,_
kain jenis lembut n sejuk,_
Condition kasut baik dan berbaloi dengan harga cuma penghantaran dari seller je lambat sikit jadi kena banyakkan sabar nasib baik jnt laju,_
"Sini murah sikit,",_
3kali dah beli kat shopee mart,_
beg ni sumpah cantik and clean design dia,_
paki yg ni jala labuu 🤪u,_
"Prior to joining CIMB, he was the head of Group Wholesale Banking at RHB Bank Bhd and was also the former executive director and group chief financial officer at Malaysia Airlines",_
"Johor Public Works, Infrastructure and Transport Committee chairman Mohd Solihan Badri said the request was conveyed to him by Singapore's Consulate-General in Johor Bahru, two months ago",_
delivery option nai ara,_
So far setakat nie ok sahaja,_
Simpel dan cpt,_
Chucky nya mahal karena ada tulisan suprime,_
Teramat2 puas hati barang rare,_
Worthy initial review with unworthy smartphone,_
THE ALBUM IS SO PRETTY AND ARRIVED SAFELY WITH NO DEFECT AT ALL LOVE !,_
papepun ok,_
"The nude colour was very nice,",_
Beli untuk 6 acc,_
Snowcap nice gila da dua kali repeat order,_
Taste:love this spicy ramen,_
"Baju cantik,kain ringan & berbaloi harga murah",_
Semua lengkap dan perfect,_
maaf kerana gambar tiada kaitan,_
One of the most patient seller i have dealt with !,_
Still can be access with some patience,_
"zip dia mmg lembut, pastu compartment bersepah bnyk gila",_
"Very cute and soft lashes, fast delivery and satisfied,",_
"kain sejuk,berbaloi dgn hrga",_
Fast delivery kasut lawa gila mcm kasut mahalll srs puas hatii & harga murah,_
Functionality:door closers,_
Wisma Putra dalam kenyataan semalam berkata lawatan itu akan dilaksanakan dengan pematuhan penuh kepada Prosedur Operasi Standard (SOP) COVID-19 yang ditetapkan oleh kerajaan Malaysia dan Singapura,_
Its really and came in good condition,_
"kain cantik, warna pon cantik, delivery ok pantas tak lambat overall good",_
tapi tak dpt lock byk,_
Try dlu klu sesuai akn repeat order lg,_
Good packaging no dent on box,_
So nice thankyouuu first beli yg hitam then material dia nice repeat yg grey ni,_
tp bila dh taw cara,_
"500 sectors, led by consumer discretionary and industrials, which both rose about 1",_
So now I'm stuck with a useless set of lights and the seller is not responding to my messages,_
Kena lipat,_
seller wrapped tebal eventho buku tu kecil je,_
adik cakap ok,_
The size xl is abit small than the usual xl,_
Ng Ziliang,_
Kli kedua bli di kedai ni,_
cuba la pakai elok ke tak,_
Barang cepat sangt sampai,_
so rezeki anak buah la dapat baju tu,_
Barang dah sampai penghantaran cepat x smpai 5 hari dah smpai bag nya lawa,_
"What an incredibly talented man,",_
Kain beg hitam ni tebal sikit berbanding putih,_
Good product and quality as expected kids really enjoyed,_
"Product was received in good condition, haven't tried out, TQ",_
"However, delivery took quite some times for this order, probably due to 7",_
Items were packed well with minimal damage to the packaging,_
"86, according to Refinitiv data",_
51 million via a renounceable rights issue of seven-year redeemable convertible unsecured Islamic debt securities (RCUIDS) and is planning to raise up to RM400 million in additional capital this year,_
Pakaikn kt anak patung boleh la,_
so far satisfied with the coverage,_
my second time purchase this eyelash curler heated n i love it!,_
s my one question,_
Orang ramai terutama pemandu turut menyedari keadaan kualiti udara yang kurang baik,_
I usually wear shoes size 39 but for this skechers shoes,_
"Barang mntap , cepat gila smpai , tq bos",_
Tq for the freelock & free skirt mak,_
thank you &amp,_
last2 ptong mcm tu,_
Ingt nk tggu sampai 3 jam,_
very gooood packaging,_
kualiti barang setanding la dengan harga,_
"Baru je order, seller terus chat",_
Just hope seller can consider to give sambal chili to sampling together next time,_
"Value for money, fast delivery, nice for birthday gift for brother or sister,)",_
Terbaik cepat semalam order hari ni dah smpai bagus seller cepat ninja van pun cepat,_
"gua pengguna lama grab,bahkan setiap hari saya memakai grab",_
*gambar &videk tiada kaitan* casing cantik gila nnti boleh repeat lgi sama mcm dlm gmbr penghantaran cept tq🥺,_
"very good, thank you seller",_
"Good packing without damage , take reasonable time to deliver",_
Tak cuba pakai lagi harap selesalah,_
amik size s ngam je,_
"We cannot stop the rain but if the pond can function, I believe it would reduce the level of water in the village during heavy rain, she said",_
"Quality:strawberi ,mangga,coklat,tiramisu",_
The phone working good,_
Takde gambar sebab tolong beli untuk anak saudara,_
Hmm nak letgo la sapa nak pm,_
It has just arrived and it is quite expensive with that price,_
seluaq ni cantik nasib ambik size 2xl kalau dak mesti ketat sbb ai peha besaq and ai berat 65 keatas,_
Lawa kain bedung baby ni,_
ingat kecik jer 🤩,_
Hoping it might live upto expectations $MENTION$,_
"Ape pn ok lah dgn hrga, seller ok",_
disyorkan kpd pengguna,_
"Thank you, semua baik produk bgus, tapi kenapa kasih warna yg sama sis",_
Btw this is my repeated order with same seller,_
rizalman tengok ni sahih jeles,_
"sy pengguna baru udah dibuat streesss gini, tolonglh diperbaiki padahal cukup ngisi kode otp sama buat pin doang udah cukup ngak perlu yg aneh²",_
"able to store lots of things, i bought it to store my blanket and bedsheet",_
Another 1 star,_
Secure packaging !,_
sy hrp pihak penjual dpt slsaikan mslh ini,_
Hard board sturdy finally found white cake board,_
"Nasib baik x urgent nk pakai sb tgh kuarantin,for sure akan repeat order kaler lain",_
4 kali dan saiz terbitan ditingkatkan daripada AS$1 bilion kepada AS$1,_
"dekat jari yg potong tu ,tak jahit claim balik",_
"For a taste of something different, there are Deep-fried Shrimp Balls with Almond and Cheese, Pan-fried Glutinous Rice Skin Dumpling and Chicken Feet with Thai Sauce as well as house specialities such as Roasted Pork Belly with Ginger Slices, Deep-fried Crispy Pork Belly in Rojak Sauce and Fried Squid with Salted Egg Yolk",_
"In a statement on Assam's arrest, the union said resistance would continue until the coup is brought down and its leaders are put on trial",_
16 sahaja,_
Repeat kali kedua 8 bungkus terus,_
Real biasa2 je,_
"Setakat ni seller ni jual harga murah , yang paling murah pun dah sold out",_
Effectiveness:good in cleaning and removing baby's poopoo,_
"Received with good condition and well packed, fast delivery and long expiry date",_
Buy it for my hubby,_
"Belum guna lagi, berbaloi beli",_
Material:kain ok tak tebal n tak tipis,_
So good so nice so beautiful comelllll fast delivery thank you seller,_
portion just nice and ayam bnyak,_
Telah selamat di terima dengan baik,_
Very recommended shop 🤗,_
"Gambar tiada kaitan tp servis brg,material beg tiptop",_
"Baby music dia okay, dah try semua elok",_
Saya terus bukak serta pasang dan letak kasut2 boot baru tu,_
"Barang sampai keadaan baik ,",_
Kualiti macam stroller mahal,_
kain dia nipis je sesuai dgn cuaca msia,_
The blaze erupted a little more than a month after a huge explosion devastated the port and surrounding area,_
Recommended to size up if your toes slightly bigger than others and want them to be comfortable,_
"baju ok selesa pakai,kain tak panas",_
"Selalu kene scam bila beli baju shirt cmni , tapi yg ni boekk",_
pemghantran cepat,_
"Hopefully it is durable, amen, thank you",_
"SINGAPORE (The Straits Times/ANN): There were 60 new coronavirus cases confirmed as of Wednesday noon (Aug 26), taking Singapore's total to 56,495",_
"Accordingly, the research house raised its ASP assumptions by 5",_
Cantik murah berbaloi la wehhhhh hahahahahahahahahahahahhaja,_
Tbl dan tape kuat,_
"Semua cukup, Thank You",_
I have never tried to cook only millet as porridge,_
🤣🤘🤘🤘🤘🤘🤣🤣🤣🤣🤣🤣🤣🤣🤣🤣,_
Cantik Dan lembut baju ni,_
saya berat 58 okayy cun baju & seluar,_
~(+🤣 :(🤔 2 🥄🥄🥄 ~🧐🧐,_
Ape² pin tq seller,_
sounds dia pun okayyyyyy x crack punnn aarrgggh suka2,_
Bagi yang cepat berpeluh sesuai pakai baju material ni,_
"kualiti baik, anak pun suka!",_
? My Heart:🤔🤔🤔🤔🤔🤔🤔🤔🤔,_
Now grab the price so expensive just 2km the price is rm 13,_
Material:kena bijak utk pasang sendiri keke,_
NORD 2 has got major upgrades,_
hijrah itu ada turun naik,_
Packaging memang helokk!,_
2 billion) EU antitrust fine that the U,_
bleh rpeat lg,_
rupanya basah,_
"too, is among the most beloved musicals",_
jatuh cinta tgok ni gelang,_
klw hujan lebat x digalakkan,_
selipar okay sangat ²,_
Overall terbaik dan pengalaman yang memuaskan,_
"Satay lockching belum try lagi,harap sedap",_
tpi okey la,_
Kali ni beli hadiahkan orang,_
"if ok, will repeat it again",_
3rd time beli kat sini,_
belikan utk kwn,_
ank bdan kecik muat tshirt nih,_
"The three companies are leveraging the same mRNA technology they used to develop highly successful Covid-19 vaccines towards other diseases, in a potential breakthrough moment for modern medicine",_
buku smpai dlm keadaan baik Penghantaran cepat,_
Material:bag da sampai,_
"This is more to bright blue turquoise, different from picture",_
Con subtítulos en español,_
"Komander ATB 2, Brigadier Jeneral Abdul Karim Ahmad, berkata tekong darat terbabit bagaimanapun berjaya meloloskan diri sebaik menyedari kehadiran Tim QRF",_
mnatap sangat membantu,_
Ok k k k kk k k k k k k k k k k k k k k k k k k k k k k k k k k k k k k k k k k k k k k k k k k k k k kk k k k k k k k k k k k k k k,_
Please beli dekat sini,_
Delivery was super2 fasttttt and worth every penny spent of course,_
"Fast delivery, product received in good condition, will buy from this buyer again",_
"baju kaler emerald, tp ntah kenapa kamera ni problem",_
Qualiti mmg berbaloi sangat dibandingkan harga,_
"nak kurangkan pedas, kurangkan sos gochujang",_
saya rekemen untuk sesiapa yang nak beli barang ni,_
"saya tak cuba lagi tapi nampak kain dia elok walaupun sebelah dlm dia nmpk mcm plastik sikit, ye lah kalis air kan",_
"Bagus, kain lembut, penghantaran laju, terima kasih ye",_
"lampu mmg nais, terkejut sebab murah but memang nais teruk",_
"barang cepat sampai,kualiti bagus,corak semua cantik cantik🥰",_
delivery ambk masa 3hari utk sampai,_
puas hati powerbank ni sekali dgn cable cas,_
semuaa okey cun elokk,_
Silap shipper,_
barang semua cuteee !,_
"Tetapi, penghantaran menggunakan shopee express mengambil masa 1 minggu untuk diterima, sangat lambat servis oleh shopee express",_
Murah Dari market luar,_
"brg sampai cepat hrini oder esok lusa smpai , lampu sensor , warna warm light , versi charge , lekat tu guna magnet so senang kalau nk amik balik utk cas , usb disediakan",_
Rasa lebih pekat compare supplier / brand lain,_
Cun cun ja,_
00 pun,_
Bungkusan :,_
saiz s ngam² di tgn yg kurus ni,_
Nice quality and original,_
"Kain tebal & sejuk, warna cantik",_
Saya suka jelas je dengar,_
doakan saya tak gelap ye aminnn,_
pokus kebonekanya,_
skru xdisediakn,_
Considered as fast delivery,_
"Tq seller it's a very nice design and good looking product,Tq",_
Manik pun cantik,_
Suka gila dgn warna2 nya,_
Gambar pon cantik je kena dengan harga,_
Anak 3,_
height : 158cm,_
sudah diterima postage laju thank you seller,_
Item wll received,_
"Tq seller barang dihantar dengan cepat,harga berpatutan",_
"Geremm ,bolak Balek akun d tangguhkan ,",_
"Sementara itu, Ho yang juga ahli jawatankuasa pembangunan Persatuan Badminton Malaysia (BAM) berharap dapat bekerjasama rapat dengan badan induk dan persatuan negeri dalam mewujudkan platform lebih kompetitif untuk pemain-pemain muda sedang meningkat naik",_
Love how half of the comment section of every monitor review is people asking for a review of different monitor,_
Nnti nk repeat tp hrp xsalah kaler la huhu,_
Material: thickluman,_
harap on point tq seller,_
Cepat gila sampai!Beli yang ni sebb pernah pakai dulu memang best gila,_
dpt grab masa shocking sale,_
Thankiuuuuuu,_
I order adult facemask but I received children facemask,_
Laju drive sampai hilng kawalan 🤣 charge 3 jam main 30 minit,_
Dpt beg idaman,_
It's not enough,_
tudung ok je smua,_
"Mana taknya, sbb dr bukit mertajam, dia pegi ke kulim, pstu lajak ke kuala lumpur",_
"TQ seller, bungkusan sngt rapi",_
ran out until the money was collected for &$HASHTAG$,_
"Memang Baikk,",_
Kenapa skrung grab ssh nk dpt ye,_
- Timbalan Menteri Perusahaan Perladangan dan Komoditi,_
Bertambah lg 1 parcel,_
Nanti saya pasti akan repeatt sbb sangat murah & berbaloi,_
Cheap price compare to other seller,_
Getting ready for 5G and it can make me broke,_
"Bang unboxing mainan action figure anime sasuke, sakura, hinata, ino, dan kakashi pliss",_
saya suka sangat2 tq selle,_
ade 1 barang seller x bg tapi seller dah refund,_
LAWAAA SGT rasa menyesal plak lock satu je murah pulak tu delivery lajuuu thank you kak leen,_
kain tebal murah cantik,_
Nursing bra selesa,_
Hm nvm,_
Sbb takda balut apa2,_
silap order ni,_
Mgkin stuck sbb cny,_
Tapi 1 pek ada 10 je,_
Warna merah cantik herlok,_
Puting sangat lembut harga murah Anak pun sukat,_
"I was lucky that I bought some in bigger sizes but I will still have to fork out for school shoes, socks and new sports attire",_
Thank you mak thank you bapak,_
servis suma ok,_
items received in good condition and good packaging,_
Effectiveness:Tak tebal tak nipis,_
mmg selesa sangat2!,_
dpt haechan for freebies thank you,_
Agak besar tapi okey lah boleh pkai lama,_
"Thanks for the free gift (I tasted before, hopefully seller can give another taste)",_
njm kali ke 2 repeatt,_
"Hi, tq seller",_
Kotak tebal balit pulak bubble wrap tebal sgt2,_
recommended lah UTK yg duk kampg bnyk nyamuk tu,_
Tuala serap air dan jenis cotton,_
All d best,_
Secretary of State Antony Blinken on two major irritants ahead of a North American leaders' summit next week,_
You can fix the paperlike matte screen protector on top of your tempered glass,_
Very satisfied with the quality for the price,_
Not working because the device is rooted,_
tp berbaloi lh dgn harga,_
laju tol saller wat kerja,_
super laju barang sampai saya yg di sarawak ni,_
"Kuning cair , cantik warna dan materialnya",_
Sgt worth it to buy,_
Iz Halmi DORAEMON lh Hehhe!,_
tidak berani guna,_
🥰🥰🥰 baju da simpan,_
Kualiti kain elok sejuk jaa,_
"Thanks seller for wrapping the product very well, trusted seller",_
"Cleaning Effect:feel so gentle to skin ,the smell is so nice",_
"Durability:The best zip okay, beg tebal, colour nice and design perfect",_
SUDAH SETAHUN LEBIH SETIA DENGAN MINYAK RAMBUT NI,_
nxojcosixowixowixisisosbxakxjis,_
Barang smpi dengan selamat dan puas hati,_
TQ SELLER BARANG DA SMPAI,_
warna grey dia gelap sikit nak sama mcm warna hitam tapi overall barang okay,_
Ordered on 18 Dec and received on 20 Dec morning,_
tebal senang pasang thank you seller nnti boleh beli lg,_
panjang betul,_
Purchase it for me hehehe the size suitable for kids & who has small face,_
Better quality than my laptop webcam,_
Kecik rupanya kipas ni,_
t since I spent most of my money on a laptop for college,_
"Apa² pun, Thank you seller!",_
Purposely choose this packaging for my betrothal,_
Tudung2 semua dah tak bersepah 🥰,_
Sekali guna masi slow line terutama luar kawasan bandar adooi,_
"Many are beaten, some tortured and killed, according to the United Nations and rights groups",_
"Silap i, cara tekan salah",_
Dh pkai hahahaaa,_
Look at packaging,_
"Pghntran sgt pantas,sy berpuas hati dgn cadar tersbut,sgt cntik",_
"Seluar cantek, jenis kain elok, sesuai utk pakai pi mane mane",_
Khemah dah selamat sampai,_
Thanks for the small free gift and angpow packet,_
good for normal usage,_
Shipment: 7/3/2021,_
THANKYOUU WORTH IT GUYSS I BELI SEN JE TIME TU AHHAHA SUKAAAAAA,_
overall smua okay quantity ckup color pun ngam soii,_
Ok hantaran cepat thanks,_
"In the 2021-25 raw material development plan, authorities said iron self-sufficiency would be significantly increased by lifting the supply of scrap steel to more than 30 per cent of the total, encouraging domestic mining and reducing steelmaking capacity",_
on the other hand thank you again,_
Untung guest tido selesa,_
overall is good experience,_
Bossku barang ambil masa 3hari,_
setakat pakai 3-4bulan ok la,_
"Ketika jatuh sakit, saya tidak selesa menghebahkannya",_
Show&quot,_
Hbrg dah smpai,_
Aku punya excited sume aku cuba hahaha tq cantik sangat cepat je pos terima kasih,_
"parcel received in good condition and the taste of mee are good, my kids love it so much",_
Tq jam tangan dh sampai,_
Dahhhh sampaiii comell jee terbaiiiikkkk penghantaran pun okelahhh tq seller,_
"With this price level, the pyjamas is matching to its price",_
Very cute and nice decent delivery time,_
thank you seller sy beli,_
tp sayang lmbt jgk ye smp ambil masa 5 hari,_
Alhamdulillah dh smpai cantik-cantik semua kali kedua beli semua cantik-cantik murah-murah sama je kualiti beli dekat luar yang harga lebih mahal,_
Selamat menyambut bulan ramadhan almubarak kepada umat muslim,_
amik saiz L dan yg lg satu tu xl,_
Kain nya nipis sesuai lah dgn harga boleh pakai,_
Got it fast,_
Really really love ur items so much much,_
It's actually scary,_
its takes almost 1 month to received,_
First time purchasing an album,_
First time try this product sbb tgok review byk yg best²,_
Boleh bawa solat juga,_
"Terbaik dah berapa kali repeat order beli dari kedai ni ,",_
very easy to use and great products,_
Seronok ank dpt jam,_
Expiry date is 21May22,_
Took about 3weeks to ship from China,_
harap berfu gsi dengan baik,_
Rxz untuk dijual,_
"everything is good, except logistic",_
Love the softness of material and love the colours too,_
"Barang sampai dgn kemek dan bengkok tapi boleh digunakan,perlu memperbaiki pembungkusan",_
Color is coollll,_
"Over 1,000 rangers have died in the last decade",_
Brg yg diorder smpai dgn slamat n ckup kuantiti siap dgn free 1,_
brg mmg bagus sngt,_
Ordered on 11 and got on 12!,_
"Tinggal taruk sdiri dlm paperbag , terus boleh bagi hadiah kat org",_
"SUKA SANGAT MAIN BOLA NI,",_
soooo full coverage thankkkkkyouuuuuuuuuuu love it sooo much,_
Lg murah beli gne voucher,_
"So beautiful, soft color and good texture",_
Slalu repeat order dngn seller ni,_
"Cntik do srs ptt beli, sorry gmbr x de kene mengene",_
50 kg,_
Belum try lg nnti dh try kita edit,_
"Disappointing,",_
smpai seperti yg dikehendaki,_
i thought its one set for whole bed,_
"It's so cute, convenient dan senang nak bawa jalan, letak dalam bag",_
Material sesuai dgn cuaca Malaysia yang panas ni,_
Terbaik seller pantas,_
"Worth to buy, the cheapest ringlight i found",_
delivery pun kira cepat jg,_
Seller bagi byk free gift,_
Foodpanda collecting your personal information Data First Case coming in Pakistan so please be careful Foodpanda app is very disappointed with your phone,_
apapun sabun beras terbaik,_
terbaik cepat sampai mudah barang nice terbaik cepat sampai mudah barang nice terbaik cepat sampai mudah barang nice terbaik cepat sampai mudah barang nice terbaik cepat sampai mudah barang nice terbaik cepat sampai mudah barang nice terbaik cepat sampai mudah barang nice terbaik cepat sampai mudah,_
tapi saye xpandai pilih size boocut saye pakai size 32,_
Takpelaahh i okey je tapi tu la sikit kecewa,_
Recited in good condition n recommended seller 🤗🤗🤗🤗🤗🤗🤗🤗🤗🤗,_
terbaikkk sellleeeeeeeerrrr tqqqqq,_
yang inner ikat memang selesa,_
