Sentence,Tagged_Sentence
"Pertama kali cuba jenama panasonic, sebelum ini jenama kdk sahaja",_
Dia berkenan dengan beg itu,_
Walaupon lambat ckit penghantaran xpa lah harga murah dan sedap,_
"Barang dah sampai, pembungkusan ok,",_
Bare ckup,_
Beli lebih dari satu jimat,_
kira berbaloi la dgn harga,_
Sgt berbaloi kalau ade air mineral dirumah setiap hari 🤗 bole contact sy 0183529408,_
Selene Lee,_
kinda one if my fav colour and one of my fav brands all the time i think Twitter: $MENTION$,_
botol cute sgtberbaloi dgn harga,_
"Layanan sdh sangat baik,cepat direspon,grab mantaap",_
Ordered on 10/10/2021 & received it on 14/10/2021,_
Felling VVIP shopping in this shop,_
"Taste:Good price, good quality",_
pos out sgt la lambat dri seller ye,_
tak rugi beli dua pasang,_
Buat letak tudung je,_
Dapat warna putih seperti yang dipesan,_
Kkb also cuteee HAHA,_
Sangat sangat cepat!,_
Zip semua ruang nmpk okay,_
Habes terkena tgn,_
naisss semuanya,_
harap cun la lps psg,_
brg tiada yang pecah,_
harap seller lps ni boleh wrap box dgn plastic or apa² yg kalis air sebab kadang courier letak parcel merata,_
semoga murah rezeki seller and teams,_
$MENTION$ fangirl yes i did :),_
x perlu gosok,_
"Simple packaging, barang okay la",_
Namun agak kecewa skit dalam proses pnyediaan dan penghantaran barang terlalu lama,_
Ok boss barang sudah terima kotak ada kemek kemek tapi ok sebab barang dalam yang nak guna kotak akan buang juga,_
Fast heating and easy to use,_
terima kasih penghantaran pon cepat,_
skirt cntik sgt2 cma yg color lilac tu jer la nipis skit kna pkai kain alas dlm murah plk tu seller baik dan prmh,_
delivery pon cept,_
seller btau bln 10/2020 ke atas,_
sorry pic & video not related,_
Murah beli d shopee plus dapat cashback lg,_
"Bole la buat basahan letak toiletries for travel, buat letak pad ke oantyliner ke ok belilah",_
hrge pum murah jg,_
Sllu dk pkai yg ada besi tu,_
received in a good condition fast service from seller,_
Tak secantik bag hitam lah,_
but 2,_
Tanya je apa2 soalan seller mesti tolong suggest kan,_
setengah bintang lagi sbb ada beberapa benang tak kemas and terkeluar,_
Going to repeat order soon!,_
Barang dah sampai kualiti baik lawa pehantaran laju 2 hari je,_
"Justeru, dengan niat membantu meringankan beban dan mahu mangsa bencana kembali menjalani kehidupan normal, Perbadanan Kemajuan Filem Nasional Malaysia (FINAS) melalui Kementerian Komunikasi dan Multimedia (KKMM) mengadakan Ops Bantu Hingga Selesai (Ops BAHIS) pasca banjir selama lima hari bermula Rabu lalu",_
🧡recommended to buy,_
1st time purchases dengan kedai ni,_
"Beliau berkata, ini susulan pertemuan perdagangan bersama beberapa syarikat pembuatan kenderaan di dunia yang sedang beralih untuk memperkenal teknologi EV, di Eropah, baru-baru ini",_
baju yang sangt berkualiti,_
Tapi air cepat habis kena selalu tambah2,_
• Bahasa Melayu,_
"8 , to $37",_
selalu beli Dr seller ni,_
Bau dia pun wangi,_
and Oxygen OS is great,_
"Sudah berkali2 & berhari2 dicoba,request otp trus menerus tidak berhasil dan selalu sama hasilnya yaitu gagal",_
"hijau cantikk, satu ji buat bagi anak sedare jeeee",_
Amazing fabric,_
Youbaby cream dah sampai,_
"Seller took 4 days to ship out but the delivery by DHL was really fast, within 1 day",_
Really simple & nice to use,_
"!delivery very fast,dua hari shj sdh sampai!",_
121420saiz,_
Boleh jatuh fitnah DAN DOSA FITNAH tu lebih besar dari DOSA membunuh,_
"It simple & 🤯stress free, ad free & free",_
"puas hati ,",_
"Rasa macam strong magnet lah, harapnya tahan lama pakai benda ala ni",_
Ke Li Tey,_
PSG's Germany defender Kehrer eventually made it 2-0 in the 53rd minute when he fired home from Nuno Mendes's cutback,_
Pnghntrn pun,_
cantikkkk sangatttt nmpk mcm exclusive gituu,_
Seller memang balut dgn bubble wrap tebal,_
"Seller, really appreciate your effort and thank you so much",_
Edited Nov 10 latest updates broke internet balance and I need to keep refresh this apps,_
nmpak macam satu set,_
Ketahanan xtahu bape lame,_
suction vacuum sgt2 kuat,_
Safety:tahan lasak,_
"For fans in other major cities of Malaysia, Edelweiss pop-up bars will be activated at outlets near them, he added",_
"Sementara itu, yuan China yang lebih kukuh terus menyokong pertukaran asing Asia daripada perubahan sentimen negatif",_
pasni leh pakai bw moto,_
sembang kari kedai ni,_
Repeat lagi penghantaran pun laju btw tq,_
"Baik, elok, bagus, okay, produk terbaik, semuanya sangat berpuas hati",_
Hsvshshsjshshshshhdjsjsdjhdhdjdjdhdjjdjdjdjdjdjddjjdjd,_
sy suka mouse ni sbb takde sound nyaa dan selesa guna,_
thankyou thankyou buat la slalu sale tu ye,_
30/12 oder 31/12 dah dapat barang,_
Mukin akan repeat lgi haha,_
Eddy Bella,_
so much cheaper than buying outside,_
"Fast delivery , TQ Seller",_
Barang sampai dengan selamat Barang sampai dengan selamat Barang sampai dengan selamat Barang sampai dengan selamat Barang sampai dengan selamat Barang sampai dengan selamat Barang sampai dengan selamat Barang sampai dengan selamat Barang sampai dengan selamat Barang sampai dengan selamat,_
Love it all the time!,_
"I can't wait to try the marinated powder, I tried the tomato soup case, but I not really into it",_
Dah lama teringin nak benda ni,_
Do not click the link,_
Tak pernah try yg nie,_
Brg smpi kadaan baik,_
Terima kasih barang sudah pun sampai dengan baik selamat keadaan pun selamat Kita bagi 5 Bintang barang terbaik,_
"Order yang sama size, tp nasib baik seller bagi yg size lebih panjang satu, yg ay order tu xleh pakai sbb pendek sngt, yg seller salah hantar tu yg bleh guna",_
Lukaku has scored in his last two Premier League appearances -- against Aston Villa and Brighton & Hove Albion -- following his return to the side after testing positive for COVID-19,_
Sometimes app says no drivers available and mentioned higher price so when book the grab instantly someone pick the ride,_
"It would be appropriate to tighten policy if wages and inflation expectations spiral higher, and trigger a second-round effect that pushes inflation above our target, Wakatabe said",_
Ni nak kena tunggu 3 hari baru nak pos barang,_
Tp sama colour,_
HELLO BOSS,_
muat ngam2 dgn saya,_
"Saja beli nak test, kalau travel sesuai sangat, panaskan dalam air dah tu makan",_
not so tight,_
"good quality with affordable price ,",_
"Ni dah terkopek kulit, mujur ada jual kat shopee",_
"All good, color pun cantik",_
Fit jazz size,_
jadi kena beli siap,_
colourfull gitu,_
Cepat betholl buat keje,_
sorry gmbr x dan ambik anak pakai terus,_
Hati kita kam boleh di bolak balikkan,_
Quality of the,_
nnti ada rezeki sy repeat lagi,_
Fancy color with cool display and super fast 65w charger now that&$HASHTAG$,_
This would be broken down to a second interim dividend of 16 sen per share and a special interim dividend of 50 sen per share for the period in review,_
"ok donee tq seller, barang semua okkk nice one boleh la secure cable iphone 13 promax 1TB wrna siera blue rm7100 with warranty bersama fast charging",_
"So lovely, this item",_
Dh la mahalll lambat hbs tu benda apa laa nk bubuh bnda ni kat mata aku kaa gila ?,_
Barang okay dah repeat kali ke 3,_
Excellent service by both seller & courier l!,_
anak2 pon boleh guna,_
Senator Chris Coons said on Tuesday he had nominated the committees and a group of medics aligned with the protest movement for the Nobel Peace Prize,_
we all love it so muchhh !,_
sehari ja brg dh sampai,_
98 lepas guna voucher,_
Everything received as per ordered,_
Shipped : 25/9/21,_
remote yg sedia ada dah menunggu masa jer tqqqqqq,_
Chang Sheng,_
Seller yang betul2 jaga quality perniagaannya,_
masa tu bergantung pada kuantiti dan tebal baju korang,_
Reigning women's singles world champion P,_
"Kain macam panas sikit, tapi kaler cantik",_
Kain best gile,_
good seller and will repeat order soon,_
Tapi brg semua dpt elok,_
mntapp,_
Gift card are not promo code it should be counted toward cash card or grab wallet,_
Absorption:wangi joo bau nyaa lps tuu rasa freshhh gituu ba gaiss 🤪,_
mesin basuh selamat diterima dengan jayanya,_
kualiti semua memang okeyyy,_
"Honeydew, ck air bestt bau nya",_
Thank you Seller🥳,_
good quality good packaging fast delivery same as picture,_
Udon I feel more better then others Mee,_
seller pn bagus sntiasa layan customer,_
"Terima kasih, baju hujan sudah dapat",_
Five Guys,_
Fit comfortably mfortable and affordable,_
Tak try lagi tapi kotak dia lawa oi aku beli rm6 berapa je sbb guna voucher HAHAHA penghantaran pun mantap laju,_
tq saller dpt 500 point🥰,_
"Lebih 200 orang hadir dengan berpuluh-puluh pegawai tinggi kerajaan hadir termasuk polis bandar itu, pegawai imigresen dan ketua pegawai antirasuah serta 20 ahli parlimen",_
Terima kasih sorry tau lupa nak snap gmbr,_
ad sesape x kt cni nk swap dgn i sz 36,_
Was just wondering what is the free gift,_
Machine learning has been used widely to develop suitable models to predict and mitigate attacks,_
Barang diterima dalam keadaan baikk thankyouu,_
Order 18Dec and received 24Dec,_
Will buy more item,_
"The quality is really good, fast deliveryI order it on 26 and it arrived on 27!",_
"tapi bila bukak ade kemek sedikit,",_
tak boleh nak letak hf langsung,_
Wrna is cantik,_
🥰🥰🥰🥰🥰terbaikkkkkkkkkkkkkkkkkkkkkkkkkterbaiiiiiikkkkkkkkkkkkkkkkkkkkkkkkkkkkkkkkkkkkkkkkkkk,_
hope dpt tahan lama new valve ni,_
lain kli kna ambik xxxl baru selesa dpkai,_
kita oder wrna gelap,_
"Super fast delivery, items were pack in courier plastic",_
Parcel selamat sampai <3 thank you seller thank you seller thank you seller,_
murah dan mudah digunakan,_
The goods is working well,_
Just nice to handle,_
the delivery take around 1 day,_
My 1st try for this ramen love it so much fast delivery,_
Baru dapat rasa yg pankaging baru ni,_
Do check it out,_
But the span quite soft make it unstatic but its okay because it is suitable with the price,_
"It's like a hug in a hat, a way of spreading holiday cheer in the run-up to a series of year-end holidays",_
Balutan teruk,_
"Tiada respond dr vendor, lambat sampai, tiada komunikasi yg baik, online tetapi chat tak balas",_
Delivery very very very slow,_
"Penghantaran pantas, diterima dalam keadaan baik",_
Dapat free gift adaptor lagi,_
cuma warna selipar tidak sperti dlm gambar,_
Please take action,_
"Very good item, gambar tiada kaitan antara hidup dan yang mati",_
emoji! 10/10,_
"kualiti yg baik,penghantaran pantas",_
"Seller sgt2 murah hati, tq tak pernah miss bg free gift",_
"In talks with Indonesian President Joko Widodo, Blinken expressed support for Indonesia's leadership in the Indo-Pacific, as the world's third-largest democracy and a strong proponent of the rules-based international order, said the US state department",_
"To register on PlantLife, you create your profile with a photo of yourself, but also with pictures of each of your plants, entering their species, age and adding a small description",_
penghantaran sangt pantas sehari je dah smpai,_
Ok seller ni,_
"Sampaii dahhh , Alhamdulillah tq seller , tenkiu courier j&t , terima kasihhh 🥰 Sampai dalam keadaan selamat",_
The delivery quite fast even tho from mainland,_
Kami berbesar hati untuk bekerjasama dengan Carsome bagi memberi ganjaran kepada pemandu untuk memberikan pengalaman terbaik kepada mereka dan penumpang,_
boleh muat baju aku tuk seminggu,_
"Love it and bla bla bla whatever I said, it's awesome",_
Gambar xde kene mengene tapi kasur cantik dan nyaman di pkai Tq seller,_
really loves it!,_
Insyallah nnt repeat lgi sbb saja try order 1 dlu,_
very good buy it,_
Besar Sangat,_
"2021, received 04",_
Ade yg terlambat sikit,_
Terbaik bagus giler memang terbaik suka giler hahahahahha,_
"Thank you, I love them all!",_
huhu tp ok jer,_
"Packaging like always, padu teruk",_
"UNMANNED aerial vehicles also known as drones are proving to be versatile, as new uses for them are being discovered every day",_
Nayaaa pak karimmm oiii,_
very recommended and good packaging,_
Boleh repeat order lagi sangat puas hatii!,_
Seller pos keluar barang 05,_
dah 3 tahun guna,_
Sangat tanggungjawab,_
Korang boleh F dulu nnti saya up gmba kat coment,_
Dapat lah coinnnnnnnnnn,_
fast delivery from the seller,_
(Reuters) - Faith has played an important role in the development of cricket in Papua New Guinea and on Sunday it will be repaid when the 'Barramundis' make their Twenty20 World Cup debut against Oman in Al Amerat,_
t mean you can&$HASHTAG$,_
"As artificial intelligence becomes increasingly integrated into modern society, evidence suggests that the algorithms meant to help eliminate cultural biases have problems of their own, and Chinese companies are no different",_
Susah ye nak cari thsirt nursing mcm ni,_
"I'm giving them away as gifts to children who will attend my wedding, attached to paper bags",_
Pernah bli kat kedai lain sblumni,_
"Ok, selesa pakai",_
Seller melayan je nak font apa,_
Interesting texture,_
"Consisting of 900 apartment units and 32 commercial lots, LSH33 will also house LSH Capital's new retail shops for its subsidiaries, as well as a decorative lighting-themed commercial space that will also be supplied by the group",_
"Functionality:kalis air, tahan Bakar, string kuat : very safe",_
gonna repeat soon with another colour and patern but for sure from this seller 🧚‍,_
Sssuai ngn balang rempah,_
The offering is palliative when what we are seeking is a cure,_
Easy to choose on the thickness so buyer not get cheated,_
Thankyou seller for the excellent service and good packaging,_
Waterproof:surprisingly yes,_
Ini kali ke dua beli vacuum H10 ni,_
Would love to get hand on it and shift all my daily usage to this new phone,_
Spender agak nipis sesuai dengan harga,_
puas hati dengan harga courier pun cepat,_
UOB also expects Fed to shed more light on its balance sheet run-off timeline and magnitude,_
dah beli untuk kali ke 2,_
"Overall, beg adalah bagus sesuai dengan harga",_
Beli kli ke 2 mak suka,_
Terbaik la seller penghantaran laju sangat,_
lebih kepada manis,_
BB 03,_
tinggi 160cm ambik saiz xl mmg ngam,_
I cannot see info of my data usage whatsoever,_
Lambang dengan size berbeza2,_
Beli 3pair dpt 3pair,_
berbubble wrap lagi,_
Waa Terbaikla 3 hari je dah sampai depan rumah,_
Worth the price with free shipping,_
"Before this 4years ago i buy same watch, so after 4y, i came and buy another one",_
Fast delivery and product very good,_
"Tinggi 150, Berat 44kg",_
"Pembungkusan terbaik, penghantaran cepat, harga berpatutan",_
Ribena pun memang minum setiap hari,_
Bronze medals went to Jorge Fonseca of Portugal and Niiaz Iliasov of the Russian Olympic Committee,_
Lambat sangat Menyebalkan,_
Kit received is neat & looks nice,_
Produk bgus diterima dalam keadaan baik penghantaran yang pantas,_
Material:Just ok,_
Dah cuci,_
Really fast to get the link,_
Cuma panjang sket utk saya yg tinggi 155cm ni ha,_
"barang sampai dalam keadaan yang elok dan barang berkualiti ,boleh repeat order",_
Korang tengok laa packaging,_
ch/report/ar6/wg1,_
Fast shipping & the taste also yummy,_
Next time boleh repeat orderlagi,_
nnti bleh beli lgi ni dgn seller ni,_
Gmbar xdak kena mengena,_
Taste good just that too oily,_
kain mcm best jer sejuk,_
beli untuk suami ok katanya tq seller,_
I got the answer really fast,_
doakan saya Selamat bersalin,_
tak try lagii,_
Maaf gmbar ta berkaitan,_
"Berikutan itu, Menteri Sains, Teknologi dan Inovasi, Datuk Seri Dr Adham Baba, berkata beliau percaya pendekatan penjenteraan Malaysia membolehkan perintis tempatan negara memberi tumpuan kepada Revolusi Perindustrian Keempat (IR4",_
The Robust model in now a days with best price range OnePlus always having the best phone with great performance now a days camera is also like cake with cherry,_
Semuanya ok n cukup,_
bepat,_
Dah sampai cepat jugak la terima kasih seller,_
work out,_
All good no damages,_
Just the packaging is little bit disappointing,_
Penghantaran lebih kurang lapan hari,_
wrap pon okay,_
Good packing in a box,_
Sape sape nak beli better amik 1 saiz besar dari biasa,_
27/2/2022 ordered,_
wrnevtak cerah tak gelap,_
Product well received with good condition and long expired date,_
bgi selesa,_
IM PATIENTLY WAITING FOR THE LIVEEE NAMJINNN,_
i think i will need to cook 2 packs at a time,_
love it but small than my size so give it to my anak buah,_
"Ordered 02/11/2021, received 06/11/2021",_
barang semua elok di pack,_
rocker akan dlm posisi duduk sgt,_
Freegift golden malkist,_
lepas ni harap seller bagi stiker untuk setiap barang,_
">Volt Archery yang menduduki tempat kedua memenangi RM10,500 manakala pemenang tempat ketiga, Bren Victress dari Filipina pula membawa pulang RM7,140",_
Fits my laptop very well,_
"Ok la, cuma kecil untuk ruang saya",_
Excellent service by seller and fast delivery because it only took less than a week even from oversea,_
You should try Realme narzo 50 it&$HASHTAG$,_
"tebal , sedap pakai rasa sejuk je 🤣 tapi belum cuba lagi la kat bawah matahari macam mana",_
Labuh 35 inch sesuai tggi saya 154cm je,_
sngat puas bli dgn seller ini,_
"I need one, probably going to buy one even if I don&$HASHTAG$",_
murah and senang,_
Baju selamt smpi,_
That is a lovely beast $MENTION$,_
"(Reuters) - An ex-policeman accused of terrorizing California with a string of murders, rapes and break-ins attributed to a serial predator dubbed the Golden State Killer was expected to plead guilty on Monday at a court hearing set to be held on a university campus",_
Ok bos pesanan sudah diterima tq,_
Material:belum try lg,_
Terima kasih sgt2🤗,_
Please add more stock for others too,_
My wallet hurts lol but great app!,_
I have been using Grab for most payments and food ordering,_
Cantik colour sama mcm dalam gambar,_
Barang sampai dengan selamat 🤩 laju gila penghantaran dia,_
"Zulkeflie ditemui pada majlis Pelepasan Tren Barisan Kru dan Pelakon Misteri Hutan Tok Kepak (MHTK), di Stesen Keretapi Kuala Lumpur",_
"Perniagaan swasta boleh terus membuat peraturan mereka sendiri dan pemakaian pelitup muka masih diwajibkan di kenderaan awam, perpustakaan, pusat penjagaan, penjara dan beberapa pejabat pihak berkuasa tempatan",_
Texture:nice la this one is thicker,_
Powerful bunner but the body is very light could be better if put more weight on the body,_
"Barang dh sampai, kali ni dh repeat order, cuma nk try saiz lain",_
Everything was good and the price is cheap,_
Yang diterima memang t-shirt bukan lain,_
beli 6 dapat free bag,_
The management goal is to at least finish as runner-up and return to the Super League by 2023,_
Kasut dia nice tapi berat sikit tapi okay lah dengan harga macam ni,_
It was one of the centerpieces of the,_
Very poor services by seller,_
lepas ni kalau ada kesempatan boleh repeat order lagi lepas ni,_
nanti nak repeat warne lain pula,_
"mantap pak abu, page ni paling murah jual bag size paling besar",_
I'm not sure but before I've bought this brand and the material is not that thin as this one,_
more pocket friendly,_
might buy from this shop again,_
Some 181,_
Sume cukup n ok,_
pnghntaran mmg lajuu,_
"X 9999,",_
Item works as intented,_
"glad it still didn't sold out tht time,",_
Item received in good condition Fast shipping Great value for money,_
very affordable and useful came with bubble wrap and nicely packed,_
I've been using it since last year but it's not working now for the last few days,_
Terbaik seller packing dengan kemas dan selamat,_
But this time shipping was slow,_
"i 40kg/151cm, besar sikit tapi kalau pakai dgn skirt cantik jee",_
effective to not feel pain while walking/exercising,_
Delivery and packing acceptable,_
saiz pun sesuai dgn anak umur 9 tahun,_
"Fits good, nice and comfortable",_
Hai hidon dah ilu,_
"Japanese billionaire Yusaku Maezawa blasted off to the International Space Station (ISS) on Wednesday in his first space flight, a voyage he sees as a dry-run for his planned trip around the moon with Elon Musk's SpaceX in 2023",_
kinda recommended,_
tq GRIMO seller terbaik,_
Legging berkualiti dan selesa,_
Tidakkah aku melihat,_
Sampai semua barang okay 🤲 yang penting color dia soft pink!,_
"good good gooooooooooooooooooooood product, nice seller and very fast",_
Seller very fast I like,_
We will order more soon hopefully,_
Functionality:Ok juga,_
2021 (Hari ke-12),_
Fast service and all the item is in good condition!,_
MasyaAllah cantik,_
Bju x trlalu besar sngt,_
Only pops up Welcome back!,_
Fairly easy to use,_
"CANTIK WEH COLOUR DIA TAK MENYESAL BELI,",_
Quantiti brg cukup,_
tpi xapelah puas hati,_
Barang mantap dan puas hati,_
lepas pakai bibir jadi lembap je best sngt sngt,_
Guatemalan families began funeral rites on Sunday for the victims of a deadly Dec,_
so ambil size 40 pn sedap dah pakai,_
Boleh cuba warna lain pula,_
Drp beli yg 16 gb dkt seller lain,_
Size mmng ngam,_
even beli satu item tp dapat dua free gift,_
"KUALA LUMPUR: Maybank menawarkan Bantuan Sokongan Banjir kepada individu, perusahaan kecil dan sederhana (PKS) serta pelanggan bukan runcit lain yang terjejas akibat banjir",_
Walaupun murah kualitinya bagus jadi lagi bagus dan lebih murah bila ada cashback n free shipping,_
"beli size biasa korang pakai je, nice sgt!",_
Beg cantik dan tak murah koyak,_
btway i jual tudung bawal,_
"Okay okay okay okey okey,alhamdulillah semua ok,kena angin yg kuat untuk masuk dalam nye",_
Panjang dia pun macam yg biasa beli,_
tapi untuk postage taksmpai 24 jam,_
klu yg mne takut nmpk lehir kna pki iner tudung sbb agak jarang kainNya,_
Buat 2 kali pun tetap tak hilang,_
Yg design ni last piece tgl size L,_
Mantulah saya suka saya suka saya suka,_
"Lembut je,mmg sesuai untuk bby tp saya pakai untuk lap2 lepas bby makan",_
siap case lagi weh,_
"Order : 4/6/2022, Received : 12/6/2022",_
LAWAA KAIN BESTT PANJANG PON OKKKKKK LAWAA LAWAAA LAWAAA THA KSSSS,_
sebelum tidur,_
blush dia okay n nice je bila pakai plus dia ada sediakan brush dengan cermin dekat belakang tu,_
My son only want to wear this type of mask with this car character,_
Waste time & money,_
Love the colour !,_
Nice packaging~~~~~~,_
Harga murah sgt2 recommend,_
Belikan untuk orang dan dia suka,_
Penghntaran yg sngt pantas,_
Aroma:smell well like it,_
Functionality:Nice and safety,_
Beli skirt tu masa shocking sale dapat harga murah skit,_
All well received as seller packed nicely and securely,_
Lupa nak update baju dah smpai,_
But need to improvise in how instruct buyer,_
Fast and efficient delivery love shin ramyun very much,_
Brg takda wrap elok2 Just sumbat je dlm plastik parcel yg nipis,_
এসে পরো 500,_
& tq seller bg free gift,_
Yeeeaahhhhhhhh barang dahh sampaiiiiiii,_
"Blender mata dia kecik je, ingtkan besar",_
Mantap terbaik terbaik terbaik terbaik terbaik terbaik terbaikkk,_
"Bungkusan tak elok, plastik jer, hujung2 rosak lah, apa2 pun terima kasih seller",_
Produk selamat sampai selepas musafir 15hari,_
it came separtely from my other orders,_
"Investors are increasingly being drawn to its bonds as an alternative to United States Treasuries, while some banks are calling for the yuan to join the dollar, euro and yen as a global reserve currency",_
Quality:design pun cantik,_
Trustful n hopeful seller,_
tidak terlalu nipis tetapi tidak terlalu tebal,_
lepas ni nak repeat lagi lahh,_
Barang sampai dalam 5 hari macam tu,_
seller pn sgt mmbntu,_
"Tq cepat betul smpai ambik masa 3 hari saja, buat masa sekarang berfungsi dengan baik",_
Vest NIE cantik n jahitan dia kemas MCM dlm video NIE lpstu X kecik sbb aku expect vest NIE kecik kauu rupanya besar jugak,_
"Overall puas hati dapat isi masa lapang, instead main phone",_
Wholesaler in GM Klang sell RM0,_
"22,received goods on 4th fast delivery and goods in good condition",_
Will install it over the weekend,_
pkai best terletak,_
sama juga yg lain,_
Boleh digayakan untuk majlis tertentu sebab menutup aurat,_
tapi satu seller bagi salah warna,_
ive bought it so many time & never disappointing,_
Hope not so spicy,_
My wreckers Tq so much seller !,_
Senang nak basuh kalau kotor atau kena air kencing baby,_
"If we proceeded with the original plan, we would be deliberately seeding thousands upon thousands of COVID cases into WA and at this point in time that is not what I am going to do, McGowan told reporters",_
Cleaning Effect:have not tried yet,_
The emergence of the Delta coronavirus variant triggered a third wave of infections in the country that peaked in September when the DOH reported its highest daily tally on Sept,_
packing dgn baikk,_
MMG TERBAIK!,_
"cuma,biasalah bila random",_
Texture:mcm syampoo biasa tapi syampoo kundal ni ada pemicit and memudahkan,_
"Bungkusan rapi, bubble wrap",_
🤞🤞🤞🤞🤞🤞🤞🤞🤞🤞🤞🤞🤞🤞,_
Paling best mop dia,_
"However, it take quite long for the order to reach me",_
Licin sesangat,_
barang cpt sampai and bungkusan okey,_
camera mantop,_
kualiti kain yg bagus dh mudah dibentuk,_
amek size biasa pakai je,_
free gift yg comel untuk customer saya,_
Nice kalau pakai dgn dress,_
"juga berguna utk semut,lalat",_
🤗 I LOVE IT SOO MUCH!🤪THANK YOU SELLER🧚‍,_
BEST BELI KT SINI !,_
The new president asserted that the EGM was not held after the National Sports Council (NSC) announced the budget cuts,_
Terbaik dari ladang Terbaikkkkk Terbaikkkkk Terbaikkkkk Terbaikkkkk Terbaikkkkk Terbaikkkkk Terbaikkkkk Terbaikkkkk Terbaikkkkk Terbaikkkkk Terbaikkkkk Terbaikkkkk Terbaikkkkk,_
"Cumanya ada sikit kemek dekat cup tu, tapi tak apa bendanya masuk dalam perut jugak kan",_
Sgt sesuai utk doorgift & sy guna utk packaging brgn yg sy jual,_
The Health Minister said that 20 countries have reported Covid-19 cases involving the Omicron variant of concern as at Nov 30,_
cantik macam dalam gambar berbaloi beli murah kualiti bagus,_
Excited nya la adik dapat bnda ni,_
And they also gave me a free gift!,_
puting ok ja,_
Great Phone design I like it,_
me too but my wallet says *&amp,_
Selamat sampai ke Penang,_
Kena alter tambah kain,_
!Recommended,_
