Sentence,Tagged_Sentence
Sy suka sbb ia buat sistem penghadaman sy makin elok,_
Love them will repeat order next time,_
It is now a partnership for sharing capabilities for the common good,_
reciksssss !,_
Tapi nasib item cukup,_
What is being said in the media about the lack of supplies and rising input prices are correct,_
Brg smua,_
packaging ok lepas sampul plastik masuk dlm kotak,_
"Фу,они же вареные,а я люблю жареные,хрустящие",_
nnti nk beli utk my dad plak,_
Unjust and all for profit,_
Got delayed due to raya but its ok as i ve bought a few times from this shop,_
27kg,_
- Foto hiasan NSTP,_
"Item already received,thanks seller",_
not so fast delivery for me,_
"Shipping out laju bdesub dr abg bwg,kourier delivered pn laju",_
"Fast delivery, the colour also nice",_
Packaged item with good condition,_
"To make electrostatic sticker sticky again after taking it off to adjust placing, wash it using water and dish soap",_
Minyak hitam 4t stp selamat mendarat dirumah saya dalam keadaan baik,_
Terima kasih barang pesanan saya sudah sampai,_
berpuas hati dengan penghantaran dan girdle nii mmg terbaik🤩🤩🤩🤩🤩🤩🤩🤩🤩🤩🤩🤩🤩🤩🤩🤩🤩🤩🤩🤩 thankss seller,_
the box for product damage badly too,_
Tebaek laaa,_
nak repeat lagi warna lain its from overseas so agak late to arrival but im so satisfied,_
Kena ambk 1 saiz besar ye tapi kalau kaki jenis lebar better ambk 2 saiz besar sbb bahagian depan tu agak sempit,_
Dah test inflate kat rumah,_
sabtu bole test on kayak,_
Warna & design cantik sangat,_
He (trial judge) considered this defence in some detail before rejecting it,_
"barang sampai dalam keadaan baik , penghantaran agak lambat sedikit",_
Phone case safely arrived,_
"packed promptly, fast delivery",_
Baju besar tp boleh la paki lama sikit,_
Kenapa digi sekarang selepas update kuat makan kuata kuata macam angin cepat habis,_
And others,_
Postage :,_
Good value for money but the glass is not as hard as mineral glass on ori as it scratch easily even by wiping with cloth or hand,_
Nice and safe to use,_
Kualiti shawl ni memang bagus dan delivery time pun tak lama mana,_
Barang semua di stor simpanan tak sempat nak ambik,_
brg d terima dalam keadaan baik seperti yang pasarkan,_
Overloaded my collection of natural stone,_
Will keep our body from sickness,_
Cash on delivery was blocked for what?,_
• Phone Monitoring,_
Nilai bru dpt,_
THANK YOU SELLER FOR YOUR KIND RESPONSE,_
"5cm, size 36 fit me well",_
Muhammad Nor Firdaus npk sdp plk,_
Yang diterima tiada,_
Repah assemblyman Veerapan Subramaniam said the 60-year-old Murugan temple in the former Chinna estate was given an alternate piece of land because of redevelopment,_
baju besar org saiz 3xl pon boleh pkaiii org kurus pon xnmpk gemuk klo pkai terbaik,_
powerband kecil senang boleh masukkn dalam handbag,_
"tq seller,insyaallah akan repeat beli lgi",_
I loved GRAB,_
Looks good in quality,_
barang ok kotak pon ok,_
easy money come easy go oso,_
Material cantik corak cantik,_
$MENTION$ great phone,_
"Fast delivery, only this time got 1 of the inside pack is spoiled so have to wash it",_
But should have tipping function embedded,_
baru dapat dah beli mcm mcm,_
"kualiti sangat memuaskan,material tebal dan selesa",_
Armed Forces chief Jen Tan Sri Affendi Buang said such irresponsible remarks had also offended the family members of the Armed Forces and police personnel who had died fighting the intruders,_
Tak recomend these seller lh,_
elok je mata bila pakai,_
Ordered:14/5/2022,_
I need review of 13,_
harapnye serasi dgn bdn sy,_
on omni o76y km 5,_
Material:brg sampai dlm keadaan baik tiada kerosakkan,_
black slipper is slightly softer than blue,_
Quality:Ikan bilis kasar2 mabeles,_
Quality kain Mmg terbaik,_
Suar kain mantap pak abu,_
Sedikit calar,_
sbb dari china kan,_
courier lmbt,_
Not like lastime glossy surface and thicker texture,_
Towel for kids,_
bucu kemek skit,_
Done stock up my samyang!,_
"Barang dah sampai dalam keadaan yang baik adanya cepat dan pantas ,",_
"All items received in good condition, nice packaging and super fast seller",_
"Setanding dgn harga selesa tak panas, ingt size M ni untuk budak🤣 takpa puas hati",_
t=7m52s>,_
beli dua terus untuk stock,_
"I received the products in good quality, with complete safe packaging to make sure my products are always in good condition",_
Packaging is ok and the item are in good condition so thumb up to seller,_
wangi tp xmenyusuk hidung,_
Beli sebab mulut cepat merekah,_
lalalala Sejok bertemu pertamo kali Diriku raso serupo mimpi Makei tak lalu Tido tak leno bokte kerano teringat demo Terbaye baye siey malei,_
tp ada item lain yg x lengkap,_
"Ermmm, nt function very well on rubber surface, good product quality, good value for money, thank you",_
Next time tlg la jgn pakai ninja van,_
That's not helping i dont know if im making a report they would reply,_
Fast delivery & product received safely,_
Good as a sock replacement,_
Harap2 semua okk,_
Azhar Aziz,_
04 trillion yen,_
Murah order sini,_
Not support actual fast charging 3,_
seluar je ngam2,_
Product came as advertised,_
Now upgrade to include rear camera cos always kena from behind especially motorcycles,_
"Ht 156cm, wt 47kg",_
"Barang dah sampai dengam selamat, pembungkusan kemas, terbaik terbaik terbaik terima kasih",_
Bogged down at the first sign in,_
"The On Off button is softer now, just need to gentle press it",_
apapun trima kasih seller Dan j&t,_
Fast delivery dari saller dapat sebelum 22,_
"Taste:sedap dan rangup, kruk krap",_
janji sampai kan,_
Tastes good and healthy,_
The curler are sturdy and in a good condition,_
"Difahamkan, sekurang-kurangnya 10 unit pangsapuri kos rendah di blok terbabit sudah dihuni keluarga penduduk tempatan, manakala sebahagian besar pemilik kediaman di situ belum berbuat demikian",_
maaf takda pic,_
Rasa kopi arabica ni mmg terbaik,_
Seriously im so excited when the parcel arrived i can sleep happily tonight thank youu,_
"Beli 11 biji, hrp2 berbaloi la",_
"Seller bagus respon pantas, ada masalah seller boleh settle good job seller mantap mantap tq seller🥳🥳",_
Hapus levi AP untuk harga kereta lebih murah,_
harap muat lah ngn rim saya,_
"kalau ok,next time blh order lg",_
harap kena dengan tekak,_
Exp date at end year 2022 good,_
"Barang sampai dalam keadaan baik dan cantik, dibungkus kemas dan rapi, terbaik penghantaran, laju je semalam order harini dah sampai, harga sangat2 murah berbanding kat kedai, harap2 produk ni dapat bantu almari saya yg selalu bercendawan la",_
Tak cair masa penghantaran,_
Try 2 types of strap,_
Delivery - super slow (no mood to eat ady),_
tapi still smpai,_
FAST RESPOND!,_
"Dok mnyesl beli , kain dye cntikkkkk nsib sempat smpai 🤣🤣🤣 dok sbar nyer nk pkai nnty",_
Berguna giler time raya haritu sbb takde org nak amikkn gambar hehehe,_
All items well protected with inflated bubble wrap and packed in box,_
sekarang senang,_
cantik2!,_
Ingat sempat tunggu nak buat kek nya,_
🤔🤔🤔🤔🤔🤔,_
Mantapp kualiti okay,_
"No one: Literally no one: RM, JK &amp",_
but for silver men dont working battery out then i go to shop,_
Beg kecik jgk,_
lepas ni memang saya x beli lain,_
E27,_
Shud have requested the seller to cut to 15CM as it is still very loose,_
item arrived - parcel has a small tear can see contents - nit sure if it is courier or supplier - received all coffee as listed,_
"Harga pun okay lah kan dgn barang, so just nice lah",_
Barang seperti yg di pesan,_
beli tunggu masa promosi terus je rembat,_
Dh test td goreng nuget,_
"item okayyyyy just nice hihihi, love it thank you seller",_
Sangat cantik dan lebar,_
"Yg corak mickey quite good boleh buat utk pakai jalan2, yg lain sesuai utk harian sbb agak nipis",_
Stay safe ok!,_
Very2 good coz package in proper bubble wrap and arrived fast,_
padan laa degn harga,_
nnt i review balik kalau dah rasa,_
Tshirt suits me well,_
The survey data is consistent with the findings of the Statistics Department which have shown that mothers having children between 35 and 44 years old increased in 2018 and 2019 while those having children between the age of 20 and 34 gradually declined in the same period,_
Ada satu patah tp yg lain ok hanger best sgt2 tdung jd kemas,_
I buy the silver one but I get the gold and the spectacle is in bad quality,_
All body wash smells so goodd,_
Penn'z De Sauza pasni try this,_
Always love Nestle products!,_
Thank youu thank youu thank youuu,_
pgantran pun laju ja,_
Kali kedua beli perisa sedap2 terbaik,_
i likes all item,_
Repeat oder lagi 3 helai,_
It doesn't have a complaint or report button,_
2-3 31/3/2022 8pm,_
Tq selller brg dlm keadaan baik tq bagus fast delivery tq barang diterima terima kasih banyak banyak cuma brg ade pecah satu botol,_
my kids also the ribena lover,_
Material:5 coin,_
"Pertama sih ragu, takut salah klo mesen, akhirnya sih tanya² dan bisa skrng jd terbiasa dan apl ini memudahkan saya dlm transportasi, antar makanan dan lainnya",_
Unit Terhad,_
beli yg nipis memang puas hati,_
Murah cepat dan semestinya sedap akan direpeat memandangkan dapat free postage,_
walau lambat sikit sebab yelakan Dari indon memang la,_
"Havent tried it on my skin but do try swatching and it absorb well, usually use watery types, not sure i'll like the lotion type but why not give it a try ?",_
Size/Perfect Fit:unborn child,_
hopefully they would,_
Packed very compact,_
harga sangat² murah,_
quality still ok,_
"Servis penghantaran cepat, order 24, 27 dh smpai srwk",_
"Scan to pay to another bank is not invalid, please solve this problem",_
"Ship'Out agak Lmbt ckit but Sokey,",_
The product itself is worth it,_
wafna cantik,_
Love my kitchen storage,_
"Good packing with box and bubble wrapped, good taste, will buy again",_
Gift only can be purchased after buying any product from this seller,_
"But the material is pretty good, according to the price",_
very responsive and polite,_
"Xi made the remarks during a virtual conference with the members of the Association of South-East Asian Nations, or Asean, held to mark the 30th anniversary of relations between China and the grouping",_
sampaii dalam keadaan baik tiada kerosakan apa apaa,_
"Overall is good , affordable, size just nice",_
Cantik wrna pon cantik,_
Recommend this for filming something or watching a movie,_
Formula may have bleach,_
Enjoy 6 OFF all categories in Malaysia or 2 OFF special activities when you book with Klook from the link in the deal,_
secure betul terkejut cheq kotak besar mai hantaq depan rumah,_
Hitam dan premium,_
"barang sampai dalam keadaan baik, barang cunnn",_
bang Kalau Masukkan Bb Dlm Tu Rosak X (pertanyaan),_
"Agak kering, tak basah",_
next blh repaet lg,_
Barang dah smp dalam keadaan baik,_
I would've picked it up when I brought the printer,_
"It is straightforward, user-friendly and convenient",_
tunaikn janji,_
Water Absorption:100 menyerap air,_
The colours received are just the same with advertised,_
presentable as gifts,_
Kasut XES memang berkualiti,_
seller memang cekap dan mempunyai kualiti dalam cara berkerja,_
Saiz okayyy chat seller x bals nk tuka saiz nasib muat disarankan ambik satu lebih besar,_
These matches are so cute 🥰,_
Products are good also,_
Anak² dah tak sabar nk pegi ke laut,_
thank you best gilerrrr korang kena beli,_
"Love the chain, its pretty and arrived with perfect condition",_
I wish If I can win this phone,_
Kita seolah-olah lupa perkara itu,_
texture lembut je tak melekit sangat,_
semoga dipermudahkan urusan kita selalu,_
Comel sangat beg dia,_
item ckup lengkap,_
Dah setahun lebih follow sni,_
kalau korg nk batter beli saiz more that kaki korg tu la,_
"Dah try, mmg elok and mudah",_
NICEEEEEEEEEE CANTIKKK MMG CANTIKKKKKK CANTIKKKKKKK NICEEEEEEEEEEEEEEEEEE,_
Seronok pakai musim panas ni,_
"Order on 25/12 , seller ship out 27/12 , received the",_
"Very good value for money, save my time, no need to worry about parking and traffic jammed",_
"okay sahaja , selamat sampai ,",_
thanks for fast action,_
Came in quite quickly,_
i refer youtube to know how to use this watch,_
Barang sampai dengan selamat dan tiada sebarang kerosakan berlaku serta penghantaran yang sangat cepat dan pantas sangat berbuas hati kerana casing cantik pelbagai pilihan warna boleh dipilih saya cadangkan boleh repeat order for the next time Sangat berbaloi dan berpatutan dengan harga sangat murah,_
Material:selesa dan nampak berkualiti,_
Need to upgrade the packing by using box not just only bubble wrap,_
"Received product in good packaging, fast shipping & fast deliver, thank you seller~",_
t know why but I feel really optimistic on this $MENTION$,_
ape pun tq seller bungkus dgn elok,_
Samp dah kopi,_
beli masa free gift dpt cincin n pendant,_
Ssuai utk suami berat 74kg,_
Berapa tahun lagi baru expired,_
material kain sedap xterlalu berat just nice,_
"m currently sick, this video is making my day",_
xskit kaki sbb tapak lembut,_
"It's good for that price, not bad, the shipment is also fast and the item arrives in a safe condition, thank you",_
"Fast delivery, value for money,good",_
Fast delivery by seller & nice watch,_
"The new microcontrollers will consolidate many of the functions now handled by individual chips, which not only will reduce cost and complexity, but will drive quality and predictability, he said",_
Sy puas cari barang sy x smpai pun,_
material macam tali kasut,_
"Lawaa sesangat, kain diye sejuk bile pakai, kene pakai inner sebab baju tu jarang skit bile duk bawah matahari, tapi 100 besttt",_
"tadinya seneng bgt pake ini, semakin ksni kecewa lahh",_
Tapi paduuu sedutttannyaa,_
Taste:Water with sugar & cucumber flavored rather than cucumber juice,_
klau okey nt kita repeat order lg yer,_
lepasni repeat,_
"Seriously material dia memang best, lembut je",_
Material of the strap looks & feels quite good,_
Packaging tiptop and barang smpi dengan selamat,_
Tp dpat 17inchi,_
cuma saiz plk ngam2 ordee hehehe~ kena kurus skit mesti cun pakai,_
Brg semua elok tq seller,_
Alhamdulilah Produk tiba dgn selamat Penghantaran pantas,_
ssuai,_
"Brg dah smpai dgn slmt comel je corak vacuum bag ni,konon nk ambk 50x70cm tu kecil lah rupanya besar utk 1bantal sesuai,60x80cm utk cadar,mmg jimat ruang cuma klu nak guna vacuum electrik yg kuat sedut sekejap je,klu guna tgn ambk msa sbb manual tgn je la yg lenguh,so far berbaloi beli tq seller",_
Berat 47 ( 46 - 55 ) i think can take size 2xl or xl,_
Noodles are very spicy,_
Jahitan cantik good value for money,_
gαmвαr хdє hѕhѕhѕh nαntí dαh αdα ѕαчα crєαtє вαlík rαtíng ní hѕhѕhѕh ѕαíz ngαn íí kαlαu pαkαí dgn ѕtσkín hѕhѕhѕh σrdєr 10/10 ѕαmpαí 13/10 hѕhѕhѕh thαnkчσu ѕєllєr,_
Comfortability:yes for me,_
Ok la Puashati,_
"Second time repeat order, fast delivery, nice packaging",_
Niceee beli utk ank ii tadika,_
Chai Zhiyan,_
So far sy puas hati sgt2,_
This is my 2nd time buying,_
Material:plastik yang kukuh,_
Penghantaran pantas tidak perlu tunggu lama,_
Myb sempat minum 8-10 kali,_
tak keras sgt dan tak lembut sgt,_
Haven't fully test yet but seems working,_
The exponents will then have to prove themselves by March as we have the South-East Asian Karate Championships in Cambodia and our national championships in Kuala Lumpur,_
Product not function,_
Xhsysyc heshsydyvyv7 ydshwjsj fueuwuwhchhd whvrjsjs,_
Maaf gambar & video tiada kena mengena,_
Okay tapi selit stand kat bawah tilam tak kuat,_
"Very good, the quality is also very good",_
As always super fast delivery,_
Terima kasih mummy dan bang Lee,_
So cute sangat sesuai jadikan freegift baby,_
Second time brought from this shop!,_
"Beli sebab murah(kalau tak muat, takdelah menyesal sangat)",_
Quality:Sory gmbr tk berkenaan sbb memang xsempat nk snap,_
cantik besar botolnya harga murah ja,_
Memang kalis hujan,_
100 Best Very helpful,_
"Arrived quickly, looks good, very light, about the same as my phone, very convenient, great with free gift charging, thank you seller for the free gift",_
"Cantik Hopefully lps ni boleh wrap tebal sikit, sbb maybe courier tak handle baik2",_
Kotak dent,_
"Very nice customer service,",_
nice white color still look clear ar day light,_
Camera belum pasang lagi,_
nice and thank you seller,_
"Saya ada keyakinan, mari kita lihat pada Mac, kami boleh memenanginya",_
Overall : puas hati dgn product dan surely akn repeat order dgn seller ini,_
Victory are third in the early season standings with 10 points having won three of their first five games to sit two points behind leaders Macarthur FC,_
Namun item berfungsi dgn baik,_
"Barang dah sampai sabah, semua elok takda pecah",_
Material:bear comel !,_
Tq seller barang dah sampai thanks cantik topi dia blh order lagi tqtqtqtqtqtq,_
"Sedap, garing, rangup",_
The product is authentic and the price is reasonable,_
"Gambar tidak berkenaan, sandle sampai lawa ,ngam, baru sempat try sebab baru balik dari kampung",_
status out for delivery pun ambik masa 2 hari br smpai ke rumah,_
Super prompt delivery!,_
Video x ada kena mengena,_
We like the taste,_
"mmg berbaloi dgn harga, kualiti terbaikkkkk",_
Kain dia pon berkualiti,_
Sangat jimat bila beli loose macam ni,_
My second purchase suka,_
Nak kena cari atena lain dulu tryy,_
"YA ALLAH ASAL LEMBUT GILA KAIN DIA bestnya ,",_
Good value FOR MONEY,_
7 percent fewer than in May,_
Bau dia tahan lama,_
"Penghantaran yang sederhana, tak cepat dan tak lambat Harga barang lebih kurang sama dengan pasaraya cuma kena tambah kos shipping",_
Bought it with cheap price and arrived within 2 days,_
Super tiny but i guess it is easier to bring it anywhere,_
"Saya sudah nentuin lokasi lewat maps, ehhh pas driver sudah nganter, ternyata lokasi maps salah",_
dalam 10 hari barang sampai,_
jam sampai dgn selammat,_
cadar sudah sampai,_
Not yet try makan,_
Packaging slmt smpai wlaupun pnghntran ada lmbt sikit,_
"I could probably have had six on another night, Kane, who was substituted just past the hour mark, said",_
"Luckily my mum luvv it and she said after 3 days consume, sakit kaki dia hilangg",_
"x dpt nak bg feedback lg,harap² sesuai dgn kulit muka",_
sampai dengan selamat dan laju tau,_
Terima kasihhhh barang dahhh sampaii barang dah sampaiii,_
"Beli semasa sale, sangat berbaloi",_
My family loves this cereal,_
dannn murah giler,_
"anak2 happy,mak pun happy jgk",_
"brg sume ok, satu pon x missed, nice 2 buy again,gOod job10Q",_
bought it with rm11 off and free shipping voucher,_
pakai dok bekas line panty,_
Quality/Material:received faulty item,_
Very well packed and wrapped with bubble wrap but just slightly dented on one of the cans but acceptable,_
Saya sudah berbincang dalam Kabinet sebanyak enam kali berturut-turut,_
Walaupun lambat sampai sebab dari luar negara lah kan tapi qualiti bagus,_
using barehand,_
besar and takde kerosakan,_
"faster delivery, and good quality",_
"Okay barang sampai dengan selamat , thankyou seller",_
Material good enough,_
"90,hui rugi tk grab,jp gi tk sale rm55,tolak coin dpt lh byar kurang,seller ni patut bgi lh coin,customer beli bukan 1byk oi,bgi coin best sikit,200coin cukup lh tok customer,thanks seller abg posmen shopee",_
Cantek dan tahan lazak,_
overall nice kotak msih berbalut,_
succesfully delivered,_
maaf gmbr dgn vdieo xda kaitan beli tuk abg oklh berfungsi dgn baik,_
Suke pakai bra ni sebab senang dan murah,_
Puting lain dia tolak,_
bukan utk long term pakai,_
Kenya has ramped up its vaccine rollout with social media and television and radio ads promoting vaccines,_
Manterpppppppppp,_
Puas hati next nk purchase lagi,_
🥰🥰🤣🤣 hello police,_
puas hati brg tiada kerosakkan,_
How satisfied are you with your experience from Celcom,_
"Quality is good, only thing is the colour of the actual product is different from what displayed in the picture hmm",_
Aim nk beli semua kaler ni,_
And I can't use it now,_
Will come back and give 5 star if effective,_
will restock lagi after finish,_
can fit my miband 6 in this strap,_
Eng Tatt Tan please take note,_
"Paris St Germain manager Mauricio Pochettino has also been linked with a move to Old Trafford but the Argentine, who guided Tottenham Hotspur to a Champions League final, said he was happy at the French club",_
Customer regular sunquik,_
product come wif good conditiongood quality of productfast deliverythanks seller,_
t=2m31s> pobre de mi tae todo ignorado :(,_
Takde pecah pape pon,_
Photo Dan Video,_
"tq seller finally i got t-ara new album, really excited",_
"Editing by William Mallard, Alison Williams and Hugh Lawson)",_
"Friendly user, good value for money",_
This is the first time,_
"They compete in Ligue 1, the top division of French football",_
"Delivery, even pass the limit of SHOPEE GUARANTEE",_
"Some work went into that lauch event, god I wish I had that phone Twitter: $MENTION$",_
"Murah plak tu, suka sgt blh repeat lagi nnt",_
16kgWE16kg,_
Harap muatlah sebab nmpk kecik betul,_
Smpi dngn selamat,_
"Item delivered safely, fast delivery",_
Fails to open on Chrome OS/Chromebook,_
tapi dompet tu saiz dia besar sikit,_
"brang dpt cantik,tapi seluar agak kcik",_
Functionality:tudung ketat betul,_
Tq ye seller 🥰 plastik naiss bole sumbat byk jugak ehhh Overall ok je !,_
Samyang tk pecah langsung,_
Everything is fine here,_
British Brexit minister David Frost said on Wednesday that his government's preference is to strike a deal to improve post-Brexit trade arrangements for Northern Ireland and that agreement can be reached by Christmas,_
terpaksa beli inner sebab jarang,_
worth the price n value for money,_
Tapi warna dia mmg lawa lah,_
and and and I did,_
2 kali oder memuaskan,_
Functionality:Produk mmg bagus,_
LOVEEEEEEE BETUL DENGAN PACKING LIPSTICK DIA COMEL JE,_
Barang ok tpi packaging kurang memuaskan,_
Barand diterima dengan baik dan berfungsi dengan baik,_
komen lain²,_
Item received in good condition but nowadays the shopee supermarket took long time to pack and send to customer,_
Thanks seller Thanks Seller,_
Berbaloi beli kat kedai ni,_
"If it suits me, I will definitely repeat order",_
"Barang tak try lagi, harap berfungsi",_
boleh repeat oder lg nnti,_
dah beli rasa nk beli sokmo,_
Absen 500 orang ke seribu orang yuk absen,_
All okay function well for my daughter's swimming class,_
tapi rasa sedap,_
Tali atas dia panjang,_
dah sampai lampu lip lap,_
"BERLIN (Reuters) -Leaders of Germany's centre-left Social Democrats (SPD) and two smaller parties will recommend moving into formal coalition talks and have agreed a road map for negotiations, the SPD's candidate for chancellor, Olaf Scholz, said on Friday",_
Taste:standard nescafe,_
sy beli dua helai tapi yg dapat cuma satu sahaja,_
"Thanks seller and courier🥰 barang sampai dengan selamat, packaging pun kemas",_
"THANK YOU seller ,",_
Kindly google or youtube,_
maaf laaa tak sama sbb kereta tuhh anak tak bg ambik,_
The receiver was happy with items received,_
Kalau pakai dengan high heels sedang elok la jadinya nanti,_
bila ketuk tak rasa spring,_
"Lambat sesangat nk post out ,",_
Only therapy I love Twitter handle - adil_vhra,_
OnePlus 9 Pro comes with a 65w adapter,_
expired date lmbat lagi,_
hrp2 btahan lama,_
Kain nye lembut ok lh dgn harga,_
"baju cantikkkkkk gilaaaaaaa dia punya kainnnnn punnnn naiseeee srss takkk menyesall belii thankyouuuu selllerr,",_
berpuas hati dgn stokin ni,_
4th purchased from this seller,_
There is no actual,_
"sy kurus tggi 156, berat 43",_
"Alhamdullilah parcel dah sampaiservice sangat cepat and memuaskan dah pakai tadi rasa selesa sangat2,",_
Kotak x de kemek2,_
Sound dia terbaik,_
Glutinous Rice Fragrant Puer Tea,_
"Pernah pakai sebelum ni,so far okeh okeh lorrr",_
Saya nak repeat ambil warna lain pula la,_
Actually order few things frm this seller,_
downloaded app and it will not open,_
Order came in within 2days,_
", kemas",_
ape2 pun barang ok,_
"Definately recommend getting extra protection, they really pack it damn well and surely it will be away from harm's way",_
"As Parti Warisan Sabah president and (caretaker) Chief Minister, I want to apologise to all members of the security forces, their families and all Malaysians for the statement by one of the party members, he said in a statement yesterday",_
Material:Thicker material than normal hinge,_
bintang ni saya bagi untuk courier j&t sebab penghantaran laju,_
sabar jelahh ye,_
Value for money and fast delivery Can purchase with seller again next time,_
Absorption:Absorb well to the face,_
Packaging perlu improvement sbb bunga ada yg patah patah skit,_
Recommended seller gaiss,_
terbaik cume zip utk breastfeeding tak cukup panjang,_
penghataran laju je,_
Bang gw mo ikut,_
Good quality of handbag and facemask,_
Not yet use hope can swift on function,_
Item received item received thanks,_
"packing nicely, tq seller",_
beli bnyk xbole pkai/refund,_
ขอกินด้วยคนนะค่ะ สุดยอดเลยค่ะ,_
Comfortability:Hope gt effect,_
"the almari is wobbly,",_
Terima kasih barang dah sampai dengan selamat dan kain lembut,_
kain dia ok cuma kelembutan dia mcm berbeza sikit untuk setiap colour,_
Breakfast bars everywhere and packing is broken,_
very puas hati !,_
sbb nnt nk raya baby dah msuk 8 bln,_
🧟 $MENTION$,_
dlam masa seminggu juga,_
"'EVERY DAY FRIENDS LEAVE' Once migrants arrive in Minsk, most move quickly to the border",_
"Packaging have some disappointed too poor , broken",_
Seliparrr okayyy cuma kalau pijak air mmg ada bunyi squishh tapi overall mmg baik dan selesa,_
Seller ships out quick,_
I used to try this product before and love it!,_
i pakai buat ootd gempak weh dah la murah,_
Bantal semua menggemok bila dah buka plastik,_
I love how small and compact it is!,_
nasib smpt dgn tarikh lahirnya,_
Brg dh smpai dh berfungsi dgn baik,_
cantik gak cermin matanya walaupun plastik,_
worth laa dengan harga,_
i love it 🥰🥰 Memang best,_
"Maaaaaaaabbbbbbbnnnnnnntttttaaaaappppppppppll ,",_
Who wants to buy those albums?,_
2022 Johor,_
