Sentence,Tagged_Sentence
Kena beli lagi la cite dia,_
Penghantaran tidak lah lambat tidak lah cepat,_
Very nice packing for all the item,_
Functionality:kt bahagian tangan ada butang,_
colour cream pekat camtu lah,_
album ok,_
Comel beg nye,_
Xsmpai 48 jam dh smpai,_
Senyap je bunyi tkasih,_
Boleh beli la brg ni,_
nnti blh order warna lain pulak thank you saller pon bgus,_
"Its Minister Khairy Jamaluddin explained that leprosy is not a hereditary disease or a curse, but it is an infectious disease that can be cured using the multidrug therapy treatment",_
Functionality:sorry gambar tak ada kena mengena,_
"Nice bag, well packaged",_
Huhu i repeat buying,_
& ganti baru,_
"Thank you seller, good quality, good delivery, received safely",_
"The father had pushed his son, who hit the wall and fell",_
"as always, warna gelap tak jarang & warna cerah agak jarang",_
"saya bayar Tau,",_
ank sedara pakai saiz 14,_
kain dia pun besar sesuai kalau baby tu besar,_
Buat isi ringan ringan je okay la 🥰,_
maaf gmbaq dan video tiada kaitan,_
design pun cute sgt tak nyesal pilih yang ini,_
Nak buat bedung mcm kesian pulak kat baby,_
it is so pretty and comfortable to sleep in at night,_
Received all 45packs,_
"Packaging and overall terbaikk,",_
mmg terbaik la seller ni,_
tgk brg semua ok,_
This offers an impressive number of combinations,_
so subtle and nice,_
kuasa sedutan bgusssssssssssssssssssssss,_
Will tryy later on,_
Seller wrapped nicely with bubble wrap as usual and the delivery as usual super fast Thank you everything is good,_
OK LA OK LA OK LA OK LA OK LA OK LA OK LA OK LA OK LA OK LA OK LA OK LA OK LA OK LA OK LA OK LA OK LA OK LA OK LA OK LA OK LA OK LA OK LA OK LA OK LA OK LA OK LA OK LA OK LA OK LA OK LA OK LA OK LA OK LA OK LA OK LA OK LA OK LA OK LA OK LA OK LA OK LA OK LA OK LA OK K,_
so good 🥰,_
The automatic camera switching for macro shots seems super weird,_
"Malone's tweet about the paper is no longer available, but Wheeler's video still appeared on Facebook weeks later",_
"Well, a dog is known as man's best friend",_
Effectiveness:luarbiasa,_
Belum cuba lagi macam mana oke ka tidak,_
That BLUE color is AMAZINGGGGGGGGGG,_
Baju semua okay kain semua okay tapi saya nak cari yg betul2 sesuai utk ke kolam renang,_
"2 kali dah beli kt saller ni , terbaikkk",_
dh la cntik murah,_
Hoi tengah puasa ni,_
No tears and all,_
Cantik d puashati,_
baru nk on,_
xnipis,_
Tp nak pakai bwk g keje je,_
barangkali roda kamu pancit,_
Order 19/8 terima 23/8,_
"Tq bos memang laju cepat pantas barang smpai selamat semua ok memang terbaik la boss kite no, sy suka sgt brg ni",_
The best quality cause its hard silicone not the cheap one but this is the expensive one,_
Item received in correct order and good condition,_
Plastik terbuka bila menerima parcel,_
"IHG Rewards members, Gourmet Collection members and selected bank credit cardholders enjoy special discounts when dining in during Chinese New Year festivities at InterContinental Kuala Lumpur (excluding afternoon tea sets)",_
🤲🤲 only took 5days to arrived dapat freegift toploader,_
Sy bert 64 kg tnggi 158 ambil size L,_
Mantoppppppoooooo barang sampai cpt gakkkkkkkkkkk,_
Turkey has denied playing a direct role by allowing its territory to be used to ferry in migrants,_
"Bodo punya app ni,aku nk order pun susah,lepas tu dia beritahu sila cari restoran aku dah cari tapi tak boleh lepas tu dia suruh aq tukar lokasi dahlah lokasi tu jauh,app ni wajib aq buang,",_
Texture:lembut ringan mudah pakai n boleh guna byk kali,_
Not as thick as i thought,_
last minute canceled my order,_
tapi ape2 pun tq ye,_
good deliver,_
Quality:80/100 its affordable for the price,_
"Polls indicate women, especially younger women, are more likely to vote for Boric",_
Beli 4 pasang lain warna,_
nk ode,_
Received with thanks for the umbrellas with good condition,_
Beg cantik n zip semua okey,_
16/12 received already,_
saiz ngam ngam soi dengan kaki kita,_
"Pelan ini bertindak sebagai panduan dan seterusnya menjawab persoalan apa tindakan yang perlu diambil, bagaimana tindakan dilaksanakan dan siapa yang bertanggungjawab dalam meningkatkan tahap keselamatan jalan raya",_
Hat rimau elok kain elok size elok,_
Maaf gambar dan video lain rasanya dari barang,_
ini kali ke 3 order dengan seller ni,_
"Repeat kali kedua sbb mmg best,",_
it's not even a matter,_
Boleh guna masa malas masak atau travel,_
Mask kualiti kurang memuaskan,_
sesuai dengan muka,_
yeahhh dh smpai cuke anak dapat barang yang dia order,_
Good value for money got my parcel in 3 days,_
"Fast delivery and Good quality so i gave five star, thank you seller",_
barang pun quality baik,_
Part A : 3,_
yang paling penting material cotton,_
"Safely arrived,hope it is good",_
seller friendly sgt,_
"Penghantaran pantas, kualiti yg baik, berbaloi2 beli",_
"11 Tahun 2021 bertajuk Dasar Pelaksanaan Imunisasi COVID-19 bagi Pegawai Perkhidmatan Awam Negeri berkuatkuasa 14 Oktober 2021 telah dikeluarkan, katanya",_
jaga Amal,_
Tk Seller nanti,_
"Their inability to convert chances will be a concern for head coach Bruno Lage, as Wolves have not won at home against the Reds since 1981",_
Problems dekat pihak courier,_
dia ngam2 je,_
Kalau nak camera cantik kena beli yg mahal lagi la,_
Padu dan power,_
"Quality:1 year expired date , manufacture date is 2021 June",_
Plan maxis ke tu🤣🤣,_
saiz ngam besar sikit je,_
Penghantaran sangat memuaskan dan pantas,_
hhhj,_
Custom name tag,_
Tq sis brg dh smpy,_
Baru bayar seminit terus dapat kod,_
custome made pnye,_
the fabric is rather thin,_
Berbaloi2 beli time sale 12,_
"Thanks for the prices ,I don't have calculate now ,time saver",_
"Great plays last for a reason, agreed O'Hare",_
Tp delivery guna dhl teruk giler,_
Quality:kain yg lembut dan tipis saya suka,_
"First, the Fed's prolonged misjudgment of the inflation dynamic means that it now has to move virtually simultaneously with three measures that reduce monetary accommodation, greatly increasing the risk of a policy misstep",_
Warna pun bright cantik,_
8 brg smpaiii 20,_
"Kain tebal, tak jarang pun",_
Earphone function well!,_
jahitan kemas!,_
Baju- baju dah selamat sampai,_
Blh la dlm 20 gulung lebih centu,_
So I hope this is useful to me,_
"Fast delivery items wrapped properly and received in good condition not try yet, hope it's nice",_
Saya 158 berat 74 Ambil size Xl labuh and but boleh tarik ke atas sbb dia memeri and ketat sikit lah bukan ketat pingang ketat peha just nmpk bentukk tpi everything is okayyy i love ittt thnkyouuu sellerr🥰,_
ada wifi 5ghz tak ?,_
10 (9days to sarawak),_
Just bertutur ni aq tgk video is not the intended recipient you are not the same 🥺 my bias is a very good and the best of my bias in a few days to get the end of this video is currently in the video formats like always be a good time and kawin tu ain t t W the real definition filter pilih hok lm a,_
"Fungsi dia agak bagus, boleh swing kanan kiri",_
Got two pockets inside,_
"Berbaloi beli, tak tahu la bila nak habis ni",_
Cantik sngt🤩🤩🤩🤩🤩🤩🤩,_
Good product quality and good value for money very fast delivery and very well wrapped,_
"Just that there's a little bit of dust on the products, and I think packaging can still be improved (a little dent on my drinks), but nothing too bad",_
m a huge fan of the Galaxy folds - any time I see a guest at work with them I compliment the phone and say how cool I think they are,_
Matahari Blend got strong ashy/smokey flavour to it (true as advertised),_
SUCH A GOOD WAY FROM SELLER,_
Good value for money purchase during flash sales,_
makacehhhh seller semoga murah rezeki selaluuu,_
Beli untuk ank,_
Kena pilih saiz kecil sikit,_
overall puas hati lembut kain boleh pakai di rumah🥰,_
Pigment:bau sdp ssh je nk tanggalkn,_
Spears has profusely thanked the members of the $HASHTAG$ movement and said she is celebrating on cloud 9 after the conservatorship was terminated,_
Thank you seller all in good condition but sorry cause the picture and video is irrelevant,_
"Pigment:so pigmented ,",_
Ketebalan pon okay juga tak tebai & tak nipis sangat,_
Quality:4stars,_
"cantik sngt next time nak repeat , thank seller",_
Mcm benang putus,_
kasut nya bru sampai,_
Siap dapat free keychain,_
Tak smpat amek gambar,_
All the ordered items arrived safely and the delivery was quick,_
anak saya 7 tahun,_
Functionality:3pcs,_
Functionality:Alhamdulillah both received in good hands,_
Betul² baggy,_
"I ordered 3 pcs, why can't give different colour",_
A bit lossen,_
"anak tk naik ruam, tissue pn besar tebal",_
THNKS SELLERREEEEE,_
First time pkai,_
ni kali ke entah berapa kali beli di kedai ni,_
Material:getah lembut mmg sdp pakai waktu mlm,_
igt singgit lebih utk 5psg,_
"pnhntaran laju,bgkusan kemas",_
"Terima kasih seller , saya beli ye",_
"cantik je warnanya, tapi kat gambar i pakai flash",_
"Dah dapat, order khamis , sabtu pos ahad sampai order dekat perak",_
"This my second order from this shop and I'm very satisfied,will definitely order again!",_
Belum cuba pasang lagi,_
Will buy again if hv promotion next time,_
Thanks seller for the good job!,_
Korea samyang bulfak pack Ramen Hot chicken,_
Thanak you so much seller now anak buah saya dah mudah tidur sebab ada buai yuhuu mudah kerja,_
Terbaik terbaik terbaik terbaik terbaik terbaik terbaik terbaik terbaik terbaik terbaik,_
light light candy color,_
korang rasa boleh jual x ni?cuba like sikit,_
Except packaging could be improved more for better security & safe arrival,_
🤲 Thanks so much seller 🤗,_
Gambaq nampak quality tapi nipis baju,_
Taste:rasa kacang,_
"terbaik arrrrrr ,suka gilaaa",_
Aku bg 5star sbb guna jnt,_
Tak de bubble wrap langsung,_
"Sebelum ini, Kerajaan China dikritik kerana membina empangan di hulu Sungai Mekong, yang didakwa telah menjejaskan paras air dan perikanan di negara jiran",_
"The shipping is very fast, the item is also good, my child likes it, thank you seller, hopefully the seller will be more creative and successful",_
Seller comel je buat note untuk kurier 🤭Alhamdulillah,_
malas nk tarik dari stor so beli la yg comel ni,_
i buy it cus of my online class heheheh,_
"Product received in good condition, packaging acceptable",_
Best sgt2 baju dia,_
$MENTION$⃣ Without owning the nationality?,_
Penghantaran mmg tetbaik,_
Colour green tuh cantikk,_
"Saman itu bukan kali pertama dari firma gergasi teknologi itu kerana Facebook pernah menyaman NSO Group pada 2019 dengan mendakwa mereka menggunakan WhatsApp bagi menjalankan pengintipan siber terhadap wartawan, aktivis hak asasi manusia dan lain-lain",_
tak cukup lagi kena tambah lagi,_
Sesuai untuk sampah yang tidak berat,_
Baju lawa terukkkkkk,_
Suka sangat 🤭 ada rezeki saya repeat order lagi,_
Barang sampai dengan cepat dan selamat pakajing terbaik seller ada kasi tutorial memang terbaik seller!,_
Can be hard to find what you need with all the ads,_
"no problem to order, received with good condition,fast delivery",_
"Companies such as Amazon, Walmart's Flipkart, and Indian food delivery firm Zomato, who are likely to be affected, also did not immediately respond to a request for comment",_
extremely fast delivery with excellent packaging at affordable prices,_
Parcel sudah selamat sampai dan diterima dalam keadaan yang baik,_
Dan x lupe tq jugak kpde brothe yg hntar,_
Next time sy repeat lg ye,_
rate based on received item not on usage,_
ini kali kedua,_
GoodgoodgoodgoodgoodgoodgoodgoodgoodgoodGoodgoodgoodgoodgoodgoodgoodgoodgoodgoodGoodgoodgoodgoodgoodgoodgoodgoodgoodgoodGoodgoodgoodgoodgoodgoodgoodgoodgoodgoodGoodgoodgoodgoodgoodgoodgoodgoodgoodgoodGoodgoodgoodgoodgoodgoodgoodgoodgoodgoodGoodgoodgoodgoodgoodgoodgoodgoodgoodgood,_
Very fast order processing by the seller and received in good condition,_
pakai ketat skit,_
are bhai aap unboxing kar rahe ho gta v ki video toh daalo pleaseeeee,_
Chose pikachu yellow but seller sent dragonball,_
Well received free gift mentholatum lipbalm,_
Kelisa semua 4 pcs ngam,_
Pls do delivery when people are home,_
"Note that while in Berlin, scooters make up the majority, in Paris, it's bicycles that are the most numerous",_
Tq222222222222,_
"Nice seller ,good",_
baju pon ngam ngam,_
Dua² cantik,_
"Penghantaran pantas, shipping pantas,semua pantas, barang baik",_
So far the product is good everything just,_
semua dalam keadaan baik dan penghantaran yang sngat pantas,_
"Mmg terbaik pghtran laju, brg2 berkualiti tp hrga berpatutan",_
Knp skng minta pembaharuan mulu ya',_
I love those drones eye view video clips,_
f gs fdg af,_
I have a lot of trouble lately,_
Quality:Good 8,_
Taste:barang cepat smpai!,_
"Nak nmpak sopan boleh pair dgn mini skirt before pakai jeans, or else just wear it with long skirt",_
-love you,_
57🧐🧐,_
Bapa kali dah repeat,_
SELLER MEMANG BAGUS CEPAT JE POS,_
"Harga yang murah, penghantaran yang cepat dan bungkusan yang baik dari shopee dan seller",_
Dah banyak kali beli dengan this seller semua puas hatiii,_
"Received in good condition,tq sellerrrrrrrrrrrrrrrrrrr",_
Selasa je harga pun murah kat sini,_
Items received in good conditions no defect,_
Mantaaaaaaapppppppppppppppppppppppppp,_
u are truly recommended,_
"Prompt replies from seller, attentive and helpful",_
Tpi xcuba lagi,_
Hrp boleh trunkn berat badan jugak,_
"LONDON: TikTok has been in discussions with the UK government over the past few months to locate its headquarters in London, a source familiar with the matter said, as part of a strategy to distance itself from its Chinese ownership",_
Pakai pun tak panas mmg sangat selesa,_
nt dah consume sy update balik review,_
dok install bnyk kali dh ni,_
Na scam naden ako nyan ni oppo dati eh a3s almost 10k 3gb ram 32gb rom hahaha camera lang tlga nagdadala sa oppo hahahaa,_
Supermodel hangatkan FKLFW RTW 2017,_
Is worth buying for newborn as is cheaper than other brand but the function is the same,_
Jangan belilah very poor quality,_
Bra pun okay je,_
kne glue uhu,_
"Sekiranya anda kes positif rempit yang berada di rumah, pantau diri sendiri setiap hari",_
Quality:Brg smpai amat memuaskan,_
terbaikk terbaikj,_
All item nice,_
kalau nak buat pi jogging yang pakai tudung tu better pakai cardigan,_
Anything I will repeat again,_
Service sepantas kilat sangatlah recommended,_
My kid loves the animal figurines,_
"The price is competitive among the seller, can't wait to try as good",_
Babshdhdhffhffhfhfhfffdhhdhdhdhdhddhdhddhddhddhdhhdddd,_
Semua item cukup cuma cermin tue jer la xdpt macam dlm gambr tue,_
Kotak langsung tak kemek,_
Berbaloi beli beg cantik,_
Sherlyn Wee,_
qttq,_
"the material, sooo gooddd gurll",_
"barang murah, barang cepat sampai,barang dalam keadaan baik,hehe",_
cantik sgt5,_
I even named it,_
But Tuchel still has to find a way to get the best out of Chelsea's record signing Romelu Lukaku who missed two good opportunities to put Chelsea ahead in the first half and was denied by Spurs goalkeeper Huge Lloris after the break,_
"Xu Liping, director of the Center for Southeast Asian Studies at the Chinese Academy of Social Sciences, said with the United States fixing its eyes on China and attempting to sow discord in the region, China-Asean cooperation will not be without challenges",_
"Ordered on 25th, received on 2nd April",_
"After receiving the goods, intact inside, very slippery, cloth is very soft, will not be very",_
recommend korang tolong beli ye 🥰 terima kasih permudahkan kerja saya kemas barang balik poli 🤲 okay memang mantap!,_
The WiFi connection and app is also useful,_
This item is really cool,_
"Kain tebal,sejuk n tak mudah berkedut",_
"Smua wangi, sya suka honey dew Dan pandan",_
kain selesa xpanas sangat,_
Tgk harga kita bayar la,_
cari di kedai x jumpa,_
can bay again,_
Material sangat berpuashati & berpatutan dengan harga,_
I'm giving 3 stars cz the packaging was just like the other reviews: Poorly done,_
Bagus betul service puma ni,_
"Sorry, video tiada kena mengena overall semua bagus, sangat puas hati, tq saller",_
Sebab yela nak pakai utk doc sikit ii je,_
produk okey stkt ni penggunaan printer xde msalah murah dr keddaiiii,_
"pulang,",_
"Functionality:Good, easy to tear off and stick close",_
sy beli lagi,_
Sangat berpuas hati parsel pun cantik dan boleh repeat lagi,_
but have to said Grab really need to improve the service of Grab Food,_
Thank for 5th,_
hrp kukuh la,_
Seller respons ok,_
Barang smuaa okayyyy,_
Thank yoi seller for delivering it in really secure box,_
"Maybe i bought wrong shade, it more to orangish like that hmmmm huhuhu i have fair skin huhuhuhu",_
Received : 17/11,_
Sy bg sejuta bintang buat kedai abg,_
In sha allah ok dengsn skin dia,_
Well received with many many thanks!,_
Yusoof Taiyoob ~,_
"item tiptop 100 ,ngam dgn hrganya",_
Item expiry date : 30,_
okokokokokokokokokokokokokokokokokokokokokokokokokokokokokokokokokokokokokokokokokokok,_
"The shoes are light, flannel like insole and comfortable to wear for wide feet (but not for longer time)",_
thx free gift boss,_
Sempat nilai,_
Asap tebal,_
bayar rm4,_
Jamie Spears' removal has been a longstanding demand of devoted global fans campaigning under the $HASHTAG$ slogan,_
ni semua sbb racun TikTok and kite tgk review semua ok kite pon abeskan aje la duit aish,_
Good price good quality fast delivery good packaging,_
fast shipping saranghae tto saranghae,_
GOOODDD QUALITYYYYY GOOOODDDDDD PRODUCTTTTTTTT WILL SURELYY REPEATTTTTT!,_
"No Twitter,",_
Comey kasut,_
memang nipis tapi kain sejuk,_
hehahu,_
"Sgt mudah dan selesa, terus beli dua senang",_
Bang for the buck at ~ Rm 15,_
barang dibalut elok,_
xlaju xjuga lmbt,_
Dan delivery agak cpt jgk,_
Waterproof:best je,_
Taste:sampai dah beli masa promo 25/2 dapat murah banyak next nnty promo kita repeat lagi,_
"want a high five,",_
Setiap dicancel dri 2kali dh g dpt pengemudi,_
"Gambar depan tunjuk earloop, nasib betul headloop",_
Lebih 3 hari juga baru sampai,_
Just the taste so so,_
Tp boleh digunakan tanpa masalah,_
Can't install the new update,_
Masih belum dapat lagi charge,_
barang selamat sampaii cume ada pecah sikit sbb dia letak dalam kotakkk jeee hmmm pape pun tq,_
But I don't dare to try,_
Foc 99,_
nice and good quality tee,_
Disney+ added just 2,_
dpt cincin,_
rupanya lgi satu kipas dia sumbat sekali smpai kemek cover kipas tuu,_
Mancy Loo,_
Tq seller and jnt service,_
Material agak memuaskan pada harga rm6,_
Yap Yong Ching,_
"Item arrived in good condition,secure packaging and fast delivery,first time buying if delicious will buy agaian",_
Ada lagi vc,_
🤣🤣🤣 tq seller recommended seller,_
we will have an analyst meeting with old footage,_
Brg sampai habis kemek,_
"Very recommended to buy from this shop, price is quite cheap also",_
Berat 68-70,_
Gmbr tkde kena mngena,_
im wearing size m,_
hujung x berjait,_
Tq besar,_
Akhirnya berjaya pasang,_
Andai ada masalah saya akn chat okay,_
Need more storage and want MagSafe accessories!,_
"Meanwhile, data Friday is forecast to show the jobless rate fell in December to a new pandemic low of 4",_
"Both sides agreed that in the future there will be even more cooperation on chip supply chains, there will be a complete framework, a system, to have all round cooperation on semiconductors and other industries the two countries put importance on, he said",_
Sorry gambar video takda kena mgena,_
Alhamdulillah nyaman gk ada masalah,_
Bestnya Bestnya Bestnya Bestnya Bestnya Bestnya,_
This brand has valid for money better than other baby laundry,_
HOPE SHOPEE CAN CHANGE RULES,_
dan tidak rosak barangnya dan penghantaran sangat pantas dan paling penting trusted,_
"RM0 ASTRO FIBRE: One Home, one Internet!",_
Korang boleh beli kedai ni dah lah kat malaysia,_
even lambat smpai tapi still memuaskan hati,_
Effectiveness:berkesan untuk batuk2 sapu kat bahagian dada dan belakang badan,_
Very good good good,_
All size correct,_
Harap semuanya baik2 saja,_
Very well packed and very fast shipping and delivery,_
"Kebetulan nmpk kt shocking sale, dpt pulak redeem shop voucher",_
"Song Saran, president of the Cambodia Rice Federation, said RCEP will ease trade in goods in the region and all participating countries will benefit from it",_
meja semua ok,_
maybe is the material and not so thick,_
Please look into smaller details seller anyways thank you sm,_
black sugar don't have the label difficult to guess what favourite,_
suka dgn material die ringan & selesa patutlah cepat sold out harga pon berbaloi shipping & wrapping mantap!,_
"Kasih, penghantaran yg cepat",_
x pasti lah smada,_
"Brg elok , walaupun dpt satu je,tapi brg okay, semoga murah rezeki",_
Ramliberes punya product is the real thing!,_
tp kaler cantik,_
"But details of the meeting are unclear, including the level of shareholder support it will require to continue with the plan",_
The delivery was pretty fast which is good,_
The hearing is expected to conclude Friday,_
"Nk byk kan viewer, ko ckp lah ada antu bagai, abah kau lah meed",_
This cloth fades when washed in the water,_
seller pm susah nak blas chat,_
alhamdulillah tq seller rrrrrre,_
i am 5'4 and the mukena is just slightly short for me but its not that much,_
Hari nie oder esok dah smpi,_
Delivery within 10 days since I ordered before SK Shipment,_
Great item and superb service,_
"Program ini adalah kesinambungan Skuad Keluarga Malaysia, yang dilancarkan Perdana Menteri, Datuk Seri Ismail Sabri Yaakob, pada 23 Oktober lalu di Kuching, Sarawak, yang bertujuan memulihkan negara daripada kesan pandemik COVID-19, katanya",_
The 6 is 1080p,_
x recommend beli ngn seller nih!,_
"Smooth and nice to use, size is also ngam ngam",_
selalu membantu perjalanan ku,_
"Bolehla untuk harga dia, rm5 lebih je kan HAAAHA",_
saya tak perasan saiz,_
"First time bought this, hope it taste good sad, limited to buy only two at promotion price",_
Kali ni smpai trbeli yg besar giler punye bracelet sbb lawo sgt,_
You should give the option to review the orders apart from asking it,_
Thank you seller 🥰🤩🤩🥰🥰,_
$MENTION$ idk lol,_
Tak nipis n tak melekat2 dan mudah nak urus,_
"HONG KONG: Asian shares again ignored record highs hit elsewhere in the world to fall on Friday, with declines in chip manufacturers weighing on several markets, though Australia bucked the trend",_
Teruskan promosinya untuk Grab,_
"Fast response, fast activation, genuine key",_
Too much high prices as well as too high delivery charges,_
Walaupun murah tp kasut selesa & lembut dipakai,_
Taste:goooood,_
instead of rm80,_
My fav baby shop,_
Bila dipakai memanh xbest,_
"beli time sale mmg berbaloi, barang semua okay, packaging so good",_
the shirt fits perfectly and good quality too,_
Try the dented lychee taste still nice,_
Jenis x pnas,_
Puas hati dapat beli harga murah sale 7,_
Kualiti baju cantik,_
Kain okay dan cantik,_
tertukar agaknye,_
test all ok,_
mmg cantek dan Pembgkusan yg sempurna,_
Order 25 june at,_
25 coup ended a power-sharing arrangement that began in 2019,_
Saya masih alami pendarahan,_
mantap pak abuuu,_
"Hi, we are Google, one of the largest companies on the earth",_
"The competition, mooted by the University of Nottingham Malaysia (UNM) in collaboration with Maya Press, called for the submission of original unpublished poems on any topic, and was curated for Malaysian writers of all ages to showcase unique literary perspectives",_
seller please lepas ni allert dgn brg yg pelanggan beli,_
Yes I know,_
"tq ira,saya beli ye",_
"Markas Divisyen Kedua Infantri Malaysia (2 Divisyen) dalam kenyataan hari ini berkata, kehadiran mereka disedari anggota pasukan Briged Keenam Infantri Malaysia yang melakukan rondaan di jalan keselamatan sempadan Malaysia-Thailand, kira-kira jam 1 pagi",_
"Dah lah besar, murah pulak tuuu",_
🥰 🥰 serum rambut baru nk cuba🤭suka serum wangi sangat,_
ape2 pn saya beli,_
"THE much-anticipated Robina Eco Park in Teluk Ayer Tawar, Butterworth, is now open to the public following completion of its upgrading works",_
"Dia punya wrap,",_
"2nd time repeat, colour cantik-cantik",_
"efficient, effective n express",_
"barang sampai dalam kotak okay tak kemek line laju instruction ada kalau tak faham charger boleh guna beli untuk online class, so far so good",_
Bhg atas tu mcm kain,_
sama pakai Dan x pakai mask,_
ADOREI,_
"bila message masuk, bergetar kuatt",_
Selesaiiuu,_
"Cheezilla Double Down, 1 piece of chicken, whipped potato, drink",_
"Purchase yg kali ke 10 kot, thank you kak dee!",_
"Mengulas lanjut, Yuan berkata, antara penyelesaian perniagaan ke perniagaan yang tersedia dan dipamerkan di CSIC, termasuk penyelesaian 5G Huawei di seluruh dunia, termasuk penyelesaian bagi bandar pintar dan kenderaan autonomi serta sistem Pendidikan Pintar Huawei",_
Didn't try yet but I hope this will be good product,_
kain nipis sikit tp sesuai la dgn harga,_
terbaikkkkkkkkkkkkkkkkkkkkkkkkkkkkkkkkkkkkkkkkkkkkkkkmk,_
"Taste:Sedap, daging pon lembut",_
Berbaloi& berpatutan harga,_
Berita baik untuk penggiat seni,_
semiga bertahan lama,_
Kehadiran penonton di Litar Tangkak buat pertama kali sejak musim 2019 turut memberi motivasi tinggi kepada pelumba elit kelas CP150 itu,_
"Tiba tiba pesan pengemudi otomatis, berulang, sampe banyak Driver yang nelfon saya karna orderan",_
Buy during sale much more cheap,_
So yeah act i beli for my friends cause hrituuuu i pecahkannnn dia punyaaaaso i beli dia punya stress ball kat dia ni tapi i beli ni lagi cntik dri dia punya lah,_
sorry gambar takde kaitan tapi seriously penghantaran cepat!,_
"good quality wallet, really love it",_
Selamat terima produk,_
kuantiti dia makin lama makin nipis jer,_
terbaikk boleh meregang dah boleh la tahan lama compare kualiti made in china dan uptown,_
No hard smell and not so sticky and oily to my face,_
Sangat tidak bertuah kerana tidak berfungsi sangat sedihh,_
Faaassssstttttttttt deliverrrrrrryyyyyyyyy,_
Seller terbaik guys,_
"elw vms hc' bde fyzc , jatk vww",_
"okey je pakai ngam je, overall okey cuma dia punya hoodie agak pelik dan kelakar hehe",_
bungkusan yang kemas dan rapi,_
Some worst some not so,_
Kelvin Soo,_
Dah smapaii,_
