Sentence,Tagged_Sentence
nice utk muslimah,_
wangi pulak tuuu,_
Delivered 17dec,_
belian yg Kali ke 6 dengan seller ni,_
Baju set dah smpai dgn selamat,_
kad nya semua cntik2,_
My membership from Platinum downgrades to Regular without any reminder,_
So far it's workable and monkeys stay away from my farm,_
Repeat kali ketiga beli,_
Tqq barang selamat sampai barang berfungsi sgt baikk tq sallerrrrr,_
"Berikutan peningkatan kejadian sebegini, adalah sangat penting untuk kita mencari jalan penyelesaian secara holistik",_
Baru la tak kena kecam ðŸ¥°,_
Good packaging parcel receive in good condition,_
baguihhhhhhhhhhh,_
"lumpiya mi yapiliyor,",_
logo dia sulam bkn tampal,_
Took some effort to install and had to bend the wire frame just a tiny bit coz was really a tight fit,_
Super simple to navigate had an amazing shoe buying experience,_
Storage besar dan sedap pakai,_
App is easy to install but took quite a long while for it to connect to WiFi,_
boleh msuk bntal leyna,_
"Kualiti product terbaik, harga baik dan berpatutan, penghantaran yang sgt lambat dr shopee express",_
4 pad nicely,_
Kirain Treasure yang lain wkwkwk,_
GOODGOODGOODGOODGOODGOODGOODGOODGOODGOODGOODGOOD,_
Mantap terang sngat memang puass hati kena dengan harga,_
I spend my most time in &$HASHTAG$,_
s best smartwatch!,_
time try brand ni,_
Next time repeat bgi design yg berbeza ye,_
Sory gmbar xda kena mengena Terbaik sngat2 puas hati Terbaik sngat2 puas hatiTerbaik sngat2 puas hatiTerbaik sngat2 puas hati nnt boleh beli lg tq,_
Pretty bag and very affordable for the price good product quality good value for money also fast delivery this my sec time buying will also repeat again later,_
"Waalaikumussalam, boleh Case 1 : <a href=$URL$",_
This product is good Now i don't have to worry about my arms feeling pain while doing work,_
"Beautiful colour, good value for money, fast delivery, thank you seller",_
Effectiveness:nipis sedikit,_
belum pasang sbb nk tunggu tinted biar kering betul Â²,_
warna dan jumpa pun mmg tepat seperti yg di order,_
"Allahyarham Aji atau nama sebenarnya, Fauzi Samin yang juga pemain gitar terkenal meninggal dunia akibat serangan jantung pada 5 September 2019",_
Padahal tgh hari ni,_
Brg semua dah sampai tq seller,_
"Very useful for last minute notes spm ,",_
Postage lmbt sikit tp overall ok,_
"I've check , then ot say my ordered was cancelled ,",_
nak pakaikan kat anak,_
Harga baloi lah jgak,_
"OVERALL NICE BOLEH GUNA ,",_
pinggang ap semua tu cun,_
"maaf gambar tiada kena mengena , baju semua baikk selesa pakai",_
Kali ni klo order nak beli UTK mak di kampung,_
"beli sini je,murah pun murah",_
"Good packaging, undeniably good products",_
don't sell it out !,_
Nnt blh repeat oder lg,_
jenuh menunggu tapi puas hati packaging memang secured maaf video tak berkaitan,_
"epal,mne satu strawberry",_
"Kalau muka anak kecil, boleh pakaikan kerongsang",_
"delivery agak lambat tapi takpee , tudung sampai dalam keadaan baik , sama macam dalam gambar , insyaAllah repeat lagi nanti ðŸ¥° thankyou seller",_
item cukup dan xde maslah akan oder lagi,_
"penhantaran cepat, bungkusan kemas, brg sampai dlm keadaan selamat, kuality sepadan dgn harga",_
apapun kasut cantik sesuai dgn harga,_
bru order 3 hari sampai,_
Second time beli memang puas hati,_
BOTH keyboard and mouse in good condition,_
ðŸ¤©ðŸ¤©ðŸ¤©ðŸ¤©ðŸ¤©ðŸ¤©ðŸ¤©ðŸ¤©ðŸ¤©ðŸ¤©ðŸ¤©ðŸ¤©ðŸ¤©ðŸ¤©ðŸ¤©ðŸ¤©ðŸ¥°ðŸ¥°ðŸ¥°ðŸ¥°ðŸ¥°ðŸ¥°ðŸ¥°ðŸ¥°ðŸ¥°ðŸ¥°ðŸ¥°ðŸ¥°ðŸ¥°ðŸ¥°ðŸ¥°ðŸ¥°ðŸ¥°ðŸ¥°ðŸ¥°ðŸ¥°ðŸ¥°ðŸ¥°ðŸ¥°ðŸ¥°ðŸ¥°ðŸ¥°ðŸ¥°ðŸ¥°ðŸ¥°ðŸ¥°ðŸ¥°,_
So it's okayy,_
Entam jela labu,_
"WPKL - 573 (173,812)",_
boleh repeat order pagi,_
My screen become blank,_
"Thank you reseller, barang dah sampai",_
Love for OnePlus $MENTION$,_
"Item received well, expired date still have time , delivery as notice next day delivery, great service, thank you seller",_
Tidak melekat pada hidung,_
Lau ok repeat lagi,_
My mistake in counting the patches,_
Selesa pakai waktu sejuk,_
We need bright colors especially now,_
Saiz kecil klu nak bli kna abl saiz besaq dri biasa yg kta pkai,_
Goods Design Goods specs plus that speaker man it really sound premium $MENTION$,_
Penghantaran ambil masa 2 hari je,_
xsabar nak main bola,_
Kecil molek,_
Its keep log me out off my account,_
"ingt kecik , besau rupanya mntp mntp mntp mntp , tngh fikir nk letak apa sbb besar hahaa",_
It really holds your glasses in place,_
Original sabahan,_
Cant use video auto motion,_
tp tgok kt penilaian,_
walaupun kualiti bunyi belum setanding jenama2 otai tapi dengan harga bawah 100 tranya sudah berikan lebih dari cukup,_
"3 per cent in 2022 following an expected 8 per cent growth this year, a top government think tank said on Monday (Dec 6)",_
"Packed well, good quality, love the texture",_
aritu aku usha wrna biru,_
"Items received in were well packed ,good value for money",_
mantapgmbr xde kene mengene hahahah,_
buat pkai dgn mini dress or blouse pun helokk,_
"Affordable price tqsm seller,",_
Durability:thanks,_
tested and working as it should,_
cuma suar uniqlo tu kcik,_
dia lebih kpd natural oak punya color dgn campuran sikit je yellownya,_
"Fast shipping recommended, and it's so cute!",_
Ape pn tq seller tq courier,_
Nak buat camna jnt perak selalu peram barang,_
Setia alam,_
Actually panties for kiddos,_
je dh smpai,_
Merchants worth buying!,_
Bole gune,_
Nice and Convenience to use,_
Memang sesuai sgt dgn ketinggian 155 berat 53 mmg cun amik saiz xxl,_
Nice jugak nih,_
Now people would have to choose to not have it on their phone or risk the security of their phone,_
cantik byak poket,_
BARANG DAH SAMPAI TQ TQ TQ TQ TQTQ TQ TQ tq tq tq tq tqq tq tq tq tq tq tq tq tq tq fq tq tq tq tq tq ta ta tq ta tq ta ta tq tq qtq tq tq tq tq tq fq tq TQ TQ TQ TQ TQTQ TQ TQ tq tq tq tq tqq tq tq tq tq tq tq tq tq tq fq tq tq tq tq tq ta ta tq ta tq ta ta tq tq qtq tq tq tq tq tq fq tq,_
Economy itni kharab ho gayi ab companies phir se back to back budget phones launch kar rahi hai,_
Expiry in March 2022,_
Pengurusan kes saman Najib terhadap Harakah 26 Jun,_
Arrive within 2 days,_
"Blusher pun not bad, ada brush kecik dlm tu tapi keras eyeliner pun okey, tak terlalu tebal",_
I took realme pad,_
"Users who see ads without a political disclaimer may not be aware that their intent is to influence them, they added",_
Seller sangat friendly ðŸ¥°ðŸ¤©,_
Have been drinking this for many years,_
"Received in good condition , fast delivery and good service ,thanks for seller",_
Material tudung soft,_
"Gonna have good time using these, help me saves space",_
Tak sempat nak snap kasut,_
nanti repeat lagi beli penghantaran pon cepat packaging selamat tkde bocor,_
"For the price, this is the best spec on Shopee",_
beli buat sampin,_
"x bancuh lg,bau sedap",_
belum try lagi hrap ok,_
"received mine today, the watch very nice and works well",_
terbaekkkla macam beli dekat butik,_
Chin Chin Lee,_
btw delivery cpt gila n warna cantik gilaaa,_
All item received in good,_
Koko krunch ni i beli utk anak i,_
Best Best Best Best Best Best Best Best Best Best Best ðŸ¤©ðŸ¤©ðŸ¤©ðŸ¤©ðŸ¤©ðŸ¤©ðŸ¤©ðŸ¤©ðŸ¤©ðŸ¤©ðŸ¤©ðŸ¤©ðŸ¤©ðŸ¤©ðŸ¤©ðŸ¤©,_
"The shorts are a bit hugging to the body, so if you got thick thighs better get a size bigger",_
THE BEST SHOP EVER,_
This was in line with what the market was expecting with polls by Bloomberg and Reuters expecting the central bank to maintain the benchmark interest rate,_
"Good product quality, worth every penny!",_
"Kain sejuk, bahagian leher pon panjang",_
pnghntran pntas cma abx ambik msa skit,_
seller pon bg respon,_
Beli 200pcs,_
Beli utk bg birthday gift kat kawan,_
Next year Tim Cook: the new iPhone Marques: so I've been testing the new iPhone 14 Pro for a few months now,_
Utk ref bakal pembeli,_
Terima kasih seller barang cpt smpai terima kasih bnyk bnyk mmg fast shipping fast post fast delivery,_
Tqtqqtqtqtqtqtqqtfqfwgvfncnckckcncncjchcgchxxjxfmxbbxchjcncnncbcbcbcnjxjdidjdhdgdgdgsvshshdgdydgvdhddjbxvdgdhdhhdfbhdj,_
"It is also true to size, if u r a size S then just take back size S",_
yg backpack comel gilerrr,_
Mmg akan repeat lps ni,_
10/10 would recommend to those looking for a good foot massage,_
Hidjnddbdjdjdkekenebebeneieejbenrrbbrbrbrjrjrnrnrnrnndnrnr,_
xrushing pun,_
cantik hahaha warna hitam is a must okey sbb look perfect jee nyah,_
Awning ponn onzz,_
When a driver cancelled my booking you will get 50 pesos?,_
Functionality:lampu berfungsi dengan mode,_
Terbaikkkk keje yg lajuuu,_
xtau pun adq mask dlm tu,_
"Oh yes love it,",_
"Kalau ada masa lagi,tengok",_
", tapi bagi 2 star sbb just 5 hari dh dapat selalu 9++ and dapat freebies , anyways tqvm <3",_
"and i really love it,",_
Received in good condition excellent service fast delivery thank you,_
"Packing very good ,cheaper buy at 11",_
"Biden setakat ini ini mengekalkan pendekatan tegas ke atas Beijing seperti yang dilakukan presiden sebelumnya, Donald Trump, dengan kedua-dua pentadbiran melihat kebangkitan China sebagai cabaran terbesar di abad ke-21",_
Rasa nak beli semua warnaaa!,_
Pictures are for 1st purchase,_
Warna pun comel,_
"Hiii , i love this band &quot",_
Tp tksedar yg dia ni makin membesar dgn sihatðŸ¤£ So klau tkmuat nanti sedekah dkt org jela,_
Soopiiiiii borrrinnnnnkkkkkkkkkkkkkkkkkkkk just give it the coinnnn meeyyyhhhhhhhh,_
banyak lg nk kena explore nie,_
The courier service provided is pretty good,_
Fast delivery by spxmy,_
saiz beg pun ok xbesar sgt,_
"so far okay i can login to given account, hope i can keep using it in future",_
but baby still dapat tdr,_
-harga mahal sikit,_
sampai je terus cuba pakai,_
design kad cun,_
For me the material dia apa yang i cari selamni and the measurements pun apa yang i nak,_
Ok la cantik cuma terlalu labuh kain ok alhamdulillah brg sampai dgn baik dan cepat,_
Cuma wayar usb terlalu pendek sgt,_
Saya Beli tiga helai memang puashati,_
"Comel jaa , sampai dlm keadaan yg baik tapi btry belum psg sbp skru tu rosak mcm2 try skru dah try buka tp blm dpt buka x pe la janji comel thank you seller",_
Btw will buy again from this seller!,_
Penghantaran yg sangat cepat jumaat order ahad dh sampai,_
ruang lebih besar berbanding 4r dan size polaroid,_
Bhgian pinggang Je lbh krng seinci dua gitu,_
but tgk review semua kasi good feedback,_
Alhamdulillah basikal ni ok untuk dia,_
TAPI HARAP SELLER TAK REPEAT KESILAPAN ðŸ¤—,_
Cuma packaging boleh improve lgi,_
Mmg ngam d bdn just bju lbih skit la,_
A bit intense but works good in refreshing,_
And love these designs,_
barang dh selamat smp kt ank di asrama,_
Ordered for first time,_
Cepat ttttttt sampaiiiiiiiiiiiiiiiiiii,_
I'm going to face SPM,_
Bought for them and they really liked it,_
Gambar takde kaitan sbb bagi hadiah dekat kawan heh btw tq sellerrr stokinss so cute sukaa!,_
Barang dah sampaiiii tapi baju terlampau besar untuk saya salah amikk size,_
can't wait to go to primary school,_
Goooooooooooooooooooooooooooooooooooooooooooooooooooooooooooooooooooooooooooooood,_
co/cl4xc1i,_
Jsjssjsjsjssjejrjrrjjrnrjtjjththththhththththhtthhththrrhthrhrh,_
Tapi sy punya kalau ke atas diaa jadi terbukak itu yg lubang dia ku pusing kebawah tu,_
Jemput like page fb : Hitam Putih Homestay Muadzam Shah,_
The size and measurements mentioned is exactly as per reviewed,_
Spek dh sampai,_
Beli utk anak f1,_
Item berfungsi elok,_
Best lah xkan mengecewakan,_
ðŸ¤ 100 lomo card ðŸ¥°,_
urusan bersalin nanti ye,_
Nice texture and smell,_
I'm in love with this door gift bride n groom boxes!,_
"Height: 165cm Weight: 65-66kg, its quite long mmg labuh gila kalau amik size XL (sy ukur labuh XL=42 inci) if amik size L je pun ok dh",_
Sooooooooooooooooooo gooooooooooodddddddddddddddddd,_
second time order fast delivery and and no damage and its work very fast charging,_
"$MENTION$ à¤¦à¥‡à¤¹à¤°à¤¾à¤¦à¥‚à¤¨ nope, apart from Samsung smartphones you will get Google dialer in every UI",_
bersih rmh,_
cantik suka sangat nak pakai untuk raya,_
Gamba takde kena mengena tapi barang sesuai dengan harga murah,_
Anak suke ibu pun suke,_
"X rugi beli, dh 2-3x repet belk",_
Aishah Ecah,_
"dapat yang seller salah pasang, camno nak buat tripod, adui OKU plak tripod ni, Bluetooth pun hp xboleh detect",_
bju ngam dgn bdn saiz M,_
Cepat je shipping,_
Bag pon cantik,_
tp if ada defect sket tu normal la nama pn bundle,_
The socks is okay!,_
warna pon cantik lembut ja,_
rasa buah buahan yang mengiurkan,_
75 sen to get this with free shipping fee!,_
cuma 0,_
baran sampai dengan elok tiada kerosakan,_
"Highly recommend to buy from this seller, fast delivery and also genuine product",_
Okay gamba takda kena mengena,_
My doter love it so much,_
ARRIVE IN GOOD QUALITY TQ SELLER ARRIVE IN GOOD QUALITY TQ SELLER,_
Hubungi 0199009300 utk maklumat lanjut,_
Be accurate in delivery time,_
Stokin dan kasut saya beli alhamdullilah ok,_
Colour is so pretty!,_
Taste:Love this brand,_
semua item in good condition,_
Overall semua berfungsi dgan baik,_
Material:Alhamdulillah tasbih di hantar dalam Keadaan baik,_
Thanks Seller fast arrangment !,_
His humor is in another level,_
and jimin just &quot,_
This seller really helped me on fast shipping,_
tak ad defect,_
the results may be vary,_
inshaAllah next nanti nak repeat lg,_
Doesn't work on my device,_
Great experience as a customer but a horrible one for their riders,_
"However, Shima clarified that it was a scene from her latest music video titled Lalai and that she was unaware of how the images got circulated",_
"Good product quality, good money, fast delivery, good value,maaf gambar tak berkaitan sb nak coin huhu",_
Breathable Girl's Boxer Cartoon Solid sudah terima,_
"Cantik, color sama macam dalam gambar",_
"Warna pigmented sangatt, boleh laa untuk main main make up, nak beli mahal mahal jarang nak make up, so membazir jer",_
perghhh jadii bohh,_
"Bahkan Bernama difahamkan, beberapa pakar merawat ketagihan dadah sudah mengemukakan permohonan kajian berkaitan penggunaan kanabis untuk penyakit tertentu susulan kenyataan Khairy itu",_
"Terbaik, size ngam dgn badan kain nipis sesuai la dgn malaysia yg panas",_
Okay comel dan selesa suami suka Okay comel dan selesa suami suka Okay comel dan selesa suami suka O,_
brand shee shee saya order size M pun still pendek,_
Seller ship out laju je,_
"Kereta tidak loss power, atau liking, minyak hitam Tak penah hilang apabila guna minyak mizu ni",_
"I purchased these through toys wonderland, but it's already been 4 days and i still haven't gotten any updates from dhl",_
oyi suka gila makan snack ni huhuhuhu,_
"Good packaging of producuts and fast delivery,",_
mmg tidak mengecewakan,_
Outstanding quality and worth the price tag,_
Super-FAST delivery,_
Thanks plz send gift it India,_
Takda delayÂ² dari pihak seller,_
"harga murah juga , next boleh repeat order",_
VOD below my expectations,_
alhamdulillah sampai cantik sangat2 puas hati beli nanti boleh beli lagi,_
"buy for all my family devices, they really love it",_
Suri rumah,_
"Bantuan ini bertujuan meringankan beban kewangan pelanggan Maybank yang terjejas akibat banjir, yang turut menyebabkan",_
Kampar district police chief Supt Hasron Nazri Hashim said the 17-year-old was detained at 11,_
"5km line of bicycle routes involving an area around the lakes with a connection route to Kuala Lumpur Forest Eco Park, he said",_
Another reason to look elsewhere,_
Outclasse,_
Puas pulak tu banyak features boleh guna and paling penting takde watermark!,_
smpai penghntran cepat jugak,_
"I would repeat here soon, thankyouuu",_
Bought it for him hope he likes it ðŸ¥°,_
"Kalau yg size besar ok je xlicin sbb ada lptop berat kt atas dia, so x gerak",_
"3 billion in June last year, he said: We are open to improvements",_
Seller ramen terbaik,_
"Fast delivery, item in good condition, good packing, trusted seller",_
"Love those cute cute figurines, the owl, fish, doggi, sheep",_
Beli untuk anak dia suka ok laa,_
Item was wrapped safely and securely,_
"Presiden MPM, Datuk Seri Megat D Shahriman Zaharudin berkata pihaknya mahu menjadikan AYPG 2021 sebagai platform, membantu atlet negara mencatat rekod dan mata kelayakan diperlukan, bagi memudahkan mereka menyertai mana-mana kejohanan dunia selepas ini",_
Mmg puas hati kalau beli sini,_
i guess they know the crease on the screen will be more prominent if the phone spent too long inside the box in a folded state,_
MEMANG LAJU GILER,_
"After Wan was imprisoned in 1999, it was believed Chau visited him often, deepening their personal relationship",_
Dpt free gift spt yg dijanjikan,_
"Siapa tu , batuk kuat, hei",_
Baju ngam ngam je dgn anak,_
dibungkus elok sempurna,_
"Tapi xpa, thank youu",_
Very useful and very recommended to all,_
Go and watchh !,_
Overall the product quality is ok,_
slow delivery but well packed and products are in order,_
"I dont lie, i will buy it!",_
Tapi agak sempit walaupun sy ambil 1 size larger than my usual size,_
Good tq good Tq Good tq good tqqq Good tq good tq Good tq good Tq Good tq good tqqq Good tq good tq Good tq good Tq Good tq good tqqq Good tq good tq Good tq good Tq Good tq good tqqq Good tq good tq Good tq good Tq Good tq good tqqq Good tq good tq Good tq good Tq Good tq good tqqq Good tq good tq,_
Buy this during Live promo,_
"PASTUUU KAIN DIA SUMPAH BEST CK TAK NIPIS CK KAIN MAHAL PUN AD AND SOOOO SHANTIK DIA PUNYA CANTIK BILA PAKAI NAK KURUS LAHHHH TIBAHHH TAPI SERIOUS ADIK I SUKA GILE,",_
Puas hatiiiiiiiiiiii sbb cukup cukup 10 takde lebih takde kurang btw dia tebal bukan nipis yee anak anak,_
Cantik masih under budgetðŸ¥°,_
Prepare awal senang takde kelam kabut nnti,_
Bbbbbbbbbbbbbbeeeeeeeeeeesssssssssssssttttttttttttt,_
Smart betul kasut ni,_
bcs its not working very well huhu,_
Mula mula taktahu nak pilih hitam ke putih,_
kain pun lembut dan cantik,_
"In line with that approach, the People's Bank of China refrained from injecting additional cash into the financial system in its monthly liquidity operation yesterday, rolling over all the loans maturing instead",_
belt tk okay,_
love d smell,_
The price also so reasonable and my daughter always use this product and can be last long,_
Thanks Pos Laju Malaysia,_
My repeat n repeated orders,_
NgamÂ² suii,_
pretty and spacious!,_
"Bungkusan kemas,baik",_
"Yahaya Aminu Sharif was sentenced last month by a sharia court in Kano, the commercial hub of Nigeria's mostly Muslim north, after he performed the song and shared it on WhatsApp",_
Quality:very low quality,_
This gate is really easy to install,_
does anyone know if the 13 pro max is more convenient than the 13 regular?,_
"The group's test engineering solutions business, JF TestSense, has been making very encouraging progress",_
Quality:kualitibternaik mee eloknkenyal,_
Nice pouch with many compartment,_
So far baju sampai dgn selamat,_
Parcel xde silap,_
Kena guna ni,_
klu byk ckit mybe full coverage,_
Gagal btl lah,_
One weird thing is that I can't press my volume / on off button with the astronaut case,_
Functionality:Terbaik gitu,_
i waiting for the refund,_
Material okay quality okay,_
I just bought like 8GB worth of hotspot quota and now it's gone just like that,_
"maaf gambar tidak berkenaan, penghantaran yang laju dan barang sampai dalam keadaan yg baik",_
123456789 10111213141516171819202122232425262728293031323334353637383930,_
kalau dpt lg murah itu bonus la,_
Elok cuba masa cuti,_
"I extend my sincere apology to my fans and subscribers as well, Song said",_
"Good value, high quality product, but screen too small,",_
"The bag is thin, cute, according to the picture, is it suitable for women or men, next time i will buy it here again, thank you!",_
But price wise sini cheaper,_
I luv this app,_
Lama betul seller nak prepare barang,_
tp kain dia soft gila,_
Deme suka sangat,_
Fast delivery juga Kiranya ni,_
fast delivery as well all of the item arrived safely,_
Bazir je dengan kos pos lagi,_
Maggie Kong,_
SAPE YANG TERBACAAA SILAA BELI DEKT SINII TK RUGI LANGSUNG !,_
thumbs up seller and courier jnt,_
They also have to retain at least 5 per cent of their crops for the cranes to feed on,_
"Jam comel, anak2 dan anak2 buah suka, nit baddddddddddddddd",_
"kualiti yg baik, sesuai dgn harga & servis yg pantas drp seller",_
"Worthy, apps running smoothly",_
goodgoodgoodgoodgoodgoodgoodgoodgoodgoodgoodgoodgoodgoodgoodgoodgoodgoodgoodgoodgoodgoodgoodgoodgoodgoodgoodgoodgoodgoodgoodgoodgoodgoodgoodgoodgoodgoodgoodgoodgoodgoodgoodgoodgoodgoodgoodgoodgoodgoodgood,_
Mantappppppp murahhhh amannn terpercayaaaaaa yaaa gess yaa beli laahh di sinii,_
wrong items been post to me,_
pehataran yg sgt cepat,_
So Hye guyss,_
Kalimba telah sampai dengan selamat,_
Terima kasih j&t cepat dan tangkas TAPI BARANG CALAR BALA,_
maaf gambar ng video xdk kena mngena,_
Wow the price is nice and I absolutely love this brand of luncheon meat!,_
Beli byk,_
Buy during festival is cheap,_
Yang krim tu bau cam buah oren gitu,_
i got these today and i gotta say they're pretty underwhelming :/,_
Suitable for old cars,_
jika ada sape2 tahu sila pm sy yea,_
Brg dah pun sampai,_
2)the file is not working,_
Dh LM sampai,_
barang semua secure,_
Kualiti dia terbaik weh,_
"the materials is so smooth and durable, lovely magnificent",_
"Skin Suitability:all skin type, based on the label",_
kilang yg salah,_
"Anyways, barang memang terbaik",_
I do this thing everyday ðŸ¥’ðŸ¥¬,_
mula2 agk risau tentg penghntran tp alhamdullilah smpai dgn selamt walaupon sesetgh tmpt mengalami banjir thank you seller,_
Get the Sierra blue cause it's a better phone lol,_
I hope many more will buy from your store and keep up with the good work!,_
Delivery all very good,_
xmkn pedas,_
Beli product Masa flash sale,_
daun senna pun segar2,_
nice quality received in good condition,_
agak besar utk beg laptop hp,_
Penghantaran cepat dan packaging pon okey x de yg terjejas pada barang,_
order smlm hri nie dpt,_
Sampai cepat daripada dijangka,_
pelekat ni nak gune kt kereta nak letak hp,_
Cantik Dan hrg murah,_
next tme bli kaat shoppe jer,_
"Items received well,in a good condition and complete",_
Product received in good packing and good condition good value for money,_
ok la Ng have Beli tuk ank OkOkOk,_
"My purchase was processed fast & it was shipped out fast too, but arrival to east malaysia was delayed due to raya",_
"Barang sampai, naxt time kena balut dengan plastik bubel utk elakkan kerosakan",_
received instant oats in good condition,_
"Baju cantik, kain berkualiti, harga murah, penghataran sangat laju",_
"servis tiptop,smlm order hari ni sampai depan pintu",_
mmg trbaikkkkkk,_
46 trillion,_
Haha I'm so sleepy ðŸ¥± I'm not working anymore babe babe I'll text back,_
"While 13 M-REITs were listed in the six years between 2005 and 2011, the past 10 years saw the debut of only six M-REITs, a clear and worrying slowdown in growth",_
"Muhammad Sha'ani, who is the organisation's Tobacco Control coordinator, explains that under the National Strategic Plan on Tobacco Control 2021-2030, Malaysia already intends to introduce a smoke-free generation, where people born from 2009 onwards would not smoke",_
Sorry ni kek customer saya,_
Nescafe muroh mase ni,_
harap oklaaa seluar tersebut,_
Up one size must be better becoz it smaller than normal size,_
Kali ke berapa repeat beli kat sini pn xingt dh,_
Mantobbbbbbb,_
Adain give away gk papa bang,_
Earphone dua2 mantap ðŸ¤©,_
Tinggi-150cm comel2 je,_
"Barang tip top, dia punya bubble wrap pun okay2",_
Murah sangat berbanding beli di kedai,_
"Christina Van Norman and David Coe had resumed small gatherings finally of their fully-vaccinated friends at their home in Montgomery County, Maryland, United States, where coronavirus transmissions were relatively low",_
ship out lambat sngt tp tkpela janji sampai dgan betul,_
dpt tolak coin plak,_
When i unsubscribed the plan the the whole thing just disappear including the data plan that has been purchased when my intention was to unsubscribe it for the next month renewal,_
"Kalau anak mata dah memang warna coklat, beli warna lain",_
Terima brg dgn selamat dan berfungsi dgn baik,_
I think i will get the hang of it,_
"Penghantaran cepat, saiz ok, bungkusan pun",_
Beli 5 tqpi cuma dapat 4,_
"penghantaran dan pembungkusan okey, belum rasa je",_
Kulit jadi lembut sgt,_
Great one already bought 4 of them,_
Klu Ori kompom mahal,_
delivery was super fast too!,_
Wrapped properly and fa,_
Insyallah nnti repeat lg,_
Free gift semua ok,_
tetiba terjatuh cinta,_
ape2 pown tq so much,_
Terime kasih gift lipas,_
"And saiz dia pun accurate, tggi I 150 berat 42 ambik size L, mmg ngam2 mcm I yg nak!",_
Enough for few coins and few cash,_
He always assists coworkers that are having di,_
"Russia has massed more than 100,000 troops near the Ukrainian borders, sparkling fears of a planned assault",_
Must truely food deliver a oder to customer,_
But all good je,_
Beli vacuum utk umah mil,_
"rasa agak kecewa, sbb sangkakan beg ni besar ckit dr yg sy dh ada, tp kecik juga, nk cari besar ckit, apa pun redho je lh, risiko beli online mcm ni lh",_
Lam Xiao Sian,_
Can mix with Nestum to eat every morning!,_
Barang dh smp terbaikkkk cantik terbaikkkk,_
Nor did Ferguson berate Ponton for the mishap,_
Save money and energy time is not spent on commuting and eating out during lunch break,_
Aku nok coin je rate bebanyak nii lol,_
Baju memang ngam dengan saya,_
Kxhjdhuxyihxixhihdkxjdyu5wuw5u,_
Buy with coins cashback worth for money thanks seller and expired date 2024,_
item deliveryfast,_
nasib baik ada sebuah je sang kancil tu,_
Mcm mana nak tukar plan digi NEXT pi plan digi 1 gb 12 am to 8 am,_
"should buy it ,",_
"With a simple wish, he is transported into Wonderland",_
Barang smpai agak lambat sebab dri china kan,_
I always buy my Richam from only this seller as I know they are very reliable,_
PSM 'lawan balik' isu penggantungan,_
